time,content
719,"内心毫无波澜，甚至想吃一颗琥珀核桃"
719,"求一天更新八集！！！只想看璎珞手撕大戏！"
719,"璎珞你拿的是本宫的手串吗"
719,"更新挺快。"
719,"哇哦这句“你想一想”有富察皇后的感觉唉令后大旗"
720,"贵人戒指大了要掉"
720,"要不是给导演钱，就陪本宫了"
720,"不是平起平坐啊你当时是大宫女啊亲"
720,"纯妃送的没错了"
720,"明玉越看越乖了"
720,"谁说本宫不得宠了"
721,"多更新几集"
721,"明玉，厉害了，是不是偷偷给导演送礼物了"
721,"困明，走秋，出来追剧了！"
721,"一入宫门深似海！"
721,"手串是容音给的"
721,"小说跟新好慢啊"
722,"大猪蹄子啥意思"
722,"朕是大猪蹄子"
722,"手上的珠子看着眼熟"
722,"本宫给你的手钏竟还留着"
722,"我媳妇就是聪明"
722,"竟然把本宫的手串都留着"
723,"明玉好可爱，希望安排好的归宿"
723,"曾经也不能和你平起平坐好吧"
723,"哎呀安啦盒饭快好了"
723,"见手串如见富察皇后"
723,"璎珞，你带着本宫的珠子，本宫很是欣慰"
723,"本宫给你的手钏竟还留着"
724,"有道理，送个人来是让你来受气的"
724,"本宫现在可是集齐了皇后和太后手串的人"
724,"好红红火火恍恍惚惚哈哈哈哈"
724,"明玉，我来带你上王者"
724,"以后手串涨价了就找你算账"
724,"本宫给你的珠子，尽然还在"
725,"明玉气鼓鼓的样子好可爱"
725,"皇后，太后都给了手珠阿"
725,"璎珞手上拿着皇后的珠子，时刻想着她是替皇后来报仇的"
725,"这不是在说明玉嘛"
725,"要是明玉能一直陪伴在璎珞身边就好了"
725,"朕的香妃什么时候出来"
726,"看了四十多集的丫鬟咋看当主子还不习惯来"
726,"璎珞说话的语气越来愈像本宫了"
726,"珠子是前皇后的吗？好激动"
726,"狮子还会怕蚂蚁吗"
726,"为何在瑜贵人做贵人的时候看不出有那么的高大上"
726,"皇后，太后都给了手珠阿"
727,"大嘴猴谁这么有才不过真可爱"
727,"凡事要冷静"
727,"好押韵，可以去中国有嘻哈了"
727,"跟我魏璎珞玩心机?呵呵……从前那是跟你们随便玩玩的"
727,"皇后的手串真的好用心"
727,"看到标题我就放心了"
728,"璎珞好力害"
728,"手串是皇后的"
728,"赵欣欣大猪蹄子"
728,"你们是不是快把我给忘了"
728,"我看到好大一只苍蝇哈哈哈"
728,"凡事要冷静"
729,"琥珀的盒饭已经热好了"
729,"朕是最可爱的大猪蹄子"
729,"多给明玉小可爱几件衣服吧"
729,"手里还拿着皇后娘娘给她的珠子诶"
729,"明玉就是护住的性格敢爱敢恨"
729,"手里拿着本宫的东西，本宫保佑你"
730,"皇上就是大猪蹄子"
730,"本宫的令后大旗在哪里"
730,"不是太后也给她手串吗所以这个到底是太后的还是皇后的"
730,"娘娘，璎珞从未忘记过您，您还好吗？"
730,"确认过眼神是充了钱的人"
730,"明玉袖子上有只苍蝇"
731,"有个明白的主子是多么珍贵"
731,"琥珀我劝你善良"
731,"高端玩家不是一般人对付的了的"
731,"我这个大猪蹄子"
731,"皇后给了她一个手钏，太后也给了一串呢，好像是佛珠吧"
731,"大概是被我吞了"
732,"如玉可爱啊一不高兴嘴巴就撅起了"
732,"你们别再说了反正45集也没有臣妾"
732,"明玉说话的语气很可爱，不像圆明园那样了，全都是害怕"
732,"本宫怎么看到有44集"
732,"浦心语你就是个大猪蹄子"
732,"因为是配音所以说话要夸张"
733,"怎么感觉魏婴洛说过长鼻炎犯了一样"
733,"我劝自己善良"
733,"明玉真的可爱"
733,"手上拿着容音的珠子"
733,"这部剧怎么没有东阿阿胶和麝香啊"
733,"璎珞渐渐有了本宫的姿态"
734,"璎珞说话太夸张，嘴张的太大，"
734,"曾银大傻子"
734,"魏姐最聪明了"
734,"魏姐你啥时候卑躬屈膝了，讲话要凭良心啊"
734,"Lily姐是个超级大美女"
734,"手上拿着容音的珠子"
735,"璎珞的演技真的很好"
735,"大猪蹄子本猪了"
735,"嘴幅度太大了"
735,"本宫的手链会一直在"
735,"唯一咯，嘴巴好不自然说不出的感觉"
735,"琥珀盒饭加鸡腿"
736,"琥珀你盒饭热好了，快趁热吃了"
736,"明玉最可爱了"
736,"你们都是三好学生，什么苍蝇头皮屑都能看到，实在是高"
736,"琥珀不得无礼"
736,"我说明玉为什么第一集戏份就那么多"
736,"今天也要做乖宝宝"
737,"这是灵火珠的加长版吗？"
737,"本宫要善良"
737,"明玉活了几集"
737,"璎珞还拿着本宫给的手珠"
737,"没44刷新一下就好了"
737,"朕会替你踢她一脚，放心放心"
738,"为什么魏璎珞一说话嘴要张那么大那么不自然呢"
738,"就不该微博上问你们大猪蹄子是什么意思😭😭😭"
738,"他手上的手链是皇后的发现没"
738,"当了贵人好开心~"
738,"太爱璎珞了，演的太好了。🌹"
738,"因为要请她吃盒饭啊"
739,"令后大旗扛起来，璎珞一直戴着容音的手钏"
739,"那是本宫给璎珞的定情信物"
739,"璎珞：冷静理智如我！冷静理智如我！"
739,"本宫领完盒饭，前来追剧"
739,"明玉什么时候可以开大？"
739,"我聪明吧！"
740,"估计是太早了人都没来吧"
740,"令后大旗扛起来"
740,"璎珞可是要做大事的人"
740,"明玉手上有个大苍蝇"
740,"皇后和太后的链子都集齐了"
740,"那是本宫给璎珞的定情信物"
741,"这只苍蝇演的好"
741,"盒饭快热好了，等会儿来领"
741,"明玉真的是忠仆对哪个主子都是"
741,"盒饭会迟到，但不会不来"
741,"那是老佛爷给的手串，上集没看么"
741,"你们怕是忘了本宁馨儿了吧"
742,"延禧宫肯定以后会是最热闹的宫廷"
742,"戒指都不合适"
742,"明玉真的好忠诚"
742,"璎珞你手上的珠子可是本宫的？"
742,"这是之前怡姘住的地方吧"
742,"不愧是我媳妇👄"
743,"璎珞就是看得清"
743,"那是本公主乐的定情信物。"
743,"璎珞手上拿的珠子好像是皇后的呢"
743,"这个嘴巴浮动太大了"
743,"明玉真的好忠诚"
743,"璎珞你手上的珠子可是本宫的？"
744,"苍蝇演技好"
744,"我会快点把盒饭发到她手里"
744,"手上拿的是皇后娘娘给她的珠子哎"
744,"本宫最珍爱的珠串你随身拿着真好！"
744,"我居然为了苍蝇倒回去再看了一遍"
744,"一众小妖精们，看我怎么收了你们"
745,"一直拿着容音的手串好评"
745,"透明的手串是本宫给璎珞的"
745,"琥珀来陪陪本宫吧"
745,"贵妃最可爱了"
745,"因为她迟早领盒饭"
745,"看到本宫的珠子了"
746,"你们看明玉手上落了个苍蝇都不动好演员啊"
746,"我劝你聪明"
746,"手上的珠子是她出宫回家的时候富察皇后给的"
746,"几年前，我们同是宫女，现在我离开了，可你依然是宫女"
746,"魏贵人这戒指太大了！"
746,"还是我媳妇厉害👍"
747,"魏璎珞:琥珀，来来，盒饭给你备好了，味道不错哦"
747,"就不能给魏贵人配点合适的戒指吗？"
747,"贵人的戒指是不是大了点"
747,"慢慢来不着急"
747,"翁俊峰你这个大猪蹄子"
747,"戒指没带好"
748,"一直拿着皇后的珠子这个细节好"
748,"赢咯没有忘了本宫，你看这手串，正是本宫留予她的"
748,"皇后的手珠演得好"
748,"若要一个人灭亡必先让其膨胀"
748,"戒指太大了"
748,"璎珞手上的珠子，是皇后的那个！"
749,"好激动，坐等"
749,"夸我聪明快夸"
749,"明玉手上的那只苍蝇是人真的吗"
749,"明玉你手上的苍蝇是来抢本宫戏的吗"
749,"一直拿着皇后的珠子这个细节好"
749,"璎珞手上的珠子，是皇后的那个！"
750,"注定在一起的人绕多大一圈都会回到彼此身边"
750,"虎珀我劝你善良"
750,"樱珞眉毛没画好"
750,"我情商太高了"
750,"这戒指看着手疼"
750,"容音手串一直被我带到最后一集"
751,"皇后的珠子，心里一暖，眼角湿润了"
751,"我就是这么聪明"
751,"手串！注意手串是富察皇后娘娘送的"
751,"那就发陪她偷东西出宫吧。。。"
751,"王龙炎是大猪蹄子！！"
751,"大家想我了吗？"
752,"解释了愉妃是什么样的人"
752,"陈威杰你个大猪蹄子"
752,"璎珞真的是心机非常深沉啊"
752,"珠子演的好"
752,"璎珞手里还拿着皇后娘娘给的珠子"
752,"皇后的珠子，心里一暖，眼角湿润了"
753,"先皇后和太后都把手珠送她了"
753,"皇上真是个大猪蹄子"
753,"欲其灭亡，必先其疯狂"
753,"明玉，现在开始，我来帮你升级"
753,"纯妃可还记得本宫"
753,"璎珞手里还拿着皇后娘娘给的珠子"
754,"琥珀你是嫌命长了啊，尽然惹我"
754,"当了贵人好开心~"
754,"卫龙大旗立起来"
754,"当丫鬟久了，当主子看着不习惯"
754,"明玉的头饰很可爱"
754,"啊呀呀看戏真好"
755,"令后大旗永不倒"
755,"令后大旗摇起来"
755,"嘴动作真的太大了，自己不知道的嘛"
755,"哼大猪蹄子"
755,"都在安静的看剧"
755,"放心，坑已经挖好了"
756,"总觉着明玉皮肤特别好"
756,"你还留着本宫的手珠啊"
756,"我不能惩罚她反而要给她准备盒饭天理何在"
756,"想皇后娘娘"
756,"这个戒指是给手指缝戴的吧"
756,"明玉你的手上怎么有个苍蝇呀！"
757,"琥珀的盒饭热好啦"
757,"明玉的耳朵长太好了！"
757,"这部剧里面的眉毛画的都好棒"
757,"哈哈哈你打不过我吧没有办法我就是这么强大"
757,"令后大旗永不倒"
757,"背后策划你是在说于正吗"
758,"魏璎珞：我好机智哦，机智到我自己都佩服我自己"
758,"皇后走了几天了，想恋皇后了"
758,"赵忠纯大猪蹄子"
758,"黄黄再看嘛"
758,"璎珞的眉能改一下吗？化妆师"
758,"这部剧里面的眉毛画的都好棒"
759,"明玉，怎么这么久了你还是没变，喜欢你的直爽"
759,"没关系她的盒饭已经热好了"
759,"是手指太细了么戒指都转了"
759,"冠军看冠军，越看越开心"
759,"情商真的太高了"
759,"容音的手串一定要随时带着"
760,"张子杨是个大猪蹄了"
760,"突然想皇后娘娘和高可爱了……"
760,"明玉皮肤真好"
760,"能不能把戒指给本宫带好"
760,"明玉变可爱了"
760,"情商真的太高了"
761,"璎珞不管到哪儿都拿着本宫给予她的手链，本宫甚是欣慰"
761,"琥珀我劝你善良"
761,"大姐你戒指戴反了"
761,"富察小天使不在第二天想她想她想她"
761,"明玉小可爱以后黑化了就精彩了"
761,"明玉皮肤真好"
762,"高贵妃：琥珀你盒饭我给你热好了记得快点来吃呀"
762,"大猪蹄子什么时候来啊"
762,"明玉懂事的样子好可爱啊"
762,"明玉你手上的苍蝇演的不错"
762,"明玉是个好演员，手上有虫子"
762,"出宫看望爹的时候皇后给的"
763,"纯贵妃就是大明湖畔的夏雨荷"
763,"明玉手上有个大苍蝇"
763,"令后大旗摇起来"
763,"明玉，你手机有只大苍蝇"
763,"樱落嘴无敌了"
763,"明玉懂事的样子好可爱啊"
764,"手链好眼熟"
764,"发现明玉的台词就是为了让璎珞解释她的做法"
764,"愉妃忘了人家当初是怎么舍命相救的了吗"
764,"倒退重新看了隔应还以为是本宫听错了"
764,"手上的蚊子是认真的吗"
764,"明玉手上有个大苍蝇"
765,"璎珞好辛苦，那么多妖怪要打😂"
765,"璎珞，本宫的手珠你可要仔细拿好了"
765,"谁告诉朕大猪蹄子什么意思"
765,"璎珞拿着本宫的手串，本宫很是开心"
765,"赵彦龙是大猪蹄子~"
765,"王周昕你个大猪蹄子"
766,"明月这是大配角啊活的比主角都长"
766,"明玉你手上的苍蝇是认真的吗？"
766,"明玉才是活的最久的人"
766,"有只苍蝇飞到了明玉小可爱手上"
766,"明玉演的太好了手上有苍蝇要是我早就一巴掌拍了"
766,"不知今天有多少人想给我送盒饭啊"
767,"看耳饰位置就知道只有最下边的是真的剩下的是夹的"
767,"明玉手上的蚊子演的好啊"
767,"璎珞说话嘴的动作好大"
767,"我劝你们都给我善良点"
767,"哈哈，苍蝇都能看到，看电视的好眼力"
767,"明玉你手上的苍蝇是认真的吗？"
768,"好单纯啊明玉"
768,"本宫的明玉小宝贝真的好可爱鸭！！！"
768,"嘴幅度那么大是认真的吗"
768,"本宫的嘴好灵活"
768,"令后大旗摇起来"
768,"璎珞说话嘴的动作好大"
769,"人家叫机灵不是心机深"
769,"苍蝇演的好"
769,"好深的套路"
769,"就没有个合适的戒指吗"
769,"眼力太好了居然看到苍蝇"
769,"看本宫怎么勾引皇上"
770,"令后大旗不倒，手串就说明璎珞在时刻提醒自己复仇"
770,"爱妃好聪明"
770,"遇到心爱的人两情相悦"
770,"明玉手上的苍蝇是认真的吗"
770,"再说大猪蹄子我一巴掌呼死你"
770,"眼力太好了居然看到苍蝇"
771,"明玉手中的苍蝇好可爱蛤蛤蛤"
771,"明玉手上的苍蝇是认真的吗"
771,"魏嘴的幅度好大"
771,"明玉你手上又一只大苍蝇"
771,"看了四十集，还是没看顺眼魏璎珞那张夸张的嘴脸"
771,"觉得我特别帅"
772,"延禧宫最冷僻你错了会热闹起来的等着看"
772,"大猪蹄子能换个地方住吗？"
772,"不受外物干扰才是道行高的表现"
772,"曾瑜大猪蹄子"
772,"璎珞的戒指太大了发现没有"
772,"明玉，看你手上有虫子，还这么淡定"
773,"浓郁手上有苍蝇好大一只"
773,"大猪蹄子快来发糖"
773,"你们看的好仔细呀苍蝇都被你们看到了😂"
773,"我咋还不出来作妖，快作几次要领盒饭了"
773,"明玉手有只苍蝇是认真的吗？"
773,"你忘了这剧的名称是怎么来的么"
774,"别急，皇上会自己送上门来的"
774,"放心吧，大猪蹄子会来的！"
774,"明玉手上的苍蝇是认真的吗"
774,"为啥叫我大猪蹄子"
774,"这不是灵火珠吗"
774,"浓郁手上有苍蝇好大一只"
775,"怎么办？当然是让大猪蹄子多走点路呗"
775,"没事儿，朕不怕多走几步路，！"
775,"别纠结眉毛了，多了解历史，这是当时盛行的眉毛和妆容"
775,"曾银，你个大猪蹄子"
775,"怪不得是延禧攻略呀，四十多集才理解剧名"
775,"别急，皇上会自己送上门来的"
776,"谁是医生，给我们明玉做手术取出针来吧"
776,"高高走得第二天，想她想她想她"
776,"大猪蹄子会自己来的😂"
776,"这桌椅太敷衍本宫了吧"
776,"主角的脸太容易让人出戏了"
776,"媳妇，我你不爱我了"
777,"字幕的错别字真的不是一般的多，都是找文盲校对的吗"
777,"放心吧以后这事最豪华的宫殿"
777,"璎珞你长的怎么那么像陈晓"
777,"盒饭给我热好了吗？"
777,"苍蝇你可长点心"
777,"明玉手上有苍蝇飞来飞去的，本宫好怕呀"
778,"符合规定发给发给他一人多高"
778,"愉妃是好的"
778,"那个说苍蝇演的好的你是魔鬼吗"
778,"隔应这一词用的妙"
778,"放心吧以后这事最豪华的宫殿"
778,"璎珞你长的怎么那么像陈晓"
779,"得罪璎珞的小人物一般活不过1集"
779,"我家明玉好可爱"
779,"璎珞：酒好不怕巷子深"
779,"担心吧，朕这个大猪蹄子会来的"
779,"手里拿着皇后送的手链，高举令后大旗！！！！！！！"
779,"被你们带的本宫找了半天苍蝇"
780,"手上的仓蝇演的很好，戏份很足"
780,"酒香不怕巷子深"
780,"都多少集了还有人问大猪蹄子"
780,"苍蝇演的好"
780,"隔应这个词用的好"
780,"璎珞：酒好不怕巷子深"
781,"吉祥现在活着就好了，两个好帮手"
781,"大猪蹄子咋来的"
781,"眼睛👀都看的好细致"
781,"明玉手上的蚊子是认真的吗"
781,"酒香不怕巷子深"
781,"苍蝇演的好"
782,"演员真的好敬业啊，刚才明玉手上有个苍蝇爬来爬去的"
782,"琥珀的盒饭热好了"
782,"明玉好可爱，越来越喜欢她了"
782,"演了40多集刚演到正题上"
782,"魏回家看她爹的时候皇后把手钏给她了"
782,"看到苍蝇的人真六。眼神不错"
783,"卫龙女孩高举大旗"
783,"不急，只要进了宫我就能开挂"
783,"没有为什么你就是大猪蹄子"
783,"大猪蹄子你怎么还不来"
783,"不不不，延禧宫以后是最热闹的宫殿"
783,"郭力榕你个大猪蹄子"
784,"魏璎珞琥珀我劝你善良不然下个领盒饭的就是你"
784,"本宫是最聪明主角光环最强的"
784,"琥珀的盒饭热好了"
784,"大猪蹄子会来的"
784,"大猪蹄子会来的,放心"
784,"明玉真的是可爱呢"
785,"字幕的错别字真的不是一般的多，都是找文盲校对的吗"
785,"不急，盒饭还没热好"
785,"大猪蹄子会自己送上门的别担心"
785,"本宫自带外挂，就是这么帅"
785,"明玉好阔爱"
785,"不急，待我使出绝招"
786,"明玉你手上的大苍蝇飞来飞去的"
786,"没是以后这延禧宫可是最热闹的宫殿连本宫儿子都要常来"
786,"各应这个词用得好"
786,"琥珀的盒饭快热好了"
786,"琥珀我劝你善良"
786,"胳应一词用的好"
787,"好热啊夏天拍辛苦了"
787,"大猪蹄子等你来呦"
787,"可憐的明玉還不知道身體還有三根銀針"
787,"别急，我来给皇上拖托个梦"
787,"璎珞姐多的是套路"
787,"琥珀的盒饭快热好了"
788,"珍珠好可爱啊"
788,"本宫会让这里热闹起来的"
788,"令后大旗不倒"
788,"我不怕大猪蹄子"
788,"放心黄桑巴不得天天来找她"
788,"苍蝇演技不错"
789,"以后有大猪蹄子就暖和了"
789,"桃子你惊不惊喜，意不意外，刺不刺激"
789,"愉妃的心情就是璎珞现在的心情"
789,"明月也要挂了身上还有银针"
789,"你们的眼睛看的真清楚，什么都能被你们发现"
789,"你们对朕这些东北人有什么偏见？"
790,"东北话挺多都是来自于满语的"
790,"本宫成熟了"
790,"这个朝代的宫女说话这么随便也是很厉害啊"
790,"大猪蹄子怎么还不来看我这个小可爱(๑•.•๑)"
790,"齐林林你个大猪蹄子"
790,"等着本姐姐好好和你们玩"
791,"璎珞：你都被欺负成那样了，还不长心强大起来……"
791,"我劝你善良"
791,"张建是个混蛋，大傻子"
791,"你们都快下来陪本宫吧"
791,"她有了皇后身上的沉稳。"
791,"本宫成熟了"
792,"这就是成长啊明玉"
792,"诶嘿嘿，这镯子不错，珠子也不错，回来太好了"
792,"有勇有谋活的长"
792,"为啥叫我大猪蹄子"
792,"大家都是好孩子"
792,"她有了皇后身上的沉稳。"
793,"这和角色很好，一直在打怪兽，一直升级，装备强化快"
793,"以前我只有被动技能，现在我学了主动技能了"
793,"她在酝酿大招，别急别急"
793,"富查白月光走的第三天想她"
793,"明玉真善良"
793,"这就是成长啊明玉"
794,"有安陵容呆过的延禧宫怎么可能会热闹"
794,"本宫段位升了"
794,"明玉手上有个大苍蝇"
794,"有个苍蝇，明玉，你也能忍"
794,"你是大傻子"
794,"想念皇后娘娘啊"
795,"看得长远的人不会计较这些"
795,"你们不要急，我下集就出来作妖了"
795,"朕不怕多走几步路"
795,"不用来找朕，朕主动去找你就行了，不用让你劳累璎珞"
795,"本宫段位升了"
795,"明玉手上有个大苍蝇"
796,"看了这本就觉得还好五阿哥死的早"
796,"琥珀你想吃什么口味的盒饭。先帮你订好"
796,"璎珞：不急，本宫下一集就是令妃了"
796,"一定要保护好明玉呀"
796,"要想办大事就得沉住气"
796,"明玉宝宝越来越可爱了"
797,"手上大苍蝇是认真的吗"
797,"为什么你们都叫我大猪蹄子？此称呼因何而起"
797,"跟皇上好甜啊"
797,"魏贵人你长的怎么那么像陈晓"
797,"那个时候越尊贵越流行这样的妆容"
797,"要想办大事就得沉住气"
798,"璎珞成长了，开始有城府，耐得住性子了"
798,"你是朕的女人不管你住哪里朕都能把你找到"
798,"吓得我赶紧看了看集数表还好还好～"
798,"一群疯人。"
798,"瑜贵人是好的吧，故意变坏的，"
798,"这个头型，本宫说什么好呢"
799,"明玉确实好的时候太好刚开始好不懂事"
799,"本宫的盒饭都吃完了纯妃怎么还不来？"
799,"明玉太可爱了，看到这里突然最喜欢明玉"
799,"我现在是钮钴禄氏璎珞"
799,"皇后走后，我变成了她，但温柔远不及她"
799,"还是嘴太出戏了，讲完话都合不上。。"
800,"明玉嘟嘴的时候好可爱"
800,"因为从前有皇后娘娘护着"
800,"其实明玉真的很好"
800,"跳出来的不是你吗"
800,"从此以后她们只有彼此能够相互信任了"
800,"明玉太可爱了，看到这里突然最喜欢明玉"
801,"能娶到明玉的肯定是上辈子拯救了银河系"
801,"我们满族人本来就是东北人啊你现在看的是东北一家人"
801,"苍蝇给了多少钱？？演的那么好？？"
801,"苍蝇演得好"
801,"其实明玉真的很好"
801,"从此以后她们只有彼此能够相互信任了"
802,"她俩这样子喊名字感觉好幸福"
802,"明玉能活到现在真不容易"
802,"丧驹是个大猪蹄子"
802,"就剩你俩相依为命了。好好保护好对方啊"
802,"皇后娘娘教的好"
802,"来人，把纯妃的盒饭端上来"
803,"你不让别人叫名字，自己倒是叫的很开心哈哈哈"
803,"好戏才开始呢，别急"
803,"卫龙大旗举起来"
803,"本宫已从王者晋升为荣耀王者，能一样吗"
803,"她俩这样子喊名字感觉好幸福"
803,"皇后娘娘教的好"
804,"能有个明玉这样的朋友彼此照顾挺好"
804,"本宫自有妙计"
804,"呆在外地路他不熟悉有事随便找个地方躲都来得及"
804,"我啥时候能出场啊？"
804,"苍蝇演的好"
804,"你不让别人叫名字，自己倒是叫的很开心哈哈哈"
805,"齐琳琳你个大猪蹄子"
805,"不急，本宫的盒饭还没做好，还要点时间。"
805,"明玉只在两人单独相处的时候叫璎珞"
805,"我这是成熟了"
805,"原来延禧宫略是这么来的，延禧宫哈哈"
805,"等大招CD好了，你们都得死。"
806,"明玉你可长点心吧"
806,"璎珞你长的怎么那么像陈晓"
806,"是够偏僻的，明玉手上都有苍蝇在爬"
806,"明玉呀！你可长点心吧～"
806,"这两只真好"
806,"明玉只在两人单独相处的时候叫璎珞"
807,"她活成了成容音的模样心头一震"
807,"琥珀不急盒饭在给你热着呢"
807,"眉毛没画好"
807,"璎珞的戒指是认真的吗"
807,"璎珞的戒指大了"
807,"听说有人想我善良"
808,"手上的戒指好大啊，戴着不觉得不方便嘛"
808,"明玉单纯可爱，没心机😊"
808,"这个打三个耳洞也是厉害"
808,"璎珞和皇后娘娘一样，不能再做以前的自己了。"
808,"明玉啊，被针扎成着了。长点心吧"
808,"本宫就是金星附体了"
809,"这戒指好大，走移了"
809,"她远比我温柔"
809,"下次去故宫玩，要去看看延禧宫了"
809,"皇上想本宫了没"
809,"那戒指戴的，大的"
809,"我来冒个泡"
810,"璎珞你能好好戴你那两个戒指不，不舒服就摘下来吧。。"
810,"本宫的戒指太大了，换个合适的号来"
810,"实话吴谨言这演技绝了，无敌"
810,"沈冰洁你个大猪蹄子"
810,"璎珞手上的戒指是认真的吗"
810,"虽然很难见到皇上，可后面皇上天天来延禧宫"
811,"想起皇后我心里一酸"
811,"明玉，从前车马很慢，书信很远，一生只够爱一个人。"
811,"苍蝇，我劝你善良"
811,"戒指太大啦"
811,"看到皇后的珠子好怀恋啊"
811,"哈哈哈！带的戒指太大了😂"
812,"无名指的戒指大了吧，等你得宠大猪蹄子会给你换合适的"
812,"这串手珠是本宫留给你的唯一的想念了"
812,"哈哈哈无名指的戒指是太大了吗"
812,"还是本宫最善良"
812,"璎珞那么要强的一个人，原来还是想荣华富贵啊"
812,"想皇后嘤嘤嘤"
813,"头上有个大头皮削"
813,"为啥叫我大猪蹄子"
813,"而且当众送的让她善良理佛呵呵"
813,"我们关系好，咋叫都没问题！"
813,"就我一个在帮琥珀热盒饭吗"
813,"无名指的戒指大了吧，等你得宠大猪蹄子会给你换合适的"
814,"主子戴戒指有什么不方便的又不是干活啊！"
814,"一直带着皇后娘娘出宫前送她的的手珠"
814,"感觉像是天真离开了小哥"
814,"一直拿着本宫送的手珠，不愧是本宫爱的人"
814,"璎珞现在有点像皇后娘娘了，教的好"
814,"能让看看无名指的戒指到底长什么样吗？"
815,"皇后娘娘想让你做自己啊！可是为重要的人报仇这也是你"
815,"我下了好大一盘棋"
815,"戒指带上像暴发户，太大了"
815,"琥珀暂时还领不了盒饭，发配到袁春望之前的地方了"
815,"手上的戒指太大了都代反了"
815,"容音走的第三集想她"
816,"璎珞手上是皇后娘娘给的手链！令后大旗扛起来"
816,"璎珞小心谨慎活成了皇后的样子"
816,"璎珞请给明玉买一件新衣服都褪色了"
816,"主角光环如此强大"
816,"别急令妃要开大了"
816,"本宫的戒指为什么是片猕猴桃"
817,"戒指大了带不稳"
817,"戒指大了大了"
817,"为啥我没有绿没有红。"
817,"我戒指上那个是猕猴桃吗"
817,"璎珞手上是皇后娘娘给的手链！令后大旗扛起来"
817,"璎珞请给明玉买一件新衣服都褪色了"
818,"还能看半个月太好了"
818,"手串演的真好"
818,"闫鹏军你个大猪蹄子"
818,"这戒指太大了吧"
818,"璎珞受伤的是皇后的手链"
818,"想富察皇后娘娘了"
819,"令妃娘娘，你是不是得罪化妆师了，你脸上的粉好厚啊"
819,"以后由我这个大猪蹄子护你表要怕。。。。"
819,"令后大旗扛起来"
819,"朕就是大猪蹄子"
819,"大猪蹄子忘了本宫了吗"
819,"明玉真的是个好孩子啊"
