time,content
765,"大家本无缘全靠钱聚来，各位晚上好"
765,"你个大猪蹄子！"
766,"永琪才是最聪明最心机的"
766,"大猪蹄子还记得本宫吗"
766,"聂远比霍演得好十倍，很自然"
766,"我还是很帅，很帅很帅，"
766,"看看人家对养子的态度再看皇后这就是区别"
766,"袁春望来陪陪本宫"
767,"还是本高可爱善良"
767,"最后再开一次大"
767,"侯兴你个大猪蹄子看到这儿了吗"
767,"朕才是老大"
767,"这个皇上演的太好了，也太明事理了"
767,"聂远比霍演得好十倍，很自然"
768,"画面对不上的退出去不要开杜比音效就好了"
768,"那我劝你善良"
768,"说自己不善良的人，是好人"
768,"臣妾不善良"
768,"风筝有风海豚有海"
768,"今天和璎珞一起直播了，你们想我了吗"
769,"，如果好皇子不被陷害掉，估计大清不会那么快亡了吧"
769,"哎呀哎呀脑瓜疼脑瓜疼"
769,"傅璎大旗举起来"
769,"本宫想吃盒饭。"
769,"这皇上确定是乾隆而不是康熙，怎么总感觉演的是康熙帝呢？"
769,"人善被人欺啊"
770,"许代化是大猪蹄子"
770,"想我高可爱了吗"
770,"申智宇大猪蹄子"
770,"都是大猪蹄子"
770,"谁画面台词对不上？我都齐着"
770,"哎呀哎呀脑瓜疼脑瓜疼"
771,"脑壳疼呀脑壳疼"
771,"周友缘你个大猪蹄子🐷"
771,"你还知道自己不善良，早就忘了容音了吧"
771,"本宫才是老大"
771,"我们傅璎不愿清醒"
771,"你们相信我还是个雏吗"
772,"傅璎不可能了好吗乖乖吃我们卫龙吧"
772,"你们的高可爱突然出现"
772,"我不信就我一个人认为袁春望是多余的"
772,"本宫的双下巴很抢眼"
772,"我魏姐自从当了贵妃手上的戒指也多了"
772,"封我儿子荣亲王"
773,"永琪腿受伤了，当时看给小燕子私奔跑挺快啊"
773,"本宫活着就要一直复仇复仇"
773,"涂泽宇你个大猪蹄子。"
773,"我太单纯了，连太监都比我有心机"
773,"凌同你个大猪蹄子🐷"
773,"呵大猪蹄子"
774,"为啥魏姐这么瘦还有双下巴看着不舒服"
774,"还是我聪明，让儿子抱紧令贵妃"
774,"没有小燕子，但是知画是真实存在的，为五阿哥的侧福晋"
774,"绿绿劝你善良"
774,"后天晚上就看不到大猪蹄子了"
774,"永琪腿受伤了，当时看给小燕子私奔跑挺快啊"
775,"永琪：我活着真不容易"
775,"本宫的杜比好着呢"
775,"杨响，你个大猪蹄子"
775,"看到最后觉得我和袁是天生一对，觉得谁都对不起自己"
775,"像僵尸一样长的指甲……"
775,"为啥魏姐这么瘦还有双下巴看着不舒服"
776,"申气气你个大猪蹄子"
776,"人家就是高可爱"
776,"璎珞这坨头发也太大了，造型师差评"
776,"高贵妃走的第好几天，想她想她想她"
776,"大猪蹄子是什么梗"
776,"快点让袁春旺领盒饭"
777,"脑阔疼脑阔疼一批奏折脑阔疼"
777,"皇上，您有了新的妃嫔就忘了臣妾，不过臣妾也不计较！"
777,"汪啸风你这个大猪蹄子快给我道歉"
777,"见不得有些人看剧刷一些别人的名字。"
777,"皇雅博你个大猪蹄子"
777,"脑瓜又疼了"
778,"我觉得袁春旺这个角色很出戏啊，要他干啥？多余。"
778,"你们为啥子都叫朕大猪蹄子"
778,"高贵妃最可爱，高贵妃最美丽"
778,"说没剧追的，随本宫去刷刷嬛嬛传吧"
778,"那么瘦怎么还有双下巴"
778,"朕的脑壳从第一集疼到现在"
779,"播放正常。不正常的重进一遍试试"
779,"，大猪蹄子，你还记得臣妾吗？你什么时候下来陪我"
779,"为什么带大尖指甲"
779,"聂远最帅乾隆，不接受反驳"
779,"王诗瑾你这个大猪蹄子"
779,"璎珞我劝你善良"
780,"蛙哥好善良啊，果然善良的人活不久"
780,"还有人记得本宫高可爱吗"
780,"大猪蹄子很适合演皇上"
780,"说话是门艺术，在这里体现的完美！"
780,"小培辰，你的大猪蹄子，快来啃"
780,"杜比我劝你善良"
781,"楼哥哥你个大猪蹄子"
781,"大猪蹄子真可爱"
781,"周占晓大猪蹄子"
781,"本宫的头发比头大"
781,"现在知道为什么皇子死亡率那么的高了，多半是被人害死"
781,"后面的本宫都是划着看的"
782,"这个耳环好厉害，一直戴完一个剧"
782,"弄来弄去，还是本宫最善良"
782,"吴谨言这么瘦还有双下巴"
782,"本宫想永琏了，大猪蹄子快来安慰我！"
782,"宋博文是个大猪蹄子！"
782,"大猪蹄子是什么意思？"
783,"大猪蹄子贼帅贼帅的"
783,"你们都不会好过"
783,"不管怎样，还是要举傅璎大旗"
783,"我不在你们很开心啊"
783,"徐二花，大猪蹄子"
783,"弄来弄去，还是本宫最善良"
784,"你也善良，讨公道到不代表不善良"
784,"你萌想本可爱了吗"
784,"大猪蹄子你的眼睛咋滴了"
784,"我才二十多岁，不老"
784,"别说了，大猪蹄子睡着了"
784,"冯贤，你就是个大猪蹄子🐷"
785,"陈睿严你个大猪蹄子"
785,"为什么要说朕是大猪蹄子"
785,"王宝宝，你这个大猪蹄子"
785,"声音对不上退出重进就好了"
785,"我杜比音效怎么这么好"
785,"哇哥没我帅"
786,"大猪蹄子是指皇上见一个爱一个，而且还爱踢人"
786,"大家想我没"
786,"总提大猪蹄子，你们是饿了还是咋的"
786,"丢雷老谋啊"
786,"香蜜不忍看下去，太虐"
786,"郭v股海护航好"
787,"大猪蹄子脑壳疼"
787,"本宫等的杜比音效就很好"
787,"傅璎大旗永不倒"
787,"曾宇你个大猪蹄子"
787,"帅宇辉昨天喝了多少酒"
787,"后天宝宝们怎么办哦天天追剧"
788,"看他俩秀恩爱好甜啊，😘😘"
788,"我好温柔啊"
788,"杜海涛：手心手背都是肉"
788,"都说我脖子长？"
788,"对不上请勿缓存"
788,"袁春望是本宫太放纵你了吗"
789,"侯兴你个大猪蹄子看到这儿了吗"
789,"袁蠢望你求求你领盒饭吧，本宫给你加菜"
789,"听起来永琪挺棒的"
789,"，，咸小咸请你务必善良"
789,"魏贵妃太厉害"
789,"孟建丽你真对得起我"
790,"令妃娘娘你的下巴怎么这么突出"
790,"璎珞什么时候变得这样紫温柔了皇上也这样想"
790,"我就是大猪蹄子"
790,"两倍都慢剧情越来越水"
790,"黄晓慧你个大猪蹄子"
790,"我儿子竟落得如此下场"
791,"想高可爱了"
791,"想本可爱了吗"
791,"全程2倍速看给力多了"
791,"我越来越美"
791,"袁春望我劝你要善良"
791,"袁春望，本宫允许你领盒饭"
792,"聂远是比霍建华演的好"
792,"朕是大猪蹄子，不接受反驳"
792,"谁叫皇上这么厉害啊，儿子那么多"
792,"从本宫的儿子出事就开始担心他还怎么和小燕子私奔"
792,"手心手背都是肉，但手心肉多啊"
792,"有人说你像吉娃娃，哈哈哈"
793,"这个眉毛是认真的吗"
793,"让本宫上去把袁春望带去吃盒饭"
793,"长得就带个丫鬟样"
793,"看来本宫才是最善良的了。"
793,"哎吆，皇桑的嘴唇好性感~~"
793,"聂远是比霍建华演的好"
794,"谁让你媳妇多娃儿也多"
794,"本宫不善良"
794,"令妃:都是本宫眉毛演的好"
794,"袁春忘活到了最后一集，然后疯了"
794,"这个眉毛是认真的吗"
794,"让本宫上去把袁春望带去吃盒饭"
795,"只有我觉得开杜比后只是声音大了么"
795,"卫龙是啥意思"
795,"正面侧面都是美，这文案没谁了，哈哈哈哈哈"
795,"所以你到底想说什么呀"
795,"谭皓天你个大猪蹄子"
795,"头发跟本宫一样"
796,"荣誉你也是个大猪蹄子，大猪蹄子！"
796,"本宫，今天是来早了吗"
796,"手心手背都是肉，正面侧面都是美"
796,"以后你儿子才是皇上，别担心了"
796,"王思远是大猪蹄子"
796,"后天开始没得看了"
797,"要辣条的你是认真的吗"
797,"牟国臣是个大猪蹄子"
797,"大猪蹄子什么意思啊"
797,"本宫要皇后死"
797,"赵德龙你个大猪蹄子"
797,"好想复活，想拔袁春旺的指甲"
798,"剧集太长，忘了四阿哥是哪位妃子的儿子?"
798,"袁春望我劝你善良"
798,"闫戍是大猪蹄子"
798,"怎么没有小燕子和紫薇格格？还有香妃和容嬷嬷？"
798,"许浩锋才是大猪蹄子"
798,"本宫要皇后死"
799,"隔壁如意传，五阿哥又和如意关系好，令妃把他害了"
799,"袁春旺什么时候领盒饭，竟然害朕皇嗣"
799,"高低眉好明显"
799,"还有谁记得本宫"
799,"璎珞好耐看啊"
799,"师傅别念了"
800,"正常的比杜比音效好"
800,"田子萱你个大猪蹄子看到这了吗？"
800,"蛙哥，我不劝你善良了，你别领盒饭就行"
800,"点回去，重新打开应用就好了"
800,"还珠格格历史上是不存在的好吗"
800,"隔壁如意传，五阿哥又和如意关系好，令妃把他害了"
801,"俺杜比音效很准，不准的可能是钱不到位"
801,"看来看去还是我善良吧"
801,"强烈要求把删掉的剧情补回来"
801,"本宫容颜不老"
801,"令娘娘怎么看都长了一副宫女像"
801,"你知道就好"
802,"朕的令妃好懂事"
802,"大猪蹄子快把袁春望踢下来和本宫一起吃盒饭"
802,"龙椅，你演的真心不错，加餐"
802,"朕的眼皮演的好"
802,"袁春望的戏份不是一点点的多啊"
802,"皇上有点帅哦"
803,"脑瓜疼不疼啊，大猪蹄子"
803,"袁春望我劝你善良"
803,"小星星才是大猪蹄子"
803,"编剧我劝你善良"
803,"臭咪目你这个大猪蹄子"
803,"皇上有点帅哦"
804,"谁让你生那么多儿子的，大猪蹄子"
804,"不知道为什么总感觉魏璎珞鼻孔好大"
804,"白敖力根你个大猪蹄子"
804,"脑袋疼脑袋疼"
804,"我有璎珞一半聪明就好了"
804,"我才是大猪蹄子你们不要说皇上"
805,"大猪蹄子演的好"
805,"哈哈，大猪蹄子的双眼皮演的好！"
805,"王鹏是大猪蹄子"
805,"朕就是这么威武霸气帅"
805,"大猪蹄子困了"
805,"看朕的这大双眼皮子"
806,"黄桑演技太好了演出中老年的感觉，令妃演技有待加强啊"
806,"所有人都在意朕飞的高不高，只有你在乎朕飞的累不累"
806,"想啃个大猪蹄子"
806,"眼皮儿演的好"
806,"五阿哥母亲是愉妃"
806,"我觉着我可以复活把袁春望拖下去一起吃盒饭"
807,"齐贵妃这个角色孙俪演就更好了"
807,"这些甜蜜的行为都是朕想出来的"
807,"皇上演的真好各个年龄都能表现出来"
807,"所以只生一个好"
807,"手心手背都是肉正面侧面均是美"
807,"好红红火火恍恍惚惚"
808,"大猪蹄子你的双眼皮还能自由切换啊？"
808,"后面剧情发展的有点太快了智商都不在"
808,"陈江源是大猪蹄子"
808,"张斯骑你个大猪蹄子"
808,"刘勇是个大猪蹄子"
808,"双眼皮演的好"
809,"大猪蹄子有点帅啊"
809,"舒妃到底什么时候领盒饭，这是一个漏洞还是？"
809,"段奕羽是大猪蹄子"
809,"注意看我眉毛，高低眉"
809,"说手心肉多的你别走"
809,"大猪蹄子你的双眼皮还能自由切换啊？"
810,"大猪蹄子我爸和你有点像"
810,"大猪蹄子就是夸我胶原蛋白"
810,"大猪蹄子演技棒棒的"
810,"你们都是大猪蹄子朕不是"
810,"皇上的三眼皮演得好"
810,"真心演的不错"
811,"眼里血丝明显没休息好连续眨眼也不是有意而为体谅就好"
811,"皇上个大猪蹄子"
811,"怎么那么多说大猪蹄子的"
811,"朕的双眼皮厉害不"
811,"双眼皮贴演得好"
811,"本宫不善良"
812,"高可爱走的第好多天，想她想她想她"
812,"朕的基因太好了生了十二个"
812,"田子萱你个大猪蹄子看到这了吗？"
812,"辣么多戒指💍带着，就问你们美不美"
812,"怎么回事？我这里声音和屏幕不一致"
812,"皇上个大猪蹄子"
813,"叫你这个大猪蹄子生怎么多"
813,"朕都欣慰出大双眼皮了"
813,"儿子多了脑仁疼"
813,"我劝自己要善良"
813,"聂远演的真好，璎珞也很好"
813,"手心手背都是肉，想吃掌中宝"
814,"大猪蹄子脑阔疼"
814,"朕的双眼皮演的好"
814,"皇上的双眼皮好深啊"
814,"这胡子演的很好👌🏻"
814,"大猪蹄子现在内心崩了"
814,"儿子多了脑仁疼"
815,"永琪快带着小燕子私奔吧皇宫的水太深了"
815,"谁还记得本宝宝呀"
815,"蛙哥好善良"
815,"袁春望真丑"
815,"大猪蹄子是什么意思"
815,"本来90多集剪了那么多"
816,"大猪蹄子：为啥叫我大猪蹄子"
816,"皇上大猪蹄子"
816,"好可爱的孩子"
816,"袁春望我劝你善良"
816,"乾隆:我好可爱"
816,"皇上居然不肾虚"
817,"看了这么久还是感觉魏璎珞长的和陈晓一样"
817,"永琪会不会好"
817,"这个妆化得可真好，真的像熬夜了的样子"
817,"皇后养了一个太出格的奴才袁春望"
817,"曾文珂你个大猪蹄子"
817,"皇上居然不肾虚"
818,"有亮点两个大猪蹄子"
818,"就我媳妇，尽说大实话"
818,"zzt你个大猪蹄子"
818,"本宫今天的眉毛怎么样"
818,"袁春望快来吃盒饭"
818,"我滴鹅子啊"
819,"聂远细节演的太好了"
819,"我爱说大实话"
819,"眼皮演得好"
819,"朕的眉毛不错"
819,"本宫就是诚实"
819,"因为我厉害啊"
820,"分饭豆豆你个大猪蹄子"
820,"朕的杜比是好的👌"
820,"双眼皮演的真好"
820,"本宝宝想我媳妇璎珞了"
820,"最不容易的还是乾隆"
820,"老夏来追剧了"
821,"宋钰欣你这个大猪蹄子"
821,"本可爱最可爱"
821,"皇上的胡子为什么只粘半边，经费用完了吗"
821,"男人都是大豬蹄子"
821,"充钱让我们相遇"
821,"眼皮子演的好"
822,"令妃如果孙俪演会更好！"
822,"我出宫游玩了照顾好我儿子"
822,"魏璎珞高低眉太明显了"
822,"大猪蹄子忘了我吗"
822,"皇上演的真好"
822,"哎呀还是我最聪明"
823,"大猪蹄子声音好听"
823,"你个大猪蹄子"
823,"聂远的演技真是老到，连眼皮都是戏"
823,"确认过眼神，是充了钱的人"
823,"人活着不容易啊"
823,"四阿哥是大嘉嫔的儿子"
824,"给你们傅璎大旗都砍了"
824,"高可爱等着你们呢"
824,"夏天是大猪蹄子"
824,"大猪蹄子加油呀"
824,"五阿哥会好的，皇上不要担心。"
824,"皇上的眉毛一单一双真有个性"
825,"累到大眼皮出来好演技"
825,"是人都喜欢好听的话，朕也是人"
825,"喜欢娴妃，从头到尾手都是干干净净的高段位玩家。"
825,"大猪蹄子爱听"
825,"谁不爱听好听的话"
825,"我来刷下存在感"
826,"聂远老师好厉害呀"
826,"现在觉得我很可爱了吧"
826,"吴青伟你个大猪蹄子"
826,"媳妇就不能说个假话哄哄我"
826,"魏璎珞：我娃娃都那么多了还缺他一个吗"
826,"累到大眼皮出来好演技"
827,"大猪蹄子演的好"
827,"王占曦你个大猪蹄子"
827,"有人说大猪蹄子的双眼皮是；隔得"
827,"朕太天真了没办法"
827,"魏璎珞演的表情太单一，有点面瘫"
827,"聂远老师好厉害呀"
828,"俩人都好了解彼此啊，利落最甜"
828,"眼皮演得好啊"
828,"富贵使我们相遇"
828,"来人！把袁春望拖出去斩首"
828,"皇上的演技真的好"
828,"袁春望快点领盒饭"
829,"永琪好善良"
829,"好温馨的画面"
829,"卫龙大旗扛起来"
829,"朕说周志铁是个大肥仔"
829,"1.5倍看惯了看正常速度都不习惯"
829,"眼皮演得好啊"
830,"陈巧婷你个大猪蹄子"
830,"珍珠多大了，怎么还不出宫嫁人呢"
830,"小燕子记得永琪不是会飞吗"
830,"袁春望本宫劝你善良"
830,"小燕子想必已提着四十米大刀赶来"
830,"开了杜比画音也对得上，对不上的是别的原因吧"
831,"张森你个大猪蹄子"
831,"令妃嘴太大了不得体"
831,"上错花轿嫁对郎看着也很甜"
831,"感觉跟皇后无关可能是袁春望自作主张"
831,"令妃厉害了"
831,"粘牙了粘牙了把牙粘住了"
832,"大猪蹄子演技真好"
832,"想多了吧！我们傅璎大旗怎么也砍不倒"
832,"刘勇是个大猪蹄子"
832,"皇上就是个大猪蹄子"
832,"郑天龙是大猪蹄子"
832,"情话想说给耳朵听，怎么让眼睛动了情"
833,"大猪蹄子就是男人都没一个好东西"
833,"丁畅我劝你善良"
833,"聂远演的乾隆真比霍建华好太多了"
833,"袁春望，我劝你赶快领盒饭"
833,"啊呀妈呀，脑瓜疼，脑瓜疼……"
833,"情话想说给耳朵听，怎么让眼睛动了情"
834,"华硕正面侧面都很美是魔鬼吗"
834,"还是我高可爱善良"
834,"莫家乐几个大猪蹄子"
834,"袁春望活着是干嘛的"
834,"好久都没追剧了，追剧的滋味真不舒服"
834,"聂远演的乾隆真比霍建华好太多了"
835,"大猪蹄子真好"
835,"爱情长得好美丽"
835,"你们的高可爱突然出现"
835,"完了，都去看本宫年轻的时候了"
835,"眼大无神，嘴大像个门"
835,"陈湘豪你要好好的"
836,"明明最爱说假话的就是你呀皇后才是最爱说真话的"
836,"傅璎大旗举起来"
836,"刘泽昊你个大猪蹄子"
836,"袁春望，你的盒饭热好了"
836,"跟大家说个秘密卢冰冷是我大儿子狄文婷是我小儿子"
836,"眉毛一单一双是什么意思我不懂🤔"
837,"乾隆可是要活80多的，当然要年轻"
837,"哎呀妈啊脑瓜疼，脑瓜疼脑瓜疼"
837,"十五阿哥继承了皇位是嘉庆帝，也就是令妃的儿子"
837,"本宫情商高，智商也高，哈哈哈"
837,"奏折演得好"
837,"黄罗豪大猪蹄子"
838,"严佳蕾大猪蹄子耶耶耶"
838,"本宫在的时候多好，袁春望不作妖"
838,"你这大猪🐷蹄子，别想我会在乎你"
838,"还是本宫可爱"
838,"袁春望活的挺长哼"
838,"朕要成葛优躺了"
839,"同父异母的兄弟太多的，造孽"
839,"鹿尧你个大猪蹄子"
839,"徐瑞文你个大猪蹄子"
839,"错了，是因为皇上喜欢你，你说什么都爱听"
839,"韩泽铭你个大猪蹄子"
839,"你的眼睛成功的，成功引起了朕的注意😎😎😎😎"
840,"生了孩子的璎珞好温柔啊"
840,"给本宫热好盒饭，本宫马上就来"
840,"曾亚婷是个大猪蹄"
840,"袁春望你活的太久啦"
840,"聂远演得很好"
840,"想本可爱了吗"
841,"马少东你个大猪蹄子"
841,"这讲的是一个太监的复仇史故事吗？"
841,"陈忠勇你个大猪蹄子"
841,"璎珞说话时眼睛眨的飞起□"
841,"周唯婷大猪蹄子"
841,"皇后快领盒饭了"
842,"眼皮儿的演技不错不错不错"
842,"帮永琪报仇吧快快快💕"
842,"袁春望坐大，收视率下降，编剧思路出岔子了"
842,"大猪蹄子想我了没有"
842,"吉娃娃头好大"
842,"大猪蹄子还记得本宫吗"
843,"聂远把乾隆演活了比霍建华演得好"
843,"背景音乐我劝你善良"
843,"魏璎珞眼睛眨的好厉害"
843,"令贵妃你眼睛眨的朕心盲啊"
843,"哪来这么多大猪蹄子"
843,"死一个好开心❤❤❤"
844,"大猪蹄子就是男人没一个好东西"
844,"后面的灯演得好"
844,"光盯着璎珞的眼睛看入神了，台词都没听到，眨好有喜感"
844,"本宫劝你善良"
844,"大猪蹄子真香"
844,"这么说你也不可能真心疼爱五阿哥喽"
845,"个人觉得开了杜比更清晰音质也很不错好吗"
845,"化妆师，我睫毛掉了，进眼睛了，导演强烈要求换化妆师"
845,"魏璎珞这个眼眨的有点快啊"
845,"好想来个冰阔乐"
845,"这眼皮跟之前的一滴泪都好演技"
845,"会心疼大猪蹄子了"
846,"聂远演技是真的好"
846,"大猪蹄子你可拉倒吧！"
846,"侯宏宇你个大猪蹄子"
846,"我劝袁春望善良"
846,"傅璎女孩高举大旗！！！"
846,"你们都没我善良"
847,"璎珞讲话眼睛眨得好快"
847,"还是我最了解大猪蹄子"
847,"小妖精是个大猪蹄子"
847,"璎珞把你的眨眼神功收一收"
847,"大姐永琪是你亲生的吗？"
847,"今天的袁春望领饭盒了吗"
848,"看过那么多的风景，都没有你谎言动听"
848,"帝王之家就是要打打杀杀"
848,"心疼大猪蹄子"
848,"我为啥总眨眼睛"
848,"奶盐演的好"
848,"你们把我忘了是吗"
849,"璎珞说话的时候眼睛乍的厉害.是有眼疾吗"
849,"傅缨大旗永不倒"
849,"大猪蹄子眼睛一睁一闭六十集过去了😁"
849,"利落大旗摇起来"
849,"刘啦啦你是大猪蹄子"
849,"魏璎珞我劝你善良"
850,"璎珞爱睁大眼睛说话，太刻意了"
850,"还是我厉害吧大猪蹄子"
850,"大猪蹄皇上，以后没得追了"
850,"魏璎珞！你不是很聪明？你也怀疑本宫？故意这么说害我"
850,"这个令妃眼睛眨得真厉害"
850,"盒饭可好吃了，快来快来常一常"
851,"难道皇上没有一个女儿吗全是儿子儿子"
851,"为大猪蹄子的演技打☎️"
851,"最后几集节奏太慢"
851,"永琪也不是你的亲生儿子啊你也不是真心疼爱?"
851,"后面真的多余"
851,"真的不关本宫事呀"
852,"旺旺是个大猪蹄子"
852,"本宫就是不老"
852,"看的好心疼皇后"
852,"还是我最可爱嘛"
852,"大猪蹄子什么意思"
852,"我这话是来给你上眼药呢"
853,"我们是个美丽又健康地生活里生活在阳光中的人也越来越"
853,"十年没打排位掉成青铜了嘤嘤嘤"
853,"这这歌配色真的好高级啊再次感叹"
853,"朕的寿命可是长的很"
853,"眼睛还不是一般的眨，是卡巴！"
853,"还是我善良"
854,"椅子演的好，一动不动"
854,"皇后我劝你善良"
854,"不知道吕广会看没看剧"
854,"哈哈哈哈哈！没有办法吧，我就是这么强大！"
854,"我觉得就算不是亲生也是真心疼爱"
854,"我劝你善良"
855,"这是在说皇后啊，厉害厉害厉害"
855,"本宫眼睛不舒服"
855,"王彬彦是个大猪蹄子"
855,"我就是这么强"
855,"今天我杰哥也成大猪蹄子了"
855,"你个大猪蹄子啊！"
856,"璎珞眨眼睛的频率好高"
856,"还是富察皇后好"
856,"是在背词么，一说话，眼睛眨的厉害"
856,"我可会生儿子了，还会钻被窝呢"
856,"罗祖龙你个大猪蹄子"
856,"雪泡在看是不是？"
857,"大猪蹄子大猪蹄子"
857,"我来混个脸熟"
857,"从为皇后报了仇后面就是多余"
857,"谁是大猪蹄子？"
857,"嘉庆其实算是个好君王了，只是当时时代的问题"
857,"那你是真心疼爱永琪吗"
858,"富察皇后：大猪蹄子你忘了本宫了吗"
858,"范晶我劝你善良"
858,"眼睛眨太多了"
858,"wmk你个大猪蹄子"
858,"饭盒准备好了"
858,"追完剧正好开学"
859,"让你生那么多儿子，现在哎呀，妈呀，脑瓜疼了吧"
859,"你们说朕是大猪蹄子的你们是魔鬼吗"
859,"傅璎大旗我来扛"
859,"大可爱前来追剧"
859,"魏英落的演技一般嘴有点做作"
859,"明天要加班，宝宝不开心"
860,"郭珈琳是个大猪蹄子"
860,"本宫也想有儿子"
860,"皇上胡子粘的好"
860,"本宫最近眼睛有问题"
860,"皇后这次真的是无辜的啊……好心疼淑慎"
860,"全部领盒饭"
861,"眨眼太多，显得不稳重"
861,"耳环演得好"
861,"董国民大猪蹄子"
861,"男人👨都是大猪蹄子"
861,"王慧聪你个大猪蹄子"
861,"我劝我自己不要善良"
862,"你们六十多集不眨眼看下来试试。"
862,"盒饭热好了"
862,"好可爱的孩子"
862,"朱晓宝个大猪蹄子"
862,"袁春望演的好，没有袁春望这部剧就只有30集"
862,"眉毛演得好"
863,"眨眼是在思考脑瓜慢的人是不懂的"
863,"感觉聂远演的乾隆很讨喜！演技很棒！"
863,"皇上为什么叫大猪蹄子"
863,"肖密点大猪蹄子"
863,"猪蹄你知道就好"
863,"本宫今天不开心"
864,"高举傅缨大旗"
864,"知道了还不处理大猪蹄子哼唧"
864,"曾梦婷这个大猪蹄子"
864,"继后其实很爱皇上，现在的她到结尾都很好但是一直背锅"
864,"朕觉得朕演的不错"
864,"晚晚小可爱呢"
865,"主角光环强大啊你的五阿哥也不是亲生的"
865,"真的跳进黄河也洗不清"
865,"那你对五阿哥呢，意思是养他再好，不是亲生也……唉"
865,"眼睛眨的不酸吗？"
865,"柴雪然大猪蹄子"
865,"你们也是老夫老妻了，看起来好和谐啊"
866,"必须动手术多吃营养多运动一两年就恢复差不多"
866,"崔一川你个大猪蹄子"
866,"黄桑是怎么做到眼睛都能和年轻的时候不一样呢？"
866,"徐你个大猪蹄子"
866,"大猪蹄子可爱"
866,"令妃的头重不重啊"
867,"璎珞眼睫毛贴太多了，所以总眨眼"
867,"大猪蹄子我劝你善良"
867,"老是眨眼就会装的机灵吗"
867,"本宫不在，你们玩的都不热闹了"
867,"这话不地道了，"
867,"来呀，快活啊"
868,"毛敬淳你个大猪蹄子"
868,"哈哈哈，打不过我吧！没有办法，就是这么强大。"
868,"陈伟霆你个大猪蹄子"
868,"谁给本宫化的眉毛。真的是化的不上不下的"
868,"咕噜老师，你这个大猪蹄子"
868,"任丘市的走一走"
869,"聂远演技真的太好了，好想看他的戏，真的是享受"
869,"大猪蹄子，你可还记得我"
869,"还是那么任性想怎么说就怎么说呀"
869,"大猪蹄子忘了我吗"
869,"郑照坤，大猪蹄子"
869,"令妃娘娘最棒。"
870,"袁春望好长命，啥时候领饭盒"
870,"居然说本宫坏话，不信本宫单纯"
870,"璎珞眨眼睛太多了"
870,"演的蛮好棒棒"
870,"鹏鹏个大猪蹄子"
870,"胡文清，我劝你善良"
871,"高可爱善良"
871,"高贵妃活到结尾就好了"
871,"心疼皇后娘娘，这锅背大了"
871,"魏璎珞本宫是个有原则的人，不会污蔑本宫！"
871,"皇上是大猪蹄子"
871,"朕的女人就是聪明，不愧为朕的女人"
872,"我姑50多因为搬东西把腿砸断了动手术两年腿好了"
872,"可还记得我，大猪蹄子"
872,"画面太美，像画的人物，服饰也很美！"
872,"男人都是大猪提子"
872,"璎珞头上那坨头发不重，要掉的样子"
872,"我情商高。知道皇上怀疑谁，我就顺杆爬"
873,"璎珞演的最出色"
873,"尚进是大猪蹄子"
873,"令妃后面的演技是越演越好了"
