time,content
1,"没有好人坏人之分包括俯察皇后只有手段高不高之分"
1,"够早的啊大猪蹄子们"
1,"皇后的龙是被人吓到了，皇上的龙是捡到钱了吧那么开心"
1,"这世上哪有绝对的公平"
1,"愉妃是自己人！！愉妃是自己人！！愉妃是自己人！！"
1,"想起以前的皇后了，绝对不会让皇上为难"
2,"每次都不舍得跳过开头"
2,"人这么少？"
2,"我老一到！🙋"
3,"和小哥哥一起追剧多好"
3,"不愿错过片头，真的太有质感了"
3,"先来报个到"
3,"来的人不少呀！"
3,"快完了，咋办"
4,"为什么要说是继后"
4,"富贵使我们相遇"
5,"一起来追剧"
5,"喻子宸第一"
5,"皇后又怎么样"
5,"(⊙o⊙)哇，今天更新到56集了"
6,"今个，好早"
6,"皇上就是大猪蹄子"
6,"各位晚上好"
6,"杜比音效还没有？"
6,"还好还好哈"
6,"我快出场了babe"
7,"今天更新的好早"
7,"大猪蹄子会跳舞"
8,"这么早更新了"
8,"哎，皇后的父亲真可怜"
9,"你们有看片头片尾画面的吗，真的好精致啊"
9,"今天谁领盒饭"
9,"疯了一天看几次，时刻准备着更新"
9,"又偷偷的更新"
9,"朕的角色呢？朕的杜比呢？"
9,"本宫给你生猴子！🐒"
10,"快来人啊更新啦"
10,"真的好天真啊"
10,"海燕大傻子"
10,"难道就朕一个人没有杜比音效么……"
10,"墙裂要求出续集"
10,"你们给我记住"
11,"片头曲好高级"
11,"早啊大佬们"
11,"聂远帅的啊"
11,"片头片尾也舍不得跳过"
11,"抢了个沙发"
11,"八点准时到"
12,"哎呀呀呀每次看继后红了眼眶我就想跟着哭这演技"
12,"爱卿们今儿个挺早啊"
12,"路倩出来没别去过节了"
12,"飞上飞下吗"
12,"集合了集合了"
12,"怎么没有图像"
13,"陶杰大猪蹄子吧"
13,"晓冉在看吗"
13,"嬛嬛是不是要领盒饭了"
13,"都给本宫等着，一个个的收拾你们"
13,"最近几集我都一天看好几遍等更新"
13,"来追剧的没过节啊！"
14,"就我觉得主题曲好好听吗..."
14,"早呀，姐妹们"
15,"片尾曲的画面更好，透着剧情"
15,"充钱使我们相遇"
15,"单身狗们，早"
15,"还以为到八点"
15,"提前更新了"
16,"第一次看片头曲"
16,"本宫在来的路上"
16,"这集什么剧情"
16,"更新啦。快点的"
16,"咦～更新了"
16,"来啦来啦，小板凳坐好了"
17,"今天好早，我怎么看不到标题是什么呢"
17,"八点大军来相见"
17,"还以为今天不更"
17,"第一次看片头曲"
18,"哇撒这里真的和清朝末期的衣服场景一模一样"
18,"往后的衣服都脏了。"
19,"小剧场你是不是想让我哭"
19,"见不着富察皇后了"
19,"有十集都看不够"
20,"这个片头真的好精致"
20,"提前了这么多吗？"
20,"本宫来晚了"
20,"皇上，为何臣妾没有杜比音效"
20,"第一集起就感觉跟陆贞传奇演的很像"
20,"这是魏璎珞吗？"
21,"更新了开心"
21,"想本宫了吗？"
21,"可算更新了"
22,"片头做的真好"
22,"胖子胖子胖子"
22,"没有情人的情人节”"
23,"迟到半小时"
23,"为啥没杜比了啊"
24,"我竟然把标题看成继父为后申冤"
24,"来人呐更新了"
25,"皇上怎么老是往延禧宫跑，那么多优秀的嫔妃"
25,"皇上这几天也不来看本宫了"
26,"吉祥是你吗？红姐是你吗？"
26,"眼神好奇怪"
26,"各位陪我过七夕[色]"
26,"片头有点瘆人"
27,"来咯我最早哈哈哈"
27,"来追剧不过节"
27,"和我老妈一起追"
27,"都去过七夕了"
27,"结果是第一"
27,"唉又要开始虐了"
28,"帅！！！！大猪蹄子帅！"
28,"怎么不清楚"
28,"小的们，快更新了。"
29,"好久没有追过剧了"
29,"刚看了预告"
29,"怎么卡卡卡"
30,"于正这部片子真的不错...看片头都有看历史的感觉"
30,"哪里可以看的更多，更得好慢"
30,"每天准时八点"
30,"這是在鬼叫嗎"
30,"片头曲有种凄凉的感觉"
30,"更新十集都不够看"
31,"告诉大家吧。片头曲叫《看》"
31,"卡的不行啊"
31,"第一次看头片"
32,"从早看到晚，疯了……"
32,"续集是还珠格格啊"
32,"这标题。。难道这集又没有魏姐吗"
32,"又没有杜比了"
32,"给各位拜个早年"
32,"更新了，快来看了"
33,"好早，我第一么"
33,"看标题这集魏姐有啥事没"
33,"也许在这里可以遇见你"
34,"片头一句歌词没有，全是静止的画面，好特别"
34,"片头曲好听啊，这剧真的不错！"
34,"被甜虐了一天，还是追个剧吧"
34,"今儿有片头曲了"
34,"好久没追过剧了"
35,"人都过七夕了"
35,"喜欢片头曲"
36,"荷花池剧里有嘛"
36,"追剧的感觉很好啊……"
36,"这几年第一次追剧"
36,"来报个道。"
37,"古代的女人可真是强"
38,"怎么没有杜比了"
38,"今天这会看电视的都是单身狗"
38,"今晚来的早些"
39,"这静图画面真美"
39,"画面真的好唯美"
39,"吉祥戏真多"
39,"第一次这么早"
39,"黑夜给我力量吧"
41,"看来我们都是单身集合在里啦"
41,"这几个宫女演技有前途啊哈哈"
41,"一群小机灵鬼"
41,"后面开始虐了。。。好不忍心"
41,"最后还真的反了，可惜了弘昼！~"
42,"我魏姐眼睛可太大了"
42,"袁春望即将黑化"
42,"来看你们了"
43,"前头都做得那么优秀，好优秀的剧"
43,"朕的杜比音效呢"
43,"画面真的好高级啊"
43,"富贵使我们相遇"
43,"大猪蹄子！"
43,"杜比是什么意思"
44,"片头好棒，以前都错过了"
44,"同一时间一起来看"
44,"哪位老哥，告诉我"
44,"开始看喽！"
44,"等待的过程实在太难熬了"
45,"我有杜比耶，难道晚一天看就有了？"
45,"主角有看吗"
45,"没有情人节，呜呜"
46,"充钱使我们相遇"
46,"好喜欢这个片头，超级有质感"
47,"画面真的好美"
47,"第一次听片头曲，画面不要太美"
47,"杜比去哪里了"
48,"令妃，早呀！姐妹们。"
48,"因为单身狗。喜欢看追剧。"
48,"今天是皇后娘娘头七😔"
48,"再过七夕，人好少"
50,"主题曲太美了吧"
50,"我什么时候出来"
50,"情人节跟皇上令妃一起过了。"
50,"一群连片头都不放过的人"
51,"我来撸大猪蹄子了"
52,"吴谨言要火"
52,"充了钱就是不一样"
52,"羡慕嫉妒恨"
53,"这画面太美"
53,"到现在还是不喜欢魏璎珞这个演员"
53,"喜欢主题曲"
54,"44分半的时候出的。"
55,"来人呀，开始了"
55,"不够看呐，"
57,"吉娃娃，哈哈，形容得好贴切呀，太有才了"
58,"片尾曲也很好呢"
58,"下了一天雨，刮了一天风"
58,"如意传快开始了"
58,"可以用来当屏保"
58,"怎么这么冷清"
59,"片头都这么美"
59,"娴妃黑化不怪她，她刚开始谁也没害不是吗"
60,"好气派的感觉"
60,"好赞的片头"
60,"屈佳快来看"
60,"大家都去约会去了"
60,"人呢，都在吃饭吗"
60,"莫非今天我第一？"
62,"吴谨言要火了，期待她演的朝歌"
63,"都过节去了。。"
64,"哭完丧来追剧"
66,"一开始就是老女人"
66,"都在认真看"
68,"酒店也满房了"
68,"大猪蹄子，快下来和本宫过七夕"
68,"都过七夕去了"
70,"富察走的第n天，想她想她"
71,"富贵使我们相遇"
71,"特别喜欢这个旋律"
71,"夜生活开始了"
71,"一个人来看啦"
72,"真的很心疼继后很心疼那尔布"
72,"这么早，我都有点不敢相信"
72,"还有人在看吗"
72,"因为今天是七夕啊"
73,"第一次没跳过片头"
73,"都过情人节去了吗"
73,"都看到57了，人自然就少了"
74,"第一次连着片头一起看了"
74,"确认过眼神，是要黑化的人，"
74,"越南去哪看"
74,"更了哇哈哈"
74,"都过七夕了"
76,"不要约会了，看剧重要"
76,"今天一个人看了。有谁一起"
76,"每天两集不够看呀"
77,"超喜欢戏音"
79,"七夕来追剧"
80,"七夕有啥好过的"
80,"刮台风呢还过七夕"
81,"高可爱是你么"
81,"片头的画面好美！"
81,"都陪情人了"
81,"本宫唱的如何"
81,"都没有去约会啊！，"
82,"提前更了耶"
82,"为皇上停啊"
83,"全部更新完算了"
83,"我都不舍得看"
83,"天天等到8点更新哟"
83,"吗吗妈妈你们呢"
84,"一个人孤单的过。"
85,"刮台风也没事，有宾馆😂️"
86,"你们都是单身狗吗，七夕不出去约会"
87,"那个抹鼻子动作好可爱"
87,"每晚零点以后追剧，强烈求加更"
88,"皇上，还记得大明湖畔的夏雨荷吗？？"
88,"等更新太难了"
89,"这么多人没去约会，单身的挺多啊"
89,"跪了一夜，累死本宫了。"
89,"老佛爷吉祥"
90,"现在追剧的都是单身汪"
90,"七夕都来陪我过"
90,"我媳妇不要我了"
91,"我四天没看就是为了把它留着一次看个够，"
91,"朕不死尔等终究是臣第一"
91,"来的真巧啊！"
92,"这配色绝了！"
93,"剩下我们这些"
94,"早早就来等着了"
94,"歌都这么别出心裁"
94,"约会的人不少啊。"
95,"为什么要追剧...."
96,"充钱的朋友们，单身的朋友们，来追剧了"
96,"约会中看剧"
96,"今天人这么少"
97,"这标题不简单"
97,"怎么这么卡"
98,"情人节坐等更新"
98,"我特地来看片头"
98,"这部剧于正洗白白"
98,"你们约会我就自己看！！"
98,"为啥就一集啊"
99,"那时候有大不列颠国"
99,"单身狗才看电视"
99,"单身狗看剧"
99,"我甄姬也是这么个曲"
99,"今天现在人少"
100,"老夫掐指一算，今晚必有血战"
100,"下班洗漱完就马上追剧"
100,"不，还有守活寡的在追，宝宝睡了"
100,"我一个人过"
100,"哈哈一个人"
101,"追剧真辛苦，"
101,"有一起过七夕的吗"
101,"单身狗狗一起过"
101,"怎么更新这么早还，还没到8点呢"
101,"没过七夕的都在这了？"
102,"过七夕这辈子都不可能，只能靠追剧玫能维持生活"
102,"竟然提前更新了"
102,"后宫的每一个女人，都不容易"
102,"烧鸭仔看剧啦"
102,"纯妃今天该领盒饭了"
102,"哒哒哒我来咧"
103,"今天跑了会第一好高兴"
103,"美丽追剧了"
103,"贤妃衣服是绿色的"
103,"皇上，还是我好吧"
103,"全世界最爱杨灵聪"
103,"一个人＋1"
104,"确实没能力，有能力的人不会让这件事曝出来"
104,"好心疼继后，她是个孝顺的女儿啊"
104,"汪康个大猪蹄子啊哈哈哈"
104,"我们就去去看看他们"
104,"周勇你个大猪蹄子"
104,"还记得本宫么"
105,"这个时候的闲妃除了报复高贵妃也没做过坏事啊"
105,"来啦看大猪蹄子"
105,"啦啦啦，提前更新最开心了"
105,"为什么叫朕大猪蹄子"
105,"七夕难道不能多放两集？"
105,"让本宫出来透透气想我了没"
106,"下一集纯妃就要领盒饭了，开心"
106,"每天看剧第一句先给魏姐打个气"
106,"怎么卡得那么厉害"
106,"看剧啦看剧啦"
106,"我这是怎么了，宁愿看攻略三四遍也不看其他电视"
106,"七夕请发糖"
107,"在隔壁看一不小心香蜜来晚了"
107,"坏人，我劝你善良"
107,"路骁你看了吗纯贵妃要完犊子了！"
107,"不，本宫是告诉你，要做一个明君"
107,"全部演完了再看，多好"
107,"单身狗都来追剧了"
108,"这两集好紧凑可以不看不"
108,"皇上的衣服上的龙眼珠好可爱"
108,"来晚啦来晚啦"
108,"这标题没啥激动感"
108,"谁来赔这一世好光景"
108,"航哥航哥，明天尔晴就要领盒饭了"
109,"来晚了来晚了"
109,"看这标题本宫好担心，能不能申冤成功"
109,"香冒出来的烟是蓝色的呢"
109,"大猪蹄子🐷，别忘了我"
109,"好早更新，我喜欢"
109,"皇上的衣服上的龙眼珠好可爱"
110,"哇这么多人，我来晚了"
110,"这么早更新"
110,"好早啊各位仙女"
110,"记得来买本宫的面膜"
110,"更得好快啊吼吼"
110,"黄慷来陪我一起吃盒饭"
111,"皇后背后做了那么多坏事这也算是报应"
111,"记得要买本宫的面膜嗷～"
111,"听说纯贵妃领盒饭了！"
111,"看标题我放心了"
111,"好怀念以前的娴妃"
111,"一个人过的来看延禧攻略了"
112,"啊第一！傅璎女孩明天一定要看快本不得体现场结婚！"
112,"本宫跪了一夜，还让本宫卖面膜"
112,"哇咔咔卡卡卡追剧使我开心"
112,"纯贵妃你就要领盒饭了，臣妾已经帮你热好了"
112,"开心开心第一名"
112,"标题好评加鸡腿"
113,"高举傅璎大旗"
113,"皇上好可爱"
113,"好早啊你们"
113,"我就快要领盒饭了，你们开不开心"
113,"对啊支持正版吧还有让魏姐火起来"
113,"本宫跪了一夜，还让本宫卖面膜"
114,"看这个标题，就不太想看，我就想看令妃热盒饭"
114,"七夕难道不能多放两集"
114,"来晚了来晚了"
114,"面膜我劝你善良"
114,"情人节来追剧单身就是好"
114,"哈哈令妃宝宝来追剧"
115,"大猪蹄子们晚上好"
115,"你真美，又好可爱。"
115,"大猪蹄子不容易"
115,"这标题起的好啊！"
115,"大猪蹄子串场去啦"
115,"本宫卖面膜"
116,"皇后做的坏事太多了都让父亲还债"
116,"各位大佬好早啊"
116,"大猪蹄子们好"
116,"一个人过七夕也要坚强鸭"
116,"海兰察是什么身份背景啊，感觉很厉害"
116,"我来啦！杠着卫龙大旗"
117,"好早好开心"
117,"还好今天周五，明天不用上班，不然得请假啊"
117,"提早了好开心"
117,"这一回，皇后是彻底对皇上失了心了，难怪之后会谋逆！"
117,"大猪蹄子们，晚上好"
117,"大猪蹄子！我来啦！"
118,"这集标题继后让人甚是满意"
118,"大猪蹄子，你怎么可以喜欢别人。"
118,"大猪蹄子陪我过七夕"
118,"今天七夕，大猪蹄子想我吗？"
118,"今天更新早，好棒"
118,"看这标题有点激动呀"
119,"大家来的好快"
119,"这个标题好啊，看来你们还记得本宫"
119,"范钖大猪蹄子"
119,"佘诗曼好美"
119,"40就更了速度拿板凳坐好"
119,"看到这标题，本宫就知道又只能看戏了"
120,"是富贵让我们聚在一起"
120,"皇后娘娘，本宫劝你善良"
120,"看看大猪蹄子衣服上的龙"
120,"大家都好早哇"
120,"大猪蹄子到底啥意思"
120,"想高可爱了！"
121,"这么多人吗都好早啊"
121,"好早啊更新的"
121,"富贵我劝你善良"
121,"大猪蹄子又被骗"
121,"开心开心更新了"
121,"各位来得挺早啊"
122,"七夕也真这么多人陪着看，真好"
122,"本宫马上要吃盒饭了，开心吗"
122,"更新好快，喜欢"
122,"我还真是个大猪蹄子"
122,"听嬛嬛的准没错"
122,"各位来得挺早啊"
123,"大家都来的好早"
123,"本宫面膜用完了大猪蹄子，还不送来"
123,"大嘎晚上好"
123,"这么巧你也充钱了"
123,"快来看大猪蹄啊"
123,"我劝我自己善良"
124,"再晚也要追剧，用最贵的眼霜，熬最晚的夜，安排！"
124,"今天也是绿意满满的一天喔"
124,"开始了开始了七夕有什么好过追剧正经的"
124,"本是温柔人呀"
124,"好开心，又可以看了"
124,"皇后劝你善良"
125,"哇咔咔哇咔咔好早哦"
125,"皇上，今天是情人节，嫔妾要亲亲抱抱举高高"
125,"有才的人总会发光"
125,"每次看到荣耀手机就知道新的争斗开始了"
125,"你不爱我了大猪蹄子"
125,"继后?又要出来新的皇后了吧"
126,"晚一天看就有杜比音效"
126,"你们这些嫔妃们、都靠边站吧。大猪蹄子最爱我。啦啦啦"
126,"哇你们都好早"
126,"你们好早哦"
126,"第一个皇后太完美了"
126,"你个大猪蹄子"
127,"更新的好早呀"
127,"好多人呀都不过节呀热闹热闹"
127,"皇上大猪蹄子我来看你了"
127,"那么你们看香蜜吗"
127,"想当年本宫还是周芷若的时候，谁敢让本宫跪一夜"
127,"我还有三集就吃盒饭了"
128,"跪了一夜敷石墨烯面膜就元气满满了"
128,"充钱了的人你们晚上好"
128,"大猪蹄子你玩抖音吗"
128,"本宫跪了一夜得敷面膜补水"
128,"曾川你个大猪蹄子在看吗"
128,"我饿了要吃饭要吃饭"
129,"太后是宗室的最大受益者，而且也不愿牺牲自己亲人"
129,"七夕来追剧，大家想我了吗"
129,"都好积极哦"
129,"七夕分手，教我怎么放下啊"
129,"今天来那么早的都是单身狗"
129,"萌萌呆的龙"
130,"大静的别走"
130,"我马上要领盒饭了开心开心"
130,"纯贵妃下一集领盒饭"
130,"大猪蹄子又要动心了"
130,"七夕就不能多更俩集啊"
130,"本宫黑化可是理由很充分的"
131,"娴妃做的坏事不多？怕是剧情看不透"
131,"希望大家支持正版好嘛"
131,"皇后没搞清事情的关键点在哪，再跪也解决不了问题啊！"
131,"本宫已经卖面膜了不要再让我领盒饭了丫"
131,"智齿疼到睡不着，只能是在看一遍"
131,"还是本宫可爱"
132,"我觉得先皇后娘娘看到璎珞成为皇后一定很高兴吧"
132,"大猪蹄子不想看到你"
132,"大猪蹄子你腰带珠子掉了"
132,"更新了，开心开心😃"
132,"雷雷哥哥你个大猪蹄子"
132,"朕的龙可爱吗？"
133,"单身汪集合处！重要事情说三遍"
133,"大猪蹄子，今天是七夕，你居然要虐我"
133,"满屏都是弘昼的宽阔的肩膀"
133,"皇后多说无益"
133,"杀富这是人家有手段啊"
133,"皇后娘娘走的第七天想她想她想她"
134,"来晚了来晚了"
134,"一个人过七夕想也要坚强鸭"
134,"。大猪蹄子，又来追剧情，过什么情人节呀"
134,"七夕情人节送你们一首体面。"
134,"想高可爱了"
134,"这里看哭了。我爹是不能啊"
135,"哈哈哈好巧大家都充钱了"
135,"本宫是穿绿衣服的"
135,"莫名的看哭了,佘诗曼演技真的太好了"
135,"我马上就要死了好开心"
135,"盒饭已经热好了"
135,"大家晚上好"
136,"好早啊今天"
136,"娴妃我劝你善良"
136,"倪媛大宝宝出来"
136,"什么时候才能圆满啊"
136,"七夕大猪蹄子跟谁过啊"
136,"我劝你们都善良"
137,"为什么大家都喊大猪蹄子，我不喊好像不和群😰"
137,"好高兴啊这个继字"
137,"红红。你看到这里了吗"
137,"皇上衣服的小萌龙，真可爱"
137,"今天更新好早啊！"
137,"皇后遇到这种事估计会以大局为重"
138,"七夕能不能多更两集，让单身狗过过瘾😂"
138,"嬛嬛盒饭已经给你热好了"
138,"你们好早啊，爱妃嘛"
138,"本宫也要出来过七夕"
138,"太监演的好"
138,"我再不出来，都要忘记我了"
139,"皇上身上的龙好可爱"
139,"杜比个斑马旅游去了吗"
139,"大猪蹄子就是个大笨蛋"
139,"今天我头七你们怎么能过节去了呢"
139,"杨泽疆，郭涛，魏学哲，郝文琦，我劝你们善良"
139,"晚上都不出去宠幸的嘛"
140,"各位充钱的七夕晚上好"
140,"你这个大猪蹄子还不让本宫起来"
140,"周一我劝你善良"
140,"大猪蹄子早上好啊"
140,"所以有能力就是有镇压，掩盖的能力吧？？"
140,"戏里戏外反差挺大的哈"
141,"他想做都不能做，只怪你给你阿玛太高的帽子了"
141,"来看本宫死的那么多啊！"
141,"啥叫大猪蹄子"
141,"我来绿一波"
141,"充钱的感觉真好"
141,"本宝宝最皮"
142,"祝天下所有的情侣都是失散多年的兄妹"
142,"大猪蹄子你忘了我吗？"
142,"不科学啊，能跪一晚啊，我半个小时就受不了。"
142,"哈都去忙到过七夕了更新都提前了"
142,"傅璎大旗永不倒"
142,"江阴刘尬尬在看吗"
143,"这么多人没去过节吗"
143,"换了和珅来两场都处理的好好的没能力还是没能力啊"
143,"鲍雨薇你个大猪蹄追到这里了吗"
143,"你们都给本宫追起来"
143,"哈哈哈，新电脑看剧最爽了"
143,"还有人记得我吗"
144,"真的蛮同情皇后的大猪蹄子你就不能有自己的主见吗"
144,"我劝自己善良"
144,"无能的人不要去做重要的事了，害人害己"
144,"这个标题本宫不是很感兴趣"
144,"刘三好，你忘记要说好话，做好事，存好心了？"
144,"还有人记得我吗"
145,"善良果然没有好下场"
145,"本宫的杜比音效呢"
145,"更得好辛苦"
145,"我来作妖了"
145,"这是更新的不，不敢相信这么早呢"
145,"皇上最爱我，谁都比不了"
146,"张太枫大猪蹄子看到这了吗"
146,"大猪蹄子，牛🐮郎织女在吃烧烤，咱们去不去啊？"
146,"这叫好人没好报"
146,"七夕是什么东西，本宫还是来热盒饭吧"
146,"佘诗曼真是演的好"
146,"皇上快来看我"
147,"男人都是大猪蹄"
147,"想我高可爱了吗"
147,"光衣服就比其他剧棒"
147,"为什么都叫我大猪蹄子"
147,"七夕追剧就好了"
147,"还是宫廷剧最得我心。"
148,"皇后耳朵好红啊！"
148,"刚刚陪我过完情人节。来追剧"
148,"确实不该杀，皇上我劝你聪明"
148,"我黑化有道理"
148,"为什么没有杜比全声了"
148,"朕的杜比音效哪儿去了"
149,"她阿玛根本就不是愚臣，太善良太正直也是错？"
149,"每天都好准时好棒"
149,"唉，好人不能太老实，这样死得更快。愿好人都机灵点。"
149,"朕还是晚了一步"
149,"佘诗曼演技真的好要是主角多好"
149,"皇后快来领饭了"
150,"充钱的你们好开心"
150,"今天真的好早呀。"
150,"等的好辛苦啊"
150,"令妃没有生孩子是怎么回事？"
150,"各位没有出去过节的宝宝们好啊"
150,"眼睛都红了"
151,"💗七夕得体女孩的大旗举起来！"
151,"为啥没有杜比"
151,"佘诗曼演技真的好，眼睛戏很足"
151,"七夕节都没过，坐等更新"
151,"一天更新十集最开心"
151,"七夕大家都怎么过的呢"
152,"娴妃父亲真的很好啊杀了父亲后她黑化升级是必然的"
152,"我耳朵好红导演来给我去掉两个耳环"
152,"皇后眼睛红了好真实"
152,"今天是皇后娘娘头七"
152,"快了快了尔晴快死了"
152,"想帮你工了吗"
153,"这么清闲的人为啥要做到杀一儆百？不可以找个人代替吗"
153,"娴妃，我劝你老好人是不会有好下场的"
153,"同情皇后是认真的？忘了富察皇后怎么死的了？"
153,"宝宝好辛苦"
153,"做得再好也落不到好下场"
153,"我耳朵好红导演来给我去掉两个耳环"
154,"现实也是如此越实诚越难混"
154,"高可爱走的第n天想她想她"
154,"善良没有好下场的"
154,"此刻说的都是发自肺腑的的"
154,"贤妃说话好温柔"
154,"你们还有杜比音效吗"
155,"皇后耳根子好红啊"
155,"皇后你的耳朵还好吗"
155,"虽然皇后不是东西，但这样听起来她爹还不错"
155,"开心更新了"
155,"好演技眼睛红了"
155,"不听不听，给朕拖出去斩了"
156,"不是善良没有好下场"
156,"好人没好报啊皇上"
156,"这部剧的反派除了尔晴，玲珑，纯妃其他都让人好心疼阿"
156,"我可真厉害"
156,"胡光友是大猪蹄子，你看到了么"
156,"今天不只是七夕，也是是本宫的头七"
157,"眼睛好红啊"
157,"高举傅璎大旗"
157,"考虑到我们很多人不用过节，所以提前跟新了嘛😂"
157,"好人都活不长么"
157,"是不是删了一段皇上去璎珞那里谈这件事的片段啊"
157,"今天我就让你知道什么叫规矩什么叫体统"
158,"眼睛都是红的，细节处理的好"
158,"今天晚上我头发大大方方个好机会跟哥哥v"
158,"聂远这人不诚实，看过上错花轿，那脸也太方了"
158,"皇后我劝你善良"
158,"尔晴54集就死了好开心"
158,"大胆皇后竟敢卖了朕赐给你的东西"
159,"佘诗曼的配音很好听很温柔，语气都很到位"
159,"大猪蹄子你的珠子掉了一颗没看到吗"
159,"皇上衣服的龙是认真的吗"
159,"廖梦萍是大猪蹄子"
159,"这配音好听，，佘诗曼的演技一半归功于配音"
159,"大胆皇后竟敢卖了朕赐给你的东西"
160,"皇后的父亲没有能力。就不要揽这活，忠诚还没杀头"
160,"我才是好人没好报"
160,"闲妃爸真不容易可是也不得皇上的心"
160,"竟然有点心疼皇后娘娘啊"
160,"闲妃这个角色真的棒"
160,"看我苦肉计"
161,"看了这么多集都没掉泪唯独看到娴妃这哭了当真是"
161,"世世代代能有多少代清军入关才多长时间"
161,"人真的不能太老实……这么好的一个人却是这样下场"
161,"大猪蹄子，本宫命令你不要杀那尔布"
161,"真没觉得娴妃演的好语气没有一点波动"
161,"不眨眼睛就会红"
162,"一个人能力不足，再忠良也难担大任，只会害了他"
162,"这个继字刷了本宫好的存在感"
162,"是好人，就是人太好了才会被害啊"
162,"盒饭吃好了，我什么时候再出来一下"
162,"可否一晚多更新几集啊"
162,"不是对所有人都可以善良的😠"
163,"配音声音气息好厉害呀"
163,"好人不长命，祸害活千年啊"
163,"喜欢看大猪蹄子笑"
163,"今天七夕更新早，现在看的都是单身狗🐶😂"
163,"所以说找个长得像的死囚冒充一下"
163,"老娘劝你善良"
164,"嫩个聪明的女人有个嫩个老实的爹"
164,"只是黑化后的贤妃厉不厉害啊"
164,"感觉耳朵坠的好疼啊"
164,"别说了。再说朕流泪要流出来"
164,"我劝大家别善良，好人没好命"
164,"好人不长命，祸害活千年啊"
165,"如果是璎珞，大猪蹄子肯定不会杀她父亲"
165,"哎眼睛好红好心疼"
165,"好想听一下阿佘现场港语版是什么样，配音太好听了"
165,"好人没好报好人不长命啊"
165,"大猪蹄子，又想心软了"
165,"七夕过的好吗爱妃们"
166,"更新好早良心了哦"
166,"那个龙好可爱"
166,"追剧的可有大猪蹄子吗"
166,"举起卫龙大旗永不倒"
166,"细节好评。眼睛很红表示熬了一夜"
166,"立场不同，没有绝对的好人坏人"
167,"娴妃黑化能理解尔晴真不是东西皇后对她那么好"
167,"没有金刚钻别拦瓷器活啊，怪谁呢"
167,"皇后，你父亲这么清廉，你怕不是捡来的吧"
167,"恕我直言，七夕现在还在看剧的多半都是单身狗"
167,"这么老实的爹，怎么生了个这么有心计的女儿"
