time,content
1943,"他这是烤牙还是便宜的那种贵的看不出来"
1943,"啥时候一起跳舞"
1943,"很明显她是挑王爷进宫那天才来看太后的"
1943,"前方高能预警！"
1943,"皇后厉害！这是在利用初恋的美好"
1943,"牛娇娇我劝你善良"
1944,"大龅牙又来祸害人，每次他们都能凑巧相见"
1944,"我怎么这么绿人人都绿我"
1944,"难道大猪蹄子要被和亲王绿了吗"
1944,"看着这鼻孔是真的不舒服"
1944,"为什么尔晴死那么久了富察还不出来"
1944,"都不是什么好东西"
1945,"辉发那拉氏我劝你善良不然可能就是喜塔腊氏的下场了"
1945,"等本宫技能冷却好了一个都逃不掉"
1945,"就是纵欲过度，一看就不是好玩意"
1945,"我就是这么强大……"
1945,"说僵尸牙的放学留下！太有才了！～"
1945,"和亲王是僵尸吗"
1946,"佘诗曼的鼻子好特别"
1946,"本宫的法令纹好重咋办"
1946,"烤瓷牙不错演的好！[得意]"
1946,"又被我利用了，好开心啊"
1946,"魏一生都在为别人报仇而活"
1946,"每次都出现得那么及时"
1947,"和亲王这个牙齿演技太厉害了"
1947,"我大猪蹄子看娴妃是太闲了吧"
1947,"怎么和亲王的戏份这么多，删了吧"
1947,"大猪蹄子，你的头上绿了"
1947,"编剧，安慰和欣慰是不一样的"
1947,"娴妃朕送你去领盒饭🍱"
1948,"说容嬷嬷的，容嬷嬷比皇后大很多好吗"
1948,"和亲王的牙是怎么回事"
1948,"太监都好厉害，肩膀真有劲"
1948,"你们是不是把我忘了"
1948,"魏姐快截了这个大龅牙吧"
1948,"我还有多久出场啊"
1949,"觉得袁春旺长的很顺眼演技也好怎么这么多人diss他"
1949,"本宫什么时候出场？"
1949,"说大猪蹄子的人都是大猪蹄子！💩💩💩💩💩"
1949,"这都多少集了，我怎么还没有出来..."
1949,"实话实说，亲王长的不讨喜啊，太抽象了吧"
1949,"土拨鼠那么乖，他不配"
1950,"白大牙我劝你善良"
1950,"一看到和亲王的大板牙就跳戏"
1950,"就好奇那个雷是怎么劈下来的"
1950,"有人想本可爱吗"
1950,"牙哥不要出来作妖了出来先看看你的大牙"
1950,"你们都惦记着朕的女人"
1951,"本宫是高可爱呀你们都忘记了吗"
1951,"我怎么绿了"
1951,"阿佘好厉害"
1951,"发现了一封信呦"
1951,"头顶吕光太强大"
1951,"都给本宫等着"
1952,"僵尸这个词用的好"
1952,"大猪蹄子你会后悔的"
1952,"话说那些说姑姑是容嬷嬷的，真的是认真看的吗"
1952,"头顶一片绿"
1952,"找这个王爷送那封信？"
1952,"又来勾引王爷了你这妖女"
1953,"绿色好显眼"
1953,"我什么时候才能见到夏雨荷？"
1953,"每次都能那么准"
1953,"主角光环几天就能把佛经搞定"
1953,"看给你能的，嬛嬛的手段你是没见识过，"
1953,"容嬷嬷是皇后的乳母你们都忘了吗？"
1954,"和大牙怎么出现的这么频繁什么时候挂"
1954,"杨宗明就是大猪蹄子"
1954,"以前皇上去看太后璎珞都在。现在皇上都不去看太后了？"
1954,"那个吹头发的你是魔鬼吗"
1954,"王爷长得像不像骷髅。。。"
1954,"我自己都恨我自己"
1955,"难道就不会奇怪？这么相信继皇后"
1955,"这部戏可以换个名字叫动物世界了"
1955,"抬轿子的手都不扶一下吗？"
1955,"可都忘了本宫"
1955,"抬轿的怎么都不用手扶着啊"
1955,"能不能让这个皇后早点回去吃盒饭啊看得难受"
1956,"收好你的牙龅牙哥"
1956,"为什么坏人有私情就能藏得住"
1956,"大龅牙什么时候领盒饭?"
1956,"说加肝素那个别走"
1956,"疯了才会动太后。你们玩的都是太后玩剩下的"
1956,"该我进组了吧"
1957,"大龅牙见到皇后才安生会，在其他人面前又是一副鬼脸"
1957,"什么时候该本帅哥出来"
1957,"真心不喜欢看皇后和这个死王爷！"
1957,"和亲王是个龅牙吗"
1957,"我倒是希望皇后笑到最后"
1957,"你們都忘了我嗎"
1958,"和亲王现代装比古装帅"
1958,"只有我一个人觉得郁太妃和余妃长得很像吗"
1958,"绿是一道光"
1958,"一个个看着都烦"
1958,"只有我觉得吴总馆和和亲王是同一个人吗"
1958,"又是皇后安排的"
1959,"两军对战先把队友都交齐了"
1959,"盒饭热好了"
1959,"大龅牙快死吧"
1959,"被本宫利用的小白"
1959,"娴妃又开始作怪了"
1959,"朕是你们爸爸"
1960,"死这么久还在吊唁？？？？？死一年呀"
1960,"没有办法我就是这么强大哈哈哈哈哈"
1960,"死了这么久了东西还没拿走？？？"
1960,"本宫是要跟和亲王结盟"
1960,"和亲王长得像僵尸🧟‍♀️"
1960,"本宫可不是好惹的"
1961,"怎么这么巧"
1961,"本宫是大猪肘子"
1961,"还记得非常完美的洪尧吗"
1961,"你怎么那么多事"
1961,"也不喜欢这个和亲王"
1962,"人都死了这么长时间了东西还没收拾干净？"
1962,"弘昼我劝你善良"
1962,"这一口大假牙都要包不住了"
1962,"这王爷带资进的剧组吧"
1962,"把娴妃拉出去砍了"
1962,"娴妃什么时候领盒饭"
1963,"每个成功的女人背后都有一个被利用的备胎"
1963,"怎么会有袁春望这角色赶紧领盒饭"
1963,"爱是一道光如此美妙。"
1963,"这个有用被利用了"
1963,"好一个大门牙"
1963,"皇后娘娘切等着"
1964,"大猪蹄子啥意思"
1964,"拉出去都斩了"
1964,"爱是一道光绿到你发慌💥"
1964,"嬛嬛的晚年生活"
1964,"王爷大龅牙"
1964,"又要处幺蛾子了"
1965,"大门牙我劝你善良"
1965,"想念高可爱的好几天"
1965,"皇后这招高！"
1965,"啥时候该我出来造作啊"
1965,"又是一个被利用的人"
1965,"我出来冒个泡"
1966,"土拨鼠劝你善良对待大猪蹄子"
1966,"还有人记得我还在战场吗"
1966,"舒嫔我劝你善良"
1966,"红红火火恍恍惚惚"
1966,"皇后的套路又开始了"
1966,"皇后谁都利用"
1967,"大龅牙太纯了"
1967,"牙哥赶紧领盒饭去吧"
1967,"这袁春忘背叛"
1967,"大家还记得我这个小可爱吗"
1967,"有人想本宫吗"
1968,"又要利用和亲王了"
1968,"这个傻子，太好利用了"
1968,"别说了，没看到人家王爷都不敢笑不敢张嘴说话了😁"
1968,"和亲王好歹是个演员，怎么去非常完美相亲"
1968,"这里面露脸的小太监都是眉清目秀的"
1968,"里面有信吧"
1969,"快绿了皇上"
1969,"大家想我没"
1969,"这个皇后娘娘才心机最深"
1969,"璎珞好厉害👍"
1969,"袁春旺是魏璎珞的一记，还是跟璎珞一伙的，同感的追上"
1969,"又要利用和亲王了"
1970,"爱是一道光"
1971,"突然想高单纯"
1971,"你们不要劝我善良"
1971,"绿是一道光，如此美妙！"
1971,"衣服演得好"
1971,"这个和亲王的牙好像僵尸"
1971,"全程看嘴，只怪太抢镜"
1972,"和亲王我我劝你善良"
1972,"你个大龅牙王爷"
1972,"题目，我劝你善良"
1972,"这智商很快就和我一起吃盒饭了"
1972,"王爷现实装帅的一匹！！！！"
1972,"你们想没想我"
1973,"这娴妃可真是厉害，老是利用别人"
1973,"这个和亲王什么时候领盒饭"
1973,"龅牙到现在还没开始报复璎珞么"
1973,"信让他送了，被利用了"
1973,"又要作妖了"
1974,"皇后心机好重"
1974,"我戏份好少"
1974,"就是皇上也没自由"
1974,"皇后好久才领盒饭"
1974,"信让他送了，被利用了"
1975,"爱是一道光，绿到你发慌"
1975,"张健你还记得本宫吗"
1975,"和亲王不使劲的话，怕是这个牙是包不住的吧？？？？？"
1975,"我啥时候出现啊"
1975,"小太监的眉毛好像为谁拼过命"
1975,"皇后心机好重"
1976,"这哪是龅牙明明就痞痞的那种帅好吧"
1976,"傅恒啥时候回来啊"
1976,"卫龙大旗永不倒"
1976,"没有眼力劲"
1976,"都死了那么多年了，怎么东西还在"
1976,"和亲王不演僵尸真是浪费了"
1977,"刘世昌你个大猪蹄子"
1977,"顺萍什么时候出场呀都56集了还不出来"
1977,"皇上令妃什么时候和好啊"
1977,"王爷要被皇后利用了"
1977,"娴妃每次都用这种手段看腻了"
1977,"这个王爷要被我利用了"
1978,"这里面的计划怎么都没有意外的？"
1978,"果然好心机"
1978,"开始作妖了"
1978,"我什么时候出场"
1978,"它以前在非常完美后面还牵手了一个女嘉宾"
1978,"快吃盒饭去吧"
1979,"容嬷嬷是皇后的乳娘，珍儿是丫鬟，年龄相差那么多"
1979,"我好厉害啊"
1979,"这就是那个更合适的人"
1979,"还是本宫最可爱"
1979,"真是好心机"
1979,"我段位这么高啊"
1980,"高贵妃：🈶️没🈶️想我高可爱"
1980,"好想高可爱"
1980,"嘴和鼻子都是缝出来的吧"
1980,"牙亲王，我劝你善良"
1980,"这皇后算计的整个皇宫的人都能为己所用"
1980,"有木有人想我呀"
1981,"谁的盒饭已经热好了，赶紧来吃啊"
1981,"怎么被雷劈一直没讲是不是现在要出现了让王爷报仇"
1981,"王爷被利用得很开心"
1981,"绿的你发光"
1981,"袁春望后面是被仗杀的好像。"
1981,"很好，一起作吧"
1982,"贤妃是怎么算的时机都刚好的"
1982,"包袱里有猫腻，大猪蹄子，你要小心了"
1982,"大家都厉害啊都能猜的到剧情吗"
1982,"盒饭已经吃完了好香啊"
1982,"涂源清你个大猪蹄子"
1982,"我还想回来"
1983,"死一个妃子的话就要留一间房，这么多代下来该咋办？"
1983,"袁春望不是间谍，他就是变坏了"
1983,"我觉得袁春旺由何炅扮演估计好玩"
1983,"一起吃盒饭吧"
1983,"作这部剧的人心机才最深呐"
1983,"死了那么久了还有旧物"
1984,"尔晴死得太简单太轻松了吧"
1984,"朕也支持傅璎CP，大旗举起(´･Д･)」"
1984,"皇后很厉害啊，我觉得不错"
1984,"就我最厉害"
1984,"高贵妃走了也不放过她们。让她们斗来斗去，误会了皇后"
1984,"王爷，被算计了！"
1985,"令妃心机手段太深皇后只是为了报杀父之仇"
1985,"大猪蹄子对我好点"
1985,"我好想高贵妃和先皇后还有纯贵妃"
1985,"侧面长得好像马"
1985,"死了，那麼久才收拾舊物"
1985,"还是本宫最单纯"
1986,"烤瓷牙你的盒饭热好了"
1986,"这集我大猪蹄子休息啊"
1986,"各着你们几个想太后让你们吃盒饭的时候带上和亲王呀"
1986,"娴妃你利用了所有人，果然厉害"
1986,"感觉和亲王每次都来吊唁裕太妃，都不能换个理由啊"
1986,"高贵妃走的好多天，想她想她"
1987,"什么叫做女人成功都得靠男人男人不是女人生的吗"
1987,"知道本宫的好了吧"
1987,"还真的想高可爱了"
1987,"这皇后太厉害了叭"
1987,"太多人帮皇后了"
1987,"本宫天下第一美"
1988,"这大板牙怎么还不死啊"
1988,"本宫劝你们善良"
1988,"2倍速是个好东西"
1988,"我太厉害了"
1988,"皇后，太妃，死了才留着，高贵妃就没留啊"
1988,"什么叫做女人成功都得靠男人男人不是女人生的吗"
1989,"和亲王是最好的人选，这届冠军厉害"
1989,"现在你们知道我多可爱了吧"
1989,"都死这么久了，现在才收拾旧物啊"
1989,"本宫才是这宫里最单纯的宝宝"
1989,"这个王爷是楚乔传里一个人的哥哥"
1989,"娴妃，下来陪本宫吧，听说你是王者，带带我这个青铜"
1990,"小太监比王爷帅多了"
1990,"啥时候再来个人来陪陪本可爱"
1990,"这封信由大钢牙去送是吧！"
1990,"我鼻子好大"
1990,"这是兔牙。大板牙不是这个样子"
1990,"和亲王真是一把好枪"
1991,"王爷自以为聪明其实一直被利用"
1991,"！真佩服古人的智商，算的真准"
1991,"皇后的段位真是不一般呐"
1991,"还是本宫可爱的。"
1991,"皇后身边小人多"
1991,"本宫给和亲王发盒饭"
1992,"只有我觉得裕太妃和愉贵人长得很像吗"
1992,"就是他强了我姐姐！"
1992,"本来太后就不是皇上的亲母"
1992,"还是我可爱"
1992,"历史上的令妃长的就是像吉娃娃"
1992,"刷下存在感"
1993,"感觉算计人一算一个准"
1993,"本宫是编剧，计划会有意外？"
1993,"满满的套路，算的刚刚好"
1993,"来吃盒饭啊盒饭超好吃的"
1993,"本宫劝你们善良"
1993,"谁有我厉害"
1994,"一开始就觉得袁春望不是个好东西，"
1994,"想高可爱的第一天"
1994,"高贵妃的计划不就全是意外"
1994,"现在想想还是本宫善良啊"
1994,"傅恒太久没出来啦"
1994,"娴妃我劝你善良"
1995,"这样一比高贵妃太嫩了"
1995,"大板牙我劝你善良"
1995,"皇后厉害啊"
1995,"作也这么多人看到70集"
1995,"我发现古代人做路子都是一流的，随随便便就心想事成！"
1995,"我劝你善良"
1996,"世世代代相传世O世u头发剪了头发长了好多好多话语法"
1996,"高可爱走的nnn天，想她，想她，想她，想她"
1996,"后宫就没有单纯的好吧，单纯的活不活一集"
1996,"想高可爱了"
1996,"大猪蹄子忘了本宫了吗"
1996,"想本可爱了吗"
1997,"发送的内容不能为空哦！"
1997,"玉龙大旗我来扛"
1997,"无巧不成书啊"
1997,"大猪蹄子你等着"
1997,"这太妃都死这么多年了，房间还留着？"
1997,"僵尸脸越看越不顺眼"
1998,"袁春望也从来没好过呀，他对璎珞好也不代表是个好人啊"
1998,"和亲王倒也是个孝顺儿子"
1998,"历史上的弘昼和这人长得挺像"
1998,"袁春望你看今天盒饭有鸡腿哎快来吃啊"
1998,"娴妃在后宫杀的人最多"
1998,"朕头上有点绿"
1999,"皇宫有那么多院子吗？死了还要占着地方？"
1999,"像害太后，太后有我护着呢"
1999,"皇后好心机啊！利用和亲王"
1999,"剧里。人越来越少我更加好不习惯好希望和和睦睦的"
1999,"本宫想闲妃了"
1999,"和亲王，智商堪忧啊"
2000,"你生个儿子母凭子贵也算靠男人"
2000,"春望，本宫劝你善良"
2000,"说袁春望演技好的该看眼科了吧，从头到尾装酷"
2000,"我就是这么厉害。"
2000,"王爷是凤囚凰里面的桓远才记起来一直没记起来是什么远"
2000,"让我复活！让我复活！和亲王我还没上呢！"
2001,"这个皇后才是演的好"
2001,"还是高贵妃可爱"
2001,"皇后放了一封信在理面"
2001,"还不让我出来？我吃饱了！"
2001,"皇后这是要用和亲王对付太后啊"
2001,"本宝宝才是笑到最后的人"
2002,"想高可爱的第二天"
2002,"一直觉得袁春望没好过"
2002,"蜡烛演的好"
2002,"本宫不可爱嘛"
2002,"好想看王爷大笑仔细看看他的牙"
2002,"还是我最善良"
2003,"这帮大猪蹄子没一个好东西"
2003,"袁春望最后好像被杖毙了"
2003,"因为太了解对手了，所以事情都计划的顺利，这才叫手段"
2003,"啦啦啦哈哈哈😄我最厉害"
2003,"大板牙演的好啊"
2003,"想本宫唱的戏了吗"
2004,"都是太后了，还一天操心后宫的事，都那么大年纪了"
2004,"娴妃虽然是大反派，但是本宫不得不说，她真的太聪明了"
2004,"璎珞好可爱"
2004,"本宫比起他们已经够纯洁了"
2004,"裕太妃和愉贵人长得好像啊"
2004,"袁春望我劝你善良"
2005,"尔晴死的第二天开心开心开心"
2005,"我还没出场"
2005,"大板牙我劝你善良"
2005,"弘昼也挺帅的"
2005,"领子上都是汗演员是真遭罪"
2005,"哥，我们绝交"
2006,"和亲王啊，和亲王，我劝你善良对待大猪蹄子"
2006,"娴妃，盒饭热好了你啥时候来啊"
2006,"一个坏事做尽的人为什么还安个地方祭拜"
2006,"我什么时候能出来"
2006,"我只想看傅恒和璎珞,傅璎女孩用不倒。"
2006,"令妃性格我喜欢"
2007,"想高可爱的第三天"
2007,"为什么高贵妃叫高可爱啊？"
2007,"晚晚咋活到现在的"
2007,"活该以为所有的妃子不在了你就得势了还有太后压着你嘿"
2007,"爱是一道光，绿到你发慌"
2007,"这个王爷也不是什么好东西😓"
2008,"尔晴走的第一天，开心开心"
2008,"哭唧唧还是我最单纯"
2008,"精精你看到这了吗"
2008,"高贵妃走的第n天，想她想她想她"
2008,"突然好想念高可爱"
2008,"没有我作妖你们还习惯吗"
2009,"人活着的时候都没见到你来的这么勤"
2009,"本宫没你也挺好"
2009,"牙精我劝你善良"
2009,"听说你们想高高了"
2009,"你们一个个的看电视看演技就行了非要看什么牙"
2009,"呵呵你家能装下就na回去吧"
2010,"想高可爱的第三天"
2010,"这么多年了，现在才来收旧物，还挂着白幡，太不合理了"
2010,"都死了那么久不把旧物拿出来，现在拿？套路！"
2010,"爱是一道光"
2010,"皇后是宜修的侄女，太后之前还叫皇上封她做皇后"
2010,"你算哪根葱"
2011,"说乾隆生母有异议的怎么不想想雍正的为人处事作风"
2011,"大钢牙，我劝你善良"
2011,"说皇后好的忘了小燕子了"
2011,"本可爱突然出现"
2011,"历史上和亲王是一个很聪明的人"
2011,"你跟朕一样热啊"
2012,"别怪皇后，在深宫不算计能活么，谁还不是各怀鬼胎"
2012,"高贵妃怎么推皇后的都忘了吗？想她的真是有趣"
2012,"裕太妃和愉贵人长得一摸一样的"
2012,"他就是本宫用来送信的人"
2012,"满满都是套路"
2012,"本宫坏的比她门明显多了"
2013,"皇后可以去打职业了，巅峰赛已经不能体现你的水平了"
2013,"你看给王爷热的"
2013,"活该死掉，这娘俩没好东西"
2013,"我可真是个小机灵鬼"
2013,"裕太妃被雷劈的真正原因好像一直没说吧"
2013,"袁春望往我对你这么好你竟如此对我"
2014,"大龅牙僵尸脸其实气质不错"
2014,"想我高可爱了没"
2014,"总觉得太妃跟愉妃长一样"
2014,"不理她们，高妹妹咱们继续打，唉！胡了"
2014,"和亲王之前都是在相亲节目上混脸熟的"
2014,"弘昼本宫劝你善良"
2015,"谁说他帅的长得跟骷髅头一样什么眼光"
2015,"本宫也没害过闲妃，还不是照样害我"
2015,"前皇后高贵妃真是走的太早了想念想念"
2015,"你个大猪蹄子胡说什么"
2015,"想想八国联军侵华战争时拿走了多少宝贝"
2015,"一看就不是好东西"
2016,"新人进宫还有地方住，厉害了"
2016,"爱是一条光，绿的让人发光"
2016,"本宫的旧物这么久才收拾？"
2016,"朕都没钱做烤瓷牙"
2016,"都是大傻子"
2016,"我什么时候可以出来"
2017,"这皇后好深沉的心机啊"
2017,"本可爱出来刷下存在感"
2017,"看起来很热啊，领子都是汗"
2017,"本宫想大猪蹄子了"
2017,"皇宫都是戏精"
2017,"我看到这里了，大猪蹄子"
2018,"大猪蹄子我劝你善良"
2018,"本宫善良盒饭也是领的最早"
2018,"大龅牙请善良"
2018,"想我高单纯了没有"
2018,"都死那么多年了，现在才拿旧物"
2018,"真正开挂的是本宫啊"
2019,"很好奇这个牙是怎么做的，要把自己的真牙全拔了吗？"
2019,"其实红杖这是个大猪蹄子"
2019,"看这些演员出的汗真的是不容易啊"
2019,"闲妃我劝你善良"
2019,"这个大龅牙王爷怎么还不领盒饭，神烦"
2019,"小样儿，原来你也是大猪蹄子"
2020,"衣领是被汗水打湿的吗"
2020,"裕太妃，愉贵人，不仅长得像，名字音都一样"
2020,"爱是一道光绿到你发慌"
2020,"盒饭味道不错"
2020,"袁春旺完全是多余人物"
2020,"不听不听王八念经那个请留步"
2021,"不得不说过去那个朝代的人都很孝顺，后代值得学习啊"
2021,"我劝你们都善良"
2021,"门牙好大啊"
2021,"真不是不宠着你，是因为还要宠着令妃呢"
2021,"弘昼也是个可怜人，一片真心从头到尾被利用"
2021,"皇后走的第n天，想她想她"
2022,"王爷衣领是湿的吗"
2022,"爱是一道光绿的你发慌"
2022,"皇后每次处于困境都能遇到和亲王"
2022,"我变透明了？"
2022,"1.5倍才是正常速度"
2022,"周一要更新了"
2023,"这这个柜子好神奇啊"
2023,"本少爷好久没出来蹦哒了，不开心"
2023,"庆幸没生在那个年代，否则活不过一集"
2023,"辉发那拉氏快来呀王者五排就差你了"
2023,"算得这么准"
2023,"本宫何时出来，快放了本宫……"
2024,"尔晴死的太简单看着不过瘾"
2024,"这匣子演得不错"
2024,"和亲王下巴上有个洞，是唇钉吧"
2024,"吓我一跳我还以为棺材板压不住开了"
2024,"这个套路太深了"
2024,"顺嫔还不出来"
2025,"裕太妃在的时候也没看你多孝顺"
2025,"为什么叫我大猪蹄子？求解"
2025,"感觉王爷挺帅的啊，你们是不是都长得像吴彦祖金城武一"
2025,"裕太妃的死是她自己活该"
2025,"这个机关也太随意了吧"
2025,"本宫快要发霉了"
2026,"柜子演的好啊柜子演得好"
2026,"其实皇上就是个大猪蹄子"
2026,"这个地方演的有点过，演员不该这么急着打开"
2026,"还是我最单纯可爱"
2026,"根本不想看到这个闲妃"
2026,"姐在攒能量，大家耐心等两天"
2027,"和亲王好孝顺哦"
2027,"柜子演的好"
2027,"妈也说实话吓我一跳"
2027,"全剧最出色的牙"
2027,"门演得好…"
2027,"几集出来啊"
2028,"这大板牙也是个笨蛋"
2028,"你们快来盒饭很好吃的哟"
2028,"算准了会坐床？"
2028,"什么东东？"
2028,"和亲王被利用的很开心"
2028,"柜子演的好"
2029,"王爷的领子湿得不均匀"
2029,"土拨鼠，我劝你善良对待大猪蹄子"
2029,"他孝顺和他是个混蛋没有一点关系"
2029,"算准了你要坐床头"
2029,"大龅牙准备领盒饭了"
2029,"这大板牙也是个笨蛋"
2030,"原来是皇后放的信。借和亲王这个蠢货的手交给皇上真毒"
2030,"高可爱突然出现"
2030,"信封演的好"
2030,"你的女神利用你哦王爷小心"
2030,"这么那么巧"
2030,"机关演的太棒"
2031,"放的好明显的信"
2031,"床头柜演的十分到位"
2031,"那个大神能告诉我开了杜比音效有什么区别吗"
2031,"这也太巧了吧！"
2031,"皇后一直利用大白牙"
2031,"原来是皇后放的信。借和亲王这个蠢货的手交给皇上真毒"
2032,"好明显，就怕人看不见哈哈"
2032,"大板牙太监的鼻孔演的好哦"
2032,"高贵妃才是最阔爱的"
2032,"柜子演的好，有赏"
2032,"这柜子演的好"
2032,"这信演的好"
2033,"恍恍惚惚皇后下得一手好棋"
2033,"皇后，我劝你善良"
2033,"机关演的好"
2033,"我不知道你是怎么了"
2033,"柜子演的好啊"
2033,"床头柜演得好！"
2034,"想念高可爱唱的戏了"
2034,"果然是合适人选"
2034,"放这么明显，这剧情好严谨啊"
2034,"还是我最单纯"
2034,"皇后算准了他会坐那个凳子？"
2034,"还是有遥控器的？"
2035,"好高级，自动开"
2035,"哇…好巧啊…"
2035,"一看就是故意放的，那么明显"
2035,"肯定和袁春望有关系"
2035,"柜子演的好"
2035,"啥时候出来"
2036,"这么重要的信随便放柜子里"
2036,"皇后太厉害了吧厉害的有点害怕"
2036,"这机关设得真好"
2036,"柜子演的好"
2036,"柜子我劝你善良"
2036,"皇后聪明啊"
2037,"算的这么准，他会做床边发现这封信"
2037,"太后要倒台了"
2037,"话说顺妃什么时候上线呢，这眼看就完事了。"
2037,"这纸好新啊"
2037,"算得这么准，可以为我算一卦吗"
2037,"好手段！好手段！"
2038,"好开心希望太后领盒饭"
2038,"要想京城混的好，投胎必须投的好"
2038,"觉得和亲王的牙就像僵尸的牙一样要使劲努嘴才能藏起来"
2038,"还以为会当面给呢，结果……娴妃套路深啊"
2038,"继皇后真是好手段"
2038,"这个柜子演得好，吓本宫一跳"
2039,"你再智慧最后还是活不过大猪蹄子"
2039,"你们快来哦！盒饭好好吃😋"
2039,"一看就是陷阱，这么重要的东西就大摇大摆的放在这里"
2039,"我真是个小机灵鬼👻"
2039,"好随意的摆放"
2039,"皇后放的肯定，心机太深"
2040,"信里有那么大的秘密就放在这么容易看到的地方？？"
2040,"娴妃给你厉害的，你等着"
2040,"心疼演员，大热的天气穿那么多"
2040,"阿牙呀阿牙，你可长点儿心吧"
2040,"这柜子演的好"
2040,"机关演的好"
2041,"不巧，和亲王看得到吗"
2041,"我放大招了嘻嘻"
2041,"信封演的好"
2041,"我有主角光环"
2041,"凳子演的好"
2041,"我还会魔术"
2042,"所有东西都收拾走了，就剩一封信，也太明显了吧"
2042,"想我高可爱了吗？"
2042,"和亲王眼睛长针眼了吧"
2042,"这抽屉演得好"
2042,"柜子演的好"
2042,"我劝我善良"
2043,"这一看就是故意放的好吗"
2043,"这纸演的好"
2043,"无巧不成书"
2043,"这床演的好"
2043,"王爷该领盒饭了"
2043,"想容音了嘤"
2044,"袁春阳这角色好多余"
2044,"还是本高可爱最单纯"
2044,"这信演的太好了"
2044,"本宫设计的，厉害吧。"
2044,"大僵尸被利用了"
2044,"上届冠军要遭殃了"
2045,"皇后心机好深"
2045,"柜子演的好！"
2045,"嬛嬛可不是好欺负的辉发那拉氏你等着"
2045,"和亲王演僵尸都可以不用化妆来着！"
2045,"这个柜子演的好"
2045,"你们想本宝宝了吗"
2046,"大板牙演得好"
2046,"爱是一道光如此刻美妙"
2046,"皇后好厉害"
2046,"知道本宫的厉害了吧"
2046,"我发现她们虽然用计但是怎么可能每次都那么巧，真的是"
2046,"柜子演得好"
2047,"袁春望会不会是璎珞扳倒皇后最后一步啊"
2047,"纯属被人卖了还给人数钱的傻蛋啊"
2047,"这纸演的好"
2047,"柜子的演技真好"
2047,"这柜子演的好"
2047,"孩子你被利用了"
2048,"你看的会不会太快了"
2048,"还是自动打开，不要闹好伐"
2048,"信封演的好"
2048,"确认过眼神是要造反的人"
2048,"后天才更新，明天怎么活啊"
2048,"这也能算准？"
2049,"他下嘴唇有个洞，是打了唇环吗"
2049,"把你厉害的"
2049,"龅牙演的好"
2049,"好一招釜底抽薪"
