time,content
720,"这孩子才多大呢就这么叨叨了"
720,"脑壳疼,脑壳疼"
720,"你不是皇后养大的吗，白眼狼"
720,"五唐生就不要再念了"
720,"魏姐孩子都是活在台词里😂"
720,"又开始了，脑阔疼"
721,"蛙哥跟璎珞太可爱了吧"
721,"我怎么这么可爱"
721,"璎珞服装造型没点变化，还是丫鬟样"
721,"本宫听不下去了，能逃走么"
721,"哈哈哈哈哈哈五阿哥真可爱，又念经了"
721,"这孩子才多大呢就这么叨叨了"
722,"心思那么深的人又这样的天真"
722,"永琪好可爱"
722,"这不嫁对了人，就越活越年轻么"
722,"不听不听王八念经！本宫要吃粽子😋"
722,"本宫听不下去了，能逃走么"
722,"唐僧又附体了，我怕了怕了"
723,"你自己去学个够好了"
723,"本宫带你逃课好吗蛙哥憋说了"
723,"三个孩子活在台词里，这剧真是敷衍"
723,"哈哈哈，永琪好可爱!"
723,"唐僧附体的蛙哥"
723,"永琪好可爱"
724,"哎呀妈呀，脑阔疼，脑阔疼！哈哈哈"
724,"这是永琪吗？是唐三藏走错片场了吧？"
724,"这个五阿哥好可爱我稀罕"
724,"惹不起惹不起怕了怕了"
724,"永琪历史上活到20多岁就死了"
724,"本宫带你逃课好吗蛙哥憋说了"
725,"这个永琪好可爱哈哈"
725,"五阿哥的头好大"
725,"好一个碎碎叨的五阿哥"
725,"永琪太可爱了我爱了"
725,"哇哥头有点大啊"
725,"哎呀妈呀，脑阔疼，脑阔疼！哈哈哈"
726,"蛙哥头好长"
726,"五阿哥不容易啊，刚出生就差点儿被本宫活埋了"
726,"五阿哥喜欢小燕子不是没理由的令妈妈这么闹腾"
726,"我媳妇真可爱"
726,"五阿哥的头好大"
726,"好一个碎碎叨的五阿哥"
727,"蛙哥情商好高啊"
727,"永琪长得好像我大学班主任啊"
727,"永琪脑壳好可爱"
727,"我可不想多一位娘了"
727,"永琪的脑袋好大"
727,"头真大看着真是奇怪"
728,"我觉得乾隆是把自己孩子的寿命都活了"
728,"哇哥脑门好大"
728,"这个头好大呀"
728,"赫连景这个发型也是帅的"
728,"还没儿子懂事"
728,"永琪脑壳好可爱"
729,"永琪的头好大啊"
729,"永琪，为什么你的牙也这么大"
729,"好可爱的妃子"
729,"来人啊，本宫的耳环掉了一个"
729,"永琪好可爱啊，碎碎念哈哈哈哈！"
729,"“不想听你念”永琪：“不,你想”"
730,"五阿哥好大的头"
730,"哎呀妈呀，脑瓜疼。五阿哥是唐三藏的化身吧！"
730,"永琪好可爱"
730,"你是唐僧转世吧，话这么多"
730,"不愧是亲爷俩"
730,"也就你能治住本宫了"
731,"蛙哥好可爱"
731,"俺儿子好可爱！蛙哥！哈哈😄"
731,"魏璎珞头上的电话演得好"
731,"永琪衣服都湿脖子了"
731,"打了袁春望就可以杀青了…剩下的看还珠格格就行了…"
731,"不愧是亲爷俩"
732,"别急，该立储了，有热闹的时候"
732,"就是要带儿子逃课"
732,"关键还是容音走得早，不然八国联军进不来"
732,"我不是你娘，你是我爹"
732,"好懂事，好感人"
732,"魏璎珞头上的电话演得好"
733,"永琪的头是被令母妃气大的"
733,"有耳机就好了本宫要听歌不要听你唠叨"
733,"璎珞就是被皇上和儿子给宠成了孩子啊"
733,"永琪才是我妈"
733,"璎珞也有怕的人了，五阿哥"
733,"别急，该立储了，有热闹的时候"
734,"脑壳疼脑壳疼哎呦妈呀一见永琪脑壳疼"
734,"五阿哥好可爱"
734,"流殇厉害了，就一唐僧附身"
734,"本宫感觉我儿子像我哥一样"
734,"我说这哇哥怎么这么眼熟"
734,"本宫怎么只有两个耳环了"
735,"主角没光环是个锤子主角呦"
735,"越老越可爱啊"
735,"要是五阿哥当皇上就好了"
735,"你赶紧走吧这很魏璎珞"
735,"哈哈，好可爱"
735,"脑壳疼脑壳疼哎呦妈呀一见永琪脑壳疼"
736,"苏有朋现在年纪太大了怎么能演五阿哥"
736,"本宫最可爱"
736,"永琪好热呀"
736,"五阿哥是小景吧！萌妻里面的"
736,"天啊好唠叨"
736,"哈哈，好可爱"
737,"五阿哥真的好唐僧啊"
737,"快做快走赶快走"
737,"为什么公主和十五阿哥还没出现啊想一睹芳容"
737,"一走就出事儿"
737,"带着儿子逃课"
737,"难怪永琪喜欢小燕子"
738,"这个五阿哥在萌妻食神里面的扮相帅多了"
738,"五阿哥是不是大龅牙的孩子。。。"
738,"脑阔疼，脑阔疼"
738,"五阿哥就是遇上小燕子才没当上皇子吧"
738,"蛙哥那是超次元偶像选出来的。不是二次元偶像哈哈哈哈"
738,"五阿哥真的好唐僧啊"
739,"后面删的太多了。剧情都不连贯了"
739,"当初救五阿哥的时候，怎么就不知道这货这么唠叨呢"
739,"左下角有只白毛鸡🐔"
739,"不听不听永琪念经"
739,"被宠着的女人就是可爱😂"
739,"本宫亲自把它们解决掉"
740,"哇永琪的头真长啊！"
740,"五阿哥你的小燕子去哪了？去找你的小燕子吧"
740,"让公主太后也出来看看啊"
740,"你赶紧走吧"
740,"不听不听永琪念经"
740,"本宫亲自把它们解决掉"
741,"永琪是吃三鹿奶粉长大的吗"
741,"都是本宫的粽子糖"
741,"十五阿哥长大以后是皇上哈哈"
741,"哎，璎珞也有白头发了……"
741,"本宫亲自吃光光……"
741,"师傅，快别念了"
742,"蛙哥你不热吗"
742,"永琪你嘴巴'真大"
742,"这些人为了演这部戏都打了好多耳洞啊"
742,"五阿哥你是属“长颈鹿”的嘛？"
742,"都是本宫的粽子糖"
742,"本宫亲自吃光光……"
743,"永琪的头会不会很重"
743,"突然好想高贵妃皇后明玉她们感觉要是一起会很有趣"
743,"令菲妃没生孩子前和生孩子后是两个人"
743,"本宫全部自己拿着吃"
743,"越来越觉得璎珞能装了"
743,"本宫亲自吃光光"
744,"是妈以前教的好"
744,"本宫是不是很可爱"
744,"好可爱啊，璎珞"
744,"明玉在就好了"
744,"五阿哥的的脑袋真大真亮"
744,"我儿子咋变成唐僧了"
745,"你们没有发现永琪头好大吗？"
745,"这儿子比老娘厉害啊"
745,"算是看明白了令妃始终就一招欲擒故纵难怪死的早"
745,"有些人表面上是十五阿哥，背地里还是流觞。"
745,"恭喜你多了个新妈"
745,"好可爱啊，璎珞"
746,"永琪：妈，我怀疑你会私吞，我妹和我弟一样都捞不到"
746,"哈哈哈本宫好可爱"
746,"本宫亲自把那些好吃的粽子糖塞进肚子里！😂😂😂"
746,"要是明玉走就好了"
746,"骗你的，本宫一会就全吃光了"
746,"恭喜你多了个新妈"
747,"这个跟上一次是一个时候拍的哦，五阿哥衣服湿的一样"
747,"我儿子话可真多"
747,"三个太重了，戴两个吧"
747,"人呢，都给朕出来"
747,"永琪：妈，我怀疑你会私吞，我妹和我弟一样都捞不到"
747,"要是明玉走就好了"
748,"本宫一定会亲自吃光全的，放心"
748,"不赶你走本宫怎能亲自吃掉这些礼物"
748,"好可爱啊璎珞"
748,"本宫打算自己全吃下"
748,"五阿哥走了以后，令妃会不会偷吃七妹的粽子糖"
748,"这些礼物留下本宫要吃！！"
749,"五阿哥是不是双是宠妃的流殇啊"
749,"我还想多活几年，陪陪我大猪蹄子，你快走吧"
749,"这个五阿哥还挺嫩"
749,"我怎么这么可爱，这么可爱怎么办"
749,"永琪这岁数是该遇到小燕子了吧"
749,"本宫一定会亲自吃光全的，放心"
750,"突然发现皇后没领盒饭是因为没和璎珞正面对过"
750,"如果知道会受伤你会不会就拦着说啥也不让他去了"
750,"幸福，幸福"
750,"哈哈，快走吧，本宫要开始吃糖🍬啦"
750,"不像母子像情侣"
750,"哈哈哈这下全部都是本宫的了！！！"
751,"没事的时候你们多看点历史，真是醉了"
751,"明玉在就更好了"
751,"五阿哥好高"
751,"等你走了我就把它们吃掉了哼"
751,"突然发现皇后没领盒饭是因为没和璎珞正面对过"
751,"哈哈，快走吧，本宫要开始吃糖🍬啦"
752,"人生如璞玉,不争就是最大的争"
752,"耳环怎么变两个了"
752,"璎珞好可爱"
752,"耳环明明有三个"
752,"岁数大了还是不稳重啊"
752,"璎珞这十年生活得很幸福"
753,"好可爱啊这对哈哈哈永琪有孝心啊愉妃还在多好啊"
753,"本宫亲自帮他们吃掉"
753,"越优秀越要遭来杀生之祸"
753,"感觉1.5才是正常的速度"
753,"永琪：哎，我令母妃不爱我了"
753,"璎珞好可爱"
754,"珍珠竟然活了那么久"
754,"本宫生了4个儿子两个女儿厉害吧"
754,"疯跑你是认真的吗"
754,"我儿子真好"
754,"明玉在就好了本人念旧啊"
754,"好可爱啊这对哈哈哈永琪有孝心啊愉妃还在多好啊"
755,"璎珞好可爱"
755,"最后五集逗逼了。。。"
755,"怎么年龄大了，画风还如以前一样"
755,"唐僧一样的永琪和小燕子在一起，可爱啊"
755,"怪不得五阿哥喜欢小燕子，原来受了令妃的影响"
755,"要是明玉在就好了"
756,"不减这么多剧情就好了"
756,"小燕子，你在哪？快来救我，哈哈"
756,"要是这个时候明玉在多好啊"
756,"越活越回去了😁"
756,"还好带跑了两年病好了，要不然又该夭折了"
756,"怎么年龄大了，画风还如以前一样"
757,"看到5阿哥好热啊，衣领都湿透了"
757,"撒糖真开心"
757,"五阿哥是不是小时候三鹿奶粉喝多了?"
757,"有一个是戴的圈仔细看"
757,"嘉庆皇现在都还没上过镜"
757,"格格咋还不出场"
758,"穿上这鞋侧面看起来鞋幽灵"
758,"真好吃😋"
758,"永琪还是输在太老实了"
758,"糖糖哈哈哈哈吃完呐。。。"
758,"佳妮佳妮也是怕怕"
758,"五阿哥真好。。哎"
759,"二倍看着超喜感超温馨啊"
759,"皮一下很开心"
759,"好像看看两个女儿的样子"
759,"你们眼睛有问题"
759,"璎珞的孩子怎么没露过脸"
759,"不喜欢现在的魏璎珞好作做"
760,"这么多男人宠"
760,"瞅你那爱吃样"
760,"感觉看还珠格格的时候令妃没有那么皮啊……"
760,"想吃粽子糖呢～"
760,"这个时候明玉在就好了…"
760,"笑死寶寶了後面這幾集怎麼那麼逗哈哈"
761,"魏璎珞真的有点任性其实为人母了也不改一改性格"
761,"帮我儿子和女儿加多两场戏行不"
761,"偷吃孩子的东西真的强"
761,"指甲那么长，不怕戳到嘴啊"
761,"皇后不是说了吗，想吃什么就吃什么，想玩什么玩什么"
761,"感觉看还珠格格的时候令妃没有那么皮啊……"
762,"永琪不能有事啊，还得等他拍还珠呢"
762,"朕的魏璎珞越看越美"
762,"庆妃露个脸啊"
762,"妈呀慢点别戳到嘴巴呀"
762,"吃粽子糖的表情绝了"
762,"偷吃孩子的东西真的强"
763,"多大年纪了都"
763,"看本宫装可爱装得多好"
763,"我家今天买了大猪提子"
763,"永琰怎么还不出来"
763,"以前还不这样呢岁数大了卖萌反而不适应"
763,"嬷嬷是三个，表示资历老吧"
764,"璎珞好可爱哈哈五阿哥也可爱"
764,"好想明玉嘤嘤嘤"
764,"珍儿的耳坠都是三个"
764,"孩子真的是亲生的吗"
764,"怎么是两个耳环了"
764,"好想念明玉哇"
765,"想明玉了，明玉要是还在该多好呀!"
765,"我可爱死了"
765,"令妃活的很洒脱"
765,"啊红红火火恍恍惚惚"
765,"耳环值钱我拿了一个去当了啦"
765,"年龄大了这样就觉得过了"
766,"佳妮佳妮也是怕怕那个配的不错笑死了"
766,"格格快出来，好想看看长啥样"
766,"珍珠怎么也带三个了啊,大宫女不也是一个嘛"
766,"本宫的耳环是三个，只不过挤一起了"
766,"珍珠这头饰衣服比明玉多……我去"
766,"令妃活的很洒脱"
767,"演技明显好了很多o"
767,"本宫的璎珞就是可爱"
767,"我就知道你会昧下…一天天成何体统"
767,"惊不惊喜，，意不意外😂"
767,"如果明玉在。就完美了"
767,"妈耶想吃糖"
768,"明月在该多好啊"
768,"朕还有3秒到达，吃的都给你吃光！你等着"
768,"珍珠好幸福啊"
768,"和孩子抢吃的"
768,"难怪五阿哥喜欢小燕子原来照着令妃的样子找的呀"
768,"我就知道你会昧下…一天天成何体统"
769,"还珠格格是琼瑶写的好吗！能当参照物吗？"
769,"本宫眼睛够大吧"
769,"后面的剧情好水阿"
769,"还记得本宫吃的藕粉丸子吗？"
769,"我左右各三个有四个是自己用银针穿的😂真的"
769,"和孩子抢吃的"
770,"剧情虽有点夸张，是为了显示她和皇生活方式，很温馨"
770,"永琪好暖啊，好喜欢"
770,"珍珠好温柔！"
770,"珍妮珍妮偷吃糖了吧"
770,"珍珠一笑很可爱"
770,"小燕子去哪了？快把五阿哥带走吧，唐僧"
771,"哎呀哎呀脑瓜疼脑瓜疼"
771,"高可爱不在的n天，想她想她想她"
771,"不是说一个耳环是宫女三个是嫔妃吗"
771,"哇哥要出事了"
771,"永琪好暖啊，好喜欢"
771,"珍珠好温柔！"
772,"珍珠看起来好温柔"
772,"葡萄真好吃"
772,"奶盐吃糖真心可爱炸了"
772,"蛙哥你耍我"
772,"哇哥真贴心"
772,"哇哥要出事了"
773,"被宠成公主了，好幸福"
773,"唉要是现在明玉在该多好"
773,"为什么觉得五阿哥和令妃也好甜"
773,"珍珠好慈祥，哈哈"
773,"明玉要是还在就好了"
773,"耳环是三个好吗"
774,"带三个耳环重死了😔打耳洞好疼的"
774,"喜欢珍珠，温柔可爱"
774,"这个糖好像很好吃的样子"
774,"小燕子是个虚拟人物"
774,"被宠成公主了，好幸福"
774,"明玉要是还在就好了"
775,"各位别管是不是历史了，看着开心吗开心就行了"
775,"跟自己儿子抢糖吃？也是没谁了！"
775,"嘻嘻嘻朕好开心呀"
775,"善良的主子，就连身边的丫鬟都那么有爱"
775,"吃东西的样子真可爱"
775,"这个糖好像很好吃的样子"
776,"令妃该可爱时可爱，该正经时正经。很好。"
776,"我蛙哥真可爱￼"
776,"原来嘉庆不优秀都是令妃的错"
776,"珍珠好可爱"
776,"我觉得演得好"
776,"善良的主子，就连身边的丫鬟都那么有爱"
777,"蛙哥真是好孩子"
777,"朕这么落魄了么衣服上那么多褶子"
777,"永琪肯定会喜欢小燕子，因为他的令母妃跟小燕子一样"
777,"什么时候安排我复活。"
777,"珍珠声音很好听"
777,"粽子糖好吃吗"
778,"也不怕吃多了牙疼"
778,"珍珠好福气"
778,"五阿哥给令妃买了一堆东西，四阿哥只给皇后买两件东西"
778,"这张嘴👄吃的表情太棒了！"
778,"明玉在就好了。"
778,"珍珠呀珍珠你竟然留到了最后"
779,"哇哥好可爱"
779,"大家撤吧，后面一点盼头都没有了"
779,"这兄弟俩都在讨养母开心，但结果完全不一样"
779,"明玉活到现在就好了"
779,"五阿哥真好"
779,"太装可爱了"
780,"这两集就是要发糖的为后面作铺垫的，说多余的可以不看"
780,"要是我还在多幸福啊"
780,"白天拿扇子，吃冰的，晚上盖厚被子，咋想的"
780,"四阿哥长的太像尔康"
780,"璎珞演的好可爱"
780,"小标题我劝你善良"
781,"说要打耳洞的你怕是不知道有个东西叫耳夹"
781,"你们把本宫放哪里"
781,"粽子糖是什么。。很好吃的样子"
781,"根本就没有小燕子。"
781,"大概明白五阿哥为啥喜欢小燕子了、性格太像令妃"
781,"璎珞演的好可爱"
782,"真正用爱养大的五阿哥就是和四阿哥不一样"
782,"我最可爱💖"
782,"珍珠是个好珍珠"
782,"五阿哥喜欢令妃这型的吧要不让小燕子迷住了"
782,"永琪太可爱了"
782,"粽子糖是什么。。很好吃的样子"
783,"明玉在就好了"
783,"明玉怎么不见了"
783,"那个说明月的是魔鬼吗"
783,"标题是重点啊"
783,"真正用爱养大的五阿哥就是和四阿哥不一样"
783,"五阿哥喜欢令妃这型的吧要不让小燕子迷住了"
784,"如果明玉还在该多好啊"
784,"璎珞好可爱"
784,"我觉得后面几集超甜咋，不管是卫龙还是蛙哥"
784,"真心喜欢一个人是永远不会改变的。"
784,"四阿哥，我劝你善良"
784,"珍珠还没出宫嫁人？"
785,"珍珠好温柔哦"
785,"四阿哥我劝你善良"
785,"珍珠演的不错"
785,"朕也要吃特产"
785,"大半夜看饿了"
785,"珍妮珍妮～"
786,"这两集最甜"
786,"今天这两集看着特别开心哈哈哈"
786,"看他那寒碜样，人家十五阿哥带了多少东西"
786,"为什么要害蛙哥？"
786,"蛙哥真的是旅行蛙"
786,"嫔妃和掌事的大宫女都是三个耳环的"
787,"唉，永琪为什么死那么早"
787,"朕不知道你们还斗不斗了，好困啊。。。"
787,"明玉在就好了。"
787,"感觉这样下去，智商会下降啊"
787,"本宫至今还未见到令妃的三个孩子呢！"
787,"封贵妃哪一集演的"
788,"珍儿你衣服的褶子太多了，都没晕开"
788,"本宫的璎珞真的敲可爱"
788,"璎珞这是扮猪吃老虎吗"
788,"有这么个儿真好"
788,"差别这么大？"
788,"越来越觉得没看头了"
789,"吴谨言好可爱"
789,"本宫就调皮一下"
789,"四阿哥我劝你善良"
789,"因为满族女人都是耳朵有三个洞"
789,"皇上演的真好，相貌堂堂"
789,"松仁粽子糖比较好吃"
790,"四阿哥清醒点吧你的亲额娘就是他杀的[衰]"
790,"不要伤害郑的永琪"
790,"珍珠才是最强的"
790,"纯妃的儿子不是过继给王爷了吗"
790,"怎么演着演着成了小燕子"
790,"这是嘉嫔的儿子吗"
791,"今晚的情节好甜啊喜欢这种爱情"
791,"四阿哥长得好"
791,"酒窝演的好"
791,"大明湖畔的夏雨荷碰到了吗"
791,"她可是你的杀母仇人啊"
791,"不那么喜欢樱落了"
792,"五阿哥好暖"
792,"珍珠是活到最后的宫女吗"
792,"要是明玉也在，那可就更热闹了，哎"
792,"魏璎珞你是不是疯了"
792,"永琪要受伤了吗"
792,"珍惜傅恒在的每一集"
793,"第二个皇后杀了四啊哥的母亲前任嘉娉高贵妃一派的"
793,"替别人生了个儿👀"
793,"剪了太多台词了"
793,"这两集太腻了，甜的齁不住"
793,"这对一点都不亲"
793,"四阿哥这么孝顺真是可怜没有个好妈妈"
794,"好奇她的三个孩子长什么样肯定很可爱"
794,"敲可爱敲可爱的"
794,"哇，五阿哥和令贵妃也太可爱了吧"
794,"就没见过十五阿哥，还有七格格和九格格"
794,"大嘉嫔生的"
794,"我喜欢这段"
795,"同样是收养的儿子这差别咋就恁大泥？"
795,"永琪是不是忘了本宫"
795,"我缨络最可爱"
795,"本宫的四阿哥"
795,"原来五阿哥喜欢小燕子是因为令妃啊"
795,"珍珠全程姨母笑"
796,"四阿哥还是个孝顺的孩子，可惜跟了皇后"
796,"五阿哥这里真是个好孩子啊"
796,"璎珞这后期演的更好了"
796,"五阿哥是传说中的别人家的哥哥"
796,"2倍速真感人了解一下"
796,"同样是收养的儿子这差别咋就恁大泥？"
797,"四阿哥长得像五阿哥小时候啊"
797,"后宫女人动不动就不舒服这担心她们突然去世"
797,"后边的剧情好无语"
797,"四阿哥还是记得本宫对你好啊"
797,"分不清哪些阿哥是璎珞的，哪些是皇后的"
797,"五阿哥这里真是个好孩子啊"
798,"不要再说嘉庆不优秀什么的，有个那么优秀的爹很难超越"
798,"快给本宫热饭盒"
798,"还是庆贵人命好，不争不抢，最后还是太后吧"
798,"我怎么看四阿哥长得像尔康啊"
798,"璎珞演的很好，并不过，也并不夸张"
798,"总感觉珍珠一副坏人相"
799,"如果不是令妃，嘉庆不是不优秀可能是直接挂了长不大"
799,"宫女两鬓都发白了"
799,"来人，给五阿哥的盒饭热上"
799,"樱洛得孩子是那个啊"
799,"婢女是那个什么晓晓什么寄几"
799,"哇哥要出事"
800,"感觉他们病就没好过"
800,"本宫的儿子呢"
800,"这是办事还是出去买伴手礼啊"
800,"永琪真啰嗦。"
800,"四啊哥帅啊"
800,"现在知道五阿哥为什么喜欢小燕子了"
801,"永诚你小时候还是有点可爱的，请你善良"
801,"四阿哥不是蛮帅的吗？"
801,"四阿哥本来也是好的"
801,"没一个帅阿哥"
801,"珍儿怎么不老"
801,"老四是被过继的命"
802,"四阿哥看起来就不是好东西"
802,"就是个大猪蹄子"
802,"为什么感觉四阿哥那么眼熟，怡亲王？"
802,"小可爱们想我了吗？"
802,"和现在的人一样出差带礼物"
802,"本宫就是要越老越作"
803,"看了这剧看来以前的还珠格格白看了"
803,"有人宠的女人都傻傻的艺术高于生活璎珞演的很好"
803,"因为皇后只是利用他不是真心爱他，所以当时不亲密了"
803,"我这儿子不像朕"
803,"珍,儿好美丽"
803,"璎珞一孕傻三年呀"
804,"香蜜虐得受不了，却在延喜找糖吃，世道变了"
804,"卫龙大旗摇起来"
804,"璎珞年轻时很稳重，现在演的反而活泼的厉害了"
804,"我人想我吗"
804,"纯妃，你儿子被大猪蹄子过继给别人了"
804,"有人宠的女人都傻傻的艺术高于生活璎珞演的很好"
805,"最开始的艰难都过去了有了孩子都安稳了自然会活得快活"
805,"为什么蛙哥长得像尔康"
805,"都是代养的阿哥差别这么大。"
805,"永琪这个没良心的孩子，是不是忘了本宫"
805,"历史上永琪是病逝的根本没有什么小燕子"
805,"卫龙大旗摇起来"
806,"嘉嫔的儿子果然不是什么好东西"
806,"五阿哥就是好！"
806,"四阿哥真是嘉嫔生啊有其母必有其子啊败类"
806,"哈哈哈还好还好"
806,"为啥虐的你们不乐意，甜的又觉得腻"
806,"八百标兵奔北坡"
807,"老四长得还阔以"
807,"这是本宫的儿砸"
807,"老四啊你长点心吧"
807,"这个标题朕很不满意"
807,"小燕子要来作妖了，五阿哥你等着"
807,"四阿哥有木有尔康的感觉啊"
808,"大甜过后必有大虐"
808,"四阿哥盒饭好了，快来吃吧！"
808,"四阿哥比五阿哥帅多了啊"
808,"皇子为什么不找点小帅哥演"
808,"五阿哥要是让苏有朋演那这这戏就绝了"
808,"我就是厉害👍"
809,"阿哥们不容易啊，卯入申出，5点就起来念书了"
809,"本宫的儿子还是小正太呢"
809,"演技真是不错"
809,"感觉自己萌萌哒"
809,"十五都6岁了，继后跟五阿哥是要毙了吗？"
809,"这是嘉嫔的孩子"
810,"说大甜必有大虐的，这都虐多少级了，该甜到尾了"
810,"本宫的儿子皇上送给王爷了嘤嘤嘤"
810,"四阿哥谁的儿子来着太多分不清楚了"
810,"上一集说了纯妃的六阿哥过继给宗室了"
810,"周迅一点也没佘诗曼演的好"
810,"不知道你们想不想我"
811,"四阿哥是皇后带大的"
811,"本宫可是在默默的看着你们作妖呢"
811,"不瞒你说她杀了你亲额娘"
811,"好纠结你还敢发个哈哈哈个"
811,"同样是养母和养子，差别咋那么大呢"
811,"这孩子真丑，不见不见"
812,"历史上四阿哥活的比其他阿哥都要久"
812,"既然敢骗本宫"
812,"魏姐那么多年被人宠着当然越来越可爱了啊"
812,"本宫不说话"
812,"四阿哥是皇后带大的"
812,"同样是养母和养子，差别咋那么大呢"
813,"一看就不是好东西"
813,"朕的夏雨荷呢什么时候出来"
813,"纯贵妃的儿子呢"
813,"有人还记得本宫吗"
813,"丸美我劝你善良"
813,"什么？朕的大清亡了？"
814,"四阿哥和纯妃长的有点儿像，这演员找的好诶*罒▽罒*"
814,"四阿哥是本宫带大的"
814,"四阿哥的妈是被继皇后杀了的"
814,"四阿哥好造孽，被杀母仇人养着"
814,"四阿哥还是挺孝顺的"
814,"朕的夏雨荷呢什么时候出来"
815,"大甜必有大虐。"
815,"想高可爱啊"
815,"不用斗的日子多好啊……"
815,"还记得本宫吗，本宫出来刷存在感"
815,"傅晴大旗摇起来"
815,"这是高贵妃旁边的嘉嫔生的"
816,"故事发展的太快"
816,"要领盒饭了这位小四"
816,"长的很像纯妃"
816,"刚刚半边脸和朕好像啊"
816,"皇后是四阿哥的杀母仇人啊"
816,"皇子都比我老"
817,"小左你个大猪蹄子"
817,"朕的四阿哥比五阿哥长得有神"
817,"真的是个大傻子"
817,"四阿哥很孝顺的样子"
817,"令妃你准备怎么处理大明湖畔的夏雨荷"
817,"这对鞋竟然能走出高跟鞋的声音。"
818,"四阿哥，我劝你善良"
818,"确认过眼神，五阿哥要被害人了"
818,"急啥这不就开始作妖了吗"
818,"本宫也还没见过三个孩子呢，你们急什么"
818,"据说有番外"
818,"越到后面越没有什么看的了"
819,"要是明玉还在就好了"
819,"这是嘉嫔生的儿子吧"
819,"老四也挺孝顺"
819,"我自己都没吃到，要点回来"
819,"庆妃：什么时侯到本宫的镜头"
819,"这电视从第一集看到现在好累好累"
820,"安琪拉蹲安琪拉蹲安琪拉蹲完赵云蹲"
820,"看得要睡着了来点刺激的剧情"
820,"长得像尔康"
820,"本宫可是你的杀母仇人"
820,"想有五阿哥这样的哥哥令妃这样的老妈"
820,"到底不是亲生"
821,"孩子都大了是不是要去围猎了"
821,"快来人帮我热好盒饭。"
821,"历史上五阿哥居然只活了25岁。琼瑶阿姨果然是骗人的"
821,"本宫的儿子要被害了～"
821,"这段时光真是好平和啊"
821,"明玉走的第二天，想她"
822,"小燕子还不来吗"
822,"六阿哥才是纯贵妃生的"
822,"郭冬临，是你们"
822,"小燕子啥时候来啊"
822,"不同的养母不同的命运。。。"
822,"都给朕退下，"
823,"唐芹什么时候看到这里"
823,"现在可真热闹"
823,"六阿哥送人了"
823,"我凉了几集了？"
823,"作妖了。作妖了"
823,"嘿这不是还珠格格"
824,"如果五阿哥让李睿演就好了"
824,"这是我儿了"
824,"嬛嬛是寿命最长的"
824,"虐了又开始了"
824,"这是凑集数的把"
825,"怎么没看到璎珞的孩子。长什么样"
825,"委屈的珹珹要黑化了！"
825,"谁发的令贵妃这样好萌"
825,"没有五阿哥帅2333"
825,"两个果果呢"
