time,content
1428,"为什么我这么白为什么我这么俊"
1428,"傅恒的母亲和太后身边的嬷嬷是同一个人演的吗"
1428,"额娘，儿臣想说您是如何做到不眨眼的"
1428,"见到少爷好亲切呀"
1428,"额娘你的头发是肿么回事啊？"
1429,"打了这么多仗，还是那么嫩啊！"
1429,"这种战场下来还白白净净的，不知道怎么在战场活下来的"
1429,"少爷保安服帅多了"
1429,"哥就是这么帅，迷倒万千少女"
1429,"Q房网的伙伴们好"
1429,"爱想一道光，绿的发慌"
1430,"傅璎大旗永不倒"
1430,"打完仗还是一样的帅"
1430,"傅璎大旗永不倒！"
1430,"我怎么打完仗回来还是小鲜肉"
1430,"富恒他母亲眼睛是不是看不见啦"
1430,"打了这么多仗，还是那么嫩啊！"
1431,"永琪都长那么大了。尔康的爹还没找到媳妇吗"
1431,"傅璎女孩大旗不倒"
1431,"傅恒小鲜肉好嫩啊"
1431,"都是麦吉丽面膜用的好"
1431,"他娘好辛苦"
1431,"傅璎大旗永不倒！"
1432,"打这么久的仗还这么白白嫩嫩的过份"
1432,"又帅又能干就是我，哈哈哈"
1432,"少爷比皇上帅"
1432,"傅璎大旗永不倒"
1432,"茹萍茹萍，大美女"
1432,"傅璎女孩大旗不倒"
1433,"打仗好像不辛苦啊看傅恒白白嫩嫩的"
1433,"我还没见过公公呢就病逝了"
1433,"娶了尔晴就是最大的错误"
1433,"看来你是忘了我了"
1433,"我猜傅恒在战场上绝对不是用了美男计"
1433,"啥时候出场啊"
1434,"少爷也有新衣服啦"
1434,"看了这么多集，到底谁是男一啊"
1434,"傅恒：又帅了一个新高度"
1434,"我都吃盒饭了，你才回来"
1434,"你这哪里是去打仗，明明是去保养"
1434,"娶了尔晴就是最大的错误"
1435,"我就想问富衡他娘看着好眼熟啊，"
1435,"呀！好惊喜四集没见了，又帅了"
1435,"就不能长长胡子吗，这都放了七八年的剧情了吧"
1435,"帅不帅？帅"
1435,"傅璎大旗摇起来"
1435,"我额娘眼睛看不到了吗"
1436,"媳妇儿死了好开心"
1436,"打了这么久的仗，皮肤还是那么好"
1436,"他娘长得像舒嫔呀"
1436,"额娘你这发套好现代"
1436,"大嘴猴恋爱谈了那么多年赶紧结婚"
1436,"帅不帅？帅"
1437,"白白嫩嫩的不像打仗的人"
1437,"我不是没长胡子，是管道具弄丢了"
1437,"富恒要是和青莲在一起多好"
1437,"都那么大岁数了，还不长胡须"
1437,"大猪蹄子是乾隆，他是小猪"
1437,"我死了你也没赶回来，开心吗"
1438,"宋勇翰你个超级大猪蹄子"
1438,"本少爷最帅"
1438,"这个娘长的也蛮入眼的"
1438,"额娘是看不见了吗"
1438,"打着太阳伞去的战场"
1438,"赶紧去找你的璎珞啊"
1439,"真羡慕他们这么多年了还这么年轻"
1439,"傅璎女孩表示很开心"
1439,"尔康的长脸不像你果然是绿了"
1439,"我还以为傅恒领盒饭了"
1439,"傅缨大旗摇起来"
1439,"本少爷最帅"
1440,"回家了发现丧偶好大的惊喜"
1440,"我高可爱有人想吗嘤嘤嘤"
1440,"这个追谥是认真的吗"
1440,"走了三年我怎么不老呢？"
1440,"陈健明大猪蹄子"
1440,"我薨了哦，大家开不开心？"
1441,"傅璎大旗永不倒"
1441,"尔晴领盒饭了，我好高兴呀，好高兴"
1441,"富恒：尔晴死了，实在是太高兴了"
1441,"我已经不在了你开心吗"
1441,"这么多年过去了还是原样"
1441,"算了我直接去吃盒饭吧"
1442,"富察一直都是很尊贵的皇族，而且都是武将，但一直低调"
1442,"皇上好仁慈"
1442,"傅恒留个胡子岂不更好"
1442,"听说我媳妇死了开心"
1442,"家里这么多儿子"
1442,"傅璎大旗永不倒"
1443,"傅恒只要帅就行了，帅帅帅"
1443,"没办法，我就是这么强大"
1443,"尔康是皇上的儿子，那跟紫薇不是兄妹吗"
1443,"还有人想本宫吗"
1443,"时间过的太快了"
1443,"傅恒留个胡子岂不更好"
1444,"还以为要说尔晴病逝也没回来"
1444,"追Si……好明显的错误啊"
1444,"说薛之谦那个你别走"
1444,"我都瘦了好多，没看出来吗"
1444,"这不是还珠格格里尔康的妈妈吗"
1444,"你们想我没"
1445,"安，是让你安排，三个月都没音讯居然。大猪蹄子"
1445,"这头发发套是认真的吗"
1445,"眼睛都不眨一下好厉害"
1445,"媳妇，媳妇，我们一起私奔吧"
1445,"傅璎大旗傅璎大旗!!!"
1445,"还记得我吗"
1446,"听说尔晴死了，好开心"
1446,"不瞒各位我就是大猪蹄子"
1446,"大猪蹄子靠不住啊还是傅恒好"
1446,"怎么打了这么多年仗都没变化"
1446,"看这个的盘子的不都是大猪蹄子？"
1446,"媳妇，媳妇，我们一起私奔吧"
1447,"富恒，好惊喜，一回来就听说尔情死了！"
1447,"王玺文大猪蹄子"
1447,"打了这么多年战，还这么白"
1447,"别说了我就是去幕后吃了两个饭盒"
1447,"这打仗打得还这么细皮内柔的~！"
1447,"我好久领盒饭呀"
1448,"高高不在的第n集想她想她想她"
1448,"皇上下旨下旨赐婚哈"
1448,"这么多年打仗回来还是一个小白脸，这不太合"
1448,"我回来领盒饭了"
1448,"老夫人长得象舒嫔"
1448,"哎呀，我不在，好生气😡"
1449,"那是用用布包起来的不是头发好吧"
1449,"媳妇儿走了都不用我休真省事儿"
1449,"傅恒最帅，帅呆了"
1449,"这头发是认真的吗"
1449,"傅恒他老爹出来露过脸吗？我以为早死了，怎么现在才死"
1449,"吃过盒饭了"
1450,"一般剧中人物沙场归来不都是有点胡子的么。。。。"
1450,"想念高可爱了"
1450,"一样白，不是为了你们看着舒服？"
1450,"本宫妈妈真好"
1450,"傅缨大旗抬起来！"
1450,"哈哈，朕心情大好"
1451,"打这么久仗还是白白嫩嫩的，用的什么护肤品啊"
1451,"弟弟，本宫将你媳妇召来打麻将了你开心吗"
1451,"傅恒征战沙场，回来还是白白嫩嫩的，"
1451,"盒装我都吃完好久了"
1451,"这是富恒，生尔康的是福伦好吗"
1451,"傅缨大旗抬起来！"
1452,"从古自今，儿行千里母担忧，母爱太伟大了"
1452,"高举傅缨大旗！！傅缨大旗！！！！！！"
1452,"他怎么这么多戏份"
1452,"本少爷还是那么帅"
1452,"这是有多少人没一集一集的看"
1452,"本宫还有五秒到达战场"
1453,"傅恒刚回来，就知道媳妇死了的死讯，开心呐"
1453,"少爷打个仗回来更白了，妥妥的小鲜肉啊"
1453,"你的阿玛剧组是么给钱。脸都米有露"
1453,"傅璎大旗举起来"
1453,"黄桑还是挺耐看的"
1453,"高贵妃不在的第n天想她想她想她"
1454,"宫女画的妆都比主子好"
1454,"我出来刷一下存在感。"
1454,"顺嫔也是个反派，这妖魔啥时候才能除尽"
1454,"我一生只爱一个人，那就是魏璎珞。"
1454,"这部戏的服化道好差，出去打三年仗脸还这么白"
1454,"还记得你的落落吗"
1455,"这那是去打仗这是去出差了吧脸白手净的"
1455,"打战三年头发胡子都不见长啊"
1455,"傅璎女孩请不要坚强了，大旗早就倒了"
1455,"哎！媳妇死了高兴的回家了"
1455,"小丫头的头好尖"
1455,"还记得你的落落吗"
1456,"傅恒咋那么多年还是那么嫩"
1456,"我这个大猪蹄子都快忘了你们了"
1456,"傅璎大旗摇起来"
1456,"弟弟就是优秀"
1456,"你来晚了一步"
1456,"这下皇上该把璎珞赐给我了吧"
1457,"媳妇帮我把那妖妇除了，本宝宝打胜仗回来好开心！"
1457,"本宫的弟弟就是优秀"
1457,"五阿哥都多大了，尔康还不出生，傅恒长点心吧"
1457,"不会去是因为傅恒小哥哥还没回来，现在可以回去了"
1457,"傅璎大旗再次立起来"
1457,"上战场还这么白净啊！"
1458,"少爷打完战还是白白嫩嫩不科学"
1458,"什么？你们说我媳妇死了？太好了！！"
1458,"最优秀的是你弟，他不能做长子，但他儿子做了长子～"
1458,"我富恒最帅"
1458,"傅樱大旗举起来"
1458,"还有人想起我吗"
1459,"想看安儿有多大了"
1459,"傅恒回来啦好开心"
1459,"白白嫩嫩哪像打仗的人"
1459,"富恒：我好久长胡子"
1459,"朱政旭大猪蹄子"
1459,"什么？你们说我媳妇死了？太好了！！"
1460,"傅璎大旗我们一起举起来！！快，大家一起摇摆"
1460,"快放本宫出来，本宫要作妖了，快快，来不急了……"
1460,"大猪蹄子又要绿了"
1460,"和璎珞关系好的嬷嬷去哪啦"
1460,"傅璎大队大旗不倒"
1460,"傅恒回来啦好开心"
1461,"说皮肤白的怕不是以为打仗穿短裤？"
1461,"我回来抢媳妇啦"
1461,"现在还没弄明白到底魏璎珞是主角还是富察皇后是主角"
1461,"儿子都快娶媳妇了"
1461,"感觉还是白白嫩嫩"
1461,"我不是个东西"
1462,"好开心，回来就知道尔晴死了"
1462,"叫我高单纯"
1462,"你便宜儿子好大了"
1462,"当我儿子长大又是一部好剧"
1462,"他娘眼睛早就看不见了，尔晴嫁进来时就已经看不见了"
1462,"本宫很欣慰"
1463,"在外打仗那么多年依然是个小白脸的模样捏秝脸"
1463,"傅璎大旗不倒"
1463,"年轻的时候额娘很美的"
1463,"媳妇儿挂了，开心不"
1463,"郜文锴你个大猪蹄子"
1463,"顺嫔五秒到达战场"
1464,"看我光头多帅"
1464,"媳妇走了好开心"
1464,"这么久了还这么白"
1464,"打完仗一点都不沧桑就是这么任性"
1464,"傅璎大旗永不倒"
1464,"顺嫔是主角？为什么一个个都问她什么时候出来"
1465,"傅恒：儿子还有很多女人要打，才回来晚了"
1465,"大猪蹄子你不爱我了吗？"
1465,"傅恒小哥真是帅呀，老夫的少女心啊👄"
1465,"你媳妇让我整死了，开心不！"
1465,"额娘型看着不舒服"
1465,"怕是没想起我这个人"
1466,"富恒打了那么久战，脸还那么嫩不合理"
1466,"好开心没有媳妇了"
1466,"突然想到璎珞让热巴演会更生动"
1466,"这就是你带回个女人的原因？！"
1466,"要想皮肤好，就得去战场"
1466,"我什么时候出场"
1467,"容音还活着的时候就说老夫人以泪洗面，基本看不见了"
1467,"又回来让我吃醋了"
1467,"顺嫔也是活的集数最少的宠妃"
1467,"还记得本宫吗"
1467,"这里面的人物出场都挺随意的"
1467,"好开心没有媳妇了"
1468,"贴个胡子真实一些也让剧情更有层次"
1468,"看我打了那么多年仗还是白白嫩嫩的"
1468,"突然感觉高贵妃好单纯啊"
1468,"五阿哥都这么大了还木有尔康"
1468,"傅恒母亲眼睛看不见了吗"
1468,"少爷啊，这么多年了你咋不长胡子"
1469,"傅璎大旗摇起来"
1469,"大猪蹄子最帅"
1469,"大猪蹄子不要媳妇了？"
1469,"什麼時候讓嬪妾出來作妖啊~"
1469,"我就不长胡子，咋地吧"
1469,"我吃饱了，要回来，哼唧"
1470,"本宫的傅恒一回来本宫心就疼"
1470,"如果看到你媳妇的牌位。直接扔马桶冲下去"
1470,"大猪蹄子是什么梗"
1470,"傅缨大旗永不倒！！"
1470,"家风真得很重要，看皇后和她弟弟"
1470,"宝宝要出来做妖了"
1471,"尔晴：我死了你开心吗"
1471,"本宫死了快30集了还有人记得本宫吗"
1471,"天天打仗脸咋一道疤都没有"
1471,"你媳妇挂了开心不😄"
1471,"还是皇上更有男人味"
1471,"我领盒饭了，开心吗？"
1472,"许凯才是大猪蹄子"
1472,"好开心那个大妈不用我亲自来休了哈哈哈哈"
1472,"康熙还死，苏麻就死了好不？"
1472,"尔晴挂掉了我好开心"
1472,"他额娘是康熙王朝里面的苏麻喇姑啊，才看出来"
1472,"我领盒饭了真好"
1473,"这段回来留出胡子沧桑感演出来就厉害了"
1473,"顺嫔是好人还是坏人啊"
1473,"我说怎么这么眼熟，原来是黄春"
1473,"我咋这么帅"
1473,"这么多年过去了，傅恒还是处"
1473,"安儿其实是富恒弟弟的，羞羞"
1474,"尔康不是比五阿哥大吗？哪个是尔康啊"
1474,"这么多年了我还是年轻"
1474,"现在回去做不了妖还得经历一次九死一生的磨难才能作妖"
1474,"我死了是不是很开心"
1474,"傅璎大旗不倒"
1474,"臣妾到底是来干嘛的本宫的盒饭呢"
1475,"好开心少爷又是单身了"
1475,"我高可爱最省心了"
1475,"这么多年征战全无沧桑，吃的什么保鲜剂"
1475,"傅缨大旗给我挥起来"
1475,"打仗也不拍出来看，节约成本啊，明明去吃盒饭了再回来"
1475,"弟弟也是大猪蹄子"
1476,"傅恒怎么这么久，没长胡子，难道随身带着剃须刀？？"
1476,"妈耶我该回去看看大猪蹄子了"
1476,"善良的女人孩子也善良"
1476,"你爹唯一一次活在台词中，却说刚过世～"
1476,"皇上这气生的太久了，早点和好孩子都好几岁了"
1476,"哈哈哈哈，我就是大猪蹄子"
1477,"才发现傅恒的妈是茹萍诶，变化好大"
1477,"开心开心，做梦都笑醒"
1477,"顺嫔是来报仇的看似单纯其实满腹心机"
1477,"听说我媳妇儿不在了，甚是开心"
1477,"头上的蝴蝶结是认真的吗"
1477,"我陪你坚强傅璎加油"
1478,"额娘也不容易，演个戏在台后坐了60集了"
1478,"我还想作作妖，来呀，快刨我坟当我出来"
1478,"路上还捡了个顺妃"
1478,"我媳妇死了，开心！"
1478,"大猪蹄子是什么梗ennnnn"
1478,"这电视到底有多少集？你们可别忘了本宫"
1479,"傅恒也该找个女人生孩子了，不能便宜尔晴的孩子得家产"
1479,"你回来晚了，我已经去领盒饭了"
1479,"傅恒心说这次回来舒坦多了，不想出去打仗了"
1479,"为什么叫大猪蹄子"
1479,"这个老太太眼睛好亮啊"
1479,"不是说本宫的戏份被删了吗"
1480,"打仗多年，回来还是白面书生的模样"
1480,"我头发真好啊根本不怕发际线升高"
1480,"他额娘演的就是双目失明好么"
1480,"我吃盒饭我都吃饱了"
1480,"尔康，尔泰啥时候出生？永琪都那么大了"
1480,"请叫我高可耐"
1481,"夫人眼睛好亮"
1481,"嫔妾是要生4个猴子的女人"
1481,"尔晴死的第四集，开心，开心，开心"
1481,"傅璎女孩快出来"
1481,"办个大爬梯"
1481,"姐姐要出山了"
1482,"傅查的娘颜值好高"
1482,"我媳妇儿死了我好开心"
1482,"刚才太厚在亭子里都被挤到栏杆旁边了"
1482,"我赐死了你媳妇开心嘛？"
1482,"这个是真剃了光头的,没戴头套,看着自然"
1482,"真开心，媳妇死了"
1483,"晚晚什么时候开挂啊"
1483,"你媳妇死了，本猪蹄要再给你赐个亲"
1483,"傅嘤大旗不倒[害羞]"
1483,"我媳妇死了，好开心"
1483,"这个眼神比璎珞的有神多了"
1483,"大鼻孔你看到了吗"
1484,"富恒：好久没露脸刮了胡子敷个面膜再出来不可以吗"
1484,"看我帅不帅"
1484,"呀！傅恒也换新衣服了"
1484,"就算是打仗也要做得精致"
1484,"怎么可以这么帅"
1484,"全剧最帅的男人"
1485,"看正版吧，不然以后全水剧"
1485,"我还是白白嫩嫩好开心"
1485,"说富恒帅的怕是没见过帅哥"
1485,"快帮我们少爷纳个妾，纳个妾"
1485,"好像是苏麻喇姑的扮演着如萍"
1485,"袁春望啥時候領盒飯啊。"
1486,"这几年璎珞在圆明园要是有傅恒陪着就好了"
1486,"现在富查家只有富恒和母亲啦？"
1486,"高贵妃，出来跳一支贵妃醉酒吧"
1486,"我都过了头七了你还不知道我死了？"
1486,"这一家子都把尔晴忘了哈哈哈哈哈哈"
1486,"傅恒你想我吗"
1487,"出门打仗这么多年，风吹日晒竟没有改变"
1487,"媳妇死了，好高兴好高兴"
1487,"璎珞以为就她是聪明的"
1487,"傅恒你疯了吗？回来都不问问我死透了没有？"
1487,"额娘演得好"
1487,"还有一只真正的大猪蹄子"
1488,"让全剧组的人都看看"
1488,"大猪蹄子什么梗"
1488,"人家演技好把盲人演活了"
1488,"你知道尔晴已经死了吗"
1488,"富察家也不容易"
1488,"有胡子就更帅了"
1489,"帅全局就他最养眼"
1489,"没有媳妇的日子好开心"
1489,"打仗打了辣么久还是白白嫩嫩的"
1489,"这么久眼睛都没眨一下果然是高手"
1489,"怎么感觉傅恒他娘都不正眼看人的"
1489,"徐凯彬是大猪蹄子"
1490,"这个额娘演得也蛮好的，眼睛不带咋的"
1490,"本宫是好的哦！"
1490,"额娘眼睛里有打光板"
1490,"我家大门常打开，开放怀抱等你……"
1490,"璎珞报了仇为什么还要争宠？莫名其妙啊"
1490,"帅全局就他最养眼"
1491,"出去打战这么久还能保养得这么好，厉害"
1491,"没有尔晴又是元气满满的一天"
1491,"还是白白嫩嫩的"
1491,"大猪蹄子回来啦"
1491,"要是有诸葛亮韩信就好了"
1491,"赐莎普爱思一瓶"
1492,"手机壳快说快说快上课看撒看撒看撒困死手机手机就十万"
1492,"脑袋一道绿光，真的好开心"
1492,"不不不傅璎大旗就别竖了我们卫龙女孩看着闹心"
1492,"傅缨大旗屹立不倒"
1492,"谁跟你们说尔康是傅恒的儿子？那是福伦的儿子"
1492,"本宫长得美吗！"
1493,"傅璎大旗举起来"
1493,"爱是一道光如此美妙"
1493,"富察家的两个孩子真的养的好啊"
1493,"容音小姐姐来啦"
1493,"媳妇挂了，烧高香庆祝一下"
1493,"到底皇上的娘怎么死的"
1494,"仔细一看，大嘴猴夫妇的嘴果然不是一般的和谐"
1494,"我下线了你开心吗"
1494,"说大猪蹄子能美容养颜的那个别走"
1494,"我怎么绿了"
1494,"富察家的两个孩子真的养的好啊"
1494,"傅璎大旗举起来"
1495,"太偶像了，打仗的人这么白净"
1495,"一见绿色好心情"
1495,"一说到孝贤皇后眼泪又忍不住了"
1495,"富察家的人真的都是白月光啊"
1495,"璎珞:我自由了"
1495,"三年生两个。厉害不"
1496,"突然想起了璎珞走了愉妃的儿子呢"
1496,"难道看不出来眼睛看不见了？说不眨眼很厉害的怕是傻子"
1496,"怎么不认真？你去看看演员表"
1496,"看我打了几年仗皮肤还这么好"
1496,"那个说傅恒妈妈不正眼看人的那个人你别走"
1496,"富察家的人真的都是白月光啊"
1497,"历史上富察家是最厉害的"
1497,"我就是大猪蹄子"
1497,"看到腊肉的排位，乐的不能自已"
1497,"尔晴怎么死的"
1497,"媳妇死了回家都开心一点"
1497,"苏嫲，你什么时候嫁到富察家的"
1498,"富察家的这两个孩子真的很争气！善良优秀"
1498,"没有尔晴太开心了，又可以愉快的找璎珞玩耍啦"
1498,"要不说中国古代留下的糟粕多呢，全是为别人活的"
1498,"这两个儿子肯定不是什么好东西，该掐死了算了"
1498,"就算支持这部剧也请看正版好吗"
1498,"历史上富察家是最厉害的"
1499,"这老夫人挺会生的，儿子女儿这么争气就是去的儿媳妇太"
1499,"莎普爱思你值得拥有"
1499,"如萍年轻的时候好美"
1499,"你们竟忘了本宫"
1499,"富察家真的儿子女儿都超好"
1499,"弟弟真长脸"
1500,"徐正阳是大猪蹄子"
1500,"傅璎大旗屹立不倒"
1500,"这眼演的不错"
1500,"大猪蹄子想我媳妇了"
1500,"富恒姐弟的人设太让人心疼了"
1500,"有人想看本宫大秀嘛"
1501,"看看你们家颜值有多高"
1501,"我爱唱戏，你们一个个却都是戏精，请叫我高单纯😊"
1501,"不愧是本宫的好弟弟。"
1501,"容音走后的N天想她"
1501,"可爱的小野姐姐在看吗"
1501,"额娘你发型有那么点魔性啊"
1502,"额娘真的是很骄傲"
1502,"本宫的片酬有那么贵么，大小是个明星，竟敢如此怠慢！"
1502,"富察家颜值都高啊！"
1502,"还有我这个大猪蹄子🐷"
1502,"我都觉得骄傲"
1502,"容音走后的N天想她"
1503,"五阿哥都这么大了，怎么还没尔康和尔泰"
1503,"额娘看着就慈眉善目的一定是好婆婆"
1503,"眼睛不眨一下厉害了老夫人"
1503,"本宫出来冒个泡"
1503,"少爷，代表了一切美好的人和事物🌹"
1503,"真的要卡死了"
1504,"富察家上辈子作了什么孽这么好的俩孩子都没生下亲骨肉"
1504,"本宫可是最善良，最可爱的怎么你们忘了本宫了吗？"
1504,"茹萍康熙王朝苏麻喇姑就演的很棒"
1504,"傅恒和尔康明明是两家人好吗这群傻子"
1504,"福康安，不是尔康，还珠格格看多了吧"
1504,"太开心了我居然是只鸟"
1505,"傅恒打了那么多仗，皮肤真好"
1505,"还有一个人人都劝善良的儿媳妇"
1505,"傅璎大旗举起来"
1505,"你们的高可爱上线了"
1505,"傅恒家的人都很善良耶"
1505,"我年来一缕春风春风也沉醉"
1506,"这皮肤确实包养的好"
1506,"打这么多年仗，还这么白"
1506,"海兰察家族也很厉害"
1506,"额娘，你把你儿子比作一只鸟真的好吗"
1506,"媳妇儿死了，心里很是开心！！"
1506,"呵呵还想着安儿"
1507,"打过仗的手真白白嫩嫩滑滑软软"
1507,"回来绝对不找自己媳妇，她爱去哪就去哪（富恒专用绿）"
1507,"哇哥长多大了"
1507,"等着，本宫马上要十年生六个娃了"
1507,"富察家还有一只真正的大猪蹄子"
1507,"想本宫了没"
1508,"说富察家最厉害的可能没看过独孤天下，3个皇后"
1508,"本宫的好弟弟"
1508,"别摸我脸行吗"
1508,"我跟高贵妃打麻将了"
1508,"他演技还不错"
1508,"娘别再摸我脸了，粉都抹掉了"
1509,"大猪蹄子是什么"
1509,"富查家的人感觉都好善良啊"
1509,"富察皇后最棒"
1509,"多年没见，我出来冒个泡"
1509,"怎么不长胡子"
1509,"我跟高贵妃打麻将了"
1510,"富察家才是最厉害最有魅力的!"
1510,"本宫得罪编剧"
1510,"男二这差出的够长的"
1510,"是不是想我啦"
1510,"少爷打了那么多仗，还是细皮嫩肉"
1510,"想富察皇后的第n天"
1511,"找个群演来演阿玛，剧务太能省了"
1511,"能不能不这么帅"
1511,"顺嫔还能出来吗"
1511,"本宫长的美吗"
1511,"他娘居然在看他"
1511,"我娘还看我呢"
1512,"安儿是富恒的弟弟？？你怕是醉了吧"
1512,"哈哈哈哈，媳妇儿下线了噜噜噜"
1512,"璎珞快回去吧，再不回去有人抢你饭碗了"
1512,"不提我一下吗"
1512,"又不是你儿子还挂牵"
1512,"尔泰怎么出来的"
1513,"哪像是打了这么长久仗的脸啊，傅恒大人太嫩太俊了"
1513,"宝宝要吃盒饭吃盒饭吃盒饭"
1513,"只有我觉得傅恒他娘和舒嫔长得像吗🙃️"
1513,"我什么时候上"
1513,"安儿跟傅谦很好啊"
1513,"额娘头发白了"
1514,"富察家两个孩子都是极好的"
1514,"心里好高兴，憋住，不能笑。哈哈哈哈哈哈😄"
1514,"请大家支持正版好吗"
1514,"为什么在战场上的人比朕还要白"
1514,"哈哈哈，喊打喊杀的儿媳妇"
1514,"傅谦还没成亲吗"
1515,"不知道为何，看到傅恒就想起我弟弟"
1515,"你们懂什么？我打仗这三年每天都有认真敷面膜。"
1515,"我们要为延禧拉收视率"
1515,"心怡前来追剧"
1515,"演员辛苦希望大家支持正版"
1515,"我明明加速却感觉不出来"
1516,"福康安也挺厉害"
1516,"本宫就是生不出女儿来"
1516,"叫小君的那个站住"
1516,"今天周一也更新啊"
1516,"人少了好多"
1517,"改叫喜塔腊氏了哈哈哈哈哈哈"
1517,"本宫家里就是好也没有那么多麻烦，继后就不一样了"
1517,"安儿到底谁的儿呀"
1517,"我不管我最帅"
1517,"海兰察出去打仗咯"
1517,"本宫就要归来"
1518,"傅樱大旗不倒不倒"
1518,"我高可爱盒饭可是吃够了"
1518,"喜悦之情溢于言表"
1518,"高兴的不知所措蒙蒙哒"
1518,"白月光是啥意思啊"
1518,"想本宫了吗？"
1519,"当然是用了悦诗风吟面膜"
1519,"盒饭吃多了，可否加一份大闸蟹。。?"
1519,"好骄傲啊弟弟呜呜呜"
1519,"什么时候轮到本宫出场"
1519,"好开森啊，好开森"
1519,"怎么不长胡子呢？"
1520,"程如海大猪蹄子"
1520,"本可爱吃饱了"
1520,"这演员是如萍吗"
1520,"大家想我高可爱了吗？"
1520,"要办庆功宴"
1520,"牛琛你个大猪腰子"
1521,"少爷还是那么白"
1521,"天呀，丧偶了，好惊喜呀"
1521,"一回来就听到自己媳妇去世的喜讯"
1521,"我就是那么厉害想跟我斗😏"
1521,"顺嫔还有3秒到达战场"
1521,"哦～好嗨呦感觉人生已经到达了巅峰"
1522,"丧偶了开心不"
1522,"心里好高兴"
1522,"这个剧情好"
1522,"做梦都要笑醒了"
1522,"安儿是三少爷的儿子"
1522,"本宫都吃了多少集的盒饭了"
1523,"傅恒:媳妇死了，好开心✌"
1523,"哇，突然好开心"
1523,"去看谨言直播啦"
1523,"哈哈哈哈丧偶了太开心了"
1523,"认真看了吗？？安儿是皇上的"
1523,"做梦都要笑醒了"
1524,"好开心要忍住"
1524,"尔晴死了，高不高兴"
1524,"延禧攻略大旗摇起来"
1524,"我可真开心啊"
1524,"啊？我丧偶了？？真是太高兴了哈哈哈哈"
1524,"额娘，你头上套了个什么你的头发呢"
1525,"这个也是大猪蹄子"
1525,"好开心呀，憋住不要笑"
1525,"怎么突然叫喜塔腊氏了"
1525,"一丝窃喜从心中划过"
1525,"顺品赶紧上线啊"
1525,"心想谁帮了我"
1526,"开心到飞起"
1526,"内心止不住的窃喜"
1526,"宝贝自己，你个大猪蹄子，😄"
1526,"怎么不见五啊哥看我"
1526,"忍不住笑出了声"
1526,"本宫这就被你们所遗忘了？"
1527,"多吃核桃好，越吃越聪明"
1527,"喜塔腊氏领盒饭了？好开心"
1527,"白内障，看不清，莎普爱思滴眼睛"
1527,"我爸收拾好贵妃"
1527,"核桃演的好"
1527,"比打胜仗还高兴"
1528,"傅恒丧妻本宫也很开心"
1528,"好激动啊但是不敢表现太明显"
1528,"啊，我媳妇死了，开心啊"
1528,"我好快luo💩我不能笑"
1528,"请了三年连个牌都还请不回来吗！"
1528,"忍住不能笑"
1529,"高不高兴开不开心"
1529,"本宫投胎做知画去了"
1529,"两倍看敲核桃很好玩哦"
1529,"我努力不让自己笑出来"
1529,"忍住不能笑"
1529,"啊，我媳妇死了，开心啊"
