time,content
729,"瑜妃要是有这应变能力有这头脑她早厉害了"
730,"纯妃的盒饭马上热好了，请稍等"
730,"纯妃你的盒饭到了祝你用餐愉快"
730,"叶太医好可爱"
730,"快了快了，臣妾吃了饭再去"
730,"叶天士这么正直真奇怪他是怎么活到现在的"
730,"纯妃一起来咯"
731,"纯妃倒了皇后也是开心的"
731,"难怪五阿哥活不长"
731,"但是对老人孩子都害的人不能称之为人，是牲畜"
731,"没错。刘太医是本宫的人"
731,"叶叶太医医术高明"
731,"妹妹们你们继续我先走了"
732,"皇后演技不错呀，怪不得是影后"
732,"好了好了，我饿了先温盒饭吧"
732,"叶太医好可爱啊"
732,"哈哈哈哈你们都是大猪蹄子"
732,"纯妃长得像孙俪"
732,"张院判那个别走我居然也觉得是张院判"
733,"皇后反应好快，正好想送纯贵妃去领盒饭"
733,"纯贵妃你的盒饭热好了，"
733,"叶天士侧脸好可爱"
733,"纯贵妃，下来吧，我们一起去打麻将啊"
733,"刘太医作了太多伪证该开除了"
733,"耳环演技不错"
734,"皇后娘娘，这刀补的好"
734,"要想后宫站的稳身后必有一位好太医"
734,"目前看皇后还是很好的"
734,"太好了又一个人头回去又可以剪蜡烛啦"
734,"五阿哥长大真不容易"
734,"我劝你们善良"
735,"愉妃的做法如同武媚娘当初对待自己的孩子这样才有大局"
735,"我帮纯妃热好了饭"
735,"愉妃要是死了五阿哥以后也会出事，必须把纯妃拉下来"
735,"确认过眼神是要领盒饭的人"
735,"皇后娘娘，这刀补的好"
735,"要想后宫站的稳身后必有一位好太医"
736,"这刘太医早就该领盒饭了，不是好东西"
736,"才知道本宫和隔壁香蜜的风神是同一人"
736,"愉妃其实是在帮璎珞"
736,"愉妃你就不是个东西"
736,"看到这里声音放到最大解恨"
736,"本宫聪明吧，大猪蹄子"
737,"愉妃，纯贵妃快来和本宫与高贵妃搓麻将"
737,"我狠话不多，总是一句就扎心了"
737,"到后面愉妃走了，才告诉魏璎珞自己只能这么帮他"
737,"强迫症表示本宫的衣服不对襟"
737,"来吧纯妃热腾腾的盒饭端好了吧"
737,"最后一根蜡烛是纯妃"
738,"这个太医原来就帮高贵妃给愉妃灌毒药，竟然还活到现在"
738,"本宫说话时候的断句还不错吧"
738,"佘思曼脸最小好嘛，就是脸长了点……"
738,"所以皇后这个时候是好的吗"
738,"古代的太医好重要随便就能害人"
738,"本宫演得好"
739,"怪不得五阿哥活的不长"
739,"刘太医怂的好快"
739,"这是刘太医哦，张院判年轻一点"
739,"皇后的指点好啊"
739,"愉妃做个好人可以吗"
739,"纯妃快来抓住七夕的尾巴一起过节"
740,"一脸忠厚相，刘太医角色导演选错人了"
740,"本宫的盒饭热好了吗"
740,"愉妃眼神说，可等到了"
740,"叶太医不错"
740,"刘太医演得好"
740,"本宫吃盒饭去了，你们慢慢玩"
741,"没有办法我就是这么强大啦啦啦啦啦啦啦啦啦啦"
741,"皇后目前只害害过她的人，还算善良"
741,"在宫里有个太医撑腰太有必要了"
741,"想本可爱了吗"
741,"这刘太医捅娄子捅了那么多"
741,"朕的杜比怎么不见了"
742,"纯妃是好的，很早之前就和永琪说要去讨好璎珞了"
742,"这个刘太医既然活这么久"
742,"问题是纯妃本来不是用的人参片。所以愉妃是主角这边的"
742,"来来来纯妃陪本宫"
742,"纯贵妃快下来陪本宫吧，本宫一直在等你呢"
742,"下来陪本宫吧"
743,"从第一回看到说愉妃好的就知道咋回事了不能因为人家"
743,"纯妃叶天士手中的便是你的。。"
743,"这个太医能活这么多集充钱了吧"
743,"五阿哥活着不容易"
743,"盒饭热好了"
743,"叶天士好可爱"
744,"这个太医命太大还没死"
744,"就没看出来愉妃是好的，只是为自己罢了～"
744,"榆妃那表情亮了"
744,"张院判你什么时候改成刘太医了"
744,"历史上叶天士的医术就很高超"
744,"我有主角光环，啦啦啦啦啦啦，你们能把我怎么样"
745,"感觉叶天士才是璎珞最得力的帮手，已经帮她好多回了。"
745,"我到底是好是坏"
745,"都是高级玩家"
745,"这个刘太医真能活"
745,"太医不容易呀"
745,"生在皇室真的是难得活下来"
746,"愉妃看到太医承认松了一口气哈哈"
746,"愉妃虎毒都不识子啊那是你娃儿啊！"
746,"吃海底捞的那个你的玫瑰花估计是专门给单身人士的吧"
746,"嘉嫔怎么没得心里没数吗还用这招"
746,"这太医犯了好几次了怎么还活着"
746,"本宫的大招好了！！！"
747,"愉妃真没看出来好的明明就是纯妃倒了反咬一口啊"
747,"朕的后宫都是套路"
747,"有个太医朋友多重要"
747,"你们都是回来看的吗？"
747,"你们都说愉妃是好的，她好在哪了？"
747,"这个太医还是院判，可以领盒饭了"
748,"这个太医老是误诊还没被处死也是命长"
748,"愉妃，你可知罪"
748,"闲皇后还是不错的"
748,"大招放起来"
748,"七夕了纯妃要快点杀青去过节啊"
748,"哈哈，本宫帮你辩解"
749,"刘太医竟然活了这么多集"
749,"纯妃，戏我可陪你演了结果我我不负责啊"
749,"纯妃太坑了愉妃要举报她"
749,"纯妃，本宫等你多时了"
749,"剧情设计的太简单了"
749,"这太医才早该领盒饭了"
750,"皇上龙袍上的龙🐲，笑的好开心😂"
750,"令妃，本宫就帮到这儿了"
750,"愉妃哪里是好的……"
750,"纯妃给领盒饭了"
750,"朕的后宫真不清静"
750,"看我拿双杀"
751,"感觉供出愉妃，愉妃不紧张反而还松了一口气"
751,"这个刘太医辫子白的啊细节好评"
751,"原来是永琪的妈害了紫薇的妈"
751,"为什么叫我大猪蹄子"
751,"哎、自己孩子都下得去手，真是损人不利己啊"
751,"发盒饭咯！赶紧来吃"
752,"说分不清珍儿和玉壶的你是傻子吗，珍儿比玉壶好多了"
752,"愉妃真不像好人"
752,"嫁给永远不会疼你的人，说他父母都是这样什么节都不管"
752,"真是没节操啊，还没咋样呢，就都交代了"
752,"俞妃你就那么是非不分没有立场吗？"
752,"纯妃你先走"
753,"刚刚令妃那个表情就知道愉妃出招了"
753,"本宫即将带着纯贵妃一起领盒饭"
753,"刘太医就没有诊断对过，这等庸医居然能活这么久"
753,"大家还记得我高可爱吗"
753,"看不懂愉妃的戏"
753,"气的朕的龙袍都瞪眼睛了"
754,"愉妃是自作孽，不可活"
754,"完了，这个大本宫顶不住啊"
754,"这个太医也不是什么好东西"
754,"这张院判才是庸医啊"
754,"愉妃我劝你善良🍱"
754,"看不懂愉妃的戏"
755,"愉妃为了能赢，不惜伤害自己孩子"
755,"没办法了本宫只能实施计划2⃣️了，还好早让五去讨好"
755,"刘太医头发做的不错"
755,"还是本宫厉害早就看穿了一切"
755,"太医演的不错"
755,"这张院判才是庸医啊"
756,"愉妃要开大了"
756,"吐出来的给愉妃吃灌进去"
756,"吐槽配音的，这是阿舍的专用配音好嘛"
756,"袁春望我劝你善良"
756,"五阿哥真的好不容易啊活下来小燕子你要好好珍惜"
756,"没办法了本宫只能实施计划2⃣️了，还好早让五去讨好"
757,"来人啊，再把纯妃的盒饭热一热，她马上来领了"
757,"原来五阿哥死的早是有原因的"
757,"皇后的这碗稀泥活的好啊"
757,"陷害我有意思吗？知不知道我有主角光环"
757,"瑜妃是好滴，为了扳倒"
757,"朕发现今天都是单身之人"
758,"不想愉妃领盒饭"
758,"来呀拉下去斩了愉妃打入冷宫非死不得出"
758,"愉妃太没良心了，忘恩负义！"
758,"老娘轻敌了，着了你们的道"
758,"纯贵妃，你的外卖到了"
758,"收了金子，，"
759,"瑜妃是故意的，只有这样做才能拉纯妃下水，才能供出他"
759,"还是我单纯"
759,"这个太医怎么能活这么久"
759,"历史上叶太医也活了七八十岁哈哈啊"
759,"纯贵妃，你的外卖到了"
759,"收了金子，，"
760,"他是想保护自己儿子，交给令妃，好套路阿"
760,"我觉得瑜妃本来是想害璎珞但是害不成才拉纯妃下手的"
760,"永琪长这么大，不容易啊"
760,"愉妃纯妃都赶紧领盒饭吧！"
760,"看不懂愉妃的戏1"
760,"皇后演的好"
761,"愉妃真的是好的，再看十分钟你就知道了"
761,"纯贵妃您的七夕礼物马上到了请查收"
761,"说实话，先不论演技，就论服装延禧也甩了如意几条街"
761,"刘太医，你可以去领盒饭了"
761,"愉妃你的盒饭已热好，快去领吧！！！"
761,"有个清明的太医是很重要的"
762,"刘太医竟然活了这么多集"
762,"本可爱走了那么久了，也不想想我"
762,"俞妃为了给皇后报仇，搭上自己的性命"
762,"你们都给我唱征服吧"
762,"这到底是张院判还是刘太医"
762,"要领盒饭了嘛"
763,"说愉妃坏人的看着就好"
763,"本宫突然觉得脸好大"
763,"真有母亲会舍得用儿子的身体健康去陷害他人报仇吗？"
763,"听到永琪这个名字好出戏￼"
763,"这届扛不住啊，这速度不经大啊"
763,"纯妃，我等你"
764,"愉妃是好的啊"
764,"本宫为了帮璎珞都把儿子利用了"
764,"纯妃怎么智力下降了，没有以前聪明"
764,"我怎会伤害五阿哥呢，我还要做他媳妇儿呢"
764,"真是厉害了，拿自己孩子利用"
764,"二倍速给你带来精彩世界！！！！！"
765,"刘太医手颤抖的好评。手演技实在是高"
765,"活这么大年纪了要善良"
765,"这是刘太医，有些人不知道是咋了。没长眼睛👀嘛"
765,"七夕大家都过得好嘛～"
765,"愉妃始终还是璎珞的人啊"
765,"我今天没领盒饭"
766,"傻白甜真多，看不懂还喜欢乱说啊，俞妃好的，好的"
766,"這麼容易就招了"
766,"想问愉妃啥时领盒饭"
766,"本宫来助攻了"
766,"把脉能把出那么多内容嘛？"
766,"本宫等不及了"
767,"纯妃/愉妃一领盒饭就是王者局了"
767,"本宫清楚的很，给你们来个助攻..."
767,"顶戴演的好"
767,"他不是张院判，是刘太医，张院判是另外一个人"
767,"佘诗曼演技好"
767,"叶太医好像我们高中物理老师"
768,"愉妃好演技"
768,"纯贵妃，我马上来陪你"
768,"刘太医天天犯错，这名也够长的啊！"
768,"本宫要领盒饭了，大家不要想我哦"
768,"当个太医真不容易"
768,"不要说本宫"
769,"愉妃之前就说过哪怕吸收自己也要搬到纯肥你们都忘了？"
769,"我好厉害呀"
769,"愉妃明明是为了自保才拉纯妃下水的，风吹两头倒的人"
769,"叶天士棒棒噠"
769,"至今还有人以为愉妃在演戏说了他只是帮自己"
769,"本宫要领盒饭了，大家不要想我哦"
770,"刘太医好容易被收买，被蛊惑啊"
770,"我就混个助攻就行了"
770,"她指正纯贵妃也是为了自己"
770,"瑜妃盒饭很好吃的"
770,"招供也太快了"
770,"大家怎么看出逾妃卧底了"
771,"不是说瑜妃是好的吗，怎么看不懂呢"
771,"什么时候我出场"
771,"朕早就说这个太医要第一个领便当"
771,"想本宫了吗？"
771,"叶太医捅的好刀"
771,"我饿了，盒饭呢？"
772,"愉妃没领盒饭，把五阿哥托付魏璎珞之后出宫了"
772,"都去过情人节了，人都少了"
772,"五阿哥活的真不容易"
772,"尔晴也快了，领盒饭"
772,"叶太医捅的好刀"
772,"什么时候我出场"
773,"说好的，显然陷害不成反陷害好吗"
773,"来人，纯妃的饭盒热了马上来"
773,"紫薇，小瑾瑾，你俩看到这了吗"
773,"我早就想弄纯妃了"
773,"纯贵妃要不行了"
774,"璎珞眼睛无神的原因是眼睛太大"
774,"瑜妃，还敢跟我斗?！看姐不整死你"
774,"俞妃是因为纯妃那句出了事也查不到她头上才找璎珞"
774,"你好大的但仔"
774,"这个帽子演的好"
774,"你们都太弱了都不是本宫的对手"
775,"纯妃策划的不错，唯一的错误就是让自己的宫人领人参"
775,"就是这么棒"
775,"阿舍演技真的好，细节的地方，真的"
775,"给了愉妃一个台阶下"
775,"五阿哥是乾隆最看中的皇子，后面还被人害过"
775,"这智商还想害"
776,"愉妃是好的你们这些人永远只看表面"
776,"好了本宫要去找高贵妃了别拦着我尔晴走啊一起"
776,"愉妃开大了"
776,"纯妃，本可爱喊你一起领盒饭"
776,"瑜妃想让大家知道自己和纯妃一伙，这样就是受他指使"
776,"五阿哥你额娘怎么这样子了"
777,"我还以为纯妃黑化后会有多强"
777,"一直以为愉妃是好人"
777,"这样就算把纯妃搞下去了愉妃也得出点事"
777,"你们要善良"
777,"别自以为是了愉妃就是好的"
777,"愉妃开大了"
778,"愉妃故意害璎珞的,这样可以救他儿子"
778,"朕的脑阔疼"
778,"愉妃曾经还说再也不陷害令妃了，骗人的吧"
778,"朕的媳妇真聪明"
778,"愉妃哪里好了"
778,"哼，纯妃，有你的好日子了！"
779,"愉妃要牺牲自己吗"
779,"盒饭快热好了"
779,"瑜妃什么时候升到妃位的"
779,"五阿哥能长这么大也是不容易啊"
779,"节奏太快，跟不上节奏了"
779,"朕的脑阔疼"
780,"愉妃用自己的命拉纯妃下水"
780,"瑜菲演的好啊"
780,"逾妃真的是好的？"
780,"我去领盒饭了大家不要想我"
780,"这就是前几集俞妃给令妃说的以后把您照顾五阿哥"
780,"瑜妃什么时候升到妃位的"
781,"自从愉妃投靠纯贵妃时，我就认定她黑化了"
781,"每次都想给叶太医加鸡腿"
781,"每个冠军背后都有一个好太医顶起顶起"
781,"瑜妃这是临时倒戈"
781,"每次都化险为夷高级玩家就是厉害啊"
781,"这就是前几集俞妃给令妃说的以后把您照顾五阿哥"
782,"最后会把纯贵妃拉下水的愉妃是好的"
782,"一首凉凉送给自己"
782,"愉妃不该活这么久，后宫不适合她"
782,"瑜妃你个白眼狼！"
782,"愉妃真是演技渐长"
782,"你们走着瞧"
783,"处置你就不会手软心软了"
783,"纯妃导演叫你去领盒饭🍱🍱🍱你肯定饿了来吧"
783,"榆妃也不是个好东西"
783,"本宫后来还保护了五阿哥的媳妇儿呢怎么害他呢"
783,"愉妃和令妃的计谋"
783,"一首凉凉送给自己"
784,"一看愉妃就是为了让纯妃相信他"
784,"本宫要盒饭。本宫要吃狗粮"
784,"愉妃是故意拉纯妃的吧"
784,"皇后娘娘，臣妾来陪你了～"
784,"这位太医有做过医者该做的事吗就会害人"
784,"怎么摊上这样的毒妇"
785,"感觉愉妃也不是好的"
785,"这是渝妃设计好的，所以她早早就把永琪带着跟璎珞混好"
785,"真没看出来瑜妃哪里是好的了"
785,"大招好了待我放出来"
785,"纯妃一看就觉得事情不简单了"
785,"来来来，领盒饭了，还热着呢"
786,"愉妃是想帮皇后报仇拉下纯妃"
786,"愉妃打入敌人内部就是要与纯妃同归于尽？"
786,"这哪里是纯妃完全就是另一个人智商下降的不要太厉害。"
786,"被你们说的自己都不知道自己是好是坏了"
786,"只有把事情闹大，牺牲自己才能保全儿子"
786,"天啦明眼一看就知道皇上宠谁，不然早就给令妃拉走了。"
787,"感觉愉妃一直是为了自己的儿子活得"
787,"于非是要拉纯妃下水啊，不惜自己的儿子！"
787,"愉妃就是牆頭草。還這麼多人說她好？"
787,"领盒饭🍱吧！"
787,"盒饭快好了"
787,"愉妃真是愚蠢之极"
788,"愉妃就算把纯妃拖下水也是为了保全自己算什么好的"
788,"本宫的演技是不是特别棒"
788,"你看纯贵妃奴才的眼神，看着要笑死了可以做表情包了"
788,"马上就要去领盒饭了开心"
788,"上次是吃烧饼这次是吃人参，愉妃真是用生命在吃啊"
788,"把愉妃打入冷宫"
789,"纯妃大的丫鬟大龅牙藏不住了"
789,"皇上，臣妾给您指条明路吧！是纯贵妃"
789,"不想给你们解释了自己看吧俞妃好的"
789,"本宫要开大啦"
789,"纯妃旁边的丫鬟表情好到位啊"
789,"上次是吃烧饼这次是吃人参，愉妃真是用生命在吃啊"
790,"愉贵人的声音是新还珠里面紫薇的配音啊"
790,"说明了宫里得要有个站自己的太医"
790,"我觉得愉妃也没有什么立场，她就是为了自己和五阿哥啊"
790,"好想扇玉壶啊那白眼翻得"
790,"纯妃的宫女戏太多，赶紧领盒饭走人"
790,"纯妃大的丫鬟大龅牙藏不住了"
791,"愉妃好聪明早就安排好了永琪的庇护伞，这一计是故意的"
791,"纯妃身边这丫鬟戏太多了，居然比本宫的还多"
791,"如果不是到了这步她会咬出纯妃？愉妃到底哪好了？"
791,"要领盒饭了，愉妃"
791,"愉妃大招好了"
791,"玉壶长得有点一言难尽"
792,"纯贵妃身边那个宫女玉壶的表情说明了一切你门看"
792,"纯妃，吃顿好的上路吧"
792,"总觉得玉壶表情很欠扁啊好想手撕她"
792,"我饿了什么时候领盒饭啊🍱"
792,"尔晴纯妃赶紧领盒饭，好来陪本宫和高贵妃打麻将"
792,"纯妃，你的眼神"
793,"愉妃是不是从一开始就想拉着纯妃一起死？"
793,"憋急，本宫要放大招了😇"
793,"纯妃身后的奴才戏也太多了吧"
793,"是纯妃，今个拉你下水"
793,"没办法举报纯妃这是好的吗"
793,"总觉得玉壶表情很欠扁啊好想手撕她"
794,"逾肥是什么好的请问？沙壁一个"
794,"愉妃为了扳倒纯妃才故意这么做的吧"
794,"愉妃是想借机摆脱纯妃吧"
794,"我劝你们善良"
794,"為什麼那個玉壺那麽多鏡頭"
794,"是纯妃，今个拉你下水"
795,"愉妃也聪明了，知道纯妃不倒以后就可能倒在纯妃手里"
795,"渝妃这招同归于尽真的太优秀了！"
795,"盒饭盒饭免费不要钱纯妃愉妃快点领起来"
795,"每次手下败将的台词都一样，听腻了，没成就感啊"
795,"愉妃并不是好的，她是没办法"
795,"北宫疯起来连儿子都毒"
796,"愉妃就是为了她自己啊没查出来就害令妃查出来推给纯妃"
796,"说谁给你这么大胆子"
796,"妈耶忍不了玉壶了戏多得要命"
796,"纯飞,你安心去吧！"
796,"这个剧的大龅牙真多"
796,"每次出手都失败啊，现在大招也放了，快给我盒饭吧"
797,"愉妃苦肉计一切都是为了五阿哥，演戏给纯贵妃看的。"
797,"愉妃，我劝你善良"
797,"纯狗的丫鬟狗表情真是绝了，就凭你这演技也像圈粉?"
797,"老娘要开大了"
797,"愉妃只有这样做才能拖纯妃下水"
797,"说谁给你这么大胆子"
798,"愉妃感觉太脆，怎么会生出五阿哥这样的人才"
798,"拜拜，各位亲，不要想我，我领盒饭去喽"
798,"愉妃用自己带走了纯妃还险些害了亲生儿子不容易"
798,"一群不省心的女人"
798,"盒饭热好了，纯妃饿了吧"
798,"愉妃只有这样做才能拖纯妃下水"
799,"她这是想拉上自己来拖纯贵妃下水吗"
799,"盒饭热好了🍱快来陪我"
799,"厉害，没有一个人是简单的"
799,"本宫的盒饭已经热好了。"
799,"哎，这女人，影帝吧，变得这么快"
799,"奥斯卡欠我一个小金人"
800,"愉妃每说一句话都大口喘气听得不舒服"
800,"我大招CD已经好了纯贵妃领盒饭吧"
800,"愉妃真的神态什么的都像在见风使舵还珠里也不喜欢她"
800,"盒饭热好了吗"
800,"榆妃是为了让纯妃露馅，不惜牺牲自己"
800,"皇上衣服上的龙让人有点出戏啊"
801,"愉妃是想用自己犯错把纯妃供出来搬倒纯妃"
801,"本宫早劝你善良"
801,"这样看大猪蹄子头好大"
801,"龙认真的吗"
801,"是看在蛙哥的面子上都说鱼妃好的吧，分明就坏人0"
801,"夜壶的嘴真醉了"
802,"愉妃是好的，这群傻子怎么就看不明白呢"
802,"只有我觉得皇上很闲吗"
802,"这大热天的盒饭给纯妃加杯冰可乐吧！"
802,"把纯妃拉出去斩了"
802,"愉妃呀生命在演戏"
802,"该我出场喽"
803,"愉妃穿绿衣服了可能要挂"
803,"静好，快来，来陪我"
803,"纯妃是想杀令妃想疯了，太急了"
803,"愉妃，你是来娱乐的吗"
803,"主角光环就是这么强大"
803,"纯妃请你去洗澡"
804,"愉妃到底是好是坏人啊，求解"
804,"盒饭本宫替你热好了🍱"
804,"人参片怎么吃的下去？？？厉害👍[惊讶]"
804,"夜壶，你主子要和本宫打麻将了知道不"
804,"你们爱怎么逗怎么逗我媳妇璎珞最棒！！！"
804,"本宫演技好吧"
805,"愉妃其实并不是为了扳倒纯贵妃"
805,"纯妃，盒饭热好了！！！"
805,"小燕子飞飞五阿哥追，尔康采花送紫薇"
805,"竟对自己的儿子下如此毒手拖出去斩了"
805,"这不是当年嘉宾的手段嘛"
805,"夜壶，你主子要和本宫打麻将了知道不"
806,"大猪蹄子的龙真是可爱极了"
806,"本宫的盒饭热好了么"
806,"纯妃黑化，有一大半来自她的陪嫁丫头，自作聪明"
806,"快夸本宫，本宫厉害吧"
806,"平白……这个词用的好……"
806,"这回真的要放大了"
807,"都说虎毒不食子，你也是厉害了，是要效仿嘉嫔吗？"
807,"你们怎么演那么久？我早就领盒饭了。"
807,"高看了纯妃的智商"
807,"也不厉害吗"
807,"我希望剧情再高级一点不要每次都这么容易破案"
807,"朕好苦，这后宫的女人各个都这么不让人省心"
808,"高贵妃：盒饭热了一次又一次"
808,"本宫这演技连我自己都佩服自己"
808,"嘉嫔也是这样做的"
808,"愉妃到底是好是坏"
808,"刚刚那是高贵妃身边的宫女吗"
808,"还不是那自己孩子开刀"
809,"永琪命好大"
809,"杀敌一千，自损八百！我感觉寄几好厉害呀！"
809,"愉妃这一招叫天地同寿"
809,"丫头把嘴给本宫闭紧了"
809,"纯妃优势很大，纯妃a了上去，纯妃打出gg"
809,"大招已经好了"
810,"愉妃故意的想保护儿子跟着玲妃害怕自己保护不了他"
810,"本宫就等着皇上这么问呢！目的达成，开心开心"
810,"这剧哼的最多了"
810,"你快来领盒饭吧，我已经给你热好了"
810,"丫头把嘴给本宫闭紧了"
810,"大招已经好了"
811,"愉妃是好的，一群看不懂的孩子"
811,"玉壶龅牙演的好"
811,"所以以后永琪得到令妃庇护比自己强多了"
811,"本宫怎么还没出场"
811,"愉妃是故意的，这样可以让永琪被送到璎珞身边"
811,"开大了开大咯"
812,"哇塞太聪明啦这下永琪就可以让璎珞照顾了"
812,"大家是不是都先看这里了"
812,"俞妃不是好的她是两天后路都有准备"
812,"我就是神助攻"
812,"大猪蹄子的衣服都穿起毛了"
812,"今晚我就领盒饭了，舍不得你们"
813,"愉妃是好的只是在演戏"
813,"本宫怎么感觉右眼皮跳了一下，似乎有事情要发生"
813,"各位注意，前方愉妃高能预警"
813,"sheigeini谁给你这么大的胆子梁静茹吗？"
813,"这鱼妃用的招式不是跟上次大嘉嫔一样一样的"
813,"大家是不是都先看这里了"
814,"愉妃是好的他把五阿哥送给了令妃就来揭纯妃的真面目了"
814,"令妃，本宫能帮你的只有这么多了，照顾好吾儿。"
814,"感觉愉妃谋划已久，就等着跟纯妃同归于尽"
814,"大猪蹄子好可爱喔"
814,"好啦好啦领盒饭去吧"
814,"以为朕不知道你的靠山是纯妃吗？快把她供出来"
815,"愉妃是狼人杀中的猎人啊"
815,"请叫我愉则成"
815,"窗户是认真的吗"
815,"纯妃来陪本宫"
815,"永琪好无辜"
815,"感觉愉妃谋划已久，就等着跟纯妃同归于尽"
816,"看不出愉妃是为报仇联合璎珞对付纯妃反而是站纯妃边的"
816,"有个丫鬟好眼熟好像是高贵妃的贴身丫鬟"
816,"纯贵妃身边的大宫女能不能把龅牙收一收"
816,"你敢糊弄我大猪蹄子"
816,"大招已经好了，准备开大"
816,"来人啊，把纯妃盒饭备好"
817,"俞妃也是为了儿子，这是给儿子找个新妈，就是令妃"
817,"愉妃赶紧放大招本宫等着看好戏呢"
817,"确认过眼神，是纯~纯~纯妃给的胆子"
817,"本宫感觉不太妙啊"
817,"被女人耍的团团转的搞笑大猪蹄子"
817,"快啦纯妃下水"
818,"我不信你们还看不出来这整个是愉妃设下的圈套"
818,"本宫要开大了"
818,"看清楚玉壶的表情多神呐"
818,"皇上的戒指好潮"
818,"纯贵妃去厨房领盒饭去吧"
818,"本宫感觉不太妙啊"
819,"开大了，愉妃，五阿哥交给了魏姐"
819,"大家做好准备本宫要开大啦！"
819,"愉妃给纯妃热的饭"
819,"朕的妃子们都是高级玩家啊"
819,"突然发现我好单纯"
819,"我们全是大鼻孔"
820,"这不很明显吗，还问还问，投靠纯贵妃不是以及很明显了"
820,"凳子演的真好"
820,"纯妃说孩子啊我都是为了你好啊"
820,"愉妃你要干嘛！！"
820,"如果令妃没查出来，就害的令妃，查出来就推给纯妃，"
820,"纯妃姐姐，你走了我才能来啊"
821,"瑜妃这是用自己做诱饵拖纯妃下水啊！智商太高！"
821,"拜拜了您嘞纯贵妃"
821,"愉妃这是牺牲自己拉纯妃下水哇"
821,"愉妃胆子忒太了吧"
821,"于飞演技好了"
821,"纯妃姐姐，你走了我才能来啊"
822,"要是没有叶天士，你们还会说愉妃是好的嘛"
822,"没想到吧纯贵妃这盒饭是买一送一的"
822,"愉妃放大招把纯妃拉下水"
822,"盒饭热了热了，这就送上路"
822,"愉妃放大了"
822,"我每次都是背后推泼助澜的那个人"
823,"愉妃没想到多吃人参会害死儿子，现在知道是纯妃要害儿"
823,"盒饭热好了，热了一个晚上，好吃不？"
823,"提前让永琪跟令妃处好关系，这样自己走了也有靠谱"
823,"左眼睛跳一跳好事要来到"
823,"我明白了，愉妃是打算牺牲自己扳倒纯"
823,"纯妃盒饭🍱已备好"
