time,content
1248,"舒贵人说话贼做作领盒饭去吧"
1248,"才发现舒贵人也是一个茄子呀"
1248,"舒贵人我劝你收手，为了你也为了高贵妃"
1248,"什么时候到本宫出场"
1249,"饭盒热好了"
1249,"没那么容易"
1249,"贵妃不作妖肯定要过的好很多"
1249,"我媳妇儿真抢手"
1249,"贵妃你可长点心吧"
1249,"我呢我呢快上来"
1250,"麽麽好聪明"
1250,"高贵妃和贵人说话好妖艳"
1250,"这个舒贵人可以去领盒饭了"
1250,"敢动我师傅，不想活了"
1250,"这个纳兰才是主角光环加持"
1250,"高贵妃你的盒饭就快要好了"
1251,"来来来地三鲜的盒饭拿好，趁热吃"
1251,"我劝你们善良，敢谋我娘子是不是都想人头落地了"
1251,"看看快快快"
1251,"我不是大猪🐷蹄子"
1251,"张嬷嬷善良的人"
1251,"你们看着璎珞像不像金星"
1252,"演员的口红涂的好无语"
1252,"舒贵人的盒饭热好了吗？"
1252,"我打赌舒贵人活不过三集了"
1252,"看来得找个叫容馍馍的才能对付璎珞了"
1252,"杨过：姑姑还是师父，我分不清"
1252,"张嬷嬷善良的人"
1253,"璎珞是皇后的人就是皇上也得让三分岂容一贵妃想杀就杀"
1253,"媳妇又一个人该死了快去准备盒饭"
1253,"雁过留声水过留痕好吧"
1253,"五阿哥很可爱"
1253,"贵妃才是个真傻子，听上贵人的话，小心掉你的脑袋"
1253,"一个老爷们看宫戏有点意思"
1254,"嚒嚒有跪的容易"
1254,"舒贵人，让你再活两集，不能再多了。"
1254,"这宫里女人是真多"
1254,"看到舒贵人就不顺眼"
1254,"要领便当了"
1254,"该我上场表演了"
1255,"觉得那个输贵人迟早会领盒饭"
1255,"本宫赏你去领盒饭"
1255,"我劝你善良"
1255,"能不能让我上场了，还演不演了！"
1255,"留不留痕不知道，拔毛是一定的"
1255,"我什么时候能见我媳妇呢？"
1256,"舒贵人是有后台吧，这么久了还没领盒饭"
1256,"耳朵这么多耳坠好重好重"
1256,"盒饭该热一热了"
1256,"璎珞深得朕心"
1256,"舒贵人太美了，好想原谅她"
1256,"没见媳妇的第一个时辰，想她想她好想她"
1257,"嬷嬷好厉害，一下就听出来她们要干嘛"
1257,"看我以后怎么整死你们两个大猪蹄子"
1257,"都是明玉的错如果不把舒贵人赶走她也不会去投靠高贵妃"
1257,"爱是一道光，绿到你发慌"
1257,"张漠漠感觉好好装扮下也会很美！！"
1257,"舒贵人什么时候领盒饭"
1258,"吃饱没事闲的只会找事"
1258,"舒贵人盒饭已经给你热好了，赶紧去吃吧"
1258,"贵妃领了盒饭高段位反派才上线啊"
1258,"我媳妇在哪呢，亲亲抱抱举高高"
1258,"张嬷嬷好优雅"
1258,"舒贵人说话的腔调像怡红院出来的"
1259,"嬷嬷以前演聊斋先生可美了"
1259,"是不是想快点领盒饭"
1259,"嬷嬷好眼熟"
1259,"我啥时候领盒饭"
1259,"金屋藏娇年纪大了也是有气质的"
1259,"我就是越挫越勇"
1260,"哪位告诉我什么是大猪蹄子，打猪蹄子啥意思"
1260,"盒饭热好了"
1260,"磨磨长得很标致"
1260,"总有刁民想害本宫"
1260,"拍个戏还的打那么多耳洞"
1260,"皇后你什么时候才能,给我生个孩子"
1261,"嬷嬷好聪明"
1261,"不准欺负我媳妇"
1261,"被你们说的每个人都有一个长得像的人😂"
1261,"呵呵瑟瑟发抖"
1261,"嬷嬷长得像袁姗姗"
1261,"我还有好久出来"
1262,"这个舒贵人是宫的四阿哥的福晋吗看着好眼熟"
1262,"舒贵人的盒饭热好了没？等不下去了"
1262,"这舒贵人的声音可真是让人听得浑身不舒服"
1262,"我觉得她不帮我我可能会让她去领盒饭"
1262,"舒可以舒服的躺下了"
1262,"贵妃要小心喽"
1263,"舒贵人我求你别坑高高了"
1263,"我最帅我最帅我最帅"
1263,"下一份盒饭以热好"
1263,"堂堂一个贵妃什么都听别人的"
1263,"叔贵人我劝你善良，你要领盒饭吗。"
1263,"我劝你善良"
1264,"舒贵人的酒窝好可爱"
1264,"舒妃你是不想活了吗"
1264,"女人都是大猪蹄子"
1264,"排位连跪心态都要崩了"
1264,"让本仙掐指一算，你距离领盒饭还有几集"
1264,"有话好好说别动我姑姑"
1265,"贵妃一点教训不记，转念就又想害人，害人害己的典范"
1265,"舒贵人你不怕朕把你打入冷宫？"
1265,"张嬷嬷也是一个重要角色，为什么没有呢？"
1265,"等着我升级打怪兽吧"
1265,"张嬷嬷人真的很好"
1265,"你要是敢害我张嬷嬷弄死你"
1266,"看一下历史好吗？嘴唇是还原历史"
1266,"谁得罪我，谁领盒饭"
1266,"为什么叫大猪蹄呢"
1266,"我快杀青了不？"
1266,"个子不高这妾"
1266,"本宫最温柔"
1267,"贵妃，我还希望你多活几集"
1267,"我到底什么时候出场合适🤣"
1267,"为什么每个人的耳朵都戴那么多个耳坠？"
1267,"我什么时候出来快放我出来"
1267,"嬤嬤挺聪明的！"
1267,"最好别动她"
1268,"舒贵人长得像林允儿"
1268,"本宫除了一身还有一身红"
1268,"舒贵人我劝你善良"
1268,"拍这部剧是不是都要打三个耳洞"
1268,"高贵妃叫高宁馨魏璎宁怎么冲撞了名字都不一样"
1268,"耳坠怎么都换了"
1269,"耳朵这么多耳坠好重好重"
1269,"每次都要点一下才有啊"
1269,"舒贵人贵人我劝你善良"
1269,"马上可能不是我媳妇了"
1269,"陌陌的鞋底好干净啊！"
1269,"我什么时候才出来？"
1270,"剧情主线来啦"
1270,"发起进攻。。。"
1270,"朕的皇宫都被你们给带坏了"
1271,"舒贵人知道的可真多"
1271,"说密子君的是认真的吗"
1271,"红姑娘领盒饭去吧"
1271,"领盒饭是啥意思？"
1271,"好像袁姗姗"
1271,"哈哈有意思"
1272,"没想到朕的后宫这么热闹"
1272,"本宫要五排你要给本宫凑人"
1272,"姑姑演得好"
1272,"你知道的不少啊贵人"
1272,"最后帮你出一招，我该领盒饭了"
1272,"哟哟哟切克闹"
1273,"什么是大猪蹄子"
1273,"不知道为什么就想弹个幕而已"
1273,"woc查这么多！"
1274,"这输贵人信息技术还挺高的啊"
1274,"主角光环！"
1274,"你知道的太多了，拖出去斩了"
1274,"导演:小舒可以领盒饭啦"
1274,"拖出去赐一丈红"
1274,"给贵妃换件衣服吧"
1275,"这是抓住真的把柄了"
1275,"你们都得领盒饭"
1275,"每个剧里都有一个包打听"
1275,"我什么时候可以"
1275,"高贵妃：舒贵人求求你，放过我吧。。。"
1275,"拖出去赐一丈红"
1276,"盒饭准备好了舒贵人快来领吧"
1276,"舒贵人，等着被斩首"
1276,"前一个嫔妃都挣扎了那么多集"
1276,"我怎么还不出来？"
1276,"她这次是真的找死了"
1276,"这是抓住真的把柄了"
1277,"不领盒饭不开心"
1277,"最爱朕的皇后"
1277,"盒饭准备好了"
1277,"我怎么还不出来"
1277,"傅恒怎么还不出来，好久没甜了"
1277,"知道的太多，活不久吧"
1278,"小姐姐后来才进宫的知道这么多啊"
1278,"呦呦呦你知道不少呢。差不多该让人给你热饭了"
1278,"舒贵人怎么知道那么多"
1278,"这小浪蹄子，你是不想活了吗？"
1278,"这女人成精了？一下了解这么多"
1278,"这部剧都得打三对耳洞"
1279,"这么快知道这么多？别人都不知道就你一个刚进宫的知道"
1279,"我强烈要求出场"
1279,"舒贵人，我劝你善良"
1279,"尔晴我劝你善良"
1279,"你们发现没有，这舒贵人和那个嘉嫔很像阿"
1279,"你们查为什么这么简单啊"
1280,"娴妃的动静不大，手段也不毒，都是借别人的手"
1280,"呵呵，看你能惹出什么幺蛾子"
1280,"我觉得舒可以去领盒饭了，看着让人心烦"
1280,"想我媳妇了"
1280,"刚进宫怎么知道的这么多"
1280,"魏璎珞和周冬雨长得很像"
1281,"你在背后做手脚，也善良不到哪里去，也不配提善良"
1281,"正黄旗还敢动，你厉害了"
1281,"每次都是贵妃的拉拢人，造成贵妃的不堪后果"
1281,"好大的胆子"
1281,"她知道的太多了！拖出去斩了！"
1281,"这女人查我媳妇等着让我媳妇送她吃盒饭"
1282,"知道的越多盒饭领的就越早呀。趁着盒饭还热赶紧走吧"
1282,"总有刁民想害媳妇和姐姐"
1282,"刚进宫的贵人，什么都知道，好神奇"
1282,"知道的挺多啊"
1282,"舒贵妃我劝你善良"
1282,"正黄旗还敢动，你厉害了"
1283,"跪一晚是靠看天象看出来这些的吗"
1283,"你知道的太多了，导演组，准备热盒饭"
1283,"知道得多，死得最快。"
1283,"我劝你们俩善良"
1283,"贵妃看来很喜欢这件绿衣服"
1283,"知道的挺多啊"
1284,"知道这么多活不长了"
1284,"本宫除了一身绿还有一身红"
1284,"书柜人怎么知道的这么多！"
1284,"就你知道的多"
1284,"张磨磨声音好听"
1284,"你知道的太多了，导演组，准备热盒饭"
1285,"这小娘子也刚进宫咋就知道过去那么多呢"
1285,"后宫吃饱了没事干是吧，天天斗"
1285,"这是打了一晚排位吧"
1285,"求求你们别害高贵妃了。。唉"
1285,"书柜人知道的太多了"
1285,"這一天你啥都知道"
1286,"慢慢看吧颠覆你们高贵妃和魏姐有一段呢不信慢看"
1286,"想整我没那么容易"
1286,"舒贵人知道的太多了"
1286,"你知道的太多了领盒饭吧"
1286,"这么多耳坠怎么弄上去的"
1286,"书柜人知道的太多了"
1287,"这连皇后都不知道的事，她一嫔妃怎知道了，编剧泄的密"
1287,"一定让你的盒饭最香"
1287,"就一个宫女这些妃子吃的好空哦"
1287,"你看你那小样"
1287,"就你知道的多，怎么不去当狗仔"
1287,"好几个女人一台戏"
1288,"这个多嫔妃难道名字一个字宫女也不能有吗"
1288,"我就是大猪蹄子"
1288,"要想生活过得去头上总得带点绿"
1288,"我就这一件衣服"
1288,"不会要拿姐姐的事情来打文章吧"
1288,"以后，我就是皇后了"
1289,"完了我觉得这两位活不久了"
1289,"她怎么知道的这么多"
1289,"好像是这个人害的阿满"
1289,"有要整什么幺娥子"
1289,"这嘉聘咋什么都知道，充了钱吗"
1289,"她咋还不去领盒饭"
1290,"可以她姐姐的案子可以清楚了"
1290,"舒贵人你知道的太多了，拉出去砍了！"
1290,"粟义博是大猪蹄子"
1290,"盒饭已经热好了"
1290,"舒贵人还有个孩子，孩子没出来怎么会领饭盒？"
1290,"被发现了嘻嘻嘻"
1291,"大猪蹄子是一个什么梗"
1291,"你知道得太多了可以去死了"
1291,"你知道得太多了！来人，拉出去枪毙"
1291,"你是不想活了是吧"
1291,"这个舒贵人你怎么知道这么多啊"
1291,"哎，配角都这么不惜命吗？"
1292,"麽麽做错什么有什么事冲璎珞来好吗"
1292,"你知道的太多了，盒饭给你热好了！"
1292,"知道太多…不是什麼好事情呢"
1292,"编剧，盒饭热好了没有"
1292,"歷史背得很熟"
1292,"哎，配角都这么不惜命吗？"
1293,"不出三个月，魏璎珞长的够快啊，之前回忆里还是小姑娘"
1293,"你是不是知道的太多了"
1293,"舒贵人功课做的好足啊"
1293,"我劝你不要惹我"
1293,"这跪人典型不想活了"
1293,"你们一天天不害人会死啊"
1294,"主角好容易查出来的事情，反派很快就能知道"
1294,"来人，把给本宫配音的拖出去凌迟！"
1294,"舒贵人你知道的太多了，拖出去斩了"
1294,"舒贵人啊你别害我了"
1294,"纯妃你知道的太多了拉下去斩了"
1294,"我才是真皇后"
1295,"舒贵人死的快了。知道的太多了"
1295,"电饭锅刚刚好"
1295,"就你话多书柜人"
1295,"你知道的太多了🤐"
1295,"高贵妃叫高什么啊"
1295,"心疼我媳妇和姐姐"
1296,"舒贵人饭盒在给你热着呢"
1296,"你知道我媳妇太多事情了，拖出去斩了"
1296,"这个女人知道的太多了，赶快赐一丈红～"
1296,"聽說阿滿和貴妃有前緣"
1296,"确认过眼神是要领盒饭的人"
1296,"舒贵人死的快了。知道的太多了"
1297,"这舒贵人怎么越看越像茄子呢没头脑装文人。可笑"
1297,"舒贵人也是刚进宫，怎么知道的这么多"
1297,"拿她姐姐说事情你死定了"
1297,"舒贵妃，你是不是太舒服了，等着以后慢慢治你"
1297,"什么身份都是三个耳洞"
1297,"聽說阿滿和貴妃有前緣"
1298,"这里头所有反派演技都太好了……让人看着都恨……"
1298,"她不配吃热好的盒饭"
1298,"舒贵人你果真是不受宠衣服都起球了"
1298,"舒贵人的盒饭热好了吗"
1298,"舒贵人:我怕是要领盒饭了"
1298,"拿她姐姐说事情你死定了"
1299,"你快去领盒饭了，你的热好了"
1299,"胆够大的，拖出去斩"
1299,"盒饭热好了没"
1299,"舒贵人怎么活这么久的"
1299,"是啊是啊好巧"
1299,"竟敢调查我，我看你是想吃盒饭了"
1300,"舒贵人可能活不长"
1300,"准备好盒饭吧你们摊上大事了"
1300,"皇后这边的人其实都挺厉害的"
1300,"主角光环强大，你能拿我怎样"
1300,"知道多了死得快，😂️"
1300,"你们怕是不知道我和导演有关系所以我没有弱点"
1301,"魏璎珞这么聪明都没查到的怎么舒贵人一下就查到了。。"
1301,"舒贵人求你消停着去好好睡一觉吧"
1301,"舒贵人最后绝对死于话多"
1301,"这眼袋都挡着看不到路了"
1301,"这姑娘怎么知道这么多的a"
1301,"我就是这么没脾气"
1302,"这个嬷嬷的演技超好，一下子就能红了眼眶"
1302,"戏不要太多，不然领盒饭的就是你"
1302,"选妃要谨慎啊，皇上选的啥人这是"
1302,"知道得太多了拖出去"
1302,"高贵妃都不知道的事，她怎么查的这么清楚"
1302,"你知道的太多了"
1303,"你知道的太多了，拖出去斩了"
1303,"喜欢张嬷嬷的朕替你们赐婚"
1303,"求求你放过高贵妃，薅羊毛也不能可着一只羊啊"
1303,"呵呵，看来你对力量一无所知啊，舒贵人"
1303,"舒贵人可是要活到最后一集的人"
1303,"你知道的太多了"
1304,"舒贵人领盒饭去吧好吗"
1304,"知道越多死的越快"
1304,"舒贵人知道的太多了，领盒饭吧"
1304,"把舒贵人拉出去杖毙"
1304,"舒贵人都能查到她姐姐的死，璎珞为什么查不到"
1304,"别盼着我出场我一出来好些人领盒饭"
1305,"舒贵人不是个好东西"
1305,"敢这么欺负我媳妇，舒贵人你可要小心了"
1305,"我劝你善良，我劝你善良，劝你善良。[000]"
1305,"自作聪明的样子,真是可笑"
1305,"一个不受宠还没侍寝的嫔妃，哪来这么多消息"
1305,"舒贵人都能查到她姐姐的死，璎珞为什么查不到"
1306,"舒贵人话太多，活不长"
1306,"舒贵人，我劝你善良，别伤害我媳妇"
1306,"盒饭热好了"
1306,"舒贵人什么时候领盒饭？？？我感觉他肚子饿了"
1306,"聪明没用在正途"
1306,"你是情报局的吗"
1307,"魏璎珞查了十几集的东西舒贵人半集就查到了，厉害"
1307,"舒贵人盒饭给你备好了来领吧"
1307,"高怼怼脑阔疼"
1307,"这个眼袋确定不去割一下吗再让本宫看到砍了你"
1307,"舒贵人盒饭已经准备好了，马上就拿去热"
1307,"我劝你善良，不然你就上路吧"
1308,"反派哦都好厉害"
1308,"舒贵人你知道的太多了"
1308,"舒贵人戏份太多了吧"
1308,"古代的女人事真多"
1308,"舒贵人演的好"
1308,"来人，将舒贵人拉出去斩了"
1309,"腿好的真快这舒贵人跪了一晚上就这么利索了"
1309,"舒贵人我劝你善良咱家璎珞知道了有你好受的"
1309,"舒贵人，我奉劝你一句，话多活不久啊"
1309,"舒贵人，我怕你实在是要去领那份饭盒了"
1309,"舒贵人，你的盒饭快好了"
1309,"本宫的小弟各个都厉害"
1310,"不是让人恨就是演技好，这只是人设"
1310,"舒贵人你敢这样查我，我让你领盒饭去"
1310,"舒贵人演的不错"
1310,"我还是太善良了"
1310,"这个嬷嬷长得像陆毅"
1310,"就是光脚不怕穿鞋的"
1311,"盒饭热了n+1遍了，求求舒贵人快去领吧。"
1311,"嫌命太长了，待会看我魏姐不把你变成大猪蹄子"
1311,"不是说事情已过去多年吗！怎么3个月"
1311,"我劝你还是善良比较好"
1311,"说了你不信舒贵人他一直活着呢！"
1311,"不是让人恨就是演技好，这只是人设"
1312,"舒贵人在发布会上已经说话了，她很幸运活到了最后"
1312,"舒贵人，朕只喜欢善良的人！"
1312,"你要比老天爷都还要厉害唷"
1312,"高贵妃那集死"
1312,"高贵葱什么时候领盒饭啊！"
1312,"总有猪队友坑我"
1313,"舒贵人是活得最长的"
1313,"盒饭热好了，快来领"
1313,"舒贵人怕是充钱了吧"
1313,"嬷嬷也很不容易。"
1313,"你知道的太多了"
1313,"真是不怕死哦"
1314,"人红是非多哦"
1314,"戏服都烧掉了，只剩这一件衣服了，嘤嘤嘤不开心"
1314,"贵人你是不是不想活了"
1314,"舒贵人我劝你善良"
1314,"魏璎珞一看就是主角，别人都是三个耳洞，她是一个耳洞"
1314,"知道的还挺多啊。"
1315,"好吧，不吃盒饭不舒服斯基是吧"
1315,"敢抓张嬷嬷，我劝你善良"
1315,"冬天护肤赶紧发图发图发图"
1315,"嫌命长了是吧"
1315,"我劝你善良"
1315,"盒饭赶紧给我热一热。"
1316,"这么厉害怎么不去围拢皇上呢"
1316,"舒贵人你知道的太多了该给你热饭了"
1316,"你知道的太多了，盒饭快拿来"
1316,"我劝你们善良"
1316,"豪华套餐安排了"
1316,"又来陷害我媳妇了"
1317,"书柜人破坏了密子君在的形象，谁准你长得像密子君的"
1317,"您的黄焖鸡米饭到了，求五星好评"
1317,"突然感觉舒贵人是背景最深的"
1317,"叫声师傅可还行"
1317,"全都去领盒饭吧，热了好多，够吃好久了"
1317,"不准欺负我媳妇"
1318,"你知道的太多了，便当已经准备好了"
1318,"舒贵人可真是厉害"
1318,"大猪蹄子什么意思"
1318,"估计下一集舒贵人盒饭就可以吃了"
1318,"麼麽才是真演技你们这帮牛鬼蛇神除了一僵尸脸还剩什么"
1318,"劝你善良不然你也得死。"
1319,"编剧良心啊，看来是有认真研究过历史的"
1319,"饭盒准备好了"
1319,"人家是姑姑又高了一个等级了好吧"
1319,"输贵人什么时候可以领盒饭"
1319,"别坑贵妃了，一次次活下来不容易"
1319,"舒贵人活腻了"
1320,"只有我觉得高贵妃长得像秦俊杰嘛"
1320,"稍后领饭盒不急不急"
1320,"嬷嬷好年轻"
1320,"书柜人，我劝你善良"
1320,"女人我劝你善良"
1320,"该去领盒饭了"
1321,"嬷嬷长得好"
1321,"刚热好的盒饭"
1321,"怎么那么多坏女人呢？看到就想打"
1321,"盒饭呢？热好了吗？"
1321,"你这查的比现在电脑查的都清楚"
1321,"又准备害我媳妇了看我媳妇怎么反击你"
1322,"舒贵人不看人设的话长得好甜啊声音也是"
1322,"我劝你们善良别作"
1322,"一计不成又生一计，连环计，点子多"
1322,"舒贵人是想领盒饭了吗？"
1322,"他们的耳坠都长一个样子"
1322,"这就是女人吧"
1323,"哇塞，看来这个舒贵人不简单啊"
1323,"舒贵人你怕是不想活了"
1323,"舒贵人长的真像张庭"
1323,"好想打舒贵人"
1323,"大猪蹄子到底什么意思？"
1323,"谁又想整我"
1324,"魏璎珞:舒贵人，你知道得太多了"
1324,"舒贵人眼睛还没恢复好"
1324,"你要知道,你的下场跟嘉嫔一样"
1324,"我劝你善良"
1324,"下一个合饭给谁吖"
1324,"我帮皇后是为了自己心爱的人富恒"
1325,"强烈要求舒贵人领盒饭"
1325,"自己吃还是我喂你"
1325,"输贵人劝你善良，不要再害我们高贵妃了"
1325,"你也想领盒饭了？"
1325,"高贵妃猪队友这么多"
1325,"你个阴险女人"
1326,"看到这个舒贵人说话就想揍她"
1326,"舒贵人，我劝你善良，要不然过几集我让你领盒饭"
1326,"衣服都起毛了果然是坏人穿的"
1326,"你们都给老娘等着"
1326,"舒贵人快领盒饭吧"
1326,"万一又失败了怎么办"
1327,"想打舒贵人就说明她要得不错"
1327,"千里送人头啊书柜人"
1327,"富察少爷再不出来，我就要打电话给皇后娘娘了"
1327,"又想欺负我媳妇儿"
1327,"舒贵人就是凤求凰里面的那个皇上的妃子"
1327,"看到这个舒贵人说话就想揍她"
1328,"你也善良不到哪儿去，在背后做手脚的人也配提善良二字"
1328,"你赶紧收拾收拾东西，去领盒饭吧！换我上场"
1328,"本宫的盒饭要加肉"
1328,"敢动我媳妇，来人拖下去斩了"
1328,"婴宁到底谁杀的呢"
1328,"这个女人这么厉害·为什么只是个贵人🐷"
1329,"领盒饭就是自己戏完手工领盒饭"
1329,"看来要叫上纯妃来治你了，唉，操心"
1329,"书柜人哪里来的那么多消息。。。"
1329,"高贵妃等着瞧"
1329,"高贵妃：我就是这么可爱～"
1329,"想吃盒饭了？等不及了？"
1330,"舒贵人怕是活不过几集了"
1330,"快到我碗里来"
1330,"盒饭热一热"
1330,"你是想领盒饭了么？"
1330,"一个个讲起话来都不是省油的灯"
1330,"你们以为舒贵人坏吗？那是因为我还没发功"
1331,"真是厉害完了唷"
1331,"感觉嚒嚒和这个贵人长得一样"
1331,"紫衣服我劝你善良"
1331,"高贵妃是被舒贵人玩死的"
1331,"舒贵人的表情能管理下吗有点做作了"
1331,"舒贵人怕是活不过几集了"
1332,"淑贵人你没有活着的必要了"
1332,"我劝你不要乱来，敢动我师傅"
1332,"舒贵人这长相演正面人物肯定很可爱"
1332,"麽麽很美的好嘛"
1332,"舒贵人戏真多"
1332,"一个小小的贵人本领挺大的"
1333,"看了这么多集，感觉这个贵妃就是个背锅侠"
1333,"舒贵人，你怕是作妖不成，又要陷害本宫了"
1333,"之前看网上说高贵妃最喜欢的戏服是魏璎宁琇的欸"
1333,"还是我善良"
1333,"馍馍一张坏人脸，看眼神表情却是一个善人，演技真好"
1333,"一个小小的贵人本领挺大的"
1334,"舒贵人长的像张庭"
1334,"舒贵人我劝你善良，我媳妇你惹不起。"
1334,"真的好袁姗姗啊嬷嬷"
1334,"你知道的太多了女人"
1334,"舒贵人至始至终衣服不超过三套"
1334,"舒贵人不出几集领盒饭"
1335,"整部剧就只有舒贵人在敬业的演宫斗剧"
1335,"作死的节奏"
1335,"磨磨其实很美"
1335,"舒贵人是不是跟嘉嫔长得一样？傻傻分不清"
1335,"为了演戏都打了三个耳洞嘛"
1335,"舒贵人不出几集领盒饭"
1336,"舒贵人什么时候领盒饭"
1336,"舒贵人你知道得太多了"
1336,"又是拿家人威胁"
1336,"舒贵人是时候该贬为答应了"
1336,"嬷嬷是赵韩樱子演的嘛"
1336,"在这个宫里就是弱肉强食的世界"
1337,"贵妃啊你长点心吧你看你都是什么队友"
1337,"舒贵人领盒饭吧"
1337,"舒贵人演现代剧肯定很可爱"
1337,"保护方嬷嬷"
1337,"舒贵人怕是活腻了"
1337,"又是拿家人威胁"
1338,"说书柜人长得像张庭的那个，根本不像好吗，张庭那么美"
1338,"一开始就知道这个纳兰不是什么好东西"
1338,"这种人怎能当一国之君的女人用人命来害人"
1338,"看她这副嘴脸真想扇她一巴掌她那个朋友真的比她好多了"
1338,"看来看去这个舒贵人也快领盒饭了吧"
1338,"保护方嬷嬷"
1339,"鼠鬼人我劝你善良"
1339,"来吃吧盒饭热好了"
1339,"舒贵人挺可爱的，甜"
1339,"舒贵人我劝你善良"
1339,"对付一个宫女下这么大劲儿"
1339,"我什么时候出来"
1340,"这猪吃太多，涨肚子了"
1340,"你也就得意这一时了等会怎么死的都不知道"
1340,"这地方不错啊"
1340,"舒贵人什么时候可以去领盒饭"
1340,"舒贵人是不是想领盒饭了？"
1340,"本宫很可爱的"
1341,"舒贵人你是饿了吗？？还是吃饱了快去领盒饭吧眼涨"
1341,"你知道的太多了"
1341,"好地方啊房子贼贵"
1341,"高贵妃，你什么时候能换件衣服"
1341,"他爱了很多人，每一个都是认真的，这可能就是帝王之爱"
1341,"什么时候领盒饭呢"
1342,"永定门。多贵一套房呢"
1342,"舒贵人我劝你善良小心我媳妇让你领盒饭"
1342,"跪一晚上能查出来这么多"
1342,"祸不及家人是说给有良知的人听的"
1342,"好耳熟的地方，哈哈"
1342,"谁敢动她哥哥，小心被朕赶出去！🌚"
1343,"大猪蹄子是什么梗"
1343,"敌人是杀不完的，留两个傻子占位总比来个高手强"
1343,"盒饭盒饭备好"
1343,"好巧我住安定门"
1343,"一个贵人还有这通天的本领？"
1343,"我劝你善良我有主角光环。"
1344,"祺贵人既视感，估计没啥好下场"
1344,"盒饭啥时候好啊"
1344,"舒贵人我劝你善良"
1344,"又有人要领盒饭了"
1344,"输贵人看来离盒饭不远了"
1344,"总是这样呜呜呜"
1345,"高贵妃就是头脑简单爱信别人的挑拨"
1345,"这个女人事真多，准备领盒饭吧"
1345,"这市场调研的能力太强了"
1345,"巧了本宫也住在永定门附近"
1345,"扇子演得好"
1345,"你能不能早点领盒饭，离我远点"
1346,"舒贵妃知道的太多了，拖出去斩了"
1346,"来人把舒贵人拖出去杖毙"
1346,"舒贵人也没有好下场，活不了几集了🙄🙄🙄🙄"
1346,"我最温柔啦"
1346,"我劝你善良"
1346,"舒贵人要领盒饭了"
1347,"这宫女双眼皮隔得好明显"
1347,"舒贵人的盒饭已备好，来领一下。"
1347,"我觉得这才是正常反应啊，整人了该笑啊"
1347,"媳妇快出场削了她"
1347,"一波人头送起来"
1347,"为什么还轮不到我出场该我和媳妇发糖了"
1348,"贵妃的脸好长"
1348,"小样，你完了"
1348,"舒贵人到第60多集都没死呢"
1348,"这个衣服上的毛一看就是刺绣的不是机器绘制的"
1348,"听着让人头大"
1348,"媳妇快出场削了她"
1349,"高贵妃就是被人牵着鼻子走，被人利用的主"
1349,"舒贵人长得有点像刘芸"
