time,content
646,"爱是一道光，，绿到朕发慌"
646,"把这个太监给朕拉出去砍了真看着他演不下去"
646,"这净军有胡子啊"
646,"劝过自己善良的，没用"
647,"会不会皇后娘娘背叛了和亲王"
647,"袁春望的盒饭已热好"
647,"领盒饭了，开心不？"
647,"就佩服那时候的信鸽，想让飞去哪里就去哪里"
647,"真是看不懂袁春望，他到底是在帮谁"
647,"袁春旺你台词太多了，朕嫉妒"
648,"快治好五阿哥的腿，还得跟小燕子谈恋爱呢"
648,"丹丹前来追剧"
648,"袁春旺是导演亲儿子么？洗这么多"
648,"皇后要领盒饭了"
648,"死太监的戏份太多了"
648,"袁春望的盒饭已热好"
649,"看了那么久了末了出来弹一弹"
649,"珍儿本宫真是白疼你了所有黑锅给我背"
649,"原春旺真是个败笔，说好的绝美男子呢"
649,"爱是一道光，绿的宝宝发慌"
649,"袁春旺咋那么多戏"
649,"朕表示袁春望是最大的败笔！"
650,"珍儿你的口味好重"
650,"珍儿疯了吗？为了这么个男人背叛自己主子"
650,"还是绿衣服看着顺眼"
650,"你的眼睛成功引起了朕的注意"
650,"难道这么多人都是傻子？就元春忘贼"
650,"袁春望你疯了吗"
651,"珍儿被人利用不轻啊"
651,"春望来来来快来陪本宫打麻将"
651,"你们说珍儿这算不算叛主"
651,"袁春望害了璎珞和皇后，不知道的以为再给高贵妃报仇"
651,"总觉得没有这么简单！"
651,"珍儿你的口味好重"
652,"大胆，敢叫朕大猪蹄子，拉出去砍了"
652,"袁哥哥你的盒饭热好啦"
652,"说袁春望变好的是魔鬼吗？"
652,"为了个死太监就忘了多年的情感了。。。"
652,"这鹦鹉好绿啊啊"
652,"袁春望朕劝你善良"
653,"珍儿就是典型的恋爱脑"
653,"大家想我高可爱了么"
653,"妈呀狡兔三窟来形容真的好吗"
653,"每天起床第一句先给魏姐打个气"
653,"总觉得袁春望在间接害皇是为了最后十五阿哥登上大宝"
653,"皇后开始作妖了"
654,"长得像何炅"
654,"珍儿和袁春望人中都好长。。。。"
654,"那个说心都化了的，心莫非是水做的"
654,"杨依舟你个大猪蹄子"
654,"心化了的你怕不是审美有问题啊"
654,"袁春望我劝你善良"
655,"劝善良的人别劝了没用的"
655,"我劝你们善良"
655,"珍儿养不熟的白眼狼啊"
655,"都给本宫善良点"
655,"今晚领饭盒的人多了"
655,"你可以把经常要输入的内容放在这里"
656,"珍儿是个大傻子"
656,"袁春望的戏份比朕还多，到底谁是男一！"
656,"永琪的大腿好细啊😊"
656,"本宫才是黄雀"
656,"我喜欢大猪蹄子"
656,"珍儿养不熟的白眼狼啊"
657,"永琪的大腿好细"
657,"袁春望活到最后，可能是太厚的儿子吧"
657,"再聪明的人也经不住信任的人背叛"
657,"腿毛演的好"
657,"这丫鬟缺男人缺到没良心的地步"
657,"就属我最皮"
658,"皇上要得不是真爱，是新鲜有趣，皇后真心也是一场空"
658,"本宫的珍儿是个傻子"
658,"大头云快滴来睇啦"
658,"珍儿，你疯啦！你怎么可以看上他"
658,"珍儿是最猪的猪队友"
658,"谭甜甜看到这儿了吗"
659,"看了半天一个人没有啊都去看直播了"
659,"珍儿我劝你清醒点"
659,"感觉后面就是袁春望的报复，全都被他算计"
659,"真相只有一个，袁春望就是容嬷嬷"
659,"为什么会有珍儿这号人物"
659,"珍儿你是魔鬼吗"
660,"这伤口演的好"
660,"小妖说大王是个大猪蹄子"
660,"所以他要绊倒皇上，夺取皇位，这就是他存在的意义"
660,"哥你鼻子好大"
660,"清朝历史里确实是魏殷洛成为了第三任皇后"
660,"爱是一道光，绿到你发光"
661,"珍兒你口味好重"
661,"五阿哥腿毛长的好！"
661,"穿绿衣服的皇后要吃盒饭了"
661,"这大腿根，好细啊"
661,"永琪的大腿好细啊"
661,"袁春旺我劝你善良"
662,"腿毛演的好"
662,"白玉你个大猪蹄子"
662,"有必要特写吗"
662,"这是大腿吗这么细"
662,"这疤痕好真"
662,"五阿哥腿毛长的好！"
663,"大猪蹄子的手演得不错哈哈哈哈"
663,"这个伤疤演得好随意"
663,"腿好细的感觉"
663,"袁春旺你的盒饭热好了"
663,"贴得好明显哦"
663,"伤口演的真好"
664,"这可能是大猪蹄子最后一次叉腰了，呜呜呜"
664,"五阿哥真是长的一腿好毛😁"
664,"这腿好细，长毛了"
664,"伤口演的不错"
664,"蛙哥的腿好细！！！"
664,"这伤口演得好"
665,"袁春望的饭盒热好了"
665,"腿毛演的好"
665,"好可爱的腿毛"
665,"腿毛演的好"
665,"这大腿好细"
665,"蛙哥的腿好细！！！"
666,"好细的腿啊好多毛啊"
666,"腿上长了像一朵莲花"
666,"一群老阿姨在夸小鲜肉嫩、帅，诶……"
666,"蛙哥好点了吗"
666,"腿这么细是认真的吗"
666,"珍儿这就是背叛还不自知"
667,"哈哈哈哈，叶大夫的小胡子贼啦啦的可爱"
667,"爱是一道光绿到你发光照亮你绿色的外表"
667,"腿上的泡演的好"
667,"袁春望我劝你善良点，不要皇后娘娘抢盒饭"
667,"叶天士也是蛙哥的救命恩人了，刚出生就救了一命"
667,"腿毛演得好"
668,"叶神医也上年纪了比年轻时多了份成熟稳重"
668,"儿啊你要听令母妃的话"
668,"后面袁春望戏实在是太多了"
668,"珍儿我劝你善良"
668,"怎么可能这么久了还没结痂"
668,"完了，我快要中毒了"
669,"永琪腿好细"
669,"妈耶，比我都惨"
669,"哇哥腿好细"
669,"这大热天的还要加条毛裤"
669,"叶神医也上年纪了比年轻时多了份成熟稳重"
669,"珍儿我劝你善良"
670,"就是，这袁春旺欺人太甚，总觉得自己有多大能耐"
670,"永琪腿上的红蜡烛油滴的不错啊"
670,"叶天士也长胡子了好可爱"
670,"儿子这腿毛是认真的吗"
670,"佘诗曼还是那么美还是那么美"
670,"蛙哥腿毛演的好！"
671,"五阿哥躺着比较帅，坐着脑袋太大"
671,"叶大夫的胡子演得好"
671,"告诉你们脓包扎了就好了"
671,"伤口演得不错"
671,"求导演让袁春望去领饭盒"
671,"本宫什么时候领盒饭"
672,"这么久了，外伤都还没有好？心疼五阿哥"
672,"这伤疤演的好"
672,"永琪腿好白"
672,"笨蛋，袁春望就是在利用皇后杀皇上"
672,"五阿哥长的帅"
672,"就这点伤就能变瘸子？化妆师不能用点心吗？"
673,"来来来都把盒饭热一下，准备开饭了"
673,"腿演得好，腿毛群众演的不错"
673,"袁春望哪里好皮囊了，一点也不帅，哼"
673,"叶天士你头好圆"
673,"长的好清秀啊"
673,"五阿哥长的帅"
674,"唯一一部黑化的坏人没有用大红唇和烟熏妆来表现的"
674,"哇哥你的腿毛是认真的吗？"
674,"袁春望就是想杀大猪蹄子啊"
674,"叶天士不可爱了哼"
674,"为什么就叶天士的年龄跨度感觉得出来特别明显"
674,"、、、刘贵胜加油刘贵胜加油刘贵胜加油刘"
675,"爱是一道光绿到你发慌"
675,"大猪蹄子你偷偷穿了本宫的衣裳吧？"
675,"叶天士长得很有喜感"
675,"叶天士好可爱"
675,"京都念慈庵研制好了吗"
675,"呀呀呀叶天士好可爱！"
676,"永琪躺下还挺帅的，怎么站起来就觉得头好大，大头娃娃"
676,"本宫的儿子好生清秀"
676,"突然感觉蛙哥好可爱"
676,"我劝你们善良"
676,"叶天士都长胡子了张院判就没有"
676,"袁春望快去领饭盒"
677,"珍儿就是养不熟的白眼狼啊，有了男人就忘了主子了"
677,"蛙哥的腿毛演得好"
677,"还是忘不了叶天士穿女装的样子，好可爱。"
677,"我这么叉着腰，是不是很到位"
677,"叶天士好可爱"
677,"叶天示发福了"
678,"皇后不急太监急快吃盒饭了"
678,"不是伤的大腿吗，怎么变小腿了。导演你可长点心吧"
678,"五阿哥的腿好细"
678,"我最帅我最帅我最帅"
678,"这个伤疤做的好特别真"
678,"做成火腿。。也是一个不错的选择"
679,"叶神医长胡子看着好稳重啊"
679,"朕手叉腰的动作真是太帅了"
679,"好清秀的腿毛"
679,"蛙哥皮肤真好"
679,"五阿哥頭好大😂"
679,"叶天士变帅了"
680,"珍儿还不是被袁春望耍的团团转，袁春望智商高啊"
680,"不要害五阿哥好吗？皇后请你善良！"
680,"这蛙哥长的真嫩"
680,"袁春望本宫劝你善良"
680,"老叶你不似当年那般机灵可爱了"
680,"皇上手插着腰"
681,"必须得治好腿，要不小燕子就不喜欢你五阿哥了"
681,"朕最心爱的儿子还没给朕娶小燕子进宫呢"
681,"五阿哥像ET一样，头好大"
681,"这个伤疤演的好最佳配角"
681,"叶大夫太阔爱了"
681,"不要害五阿哥好吗？皇后请你善良！"
682,"还是喜欢叶太医，可爱善良医术精湛"
682,"五阿哥躺下特别帅"
682,"感觉叶天士的胡子长得最认真"
682,"枕头演得好"
682,"好可爱好可爱"
682,"叶天士都长胡子了"
683,"不是演的招人恨就是好演员好吗"
683,"叶大夫最近吃好的了吧"
683,"叶神医太可爱了就是搞笑的就是给人希望的"
683,"哇哥我劝你别善良"
683,"璎珞现在是多大？"
683,"五阿哥躺下特别帅"
684,"五阿哥长的帅"
684,"朕相信叶天氏能把五阿哥的腿治好"
684,"大猪蹄子背都驼了"
684,"嘻嘻嘻开心，永琪有救了"
684,"怎么年纪大了要带点胡子啊"
684,"皇上您穿的不是臣妾的衣服吗"
685,"袁春望，你的盒饭本宫热了又热，你快来领了吧"
685,"叶太医长胡子了更可爱了"
685,"蛙哥帅爆了，去，给我领一打"
685,"为什么本宫没长胡子，胡子你在哪"
685,"腿毛好有型"
685,"五阿哥长的帅"
686,"五阿哥脑袋大，可能是因为他头套太大了"
686,"皇后有盒饭了快来吧"
686,"五阿哥头大脸小，剃了光头就是大头娃娃"
686,"🐛要被人掉包了"
686,"叶天士长得有点像年画娃娃，倍儿喜庆"
686,"一笑起来仍然可爱的叶神医"
687,"五阿哥好清秀"
687,"儿子好可怜"
687,"五阿哥好可爱"
687,"五阿哥都这么大了，紫薇小燕子还没出生呢"
687,"五阿哥的皮肤真好"
687,"富贵在看吗"
688,"这是多大的船啊堪比紫禁城"
688,"哇哥是剖腹产的吗，头好大"
688,"蛙哥长得很清秀啊"
688,"我什么时候上场"
688,"五阿哥好清秀"
688,"五阿哥都这么大了，紫薇小燕子还没出生呢"
689,"袁春旺让人看了不舒服"
689,"富贵使我们相遇"
689,"猪蹄子肥了"
689,"五阿哥是我学长开心😊"
689,"不过这费用有点高"
689,"这是多大的船啊堪比紫禁城"
690,"皇叉腰好可爱啊"
690,"本宫是皇后，当然要多几个窝了"
690,"五阿哥因为很聪明头才那么大不成比例吗？"
690,"小燕子和永琪成婚了"
690,"叶天士有胡子比较正常"
690,"富贵在看呐！！"
691,"这被子演得好"
691,"皇上衣服演的好啊"
691,"容嬷嬷被爱情冲昏了头脑"
691,"小叶叶稳重了不少啊，不像以前那么皮了"
691,"我怎么感觉伤口像花"
691,"叶天士怎么长成了万三千这副德行"
692,"还是叶天士厉害"
692,"我们五阿哥又白又嫩"
692,"五阿哥好俊啊"
692,"我觉得自己嘎嘎帅"
692,"求小燕子的心理阴影面积"
692,"怎么感觉皇上穿了璎珞的衣服呢"
693,"念慈菴蜜炼川贝枇杷膏就是好叶天士发明的。有人知道吗"
693,"如果是我家蛙哥登机，恐怕大清目前还没亡"
693,"大猪蹄子的衣服是认真的吗"
693,"这是老寒腿"
693,"哇塞塞！流殇唉，我回来看你了，大宝贝儿"
693,"皇上穿的是太后的夏常服吗？"
694,"皇桑叉腰是认真的吗"
694,"叶大夫贴了胡子更可爱了"
694,"蛙哥越看越顺眼"
694,"盒飯真好吃"
694,"辫子演的好"
694,"脸是要要的"
695,"还是现代好啊，一个手术就好啦"
695,"叶太医还是女装俊俏"
695,"皇上年纪大了，所以掐腰"
695,"永琪皮肤真好"
695,"苏文涛你个大猪蹄子"
695,"皇上乃穿的这件衣服好有女人味"
696,"大猪蹄子穿的妃子服装吗"
696,"没有叶天士蛙哥真的长不到这么大"
696,"这叶天士是全科医生啊"
696,"我头顶大草原"
696,"大猪蹄子的衣服是越看越逗😂😂"
696,"直播结束了"
697,"叶太医比年轻的时候稳重了"
697,"朕这衣服是璎珞穿过的吧"
697,"这一家三口好甜啊"
697,"太可怕了，你个小叶"
697,"小景你不去找大瑶瑶吗"
697,"直播结束了"
698,"花肉贴的不错一看就是经常吃烤肉的"
698,"我个大猪蹄子。"
698,"说受伤的地方是糖做的那个谁是认真的吗？"
698,"京都念慈庵就是叶天士弄的"
698,"叶太医比年轻的时候稳重了"
698,"小景你不去找大瑶瑶吗"
699,"一个个都长了胡子有点伤感，岁月飞逝人生不过一瞬"
699,"好清秀的姑娘呀😁"
699,"永琪从小到大的救命恩人"
699,"要做个手术快签手术同意书"
699,"叶天士脸型真好"
699,"喜欢叶太医呢"
700,"叶神医长了胡子帅的"
700,"这叶太医就是厉害！"
700,"蛙哥好善良"
700,"我这衣服是不是璎珞穿剩下的"
700,"这也太不科学了吧！烧伤是皮外伤，怎么伤到骨头了"
700,"我怎么不觉得这个医生多神？"
701,"叶天士稳当多了"
701,"叶天士又帅了"
701,"叶神医你能帮我看看吗我滑膜炎快一年了……"
701,"琪琪在看吗"
701,"叶天士好可爱"
701,"叶天士怎么连声音都变了，可见是老了！"
702,"骨头重新长好？"
702,"弹弹弹弹走鱼尾纹你的眼睛成功引起了朕的注意👀"
702,"难怪五阿哥死的那么早，受罪不少啊"
702,"叶天士比以前要沉稳了"
702,"叶太医是瘦了吗"
702,"叶天士稳当多了"
703,"骨头还能重新长好吗？现代医学也不敢这么说吧"
703,"不像船上，像是五阿哥以前宫里住的屋子"
703,"蛙哥心想，这得多疼哦！"
703,"只有我没认出这是叶天士？声音也没听出来。"
703,"叶太医看起来稳重了"
703,"容朕叉会儿腰"
704,"叶神医稳重多了"
704,"还记得叶太医的女装深得朕心"
704,"叶天士的眉毛还没长好哈哈哈"
704,"哇哥你额娘临行前在你脑袋里塞了啥"
704,"骨头还能重新长好吗？现代医学也不敢这么说吧"
704,"蛙哥心想，这得多疼哦！"
705,"好清秀的姑…嗯？老叶你咋了，怎么不似原来那般靓丽了"
705,"叶天士说话语气怎么这么正经了？"
705,"大猪蹄子穿女装了？"
705,"叶天士变帅了"
705,"叶神医稳重多了"
705,"叶天士稳重成熟了"
706,"说大猪蹄子穿着妃子的衣服的那个，你是真的皮"
706,"我觉得我好可爱"
706,"大猪蹄子好可爱"
706,"尔情我劝你善良"
706,"想看叶太医穿宫女服，可美"
706,"小姐姐看到我了咩"
707,"叶神医的胡子是他自己长的吧？"
707,"用黑玉断续膏啊"
707,"不可能吧，永琪都那么大了，夏雨荷早就临幸过了"
707,"要是真瘸了，还怎么和小燕子策马奔腾"
707,"说大猪蹄子穿着妃子的衣服的那个，你是真的皮"
707,"大猪蹄子好可爱"
708,"叶神医沉稳了很多，果然好演技"
708,"说皇上穿顺嫔衣服的，你是魔鬼吗"
708,"李诗寒看大猪蹄子了"
708,"叶天士是个内科外科全能人才呀"
708,"今天特别卡"
708,"肯定成功了"
709,"在小说里，叶神医长得很帅的"
709,"我儿子长这么大太不容易了"
709,"打麻药不就行了蛙哥你是要半麻还是全麻"
709,"你们光想叶天士想本宫了没～"
709,"求五阿哥腿好"
709,"说皇上穿顺嫔衣服的，你是魔鬼吗"
710,"不是很早之前就有麻沸散了吗？"
710,"叶神医莫非穿越来的准备做手术啦"
710,"哇哥帅的勒"
710,"掐架这么些年了成姐们儿了"
710,"以前那个可爱的叶宫女呢"
710,"求五阿哥腿好"
711,"有大猪蹄子在看吗"
711,"好孩子，蛙哥真是棒棒哒～"
711,"叶神医和璎珞是认识吗？第一次见的眼神不一样啊"
711,"别试了大侄子反正都要死🌚🌚🌚🌚"
711,"治好了反正"
711,"沈煜涛在看吗"
712,"别试一试了，好好的还可以多活几年"
712,"叶太医不可爱了"
712,"好白净的小伙"
712,"叶天士的胡子居然一点违和感都没有"
712,"咏琪皮肤真好"
712,"这是流觞嘛"
713,"叶天士名声显赫啊现在买的京都念慈菴就是他发明的"
713,"五阿哥还是很帅的😍"
713,"只有我觉得永琪和帅吗"
713,"五阿哥你的小燕子呢"
713,"叶天士当皇上合适"
713,"叶太医不可爱了"
714,"皇上和画中的皇上好象啊这个装束。"
714,"蛙哥好坚强"
714,"年轻的时候什么苦都不能怕"
714,"蛙🐸哥的抬头纹好重"
714,"五阿哥长咧了"
714,"叶天士名声显赫啊现在买的京都念慈菴就是他发明的"
715,"五阿哥好嫩啊那小脸蛋好像摸摸"
715,"蛙哥好勇敢"
715,"蛙哥的腿好白哦"
715,"为了小燕子你要忍一忍。你们还要浪迹天涯活的潇潇洒洒"
715,"璎珞这件衣服很是清新雅致呀！"
715,"为什么叫朕大猪蹄子"
716,"断骨会让你长高"
716,"传说中的术前谈话"
716,"大猪蹄子的衣服以前璎珞也有个这个样式的"
716,"打断腿再长"
716,"经脉断了跟骨头有啥关系"
716,"蛙哥好勇敢"
717,"五阿哥随行了的好嘛！你们看戏不跳着看可好，一群猪"
717,"叶神医，你看本宫还能长高五厘米吗？"
717,"永琪受伤时候说厌烦自己的妻妾来哭，说明他已经结婚了"
717,"本宫劝你们善良"
717,"顺嫔是因为穿皇上的衣服才垫肩的吗"
717,"现在的断骨增高就是这么做的"
718,"蛙哥好可爱"
718,"这是要动大手术的赶脚"
718,"为什么让个太监把精明一世的皇后玩的团团转"
718,"朕永远忘不掉叶太医的六个耳环"
718,"腿好了就可以见到小燕子了"
718,"666叶天士小可爱还会做手术"
719,"永琪肯定很善良，善良的人有福眼越看越帅"
719,"永琪你可要考虑清楚这是个大手术"
719,"好像平常富贵人家的夫妻，真好"
719,"你们记得本宫吗"
719,"五阿哥好鲜"
719,"蛙哥好可爱"
720,"永琪不容易啊，从小被害到大"
720,"大猪蹄子，穿我衣服干嘛"
720,"袁铨看到我了没有你这个大猪蹄子"
720,"本宫的儿子喝三鹿奶粉长大就是不一样"
720,"五阿哥好可爱"
720,"是朕的好儿子"
721,"蛙哥要长高了"
721,"说长高的留下来别走"
721,"对了大猪蹄子怎么穿我家小姐姐衣服了"
721,"袁春望本宫给你热好了盒饭"
721,"抓手手好甜"
721,"🐸哥好可爱"
722,"永琪额头好宽呀"
722,"卫龙大旗我来扛"
722,"那个时候都没麻药蛙哥厉害"
722,"五阿哥双眼皮好美"
722,"爱是一道光，绿到你发光"
722,"对了大猪蹄子怎么穿我家小姐姐衣服了"
723,"五阿哥皮肤好嫩啊"
723,"这样看哇哥帅多了"
723,"永琪有点帅哟"
723,"🐸哥好棒棒"
723,"就喜欢看叶天士，超可爱"
723,"袁春望还没领盒饭啊"
724,"蛙哥从小被害到大还做了手术。只活了二十多岁:-("
724,"好勇敢不愧是本宫的儿子"
724,"五阿哥快便当了历史上就是这不久之后"
724,"五阿哥有点神似吴尊啊"
724,"有麻药就好了"
724,"不愧是我儿子"
725,"璎珞思想好先进，一定要问孩子的意见而不是自己做主"
725,"不愧是蛙哥"
725,"五阿哥长的好清秀"
725,"真的想去看一遍还珠格格"
725,"蛙哥从小被害到大还做了手术。只活了二十多岁:-("
725,"不愧是我儿子"
726,"流觞先生好可爱"
726,"断骨会让你长高"
726,"世界上如果真有永琪这样性格的人就好了"
726,"我儿子最棒"
726,"还是永琪招人稀罕"
726,"嘿嘿牵媳妇的手手"
727,"突然觉得蛙哥和愉妃长的挺像"
727,"那个说断骨长高的你是恶魔吗"
727,"五阿哥要是知道自己只能活20多岁，会不会后悔"
727,"🐸哥好棒不愧是蛙哥"
727,"小景你还记得大明湖畔的大瑶瑶吗"
727,"断骨会让你长高"
728,"璎珞：大猪蹄子穿的是本宫的衣服"
728,"本宫大收网了"
728,"历史上是没有小燕子的好吗别误导别人"
728,"叶太医也老了"
728,"是愉妃的孩子"
728,"那个说断骨长高的你是恶魔吗"
729,"皇上的胡子贴的好明显"
729,"好勇敢的五阿哥"
729,"永琪的后脑勺好大"
729,"永琪能活下来真不容易"
729,"赶紧把腿治好，小燕子在等你"
729,"五阿哥是本宫的"
730,"大猪蹄子声音好有磁性啊"
730,"当初我可答应了你娘照顾好你的"
730,"永琪真好人善良有才干还长得帅真是可惜"
730,"本宫喜欢尔琪"
730,"哇哥是愉妃的孩子"
730,"五阿哥毕竟是爱新觉罗的子孙"
731,"这孩子长的好清秀"
731,"🐸哥棒棒哒"
731,"蛙哥好白呀"
731,"我怕是要领盒饭了(´-へ-、)"
731,"其实蛙哥长得也挺好"
731,"叶太医的耳洞是认真的啊"
732,"叶天士从内科混到外科也是不容易啊"
732,"愉妃的孩子"
732,"会不会没治好，嫁祸叶天士吧"
732,"悔不该杀那华佗哟"
732,"嫩嫩的五阿哥"
732,"其实蛙哥长得也挺好"
733,"五阿哥会好的吧"
733,"念慈菴川贝枇杷膏就是叶天士做的，大家可以去看说明书"
733,"这个绝了真的疼"
733,"永琪是小燕子的永琪么"
733,"骨头断了能长学医的告诉你"
733,"嫩嫩的五阿哥"
734,"想想都觉得好疼"
734,"挫折挺多，希望腿能快点好起来"
734,"为啥叫大猪蹄子"
734,"本宫儿子好乖"
734,"陈儒敏大猪蹄子"
734,"蛙哥就活了25岁天妒英才～"
735,"断骨真的能长高么"
735,"我儿棒棒哒"
735,"永琪现在多大了"
735,"本宫不想说话"
735,"傅缨大旗还能举吗"
735,"小五还是很帅的！⊙ω⊙"
736,"说五阿哥是纯妃儿子的你认真看剧了吗？愉妃，是愉妃啊"
736,"叶天士圈粉了，长的满帅气"
736,"让我们红尘作伴活得潇潇洒洒策马奔腾共享人世繁华……"
736,"不愧是本宫的儿子，为娘甚至欣慰"
736,"过了不久蛙哥就死了白疼一场"
736,"五阿哥好坚强"
737,"没事会好的你还会找到小燕子"
737,"我去看妇科碰到过叶大夫，怎么他还会外科"
737,"原来哇哥是小景景。怪不得这么眼熟"
737,"🐸哥真厉害，可惜我不在场"
737,"还能长高呢"
737,"小燕子飞飞五阿哥追追"
738,"对啊小景我说看着这么眼熟呢记性好的人真多"
738,"蛙哥跟朕长的真像"
738,"五阿哥是愉妃的儿子，四阿哥是纯妃的儿子"
738,"我儿何等优秀"
738,"聂远越看越迷人，比年轻的时候更帅了"
738,"没事会好的你还会找到小燕子"
739,"必须好啊还得策马奔腾共享人世繁华呢"
739,"本宫的儿子就是优秀！"
739,"一只脚长高那不成长短脚咯"
739,"各位明天追啥剧"
739,"令贵妃，你为你儿子找了个好帮手啊"
739,"小燕子在等你呢"
740,"历史上蛙哥是活了20多岁去逝了吧！"
740,"永琪好可爱"
740,"好了也没几年活头"
740,"傅缨大旗永不倒"
740,"五阿哥头好大"
740,"儿啊你要坚强啊"
741,"叶天士脸好大"
741,"大猪蹄子你是不是偷穿我衣服了？"
741,"好温柔的皇上"
741,"还有人记得本桂芬可爱吗"
741,"夜大夫是全科大夫"
741,"永琪长得清秀阿"
742,"永琪还接了别的戏吧，头发不舍得剃，带个发套显头大"
742,"大猪蹄子快哄我"
742,"五阿哥活到现在真的不容易"
742,"我儿子就是厉害"
742,"突然觉得哇哥有点帅"
742,"还有人记得本桂芬可爱吗"
743,"蛙哥活到现在也是不容易"
743,"蛙哥好可爱"
743,"麻沸散发展到今天已经很不错了"
743,"儿子你要坚强啊！你额娘在修行呢！"
743,"对哦，小景景，你还记得大瑶瑶吗"
743,"五阿哥活到现在真的不容易"
744,"历史永琪只活了20多岁"
744,"幸福的尔康得到了紫薇"
744,"哇哥躺着的时候看更帅"
744,"蛙哥我滴娃啊"
744,"蛙哥活到现在也是不容易"
744,"蛙哥好可爱"
745,"刮骨都能治好，高贵妃一个皮外烧伤就挂了"
745,"加油儿子你是最棒的"
745,"永琪又帅，又孝顺，又善良，又有文采，我喜欢"
745,"蛙哥真勇敢"
745,"叶天士性格变稳了还不习惯呢"
745,"叶天使，你怎么长胡子了"
746,"追了这么久的剧要完了"
746,"隔着屏幕都感觉到了疼"
746,"樱络皮肤越来越好了"
746,"哇哥好水嫩"
746,"永琪是小燕子的，永琪是小燕子的，永琪是小燕子的!"
746,"加油儿子你是最棒的"
747,"五阿哥还没遇到小燕子呢，当然会好"
747,"我戏份不太多"
747,"蛙哥好棒棒"
747,"尔晴的扮演者说她演这个角色晚上睡不着，经常失眠😔"
747,"问大家一个问题：怎么能不长胡子？"
747,"哇哥好水嫩"
748,"这么好的船，看着像是紫禁城一样"
748,"有人想本宫吗"
748,"还以为头顶挂满了玉米"
748,"想我了没有"
748,"想看小燕子的去看还珠格格啊，这是主放璎珞"
748,"有人想我了吗"
749,"五阿哥好可爱喜欢！！"
749,"是不是都忘了我了？我得刷刷存在感！"
749,"现在呢高贵妃又发了一条还记得我吗这是怎么回事"
749,"本宫怎么还没出场啊"
749,"五阿哥勇敢"
749,"好眉清目秀的小哥哥"
750,"这样两人挺好，像普通夫妻一样。省的都太古板"
750,"我儿子腿毛真:长"
750,"五阿哥五阿哥念快了就是蛙哥！哈哈"
750,"我咋这么好呢"
750,"蛙哥会好的，他还要追小燕子"
750,"王阿哥小鲜肉"
751,"上一届优秀毕业生嬛嬛赢了这一届优等生皇后啊"
751,"高可爱和富察皇后走的第n天想她们想她们"
751,"永琪长的真不错"
751,"大猪蹄子这是穿的容音的衣服吧"
751,"充钱的朋友们你们好"
751,"我儿子最厉害"
752,"愉妃去哪里了。永琪都这么大了愉妃也不来看看永琪"
752,"本宫的儿砸就是厉害👍不错不错"
752,"五阿哥喜欢小燕子原来是受璎珞影响这性格都活泼的很"
752,"总感觉令贵妃才是皇后"
752,"这船是有多大"
752,"我儿能活多久"
