time,content
701,"这狗奴才，真以为自己是主子啊，仗主欺人，这太不真实"
701,"皮一下好开心😃"
701,"就是皇后太温柔了奴才都敢替她做主了"
701,"静静看你们作死"
701,"这个皇上演的不错"
701,"哎，可怜的遇贵人"
702,"这配音不错，一看皇后就中气不足，生着病呢！"
702,"皇上好可爱。。。"
702,"哇这宫女了不起啊，拖出去杖毙啊"
702,"这个丫鬟赶紧领盒饭去吧"
702,"就是皇后太温柔了奴才都敢替她做主了"
702,"这个皇上演的不错"
703,"好可爱的太监"
703,"大猪蹄子找不到我"
703,"若曦才是纯元皇后吧"
703,"我劝我自己善良"
703,"聂远还是那么帅"
703,"啥时候我才出场。。。。"
704,"这小婢女胆挺肥啊"
704,"我辉发那拉氏什么时候登场"
704,"这丫头怎么活这么久的"
704,"2倍速飞起来"
704,"这丫头太不懂事"
704,"抓不到我吧🙃"
705,"这宫女能活着也是神奇"
705,"富察皇后真的太温柔了"
705,"这宫女真是好大胆，擅自做主"
705,"把她拖出去砍了，竟然不把本宫放在眼里"
705,"高慧娟好巨大"
705,"这小婢女胆挺肥啊"
706,"不听话的奴才活不长"
706,"大猪蹄子就是我"
706,"这个女事也太多了，戏可真多呀，"
706,"这个女人有点傻"
706,"聂远演赵云也帅啊"
706,"这个是最新的笑傲江湖里那个岳灵珊"
707,"这剧里面的宫女都好厉害。好大的胆子。"
707,"嘻嘻，皇上抓不到我"
707,"这个剧有传说的那么好吗？没看出来"
707,"我什么时候才出来啊"
707,"好大胆的奴才"
707,"竟然把我拒之门外！"
708,"这皇后真没用，还没有一个贵妃的权力大"
708,"守护全世界最可爱的明玉小天使"
708,"说句实在话真的不喜欢这个明玉"
708,"哎，当皇后也不容易啊！"
708,"一个奴婢哪来这么多权利？"
708,"皇上真的太皮了"
709,"休息重要还是人命重要？醉了"
709,"就你心思多"
709,"不听话的奴才就不该留着"
709,"这宫女活不过三集吧"
709,"连宫女都欺负皇后太大胆了"
709,"一个奴婢哪来这么多权利？"
710,"这宫女胆子太大，做事不计后果，是个累赘"
710,"被我打败啦全都一起上吧我根本没在怕"
710,"怎么这上边的奴才胆子都好大啊"
710,"这皇上的大脑反应弧度太长了，都是后知后觉"
710,"不听话的奴才就不该留着"
710,"休息重要还是人命重要？醉了"
711,"真的是奴大欺主，什么事都敢替主子做主"
711,"朕从前是魔界的七夜圣君"
711,"乾隆这个大猪蹄子是忘了春樱吗"
711,"这种丫头怎么教的"
711,"一个下人好大的胆子，屡次以下犯上"
711,"这宫女胆子太大，做事不计后果，是个累赘"
712,"这皇后挺好，就是太善良，感觉要被贵妃挤下去"
712,"来人，把这个丫鬟给本宫拉出去斩了！"
712,"敢替主子决定事情，心大了，不能重用，怕是要出事"
712,"丫头要治了"
712,"这种奴才才该死，好大的胆子"
712,"这种丫头怎么教的"
713,"容音小天使什么时候看都是那么端庄高雅"
713,"姜梓新嘴好大啊"
713,"奴大欺主，都替主子拍板了，不能惯着"
713,"皇后好温柔"
713,"上错花轿嫁对郎那时候聂远是真的帅命都能给他"
713,"我怎么这么可爱"
714,"奴才主意可真大"
714,"我准备就是一国之母了"
714,"丫鬟比皇后还厉害醉了"
714,"拖出去斩了"
714,"强行加戏，跟导演很熟吧"
714,"奴大欺主，都替主子拍板了，不能惯着"
715,"替主子做决定胆挺大啊"
715,"快把我杀了，你们就不会劝我善良了"
715,"皇后的声音有气无力，一点都没有作为皇后的威严"
715,"红衣服大嘴猴"
715,"皇后不是权利不大，只是她不想管……"
715,"什么时候奴才敢做主子的主了，什么东西"
716,"明玉蛮好的到后面特别好"
716,"红玉，本宫劝你善良"
716,"明玉没有好下场"
716,"我就是这么善良"
716,"其实有这种帮主子做坏人的宫女也是件幸事"
716,"替主子做决定胆挺大啊"
717,"尔晴好可爱啊"
717,"二刷的人多吗"
717,"知画的配音还是原声呀好听"
717,"朕头上一片绿"
717,"你一奴才有什么资格管你主子做什么事"
717,"这个皇后怎么觉得底气不足啊"
718,"宫女胆子好大，自作主张"
718,"我真温柔。吵架都那么温柔。"
718,"说要争过贵妃的是你；说管不过贵妃的也是你。这奴婢神"
718,"本宫就是太善良了"
718,"想多了，你家皇后娘娘管了和没管一样的"
718,"就因为你愉贵人领盒饭了你的良心不会痛吗？"
719,"皇后好温柔"
719,"这奴才胆子挺大呀"
719,"这些奴才的胆子都这么大吗"
719,"哼，我现在还善良"
719,"这部剧的宫女都要上天了？后宫的事皇后不管谁管？"
719,"这宫女拉出去斩了！"
720,"那你就能随心所欲替皇后决定吗？？？好大的胆子！！"
720,"我啥时候初出场呢"
720,"觉得秦岚演的不错"
720,"明玉就不是好东西"
720,"皇后是个好皇后"
720,"这些奴才的胆子都这么大吗"
721,"这皇后在哪里找的演员?好合适,面由心生也不知道被潜"
721,"皇后管不管，你来做主啊。胆子够肥呀"
721,"这眉毛太细了呢也是满人的规矩吗"
721,"皇后娘娘声音好温柔体贴啊！😃😃"
721,"宫女都能替主子拿主意厉害了"
721,"你们可别劝我善良"
722,"明玉什么都能作皇后的主?胆也太大了"
722,"话多的奴才"
722,"这丫鬟快去领盒饭好吧求你了"
722,"还是皇后最贴心"
722,"这丫头该，胆儿够肥的。"
722,"朕的大清亡了，胡说朕的大清固若金汤"
723,"我有看到明玉了，好开心"
723,"丫头你胆子好大哦，小心导演不高兴"
723,"该杖毙她！看着心烦。这么多戏"
723,"你当我这皇后是闹着玩啊，要不然你当吧"
723,"皇后好温柔"
723,"明玉什么都能作皇后的主?胆也太大了"
724,"没有办法我就是这么强大抓不到我吧啦啦啦啦哈哈哈哈哈"
724,"怎么还不到我出场"
724,"你们没发现走路一会慢一会儿快吗"
724,"不要说明玉她是最善良的一个最后还帮璎珞不少呢"
724,"宫女戏比正主还多"
724,"求求你赶紧杀青8，我服了，你胆子比皇后还大"
725,"皇后好美，又美又温柔"
725,"你就等着我姐姐今晚来找你就行了"
725,"这丫鬟胆子真肥，都替皇后做主了"
725,"你胆子真大!"
725,"这里面的奴才胆子一个比一个大"
725,"这么不懂事的怎么进中宫的"
726,"这个宫女从来都不懂皇后还美其曰为了皇后好无语"
726,"尔晴你个大猪蹄子"
726,"这丫鬟再怎么为主子着想也太过奴大欺主了"
726,"皇后好美，又美又温柔"
726,"这丫鬟胆子真肥，都替皇后做主了"
726,"这里面的奴才胆子一个比一个大"
727,"皇后真的好温柔"
727,"明玉会成长的"
727,"哪个说乾隆是四爷的？笑死了，乾隆是四爷雍正的崽呢"
727,"总感觉知画当了皇后"
727,"啥事都你做主你当皇后好了"
727,"皇后娘娘，内心存善"
728,"传说中的主子不急太监急吗"
728,"我劝你们都善良"
728,"刚开始明玉真不可爱，后来的明玉可爱极了"
728,"合着你一个奴才都能做本宫的主了?"
728,"这就是明摆着咸吃萝卜淡操心"
728,"啥事都你做主你当皇后好了"
729,"好厉害哦，都让你看穿了"
729,"这个奴才话真多"
729,"好大胆的奴才"
729,"再说我把你斩了"
729,"哈哈哈皇上好可爱"
729,"传说中的主子不急太监急吗"
730,"你胆子真肥啊，都要赶上大猪蹄子了"
730,"给本宫拉下去"
730,"这宫女居然能活那么久真是奇迹了"
730,"我就是秦岚啊"
730,"这宫女是如何在宫里待这么久的"
730,"宫女权力这么大的吗"
731,"这宫女能做皇后的主心有点大啊"
731,"皇后，我晚上去找你暖被窝"
731,"皇后好眼熟，皇后声音也是。"
731,"完！别说贵妃，连宫女都能做皇后的主了！"
731,"小丫头片子你话太特码多，敢抢戏？"
731,"就这样的奴才敢替主子拿主意拖出去杖毙"
732,"明玉以后是璎珞的得力助手。你们慢慢追吧"
732,"明玉快点领盒饭吧！到底本宫是皇后，还是她是皇后？"
732,"高举大嘴猴大旗"
732,"胆大的奴才"
732,"宫女管的真多"
732,"明玉胆真大"
733,"不管图什么，你一个宫女还能替主子做决定，你厉害"
733,"皇后说话太温柔了，都没气势了"
733,"这宫女怕是把自己当公主吧，管那么多"
733,"明玉领盒饭吧…"
733,"这么大胆的奴婢a拖出去斩了"
733,"宫女管的真多"
734,"这个丫鬟把自己太当回事了。直接一仗红，看着闹心。"
734,"本宫厉害了"
734,"秦岚演技真好啊。病恹恹的样子绝了"
734,"̣̣̥᷅你替我做了决定却让一个人枉死"
734,"这宫女管的真多，赶紧死了算了"
734,"这宫女敢这么大胆子"
735,"这儿的丫鬟都挺能耐比主子厉害多了"
735,"皇后娘娘生气都那么温柔"
735,"这不就是灰姑娘和王子的戏码嘛，就是王子惦记灰姑去找"
735,"皇后就是太好了"
735,"这个宫女可真有意思，比皇后面子都大"
735,"你话可真多"
736,"所以说这就是明玉的性格盒格局不大"
736,"丫鬟敢自己做主了。。这部剧没个尊卑有序之分"
736,"这个丫鬟做主子的主真是好教养"
736,"一个丫头怎么比皇后还戏精"
736,"这儿的丫鬟都挺能耐比主子厉害多了"
736,"这个宫女可真有意思，比皇后面子都大"
737,"你厉害你当皇后啊，拖出去领饭盒去"
737,"我好温柔啊哈哈哈皮皮皮"
737,"皇后人很好善良"
737,"皇后好美丽"
737,"怎么觉得贵妃比皇后还厉害"
737,"奴大欺主了"
738,"这皇后说的话，感觉好伟大啊。真的是被秦岚路转粉了"
738,"丫鬟的胆子都这么大吗"
738,"这部剧丫鬟下人是真的厉害，没规没矩"
738,"滚去领盒饭吧，老娘完全不能看你了"
738,"这丫鬟的嘴巴可真大，下牙很龅"
738,"你厉害你当皇后啊，拖出去领饭盒去"
739,"好气质典雅高贵就是本人了"
739,"本宫发起火来都这么温柔，哈哈"
739,"丫鬟好大胆，竟敢替皇后做主"
739,"我演技真好"
739,"这部剧丫鬟下人是真的厉害，没规没矩"
739,"心善的皇后"
740,"这皇后天天跟养不活了一样难怪历史上只活到30多岁"
740,"这个剧讲的是丫鬟所以丫鬟都厉害"
740,"这个宫女是有多厉害啊，替皇后做主？"
740,"我好可爱啊"
740,"一个小丫头管这么早多，该打"
740,"皇后娘娘你真善良"
741,"明玉好大的胆子！给本宫拉下去斩了！"
741,"明玉我劝你善良"
741,"这是个啥宫女呀话这么多胆这么大"
741,"我觉得明月该领盒饭了"
741,"这个宫女好大胆，给皇后做主？不要命了吗？"
741,"这皇后天天跟养不活了一样难怪历史上只活到30多岁"
742,"这丫鬟长得像瘦版凤姐"
742,"多大了还不懂事能不能让本宫省点心啊"
742,"一个奴才管这么多，你来当皇后好了"
742,"这丫鬟真的是戏好多"
742,"这是个啥宫女呀话这么多胆这么大"
742,"明玉好大的胆子！给本宫拉下去斩了！"
743,"香蜜里面的灵火珠么这不是"
743,"这个丫头还不是个戏精吧"
743,"皇后拿的是天帝给的灵火珠吗"
743,"这丫头还是去领盒饭吧"
743,"这丫鬟管挺宽啊，皇后给你当好了这么多话"
743,"再回来看看我们明玉呜呜呜呜"
744,"皇后太好了当她的丫鬟都幸运"
744,"胆子不是一般的大"
744,"皇后说的话的好像快断气一样，病恹恹的"
744,"皇后是让这个宫女气死的"
744,"皇上鞋底好厚"
744,"让这个丫鬟领盒饭吧！"
745,"皇后就是太温柔了，丫鬟都敢说皇后管不了这种话"
745,"你好大的胆子"
745,"这丫头嘴好大啊"
745,"这给本宫气的。"
745,"让这个丫鬟领盒饭吧！"
745,"胆子不是一般的大"
746,"这皇后手速好快"
746,"我手速好快呀"
746,"你这个丫鬟还叨叨叨你是有理吗？！皇后不管谁管？！"
746,"气死了！气的本宫直转佛珠"
746,"好廉价的手串"
746,"这是气的皇后上气不接下气啊"
747,"这宫女自作主张也是心大"
747,"你个丫头竟替我这个皇后做主了，拉出去领盒饭！"
747,"历史上这个皇后就是一个大好人，一个非常善良的人"
747,"想吃盒饭了是不是.你牛是吧.别人都是傻子.😂😂"
747,"于正的剧真的没逻辑，奴才敢做主子的主"
747,"这皇后手速好快"
748,"丫鬟胆子这么大"
748,"喜欢富察皇后，善良，端庄"
748,"这个明玉居然能活那么久"
748,"来呀~快活啊~反正有大把时光！"
748,"这宫女管得宽"
748,"这宫女自作主张也是心大"
749,"丫头比主子还厉害，要不她来当皇后好了"
749,"这个丫鬟真的管太多了"
749,"这小丫头比主子还厉害了，这般长相没好东西"
749,"来人拖出去斩"
749,"这皇后演的一点霸气都没有。宫女都比皇后厉害"
749,"丫鬟胆子这么大"
750,"心疼你大爷可以死了，不知道配角死于话多吗"
750,"尔晴唉特别不是个好东西"
750,"哈哈哈哈哈哈你打不过我吧没有办法我就是这么强大"
750,"这都不打一个奴才都敢替本宫做主"
750,"这部戏奴才都比主子厉害"
750,"拖下去，斩了"
751,"宫女胆子那么大的吗？不想办法帮主子，还教训😂️"
751,"好廉价的手串，道具组差评。"
751,"来来来，你厉害完了，你来当这个皇后"
751,"本宫太厉害了"
751,"嘴大下边也大"
751,"拖下去，斩了"
752,"奴才知道娘娘善良好欺负，所以我做什么你都不会杀我"
752,"话太多了。拖出去斩了"
752,"明玉是特别好的有，一直是好的，只是性子急点"
752,"你这么会，你来当皇后好了！"
752,"怎么觉得秦岚这腿是带着绿平的劲儿演的……"
752,"宫女胆子那么大的吗？不想办法帮主子，还教训😂️"
753,"多了点人情味，你们说丫鬟胆子大但是否确定不是真的嗯"
753,"呵呵，这种奴才蹬鼻子上脸以为自己是主子了？"
753,"这部戏不是很严谨。尊卑不分，奴婢都比主子强"
753,"明玉是好人，活了很久的"
753,"皇后也是人啊，但是贵妃确实强势，大气温婉都是伪装"
753,"怎么觉得秦岚这腿是带着绿平的劲儿演的……"
754,"有这么个丫鬟，主子活不长也正常"
754,"这到底谁才是皇后啊奴才可管的真宽"
754,"皇后太善良了，丫鬟都敢给主子做主了"
754,"拉出去，杖毙！一个宫女还帮本宫做主了！"
754,"明玉特别好的！她是认准了一个人就死忠的那种！"
754,"皇后也是人啊，但是贵妃确实强势，大气温婉都是伪装"
755,"就是皇后太温柔了奴才才会借着担心的名义这么胆大"
755,"小丫头片子胆子真大"
755,"好大胆的奴才，还接话，真厉害，皇后都说不过你，凉凉"
755,"这明玉去领盒饭吧"
755,"那你来当皇后好了，看看你思虑多周全啊！"
755,"历史上第一个被宫女气死的皇后"
756,"一个宫女可以有这么大权利吗？因为她不报死了一位嫔妃"
756,"明玉的嘴很大，你们发现没有"
756,"这个宫女是嫌自己命长啊？皇后是干嘛的呀"
756,"我劝自己善良"
756,"宫女胆子不是一般的大"
756,"历史上第一个被宫女气死的皇后"
757,"这宫女好大的胆子，敢训皇后"
757,"丫鬟的胆儿也太大了"
757,"这丫头心好大，替皇后拿主意的呀"
757,"我觉得你有点话多，来人辛者库"
757,"你还敢替你主子做主好大的胆子"
757,"一个宫女可以有这么大权利吗？因为她不报死了一位嫔妃"
758,"真能添堵，皇后活下来是带着多大的勇气容忍这丫鬟啊"
758,"我看这皇后你来当比较合适"
758,"皇后到死都是一个很好很好的皇后"
758,"这年头奴才都比主子厉害"
758,"你是不知道明玉最好有多好"
758,"丫鬟的胆儿也太大了"
759,"这丫头戏可以太多了还能活下去吗"
759,"我演技真好"
759,"来来来，这皇后让给你了，我来当丫鬟好吧！"
759,"温柔贤淑善良但太懦弱"
759,"当了皇后的家了，作死的不死，该活的不活"
759,"我看这皇后你来当比较合适"
760,"这宫女可以领盒饭了，话多，皇后本就是管理后宫的"
760,"明玉是个好孩子，从后面60多集返回来看，再看一遍"
760,"做下人就不要有太多主见，误事"
760,"这是剧情啊！皇后，你就别管了，怡嫔自己想去领盒饭的"
760,"这宫女绝对跟导演睡了，加这么多戏"
760,"这丫头戏可以太多了还能活下去吗"
761,"怎么忍心怪你犯了错，是我给你自由过了火"
761,"脑瓜疼脑瓜疼，本宫被气的脑瓜疼"
761,"皇后竟然连一个奴才也管不了，编剧脑洞真大"
761,"哎呀我脑仁疼怎么就跟这小姑娘讲不清楚了那"
761,"丫头比主子厉害，胆子太大敢替主子做主"
761,"做下人就不要有太多主见，误事"
762,"明玉就是性子直，她才是对主子最忠心的"
762,"本宫气得脑瓜疼"
762,"别说了我脑阔疼"
762,"你这么厉害你当皇后吧✌"
762,"这小丫头片子话真多赏一丈红得了"
762,"别气本宫了，小丫头片子"
763,"这丫头的胆子是不是太大了，怎么可以管后宫的事情"
763,"这个丫头心好大"
763,"这个丫鬟敢自作主张，不听话，该打"
763,"这丫鬟戏怎么比我还多"
763,"本宫气得脑瓜疼"
763,"别说了我脑阔疼"
764,"好大的胆子啊敢越庖代俎"
764,"明玉小可爱前期真惹人厌，后期就不会了"
764,"这丫头管多了，比皇后厉害了"
764,"拉出去，斩了"
764,"我就想问她们是不是都是咬唇妆[惊讶]"
764,"这个丫鬟敢自作主张，不听话，该打"
765,"我觉得后期配音是一件多余的事儿"
765,"这丫鬟胆子变大了？"
765,"厉害了，这宫女还能做皇后的主？"
765,"为什么这么说明玉她是担心皇后0k？"
765,"把宫女拉出去杖毙！还管起皇后的事了！"
765,"明玉小可爱前期真惹人厌，后期就不会了"
766,"皇后很好就是太温顺了要不是皇后也早就挂了"
766,"给自己加戏这事"
766,"这宫女，好厉害，比皇后还厉害"
766,"坏人变好，大家觉得这人真好"
766,"什么叫没有胜算如果知道真相是可以搬回来的"
766,"这丫鬟胆子变大了？"
767,"快啦出去杖毙，快点啊"
767,"皇后演技真好，一秒钟变正常"
767,"这功力人的嘴都这么厉害么"
767,"不怕神一样的对手就怕猪一样的队友"
767,"奴婢给了好多钱啊，镜头这么多，"
767,"这宫女，好厉害，比皇后还厉害"
768,"这宫女能活着也是不容易了"
768,"尔晴好可爱啊"
768,"这个王后一点威严都没有区区一个奴婢都敢这么"
768,"尔晴我劝你善良"
768,"这功力人的嘴都这么厉害么"
768,"奴婢给了好多钱啊，镜头这么多，"
769,"直接拖出去斩了好吗到底谁是主子谁是丫鬟啊"
769,"皇后不是管不了明玉，是不忍心，皇后太善良了"
769,"不喜欢皇上，皇后快强大起來吧"
769,"朕看来看去，还是皇后美"
769,"你少说两句，皇后还能多活两天"
769,"这宫女能活着也是不容易了"
770,"皇后娘娘好温柔啊"
770,"本宫的身体，都是被你这个奴才气的！"
770,"哎呀我去，这宫女能活到第三集也是厉害了"
770,"这部剧的台词haishi那么的让人出戏"
770,"直接拖出去斩了好吗到底谁是主子谁是丫鬟啊"
770,"你少说两句，皇后还能多活两天"
771,"一秒头晕就好了？真灵"
771,"头疼马上好了"
771,"怎么会有猪一样的队友！太坑了！皇后娘娘要被气死咯！"
771,"宫女比主子还厉害"
771,"一个丫头台词怎么多"
771,"这个丫鬟能活几集"
772,"你事这么多要不你来当一国之母吧"
772,"你这么厉害皇后让你当得了"
772,"怎么感觉这上面的丫鬟都比主子厉害"
772,"奴婢批话太多了"
772,"比皇后还大的权利，真是无语"
772,"宫女比主子还厉害"
773,"这个丫头走于正后门了吧。。。真的历史丫鬟能说这么多"
773,"一届宫女就敢管这么多，你是想领盒饭了吧"
773,"话不是一般多"
773,"看到最后你们就知道有多喜欢明玉了"
773,"这宫女是被皇后娘娘宠坏了吧，厉害了"
773,"你事这么多要不你来当一国之母吧"
774,"明玉是高贵妃派来的吧，啥不中听，说啥"
774,"明玉就是看上去虎了吧唧的，其实人挺好的"
774,"这个皇上好眼熟"
774,"这宫女比主子还厉害"
774,"齐三公子还是这么帅"
774,"这是要疯了"
775,"这明玉性格跟公主似的任性，哪有这样的下人"
775,"……人生气到一定程度是会晕的"
775,"死丫头话真多"
775,"我这是找了个奴才还是主子？"
775,"这个宫女，胆很肥。主子都没说什么"
775,"这个富察皇后但是有几分姿色"
776,"皇上一来，头也不疼了，站得更稳了，吃嘛嘛香"
776,"哎呀妈呀，脑阔疼"
776,"皇后贵妃演得都很好啊，有些人到底什么样儿才不挑刺哟"
776,"这宫女怎么还做了皇后的主了"
776,"明玉是真的好的甚至可以为皇后买命那种"
776,"从正面看，皇上像个光头😂😂"
777,"有这样没有骨气的丫鬟主子能好吗"
777,"我不知道乾隆什么时候领盒饭"
777,"这明玉活的最久不科学"
777,"皇后长得好像知画"
777,"奴才妃子都比皇后厉害了"
777,"带资进组？话真多"
778,"说实在的，就是皇后温柔善良给这宫女惯的"
778,"看来本宫还是太善良了"
778,"为了皇后好？皇后是六宫之主，这宫女可是害了一条人命"
778,"这丫鬟还真是厉害"
778,"这个皇后是我看那么多宫廷剧里心最善的，没有之一！"
778,"我怎么还没出来？"
779,"告诉你们这丫头比皇后都活的久"
779,"我就喜欢皇后，温柔善良"
779,"诶呀妈呀，脑瓜疼嘞个脑瓜疼"
779,"你们为什么都要我善良"
779,"皇上快给我整一杯冰阔落霍"
779,"本宫气的脑袋疼╯▂╰"
780,"丫头就是话多"
780,"明玉该领盒饭了"
780,"这下人比主子还胆肥"
780,"把我关在门外，受罚了吧"
780,"这个剧真的好，好像都不是配音的。"
780,"皇后怎么不打她。。。"
781,"历史富擦皇后是个什么样的人？"
781,"我感觉自己有点可爱"
781,"皇后好温柔"
781,"我劝你们善良。"
781,"这丫头可以去死了，那么多话，比主子还厉害"
781,"朕的女人你也敢教训"
782,"没想到天底下还有久经深宫还这么善良的皇后"
782,"这丫鬟戏真多"
782,"乾隆:现在宫女胆子都这么大了？拖出去斩了"
782,"来来来丫鬟你来安排"
782,"皇后演技还不错的说"
782,"来来来，这个皇后你来当"
783,"神神气气神神气气不懂老师辩驳最流利"
783,"我啥时候可以出场"
783,"这里面的下人都好厉害呀"
783,"发现我好坏"
783,"这丫鬟戏真多"
783,"来来来，这个皇后你来当"
784,"我就想问问了你个奴才比皇后还厉害管得住皇后也是厉害"
784,"爱是一道光，绿到你发慌"
784,"感觉皇后好温和"
784,"剧情很符合"
784,"皇上好可爱"
784,"砍了这丫头"
785,"丫鬟个个都厉害的历史不可能这样的清朝等级很鲜明"
785,"朕的皇后谁都不能说"
785,"穿着都好朴素啊"
785,")这个明玉胆子太大了，就觉得皇后好欺负吗"
785,"皇后好好啊，好善良"
785,"挺喜欢这两个在一起的样子，皇后受宠难得"
786,"大家注意这是本剧中最好最忠心的奴才"
786,"皇后见了五阿哥会很高兴吧"
786,"一个丫头都敢怼皇后，可见这皇后脾气是真好"
786,"奴才比主子还厉害，一点尊重都没有。"
786,"不怕神一样的对手，就怕猪一样的队友！！"
786,"拉出去砍了，该死的明玉"
787,"大猪蹄子真是越看越帅"
787,"大猪蹄子敢和我抢女人"
787,"说皇后长得像织画的别走"
787,"这宫女胆子真大！"
787,"愉贵人的孩子是五阿哥一个宫女话真多"
787,"你还要我怎样要怎样"
788,"演员们聊的好欢喜呀！聊的真逗哈哈"
788,"大猪蹄子你手里拿的啥"
788,"明玉和璎珞最后都是好闺蜜了"
788,"能做什么啊，被你吓一跳"
788,"这个乾隆配音和为了你我愿意热爱整个世界罗晋的声音像"
788,"大猪蹄子真是越看越帅"
789,"你得好好对她不然我可要揍你不错错你好好对她"
789,"皇后配音是新还珠里面紫薇的配音吗"
789,"说皇后玛丽苏的麻烦看看历史书再来好吗"
789,"请叫我高可爱"
789,"这皇后被死的这么早估计是被丫头气的血压高"
789,"朕的皇后插不插手是一个宫女说了算的吗？拖出去斩了"
790,"丫头管的真宽，让皇后别去管，怎么不叫皇后退位让贤"
790,"这长相也是服了"
790,"宫女能把皇后气成这样，也是厉害"
790,"什么时候到我出场啊"
790,"转变好快，头也不晕了"
790,"我啥时候出来啊"
791,"这丫头也是关心皇后，皇后又这么善良，肯定不会责罚她"
791,"大家不要劝我善良"
791,"皇后感觉好柔弱"
791,"忒想看看皇后在做什么"
791,"宫女都比皇后底气足"
791,"这长相也是服了"
792,"皇后反应好快啊！"
792,"朕的皇后最美最可爱最善良最大方"
792,"大清后宫的妃子都是半唇妆所以看起来像咬唇妆"
792,"皇后超美的"
792,"明月小可爱是好的"
792,"谁是纯元皇后？"
793,"什么完应。这宫女能活到三集厉害了。还能替主子做主了"
793,"亲爱滴，手上盘啥好东西呢"
793,"皇上演的细节很好啊"
793,"皇后很好的"
793,"皇上声音好听阿"
793,"本宫就是你们的白月光"
794,"明玉后期赚足了泪点"
794,"你们听好了我后来变腹黑了哈哈哈"
794,"高贵妃是不是在甄嬛传里甄嬛说的乾隆喜欢的高氏呐"
