time,content
2051,"本宫劝你们善良。"
2051,"这才是背锅侠"
2051,"四阿哥真会装"
2052,"不愧是嘉嫔的儿子就会害人"
2052,"就是你就是你下来陪我你疯了"
2052,"四阿哥这不是明知故问吗？标题都这么清楚了……"
2052,"傻儿子等会就叫你来谈心"
2052,"蛙哥是什么梗"
2052,"skr哥我劝你善良"
2053,"撒哥我劝你善良"
2053,"看我来查凶手"
2053,"我还以为是萨哥使坏呢结果不是"
2053,"都把我忘了没"
2053,"完了四阿哥被袁春望害惨了"
2053,"你们说袁春望跟宫女怎么做的"
2054,"我觉得如果永琪当了皇上就不会杀和珅"
2054,"本宫劝你们善良"
2054,"撒哥劝你马上领盒饭"
2054,"你个小傻瓜你要完了…"
2054,"老四只是偷了枪而已不是他害得"
2054,"林更新兄弟吗这是这么像"
2055,"四哥一看就是大猪蹄子"
2055,"袁春望我劝你善良"
2055,"二倍速是个好东西"
2055,"四阿哥，不是你吗？装什么✏️啊"
2055,"没有一件事是皇上自己查出来的"
2055,"这个太监长得贼眉鼠眼的"
2056,"四阿哥也帅的"
2056,"大家快给本宫出来嗨"
2056,"真的是有其母必有其子"
2056,"袁春旺盒饭了解一下"
2056,"所有人都在为袁春望背锅"
2056,"这个太监长得贼眉鼠眼的"
2057,"太监长得还有点像大衣哥"
2057,"其实都是袁春望干的，皇后背锅，四阿哥是想动手但没动"
2057,"这小太监眼睛不一样大"
2057,"傅璎大旗永不倒"
2057,"算计别人一生一世，却被别人拿她对皇上的爱所设计了"
2057,"本宫一定要让袁春望付出代价的"
2058,"五阿哥连着读，你就会发现很神奇的事😂😂"
2058,"为什么叫永琪蛙哥"
2058,"做坏事还那么淡定真是佩服"
2058,"曾锦华看到这里了没"
2058,"蛙哥太不容易了"
2058,"大猪蹄子~~~"
2059,"自己比不上别人就试图将别人拉下泥潭"
2059,"想高可爱我了嘛"
2059,"假如这是一场意外挨~你会不会来"
2059,"蛙哥萨哥的，你们也是有才"
2059,"袁春望干的，皇后不知情。"
2059,"编剧你太，大晚上上哪给你整鸭子去"
2060,"五阿哥连贯着读就是蛙哥"
2060,"爱是一道光，绿得人发慌"
2060,"珍儿如果是容嬷嬷那她是不是叫容珍"
2060,"袁春望怎么还不领盒饭"
2060,"皇上清楚得很"
2060,"一看标题就知道这集什么意思了哈哈哈"
2061,"陈赛君你个大猪蹄子"
2061,"尴了个大尬"
2061,"这次好像也不是四阿哥，是袁春旺吧"
2061,"撒哥也是玩玩"
2061,"这次是袁春望干的"
2061,"五阿哥连贯着读就是蛙哥"
2062,"傅璎大旗永不倒！"
2062,"春汪好心机，本宫是不该留了"
2062,"撒哥不就是你干的嘛"
2062,"你会遭报应的！"
2062,"萨阿哥怕了怕了，这次不是我啊"
2062,"我儿子怎么这么粗鲁"
2063,"死阿哥可能是要让他出丑，袁春旺做了手脚"
2063,"历史上令贵妃的十五阿哥继承了皇位"
2063,"县分啥时候领盒饭"
2063,"果然是黄桑亲生的，都喜欢踹人"
2063,"该领盒饭了"
2063,"彤彤在看吗"
2064,"大猪蹄子的女人们斗完又到儿子作了"
2064,"本宫很爱很爱皇上的"
2064,"王海榕你个大猪蹄子"
2064,"今天的人真的好少"
2064,"四阿哥不是个好的"
2064,"这事只是袁春望一人所为！他们都不知情"
2065,"四阿哥也就是会使使绊子，这么要人命的事估计他不敢"
2065,"飯盒熱好了我給你送來了~"
2065,"其实皇后特别好啊我真心觉得啊"
2065,"萨哥，劝你善良，否则一巴掌扇死你"
2065,"你晓得就好"
2065,"还有人想念本宫吗"
2066,"看样子不是这娃干的"
2066,"嘉嫔生的狗果然跟它一毛一样"
2066,"撒哥和哇哥"
2066,"为什么没有纯妃的六阿哥"
2066,"原来不是四阿哥干的啊"
2066,"袁春望肯定动手脚了的"
2067,"四阿哥是背锅的。是皇后做的"
2067,"早晚都废了"
2067,"看简介就懂以后谁继承皇位了"
2067,"太监马上可以杖毙了"
2067,"看四阿哥这口气，难道也是背锅了？"
2067,"为什么没有纯妃的六阿哥"
2068,"四啊歌是大嘉平生的能不能不要再问了"
2068,"我领盒饭好快，不甘啊"
2068,"明知这是一场意外哎，你会不会来～"
2068,"天天吃大猪蹄子太腻了"
2068,"都是那该死的袁春望，当初就不该留着他"
2068,"袁春旺肯定不是皇子，他自己误会了"
2069,"一个太监什么权利管那么多珍儿你该清醒点了"
2069,"袁春望吃盒子吧"
2069,"一个袁春旺有这么大能耐吗"
2069,"缙中的小伙伴在看吗"
2069,"说多少遍了历史上是令贵妃的儿子永琰继承皇位"
2069,"纯妃的是六阿哥"
2070,"萨哥不错啊长得"
2070,"傻小子、这是来送盒饭的"
2070,"桌子演的不错"
2070,"谁让你容嬷嬷不通报就进来的"
2070,"珍儿变坏了听信了袁春望的话"
2070,"一个袁春旺有这么大能耐吗"
2071,"典型的有其母必有其子"
2071,"呵就算五阿哥有个什么意外朕也不会立你为储"
2071,"这皇后不会是让四阿哥背黑锅了吧？"
2071,"不会说说：不能：不会因为他用了、一定会要了好好努力"
2071,"四阿哥也不想他受伤啊"
2071,"朕可是经历过夺嫡的人，怎么可能看不出问题"
2072,"老四不是好东西"
2072,"不会是袁春望干的吧"
2072,"袁春望本宫劝你善良"
2072,"本宫竟有这样的狗臣子"
2072,"太监咋不长胡子"
2072,"我来给你送盒饭那"
2073,"四阿哥估计也是背锅，他是想让5出丑，袁春望动了手脚"
2073,"说皇后善良的怕是忘了她以前怎么挑唆纯妃害皇后的吧"
2073,"桌子那么亮，是开灯了吗"
2073,"果然有其母必有其子，母亲好的，孩子自然也善良。"
2073,"袁春旺啊，哎，为什么不善良"
2073,"珍儿都熬成珍姑姑了那珍珠也快是珍珠姑姑了吧"
2074,"珍姑姑也是被爱情冲昏了头"
2074,"都给朕拖出去斩了"
2074,"袁春望，本宫劝你善良"
2074,"为什么不是容姑姑"
2074,"嘉嫔的儿子果然不一样，什么妈养"
2074,"果然有其母必有其子，母亲好的，孩子自然也善良。"
2075,"千算万算算不到乾隆活到80多岁，大点的阿哥都没戏"
2075,"蛙哥，滑马一定会给你主持公道"
2075,"那位太监长得真寒碜"
2075,"袁春望，四啊哥快来陪我高贵妃纯妃尔晴大嘉嫔来打麻将"
2075,"珍儿都成了姑姑了，那什么时候变成容嬷嬷？"
2075,"珍儿长得和袁春望好像"
2076,"六阿哥是纯妃的儿子，过继给人了，都没有看剧的吗？"
2076,"容嬷嬷我劝你善良"
2076,"39岁的珍儿好年轻"
2076,"还是我好吧"
2076,"你们有人认识张永兴就毛古吗"
2076,"本宫对你是真心实意，你却让本宫替你背锅"
2077,"我一直就说珍儿不是容嬷嬷"
2077,"四阿哥本来是要让永琪出丑，结果被袁春望动了手脚"
2077,"一对一总决赛了，后宫当然只剩两个啦"
2077,"哈哈哈哈笑s我了蛙哥和撒哥"
2077,"也好像是和亲王"
2077,"姐夫义人看起来"
2078,"二倍速是个好东西！"
2078,"都是套路啊，还好盒饭领的早，根本玩不起"
2078,"珍儿也成了珍姑姑了"
2078,"是袁春望教唆和亲王干的"
2078,"珍儿和珍珠都是珍姑姑？"
2078,"珍儿不就是容嬷嬷么"
2079,"五阿哥太善良了……这样没有爪子的善良叫不分是非"
2079,"咋感觉四阿哥眼里都是对珍儿的爱意呢"
2079,"撒哥给你热的盒饭赶紧趁热吃了吧"
2079,"有木有想我哟"
2079,"果然是必有其母必有其子，虽然不是亲生的但是是他养的"
2079,"最后我儿子继承了皇位"
2080,"哇感觉本来是袁春旺做的但是要推到四阿哥身上来"
2080,"袁春旺，我劝你善良，算了，直接领盒饭吧"
2080,"四阿哥和高贵妃一样都是极其单纯的"
2080,"学学本宫的善良"
2080,"最大的是叫一阿哥吗"
2080,"要领盒饭了"
2081,"珍珠和袁春望呆久了都变坏了"
2081,"您的盒饭已送达"
2081,"容嬷嬷我劝你善良"
2081,"我咋下线了"
2081,"四阿哥我劝你善良"
2081,"哇感觉本来是袁春旺做的但是要推到四阿哥身上来"
2082,"最后袁春旺因为太后告诉他他不是雍正的儿子而发疯"
2082,"洒哥我劝你善良"
2082,"四阿哥只想让永琪出丑而已，不想伤他"
2082,"袁春望，本宫要把你杖毙"
2082,"袁春望借四阿哥的手做的"
2082,"我咋下线了"
2083,"四阿哥我劝你善良"
2083,"我劝你善良"
2083,"你们这智商哦，他只是想让永琪出丑，没想过害他，"
2083,"一个都不是好东西。"
2083,"六阿哥送人抚养了，有提过"
2083,"我知画要不要出个场"
2084,"这才是杀母夺子，之前皇后再讲自己的故事呢"
2084,"本宫劝你善良"
2084,"说皇后的那位你是没看剧情吗"
2084,"珍姑姑就是以后的容嬷嬷吧"
2084,"确认过眼神，一起看剧的人"
2084,"撒哥，居然敢欺负朕的哇哥"
2085,"大猪蹄子真聪明"
2085,"四阿哥其实长得不错"
2085,"五阿哥的嫡福晋是鄂尔泰的孙女，侧福晋是观保之女"
2085,"听说有人要吃本宫的韭菜？"
2085,"哇，这一手好棋搞掉了两个皇子啊"
2085,"這個四阿哥是誰的孩子"
2086,"四阿哥肯定没那么大胆子，是袁春旺下的手"
2086,"一个宫女权利这么大"
2086,"肯定是袁春望个狗奴才搞的鬼"
2086,"四阿哥我劝你善良"
2086,"怎么是珍姑姑呢，我还以为是容嬷嬷呢"
2086,"本宫告诉你！这是嘉嫔的儿子"
2087,"四阿哥长的不错"
2087,"四阿哥有其母必有其子"
2087,"刚刚说永琪和你一样帅的出来"
2087,"有什么娘就有什么样的儿子"
2087,"两个格格是真实存在"
2087,"麻烦各位搞清楚，容嬷嬷是皇后的乳母，不是珍儿"
2088,"袁春旺为什么会活到这么多集"
2088,"本宫是被袁春望和珍姑姑耍了？"
2088,"撒哥蛙哥那个你要笑死我吗"
2088,"还记得我吗？"
2088,"傻子，还是皇后杀了你亲娘呢"
2088,"这个小杂皮"
2089,"没办法看袁春旺"
2089,"方洋飞，你在国风美少年上唱歌真好听"
2089,"四阿哥是那个妃子生的"
2089,"还记得我这个高可爱吗？"
2089,"这是嘉嫔的儿子"
2089,"这几个奴才拖出去斩"
2090,"最大的大阿哥谁说的一阿哥"
2090,"历史上嘉嫔是活的最长的。"
2090,"都是善良的啊哥都是袁春旺干的"
2090,"还有大潮汕的卤鹅肉🙃"
2090,"盒饭热好了"
2090,"老娘最厉害。"
2091,"她不是容嬷嬷容嬷嬷是皇后乳娘不懂历史就别乱评"
2091,"还珠一波人呢"
2091,"袁蠢旺娴妃五阿哥我劝你们善良。"
2091,"四阿哥是方洋飞演的吗？"
2091,"撒哥是大嘉嫔生的，皇后收养的"
2091,"珍儿~我劝你善良"
2092,"你要知道你亲妈是你所谓的皇额娘杀的，会怎样"
2092,"有人想我高可爱吗"
2092,"这盒饭看着不错"
2092,"我还没有吃饱"
2092,"我以为是送些韭菜垫垫肚子"
2092,"珍儿~我劝你善良"
2093,"这是嘉嫔的孩子。后来皇后带大的"
2093,"撒哥，你居然敢害朕的蛙哥！"
2093,"四阿哥是嘉嫔生的，问是不是纯妃的怀疑你们怎么看的剧"
2093,"本宫的孩子是六阿哥"
2093,"四阿哥怕是要领盒饭了"
2093,"这盒饭看着不错"
2094,"说四阿哥比五阿哥帅那个，你是魔鬼吗"
2094,"你好大的胆子，敢害本宫的儿子😡"
2094,"大晚上的看饿了"
2094,"本宫才活了四集"
2094,"姑姑比你还年轻"
2094,"为什么他的盒饭这么好吃"
2095,"古代的菜做的好精致"
2095,"背锅的人还是换下好"
2095,"吃饱了好上路"
2095,"该死的袁春望，谁叫你动永琪了"
2095,"撒哥到底知不知情啊"
2095,"四阿哥要挂了"
2096,"明明是五阿哥更帅四阿哥长得有点贼五阿哥多可爱"
2096,"还是宝宝可爱"
2096,"大晚上的看得人好馋"
2096,"这种时候还喝酒？"
2096,"为了一个太监珍儿真是不容易啊爱情冲昏了头脑"
2096,"居然有烤鸭吃！！！油汪汪的好馋啊"
2097,"哇哦刚出事就好吃好喝"
2097,"袁春望我劝你善良"
2097,"这么多坏人"
2097,"小伙子长得不错"
2097,"看着就好吃啊"
2097,"你们都会领盒饭的"
2098,"皇上不急袁春望急"
2098,"这不是本可爱的藕粉丸子嘛"
2098,"啊好好吃，大晚上放毒"
2098,"最后一顿饭了，多吃点吧"
2098,"吃吧，吃饱好上路"
2098,"袁春望你啥时候去领盒饭"
2099,"还是高贵妃最单纯啊"
2099,"那个小丸子是什么本宫也想次快给我盛上来"
2099,"撒哥，我劝你善良"
2099,"吃顿好的好上路"
2099,"四阿哥是大嘉嫔生的，现在的皇后杀了他生母"
2099,"啊好好吃，大晚上放毒"
2100,"装这么多吗？最多三个菜"
2100,"大半夜的看饿了"
2100,"吃了就上路好嘛"
2100,"看着真好吃啊"
2100,"哟吃的不错啊"
2100,"吃顿好的好上路"
2101,"这菜就着馒头好吃"
2101,"大半夜让人看这个你俩疯了么"
2101,"这些人真是的太幸福了"
2101,"吃吧吃多点"
2101,"很好吃的样子"
2101,"珍姑姑是容嬷嬷吗？"
2102,"四啊哥是以前那个大嘉宾的孩子"
2102,"四阿哥，吃完饭就好好上路吧！"
2102,"那个粥看起来蛮好吃的"
2102,"吃完上路吧"
2102,"汤圆演得好"
2102,"我怎么感觉像吃最后一顿啊，"
2103,"肯定是太监作妖了吃那么好很开心是吧"
2103,"送你上路别挡我儿道"
2103,"好精致的菜肴"
2103,"吃了好上路"
2103,"皇额娘说：吃完好上路了"
2103,"我怎么感觉像吃最后一顿啊，"
2104,"这么多阿哥都分不清"
2104,"馋死我了面前那碗粥"
2104,"生金瞳蛙哥的时候纯妃还没怀宝宝呢萨哥咋是纯妃的儿"
2104,"总感觉这饭不简单"
2104,"后面的灯笼演的好"
2104,"哼老四阿你等死吧朕摘了你的脑袋"
2105,"感觉四阿哥长得比五阿哥好"
2105,"都是道具，都么精致得道具食材"
2105,"袁春望是这剧最大的败笔！！"
2105,"容嬷嬷我劝你善良"
2105,"吃顿好的好上路"
2105,"今天吃的烤鸭，嗯真香。"
2106,"看多了两倍速再回来看原速真的不能忍"
2106,"皇后智商跟不上剧情发展了"
2106,"盒饭热好了"
2106,"我觉得我还可以浪一波"
2106,"还珠格格上的令妃可没有这么顽皮呀"
2106,"这是你最后一餐饭"
2107,"袁春望让珍儿送吃的，等下四阿哥就该中毒了"
2107,"乖儿纸，好好上路吧，本宫想对你说的就是这些了"
2107,"感觉后面不是很精彩了呢"
2107,"我不想吃，我吃饱了，哈哈"
2107,"袁春望我劝你善良"
2107,"这些吃的拍完是不是就都浪费了啊"
2108,"皇后的贴身侍女不能出宫自然只能跟太监好"
2108,"导演把我忘了吗？"
2108,"珍儿的脑袋里装的是浆糊么?"
2108,"想本宫了吗。"
2108,"这是要歇菜的节奏啊"
2108,"珍珠别被袁春旺带坏了，离他远点"
2109,"四阿哥开始和高贵妃的大嘉嫔的儿子，五阿哥是愉贵人的"
2109,"四阿哥这是给你的盒饭比别人的丰盛"
2109,"袁春旺活不过一集了"
2109,"皇额娘劝你善良"
2109,"四阿哥，我劝你善良"
2109,"哼让你害我五阿哥"
2110,"愉妃是个好母亲"
2110,"珍儿给撒哥送夜宵吃了"
2110,"这个珍儿不是好东西"
2110,"带着来砍掉你的脑壳"
2110,"弟弟要小心"
2110,"这碗莲子羹有问题"
2111,"夜天子徐海乔宋祖儿演的还不错"
2111,"这是让他背锅么"
2111,"四阿哥是大嘉嫔生的，五阿哥是愉贵人，六阿哥是纯妃！"
2111,"珍儿也是傻的可爱"
2111,"吃饱了好上路"
2111,"珍儿真老了，成姑姑了"
2112,"珍儿没一点眼光喜欢心毒的人必然也会领盒饭"
2112,"五阿哥是个好孩子"
2112,"老四只想让五阿哥出丑,这事不是他做的"
2112,"四阿哥我劝你善良"
2112,"居然给了菜一个特写？有问题有问题"
2112,"大晚上吃汤圆消化的了吗"
2113,"明知这是一场重伤害，你要不要来~~"
2113,"儿子，吃完饭就上路吧，我一个儿子就够了"
2113,"吃完饭估计也要交代了"
2113,"撒哥你等着"
2113,"立刻对他好了，毕竟老五这样了"
2113,"五阿哥是个好孩子"
2114,"这是袁春望让珍儿来演一出戏的"
2114,"自己养大的孩子都舍得杀，本宫厉不厉害"
2114,"活该你，谁让你的母亲有一个袁春望"
2114,"大晚上一碗汤圆消化不了啊"
2114,"确认过眼神，是背锅的人哈哈哈"
2114,"本宫不想看到袁春望和四阿哥了"
2115,"很明显是四阿哥只是让永琪出丑结果被袁春望利用了"
2115,"四阿哥，我劝你善良"
2115,"珍儿被爱情冲昏了头"
2115,"袁春望我当时就该让你领盒饭"
2115,"撒哥蛙哥那个笑死我了"
2115,"袁春望三缺一来不？"
2116,"盒饭送的不错啊"
2116,"容嬷嬷什么时候上场"
2116,"么么，看到这了么"
2116,"我听成芍安勿躁，你们呢？"
2116,"方洋飞方洋飞！！"
2116,"珍儿被爱情冲昏了头"
2117,"这好酒好菜有阴谋"
2117,"本宫让你吃了一顿好的，快点上路吧"
2117,"这个四阿哥长得好像纯妃"
2117,"嘉宾的儿子要领盒饭了"
2117,"大阿哥哪去了"
2117,"还记得我么"
2118,"自己的亲额娘都是她亲手所杀"
2118,"为了我儿四阿哥只有请你先吃盒饭了他们说很香。"
2118,"最后一顿好饭了"
2118,"韭菜你是认真的吗😂😂"
2118,"四阿哥要挂了"
2118,"珍儿居然带了三个耳环！"
2119,"皇后太久没作妖这段位掉得厉害啊😂😂"
2119,"你还有脸看我儿子"
2119,"有特写的菜你也敢吃，就你胆肥"
2119,"要背黑锅了"
2119,"大晚上吃汤圆，不会不消化吗"
2119,"四阿哥要挂了"
2120,"珍儿就是被爱情冲昏了头了"
2120,"看这节奏，不是四阿哥干的吧？怕是被嫁祸的？"
2120,"叫杀母仇人皇额娘，心疼一下。"
2120,"放筷子的是一包餐巾纸吗"
2120,"饭菜怕是袁春望安排的"
2120,"皇后太久没作妖这段位掉得厉害啊😂😂"
2121,"四阿哥是嘉嫔生的好吧五阿哥是瑜妃生的"
2121,"还是那熟悉的藕粉丸子"
2121,"皇后心里爱皇上，不是袁春望的话不会到这地步"
2121,"😂😂容嬷嬷就是她么"
2121,"大晚上的追剧真不容易饿了饿了"
2121,"你们道行还是低了啊"
2122,"被皇上发现还在这么开心喝酒吃饭就完完了"
2122,"菜演得不错"
2122,"皇子们都是好的"
2122,"袁春望戏精"
2122,"没有一个人好好反思一下袁春旺是幕后黑手么？"
2122,"皇后娘娘说了，吃完这一顿你就安心上路吧。"
2123,"大猪蹄子一看你五弟那样了你吃这么好"
2123,"这四阿哥是有恋母情结吗"
2123,"送你上路，吃好吃饱"
2123,"吃完就看不到五弟"
2123,"看起来很好吃的样子"
2123,"这一吃你就认罪吧"
2124,"大猪蹄子发飙了"
2124,"撒哥的盒饭热好了"
2124,"四阿哥真的因为这顿饭死了，珍儿你也活不了"
2124,"本宫劝你善良"
2124,"这菜还挺丰富的，"
2124,"不是四阿哥，是袁春旺搞的鬼"
2125,"煞哥，你就吃吧，吃完好上路"
2125,"吃饱了肚子，安心上路吧"
2125,"盒饭到了，皇额娘让你不用回宫了"
2125,"看来皇后要先动手了"
2125,"他现在是袁春旺女人，皇后这次是被陷害了"
2125,"袁春望该领盒饭了"
2126,"四阿哥长开了，变帅了啊"
2126,"可还有人记得本宫"
2126,"四阿哥是大嘉嫔生的，五阿哥是瑜妃生的。"
2126,"太在乎皇后了，唉～"
2126,"QAQ蛙哥好善良啊"
2126,"看来皇后要先动手了"
2127,"袁春望戏太多了"
2127,"容嬷嬷你要下毒吗"
2127,"撒哥想去看看哇哥"
2127,"吃完了好上路"
2127,"我劝你善良"
2127,"有两个蠢奴才在自作主张"
2128,"孩子都是善良的，只是投错了胎"
2128,"吃完就可以去看五弟了"
2128,"大阿哥不是还没死么"
2128,"这个特写有猫腻"
2128,"酒酿丸子演的好"
2128,"容嬷嬷你要下毒吗"
2129,"是让你跟你亲额娘团聚"
2129,"为什么喜欢太监呢"
2129,"我一看就知道这顿饭不简单"
2129,"本宫突然出现"
2129,"我才知道撒哥是四阿哥！蛙哥是五阿哥😱"
2129,"富贵让我们相遇"
2130,"大阿哥是容音夭折了的，所以没有"
2130,"吃好了赶紧上路"
2130,"容嬷嬷你能有点常识不？稍安勿躁好吧"
2130,"我劝你善良"
2130,"四阿哥的面相看着挺善良的"
2130,"本宫已经善良"
2131,"四阿哥看久了也挺耐看的"
2131,"饭菜都特别好吃，吃完就等着去见阎王爷吧！"
2131,"盒饭热好了"
2131,"说放筷子的是餐巾纸眼神有问题吧"
2131,"只怕这元宵里有问题，为了让他背锅，这女人也是拼了"
2131,"最后一顿饭了吃好"
2132,"这俩奴才是活太久了吧"
2132,"吃饱好上路"
2132,"袁春旺劝你善良"
2132,"我以为是藕粉丸子"
2132,"一手带大的也要杀吗？"
2132,"袁春望，去领盒饭"
2133,"四阿哥长得像尔康"
2133,"过会儿你就得领盒饭了，赶紧抓紧时间多说点台词"
2133,"皇后和四阿哥现在还都不知情，都是袁春旺在背后捣鬼"
2133,"吃饱了皇额娘送你上路"
2133,"萨哥也是被冤枉的，他并不想害蛙哥"
2133,"你的高可爱突然出现"
2134,"其实四阿哥单纯都是袁春望打个狗卤菜还不去死"
2134,"不是皇后娘娘送的，是她和袁狗贼串通好的"
2134,"这几个菜不错，那碗汤圆看着就好吃"
2134,"这不会是袁春望让送的吧"
2134,"老四，朕劝你善良，要不然连盒饭都没得吃"
2134,"你皮任你皮"
2135,"看珍儿这表情，是要送老四上路啊"
2135,"成功也爱吃"
2135,"袁春旺一个多余的配角"
2135,"本宫不在的这三十集，可有人想念本宫"
2135,"这也是袁春望送的，饭菜有问题"
2135,"感觉是最后一餐啊"
2136,"大晚上吃酒酿元宵也不怕不消化"
2136,"他没想永琪受伤只想让他出丑结果被元春望动了手脚"
2136,"就想知道袁春望带多少资进组"
2136,"话怎么这么多赶紧吃啊"
2136,"这是袁春旺给你准备的撒哥"
2136,"想吃煎饼果子"
2137,"方洋飞好可爱啊"
2137,"充钱让我们相遇"
2137,"喉咙细就嚼嚼啊！吃什么都直接吞的吗？"
2137,"镜头特写，想都不用想了"
2137,"吃这么多元宵！"
2137,"i别说了，快吃吧！"
2138,"所以说这个嘉嫔生出来真的没什么好货"
2138,"感觉下毒了"
2138,"四阿哥我劝你善良"
2138,"哼哼我最美"
2138,"就我觉得四阿哥比五阿哥帅？？？"
2138,"给你送行！"
2139,"这喉咙该多细啊"
2139,"更年期掉段了"
2139,"珍儿其实挺善良的都是袁春旺害的"
2139,"一看就是个没干好事的"
2139,"洒哥要崩了"
2139,"这不会是袁春望送的吧"
2140,"珍儿的表情一看就知道饭菜有问题"
2140,"吃了这碗就永遠留在宫里了"
2140,"老四谁生的，搞不清"
2140,"珍儿爱情蒙了你的心啊"
2140,"估计是最好一顿了，一切都是袁狗做的，四阿哥背锅了"
2140,"珍儿你也要本宫背黑锅吗"
2141,"我没听错吧元宵咽不下去，难道你吃东西不用嚼的吗"
2141,"别给自己加戏了快吃吧"
2141,"袁春旺演的好"
2141,"不会把四阿哥害死吧！"
2141,"这个四阿哥不会是想对他的珍姑姑怎么样吧"
2141,"一下除了两个"
2142,"珍儿你是这等四阿哥长大了然后你们再一起长更大吗"
2142,"这不是本宫吩咐的"
2142,"珍儿眼圈红了，而且那碗元宵有特写，所以一定有故事！"
2142,"原来我儿子喜欢我贴身丫鬟啊"
2142,"彦祖教练你个大猪蹄子"
2142,"这个四阿哥不会是想对他的珍姑姑怎么样吧"
2143,"四阿哥是皇后养大的"
2143,"狗奴才你要心软了么"
2143,"容嬷嬷我劝你善良"
2143,"给了汤圆特写，有问题"
2143,"珍儿我劝你善良"
2143,"反正也不是亲生的，跟着你亲娘走了吧！"
2144,"撒哥有点阔耐啊"
2144,"珍儿要心软了"
2144,"袁春望快去给富察皇后她们端茶送水吧"
2144,"这元宵不简单"
2144,"容珍儿，劝你善良"
2144,"给了汤圆特写，有问题"
2145,"愉贵人生出来孩子多好"
2145,"这是酒酿小圆子"
2145,"最后的晚餐啊四阿哥你先别急着感动啊"
2145,"珍儿演的不错"
2145,"容嬷嬷我劝你善良"
2145,"不会是袁春望让珍儿下毒吧"
2146,"娴妃这么做是为了撇清关系让大家以为自己也是被害者"
2146,"可怜的孩子"
2146,"大明湖畔的夏雨荷呢~哈哈哈哈野这么大了吧"
2146,"有点可爱怎么回事"
2146,"肯定是袁春望想拉个替罪羊一举两得"
2146,"袁春望要找背锅的了"
2147,"都是善良的就怕有奸人挑唆"
2147,"袁春望是不是想登皇位"
2147,"大猪蹄子还记得当年大明湖畔的夏雨荷吗"
2147,"这顿饭不简单因为给特写了"
2147,"要心软了吗"
2147,"吃元宵是整个咽下去的吗？牙呢"
2148,"珍儿是袁春望派来的谋杀四阿哥的把一个太监演得太权大"
2148,"撒哥看起来好蠢好单纯"
2148,"皇后还是御下不严，让他们觉得自己可以做皇后的主"
2148,"撒哥快下线了吧"
2148,"四阿哥还不错啊"
2148,"要心软了吗"
2149,"是啊！哥演的好"
2149,"袁春望要把皇子都杀死"
2149,"四阿哥准备领盒饭了"
2149,"呜呜呜四阿哥也要下线了吗"
2149,"四阿哥不会就这样挂了吧"
2149,"撒哥快下线了吧"
2150,"每天吃这么好，还这病那病的"
2150,"想念你们的高可爱吗～"
2150,"其实这个四阿哥脸蛋也不错"
2150,"本宫要送你上路了"
2150,"不是亲生的你得意个毛"
2150,"F晓燕不知道你能不能看到我只想对你说对不起"
2151,"元宵一定很好吃"
2151,"太可爱了太监"
2151,"你们都要感谢袁春望大人！！！不然嘉庆都没戏了。。"
2151,"又是袁春望里主意吧"
2151,"吃完就得玩完"
2151,"等等！袁总管的盒饭还是留给他自己吧"
2152,"都是背着皇后干的"
2152,"这红丫鬟是个傻子吧"
2152,"有问题吧这碗元宵"
2152,"完了，撒哥要背锅了"
2152,"那是皇后那时还没亲儿子"
2152,"我儿子要领盒饭了吗？"
