time,content
1983,"刘思凡你个大猪蹄子！"
1984,"纯贵妃离开的第一天，想她想她"
1984,"感谢佘诗曼让我们看到了演反派也可以那么有层次"
1984,"爱是一道光，绿到你发慌"
1984,"最后一根灯芯会不会是娴妃她自己呢"
1984,"皇后心机真深"
1984,"最看不懂的就是皇后，城府好深啊。"
1985,"纯妃你本就不是个好东西，做棋子也要你有贼心不是吗"
1985,"自然俩字看了好几遍演技太好了"
1985,"纯贵妃满级了智商就下降了"
1985,"本宫要去找水神和锦觅了"
1985,"这个剧的下人出卖主子出卖的都很利索啊"
1985,"纯贵妃离开的第一天，想她想她"
1986,"本宫那么善良，对你们那么好"
1986,"看来纯妃你还是跟着本宫的时候智商高一点"
1986,"有录音就好了"
1986,"来来来，一起吃盒饭，多吃些肉"
1986,"这个眼神倒回去看了一次又一次每次都给吓到"
1986,"本宫要去找水神和锦觅了"
1987,"本宫可没这么说哦，都是你这个大猪蹄子自己想的"
1987,"本宫急得跳了起来！！"
1987,"皇后好善良谁都让她死的明明白白"
1987,"气的本宫声音都像高贵妃了"
1987,"这个回头，厉害了👍好演技"
1987,"爱死佘诗曼的演技"
1988,"我还以为淑慎回头两个人要亲上"
1988,"这表情到位"
1988,"本宫当然是帮你热盒饭的"
1988,"别吵了，死后还要在一个墓里见呢！"
1988,"面部表情生动，演技出色。、"
1988,"纯妃以前多聪明啊……"
1989,"阿佘表情亮了，太到位了"
1989,"纯妃盒饭已热好麻将已备好来吧就等你啦"
1989,"这个飙戏厉害了"
1989,"段位不同不敢惹不敢惹乖乖吃盒饭吧"
1989,"余演技真好"
1989,"我错过了这么多好戏"
1990,"纯贵妃头上的是挖耳勺吗"
1990,"来来来，热乎饭"
1990,"啊说自然扭头的这个眼神太到位好怕怕演技爆裂"
1990,"竟敢愿望本宫"
1990,"纯妃，你太嫩了，去峡谷练练技术吧"
1990,"这就是强者的世界吧"
1991,"纯贵妃也是原声啊，这个相当厉害啊，比秦岚配的更好"
1991,"突然觉得本宫是个单纯的孩子。"
1991,"让我们绿起来好么"
1991,"我以为自己已经很聪明了"
1991,"盒饭热好了"
1991,"啊说自然扭头的这个眼神太到位好怕怕演技爆裂"
1992,"佘诗曼那个得意笑的真是演的好"
1992,"你这个大傻子还挺聪明"
1992,"纯妃演的真的好，才能让人恨她"
1992,"现在才知道晚了本宫比你聪明不知道多少倍呢"
1992,"阴谋，阳谋，明说，暗夺的魔，努力做厉害的人"
1992,"自然说的好自然"
1993,"闲妃没错啊，如果你不想害皇后她叫你去你也不会去啊"
1993,"本宫那么善良对你们那么好"
1993,"好可爱离开的第N天，想她，想她，还是想她。。"
1993,"怎么这么多人害了我"
1993,"在后宫活着双商需要多高……"
1993,"你知道的太多了，你死定了"
1994,"皇后扭头说自然的时候表情有点慎人演技真的好"
1994,"转头那一下吓坏我了宝宝又想起来嘉嫔走的那天晚上"
1994,"这俩人演的太好了"
1994,"这句自然和转头给我看惊了冒冷汗那种"
1994,"璎珞听见就好了"
1994,"自然，自然堂，我本来就很美"
1995,"纯答应你牙齿有点黄要用我家美牙仪吗"
1995,"本宫眼镜好大"
1995,"其实我们现在好喜欢高贵妃啊始终是那么高贵"
1995,"拉下去斩了"
1995,"都是好演员"
1995,"我能复活了嘛"
1996,"皇后头好大"
1996,"还是宝宝善良"
1996,"这皇后看着好瘆人"
1996,"看我眼睛大吗"
1996,"娴妃，我劝你善良"
1996,"纯妃你吓我一跳，小心我拉你照镜子或者勒脖子😬😬"
1997,"妈耶纯肥脖子和脸的色差？？？"
1997,"我突然发现我好善良"
1997,"富察皇后：纯妃，愉妃快出来和本宫打斗地主。"
1997,"本宫来抢人头啦，你的人头本宫也要收下"
1997,"自然两个字的神情佘诗曼演技真的好"
1997,"都是在将死的时候看明白"
1998,"纯妃还是很聪明的"
1998,"想做个什么造型?两边打薄吗？办卡吗？"
1998,"明明是自己起了害人的心思，还把这些错推给别人"
1998,"我劝你们都善良"
1998,"嗯，这个剧情挺随意"
1998,"本宫要开个理发店"
1999,"这段戏两人演的不错啊"
1999,"临死才这么明白，晚了"
1999,"冷宫就是真相大白屋了所有到冷宫的都是说实话了"
1999,"后宫女人真厉害"
1999,"这个发型可还好"
1999,"现在才发现，本以为是王者现在我觉得你只是个钻石鸭"
2000,"刘三好厉害了，手始终是干净的"
2000,"爱是一道光，绿到你发慌"
2000,"两边打薄吗？要不要办张卡?"
2000,"本宫耳坠穿帮了！你们不想活了么？"
2000,"佘诗曼得演技是真的太好了。"
2000,"怎样还满意吗"
2001,"以前这两个人的关系多好"
2001,"你拉我照镜子！是第二步！"
2001,"阿佘演技真的好，TVB很多演员比大陆演技好多了"
2001,"你看这个发型可以吗不行咱烫一下"
2001,"本来纯妃智商很高啊"
2001,"发型还满意吗"
2002,"都不是好货皇后那么好你们算计活该都没令妃笑到最后"
2002,"宝宝还是厉害的"
2002,"纯贵妃的耳朵会动耶"
2002,"妈呀！我都不知道我喜欢富察·傅恒"
2002,"看两个演技好的人飙戏就是爽"
2002,"本来纯妃智商很高啊"
2003,"这个剧最大成功就是找了一批好的演员"
2003,"女人都是大猪肘子"
2003,"嘉贵人就是在这样的房间里跟娴妃吵架就被勒死了"
2003,"我让你照镜子你就得死"
2003,"娴妃转头说自然的那个眼神太到位了"
2003,"我才发现，我真聪明"
2004,"纯妃演技不错"
2004,"每个人下线都要给观众解说一遍"
2004,"纯妃挺可爱的"
2004,"晚了、你太傻"
2004,"娴妃转头说自然的那个眼神太到位了"
2004,"这个剧最大成功就是找了一批好的演员"
2005,"苏静好，岁月静好引人无限遐想，只可惜你终究还是负了"
2005,"本宫好单纯啊"
2005,"明白的时候就晚了哦"
2005,"纯贵妃，我劝你善良"
2005,"快死了然后智商突然上线晚了"
2005,"晚了、你太傻"
2006,"你的好友纯贵妃，哦不纯答应已退出群聊"
2006,"好开心好开心。"
2006,"你不要把自己的私心怪在别人身上，有了孩子的妃嫔多了"
2006,"我太单纯了"
2006,"佘诗曼的演技棒呆了"
2006,"就是做头发的时候啊"
2007,"你现在聪明了有屁用"
2007,"快快快，录音，给皇上听"
2007,"纯贵妃这卧蚕不想吐槽"
2007,"女人翻脸就是这么快"
2007,"纯妃眼角开得太大了"
2007,"本宫格局比你大；还不明白？"
2008,"这就能看出来娴妃眼光多长远这么长时间都能算计"
2008,"我对你们那么好，你们竟然个个都想害本宫。"
2008,"纯妃的眼睛割的很不错啊"
2008,"我逻辑思维能力好强再让我回忆一下"
2008,"纯贵妃要领盒饭了"
2008,"你现在聪明了有屁用"
2009,"富察皇后：静好呀~本宫劝你善良怎么就不听呢？？？？"
2009,"本宫演技不错，但还是想吃盒饭"
2009,"佘诗曼的演技真的好啊，眼神真的太到位了"
2009,"两个人演技真不错，纯妃你先去吧，我随后就来"
2009,"才想清楚晚了"
2009,"降到青铜了才意识到水晶要爆了？"
2010,"明白的太晚了纯！再说你本来就居心不良才给人可趁之机"
2010,"晚了一步，就是步步晚"
2010,"纯妃段位掉的有点快啊以前是找的代打吗"
2010,"现在才恢复智商，晚了"
2010,"你们好厉害，怎么看出纯妃开过眼角啊"
2010,"佘诗曼的演技真的好啊，眼神真的太到位了"
2011,"纯妃原声台词功底不错"
2011,"老娘们你现在才想明白可算是晚了"
2011,"纯妃聪明了"
2011,"如果你本性善意，别人说什么又有什么关系呢"
2011,"现在才明白，晚了"
2011,"现在才恢复智商，晚了"
2012,"这部剧一直在填坑啊，好细心啊每个细节都有解释，完美"
2012,"娴妃才是最毒的好吗别为她说话了"
2012,"纯贵妃的颧骨实在是高啊"
2012,"这后宫我见多了呵女人"
2012,"你还以为自己有多精明"
2012,"老娘们你现在才想明白可算是晚了"
2013,"人家也只是引导你，还不是自己私心太重才会做坏事"
2013,"纯答应这就是你背叛的下场"
2013,"纯妃对皇上没有感情，感觉对永瑢也没那么在乎"
2013,"分析的真好，可以写篇论文了"
2013,"都不是什么好东西"
2013,"本宫的演技真好"
2014,"太晚了你本来就起了邪念和歹意"
2014,"要领盒饭的时候都演技爆发了"
2014,"才看破，晚了。别说了，领盒饭去吧"
2014,"要把大象装冰箱，总共分几步"
2014,"这部剧每个演员演技都好"
2014,"本宫的演技真好"
2015,"任督二脉突来热了起来"
2015,"静好快来陪我吧"
2015,"阿佘段位真的太高了啦没得玩了"
2015,"我会动耳神功"
2015,"人家抛个引子给你，你正是有心才会上当啊"
2015,"太晚了你本来就起了邪念和歹意"
2016,"娴妃不愧是最大的反派"
2016,"现在才晓得是不是晚了很多"
2016,"佘诗曼的眼神天哪戏太多"
2016,"现在明白晚了"
2016,"这后宫好绿啊！"
2016,"人家抛个引子给你，你正是有心才会上当啊"
2017,"好无语，你不是智商挺高的吗？两句话就把你忽悠了"
2017,"阿佘演技太好了"
2017,"这样看来，高可爱真的好单纯啊"
2017,"现在才明白晚了"
2017,"那还不是你自己耳根子软，还是对富察皇后不真心"
2017,"所以说一定要防着美发店让你办卡的"
2018,"哎，你的聪明来得太晚，醒悟已经晚了"
2018,"不费一兵一卒让你们自己厮杀，好渔翁得利"
2018,"纯妃怎么情绪不稳定，智商更不稳定"
2018,"纯贵妃要领盒饭了"
2018,"你耳根子软就输了"
2018,"那还不是你自己耳根子软，还是对富察皇后不真心"
2019,"可是最后不顾那么多年情分选择动手的是你自己"
2019,"你个大傻子本宫待你不薄阿"
2019,"你那么聪明耳根却那么软"
2019,"我就是扇扇风而已，是你自己觉得凉快了"
2019,"好大的一盘棋"
2019,"哎，你的聪明来得太晚，醒悟已经晚了"
2020,"纯贵妃你要做上神了，别计较这些事了"
2020,"人家说了可是你也信了啊要是完全没想法又怎么会听呢"
2020,"智商倒了多少年回了"
2020,"当然有证据我截图了"
2020,"说实话诗曼演的真的好"
2020,"我就是扇扇风而已，是你自己觉得凉快了"
2021,"苍蝇不叮无缝的蛋，自己耳根子软还怪别人"
2021,"太监知道的最多了"
2021,"耳根子好软啊"
2021,"你才知道啊，已经晚了，本宫可以坐收渔利了"
2021,"这么聪明的纯妃也听信别人的话，没有是非之心吗？"
2021,"人生就该被坑几次才能清醒"
2022,"看看来来那个说纪后是好的来看看"
2022,"只能怪你自己嫉妒心太大"
2022,"一直做别人的棋子你害人太多现在知道一切都太晚了"
2022,"本宫要历劫完了上天去做风神去"
2022,"耳朵根子软你赖谁"
2022,"掉段了掉段了本宫领盒饭去了"
2023,"不愧是金枝玉孽出来的女人手段就是高"
2023,"晚了晚了本宫都领盒饭了"
2023,"纯答应怎么还有三个耳坠啊？快快快拿下来"
2023,"突然发现我好聪明啊，嘻嘻"
2023,"纯妃不黑化的话，和皇后，魏璎珞，就无敌了"
2023,"只能怪你自己嫉妒心太大"
2024,"纯妃眼角开的那么明显一看就知道了。不是我们厉害"
2024,"聪明得有点晚啦"
2024,"大猪蹄子也不来听听"
2024,"现在才发现已经晚了"
2024,"本宫当然要最大的盒饭啦"
2024,"现在想明白有用吗？"
2025,"不费一兵一卒高实在是高"
2025,"妹妹知道的有点晚了"
2025,"真聪明阿想明白也晚了"
2025,"我竟然错过了这么多好戏啊"
2025,"纯贵妃黑化之前智商挺高的啊..."
2025,"还忘了一部你太聪明"
2026,"你们要是知道乾隆会活到八十多岁就不会斗了"
2026,"看我厉不厉害全服最强持久消耗"
2026,"纯妃是真的惊艳，重要的事情说三遍"
2026,"哇，你都猜对了啊，真是好厉害"
2026,"自己是猪还去怨别人可笑"
2026,"纯妃，本宫段位比你还高"
2027,"苏静好这些年你只顾向前奔跑却忘了静下心来思考。"
2027,"几句话而已，难为你那么久了还能想明白，啊哈哈哈😄"
2027,"纯贵妃就是个大傻子"
2027,"本宫演技太好了！佩服自己"
2027,"以前纯飞不是很聪明么"
2027,"哇，你都猜对了啊，真是好厉害"
2028,"好大一步棋，这才是大套路"
2028,"突然觉得我好单纯"
2028,"因为到冷宫就冷静下来可以细想了"
2028,"本宫演技真好…这个表情！可以可以！"
2028,"阿佘演技太棒了，好渗人啊浑身鸡皮疙瘩"
2028,"谁让妹妹你这么听话呢"
2029,"七阿哥是原配嫡出立储不是很正常么，谁让你动杀心了"
2029,"本宫下的一手好棋"
2029,"两个大戏骨对戏好过瘾啊"
2029,"我刘三好上辈子太善良了这辈子换个定位"
2029,"到冷宫就聪明了是吧之前怎么不聪明了"
2029,"真是应了那句话:你们城里人心眼真多"
2030,"纯贵妃的死前最后总结做得好"
2030,"纯妃之前是个王者，怎么现在变黄金了"
2030,"后宫妃子智商都好高"
2030,"我只是随口说说罢了。谁知你那么认真的去做了"
2030,"佘诗曼演技是真好"
2030,"本大猪蹄子算是看透了"
2031,"娴妃最厉害，什么都不用做，动动嘴皮子就能做到一切"
2031,"本可爱才是最单纯的"
2031,"这些话让璎珞听见就好了"
2031,"聪明那么久。自己最后被利用"
2031,"怕了怕了，段位太高惹不起"
2031,"很早就开始算计勒"
2032,"你知道那么多，看了你活不过今晚"
2032,"你的脑回路真长，像皇上一样"
2032,"该领盒饭咯纯宝宝"
2032,"这才是高段位玩家"
2032,"贤妃有证据吗好傲娇哈哈"
2032,"本宫的手段比你高"
2033,"剧情梳理得好呀，省的再想了"
2033,"皇后杀了皇后这句话好"
2033,"所以这就是你害人的理由？没有害人之心从何挑拨"
2033,"居然那么久不眨眼，厉害了"
2033,"哇塞佘诗曼黑化只需要一个眼神我滴天啊"
2033,"别的嫔妃使的是手段本宫利用的是人心666"
2034,"佘诗曼演的真好和吉娃娃一比，就知道吉娃娃有多失败了"
2034,"到冷宫聪明多了"
2034,"后宫女人要是参加高考，得考多好的学校"
2034,"知道什么是王者段位了吧"
2034,"纯妃眼睛好大啊"
2034,"是时候表演真正的技术了"
2035,"金枝欲孽时就演的很好了。气质清冷脱俗"
2035,"原来有这么多人想害本宫"
2035,"以前多聪明啊现在变成青铜"
2035,"没有办法我就是这么强大"
2035,"快给纯贵妃加鸡腿"
2035,"知道什么是王者段位了吧"
2036,"咋感觉个个演员像得了甲亢眼凸的明显"
2036,"这才叫精人出口，笨人出手，解决了"
2036,"自己心思不纯想害人还要赖别人挑拨"
2036,"纯妃大傻子"
2036,"要怪就怪你太天真了"
2036,"娴妃，我劝你善良"
2037,"纯妃要是在做语文阅读理解归纳总结内容的话肯定满分"
2037,"对噢之前纯妃不是很聪明的吗"
2037,"快快录音给皇上听"
2037,"额娘教的好"
2037,"纯妃咬唇画的好"
2037,"智商刚找回来就要下线了"
2038,"计划太完美了"
2038,"本宫还不算是主宰后宫之人"
2038,"人家挑拨你可以不上当啊"
2038,"刚才佘诗曼的当然说的起了鸡皮疙瘩🐔"
2038,"太喜欢佘诗曼了"
2038,"纯妃要是在做语文阅读理解归纳总结内容的话肯定满分"
2039,"当一个人一无所有的时候她是最聪明也最厉害的"
2039,"我这么厉害怎么会被小燕子打败呢"
2039,"这部剧最大的亮点就是瞪眼睛"
2039,"本宫一到冷宫就聪明了真好"
2039,"玩心理的片子还是佘诗曼演的到位"
2039,"本宫吃的可是加了鸡腿的盒饭，导演再来一份！"
2040,"贤妃好厉害"
2040,"快来啊盒饭真香"
2040,"这个时候有个录音的就好了"
2040,"生孩子掉段了，，这反应真慢，，哈哈哈"
2040,"后妃都爱挑事，她不挑舒嫔也会挑"
2040,"这又是皇后杀了皇后"
2041,"纯妃眼真的好大啊"
2041,"居然有这么多人害我"
2041,"好手段啊皇后娘娘"
2041,"原来本宫也是个重角色"
2041,"蠢货现在知道晚了"
2041,"贤妃好厉害"
2042,"阿哥怎么越生越大了"
2042,"聪明反被聪明误啊，该领盒饭了"
2042,"演得太好了"
2042,"高手过招招招致命，我当年还是太嫩了"
2042,"阿佘的配音绝了"
2042,"演技真的好"
2043,"佘诗曼演技有好，有让人恨不起来，好奇怪"
2043,"心理学的好走遍天下都不怕"
2043,"自己的心不纯，别人怎么吹风都不管用的。"
2043,"女人嘛，就是容易被挑拨的动物"
2043,"落幕时才会冷静下来"
2043,"本宫只是辅助，自然不被人注意"
2044,"好了吧！活着的时候没见你智商这么高！~~~"
2044,"好咯，你也活不长了"
2044,"眼睛瞪大流眼泪"
2044,"我可是高端玩家，你惹不起"
2044,"我只是开了个头，看你怎么选择去做。"
2044,"落幕时才会冷静下来"
2045,"后宫三千斗下来可以当皇后的肯定是高高手"
2045,"这么久都不眨眼睛，本宫可真厉害"
2045,"只有冷宫才让人聪明啊"
2045,"知道我有多单纯了吧"
2045,"爱是一道光，绿到你发慌。"
2045,"你知道的太多了"
2046,"五阿哥根本就没有食物相克只是参片吃多了"
2046,"你们不要再劝我善良了"
2046,"静好你知道的太迟了"
2046,"导演准备好盒饭本宫饿了"
2046,"佘诗曼的一笑太优秀了"
2046,"只有冷宫才让人聪明啊"
2047,"纯答应演技不错啊"
2047,"才明白啊，人家早就设计好了"
2047,"看来这个柱子又要多一条人命了"
2047,"你还是太年轻啊"
2047,"顺妃把你们都弄了"
2047,"哎，好想皇后"
2048,"本宫的眉毛戏最多"
2048,"纯妃讲这么久话居然都不眨眼睛！厉害了"
2048,"要是有录音笔就好了"
2048,"你话太多了，本宫要晕了，你去领盒饭吧"
2048,"自己没动手，该除的都除了，厉害了"
2048,"我真聪明哈哈哈"
2049,"留封信给璎珞啊，继后下场，总觉得太便宜她了"
2049,"继后我劝你善良"
2049,"阿佘太适合演腹黑了，气质外柔内刚"
2049,"还有这么一出"
2049,"哇塞阿佘的演技太好了不愧是TVB一姐"
2049,"该领盒饭了"
2050,"纯妃原声台词功底不错"
2050,"本宫盒饭热好了吧？"
2050,"晚了领盒饭去吧"
2050,"本宫才是段位最高的人"
2050,"佘诗曼演技绝对能撑起一部戏！"
2050,"还有这么一出"
2051,"这个皇后好心计以后令妃有对手了"
2051,"你知道就好"
2051,"阿佘刚才眯了一下眼睛这么细的小动作都揣摩到了"
2051,"还是本宫最单纯"
2051,"领完盒饭去隔壁找水神，盒饭可好"
2051,"你明白的太晚了"
2052,"这部戏的女人没有一个有好下场"
2052,"这么热闹，早知道本宫当时买复活甲了"
2052,"冷静一下就都明白了"
2052,"我能活这么久真是老天保佑"
2052,"还是怪自己嫉妒心太强"
2052,"这个皇后好心计以后令妃有对手了"
2053,"两人演技棒棒哒"
2053,"纯妃演技这段很明显啊很好啊"
2053,"演技一个个太精彩了"
2053,"妹妹别激动姐姐过几集就陪你一起吃盒饭"
2053,"这个时候皇上在听就好了。。。"
2053,"冷静一下就都明白了"
2054,"只有冷静下来才能想清楚事情"
2054,"不错，要死了明白了"
2054,"纯贵妃的耳朵演的好"
2054,"你要是安分守己也不会遭人利用"
2054,"贤妃演技真的好表情到位"
2054,"哎妈呀，这真是一出接着一处，好乱，脑壳疼。"
2055,"递刀也要你自己愿意接不是！你自己就不是好东西，"
2055,"我截屏了，等下给大猪蹄子看！"
2055,"套路反被套路纯妃你呢就是太单纯了"
2055,"这个时候才明白是不是晚了点？"
2055,"佘演技真的太好了表情说明一切"
2055,"只有冷静下来才能想清楚事情"
2056,"贤妃这个演员选的好演技气质跟这个角色无敌了"
2056,"事真多啊你们"
2056,"闲妃厉害啊！动动嘴就行了"
2056,"还是我最善良"
2056,"只有在冷宫才能冷静下来，才能想明白"
2056,"知道晚了。。唉"
2057,"现在只有纯妃知道先皇后的真相，娴妃还会让她活吗"
2057,"本宫右手无名指的指甲弯了，需着内务府给本宫换新的了"
2057,"纯娴这两个飙戏太厉害了吧"
2057,"冷宫是个好地方"
2057,"纯妃耳朵好可爱"
2057,"事真多啊你们"
2058,"瞬间觉得活在现代好幸福，活在古代估计是长不大的吧"
2058,"你知道太多了去领盒饭吧"
2058,"纯贵妃，生了孩子智商就下降了"
2058,"娴妃我劝你善良"
2058,"递刀也得你有一颗要捅下去的心啊，怨不得旁人"
2058,"你先去吧本宫过几天去找你"
2059,"高端局就是厉害，高手过招，招招致命"
2059,"你知道的真多！不过已经晚了"
2059,"纯贵妃演技太好了"
2059,"现在知道晚了，来陪哀家吧"
2059,"此时，苏答应的眼睛好大"
2059,"说起来还是对我执念太重"
2060,"后面的太监表示很劲爆"
2060,"为什么这么多人都要害本宫？纯妃，尔睛，娴妃。"
2060,"纯妃的演技也很好了"
2060,"高端局就是厉害，高手过招，招招致命"
2060,"你知道的真多！不过已经晚了"
2060,"现在知道晚了，来陪哀家吧"
2061,"纯妃张一张蛇脸那现实中此女也不简单啊"
2061,"哎，我这么聪明会败在小燕子手里醉了醉了"
2061,"娴妃和令妃都是双Q很高的人"
2061,"本宫不过是美丽的皮囊而已"
2061,"纯妃很聪明。只是后知后觉的聪明"
2061,"一来冷宫都变聪明了"
2062,"纯妃娘娘你说这么多越发的活不过今晚了"
2062,"冷宫是一个让人冷静的地方"
2062,"后面那位太监信息量好大"
2062,"说那么多，领盒饭咯"
2062,"纯非演技不错"
2062,"本宫也善良过"
2063,"小太监：哎马听了太多不该听的了"
2063,"纯妃你知道的太多了，本宫不能留你了"
2063,"后面的太监会不会知道得太多了"
2063,"眼睛好酸哦"
2063,"知道了就好，去领盒饭吧"
2063,"原来你也可以快语数的讲话"
2064,"旁边的奴才好淡定啊听到这天大的消息都不惊讶一下"
2064,"那个太监怎么回事？纯妃反应好慢，我反应快，年轻真好"
2064,"看冷宫真是个好地方，纯妃一进去，立刻变聪明了"
2064,"傻子现在你把知道的都说了娴皇后能让你活着吗"
2064,"纯贵妃现在的样子让人看的好害怕"
2064,"纯妃你脖子伸的真长啊，你去当长颈鹿吧，斗不过你了。"
2065,"太监得是紫禁城知道的最多的吧"
2065,"早劝你善良，你不听，现在知道完了"
2065,"你们当着后面太监面说这么多，让小太监余生怎么过"
2065,"没有办法，我就是这么强大"
2065,"看我们俩鼻孔多大"
2065,"不是我解说这些，你们根本看不懂这女人哼"
2066,"皇上这个大猪蹄子怎么不来听听"
2066,"纯贵妃头上那根簪子待会肯定会派上用场"
2066,"声音不得劲，全靠声音大"
2066,"纯贵妃你知道的太多了"
2066,"现在才是高段位玩家对决"
2066,"纯妃呀开头的时候你像开挂一样聪明"
2067,"纯妃到最后才看透这些也不错了，还是聪明的"
2067,"看样子你不知道嘉嫔是怎么死的"
2067,"高手真是高手"
2067,"我才是最高段位"
2067,"小太监:你们别说下去了，我不想听那么多秘密"
2067,"我都录屏了，要拿去给皇上看"
2068,"佘的演技真的太棒了！内敛到点，收放自如！"
2068,"哎呀，这人段位比我高那么多"
2068,"大猪蹄子要是这时候出现就好l"
2068,"后悔了吧，还是我单纯善良，不做作"
2068,"皇后这这角色好深啊"
2068,"我不会承认得后面那么多太监"
2069,"纯妃法令纹好重啊"
2069,"冷宫是个能让人冷静的地方，一到这儿智商就恢复了"
2069,"你知道的太多了，领饭盒去吧"
2069,"朕总是错过这个时候以后要多去冷宫转下"
2069,"纯妃呀纯妃你真是单纯得可以"
2069,"佘的演技真的太棒了！内敛到点，收放自如！"
2070,"后面的太监好阔怕他怕是聋子"
2070,"你这样一说本宫突然发现本宫不是一般的厉害啊"
2070,"演的真好佘诗曼还有这个，这个娴妃太棒了"
2070,"憋说了，你知道太多了，本宫该送你走了"
2070,"佘诗曼不愧是演技派！！这表情太棒了！看得我惊住了"
2070,"说！说完发现自己好聪明"
2071,"这段戏好精彩"
2071,"知道的太多了，可以去领饭盒了"
2071,"没有办法我就是这么伟大"
2071,"快把纯妃的盒饭传上来别饿着了"
2071,"佘诗曼眼神绝了戏谑的看你表演的眼神"
2071,"本宫戏虐的眼神"
2072,"你现在对被伤害的温柔贤惠与世无争的皇后有一丝愧疚"
2072,"最强解说旁白就是我没错"
2072,"诗曼前辈的眼神好厉害"
2072,"身后的太监知道的太多了"
2072,"这段戏好精彩"
2072,"快把纯妃的盒饭传上来别饿着了"
2073,"还厉害的皇后哎劝你善良"
2073,"还是我单纯"
2073,"表情好厉害啊皇后"
2073,"不，老娘单纯的很"
2073,"纯妃啊你早点看透多好啊"
2073,"纯妃，快下来陪本宫搓麻将了"
2074,"璎珞快啊快来听墙角"
2074,"本宫演技真好你才看破"
2074,"静好本来很聪明，怎么会被娴妃玩得团团转"
2074,"你只是铂金段位，本宫是要打王者局的人"
2074,"你要是善良耶不会落得如此下场"
2074,"表情好厉害啊皇后"
2075,"好喜欢他们有族姓感觉好厉害"
2075,"纯妃怪你太纯，先收拾你，她我后面会收拾你放心"
2075,"旁边的太监都是聋子吗，这么重要的消息听不到啊"
