time,content
1803,"我就是怕你闲"
1803,"贵妃头皮红不拉几的"
1803,"哈哈，突然想到逆风如解意，容易莫摧残"
1803,"贵妃内心戏真多"
1803,"想用军功换一个人"
1804,"感觉贵妃的台词好奇怪怎么会发火给皇上说手都要抄断了"
1804,"嘴巴太奇怪了"
1804,"这滤镜用的显得贵妃牙齿好黄"
1804,"找不到我😁"
1804,"大晚上的看贵妃的戏渗人"
1804,"你们不懂这叫樱桃小嘴🌚🌚"
1805,"皇上对皇后真是甜"
1805,"怎么感觉只有高贵妃在认真宫斗，其他人都只在认真生活"
1805,"这妆容这嘴巴涂的是不是唇膏一样不够用啊？"
1805,"这是要提醒你要善良"
1805,"耳晴是个什么东东求解"
1805,"没我戏份，提前串场看看"
1806,"找人的方式厉害了"
1806,"皇上、臣妾真的是找不到啊、哈哈哈哈哈"
1806,"这方法也是厉害了强大强大啊哈哈"
1806,"皇上不宠她，她为啥还这样任性，确实不合适"
1806,"贵妃长得很像郝蕾"
1806,"你们这些后宫嫔妃，脑洞可真大，"
1807,"这贵妃感觉跟打酱油一样，引不起人恨感觉没啥用"
1807,"我可真是个大猪蹄子"
1807,"可能只是皇上觉得你太闲了"
1807,"本宫何时能亮相！"
1807,"贵妃也太大胆了，对皇上那么不敬"
1807,"找人的方式厉害了"
1808,"哈哈哈公公好可爱"
1808,"混在一起做撒尿牛丸呀笨蛋"
1808,"这口红是没图满吗"
1808,"别想找到我"
1808,"贵妃演员没选好"
1808,"演清宫剧你带什么美瞳啊贵妃娘娘"
1809,"粉衣服为什么找成了绿衣服？"
1809,"方便的多费心"
1809,"大猪蹄子是啥意思"
1809,"哈哈哈找不到我吧"
1809,"贵妃跟国公一样想多了"
1809,"哈哈哈公公好可爱"
1810,"看剧为什么会吐槽妆容服装人物台词外貌都去讲吃的空"
1810,"公公听声音也能听出来，真可爱"
1810,"这剧情好神似"
1810,"说话好慢啊"
1810,"说出戏的是怎么想的，这很还原了，要说只能说又流行了"
1810,"那嘴画的就不能对称点吗"
1811,"这个太监也太好玩了，记忆力也太好了"
1811,"高贵妃的嘴好像秦俊杰啊"
1811,"好可爱的太监"
1811,"你们居然抢我台词"
1811,"咬唇妆画得好"
1811,"厉害啊，听声识人"
1812,"这找人的方式可真别致啊"
1812,"温柔如本宫"
1812,"这脑后两个蛋真的好吗有点污"
1812,"哈哈哈哈，为了找人也是拼了"
1812,"皇上对皇后真甜"
1812,"奴才不知道"
1813,"化现代妆你们说出戏现在化柳眉绛唇你们还出戏真是够了角色的服装头型都跟古代画像上很像了好吧"
1813,"这能听出来？牛批"
1813,"这点绛唇涂得，真是不舒服，但是剧情好，我忍了"
1813,"我什么时候黑化"
1813,"公公叫啥来着好眼熟啊"
1813,"还好逃过一节"
1814,"哈哈哈哈好认真的找人啊"
1814,"喜欢这个太监，喜欢这个太监"
1814,"哈哈哈哈哈，这个听多了会不会忘记原版阿"
1814,"撒尿牛丸啊笨蛋"
1814,"不怕听多了记不住原来声音嘛"
1814,"这段是全剧最好笑的了。"
1815,"一个一个的讲要讲到啥时候才找得到璎珞？大数据很重要"
1815,"把高贵妃拖出去斩了"
1815,"公公是吃可爱长大的"
1815,"这段就觉得公公的眼神戏特别好！"
1815,"最可爱是这小太监"
1815,"哈哈哈哈好认真的找人啊"
1816,"哈哈哈找不到我吧？就是这么强大，啦啦啦啦啦啦"
1816,"哎呀我去！朕这后宫佳丽三千你要挠到什么时候？"
1816,"贵妃真出戏，演技好尬"
1816,"周星驰的食神哈哈哈哈"
1816,"没有办法我就是那么强大"
1816,"小太监怎么能这么可爱！"
1817,"这公公是傻子吧，璎珞穿粉色衣服，问绣坊的不就行了"
1817,"高贵妃你是来读台词的吗"
1817,"这公公记忆力这么强的吗"
1817,"贵妃眉毛眼睛还有嘴巴为什么要演那么夸张"
1817,"魏璎珞:哈哈哈，找不到我吧，我就是这么强大"
1817,"璎珞变个声音很容易啊。"
1818,"强迫症看不了贵妃的嘴唇，想给她涂满"
1818,"哈哈哈哈哈抓不到我吧。。。没有办法"
1818,"要是在古代会伪音就无敌了哈哈哈哈哈哈"
1818,"我等着璎珞上"
1818,"这太监耳朵真好"
1818,"这公公记忆力这么强的吗"
1819,"高高劝你善良"
1819,"这公公也是厉害"
1819,"不会看衣服吗无语，，粉红色衣服绣房的人"
1819,"气不气抓不到我把"
1819,"这不是食神的桥段吗周星驰"
1819,"这公公怕是最后都不会念这句话了哈哈哈"
1820,"人穿的是粉衣服，找绿衣服干啥啊"
1820,"这个不是周星驰的食神，撒尿牛丸"
1820,"明明人家穿的红衣服，找这绿衣服的干嘛？"
1820,"估计也听蒙圈了吧，哈哈"
1820,"这宫女头上是多肉还是西兰花啊"
1820,"朕让你这么找人吗？"
1821,"听着听着就分辨不清了"
1821,"这个太监怕是个傻子"
1821,"哈哈哈公公这是要辩音识人啊"
1821,"朕的事情尔等也敢议论，脑袋是觉得累了想下来跑跑么"
1821,"全部都好厉害呀哈哈哈哈哈哈😂"
1821,"演员演的太差了叉叉叉叉叉叉"
1822,"找嬷嬷一问不就知道了，这么大的后宫，员工不得上千人"
1822,"我怎么感觉那贵妃是更年期到了"
1822,"就算记忆力好听这么多种声音原来的声音也会忘吧"
1822,"噗哈哈晕了晕了"
1822,"刚刚有个声音太好听了"
1822,"这个太监怕是个傻子"
1823,"明明是粉衣服的来问绿衣服的哈哈哈"
1823,"这都能听出来就厉害了"
1823,"公公好可爱"
1823,"一个人的声音好吧"
1823,"这种方法也是厉害"
1823,"这不是食神里撒尿牛丸听声找人的剧情吗😂"
1824,"挠痒痒痒痒痒~来啊快活啊反正有大把时光"
1824,"完了我幻听了"
1824,"哈哈哈笑到抽筋这个太监太好玩了"
1824,"这能听出来就厉害了"
1824,"贵妃是话剧演员所以演技有点没收住的感觉"
1824,"这都能听出来就厉害了"
1825,"粉色衣服好吗大兄弟"
1825,"晕死了，别挠了"
1825,"明明人家穿的是粉色衣服你非在绿衣服里找"
1825,"感觉吃饱了撑着找一个宫女"
1825,"哈哈哈好先进的宫廷剧啊"
1825,"逆风如介意容易莫摧残"
1826,"高贵妃演的有点夸张，但是比一般的演员要好点"
1826,"神树皮都要掉了"
1826,"好记性，这都能分辨出来"
1826,"嘴都说秃噜皮了"
1826,"这个公公长的像蕉太狼"
1826,"粉色衣服好吗大兄弟"
1827,"公公可以去考英语听力了，绝对满分"
1827,"随便变个音就能混过去"
1827,"这听多了还能记住之前的声音吗"
1827,"这太监不会认衣服吗？"
1827,"那个宫女明明是红衣服"
1827,"你是魔鬼吗"
1828,"听声识人哈哈哈哈公公好可爱"
1828,"抓不到我吧，哈哈哈哈哈哈，没有办法我就是这么强大"
1828,"一直是这几个在来回放好吗？真当我脸盲啊"
1828,"你这奴才真是傻的可以啊"
1828,"听这么多都要忘了原版了吧"
1828,"你是魔鬼吗"
1829,"好机智啊，居然是听音识人"
1829,"太监你还好嘛。辛苦你了"
1829,"好了都别说了我眼睛疼"
1829,"听着听着就忘记原声了"
1829,"这个太监太不负责任了粉色的好吗"
1829,"不会先看看衣裳吗"
1830,"听多了都蒙圈了"
1830,"好魔性啊哈哈哈"
1830,"工作量好大"
1830,"你怕不是个石乐智呦"
1830,"好机智啊，居然是听音识人"
1830,"不会先看看衣裳吗"
1831,"听的多了能听出来？早混淆了"
1831,"这太监，是想改行做心理学家丫"
1831,"每个眼袋好重啊"
1831,"公公来考英语听力！"
1831,"哈哈哈哈哈这么多人找到什么时候"
1831,"听多了都蒙圈了"
1832,"还听什么听，从衣服辨认就缩小了好大的范围"
1832,"我这公公都要听疯了"
1832,"怎么觉得这么多人都是一个声音一个人的配音"
1832,"这公公太可爱了，"
1832,"公公来考英语听力！"
1832,"哎呀我去笑喷了"
1833,"宫里那么多宫女，这么多人不得听晕了"
1833,"女人都是大猪蹄子"
1833,"清宫宫女有两套宫服的，一套绿的一套桃红的"
1833,"公公的耳朵还好吗哈哈哈哈哈"
1833,"公公这是准备参加最强吗"
1833,"我这公公都要听疯了"
1834,"这公公你是色盲吗，明明是粉色衣服你找绿衣服"
1834,"哈哈哈公公太可爱了"
1834,"好可爱的太监"
1834,"这奴才可爱"
1834,"宫里那么多宫女，这么多人不得听晕了"
1834,"公公的耳朵还好吗哈哈哈哈哈"
1835,"这公公听得怕是头都要大了"
1835,"李玉也是不容易"
1835,"明明是穿的粉色衣服，怎么还问白衣服的"
1835,"怎么感觉太监要晕"
1835,"这公公你是色盲吗，明明是粉色衣服你找绿衣服"
1835,"好可爱的太监"
1836,"公公表情好可爱"
1836,"听困了可还行"
1836,"太监真的得好强大"
1836,"一个声..."
1836,"听多了，到最后都是一个调，声音都一样了"
1836,"这个胖胖好可爱"
1837,"听多了脑阔子不疼吗"
1837,"太监好可爱"
1837,"不科学，听多了就忘了原声了"
1837,"看看公公这张生无可恋的脸"
1837,"公公表情好可爱"
1837,"听多了，到最后都是一个调，声音都一样了"
1838,"好可爱的李玉公公"
1838,"是不是听着头都大了"
1838,"哈哈哈哈，这太监生无可恋的表情太好玩了……"
1838,"朕提醒你们，二倍速是个好东西"
1838,"这样子找也真厉害，自己都快要睡着了"
1838,"坐等弟弟上线"
1839,"这个总管太监好可爱啊"
1839,"我媳妇是红衣服好吗"
1839,"听了这么多一样的话,公公咋还没晕过去"
1839,"找不到我吧啦啦没有办法我就是这么强大"
1839,"这么大的太阳，热不热？"
1839,"看你多大能耐"
1840,"两个合在一起做成撒尿牛丸不久行了笨蛋"
1840,"听得要睡着了啦啦啦我就是这么强大"
1840,"听声音识人，厉害了公公"
1840,"人事部问一下不就好了"
1840,"不是灵柏吗？怎么变成树了？"
1840,"听了这么多一样的话,公公咋还没晕过去"
1841,"璎珞绝对不会出来的他还以为皇上是要找他算账呢"
1841,"这不是周星驰的套路吗，哈哈哈"
1841,"这太监不是凤囚凰里吃猪食的王爷吗"
1841,"奴才不知道"
1841,"愿逆风如解意容易莫摧残"
1841,"哈哈哈，被我打败啦！"
1842,"还是蒋欣演年妃这类角色更合适"
1842,"没办法就是这么强大"
1842,"这个公公也是可爱的"
1842,"调监控查我啊啦啦啦"
1842,"这剧的年轻女演员好多"
1842,"总管一副生无可恋的样子"
1843,"哈哈哈哈哈找不到我吧！没有办法我就是这么强大"
1843,"像不像你们四级英语听力试着找出正确答案的时候"
1843,"这太监好辛苦"
1843,"真叫人头大"
1843,"太监不是都看到玲珑的脸了吗"
1843,"这个公公也是可爱的"
1844,"听了那么多肯定都耳朵晕了"
1844,"在回放这几个人"
1844,"就这么一个声音就能找找人这太监真是没事干呀"
1844,"一群惹是生非的女人"
1844,"听了这么多，不可能记得"
1844,"这太监好辛苦"
1845,"我咋听不出多大区别"
1845,"我怎么还没出场・_・?"
1845,"太监演的好可爱"
1845,"我觉得听多了，连本来是啥都想不起来"
1845,"怎么长得记不得声音记得了"
1845,"没有办法我就是这么强大，哈哈哈哈哈"
1846,"抓不到我吧我就是这么强大，啦啦啦啦啦"
1846,"人家是粉衣服，你是色盲啊"
1846,"听多了，后面就更加听不清"
1846,"找得到我算我输"
1846,"公公长的像熊大熊二[偷笑]"
1846,"哈哈笑死了"
1847,"一个穿粉衣服的宫女，愣是找一群绿衣服的宫女来问话！"
1847,"听得我都晕了"
1847,"听屁啊！问那个嬷嬷不就知道是瘦了吗？"
1847,"辛苦你了哈哈"
1847,"不想看她了！还是跳过好"
1847,"怎么好多个镜头我看了都想吐，晕车那种"
1848,"高贵妃是药神钢管舞谭卓演的这妆容实在是太不适合了"
1848,"人家穿的是粉衣服，为何公公要找绿衣服的呢"
1848,"好出戏啊？这咬唇妆画了，光盯着贵妃嘴唇看了"
1848,"这个贵妃家里不是不厉害吗"
1848,"这里面的一些人物真可爱"
1848,"一个穿粉衣服的宫女，愣是找一群绿衣服的宫女来问话！"
1849,"皇上和这个侍卫多可爱啊"
1849,"找不到我了大猪蹄子"
1849,"衣服都一个样，太监能记得声音不错了"
1849,"我什么时候出来呀。"
1849,"会不会又找了一个宫女替代魏璎珞当妃子"
1849,"特别是色盲吧。"
1850,"好可爱的太监"
1850,"本宫很清闲"
1850,"胡演问一下那个姑姑不就知道了"
1850,"你这是在找死"
1850,"找人先找嬷嬷啊"
1850,"会不会又找了一个宫女替代魏璎珞当妃子"
1851,"把高贵人拉出去斩了[发怒][发怒]"
1851,"抓不到我抓不到我哈哈哈"
1851,"这胖嘟嘟的小太监太可爱了。"
1851,"你怕不是个傻子"
1851,"还是蒋欣演的好对皇上尊敬加爱慕对皇后是有尺度的傲慢"
1851,"把依梅园的宫女给朕找来"
1852,"听了这么多，你就是刚开始记得，听完以后也该忘了"
1852,"人在家中坐，锅从天上背"
1852,"这公公是最强大脑听音辨人"
1852,"这贵妃哪集能领盒饭？赶紧走吧"
1852,"还在问为什么打3个耳环的真的看剧了吗。。。惊了"
1852,"不是今天的事情吗怎么成了那天的事情了"
1853,"白嘴唇病得不轻"
1853,"打小报告的都还挺吃香"
1853,"这玲珑也不是个好东西"
1853,"内天？不是今天吗。。"
1853,"这么大的太阳，你耶不耶。"
1853,"这里面的人好多都戴了美瞳"
1854,"姑姑挨打居然不立刻反击？还气定神闲坐在这里养伤"
1854,"听不出来吧，哈哈哈，我就是这么强大，啦啦啦，啦啦"
1854,"能在皇上身边的人，确实没有俗人，这听声辨认厉害"
1854,"给朕上个美女"
1854,"公公好呆萌"
1854,"我咋还没出来"
1855,"女人多的地方是非多"
1855,"这部剧的布景真是用了心的"
1855,"人家贵妃电影演技也是实力派，因为不出名被你们这么说"
1855,"我什么时候出来啊"
1855,"好可爱的公公"
1855,"这个高贵妃怎么感觉比皇上还厉害"
1856,"这姑姑演贵妃我可能还能看顺眼"
1856,"我什么时候出来，等不及见媳妇儿了"
1856,"公公好可爱"
1856,"这太监是色盲吗"
1856,"我觉得这个姑姑长得还行"
1856,"超喜欢她的性格"
1857,"我看方姑姑演贵妃比较合适，眼里出戏"
1857,"本宫才是最厉害的，把方姑姑斩了"
1857,"为什么戴这么多耳环"
1857,"小人太多了"
1857,"既有色盲也有脸盲的公公"
1857,"这姑姑演贵妃我可能还能看顺眼"
1858,"为什么要带这么多耳环第一集就解释了好吗"
1858,"我觉得太监超可爱"
1858,"太监演的好"
1858,"好前卫三个耳洞"
1858,"坏人怎么那么多"
1858,"我看过一本小说令妃传"
1859,"这太监好可爱啊哈哈哈"
1859,"玲珑管好自己就行了"
1859,"穿帮了吧。不是这个宫女告的密"
1859,"这姑姑是不是要领便当了"
1859,"方姑姑长得有点像李宣美"
1859,"听多了就听不出了"
1860,"说看不懂的认真看剧情行吧？"
1860,"其实这方姑姑颜值挺高"
1860,"比比比,比什么比,一个人演了贵妃别人就不能演贵妃了"
1860,"朕就是这么强大"
1860,"总感觉后面两个耳环是夹在耳朵上的"
1860,"方姑姑就是芈月传里刘涛的姑姑"
1861,"说打三个耳洞的知不知道这个世界上有个叫耳夹的东西"
1861,"哈哈.大猪蹄子.来玩躲猫猫"
1861,"开始还以为玲珑是好的"
1861,"这种打小报告的活不过几集"
1861,"嫉妒心真强"
1861,"感觉1.5倍才算是正常速度"
1862,"方姑姑好眼熟"
1862,"玲珑和锦绣怎么还不死啊"
1862,"这是玲珑好吗"
1862,"心疼那太监"
1862,"这些演员都打了3个耳洞吗？真敬业啊"
1862,"我咋还没出来"
1863,"没正经籍贯能进宫？说改名字的是制杖吗？"
1863,"有一种东西叫耳夹，根本不用打耳洞"
1863,"发现清剧太监都很给力"
1863,"是红衣服的啊"
1863,"语文字不是杨幂演的吗"
1863,"看衣服不就知道去哪找了"
1864,"很多人是没有从头看吗，很多问题前边都有好吧"
1864,"我劝自己善良"
1864,"拜托不是咬唇妆是清朝本来就这样好么"
1864,"这个姑姑的眼妆不错啊"
1864,"这姑姑你们不觉得很眼熟嘛"
1864,"富贵使我们相遇"
1865,"方姑姑脸长两米八"
1865,"都给朕跪下"
1865,"除了吉祥全都是坏人"
1865,"这太监最强大脑，听一遍就能判断出来。"
1865,"这姑姑是不是芈月传里大王的妃子啊？"
1865,"这太监太有抢镜天赋了"
1866,"我怎么分不清这个和玲珑呢"
1866,"方姑姑，脸有点长啊！"
1866,"这姑姑不跟贵妃身边的丫鬟是一个人么"
1866,"玲珑什么时候领盒饭"
1866,"神树說:怕了怕了"
1866,"方姑姑脸长两米八"
1867,"这剧里就没有姑姑进行处罚的，顶多就是告发和验证"
1867,"锦绣我劝你善良"
1867,"玲珑能活几集"
1867,"太监是“楚乔传”里燕洵身边的阿精"
1867,"这姑姑颜值很高啊"
1867,"你想领盒饭了吗"
1868,"打过针的脸真真是扎眼得很"
1868,"小人太多一个个斩"
1868,"你们是没有仔细看剧吗，满洲国都是带几个耳环"
1868,"我怎么还不登场"
1868,"这公公确实挺可爱"
1868,"怎么？想吃盒饭吗？"
1869,"导演:玲珑，吉祥领盒饭去吧！"
1869,"听说我死了你们很开心"
1869,"说打六个耳洞的去看看文化常识清朝的时候就是这样子的"
1869,"大家不要笑，她只是在追星"
1869,"这个玲珑活了几集啊？"
1869,"这个丫鬟咋这坏呢？！"
1870,"魏樱洛是天蝎座的吧必须要报仇报复心这么强"
1870,"话太多，拖出去斩了"
1870,"这玲珑真会巴结啊嘴巴也大"
1870,"方姑姑时好时坏"
1870,"这个玲珑的额头填充得都可以演雷震子了"
1870,"玲珑活不过两集了"
1871,"最鬼的就是这种人，表面好相处"
1871,"我劝你们善良"
1871,"好多剧都有叫玲珑的"
1871,"玷污玲珑这么巧的名字了"
1871,"现在宫斗剧都流行进宫给姐姐报仇了吗"
1871,"不是灵树吗"
1872,"盒饭都热好了，你们排好队，一个个来领"
1872,"呦呦呦…结盟了"
1872,"除了璎珞和吉祥，没几个丫鬟是好的"
1872,"于正剧里打酱油的都叫玲珑啊百合的"
1872,"改名是勒令被改的好吗"
1872,"玲珑的美瞳好出戏啊"
1873,"演员长得都挺有特点的"
1873,"玲珑和这个姑姑啥时候领盒饭"
1873,"大晚上的有鬼"
1873,"玲珑，我劝你善良"
1873,"有种东西叫耳夹兄弟们"
1873,"好像没我事啊"
1874,"说抄宫心计的违心不，宫心计播的时候早拍完了好吧"
1874,"为何这些进宫的宫女长的都一样"
1874,"璎珞穿的是红的，那些穿的是绿的"
1874,"你再得瑟几集"
1874,"还找个玲珑好眼熟啊"
1874,"我感觉贵妃好可爱"
1875,"玲珑长得像刘雨欣"
1875,"为什么那么多人说我可爱，嘻嘻"
1875,"玲珑长的像吴昕"
1875,"脸盲症犯了"
1875,"方姑姑也比贵妃演的好"
1875,"你再得瑟几集"
1876,"这个人个子好大，跟个妇年的似的"
1876,"我以后会变坏"
1876,"爱是一道光，绿到你发慌"
1876,"这个姑姑长得像蔡少芬"
1876,"脑袋大的是玲珑"
1876,"这个姑姑演贵妃也不错啊"
1877,"看着这玲珑好眼熟，我还以为是刘雨欣呢，原来不是"
1877,"追剧也要看“妆”看“造型”，妆容得体，尊重历史"
1877,"你们俩人的盒饭备好了"
1877,"这姑姑虽然坏，但是长的还不错"
1877,"说打耳洞的，其实还有一个东西叫耳夹。"
1877,"这个糟老娘子坏的很"
1878,"过去的人名字都好听，玲珑，吉祥又如意的"
1878,"哈哈哈哈哈打不过我吧我就是这么强大追不上我吧啦啦啦"
1878,"如果不是璎珞，玲珑就活不过一集"
1878,"都是大猪蹄子"
1878,"方姑姑真容易被人左右"
1878,"看着这玲珑好眼熟，我还以为是刘雨欣呢，原来不是"
1879,"这个去找的人都是神似明星的人"
1879,"玲珑我劝你善良"
1879,"玲珑鼻子好大"
1879,"我这那么还不出来"
1879,"感觉方姑姑演贵妃会很合适"
1879,"过去的人名字都好听，玲珑，吉祥又如意的"
1880,"历史上高贵妃是个绝妙的人儿这个演的就是个路人脸"
1880,"你再得瑟得瑟，就有盒饭吃了，激不激动，兴不兴奋？"
1880,"改个名字进宫多好"
1880,"怎么动我女人朕弄死你"
1880,"贵妃说话也太慢了吧，看着好难受，这人设太浮夸了吧"
1880,"是盗墓笔记里面的的爱妃吗"
1881,"姑姑这个角度挺美的，至少比贵妃美"
1881,"我就觉得她好眼熟原来是宇文紫哈哈哈哈哈哈哈哈"
1881,"感觉这个姑姑脸型眼睛感觉有点像蔡少芬"
1881,"衣服上挂的东西是代表身份的吗？"
1881,"佛莲的声音听起来一肚子气"
1881,"玲珑是个耍阴招的"
1882,"刚才你说发什么好呢现在就变成坏人了"
1882,"玲珑，你是不是想去领盒饭了？"
1882,"拜托以前的唇妆就是这样的好吗"
1882,"公公太可爱啦"
1882,"于正的剧真的是东拼西凑，如果没秦岚佘诗曼真不会看"
1882,"玲珑是个耍阴招的"
1883,"主角光环强大，打了姑姑都没被罚。阔以阔以"
1883,"为什么我没有公主嫁到戏份多"
1883,"这个姑姑也比高贵妃长的美"
1883,"从香港赶来就那么点戏份"
1883,"我觉得这个方姑姑合适去演高贵妃啊"
1883,"玲珑你好坏"
1884,"听多了还能记得原声吗"
1884,"发际线都好高"
1884,"姑姑气场太强悍了"
1884,"这个玲珑是演扶摇变脸后的那个人"
1884,"多嘴的丫头活不过两集"
1884,"方姑姑的颜值可以当妃子了"
1885,"戴这么多耳环好像是说是满族的规矩第一集有说"
1885,"哈哈哈嗝找不到我"
1885,"这里泼妇太多了，看多了影响心情"
1885,"我一个小丫头，你们为了我这么大动干戈，真是惭愧了！"
1885,"姑姑长得超像徐子珊有木有！！"
1885,"长得像我表妹啊"
1886,"愉妃生了五阿哥啊，永琪啊，又遇见了小燕子啊，哈哈"
1886,"什么时候出场啊"
1886,"玲珑面部填充做的太夸张了"
1886,"我怎么还不出来"
1886,"玲珑和冰清是一个人吗"
1886,"别得瑟了！"
1887,"请不起那么多大牌"
1887,"主角光环，懂不懂"
1887,"方姑姑长得像于朦胧"
1887,"我什么时候出来"
1887,"玲珑是不是和扶摇上的宇文紫是一个人扮演的？"
1887,"我啥时候出场"
1888,"每部宫斗剧里都一定有一个叫玲珑璎珞琉璃玲琅的"
1888,"我什么时候出来"
1888,"姑姑长得很有气质"
1888,"这姑姑真坏"
1888,"刚还是冰清，怎么现在又是玲珑了"
1888,"这衣服上干嘛非要带标签呢？看不懂"
1889,"进坑多好，这名字好"
1889,"这个姑姑是香蜜里面的鲜花神吗"
1889,"哇，好了这个姑姑以后会是泄密者[再见]"
1889,"玲珑还有除了吉祥璎珞的那个人，这两个傻傻分不清"
1889,"贵妃像秦俊杰好吗"
1889,"我打起来连我自己都害怕"
1890,"一个姑姑想治一个宫女还不简单"
1890,"我好可爱来抓我啊"
1890,"好像这部剧的颜值都不高"
1890,"本宫最可爱。"
1890,"耳洞是认真的吗"
1890,"呵呵，活～该！"
1891,"没有一个玲珑是好人，没好报"
1891,"你一个姑姑你居然还用威胁宫女😂威严呢"
1891,"这都是演员的原声，没有配音"
1891,"为了拍这个剧还都打了三个耳洞呢"
1891,"拍个电视先要打耳洞！"
1891,"高贵妃眼神里都是戏"
1892,"玲珑的脸看着好难受"
1892,"玲珑我劝你善良"
1892,"这明显是耳洞好吧"
1892,"吉祥是肉肉吗"
1892,"这是后宫戏吗？这就是于正以前的深宫计？"
1892,"宫女也想攀高枝"
1893,"追剧也要看“妆”看“造型”，妆容得体，尊重历史"
1893,"似乎没我什么事"
1893,"方姑姑顔值高，应演主角？"
1893,"几个凑娘们这么多事"
1893,"姑姑长得一般"
1893,"宫女也想攀高枝"
1894,"玲珑锦绣分不清"
1894,"我什么时候出场"
1894,"话说这部具的演员没一个看着顺眼的"
1894,"说实话，这剧贵妃不像贵妃，皇后不像皇后，练嬷嬷都…"
1894,"这贵妃看着出戏"
1894,"贵妇口红没涂匀吗"
1895,"方姑姑长得像曲婉婷"
1895,"劳资就是那么牛掰"
1895,"姑姑演技好"
1895,"我喜欢尔晴，不知道为啥，演技太赞"
1895,"说是朱七七的是真脸盲啊"
1895,"这贵妃看着出戏"
1896,"因为贵妃长得像程七七那就肯定有人会说长得像紫宁了"
1896,"贵妃我很快就领盒饭了"
1896,"闲飞很闲啊，没看到啊"
1896,"我怎么还不出来"
1896,"妆特点不明显，好多人记不住"
1896,"可是魔仙堡的玲珑是个好的呀😂"
1897,"不知道有些人对颜值判定是怎样的,或者你长得多美？"
1897,"玲珑，你给我等着"
1897,"魏璎珞长得好像男版陈晓"
1897,"玲珑冰清分不清"
1897,"感觉姑姑演的很好"
1897,"还有好多句都有叫吉祥的"
1898,"这姑姑演高贵飞更合适"
1898,"姑姑我再忍你几集"
1898,"锦绣玲珑是双胞胎吗"
1898,"你们都退下"
1898,"没想到后宫里个个都那么精致哈哈哈"
1898,"这还说什么你若不答应？她不是姑姑宫女都得听她的么"
1899,"姑姑这打扮比贵妃强的不是一星半点呀"
1899,"呵一个能打的都没有"
1899,"我看宫女脸都一样，分不清"
1899,"都这么有心机的吗"
1899,"姑姑这句话说得像是大家比怕她还怕璎珞"
1899,"抓不到我吧，没办法。。。我就是这么强大。。。。"
1900,"姑姑居然用璎珞来威胁玲珑，太可爱了"
1900,"这集我怎么没出现"
1900,"为这部剧还得去多穿俩耳洞"
1900,"玲珑感觉去领盒饭吧"
1900,"妆容看起来很舒服"
1900,"大老爷们看的多吗"
