time,content
721,"德玛西亚本宫要二阶黑化了"
722,"皇上的龙还可以啊，没你们说的捏么可爱吧"
722,"太后我劝你善良"
722,"大猪蹄子只会伤害自己的皇后"
722,"皇后，真劝你善良"
722,"为啥叫大猪蹄子不明白"
722,"顺嫔出来明玉就快死了"
723,"大猪蹄子你果然是大猪蹄子"
723,"我饿了，盒饭热好了吗？"
723,"特想皇后是主角，这么好的贤内助看不到，唉"
723,"为什么叫朕大猪蹄子"
723,"没有公平的天真的公平"
723,"我已经无父无母无兄，我怕什么"
724,"大猪蹄子只会说皇后病了……之前也是"
724,"不是每个人都能像我一样什么话都敢说还没事儿的"
724,"为什么不把纯贵妃说出来，让她杖毙"
724,"还是本宫最善良"
724,"太后活得还久呢"
724,"我劝我自己善良"
725,"确定放正常不是特地加慢了吗。。。。"
725,"现在想想本可爱在世的时候真是太善良了"
725,"皇后可惜不是个男人啊，她是唯一跟璎珞一样有见识的人"
725,"卫龙大旗扛起"
725,"先皇后好善良"
725,"我这么帅，你们竟然只看龙"
726,"皇后你最阴毒！怎么说的说这么义正言辞的话！"
726,"你可是够了吧，热好自己的盒饭"
726,"历史上嬛嬛活了八十多呢"
726,"在知道本宫不容易了吧"
726,"肖夺大猪蹄子看到这了么"
726,"李玉最可爱"
727,"衣服上是弄，正经不正经我就不知道了"
727,"大猪蹄子还不来宠幸我"
727,"皇后贤妃都是好人，却没有好下场"
727,"难忍你都是大猪蹄子"
727,"佘诗曼演技好棒，配音出戏"
727,"原来只有我最天真"
728,"还是没有亲戚的好，不用诛九族也不总操心"
728,"朕的龙不是一般的可爱"
728,"这会觉得皇后越恨越好，整死魏让皇上难受死才好"
728,"娴皇后黑化我都能理解了"
728,"又说了一遍的世事不尽如人意台词亮了"
728,"本宫这一笑，你们有好下场了"
729,"期待皇后的复仇，太后的盒饭热好等着"
729,"大猪蹄子快来陪我过节"
729,"说闲妃好人没好报的在搞笑？"
729,"大猪蹄子，还是本宫好吧！"
729,"大猪蹄子果然是猪"
729,"那为什么还珠格格的时候皇后和太后这么好?"
730,"娴妃受的打击太大了"
730,"你们都是大猪蹄子，老娘要报仇"
730,"娴妃演技太好了"
730,"李玉好实诚"
730,"这个皇后长得真奇怪"
730,"能当上皇后说明是很有光环的，只是这部剧的主角不是她"
731,"皇后现在要求公平了他害人的时候就不谈公平"
731,"从什么时候起说实话会被当成说疯话呢"
731,"我觉得娴妃没错被逼到一定程度也会变的凌厉保护自己"
731,"本宫好腻害，挑拨离间棒棒哒👍大猪蹄子你等着"
731,"扛起我卫龙大旗"
731,"还是高贵妃单纯"
732,"好厉害的样子"
732,"好讽刺啊现实也是这样。"
732,"大猪蹄子是什么梗"
732,"李总管腰上挂那些重不重啊"
732,"薛小康你个大猪蹄子哈哈哈😄"
732,"如果有个封号是妖妃的皇上宠不宠😏"
733,"朕的脑阔疼脑阔疼"
733,"本宫就是这么耿直"
733,"疯的是天下人就要说清醒的人疯了"
733,"李玉，你想好了再说"
733,"...娴皇后没有做什么害人的事吧"
733,"好讽刺啊现实也是这样。"
734,"疯的人说清醒的人疯了"
734,"明显昏君，是非不分，都是私心，保自己地位"
734,"这太医也是耿直"
734,"这个太医太耿直了"
734,"太医演得好"
734,"是肯定的你到家诶就是你"
735,"我觉得娴妃挺好啊跟魏姐一样都是为了报仇但没主角光环"
735,"让朕瞧一瞧谁还敢叫朕大猪蹄子"
735,"李玉演技实在太好了。皇后的大宫女演技也是都实力派"
735,"你们还记得我高可爱吗"
735,"顺妃你啥时候出来"
735,"这个太医太耿直了"
736,"闲妃，说好话，做好事，存好心，别忘了你的经典语录"
736,"李玉的肚子很出戏"
736,"太医太实诚"
736,"我什么时候才可以领饭盒"
736,"如果是这样，太后被坑了也不冤！都不干净！"
736,"我觉得娴妃挺好啊跟魏姐一样都是为了报仇但没主角光环"
737,"闲妃黑化是有理由的"
737,"精神上有问题把脉也能测出来？身体又没病"
737,"佘诗曼演技真好，就爱看她"
737,"这太医耿直的可爱"
737,"皇后这个笑演得太好了"
737,"黑化已经满足不了我了，爹要开始妖化了"
738,"公公好可爱"
738,"还是本宫好"
738,"又要开始新一波的黑化冲击波了"
738,"一个皇后所有儿子都保不住，一个皇后所有家人都保不住"
738,"如果杀太后是不是太刻意"
738,"龙袍演的好😂"
739,"纵使情深似海，也不能事事尽如自己的心意，"
739,"那个笑好瘆人"
739,"娴妃只可惜没有一个好的爸妈，如果有像高贵妃一样的爸"
739,"我怕是药丸"
739,"今天朋友圈夸尔晴可爱…结果炸了锅。"
739,"大家有什么冲着我尔晴来𓀙"
740,"太医也是够实诚的。"
740,"我饿了，盒饭热好了吗"
740,"皇上确实对不起两个皇后，大猪蹄子"
740,"来陪我过七夕吧，朕封你做皇后"
740,"这太医也是耿直大叔没错了"
740,"还是本宫好吧！"
741,"大兄弟你当这么多太医还不懂吗"
741,"都没有我可爱我最可爱"
741,"说皇后好的怎么不想想富察皇后是怎么死的？"
741,"劝你善良，还有两集你就领盒饭了"
741,"公公就你懂戏真多"
741,"我就是大猪蹄"
742,"小玉，我劝你善良、真实、坦诚点"
742,"好人没好报坏人活千年，我不黑化都对不起自己"
742,"这个龙真的太可爱的，笑的一点都不庄严"
742,"你们一家坏事做尽，会遭报应的"
742,"一入皇宫深似海"
742,"打麻将一缺三，谁先来占位置"
743,"张院判真可爱"
743,"还是我媳妇单纯"
743,"现在这个世道不都是一样么说实话都是疯子"
743,"胖虎来领盒饭"
743,"皇后太清醒"
743,"这个继后，也跟本宫一起来领盒饭吧"
744,"佘诗曼演的好，说的好，她不黑化，谁黑化"
744,"好想听佘的原声，好听好听"
744,"贤妃真的太委屈了，坏事没做过，确要遭受这么多灾难"
744,"李公公好可爱"
744,"娴妃这段重复看了几次，演得真太好了，跟着掉眼泪，唉"
744,"胖虎来领盒饭"
745,"太医眨巴眨巴眼睛，有点可爱"
745,"想富察皇后，想我家高高"
745,"皇后没工作动力了"
745,"大猪蹄子都忘了我了吧"
745,"好像是过情人节去了"
745,"佘诗曼演的好，说的好，她不黑化，谁黑化"
746,"现在看的忠实的观众朋友们"
746,"小李子深得朕心。"
746,"这太医长得和皇上衣服上的龙一样😄"
746,"是时候点一盏灯了"
746,"皇后娘娘好棒哦，好喜欢"
746,"太医眨巴眨巴眼睛，有点可爱"
747,"太医也不容易，天天给没病的人看病"
747,"快快陪我一起吃盒饭"
747,"大猪蹄子什么梗"
747,"我来帅一下"
747,"这太医这么不懂事能活到现在？"
747,"是时候该本宫出场了"
748,"太医长得好像卡通人物好可爱哈哈"
748,"慢慢来不急不急"
748,"感觉这个太医好可爱"
748,"我不管我最可爱"
748,"愿天下有情人都是失散多年的亲兄妹"
748,"不来看的都去领盒饭了吗"
749,"不管余诗曼长得怎样，演技是真的好，那些看长相的走开"
749,"赶紧的，本宫想领盒饭好伐"
749,"这太医厉害了，记得当时他帮高贵妃，现在竟还活好好的"
749,"没有节操的太医们"
749,"哈哈哈好可爱"
749,"我还以为他会跳下去呢。"
750,"虽然不是很喜欢佘诗曼但是演德好"
750,"太医好可爱"
750,"太医好可爱"
750,"本宫没病！你个大猪蹄子"
750,"爱是一道光，绿到你发慌。"
750,"皇上说本宫病了，本宫就是病了。"
751,"有一种病是皇上说你病你就病。"
751,"古代人就是如此现状。我说你疯了你就是疯了。"
751,"太医好可爱(/ω＼)害羞"
751,"以下犯上？本宫不是天天做嘛"
751,"皇后娘娘会不会被治死"
751,"爱是一道光，绿到你发慌。"
752,"皇后真是个厉害并且正直的人最后没死算是公平了"
752,"没病也得治出病来"
752,"这个太医和皇上衣服上可爱的龙龙长的好像啊！"
752,"本宫清醒着呢"
752,"一开始最善良的就是娴妃，不希望她死，希望她出宫"
752,"有一种病是皇上说你病你就病。"
753,"可能更新太早人没到齐"
753,"只有我可以这么跟皇上说话！娴妃你是不是想吃盒饭了？"
753,"你真聪明都过情人节去啦"
753,"拂尘演的好"
753,"佘的演技真好"
753,"一个皇后保不住自己的孩子，一个皇后保不住自己的亲人"
754,"多少天没合眼还能活真优秀"
754,"皇上绿了我，自己被和亲王绿了，是这样吗"
754,"李玉是有文化的人呐，娘娘说的话都能听懂"
754,"演技好的都能留到最后"
754,"皇上家人是人别人家人都是牲口说杀就杀"
754,"坏事干多了吧"
755,"太医好可爱蛤蛤蛤哈"
755,"感觉内个太医好可爱"
755,"一入延禧深似海从此扶摇是路人"
755,"怎么感觉头顶一抹绿"
755,"太医也是耿直"
755,"你们是不是忘了本宫的善良"
756,"璎珞能为姐报仇皇后就不能替父报仇？做人不能太双标"
756,"总有大猪蹄子偷偷惦记朕的女人"
756,"是你们这帮奴才看不清世道，自欺欺人罢了"
756,"大猪蹄子，你才疯了！"
756,"看不懂了……魏不是为了报仇么，如果仇报了就出宫了才"
756,"我都不知道什么是七夕"
757,"太医年轻时肯定很帅"
757,"本可爱最单纯"
757,"林激动去过情人节都不追剧了"
757,"太医啊，一把岁数了还没过明白吗"
757,"太医演的好"
757,"我下集就要下线了，兴奋"
758,"我反手就是一个大猪蹄子扔桃子"
758,"和本宫情侣装哎"
758,"每个人都是好的只不过都是为了自己的利益不得已"
758,"只有我这个单身狗在这看吗"
758,"人呢快出来呀"
758,"猪锦甜不理我？？本宫很生气"
759,"和亲王要模样没模样要身材没身材要气质没气质"
759,"太后什么时候领盒饭"
759,"太医爷爷好可爱啊"
759,"快点回来看哦"
759,"好人得不到好下场"
759,"和亲王，我劝你别和我作对"
760,"小太监说话好可爱哦"
760,"本宫盒饭吃完了，啥时还能露个面呀"
760,"王爷也有正经的时候"
760,"李玉啊李玉。你是个活宝儿啊"
760,"没想到太后会是这种不顾别人死活的人"
760,"喜欢个老女人不怕被我打吗"
761,"麻将牙大僵尸脸，本宫劝你善良"
761,"你喜欢森林，我绿过你"
761,"这个小太监好可爱呀"
761,"还是本宫好"
761,"想高可爱了"
761,"果真机智啊"
762,"这招高没病就吃出病来"
762,"香妃会出现吗"
762,"白在宫里干这么久了"
762,"有谁记得本宫的全名叫什么"
762,"爱是一道光，绿到你发亮"
762,"我没病我没病"
763,"这个小太监好可爱"
763,"又要多点一盏灯了"
763,"龙龇牙笑得好皮"
763,"本宫要和王爷一起黑化了。"
763,"皇后演技绝对棒棒棒"
763,"皇后也是一个可怜人啊"
764,"太医的表情好可爱呀"
764,"她也是家人一次次受到伤害才黑化情有可原的"
764,"阿佘40多了，不错了有这个容颜"
764,"本宫黑化的理所应当"
764,"这个剧的小太监怎么都把手缩到袖子里有气无力的"
764,"又要多点一盏灯了"
765,"这部戏里没有绝对的好人，也没有绝对的坏人"
765,"这货是不是要给朕戴绿帽子"
765,"突破觉得王爷和皇后才是最最清醒的人"
765,"今天都去过七夕了吗"
765,"王爷也是个不错的人啊"
765,"为啥没我什么事"
766,"李玉你是优秀毕业生"
766,"好可爱的小太监"
766,"这个太医表情亮了"
766,"先皇后去的第？天，想她。"
766,"你家七夕成洋节了？搞笑来的吧你"
766,"朕也无奈啊"
767,"寰寰没有兄弟的好吗，只有妹妹"
767,"本宫先霍霍了你兄弟，就问大猪蹄子你怕不怕"
767,"他远看长得好像被烧伤的人啊"
767,"说得好像你多好一个人一样"
767,"今天宾馆生意好，都没来追剧"
767,"大假牙我劝你善良"
768,"王爷长得像忍者神龟"
768,"太后你怕是要领盒饭了"
768,"古时候要自立自强，才是王道"
768,"黑化后的娴妃"
768,"你不也是吗你娘为了你能活命不惜杀别人一路货色"
768,"朕也是无奈啊"
769,"是说王爷这门眼熟你们有人在非常完美节目看过他吗"
769,"你以前不是一样嘛，犯了这么多罪，都被人抵了"
769,"我觉得弘昼也是一个可以挖掘的角色"
769,"朕就是大猪蹄子"
769,"装什么你不也是皇亲国戚只不过这次斗着你心上人了"
769,"你以为太后这么好当能当上太后的会是心慈手软之人么"
770,"这个王爷要是早点明白事理多好啊"
770,"大猪蹄子，还不来看我"
770,"这个宫门好眼熟"
770,"这个太医好可爱啊😊"
770,"想看两个皇后斗，精彩"
770,"尔晴我劝你善良"
771,"大假牙部分直接跳过"
771,"为什么叫我大猪蹄子求懂"
771,"不会是药把皇后弄疯了把"
771,"把和亲王拉出去斩了省的以后欺负璎珞"
771,"太医真可爱"
771,"谁让人家是太后"
772,"这个王爷还挺正直啊不错不错"
772,"这个门的出镜率挺高的"
772,"娴妃是剧里黑化唯一让人恨不起来的"
772,"情人节大家都很准时嘛"
772,"皇后演的真好，真犀利！"
772,"你们都欺负本宫本宫怎么不黑化"
773,"都是到自己摊上事了反而求个公道，魏缨宁那事可潇洒了"
773,"牙牙专情的样子真可爱"
773,"被精神病的最早版本？"
773,"大猪蹄子好久没来看我了"
773,"所以说好人没好报啊，先皇后也是"
773,"大猪蹄子是什么"
774,"这王爷的大板牙真出戏"
774,"哎吆你之前害我这一次算你有良心"
774,"你也不是个好玩意，装什么个装"
774,"还不出来呀我"
774,"皇后我就不劝你善良了"
774,"大白牙你快下线吧。。看你都烦。。。"
775,"快快快，来一波红"
775,"全明昆是个大猪蹄子"
775,"愉贵人和裕太妃长的好像，是一个人吗？"
775,"本宫怎么还没出来，还想着和黄桑共度七夕呢"
775,"太后就可以乱杀无辜？要是杀的是璎珞的爸恐怕就不这样"
775,"大家怎么没去约会，还来追本宫的剧"
776,"陶瓷牙，你的盒饭已热好"
776,"爱是一道光绿到我发慌"
776,"林正英能不能把这只僵尸弄走林正英能不能把这只僵尸弄"
776,"为何都叫我大猪蹄子"
776,"明天看就多人了"
776,"后宫那个女人没被我绿"
777,"王爷的衣服太大了"
777,"烤瓷牙那个厉害了"
777,"最近这两集好水啊"
777,"单身狗来追剧了"
777,"怎么这么多集"
777,"本宫憋屈啊"
778,"个人觉得皇后黑化的好"
778,"本宫啥时出场等到花儿都谢了"
778,"乾隆对他蛮好的，为了个女人。哎"
778,"皇后被精神病了"
778,"七夕除了追剧无事可干啊"
778,"还没出现，不能和皇上过七夕了"
779,"艳如玉：有认识的朋友在看吗"
779,"自己活着有什么意思，当然找点事做，有冤报冤有仇报仇"
779,"亲侄子怕是太后的亲儿子"
779,"看不过去这么好的人会死"
779,"个人觉得皇后黑化的好"
779,"皇后被精神病了"
780,"哎，好一出繁华盛世"
780,"高子阳在看吗"
780,"这事搁到谁身上，谁都得黑化，不可能坦然接受"
780,"怎么还不放我出来"
780,"越看越像僵尸，这大龅牙"
780,"和亲王长得像杜淳"
781,"这深宫里为了自保有那个是善良的"
781,"是不是觉得这一幕很眼熟，姐姐"
781,"王爷的耳洞演得好"
781,"突然觉得着小伙子还算不错"
781,"谢昊辰大猪蹄子"
781,"这集满满都是戏"
782,"皇后的儿子就是她攒动纯妃才起杀心的好吗"
782,"嬛嬛我劝你善良"
782,"和亲王的烤瓷牙演得好"
782,"朕的头上闪耀着绿光"
782,"江欣益大猪蹄子"
782,"皇后也真的是不容易啊"
783,"满屏都是和亲王的大鼻孔眼子"
783,"爱是一道光绿道我发慌"
783,"这个和亲王长得像僵尸"
783,"红你大爷的批"
783,"宫里没一个好东西"
783,"本宫什么时候出来啊"
784,"大猪蹄子大猪蹄子大猪蹄子"
784,"怎么就我一个人喜欢贤妃皇后吗……"
784,"要是皇后做主角，你们估计就不会劝人家善良了。"
784,"导演我何时出场啊"
784,"和亲王穿的好厚"
784,"怎么我还不上场"
785,"大猪蹄子绿的发光"
785,"自己阿玛为朝廷尽心尽力，结果却被杀了"
785,"和亲王的大龅牙"
785,"我就是疯了"
785,"是不有人觉得今晚请点弄自己未来的媳妇"
785,"想知道和亲王什么时候领盒饭"
786,"这部戏的丫鬟太监都好可爱"
786,"是我太美戏都剪了吗？"
786,"最近剧里黑化的人都有苦衷都让人恨不起来除了喜塔腊氏"
786,"为什么和亲王这么帮着本宫"
786,"珍儿头上的多肉好出戏"
786,"没想到，我走后，宫中还是一样争执"
787,"被你们说大猪蹄子说的都想吃猪蹄了这大半夜的"
787,"美十八有在看吗"
787,"绿到牙都大了一圈"
787,"本宫黑化的有理"
787,"这个门演的好"
787,"要想翻案只得演一出琅琊榜了"
788,"这部剧脱的开始有点长了"
788,"啊卡卡卡卡卡卡啦啦啦咔咔咔考送送送么么么"
788,"突然觉得娴妃是个可怜人啊。。。。黑化得好"
788,"娴妃和纯妃的丫鬟感觉长得一样"
788,"王爷什么时候这么正直"
788,"为什么要叫大猪蹄子啊？"
789,"大猪蹄子的龙特别可爱"
789,"高可爱走的第N天，想她，想她"
789,"珍儿眼睛好可爱"
789,"马上就要领盒饭了好开心"
789,"继后自己先装清高，出了事又怪别人，"
789,"和亲王跳街舞的时候可帅了"
790,"同情皇后支持皇后佘诗曼演的太好了黑化也喜欢"
790,"哼，大猪蹄子。"
790,"这个门用处很大啊，很多相遇场景都有它啊！"
790,"又开始套路了大龅牙了"
790,"标题的申冤是认真的吗？"
790,"双击屏幕有惊喜"
791,"大猪蹄子的妃嫔都被人惦记着"
791,"容嬷嬷很可爱嘛"
791,"我说这人怎么这么面熟呢原来是邱家武"
791,"还是我比较温柔"
791,"李伟你个大猪蹄子"
791,"珍儿替本宫领盒饭吗？"
792,"好可爱的龙。好可以爱得太医。像及了"
792,"人都是被逼出来的"
792,"皇后都没有好下场"
792,"本宫复仇就叫黑化吗？"
792,"2倍是个好东西"
792,"李伟你个大猪蹄子"
793,"心疼皇后娘娘啊，不容易啊不容易"
793,"本宫要当梅长苏，本宫要翻案"
793,"情人节多没味，还是追剧好。。"
793,"本宫盒饭吃完了，能回来吗"
793,"好像一个大光头"
793,"郑无做的没错"
794,"要是皇后是主角，你们就不会劝她善良了"
794,"这个牙好厉害"
794,"珍儿不会是太后的人吧"
794,"珍儿，你的妆可真艳呀"
794,"太监的帽子可真遮太阳"
794,"就你口红最红"
795,"珍儿我看你眼熟"
795,"珍儿的妆是不是又浓了"
795,"和亲王也快了"
795,"本宫是香妃改编的"
795,"肯定是皇后杀了自己亲爹"
795,"怎么还没到本宫出场"
796,"珍儿好可爱好可爱好可爱"
796,"不大猪蹄子的妃嫔要反了"
796,"准时追剧的单身狗些好"
796,"呜呜呜那不是多肉那是绒花啊"
796,"珍儿演技不错！"
796,"我怎么还没领盒饭"
797,"看到58集才分清楚继皇后的丫鬟和纯妃丫鬟的脸。"
797,"看剧的不仅有单身的还有被禁足在家的"
797,"这王爷什么时候领盒饭"
797,"于正你是忘了我吗？"
797,"珍儿不会就是容嬷嬷吧"
797,"皇后真的是可怜人呐"
798,"七夕有啥好过的‘还是追剧来的实在"
798,"和亲王你管的有些多"
798,"张院判好可爱啊"
798,"假牙我劝你善良:("
798,"真可笑顶撞皇上就是病了呵呵呵"
798,"这两货的情侣烤瓷牙在哪弄的"
799,"这个珍儿长得挺嫩的"
799,"本宫要出山废人了"
799,"珍儿颜值还是高啊"
799,"看剧的都是单身狗"
799,"全剧最红的口红"
799,"丫头穿的有点花啊"
800,"珍儿，长得最标志"
800,"容么么，你太年轻了"
800,"这个珍儿满脸脂肪填充过度，一辈子红不起来"
800,"谁来陪本宫玩玩啊"
800,"皇上头上一片绿啊"
800,"珍儿是容嬷嬷吧"
801,"总觉得珍儿看着很眼熟，在哪部电视里看到过"
801,"我怎么这么久没出场"
801,"头上是多肉"
801,"现在追剧的都是单身狗或者已婚人士了……没错吧"
801,"这个眼角开得大哟"
801,"你们这些人都不去过七夕吗"
802,"珍儿和嘉嫔长得一模一样是一个医生做的吗"
802,"追剧大军都去过七夕了"
802,"追剧比过情人节有意义多了"
802,"宝宝有情绪了"
802,"继皇后我劝你不要善良了"
802,"想没想本宫"
803,"嬛嬛才是最厉害的"
803,"和亲王长得一副贼眉鼠眼的样子"
803,"现在这个唇妆自然多了"
803,"我不单身也在看剧啊"
803,"珍儿也是玻尿酸脸吧"
803,"你发什么光啊天呐"
804,"旁边那么宽的路不走非得让人家让"
804,"看到和亲王的耳洞了。。"
804,"珍儿演技也是好的"
804,"珍儿你电话歪啦"
804,"那么宽你不走，非要别人让"
804,"来来来应援色走一波"
805,"大龅牙我劝你善良"
805,"本皇后要去看看那个大猪蹄子"
805,"这么宽的路还需要让吗"
805,"珍儿的口红好红"
805,"为什么我觉得这个口号色号像死亡芭比粉呢"
805,"有谁觉得珍儿长得特别像杨紫"
806,"皇后到目前为止确实没有害过人感觉和亲王会娶了她"
806,"今天都过节去了吗？都没几个人看"
806,"珍儿好眼熟"
806,"我到现在都没镜头"
806,"蒋猪猪是大猪蹄子"
806,"七夕是什么日子啊"
807,"啥？你说啥？我让一下？嗨我这大龅牙，啊不，暴脾气"
807,"一切都是你们自找的"
807,"真是闲的什么都管"
807,"我何时出来"
807,"嬛嬛都说叫你别作，到你了吧"
807,"我怎么还没出来"
808,"皇后如果不黑化才不正常，想在宫里生活真是不容易啊。"
808,"就是，大家都出去看电影过节了吗？"
808,"那福擦皇后那么善良还失了三个孩子呢"
808,"这不是丝萝吗"
808,"王爷的黑眼圈和牙也是没谁了"
808,"这个王爷的剧情可以砍掉了"
809,"老是在大白天的时候说宫门快下钥了"
809,"珍儿长的好像胡静啊"
809,"旁边那么大的位置他都不走，偏要他让"
809,"本宫认为七夕也是乞巧节，单身也能过啊"
809,"容么么年轻的时候"
809,"你个混账东西，放开容嬷嬷"
810,"路这么宽，你敢让本王让路？"
810,"本宫的珍儿长得好俊"
810,"真儿的脸填充过太明显了"
810,"看了那么久这部剧下钥这词还是没念对"
810,"现实，好人没好报"
810,"这不是容嬷嬷，容嬷嬷比皇后大很多"
811,"大板牙，你牙太长了"
811,"原来是宫门下的药"
811,"珍儿长得像美嘉"
811,"怎么没我事了"
811,"这大牙看得就不舒服"
811,"一直都觉得珍儿不错"
812,"绿了大猪蹄子呗"
812,"又要为难宫女了吗你忘了你麻麻怎么领盒饭的嘛"
812,"七夕我连个大猪蹄子都没有"
812,"你怎么老是在宫门快下钥的时候有事儿啊"
812,"这次不和太监换衣服了？胆子肥了啊"
812,"今天是七夕所以人很少嘛"
813,"容嬷嬷明明比皇后岁数大那么多怎么可能是珍儿"
813,"觉得珍儿跟沉珂有点像"
813,"王爷这不得体啊"
813,"王爷，你们这样不得体啊！"
813,"珍儿也好美"
813,"导演是把本宫忘了吗"
814,"什么多肉，那是非物质文化遗产绒花，不懂别乱说"
814,"这辈子走过最多的路就是璎珞的套路"
814,"傅璎大旗永不倒"
814,"他那天大半夜还在宫里呢"
814,"陈祥你个大猪蹄子"
814,"和亲王可以一用"
815,"真的很喜欢娴妃，她恨的都是他认为害她的人，"
815,"这会儿这么有正义感，当初害皇后的时候怎么不正义啊？"
815,"这个大龅牙"
815,"该死的王爷早该去死了"
815,"珍儿不会说谎的设定啊"
815,"宝宝怎么还没有出来呢"
816,"你这么做不得体"
816,"本宫呢，大猪蹄子你不爱我了嘛"
816,"王爷这是要吃盒饭啊"
816,"想本宫没有"
816,"现实，好人没好报。"
816,"珍儿可是活到了最后领的盒饭"
817,"这里面的宫女都好厉害，说的让王爷让一下"
817,"去，王爷带你去个好玩的地方"
817,"大松鼠大松鼠大松鼠！"
817,"放开本宫的容嬷嬷"
817,"害别人的时候呢,报应，自己坏事做多了"
817,"听说有人想本宫了"
818,"珍儿黑眼圈好重啊"
818,"头上有点绿"
818,"胆儿肥了，让王爷让路"
818,"让人出戏的烤瓷牙"
818,"后面好精彩"
818,"本宫的容嬷嬷呢"
819,"其实娴妃只是把事情看得更加透彻吧"
819,"朕命令你们不要吵,要不要让朕过上安稳七夕"
819,"这丫鬟花儿真多"
819,"贴身侍女跟嬷嬷都分不清，看啥宫廷剧"
819,"有男人的还在追剧才是可怜人"
819,"胆儿肥了，让王爷让路"
820,"王爷不就是因为喜欢皇后啊，不然你以为他多好"
820,"本宫天下第一美"
820,"容嬷嬷年轻时还挺美的吼"
820,"德胜你走错方向了"
820,"太监好时时物的转身走了"
820,"我什么时候登场"
821,"如果魏璎珞被这样虐，她比皇后还很，有主角光环就是好"
821,"为什么要换个位置说话"
821,"大龅牙演得好"
821,"看着看着看着"
821,"牙可真长太影响颜值了"
821,"啦啦啦，找不到我，找不到我。"
822,"看着正经多了这王爷"
822,"本宫的珍儿美"
822,"这里面的妃子都好牛都有人帮出头"
822,"都去过情人节了哟"
822,"大龅牙是不是喜欢皇后"
822,"我再一次需要利用你"
823,"有男友可他是大猪蹄子不解风情🙂"
823,"有人想我高可爱没"
823,"大龅牙看着就出戏"
823,"大白牙演的不错"
823,"我命令你立刻脱下衣服跪着唱征服"
