time,content
735,"这里升级好快哦想当年嬛嬛用了那么久才升级"
735,"春望啊快下来一起打排位啊"
735,"大猪蹄子快去找你的令妃"
735,"本宫还是善良的"
735,"曾家鸿是大猪蹄子"
735,"袁春望就是太爱出风头，演太过了，招人烦"
736,"淑妃?听着好耳熟啊，还珠格格里有淑妃吗"
736,"什么时候当舒肥了"
736,"李玉演的超好，还有明玉"
736,"本宫走的早"
736,"这么快舒妃抬举她了"
736,"你还好意思说大家记得你们你出场多少回了"
737,"袁快去领盒饭吧'热好"
737,"舒妃我劝你善良"
737,"袁春旺这演技好尬"
737,"李玉最可爱"
737,"总觉得袁春望后面会有看头说不定是故意安排的"
737,"傅璎女孩一直在"
738,"乾隆:高可爱走的第N天，想她想她。"
738,"本宫觉得袁春旺并没有这么简单，肯定还有其他目的"
738,"袁春望是好的，璎珞的卧底"
738,"我啥时候出来啊"
738,"吴总管快回来吧"
738,"给本宫安排一下"
739,"袁春旺讲话好慢啊"
739,"让我们一起绿"
739,"大神是个大猪蹄子"
739,"我看这恐怕就是顺嫔妹妹吧"
739,"我去拿大家善良"
739,"袁春望早点领盒饭吧！"
740,"男大当婚，里面曹小强的舅舅李文达就是袁春旺"
740,"看来本宫的舞真的白跳了呜呜呜"
740,"明玉好可爱啊"
740,"我媳妇该回宫了吧"
740,"袁春望这是没地儿去了吗？来绣房转悠？"
740,"今日嫔妾上热搜了"
741,"邝艳萍你个大猪蹄子"
741,"大猪蹄子我不在你又不老实了"
741,"我只想问一下袁太监是配音还是原声，"
741,"都有十阿哥了，厉害呀，"
741,"这部剧咋光生儿子不生女儿啊"
741,"我什么时候出场啊"
742,"都有十阿哥了，大猪蹄子"
742,"我什么时候出来呀"
742,"袁春望是不是皇后身边的卧底"
742,"乾隆孩子怎么都早死"
742,"舒妃能从第一集活到最后一集"
742,"都没学过历史吗"
743,"哥哥，你要是没变坏就好了。没黑化就好了"
743,"十阿哥？舒妃？你个大猪蹄子造反了？"
743,"袁春望是不是好的啊"
743,"吴春望我劝你善良"
743,"高贵妃和袁春望说话真是想打"
743,"都排到十阿哥了"
744,"哈哈哈，夭折了，听着真开心，第一个孩子就夭折了"
744,"去了圆明园那么久"
744,"节奏太快了"
744,"袁春望会不会是打野的"
744,"袁春望到底什么时候下线"
744,"十阿哥刚出生就腰折了！哈哈哈哈"
745,"你要不要走的在直点，别闪了腰袁"
745,"朕的阿格为什么死那么多"
745,"信息量好大"
745,"我和我哥在演戏呢皇后就要玩了明白了吗"
745,"大猪蹄子的儿子怎么这么容易夭折啊😊"
745,"十阿哥刚出生就腰折了！哈哈哈哈"
746,"过去好久了好吗，人家不可能把每天都拍出来吧"
746,"本宫还是太单纯了"
746,"此时看到了三行字幕飘过"
746,"你说我这一生夭折了多少子子孙孙啊😂"
746,"走了这么久么"
746,"会不会袁春望和本宫一样倒打一耙？"
747,"他们这是去了多长时间舒嫔都生孩子都变成舒妃了？"
747,"等你来吃盒饭。"
747,"有什么好问的刘姑姑是好的啊太后没病吃什么药！"
747,"咦舒嫔什么时候时候生了孩子皇后又怀了每集都看咋不知"
747,"多余一个角色"
747,"甜甜在看吗"
748,"春哥我劝你善良"
748,"什么舒嫔孩子夭折了？她什么时候有的孩子"
748,"袁是会害皇子的"
748,"感觉这袁春望说话嘴巴张不开似的"
748,"春望说话都是咬着牙的呀"
748,"舒嫔生个儿子，居然死了"
749,"舒妃的孩子肯定是皇后害得"
749,"庆贵人什么时候能升位"
749,"怎么那么多阿哥夭折"
749,"谁吃盒饭，今天的盒饭加了猪蹄"
749,"甜甜在看呢."
749,"快去领盒饭吧"
750,"雍正的孩子也是死的多"
750,"袁春望真的看你不舒服"
750,"白俊浩你个大猪蹄子"
750,"老八老九阿哥格格哪去了"
750,"2倍速看这个剧才是正常的"
750,"舒妃的孩子肯定是皇后害得"
751,"袁春望的衣服还没旁边这个掌事太监的衣服高级啊"
751,"朕的孩子都快死光了"
751,"这剧情是怎么发展的，怎么这么快"
751,"好想一巴掌呼死袁春望"
751,"什么，怎么这么快十阿哥了，上一个不是七阿哥吗"
751,"雍正的孩子也是死的多"
752,"袁春望的盒饭热一热"
752,"怎么那么多孩子夭折"
752,"好了好了看58的了不起了不起"
752,"你可以快点下来陪我吗袁春望"
752,"袁春望这个演员说话听了不舒服"
752,"袁春旺旺旺啥时候领盒饭"
753,"都是阿哥好厉害"
753,"我那么大了还能生？"
753,"什么时候怀的？舒嫔的娃是真的夭折了吗表示怀疑"
753,"李玉怎么没有弹目了"
753,"好了好了看58的了不起了不起"
753,"袁春旺旺旺啥时候领盒饭"
754,"大猪蹄子大猪蹄子"
754,"时间过得这么快？"
754,"果然适当的异地恋还是很有必要的"
754,"我那么大了还能生？"
754,"本宫怎么都要生了？"
754,"都是阿哥好厉害"
755,"舒嬪懷孕了？甚麼時候懷的娃，肚子也不見大"
755,"厉害了苏菲卫生巾"
755,"这才半集，舒妃有了娃死了，皇后也有了哇，信息量太大"
755,"我走了，你还不是没闲着"
755,"节奏突然这么快了？一句话就带过了舒嫔生子丧子"
755,"果然适当的异地恋还是很有必要的"
756,"这剧的时间跨度好大啊"
756,"我走了那么久了么，现在又有舒妃皇后还揣起了"
756,"袁重望:我才是最强卧底"
756,"这剧情跳的太快咋没见有格格出生呢"
756,"历史上舒嫔是怀了阿哥，但是没有记录，原来是走了啊"
756,"剧情这么快的嘛"
757,"多大岁数了自己也不掂量掂量还生呢？"
757,"本宫不在宫变化挺大啊"
757,"这个大猪蹄子，璎珞刚走就生了俩了"
757,"袁春望你念台词能正常点吗"
757,"哇，这剧情跳的真够厉害的"
757,"本宫的十二阿哥也快了"
758,"大猪蹄子居然让皇后有孕了"
758,"我们魏姐走了，可是大猪蹄子一点没闲着"
758,"舒嫔啥时候生的娃还成了舒妃？皇后什么时候怀的孩子？"
758,"大猪蹄子你有要生孩子啊"
758,"剧情好紧凑"
758,"这个大猪蹄子，璎珞刚走就生了俩了"
759,"好啊大猪蹄子本宫不在宫里多这么多孩子，跪搓衣板去！"
759,"大猪蹄子就是大猪蹄子嘴上说着想本宫却跟别的女人生娃"
759,"大猪蹄子效率不错啊"
759,"什么？本宫要生了吗？好激动好激动"
759,"春望，你的台词信息量好大"
759,"本宫才半集不在她们都要生了之前隐藏得不错啊"
760,"啊？皇后娘娘要生，多大岁数了！😳"
760,"皇后要生，舒妃孩子保不住，太正常了"
760,"卫龙大旗啥时候举起来啊"
760,"你的晴可爱突然出现"
760,"大猪蹄子跪搓衣板"
760,"大猪蹄子效率不错啊"
761,"你也没闲着啊大猪蹄子，这点时间两个娃"
761,"哼大猪蹄子我不在你都生这么多了！"
761,"皇上是根本没有闲着呀，都要生了"
761,"大猪蹄子工作效率也太高了吧"
761,"真是个纯大猪蹄子"
761,"皇上说你们都跑出去悠闲了朕可没有"
762,"大猪蹄子没闲着啊，皇后要生了？"
762,"皇后那个老妖婆皇上您怎么下得去手"
762,"这剧中的年月是过的最快的"
762,"出生就夭折还不是本宫一个响指的事情"
762,"皇后娘娘也要生了这剧情发展有点快"
762,"为什么这么快一个个都有了"
763,"哈哈你们卫龙吃的开心吗大猪蹄子孩子都和别人生几个了"
763,"本宫要生孩子啦"
763,"这病养得够久啊，都养出续皇后一个儿子了"
763,"这是啥时候的事啊！都生孩子啦！"
763,"大猪蹄子没一个好东西"
763,"本宫是去了多久啊"
764,"皇上好厉害"
764,"你个大猪蹄子，搞大了两个人的肚子，哼！"
764,"是没充钱看不到剧情发展么"
764,"朕就是种马可比我爹强多了"
764,"乾隆儿子多呀"
764,"大猪蹄子就是配种的猪吗"
765,"时间过得可真快啊，皇后都要生娃了"
765,"真的觉得不喜欢圆春旺的声音有点说不出来"
765,"富察皇后:本宫在帮你们做盒饭呢，好了就送给你们"
765,"想想都知道十阿哥死的不一般"
765,"剧情好快啊"
765,"朕的生育能力是不是很赞"
766,"大猪蹄子这么多孩子"
766,"皇后要临盆了，这么快"
766,"哈哈哈，皇后娘娘要生了，生了一个不怎么聪明的"
766,"接下来就是本宫的十二啊哥了"
766,"长得像璎珞要收了"
766,"本宫要生了快来伺候着"
767,"可真他么厉害啊"
767,"没办法朕就是肾好"
767,"估计是皇后干的好事"
767,"顺嫔是什么"
767,"魏哥是走了多久啊，这边都生了又怀的"
767,"哈哈哈，皇后娘娘要生了，生了一个不怎么聪明的"
768,"死元春旺忘了璎珞为人多好了"
768,"你个大猪蹄子，才多久啊"
768,"娴妃才25岁谁说年纪大了"
768,"说那么大还能生的你站住"
768,"总觉得袁春望会有反转"
768,"还有格格啊。肯定不是全部都是阿哥啊"
769,"大猪蹄子大种马，天天不闲着"
769,"袁春望我劝你善良"
769,"为什么都是生阿哥这么厉害的吗"
769,"本宫这一走，变化真大"
769,"信里说了每年都是如此就是几年过去了认真看剧啊"
769,"你个大猪蹄子，才多久啊"
770,"皇后的儿子是十四阿哥永璂，皇上的儿子名字都是王字旁"
770,"这宫女长的某个角度像璎珞啊"
770,"又闻到恋爱的酸臭味"
770,"不生了不生了"
770,"删了多少啊这是，过了多少年啊"
770,"本宫闪亮登场"
771,"说袁春旺眼神好的，旁边一个更好，好吗"
771,"你们女孩子怎么喜欢看这种宫廷路呢"
771,"袁春旺是好的"
771,"顺频啥时候出场"
771,"感觉错过了好多剧情，特意回去看了前几集，怕有漏的"
771,"真快，都要生了"
772,"养了这么多年啥都不是了呵呵"
772,"大猪蹄子还回去作肾，待在外面多好"
772,"这音乐好听，叫什么名字"
772,"你怎么长得像我"
772,"袁春望一定会有用的"
772,"孩子不会是舒嫔的吧"
773,"皇上还是勤快啊"
773,"我这个万年备胎，咋还不出镜，是杀青了么"
773,"袁春望喜欢魏璎珞啊原来，由爱生恨了，"
773,"继后生了个妖怪"
773,"总觉得袁是故意投靠皇后的"
773,"勾画出风格"
774,"说戏精牡丹那个的厉害了"
774,"本宫要生孩子去了"
774,"长得像璎珞"
774,"本宫的永基要出生了"
774,"皇上还是勤快啊"
774,"袁春望喜欢魏璎珞啊原来，由爱生恨了，"
775,"我觉得就算袁喜欢魏，魏也不可能喜欢他，因为他是太监"
775,"大猪蹄子，你还真没闲着"
775,"从头到尾都觉得袁春望是多余的"
775,"皇后的不是亲生的"
775,"袁春旺：我好像要善良了"
775,"本宫的永基要出生了"
776,"袁春旺由爱生恨，爱的越深恨的约深"
776,"长得像杨幂和明玉的结合体"
776,"乾隆比他爹生育能力强很多"
776,"好一个闭月羞花的秀女"
776,"春望是好的"
776,"这不是叶太医吗"
777,"十阿哥都夭折了？呵，大猪蹄子速度挺快"
777,"大猪蹄子！！"
777,"这剧里生孩子好容易啊"
777,"这是想起我魏璎珞了吧"
777,"高可爱走的第N天，想她，想她"
777,"呀这不是消失了的要轻薄袁春望的太监么"
778,"乾隆把康熙雍正积累的家产都给败光了清朝由此开始衰败"
778,"小太监秒懂，有出息"
778,"长得挺可爱"
778,"哈哈想起来璎珞"
778,"皇后那么大了还会怀？"
778,"我为什么要早早下场？"
779,"这个是个对食的好苗子"
779,"袁春望是好的呀"
779,"这剧情跳的也太快"
779,"袁春望能不能快点去领盒饭！"
779,"这次选演员是真用心了，连路人都这样"
779,"乾隆把康熙雍正积累的家产都给败光了清朝由此开始衰败"
780,"大猪蹄子身体真好啊"
780,"我出场了。大家等急了吧"
780,"袁春望好瘦啊"
780,"最后袁要变好"
780,"感觉袁春望是在皇后身边当卧底"
780,"这剧情跳的也太快"
781,"未来的惇妃出现了？"
781,"这是本宫吗？"
781,"长得像璎珞"
781,"袁哥哥你的良心在痛了吗"
781,"袁春望是好的"
781,"我觉得袁春旺临死前还是会帮璎珞的，毕竟那么爱"
782,"皇后也要生了这地位更稳固了"
782,"袁春望果然还是爱魏璎珞的但实在被复仇冲昏了头脑"
782,"好的，好的。确认过眼神"
782,"不用想了，本宫不在你舒嫔怀龙嗣皇后放的过你？"
782,"袁哥哥你的良心在痛了吗"
782,"未来的惇妃出现了？"
783,"你们这群人，除了大猪蹄子、盒饭，还会用新词吗？"
783,"说“太后难产该多好”的放学别走"
783,"十阿哥死得不一般啊！此处省略一万字"
783,"长得像璎珞"
783,"长得像明玉"
783,"袁春望果然还是爱魏璎珞的但实在被复仇冲昏了头脑"
784,"感觉要出大事了这孩子怕是保不住了"
784,"大猪蹄子你好吗？"
784,"袁春望戏怎么那么多"
784,"这袁春望天天想女人"
784,"其实袁春望对璎珞是有爱的"
784,"长得像璎珞"
785,"哥，你是好的对吧，你在乎璎珞的，你没变坏"
785,"皇后在最安全的时期生孩子，真聪明"
785,"袁一个太监，还那么大醋"
785,"你可真是一天没闲下来啊皇上"
785,"其实袁春望对璎珞是有爱的"
785,"感觉要出大事了这孩子怕是保不住了"
786,"太后难产那该多好"
786,"袁春望本宫劝你善良"
786,"害了那么多人也不怕自己的孩子遭报应。"
786,"珍儿马上也要被袁春望利用了真心"
786,"不喜欢皇后看不出哪里好了"
786,"皇后你最好没生出来就夭折"
787,"我都怀了那么久了都没你肚子大"
787,"袁春望，本宫看你是嫌活的太长了"
787,"现在特别想说一句皇上就像一匹多情的种马"
787,"这个借景也好美"
787,"我肚子都还没这么大，她几分钟就这么大了"
787,"我一直以为皇后不能生，没想到怀了"
788,"我们错过了什么，剧情好快啊"
788,"我自己都不知道有。只不过昨晚吃多了还死鬼便秘。"
788,"容嬷嬷好可爱啊"
788,"即将临盆肚子就这么大点？"
788,"说袁春望好的的站住"
788,"没想到本宫被小燕子斗垮了"
789,"袁春望是来找大猪蹄子报仇的。不会有反转的。"
789,"大猪蹄子本宫这才走了多久你就和那么多女人生孩子了"
789,"大猪蹄子效率真高"
789,"这么多年了，居然还能怀上，真的好惊喜啊"
789,"皇后都多大年纪了"
789,"大猪蹄子看我回来怎么收拾你"
790,"那个说太后难产多好的认真的吗"
790,"摔一跤摔一跤快啊推一把加油"
790,"长的像晚晚"
790,"大猪蹄子本宫这才走了多久你就和那么多女人生孩子了"
790,"袁春望是来找大猪蹄子报仇的。不会有反转的。"
790,"大猪蹄子效率真高"
791,"大猪蹄个个生儿子，厉害厉害"
791,"本宫要时常给自己照镜子劝自己善良"
791,"也祝你活不成吧！害了那个多人的孩子，你的孩子会长寿"
791,"不公平，娴妃居然要生孩子"
791,"大猪蹄子你咋怎厉害呢"
791,"我年纪这么大了还能生？"
792,"皇后生的是十二和十三阿哥好吧，不知道别乱说"
792,"大猪蹄子敢让害死臣妾的人有了孩子真是大猪蹄子"
792,"皇后的肚子好大"
792,"这么久了我还以为皇后生不出来孩子呢"
792,"阿佘演技真的很好"
792,"果然大猪蹄，我一不在又整出两条人命"
793,"看剧的你们翻脸比翻书还快又有人说袁春汪是好的"
793,"谁让皇后滑胎我请谁吃大猪蹄子"
793,"大猪蹄子这是造了多少个孩子啊"
793,"大猪蹄子不错啊"
793,"做人还是不能忘记自己的本分，太监就做好太监该做的事"
793,"阿佘演技真的很好"
794,"皇后有一个孩子，夭折了，令妃有五六个孩子活的很好"
794,"大猪蹄子真是没闲着啊"
794,"大猪蹄子，没闲着啊！不是这个孕就是那个孕"
794,"咱家闲了还不来陪我玩"
794,"我觉得袁春望是在等候时机，到时候反皇后娘娘一击"
794,"诗曼演的太好了"
795,"没有婆婆没有丈夫的宠妾舒服啊"
795,"鹦鹉演的好"
795,"这是过了多长时间了"
795,"大猪蹄子！"
795,"说袁春望变好的。太天真。"
795,"这货也能有孕，皇上啊皇上"
796,"做了那么多孽，娃出生估计都是畸形"
796,"娴妹，哀家在等你呦，快来领盒饭"
796,"皇后都要生了，这太后和令妃出去快一年了吧？？"
796,"本宫可是生了两个阿哥呢，正得意"
796,"这皇后是有了吗？肚子这么大"
796,"皇上真是好体力"
797,"衣服都是手工的工期长做不出来那么多"
797,"皇后你这孩子是大猪蹄子的吗"
797,"皇后生的是十二阿哥，这是不是生的有点早了啊？"
797,"皇后你什么时候死？？我等不急了"
797,"希望袁春旺最后能变好"
797,"说太后难产哪位是认真的吗！！"
798,"这生的都是阿哥没有格格吗，皇上基因太强了吧"
798,"我去了星光大道！特自信，麻麻再也不用担心我被欺负了"
798,"这鹦鹉怎么感觉长肥了？"
798,"新进的梗袁春望和现在的皇后都是大豆虫"
798,"这枕头好大啊"
798,"这人瞧着得有五六十了吧"
799,"嫔妃怀个孕真快一眨眼就生了现实中怀个孕度日如年"
799,"为啥皇后衣服上是龙，穿了大猪蹄子的衣服？"
799,"袁哥哥是更厉害的愉妃么"
799,"本宫看着是不是很温柔"
799,"皇上真厉害啊，吃了什么药了，怎么生出来的都是阿哥"
799,"快，皇后让我推你一把"
800,"袁春旺最大反派教唆皇后怎么会是多余的"
800,"这龙🐲的眼睛被压爆了嘛那么大皇后"
800,"佘诗曼演得真好，演到让我对娴妃恨之入骨"
800,"本宫的龙好霸气"
800,"有什么资格提爱？不是因为他太监的身份思想性格有问题"
800,"我真是大猪蹄子"
801,"这片里衣服上的龙都好可爱"
801,"后皇后我不劝你善良我劝你去剪头"
801,"皇后那么大岁数了还能生啊"
801,"你个个一时半会都不能闲下来。"
801,"大猪蹄子是种马么"
801,"我真是太单纯"
802,"我去这个长得好像魏姐啊"
802,"朕都服了自己竟然对你下得了手"
802,"皇后娘娘，您坏事做尽也能生出孩子？？"
802,"谁让你穿本宫和皇上的情侣装了！！"
802,"有没点智商看剧"
802,"好久没有夫妻生活了呢"
803,"皇上可真厉害，生的都是儿子"
803,"有人想念本宫吗"
803,"这鸟活的真久"
803,"本宫何时出场"
803,"袁春望可能是搬到皇后的关键人物"
803,"我去这个长得好像魏姐啊"
804,"皇后居然穿了一套龙服是要篡位拖出去斩十分钟"
804,"为什么大家都只生男孩呢"
804,"大猪蹄子就是强"
804,"还记得我吗？"
804,"这宫女长得真心不错"
804,"皇后长得太让人心烦。看着就别扭。"
805,"别急，坏人都会领盒饭，没有坏人，戏没法演"
805,"高龄产妇你可要多注意"
805,"感觉后宫都生不出来男孩，生出来就得死"
805,"该老娘出场了"
805,"大猪蹄子一点不挑食"
805,"这宫女长得真心不错"
806,"皇后生个格格多有趣呀"
806,"我其实最单纯了"
806,"乾隆孩子还挺多的"
806,"还记得本可爱吗？"
806,"三个月肚子就大了？"
806,"到我出厂场了"
807,"这鹦鹉长不大吗？都这么久了"
807,"我领盒饭了我怎么不知道？"
807,"舒嫔的孩子一定是皇后给弄掉的"
807,"这个龙太可爱了吧"
807,"皇后的头型就不能换换"
807,"你说嘴巴嘟嘟嘟"
808,"剪辑了好多，其实舒嫔很义气对陆晚晚，处处护着她"
808,"感觉鹦鹉会是神助手"
808,"这鹦鹉不健康，，都缩成球了"
808,"啥？10个了都是阿哥？朕的种这么优秀啊"
808,"好像这玩意儿历史上是没子嗣的哇"
808,"舒嫔的孩子一定是皇后给弄掉的"
809,"他们去圆明园那么久了？孩子都要生了"
809,"袁春望我劝你善良"
809,"确认过眼神，袁春旺是分手会杀前女友的人"
809,"都五十八集了我还不出场"
809,"大了肚子还玩心机"
809,"袁春旺我劝你善良"
810,"长得像明玉啊"
810,"永基要出生了"
810,"袁春望是好的"
810,"我居然也是绣娘出身"
810,"佘诗曼演技很好"
810,"袁春旺我劝你善良"
811,"袁春望是好的，他和愉妃一样，是碟中谍"
811,"袁春旺的盒饭啥时候就热好了啊？"
811,"皇后要不是最后被嬛嬛玩死了她儿子肯定当太子了"
811,"皇后的衣服怎么绣着龙了"
811,"皇后这胎能生下来吗"
811,"难道这是我？"
812,"反而觉得她像陆晚晚"
812,"乍一看袁总管脸变形了？！"
812,"看抖音来的没？"
812,"璎珞也快点生一个"
813,"皇后的女儿是要被封固伦公主的"
813,"袁春旺玻尿酸打多了吧"
813,"大哥你别忘了你是太监"
813,"娴妃生了永基还珠里面不是有吗"
813,"这鸟还活着呢？"
813,"可惜了这宫女啧啧啧"
814,"快快快自己找个楼梯摔下去"
814,"这是2.0速度才能使用的"
814,"历史上就是很晚才怀上"
814,"还记得我吗？"
814,"这姑娘长得像璎珞"
814,"为啥皇后生孩子就这么快"
815,"晋江有篇文叫嫁给一个死太监，很甜的"
815,"我好善良，我最可爱"
815,"皇后生了令妃就快了"
815,"这宫女要来领盒饭了"
815,"八阿哥九阿哥没演谁生的，就十阿哥了啊"
815,"历史上就是很晚才怀上"
816,"娴妃的孩子是大猪蹄子的吗"
816,"本宫劝你善良"
816,"还是晚一点人多一点"
816,"我眉头一皱，发现事情并不简单"
816,"这就是顺妃"
816,"我劝你善良"
817,"我还以为是陆晚晚"
817,"讲个笑话伺候太监"
817,"确认过眼神，袁春旺是分手会杀前女友的人"
817,"继后四十多了吧"
817,"有袁春旺我都想跳过"
817,"我眉头一皱，发现事情并不简单"
818,"大猪蹄子又有孩子了"
818,"我相信那个太监哥哥还是好的，给皇后致命一击"
818,"袁春望的脸是被打肿了吗"
818,"他不是太监吗"
818,"皇后的永基要出生了"
818,"确认过眼神，袁春旺是分手会杀前女友的人"
819,"大猪蹄子就是大猪蹄子"
819,"这戏真是太长了都忘记之前演的啥了"
819,"长得像璎珞啊"
819,"皇上的肾真好"
819,"皇上都生的是儿子哈哈"
819,"他不是太监吗"
820,"乾小四生的挺多，活下来没几个"
820,"还以为是那个锦绣"
820,"袁春望我劝你善良"
820,"本宫马上掉段了"
820,"这个小姑娘怕是要受折磨了"
820,"皇上都生的是儿子哈哈"
821,"皇后的孩子活了多长时间？"
821,"据说袁春旺长得特别帅？这个演员是不是没选好～"
821,"可能是觉得像璎珞，所以多看了一下"
821,"袁春望好一张玻尿酸脸啊"
821,"长的像璎珞"
821,"本来酝酿哭的情绪，那一句鹌鹑直接笑出了声音"
822,"长得跟樱络还挺像"
822,"还不是因为她长得像我"
822,"大鼻孔是有点像"
822,"哎哟，长得还真像我"
822,"袁春望长的好像托马斯火车头啊😄"
822,"可能是觉得像璎珞，所以多看了一下"
823,"这演员选的妙啊真的挺像璎珞"
823,"袁春望脸好畸形啊"
823,"哇不错不错"
823,"长得像本宫啊"
823,"这个袁春旺整个脸都好畸形"
823,"长得跟樱络还挺像"
824,"袁春望是不是脸上玻尿酸打多了"
824,"还真有几分神似本宫"
824,"这个演员选的不错"
824,"袁春望，我看你还是别伺候本宫了"
824,"好畸形的脸"
824,"袁春旺的脸肿的根猪尿泡一样！！！！"
825,"是看她有点像璎珞袁春旺想她了所以多看了一眼"
825,"乍一看真的和本宫神似"
825,"不戴帽子好瓜"
825,"袁春望太吓银了"
825,"这脸长的真奇怪"
825,"好畸形的脸"
826,"这莫不是后来给六十多岁乾隆生下女儿的什么妃"
826,"袁春望啥时候姓刘了"
826,"这脸是怎么地了好黑人"
826,"他的脸怎么看着变形了"
826,"肢体动作语言都好奇怪啊，他真的不是有内情进来的吗？"
826,"本宫怎么还不出场"
827,"皇后肚子挺争气，生完娃就死翘翘"
827,"谁说袁春旺帅的你怕是实在对帅有误解了"
827,"为啥我感觉长得像海兰察"
827,"不是！？那得多炸啊"
827,"长得那么奇怪的袁春汪"
827,"袁春旺脸玻尿酸太多啦"
828,"长的变形的袁春望演员便宜没好货"
828,"和我像，袁春旺你是不是嫌盒饭热的太慢了？"
828,"不愧是大猪蹄子，动作这么快😂️"
828,"妈耶好像我"
828,"袁春望你的脸破尿酸打多了"
828,"刚打完针啊这脸"
829,"袁春旺的人中太长了看着不舒服"
829,"你的盒饭热好了下去吧"
829,"袁春旺长得跟清秀有关系吗？"
829,"这是未来的顺妃吗？"
829,"妈呀袁春望脑袋咋这么长"
829,"这个袁春旺真的是败笔"
830,"女人都打，真不是好东西"
830,"哥，你这一巴掌都把人掀翻了哈哈哈哈哈哈哈哈"
830,"春望哥你的腮红打多了"
830,"一点都不像我！！"
830,"大猪蹄子还蛮有闲心的嘛"
830,"跟我比差远了"
831,"好吧长得一般"
831,"我觉得长得像纯妃"
831,"抬起头嘴唇太厚了"
831,"这得有多乍啊"
831,"女人都打，真不是好东西"
831,"一点都不像我！！"
832,"力气怎么那么大呢，能把人煽得摔倒"
832,"大鼻孔好像"
832,"这鹦鹉有用么"
832,"这不是玲珑吗"
832,"脚翘得可爱！"
832,"感觉袁的脸都畸形了"
833,"妈耶~袁春望好阔怕"
833,"没根的东西"
833,"夭折的太多了最后立了碌碌无为的嘉庆"
833,"是有点像我"
833,"跟恭桶打过交道的一出手就是非凡呀！"
833,"这手往哪儿打呢"
834,"这也叫最帅的太监"
834,"元春旺是不是整过容"
834,"太监长得一点都不俊"
834,"袁春望你不是人！！！"
834,"哪来的爱啊！还爱都没有了，这春望真.病态的渴望爱啊"
