time,content
1980,"哎呀妈，脑阔又疼了，又被你说的一愣一愣的"
1980,"你知道的太多了"
1980,"媳妇，他不会让你吃盒饭"
1980,"你姐姐也是非杀不可的哪种懂吗"
1980,"有可能会哦"
1981,"摸鼻子的动作不错"
1981,"大猪蹄子你还记得大明湖畔的容音吗"
1981,"哎呀，脑阔疼"
1981,"龇牙咧嘴的大猪蹄子就是朕没错了"
1981,"哎呀妈，脑阔又疼了，又被你说的一愣一愣的"
1981,"你知道的太多了"
1982,"抹嘴巴好可爱"
1982,"你知道的太多了"
1982,"脑壳疼脑壳疼。"
1982,"我像不像吉娃娃？都说像"
1982,"原谅色来一波"
1982,"朕早就想掐你脖子了"
1983,"大猪蹄子好可爱啊"
1983,"大猪蹄子你放开我，疼疼疼！"
1983,"媳妇儿太聪明了，脑阔疼"
1983,"脑壳疼脑壳疼"
1983,"看不出哪裡甜了，欢喜不起來"
1983,"朕早就想掐你脖子了"
1984,"聂远这些小动作实在是太可爱了"
1984,"大猪蹄子你放开我"
1984,"你俩好可爱"
1984,"请问，在座的都是单身狗嘛"
1984,"突然觉得皇上和璎珞两人跟个孩子似的😂😂😂😂"
1984,"哈哈你两个"
1985,"这擦鼻子的两下是认真的吗？大猪蹄子你也太可爱了吧！"
1985,"没有较好的表情管理"
1985,"最近看了乾隆的照片，感觉落差好大"
1985,"你们是来搞笑的么"
1985,"验明正身就能百分百吗？斩白鸭是怎么来的"
1985,"当然不会，你还有十个孩子没给朕生呢~"
1986,"这大七夕本来想不出去好了来看剧竟然给我看这个！"
1986,"为什么本宫的声音跟高可爱的一样一样的了"
1986,"说了实话皇上秃头了"
1986,"脑阔疼，都被你猜中了"
1986,"当然怕啊，仇还没报呢"
1986,"我太聪明了"
1987,"脑阔疼脑阔疼"
1987,"大猪蹄子，吓唬我"
1987,"感觉为魏璎珞明明不可爱，说话却总是装可爱，不自然"
1987,"朕还能再可爱点"
1987,"为什么本宫的声音跟高可爱的一样一样的了"
1987,"我太聪明了"
1988,"哈哈哈哈哈大猪蹄子太可爱了"
1988,"披着一下真的很开心"
1988,"这俩真逗，戏精上身"
1988,"本夫人准备领盒饭了"
1988,"大猪蹄子，吓唬我"
1988,"朕还能再可爱点"
1989,"脑壳一紧，觉得事情没那么简单"
1989,"大猪蹄子敢掐我活腻了吧"
1989,"皇上好可爱"
1989,"哎呀妈呀脑壳疼"
1989,"果真是个大猪蹄子"
1989,"这俩真逗，戏精上身"
1990,"大猪蹄子表情好丰富"
1990,"大猪蹄子和我过情人节了"
1990,"皇上居然把腿放璎珞腿上。大猪蹄子"
1990,"皇上您最爱的就是锁喉和飞脚是吧"
1990,"皇上脑阔疼"
1990,"哎呀妈呀脑壳疼"
1991,"举着卫龙大旗的从实招来，你们举过傅璎令后帝后大旗吗"
1991,"朱洪君大猪蹄子"
1991,"摸完大猪蹄子的脚又摸嘴"
1991,"璎珞演笑戏的演技有待提高啊"
1991,"大猪蹄子和我过情人节了"
1991,"皇上您最爱的就是锁喉和飞脚是吧"
1992,"可爱的大猪蹄子"
1992,"要想生活过的去头上总要带点绿"
1992,"皇上无敌可爱"
1992,"卫龙大旗摇起来！"
1992,"两个人好可爱"
1992,"俩人年龄加起来超不过三岁"
1993,"玛丽苏，这个皇上一点威严都没有，根本不害怕好吗"
1993,"大猪蹄子好皮呀"
1993,"才发现魏璎珞声音变温柔了"
1993,"璎珞叫起来好像高贵妃叫起来的声音哈哈哈哈哈哈哈哈"
1993,"这种感觉真好。希望保质期更长"
1993,"皇上无敌可爱"
1994,"大猪蹄子和他的吉娃娃"
1994,"大猪蹄子，快来陪本宫过节"
1994,"这个乾隆演的好有意思"
1994,"你的声音怎么和高可爱越来越像了"
1994,"你们能再可爱点吗"
1994,"才发现魏璎珞声音变温柔了"
1995,"我怎么觉得皇上喜欢魏璎珞比喜欢皇后多呢"
1995,"大猪蹄子真的很爱掐脖子了"
1995,"这果真是个大猪蹄子"
1995,"我这肚子好不争气阿"
1995,"大猪蹄子和他的吉娃娃"
1995,"这个乾隆演的好有意思"
1996,"皇上演的好可爱"
1996,"大猪蹄子，你竟敢掐我，都吓死臣妾了"
1996,"是长的像吉娃娃"
1996,"摸头是一种新的时尚，朕要引领"
1996,"特别笑的时候好不自在"
1996,"大猪蹄子真的很爱掐脖子了"
1997,"璎珞：大猪蹄子请注意你的表情管理"
1997,"左手指甲都被你掐掉了！大猪蹄子"
1997,"聂远真的把皇上演的太好了啊，这才是有血有肉的皇上"
1997,"这么久了还没怀上孩子？"
1997,"摸头是一种新的时尚，朕要引领"
1997,"大猪蹄子，你竟敢掐我，都吓死臣妾了"
1998,"现在有多甜接下来就多虐，哎"
1998,"璎珞说男人是人头猪脑的大猪蹄子"
1998,"你们男人都喜欢古代的女人乖巧懂事"
1998,"没办法，朕是吃可爱丸长大的"
1998,"确实穿什么都抬不起来富贵范"
1998,"两人加起来3岁不能再多了"
1999,"魏姐跟大猪蹄子在一起声音都变甜了"
1999,"本宫其实是水神的妻子下凡历劫来的"
1999,"璎珞演的可爱不是很自然感觉没什么气质不同意勿喷"
1999,"我可不可爱"
1999,"这一段好有平民夫妻的感觉，含糖量太大"
1999,"傅璎大旗倒了233"
2000,"刘传娅你这个大猪蹄子大猪蹄子！"
2000,"本宝宝很可爱的好不啦"
2000,"主角演技真的没有皇后好"
2000,"本宫不开心了、"
2000,"快来看大猪蹄子"
2000,"这一段好有平民夫妻的感觉，含糖量太大"
2001,"辉发那拉那尔布，好长的名字"
2001,"如果我娶了璎珞，我这辈子该有多开心啊"
2001,"本来她现在就不爱皇上装的那么爱皇上厉害"
2001,"大猪蹄子你还不知道我杀了皇后"
2001,"傅璎女孩扛起大旗"
2001,"大猪蹄子，你敢吓我"
2002,"个人感觉璎珞装可爱的时候装的太明显了，不是真的可爱"
2002,"冒个泡，你们想我高可爱了嘛？"
2002,"今天是七夕，全都是恋爱的酸臭味"
2002,"陈雪妍追剧大猪蹄子"
2002,"哈哈哈哈头上又带多肉"
2002,"魏璎珞就不能穿个新鲜点的衣服吗？"
2003,"哈哈哈哈，皇上好可爱"
2003,"整部剧都是说大猪蹄子这四个字，有意思吗"
2003,"突然觉得魏璎珞后台不一般"
2003,"别把璎珞弄疼了"
2003,"聂远演活了乾隆"
2003,"在这坐着看电视的都是单身"
2004,"皇上在他面前好轻松好开心没有所谓的规矩"
2004,"大猪蹄子你忘了臣妾吗"
2004,"今晚请同学们先看大本营，等更新完再晚点看延禧"
2004,"总觉得这两人没什么cp感"
2004,"甜到卡颈啊"
2004,"ling令妃撒娇演的太做作了"
2005,"要虐卫龙了？没事啊，我们傅璎也是有多甜就有多虐😂"
2005,"本宫的脖子怕是陛下掐长的"
2005,"这部剧璎珞换个俏皮的演员演就很棒了"
2005,"你们不记得我高可爱了嘛"
2005,"璎珞没变，要是傅恒娶了她，也会像现在这么俏皮"
2005,"皇上在他面前好轻松好开心没有所谓的规矩"
2006,"皮一下好开心"
2006,"一集一集慢慢看，在重看，感觉令妃好厉害👍"
2006,"皇上的肚子是认真的吗"
2006,"高可爱快来"
2006,"要虐卫龙了？没事啊，我们傅璎也是有多甜就有多虐😂"
2006,"本宫的脖子怕是陛下掐长的"
2007,"多可爱的五斤盐啊"
2007,"本宫看你们很久了"
2007,"这个光头是认真的吗"
2007,"我出来我自己都害怕"
2007,"要是大玉儿在的话就活了"
2007,"一个令三岁，一个乾三岁"
2008,"只爱傅璎，你个大猪蹄子咸猪手拿开"
2008,"我可真厉害"
2008,"大猪蹄子也是挺可爱的"
2008,"等着本宫马上要上线了"
2008,"黄桑说太多了"
2008,"主角演技在进步"
2009,"有没发现令妃像吉娃娃就是因为眼睛大"
2009,"这部剧有多甜就有多虐"
2009,"大猪蹄子，好可爱呀"
2009,"我劝你得体"
2009,"璎珞厉害厉害"
2009,"等着本宫马上要上线了"
2010,"这个演员就是要演出装可爱的感觉"
2010,"大胆！后宫不得干政！"
2010,"皇兒也有可愛的一面呦[愉快]"
2010,"我媳妇真机灵。"
2010,"小姑娘演成这样真的不错了。"
2010,"哼！你们一点都不甜！"
2011,"刷人名的文明点行吗，要点儿脸吧"
2011,"没有办法，俺就是这么强大！"
2011,"卫龙大旗举起来"
2011,"男人都是大猪蹄子"
2011,"哈哈哈哈头上又带多肉"
2011,"我怎么只有两个耳环"
2012,"感觉吴谨言跟聂远演戏有点放不开"
2012,"看我绿不绿"
2012,"哈哈哈大猪蹄子太可爱了"
2012,"皇上胸口的龙是认真的吗？"
2012,"就是穿着龙袍也不像太子"
2012,"男人都是大猪蹄子"
2013,"朕脑壳一紧，觉得事情没那么简单"
2013,"诶呀妈呀，脑瓜疼，脑瓜疼，脑瓜疼"
2013,"大猪蹄子也太可爱了吧"
2013,"你俩这么嗨，璎珞，还报不报仇了"
2013,"每次看卫龙就觉得好尬"
2013,"cp我好出戏啊？"
2014,"哎呀妈呀，脑阔疼！看到大猪蹄子脑阔疼"
2014,"朕好开心啊"
2014,"扛起利落大旗"
2014,"还有人记得我吗？"
2014,"他们俩好甜啊"
2014,"我一直在吃避子药💊"
2015,"穿越剧看多了以后要真的穿了，照葫芦画瓢会不会死更早"
2015,"本宫养的两个大猪蹄子在一块儿了"
2015,"如果傅恒娶了璎珞我该有多高兴啊"
2015,"朕的秃头摸着真不错"
2015,"朕好开心啊"
2015,"还有人记得我吗？"
2016,"可人是你选派的啊，选了个无能的人去赈灾，是皇上的错"
2016,"嘻嘻嘻你能拿我怎么样鸭"
2016,"头上的发簪是多肉吗😂"
2016,"晚上没有蚊子咬你们吗"
2016,"哼，大猪蹄子"
2016,"想不想我啊"
2017,"就俩耳环了额乾隆你个大猪蹄子"
2017,"马上让你舒服"
2017,"高可爱走的第10天，想她想她"
2017,"大猪蹄子💃"
2017,"为什么叫大猪蹄子呀"
2017,"嗯说那么多她还不是死了吗？"
2018,"光绪长得很帅"
2018,"明天就要领盒饭咯好开心哦"
2018,"为什么要叫他大猪蹄子"
2018,"乾隆：俺是个大猪蹄子"
2018,"姜义是个大猪蹄子"
2018,"我吃了避孕药你们不要再讨论我怎么还没有孩子啦"
2019,"张铎你个大猪蹄子你什么时候也看到这里啊"
2019,"大猪蹄子本宫要抱抱举高高"
2019,"省了一个人的衣服钱，魏婴洛穿的衣服全是富察容音的"
2019,"龙龙好可爱"
2019,"受不了魏璎珞装可爱，一点也不可爱"
2019,"卫龙大旗不倒！"
2020,"emm，不知道说什么，就……大猪蹄子好可爱!"
2020,"有多甜就多虐"
2020,"要是富察还在多好啊"
2020,"爱是一道光，绿得你发慌。"
2020,"看到虐完更甜这句话我就放心了"
2020,"傅璎大旗永不倒"
2021,"呜呜呜傅璎女孩暴风哭泣呜呜呜傅璎大旗由我来扛！"
2021,"高可爱突然出现"
2021,"璎珞演技好高"
2021,"王少侠你个大猪蹄子"
2021,"这龙还蛮可爱的"
2021,"emm，不知道说什么，就……大猪蹄子好可爱!"
2022,"卫龙大旗举起来"
2022,"盒饭热好了吗"
2022,"记忆力真好，台词记那么多"
2022,"朕就是大猪蹄子咋滴"
2022,"大猪蹄子[得意][得意]"
2022,"马佳斌你个大猪蹄子"
2023,"大猪蹄子好可爱"
2023,"皇上那条龙的确有点可爱"
2023,"好甜，七夕的糖就是不一样😂"
2023,"白宗冰你个大猪蹄子😭"
2023,"左旭才是大猪蹄子！"
2023,"卫龙大旗举起来"
2024,"高贵妃哪可爱了要不是她推我阿哥能死吗醉了"
2024,"给皇上当演员可真累啊！天天装可爱"
2024,"大猪蹄子你这是龙还是猴"
2024,"你个大猪蹄子"
2024,"大猪蹄子你就想镇压是吧"
2024,"你们说女人像不像那个羊蹄子"
2025,"大猪蹄子你的龙是正经龙吗？"
2025,"大猪蹄子也来过节了"
2025,"觉得不甜的，你的直觉很准，这的确是璎珞的手段"
2025,"来啊快活啊皇上"
2025,"想看多点趣头条视频里看"
2025,"魏璎珞厉不厉害"
2026,"大虐之后必有大甜"
2026,"这个魏璎珞可真是好手段，真是气死本宫了，咚咚咚，毛手毛脚成何体统给本宫拉下去赏50大板"
2026,"大猪蹄子在里面好多细节都是演员自己加的，加了好多分"
2026,"大猪蹄子你果然把我忘了"
2026,"好可爱的龙啊绣的真好哈哈"
2026,"大猪蹄子也来过节了"
2027,"不想看顺嫔出来，让皇上跟令妃就这么甜下去吧"
2027,"想啃大猪蹄子"
2027,"以后避避子汤肯定会大闹"
2027,"都是大猪蹄子"
2027,"皇上衣服上的龙是认真的吗"
2027,"你这个大猪蹄子！"
2028,"头发上的配饰叫做绒花，是物质文化遗产"
2028,"皇上好可爱"
2028,"真想知道魏璎珞每次对皇上笑的是不是真的"
2028,"令妃好聪明"
2028,"还不是因为你不喜欢皇后，所以才保不住他父亲"
2028,"你们两个绿了我"
2029,"有木有人觉得吴谨言和陈意涵长得挺像的"
2029,"大猪蹄子真可爱"
2029,"这龙真的好阔爱"
2029,"大猪蹄子到底是什么梗"
2029,"无一人饿死也有可能是故意瞒报呀"
2029,"你们两个绿了我"
2030,"其实魏璎珞这样很戏精，不是真实的她"
2030,"高可爱来刷个存在感"
2030,"看来我辅助人头最多也是个错误"
2030,"纯妃妹妹，快点来吃盒饭，都准备好久了"
2030,"你们谁告诉我大猪蹄子是什么意思"
2030,"涂大宝大猪蹄子"
2031,"不得不承认世上有太多有用的坏人和无用的好人"
2031,"这就是你喜欢和珅的原因啊！"
2031,"说看起来不相爱的这俩本来就不相爱璎珞喜欢的是傅恒啊"
2031,"下来陪我过七夕"
2031,"那照你这个思想，容音也该死，没能力保护自己的孩子"
2031,"是不是把本宫忘了"
2032,"大猪蹄子是啥意思"
2032,"邹t本宫劝你善良"
2032,"朕龙袍上的龙是认真的吗"
2032,"只有本宫和皇上才是天生一对"
2032,"这就是你喜欢和珅的原因啊！"
2032,"下来陪我过七夕"
2033,"追了50多集，刷50多集的大猪蹄子，能不能换个词"
2033,"大猪蹄子陪我们过七夕"
2033,"怪不得留着和珅呢，和珅能力很强，很聪明"
2033,"傅璎大旗举起来！！"
2033,"皇上真的太聪明了流放既给力"
2033,"这个龙龙好可爱😊"
2034,"这难道就是有用的好人和无用的坏人吗"
2034,"哎，脑阔疼的厉害"
2034,"喜欢大猪蹄子"
2034,"盒饭可以热一热了"
2034,"姓陆的你个大猪蹄子👿"
2034,"佘诗曼好美"
2035,"突然发现跟风的好厉害。不懂大猪蹄子什么梗。也在发"
2035,"你们还聊！！本宫的阿玛都死的透透的了"
2035,"皇上不是白当的，只不过不愿意拆穿"
2035,"纯贵妃下集领盒饭了"
2035,"喜欢的演员又红了真好"
2035,"本宫肚子不争气啊"
2036,"这部剧不能从小局面来看，每个人说的话都符合他的个性"
2036,"大猪蹄子大猪蹄子"
2036,"演罗成的时候巨帅"
2036,"单身的人都在看本宫和大猪蹄"
2036,"接下来会有一个大虐了"
2036,"把盒饭🍱热好了等我"
2037,"小牟我劝你善良，七夕自己跑去玩"
2037,"女儿都是皇后了，也到了退休年龄，干嘛还要上班呢"
2037,"皇上好可爱"
2037,"朕的眉头演得好"
2037,"其他各地是怎么做的你怎么不和璎珞说清？"
2037,"尔晴我劝你善良"
2038,"流放，已是最大的仁慈"
2038,"快去給本宫热饭！"
2038,"龙袍是认真的"
2038,"喜欢皇后娘娘"
2038,"和珅，就是这样，虽然贪，但是作用很大！"
2038,"我什么时候领盒饭啊"
2039,"是因为皇上要摆架子啊所以你感觉他对璎珞感情是演出来"
2039,"大猪蹄子你是要吓死我吗"
2039,"令妃:好可爱"
2039,"本宫连吃盒饭的机会都没有"
2039,"太正直就是昏聩无能么"
2039,"本宝绿了，哇咔咔"
2040,"不想看顺嫔出来，让皇上跟令妃就这么甜下去吧"
2040,"七夕甜死你"
2040,"罗尹林你个大猪蹄子"
2040,"朕的龙朕的龙龙最可爱"
2040,"虐完也没什么甜的了"
2040,"朕是在为宠和珅找台阶下"
2041,"卫龙大旗永不倒，永不倒，永不倒"
2041,"本宫走后，你们活得挺滋润啊"
2041,"好喜欢这种成熟的爱恋"
2041,"冯文轩你个大猪蹄子！！！"
2041,"确认过眼神，都是单身的人"
2041,"快来看哦了解的人发呆"
2042,"哭着抗起傅璎大旗"
2042,"皇后黑化都怪你"
2042,"杨士康你个大猪蹄子"
2042,"什么时候放我出来啊"
2042,"朕演技太赞了，切换自如"
2042,"本宫走后，你们活得挺滋润啊"
2043,"皇上长得跟陆毅有点像"
2043,"我长得好没女人味啊"
2043,"龚静如你这个张飞我劝你善良"
2043,"皇上这回你开心了吧！"
2043,"注意看皇上胸前的图案，有谁看到了什么"
2043,"盒饭给我准备好，我马上来拿"
2044,"扛起卫龙大旗"
2044,"朕是吃可爱长大的"
2044,"身上的龙袍🐲怎么长得这么可爱啊，好出戏啊😄😄"
2044,"本宫饿了，什么时候领盒饭"
2044,"李文龙你个大猪蹄子"
2044,"都把我忘了吗？"
2045,"好可爱的这一对原来错过一个傅恒还有疼你的皇上"
2045,"水小猪你别睡了本宫命令你来看璎珞装可爱"
2045,"这剧中体面二字最多"
2045,"皇上好厉害"
2045,"不是说皇上要只能善用吗？"
2045,"大猪蹄子，想容音了吗"
2046,"田柾国你个大猪蹄子"
2046,"嘻嘻嘻想我了吗"
2046,"皇上发际线太高了"
2046,"还有谁记得我"
2046,"感觉配音变了呢"
2046,"Xll，本宫劝你善良！"
2047,"皇上其实说的有道理啊"
2047,"我好想领盒饭啊！盒饭热好了没有啊！"
2047,"套路好深啊"
2047,"就不能找个有气质点的人来演本宫嘛"
2047,"大猪蹄子。"
2047,"朕这句话内涵深刻啊"
2048,"所以说，没有那金刚钻，别揽瓷器活。"
2048,"皇上太可爱了。"
2048,"璎珞衣服大了"
2048,"大家想容音小可爱了吗😊😊"
2048,"公道何在天理何在"
2048,"皇上其实说的有道理啊"
2049,"微博上本来早就很流行大猪蹄子啊不是因为这部剧"
2049,"我真是美丽又大方"
2049,"朕的龙无敌可爱"
2049,"我哑巴吃黄连"
2049,"有多少人看过聂远演的上错花桥嫁对郎"
2049,"🙃泰国版都更完了你们信不信"
2050,"皇后面子好大啊"
2050,"大猪蹄子来也"
2050,"聂远演技太好了，完全圈粉～"
2050,"我为什么如此优秀"
2050,"你有佳人陪你走，我独拥浊风烈酒。"
2050,"咋子类还没生孩子"
2051,"魏璎珞:大猪蹄子在我面前装深沉"
2051,"我54集33:44分就去领盒饭。纯妃我帮你热盒饭哈"
2051,"太后包庇侄子怎么不说，只挑对自己有利的告诉别人"
2051,"朕是大猪蹄子"
2051,"朱腾逸你个大猪蹄子"
2051,"皇后面子好大啊"
2052,"皇上演技那么棒"
2052,"这就是太后娘娘杀阿玛的原因？"
2052,"龚静如我劝你善良"
2052,"我家媳妇耳环怎么又缺了一个！"
2052,"那尔布大人能力不足啊"
2052,"我准备领盒饭了"
2053,"好想吃大猪蹄子"
2053,"现在有多甜后面就有多…"
2053,"不现实。这种事不可能和妃嫔说"
2053,"傅璎大旗走起啊"
2053,"邹煜文你个大猪蹄子"
2053,"还有人记得本宫吗"
2054,"都开学了，没时间追剧了"
2054,"大猪蹄子真香"
2054,"跳起来一起嗨"
2054,"早知道你这么想，太后不拉仇恨好了"
2054,"你们主角都在"
2054,"00.24本宫还在看这个大猪蹄子"
2055,"来来来，说皇上杀得，你看明白，太后早了一步"
2055,"大家想好可爱了吗"
2055,"卫龙大旗举高高"
2055,"朕就是个大猪蹄子！"
2055,"就是多肉好吗"
2055,"皇上，还没送嫔妾七夕礼物呢"
2056,"要看就看聂远的倩女幽魂魔君七夜，那多过瘾啊，好酷"
2056,"想本宫了吗"
2056,"难道只有我一个人不觉得甜么，因为璎珞全是演的"
2056,"爱妃不理我"
2056,"不是做作是为了得宠为皇后报仇一切都是有原因的"
2056,"领盒饭的赶紧呐"
2057,"不知道大猪蹄子的可以从头看吗?"
2057,"想我高可爱了吗"
2057,"大猪蹄子，默默在这里刷剧"
2057,"我劝自己善良"
2057,"最喜欢大猪蹄子啦"
2057,"想本宫了吗"
2058,"这是聂远原声好吗"
2058,"林思琪能看到不"
2058,"周奕宏你个大猪蹄子"
2058,"你们想不想本宝宝了"
2058,"龚静如我劝你善良"
2058,"袖子上的小龙很可爱"
2059,"历史上的和珅很能干，外交能力更是超级强"
2059,"爱是一道光绿到你发慌"
2059,"你们都觉得甜，为什么我看起来感觉好做作"
2059,"猪蹄子可香了。"
2059,"你就是大猪蹄子"
2059,"这是聂远原声好吗"
2060,"看来自古忠诚没有好下场的"
2060,"朕可是人人都知得大猪蹄子"
2060,"容音大旗扛起来"
2060,"嬛嬛我劝你善良"
2060,"大猪蹄子你的蹄子放哪了"
2060,"男人都是大猪蹄子七夕都没有礼物的吗"
2061,"你就是你和你父亲雍正没有本质的区别"
2061,"大猪蹄子不早了"
2061,"这个皱眉，哟！还不高兴了呢真难伺候"
2061,"看我这么可爱，一看就不会"
2061,"储开网大猪蹄子你有在看吗？"
2061,"太后要被留灯了"
2062,"太后就是目光短浅啊皇上想的多好一举两得"
2062,"季国庆是个大猪蹄子"
2062,"大猪蹄子好可爱啊，哈啊哈"
2062,"我这么美块让我出来啊"
2062,"你们能不能别老是说什么东西演得好，什么耳环啊，胡子"
2062,"我才出去了两三年，璎珞就把我绿了！"
2063,"胸前的龙好可爱呀"
2063,"不，你是大猪蹄子"
2063,"曾川你个大猪蹄子你看到了吗"
2063,"看来在这看的都是单身狗哈哈哈"
2063,"陈润苏你这个大猪蹄子"
2063,"我饿了要吃盒饭"
2064,"大猪蹄子啥都会啊"
2064,"一个人过七夕，有更多的追剧情人可以选择，😄"
2064,"我家牛哥也是大猪蹄子！🤭"
2064,"感觉不是太后杀的"
2064,"皇上什么时候去大明湖畔啊，夏雨荷等着你啊"
2064,"璎珞你忘了问吗"
2065,"嬛嬛是人狠话不多"
2065,"我高可爱要出来作妖了"
2065,"七夕礼物七夕礼物，你们有完没完，我一单身🐶"
2065,"一晚上全是送命题……还好老娘机智"
2065,"杨显晨。你要善良"
2065,"啊v大猪蹄子！你变了！你把我忘了！"
2066,"你这直画唬的大猪蹄子一愣一愣的"
2066,"本宫乏了，过会在看大猪蹄子"
2066,"高可爱等着纯妃一起吃火锅"
2066,"大猪蹄子可爱的很"
2066,"大智慧的乾隆，聂远拿捏的到位。"
2066,"陈世亮你个大🐷蹄子"
2067,"死的不是璎珞他爹说的轻巧，如果害死了他爹肯定恨死呢"
2067,"哎大猪蹄子也有很多的不得已阿"
2067,"皇上给他讲这么多秘密好吗"
2067,"求生欲可以说很强了"
2067,"卫龙大旗摇起来"
2067,"导演是不是把我忘了？我什么时候上场？"
2068,"杀的是你姐姐理由也为了大局我看你还说得出这些话"
2068,"本宝宝怎么还没出场？难道盒饭给我热好？"
2068,"都是大猪蹄"
2068,"本妃年轻的时候也很皮"
2068,"张先生，你个大猪蹄子"
2068,"朕就是这么可爱"
2069,"聂远超帅，男人味十足，比小鲜肉强100倍"
2069,"朕肚子好大"
2069,"好快呀，还没看呢就快完了"
2069,"璎珞一笑我鸡皮疙瘩都起了"
2069,"倪思宇是个大傻子"
2069,"好喜欢自己呀"
2070,"大七夕的看他们秀心里居然还很高兴"
2070,"皇上，您难道忘记高可爱了吗？"
2070,"看惯了两倍换成正常感觉莫名其妙…"
2070,"本宫什么时候才能出来啊"
2070,"朱俊本宫劝你善良"
2070,"聂远超帅，男人味十足，比小鲜肉强100倍"
2071,"我就喜欢看悦"
2071,"你的富察皇后就是完人"
2071,"我劝你善良"
2071,"今天是本宫的头七"
2071,"魏璎珞太双标了，如果死的是她的至亲，她早复仇了"
2071,"五十四集领盒饭"
2072,"跟大猪蹄子一起总是那么作，跟傅恒才是真实的她"
2072,"大猪蹄子，还是我最懂你吧"
2072,"只愿君心似我心，定不负相思意"
2072,"别忘了今天是七夕"
2072,"富查皇后死了，剧情都变得没吸引力了"
2072,"快来杀我啊"
2073,"有容音就是世间唯一的完人没见过比容音更好的人了"
2073,"我看着你们很久了"
2073,"求生欲可以说很强了"
2073,"我真是太神了。"
2073,"这个亭子去真是太惬意了"
2073,"快放我出来！！！"
2074,"就说为了大局着想就好了，为什么还要说那么多理由"
2074,"皇上太阔爱了"
2074,"大猪蹄子给自己找这么多理由"
2074,"朕开两倍也嫌慢"
2074,"别个自封的十全老人好不"
2074,"怎么还没到我"
2075,"大猪蹄子梗不是早就有了？？不是这个剧吧"
2075,"胡文清，我劝你善良"
2075,"主角咋说咋有理，这要是令妃的爹试试"
2075,"我咋还没出来呢，我都等不及了"
2075,"好甜啊，又有点齁"
2075,"我就是秦岚"
2076,"哇噻好甜哦"
2076,"皇上其实是一个薄情的人，从他对容音就可以看出"
2076,"倪思宇是个大傻子"
2076,"本宫的盒饭备好了吗"
2076,"小哥哥都是陪小姐姐看这部剧的"
2076,"好甜啊，又有点齁"
2077,"好大的太阳"
2077,"我可真会说"
2077,"那是你岳父，你当然不能杀"
2077,"完犊子的人"
2077,"对面的宫墙都露馅了"
2077,"想我吗，艾维巴蒂"
2078,"纯妃叫静好"
2078,"傅璎大棋永不倒"
2078,"付樱大旗永不倒"
2078,"我爱大猪蹄子"
2078,"二倍好魔性啊"
2078,"我可真会说"
2079,"大脑壳我劝你善良"
2079,"还是我可爱"
2079,"这个也埋下伏笔，她选择入宫为妃就绝不回头，所以不会和傅恒私奔"
2079,"本宫是完人"
2079,"陈韦旭你个大猪蹄子"
2079,"啊洗吧我咋能那么快吃盒饭呢？😭😭😭"
2080,"所以这就是魏姐的强大之处了，她是最适合皇上的人"
2080,"你们两个在一起过七夕了是吧"
2080,"哈哈二倍速度看着不错"
2080,"我用1.5倍也不错"
2080,"不跟皇上在一起的璎珞才比较真实"
2080,"大脑壳我劝你善良"
2081,"大猪蹄子和大醋坛子的约会"
2081,"所以我才说可惜她不是个男人啊"
2081,"说得好最后大清亡了看看溥仪的下场痛快"
