time,content
1408,"叮咚,琥珀你的盒饭到了"
1408,"劝你善良这梗来自哪里？"
1408,"猪蹄子还有五秒钟将到达战场，琥珀请做好心理准备！"
1409,"大猪蹄子最帅气的一次"
1409,"琥珀就是嫌自己过得太久了"
1409,"朕还有2秒带着大猪蹄子到达现场"
1409,"哈哈哈踢得好跟我斗"
1409,"就喜欢大猪蹄子踢人"
1409,"琥珀还没领盒饭后边还有她的戏份呢而且还很关键"
1410,"请做好准备，大猪蹄子还有3秒到达站成"
1410,"大猪蹄子，你媳妇儿被欺负了，你！快！来！"
1410,"返回了重看那一脚给力"
1410,"皇上踢得好"
1410,"大猪蹄子超给力，回放回放哈哈😄"
1410,"大猪蹄子最帅气的一次"
1411,"不多不多，也就倒回来看了四五遍吧"
1411,"回看大猪蹄子替我教训她"
1411,"这一脚踢的好酷呀"
1411,"皇上踢得好"
1411,"请做好准备，大猪蹄子还有3秒到达站成"
1411,"返回了重看那一脚给力"
1412,"大猪蹄子你来的可真巧"
1412,"敢欺负朕的女人，不想活了吧"
1412,"回头看了几遍，一脚踢的过瘾，感觉皇上才做了一件对事"
1412,"前方高能预警😂😂😂😂😂给大猪蹄子加鸡腿"
1412,"那谁，快来领盒饭，已经热好了"
1412,"回看大猪蹄子替我教训她"
1413,"踢她这段我看了两遍好过瘾哈哈"
1413,"胆子挺大的，朕的人你也敢欺负。拖出去杖责四十"
1413,"忍不住倒出去看多几次皇上那一脚"
1413,"皇上，动作要帅，速度要快"
1413,"这部剧的奴才比主子厉害"
1413,"大猪蹄子，这脚踹的太给力了！"
1414,"大猪蹄子脸疼不疼"
1414,"好大的胆子本宫的人也敢动"
1414,"我就说她咋这么安分，原来憋大的"
1414,"大猪蹄子快点来，有人欺负你媳妇儿"
1414,"大猪蹄子，这脚踹的太给力了！"
1414,"忍不住倒出去看多几次皇上那一脚"
1415,"来来来琥珀盒饭热好了"
1415,"爱听墙角的大猪蹄子"
1415,"不高兴我就踢～大猪蹄子"
1415,"你的大猪蹄子再次突然出现"
1415,"琥珀的便当热好了对吧！"
1415,"大猪蹄子脸疼不疼"
1416,"哈哈哈，大猪蹄子来的好"
1416,"各位观众请倒回去多看几遍看朕踹的帅不帅"
1416,"特意回来重新看了一遍，大猪蹄子那一脚解气"
1416,"大猪蹄子踹你一蹄子，看你还敢不敢欺负我媳妇"
1416,"这一脚踢的真好。。。忍不住退回来又重复看一遍"
1416,"看我大猪蹄子踹死琥珀，把她里面的虫儿踢出来，哼！！"
1417,"返回重看了好几遍这一脚真给力啊大猪蹄子"
1417,"让你们看看什么是大猪蹄子哈"
1417,"厉害厉害！论心机我只服魏璎珞"
1417,"大猪蹄子来的真是时候"
1417,"回看回看过瘾"
1417,"大猪蹄子心疼了"
1418,"偶哟大猪蹄子来送盒饭了踹得好忍不住多看了几次"
1418,"这大猪蹄子真得劲儿"
1418,"琥珀这个演员脸好大啊"
1418,"这不能赖我，这脚不听话，走着走着就来这了"
1418,"让你们看看什么是大猪蹄子哈"
1418,"大猪蹄子来的真是时候"
1419,"太快了倒回来放慢看多几次哈哈"
1419,"琥珀圈踢美不美？就问你抗不抗揍就完了"
1419,"厉害了时机算的真准"
1419,"倒回来多看几遍"
1419,"倒回来又看一遍很过瘾就是这么简单😂"
1419,"退回来再看一次哈哈哈"
1420,"回来重新看这段过瘾痛快爽极了"
1420,"领盒饭了领盒饭了热乎的盒饭"
1420,"大猪蹄子赔我面膜"
1420,"大猪蹄子，我不在，璎珞交给你了"
1420,"这段循环3遍，这是这么多天来，最解气的一段了"
1420,"厉害了时机算的真准"
1421,"这大马脸女人又虎背熊腰的也能带资进组吗？表示怀疑。"
1421,"踢太快没见到，大猪蹄子再踢一次"
1421,"鬼知道我大猪蹄子看了几编"
1421,"领盒饭了领盒饭了热乎的盒饭"
1421,"大猪蹄子赔我面膜"
1421,"这段循环3遍，这是这么多天来，最解气的一段了"
1422,"返回来再看一遍，大猪蹄子这次表现不错"
1422,"那一脚好解气哈哈哈哈哈哈本宫好开心"
1422,"皇上的腿厉害厉害"
1422,"大猪蹄子这一脚踹的好"
1422,"大猪蹄子的无影脚"
1422,"盒饭热一热"
1423,"大猪蹄子踢得好不是白叫的"
1423,"皇上脚好长丫"
1423,"大猪蹄子也有有蹄子用的一天哈哈哈哈"
1423,"返回来再看一遍，大猪蹄子这次表现不错"
1423,"那一脚好解气哈哈哈哈哈哈本宫好开心"
1423,"皇上的腿厉害厉害"
1424,"大猪蹄子这回真给力!!!"
1424,"大猪蹄子这一脚踹得好"
1424,"从来没有觉得皇上如此帅过"
1424,"大猪蹄子你有用了"
1424,"皇桑踢的好"
1424,"皇上脚好长丫"
1425,"特地倒回来多看几遍大猪蹄子太男人了"
1425,"这大猪蹄子踢的好啊"
1425,"这个剧就是这么过瘾一会儿一过瘾"
1425,"这一脚不论是力度还是角度，踢的都是极好的"
1425,"大猪蹄子这回真给力!!!"
1425,"大猪蹄子这一脚踹得好"
1426,"老娘觉得大猪蹄子好可爱"
1426,"大猪蹄子抬起了他的大猪蹄子给了琥珀一个大猪蹄子"
1426,"哈哈哈哈哈哈哈哈好大猪蹄子这一脚可以可以"
1426,"特地倒回来多看几遍大猪蹄子太男人了"
1426,"朕这就让你尝尝朕的大猪蹄子"
1426,"这个剧就是这么过瘾一会儿一过瘾"
1427,"哈哈才知道大猪蹄是哈哈才知道大猪蹄是这样来的"
1427,"笑死我了，大猪蹄子，有觉悟不错不错"
1427,"大猪蹄子就喜欢起脚踹"
1427,"捣鼓看了好多遍！哈哈！大猪蹄子就是厉害！"
1427,"老娘觉得大猪蹄子好可爱"
1427,"从来没觉得大猪蹄子踢人这么痛快过"
1428,"大猪蹄子这一蹄子帅爆了"
1428,"大猪蹄子踹的好，一百零一分，多一分拿去骄傲！"
1428,"太好了太好了踢得好太帅的霸王脚"
1428,"琥珀领盒饭去吧盒饭热好了"
1428,"大猪蹄子总算做了件叫人解气的事儿"
1428,"让你尝尝大猪蹄子的厉害"
1429,"璎珞怎么算好皇上会啥时候来的"
1429,"从门外到这里这么远，大猪蹄子腿真长呀"
1429,"李玉玉好可爱：来人啊！把她拖下去"
1429,"大猪蹄子这一蹄子帅爆了"
1429,"大猪蹄子踹的好，一百零一分，多一分拿去骄傲！"
1429,"让你尝尝大猪蹄子的厉害"
1430,"大猪蹄子的大猪蹄子真利索"
1430,"哟这碗质量真好给朕备好"
1430,"皇上的脚好长，门槛外就能踢到"
1430,"大猪蹄子，我觉得你踢得好"
1430,"大猪蹄子，你这一脚踹得好"
1430,"李玉玉好可爱：来人啊！把她拖下去"
1431,"这可是大猪蹄子的一脚可疼啦哈哈哈猪蹄子没白当"
1431,"我看你是不想活了，敢欺负我媳妇儿！"
1431,"解气，这大猪蹄子可算是让我满意了一回"
1431,"哈哈哈哈哈，大猪蹄子这一脚踢得好！！"
1431,"大猪蹄子好给力"
1431,"朕的大猪蹄子厉害吗？"
1432,"这个大猪蹄子走进来好霸气，痞痞的"
1432,"大猪蹄子大男子主义呀"
1432,"魏璎珞：大猪蹄子你来啦，踹的好啊哈哈哈"
1432,"大猪蹄子这一脚帅爆啊"
1432,"解气，这大猪蹄子可算是让我满意了一回"
1432,"朕的大猪蹄子厉害吗？"
1433,"大猪蹄子太棒了！者一口气出的好！"
1433,"碗掉地上也没见粥撒地上，好神奇"
1433,"大猪蹄子对女人温柔点"
1433,"这个大猪蹄子走进来好霸气，痞痞的"
1433,"霸气，大猪蹄子大霸气了！"
1433,"魏璎珞：大猪蹄子你来啦，踹的好啊哈哈哈"
1434,"大猪蹄子这一蹄子帅爆了"
1434,"让你尝尝大猪蹄子的厉害"
1434,"大猪蹄子干的好干的好"
1434,"大猪蹄子这脚踹的好"
1434,"大猪蹄子这一刻帅毕了"
1434,"帅啊大猪蹄子"
1435,"大猪蹄子厉害死你了"
1435,"大猪蹄你好好对我璎珞不然我就把你带走"
1435,"这个大猪蹄子最近变厉害了"
1435,"大猪蹄子干的好干的好"
1435,"大猪蹄子这一蹄子帅爆了"
1435,"大猪蹄子这脚踹的好"
1436,"哈哈哈看了两遍真解气大猪蹄子踢得好"
1436,"不愧是大猪蹄子，这一脚够生猛的…嫔妾都吓懵了"
1436,"大猪蹄子来的好及时"
1436,"大猪蹄子厉害死你了"
1436,"大猪蹄子踹死你，让你说我媳妇！"
1436,"这个大猪蹄子最近变厉害了"
1437,"大猪蹄子的名义不是白叫的，这一脚带劲了"
1437,"大猪蹄子，这个小浪蹄子欺负本宫得女人快给她发盒饭"
1437,"大🐷蹄子踢得好踢得妙踢得呱呱叫"
1437,"我这大猪蹄子还挺有用"
1437,"好样的大猪蹄子你可算是保护了璎珞一次"
1437,"哈哈哈看了两遍真解气大猪蹄子踢得好"
1438,"璎珞也太厉害了，算准了大猪蹄子会来，故意引琥珀这样说话"
1438,"大猪蹄子总算做了一件人事"
1438,"大猪蹄子没白叫，这脚不错"
1438,"大猪蹄子的名义不是白叫的，这一脚带劲了"
1438,"大猪蹄子，这个小浪蹄子欺负本宫得女人快给她发盒饭"
1438,"我这大猪蹄子还挺有用"
1439,"大猪蹄子好厉害啊，没白练"
1439,"朕的大猪蹄子可不是白叫的"
1439,"大猪蹄子真是猪蹄子这一飞脚霸气侧漏"
1439,"大猪蹄子的正确使用方法哈哈哈哈哈"
1439,"大猪蹄子没白叫，这脚不错"
1439,"大猪蹄子来的真及时"
1440,"领盒饭咯领盒饭咯好开心呐"
1440,"这一脚踹的真让本宫开心呀哈哈哈"
1440,"大猪蹄子不是白喊的呢"
1440,"给锦绣做伴去吧，哦不，锦绣已经领盒饭了"
1440,"大猪蹄子踢得好"
1440,"没要了你的命算好的了"
1441,"哈哈哈哈，第一次觉得大猪蹄子这么帅"
1441,"大猪蹄子来的正是时候本宫早就看她不顺眼了"
1441,"踢这一脚看得我好开心啊哈哈哈"
1441,"刚热的盒饭烫嘴你也得给老娘吃"
1441,"盒饭领的好快"
1441,"没要了你的命算好的了"
1442,"原来大猪蹄子是这么来的好蹄子"
1442,"朕的大猪蹄子可还好"
1442,"大猪蹄子的正确使用方法"
1442,"刚热的盒饭烫嘴你也得给老娘吃"
1442,"哈哈哈哈，第一次觉得大猪蹄子这么帅"
1442,"踢这一脚看得我好开心啊哈哈哈"
1443,"大猪蹄子难得那么帅"
1443,"辛者库都是一群得罪过的人，这样一群人在一起好么"
1443,"这不是一般的大猪蹄子啊"
1443,"你的盒饭已热好"
1443,"敢动我媳妇儿，我看你是不想活了"
1443,"这蹄子踢得看得好过瘾"
1444,"大猪蹄子，给力，话说为什么叫大猪蹄子"
1444,"盒饭已经给你热好了！没鸡腿加"
1444,"还是这个大猪蹄子可爱"
1444,"琥珀跟你的娇臀说再见吧"
1444,"你的盒饭已热好"
1444,"这不是一般的大猪蹄子啊"
1445,"琥珀你已被大猪蹄子踢出群聊"
1445,"谁准你这么跟朕的女人说话，领盒饭去"
1445,"大猪蹄子厉害"
1445,"练了这么久，就为这帅气的出场～哈哈哈"
1445,"大猪蹄子，你有几套龙服啊"
1445,"琥珀我劝你善良"
1446,"这么快饭盒就好了，虎破叫你善良不听这下可好"
1446,"大猪蹄子的猪蹄子踢人真厉害👍"
1446,"这个角度看像皇上拿了个公公拿的白毛毛"
1446,"敢欺负朕的女人，给你一脚算轻的了"
1446,"琥珀你已被大猪蹄子踢出群聊"
1446,"琥珀我劝你善良"
1447,"动作要快，姿势要帅"
1447,"琥珀啊饭都给你热好了快去吧"
1447,"璎珞的套路深啊，琥珀该吃盒饭了"
1447,"大猪蹄子，给这个小浪蹄子一大猪蹄子"
1447,"大猪蹄子好棒"
1447,"敢欺负朕的女人，给你一脚算轻的了"
1448,"乾隆：我这大猪蹄子还是很给力的"
1448,"笑死了大猪蹄子派上用场了"
1448,"这段多看了几次，踢得好"
1448,"动作要快，姿势要帅"
1448,"琥珀啊饭都给你热好了快去吧"
1448,"大猪蹄子咋就那么爱偷听呢"
1449,"大猪蹄子提起他的大猪蹄子给了琥珀一个大猪蹄子"
1449,"叫你作死惊不惊喜意不意外"
1449,"皇上的腿果真厉害👍专踢不听使唤的狗奴才！"
1449,"都说了叫你不要急，你怎么那么急呀？盒饭热乎着呢。"
1449,"哎呀，大猪蹄子踢的好啊"
1449,"开心开心开心"
1450,"大猪蹄子你这一脚太痛快了"
1450,"公公都感觉好高兴"
1450,"好搭夸夸你大猪蹄子帅帅哒"
1450,"朕的女人你也敢欺负，真是不想活了"
1450,"你的大猪蹄子名给撤了"
1450,"看盒饭八成熟了吧"
1451,"好怀念大猪蹄子踢"
1451,"朕不是大猪蹄子了吧"
1451,"琥珀的存在是为了给大猪蹄子机会哈哈哈"
1451,"大猪蹄子你这一脚太痛快了"
1451,"公公都感觉好高兴"
1451,"好搭夸夸你大猪蹄子帅帅哒"
1452,"一个巴掌扇的好一个脚踢的好这要是打起来"
1452,"动作要快，姿势要帅"
1452,"顺妹妹我劝你善良点"
1452,"大猪蹄子厉害不"
1452,"琥珀的存在是为了给大猪蹄子机会哈哈哈"
1452,"这一段忍不住多看几遍"
1453,"琥珀被踢出去好远，原谅我毫不犹豫地笑出了猪叫"
1453,"打得好真解气"
1453,"踢得好，借别人的手来惩罚，自然也不会粘上自己的恶名"
1453,"敢欺负我不想活了"
1453,"自己什么段位都不清楚可怎么混的久"
1453,"大猪蹄子还是有点用的"
1454,"大猪蹄子这一脚踹的妙"
1454,"大猪蹄子好样的"
1454,"好男人不会让心爱的女儿人出手"
1454,"打得好真解气"
1454,"敢欺负我不想活了"
1454,"琥珀被踢出去好远，原谅我毫不犹豫地笑出了猪叫"
1455,"哈哈哈哈哈哈哈哈哈太开心了大猪蹄子男友力十足"
1455,"大猪蹄子打的好"
1455,"哈哈哈这一脚踢的那叫一个爽啊大猪蹄子，踢的好😏"
1455,"大猪蹄子开始护妻了"
1455,"大猪蹄子好样的"
1455,"李公公演的好"
1456,"好厉害，璎珞好厉害，大猪蹄子你又被套路了你知道吗"
1456,"就问你们惊不惊喜，意不意外，刺不刺激鸭等着领饭盒吧"
1456,"贵人走过最长的路就是您的套路，真行啊"
1456,"盒饭热好了快去吃吧"
1456,"哈哈哈哈哈哈哈哈哈太开心了大猪蹄子男友力十足"
1456,"大猪蹄子棒棒哒"
1457,"帅啊，大猪蹄子，是大猪蹄子本蹄了！"
1457,"大猪蹄子这一脚无论从力度还是角度来看都很不错哦"
1457,"好大猪蹄子棒"
1457,"好厉害，璎珞好厉害，大猪蹄子你又被套路了你知道吗"
1457,"贵人走过最长的路就是您的套路，真行啊"
1457,"盒饭热好了快去吃吧"
1458,"李玉在说拖下去的时候好可爱"
1458,"看我可爱不？敢欺负我媳妇！不想活了"
1458,"喂！喂！慢慢地去啊！盒饭还有100多份没热好呢！"
1458,"本宫觉得大猪蹄子看清楚自己的心了"
1458,"大猪蹄子这一脚无论从力度还是角度来看都很不错哦"
1458,"李玉的手指指的好可爱"
1459,"李玉不是个简单的人物！皇上真不到首领太监都太聪明了"
1459,"臣妾的大猪蹄子这一脚真是真材实料大猪蹄子用踢的"
1459,"为什么真么多人叫皇上大猪蹄子"
1459,"你不是厉害嘛？？？？来让我看看你有多厉害"
1459,"李玉在说拖下去的时候好可爱"
1459,"大猪蹄踢得好"
1460,"李玉说的最多的是来人啊，拖下去"
1460,"琥珀，敢欺负大猪蹄子的媳妇，你是准备领盒饭吧！"
1460,"大猪蹄子脚都踢疼了"
1460,"大猪蹄子给力了"
1460,"大猪蹄子还是实力护妻呢"
1460,"大猪蹄子的蹄子好厉害"
1461,"不愧是大猪蹄子，真有劲儿"
1461,"不错不错，我真聪明，我动不了你那就交给皇上吧"
1461,"公公好开心的样子"
1461,"不错不错妹妹有进步"
1461,"李玉说的最多的是来人啊，拖下去"
1461,"琥珀，敢欺负大猪蹄子的媳妇，你是准备领盒饭吧！"
1462,"大猪蹄子不错不错"
1462,"大猪蹄子你护短的样子真可爱"
1462,"李玉一听到要打就开心到起飞"
1462,"朕的大猪蹄子好久没踹人了，是你自己撞上来的"
1462,"因为他总用脚踹人，所以叫大猪蹄子"
1462,"呵呵，本宫没让你领盒饭就是好的了"
1463,"大猪蹄子可算懂事一回了"
1463,"朕的大猪蹄子喘得舒服不"
1463,"饶不了，大猪蹄子有帝王王八之气"
1463,"大猪蹄子你护短的样子真可爱"
1463,"朕的大猪蹄子好久没踹人了，是你自己撞上来的"
1463,"大猪蹄子不错不错"
1464,"大猪蹄子踢的好太解气了哈哈哈哈"
1464,"朕这一脚，大猪蹄子的帽子是摘不掉喽嘻嘻"
1464,"大猪蹄子踢得好解气"
1464,"朕的大猪蹄子喘得舒服不"
1464,"这一脚踢的好过瘾啊"
1464,"大猪蹄子可算懂事一回了"
1465,"这璎珞也是神了，就算准了不早不晚几句话正好被听见"
1465,"劝你善良你不听真是杠精。"
1465,"打的好，打得妙。打的琥珀呱呱叫"
1465,"大猪蹄子踢的好太解气了哈哈哈哈"
1465,"朕这一脚，大猪蹄子的帽子是摘不掉喽嘻嘻"
1465,"傅璎女孩莫名觉得好甜"
1466,"提的好，踢得好，提的好，踢得好哈哈啊哈哈哈很舒服"
1466,"一听说要打李玉开心到飞起"
1466,"这是整部戏里盒饭上的最快的人"
1466,"大猪蹄子踢的好，今晚就奖励你一下"
1466,"哇塞大猪蹄子帅"
1466,"打的好，打得妙。打的琥珀呱呱叫"
1467,"怎么可能救你，你是纯贵妃派来的细作以为令妃不知道？"
1467,"大猪蹄子表现不错"
1467,"打得好，节气呀，大猪蹄子做得好"
1467,"哈哈哈这一段看得舒服舒服痛快痛快"
1467,"一听说要打李玉开心到飞起"
1467,"我就是吃可爱长大滴，耶"
1468,"大猪蹄子，你这好腿啊，果然平时没少拿李玉练"
1468,"朕大猪蹄子不是白叫的"
1468,"大猪蹄子这一脚踢的好过瘾"
1468,"大猪蹄子的正确使用方法"
1468,"打得好打得妙打得琥珀呱呱叫"
1468,"大猪蹄子还挺厉害"
1469,"本宫又看了一遍，大猪蹄子做得好"
1469,"大猪蹄子做了一件好事啊开心1"
1469,"估计是算好皇上要来，故意让琥珀伺候。"
1469,"大猪蹄子，你这好腿啊，果然平时没少拿李玉练"
1469,"朕大猪蹄子不是白叫的"
1469,"高兴开心啦啦啦啦啦啦真是舒坦啊"
1470,"好快的脚，看不见出脚，对方已倒下"
1470,"大猪蹄子算你还有一点良心。"
1470,"倒回去在看看皇上踹的那一脚！好过瘾哈哈"
1470,"大猪蹄子见谁都踹"
1470,"看得好过瘾啊"
1470,"本宫又看了一遍，大猪蹄子做得好"
1471,"每个成功的清宫剧都有一个可爱的太监总管😄"
1471,"大猪蹄子这回算你识相保护了本宫最亲爱的人"
1471,"大猪蹄子还阔以"
1471,"盒饭热好了，琥珀快吃吧"
1471,"盒饭热好了，快来吃吧！"
1471,"大猪蹄子见谁都踹"
1472,"让我欺负个人让你看看我多帅"
1472,"大猪蹄子踹了这么多脚，就这脚舒服"
1472,"皇上那个大猪蹄子真管用"
1472,"魏贵人算好了皇上要来"
1472,"大猪蹄子这一猪蹄子真解愤啊"
1472,"盒饭热好了，琥珀快吃吧"
1473,"看小说剧就是这样舒爽谁嘚瑟就让谁领盒饭"
1473,"亲爱的大猪蹄子来得真是时候～"
1473,"这个大猪蹄子好可爱啊"
1473,"表现不错，今天不叫你大猪蹄子了"
1473,"大猪蹄子踹了这么多脚，就这脚舒服"
1473,"魏贵人算好了皇上要来"
1474,"大猪蹄子的蹄子厉害，踢得好"
1474,"大猪蹄子还再试了试脚法哈哈哈哈哈哈太可爱了"
1474,"一看就是故意让大猪蹄子看到的"
1474,"看朕这一脚是多厉害，重放几遍才行"
1474,"大猪蹄子好酷"
1474,"你的盒饭热好了去吃吧"
1475,"皇上不是说出去走走？？走到偏僻的延禧宫去了，好巧啊"
1475,"盲僧开大了！盲僧开大了！"
1475,"原来大猪蹄子是这么来的！踹人踹出来的"
1475,"所以大猪蹄子还是很有用的"
1475,"大猪蹄子真是一不开心就喜欢踢人"
1475,"一看就是故意让大猪蹄子看到的"
1476,"本宫什么段位你还不清楚，我动不了手但大猪蹄子可以啊"
1476,"朕刚才是木不是很酷很帅呀"
1476,"大猪蹄子用大猪蹄子踢人了"
1476,"双标，猪蹄子打女人就那么开心，别人打女人就义愤填膺"
1476,"大猪蹄子踹的好，不愧是猪蹄"
1476,"所以大猪蹄子还是很有用的"
1477,"明白了大猪蹄子说的就是皇上的大蹄子"
1477,"本宫好久没出来作妖了盒饭领的太早了"
1477,"璎珞的段位不是一般人能企及的"
1477,"朕帅不帅酷不酷"
1477,"好过瘾好过瘾"
1477,"大猪蹄子用大猪蹄子踢人了"
1478,"大猪蹄子表现不错"
1478,"怪说不得叫皇上大猪蹄子呢哈哈"
1478,"大猪蹄子威武"
1478,"朕刚刚那脚帅不帅"
1478,"不是说只是出去走走吗大猪蹄子"
1478,"朕帅不帅酷不酷"
1479,"皇上这脚属实厉害"
1479,"好李玉看呐来人啊把他拖下去这可真亮"
1479,"这时间掐的好准啊"
1479,"大猪蹄子算你有良心"
1479,"大猪蹄的无影脚帅啊"
1479,"皇上这几年没见，你踹人踹的越发厉害了"
1480,"大猪蹄子这脚法不错啊"
1480,"套路好深啊"
1480,"大猪蹄子真威风"
1480,"为什么叫大猪蹄子"
1480,"皇上这脚属实厉害"
1480,"这时间掐的好准啊"
1481,"皇上踹了这么多脚就这一下我喜欢感觉格外帅"
1481,"哈哈哈哈大猪蹄子踢的好过瘾😂"
1481,"大猪蹄子的猪蹄子踢的真不错"
1481,"你看朕的太监可不可爱"
1481,"皇上的大猪蹄子厉害"
1481,"琥珀你个不中用的"
1482,"打的好，打的妙，打的青娃呱呱叫。."
1482,"早就劝你善良了，可你非是不听呢"
1482,"哈哈，大蹄子真可爱"
1482,"暂时的忍耐是为了将来的痛快，哼哼"
1482,"打得好，出了口恶气，呼～"
1482,"哈哈哈哈大猪蹄子踢的好过瘾😂"
1483,"聂远的大猪蹄子真是可爱"
1483,"这是到现在朕做的最有用的一件事"
1483,"盒饭热好了"
1483,"大猪蹄子本宫的套路溜不溜"
1483,"哈哈，大蹄子真可爱"
1483,"暂时的忍耐是为了将来的痛快，哼哼"
1484,"不愧大猪蹄子，踢人可真厉害"
1484,"皇上好可爱"
1484,"厉害厉害，成功激起了皇上的保护欲"
1484,"恭喜我当上贵人后喜提一血"
1484,"不愧是大猪蹄子，一踢一个准。"
1484,"盒饭热好了"
1485,"皇上踢人好可爱"
1485,"大猪蹄子，上钩了吧"
1485,"你个大猪蹄子算你还有点良心"
1485,"皇上您是盲僧吗？每次都一库"
1485,"恭喜我当上贵人后喜提一血"
1485,"不愧大猪蹄子，踢人可真厉害"
1486,"皇上怎么可以这么可爱，演技也太好了"
1486,"还不是为了你你个大猪蹄子"
1486,"大猪蹄子你这是感冒了吗？声音都变了"
1486,"你个大猪蹄子又被利用了"
1486,"皇上踢人好可爱"
1486,"要善良敲黑板"
1487,"好甜啊高举卫龙大旗"
1487,"大猪蹄子来得真及时"
1487,"大猪蹄子棒棒棒"
1487,"你就傲娇吧你个大猪蹄子！"
1487,"开心到飞起"
1487,"聂远演技真的是了不得太好了"
1488,"现在深刻理解什么是大猪蹄子了哈哈"
1488,"大猪蹄子真香"
1488,"为啥叫皇上大猪蹄子呀"
1488,"吓我一跳啊皇上"
1488,"大猪蹄子保护你来啦！"
1488,"好甜啊高举卫龙大旗"
1489,"李玉公公好可爱"
1489,"好想去踢国足哦"
1489,"谨言好瘦啊"
1489,"怎么还带着袁春旺送的簪子"
1489,"才发现耳朵上戴了那么多环儿(눈_눈)"
1489,"大猪蹄子真香"
1490,"还不是你折磨的最多"
1490,"为什么天天说大猪蹄子？说着说着我都想吃了"
1490,"大猪蹄子厉害嘛"
1490,"才知道来保护我啊！这一脚厉害呀！大猪蹄子"
1490,"好想去踢国足哦"
1490,"谨言好瘦啊"
1491,"大猪🐷蹄子这一脚踢得帅呆了"
1491,"大猪蹄子你才知道心疼我？？"
1491,"用脚拨开的一瞬间太可爱了好吗"
1491,"盒饭给你刚刚热的"
1491,"想高可爱了"
1491,"为什么天天说大猪蹄子？说着说着我都想吃了"
1492,"大猪蹄子总强调你是朕的啧啧啧"
1492,"男友力爆棚，大爱皇上，帅爆，么么哒"
1492,"皇上的脚好厉害"
1492,"你是朕的贵人咦，大猪蹄子"
1492,"用脚拨开的一瞬间太可爱了好吗"
1492,"想高可爱了"
1493,"去掉贵字多好听啊"
1493,"哇大猪蹄子好可爱"
1493,"我一直以为大猪蹄子就是咸猪手的意思呢"
1493,"男友力爆棚，大爱皇上，帅爆，么么哒"
1493,"大猪蹄子总强调你是朕的啧啧啧"
1493,"你是朕的贵人咦，大猪蹄子"
1494,"好甜啊好甜啊~傅缨倒向卫龙阵营"
1494,"朕好辛苦一直被套路"
1494,"唉呀妈呀头一回觉得大猪蹄子好可爱啊！！！"
1494,"大猪蹄子你吓我一跳"
1494,"朕的贵人，有木有出戏的感觉，感觉璎珞是皇上的恩人"
1494,"去掉贵字多好听啊"
1495,"真实好演技，如果是我这么出气怕是要憋不住笑出声了"
1495,"大猪蹄子的脚就是厉害！"
1495,"大猪蹄子这一脚踹的好"
1495,"好甜啊，皇上撒糖了"
1495,"啧啧啧非要加个朕的大猪蹄子暴露了"
1495,"好甜啊好甜啊~傅缨倒向卫龙阵营"
1496,"左口一个朕的又口一个朕的好甜"
1496,"大猪蹄子踢得好"
1496,"听着好感动，又掉眼泪了"
1496,"好甜啊，皇上撒糖了"
1496,"真实好演技，如果是我这么出气怕是要憋不住笑出声了"
1496,"大猪蹄子这一脚踹的好"
1497,"大猪蹄子说的就是皇上爱踹人"
1497,"想我高可爱了么"
1497,"哈哈哈哈，看着好痛快呀！大猪蹄子威武"
1497,"大猪蹄子，喜欢就直说啊，哈哈"
1497,"看皇上踹人太过瘾"
1497,"左口一个朕的又口一个朕的好甜"
1498,"大猪蹄子问为什么要叫我大猪蹄子哈哈哈"
1498,"我啥时候成大猪蹄子咯，见识到朕的厉害了吧"
1498,"璎珞的这件衣服好眼熟，是不是里面哪个人物穿过的？"
1498,"大猪蹄子，这一脚深得我心啊"
1498,"倒回去看了好几次踢的那脚，心里平衡多了"
1498,"大猪蹄子讲一库"
1499,"皇上好可爱，表情很到位"
1499,"大猪蹄子打的好"
