time,content
1941,"这锅太重。我不能背"
1942,"富恒的戏能不等多点看她们都看腻了"
1942,"信了就是大猪蹄子"
1942,"舒贵人长了一张不讨喜的脸"
1942,"来人，赏她一仗红"
1942,"她要信了人设就崩了，不可能会信的，信也是假装信"
1942,"都怪我长得太帅"
1943,"璎珞遇到姐姐的事就没那么聪明了"
1943,"事实证明辅助一定要选好"
1943,"舒贵人长得好像郑钧他媳妇啊"
1943,"你的智商去哪了媳妇"
1943,"舒贵人啥时候领便当"
1943,"天天让我背锅"
1944,"是不是纯妃误以为是傅恒，派人杀了她姐姐"
1944,"请叫我背锅侠"
1944,"你说嘴巴嘟嘟，嘟嘟嘟嘟嘟，嘟一下你就回来呀"
1944,"我那么可爱怎么会是我"
1944,"是舒贵人的眼袋还是卧蚕"
1944,"你的智商去哪了媳妇"
1945,"魏璎珞这么聪明的人不会真相信高贵妃和舒贵人的话吧"
1945,"盒饭已经准备好了"
1945,"大家别急，舒贵人的盒饭在煮了"
1945,"这两个大猪蹄子"
1945,"故事编的不得体"
1945,"是舒贵人的眼袋还是卧蚕"
1946,"舒贵人的下巴打得也太多了"
1946,"这舒贵人的眼袋怕是水喝多了😂"
1946,"舒贵人演技挺好啊"
1946,"贵人我劝你善良"
1946,"舒贵人跟璎珞姐姐是一个人扮演的"
1946,"你们心机不纯"
1947,"璎珞不会相信善良的皇后会害人"
1947,"我相信皇后娘娘，皇后娘娘不是这样的人"
1947,"舒贵人，我劝你要善良"
1947,"媳妇没露脸不能证明是我"
1947,"知道了宫女进宫目的是这个就可以把她处置了"
1947,"要你为本宫做衣服"
1948,"穿衣打扮跟嘉嫔多像，没有好下场"
1948,"没得事我智商高得很"
1948,"嘴不大如何帮朕做些苟且之事"
1948,"本宫只是想让你做件戏服罢了"
1948,"贵妃，舒贵人什么时候领盒饭"
1948,"这个锅我不想背"
1949,"这么长时间相处的感情难道几句话就被颠覆了？"
1949,"给我拉出去砍了"
1949,"这目的明显的啊，这算计谋？"
1949,"背不动背不动"
1949,"一定是没信，就算信了也不会为贵妃所用"
1949,"穿衣打扮跟嘉嫔多像，没有好下场"
1950,"这个舒贵人和那个嘉嫔好像分不清"
1950,"媳妇，你这么聪明肯定不信哈！"
1950,"舒贵人长的好像宋茜！"
1950,"快让我出来帮你璎珞"
1950,"舒贵人啥时候死，这声音真让人受不了"
1950,"给我拉出去砍了"
1951,"舒贵人后面的丫鬟戏真多"
1951,"看了这么多集还是想说高贵妃牙齿好白好整齐"
1951,"舒贵人我劝你善良"
1951,"大胆！！！敢说本宫？是不想活了？"
1951,"舒贵人好尬啊"
1951,"其实我演技不错，就是得罪了化妆师"
1952,"看看快快快"
1952,"这腰带可真新，临时做的吧"
1952,"深宫心机好重"
1952,"这锅太大不能背，媳妇别相信他们"
1952,"所以高贵妃装都不装善良呀嘻嘻嘻嘻"
1952,"女人的嘴，骗人的鬼"
1953,"张嬷嬷以前不是说璎珞一遇到她姐姐的事就智商极速下降"
1953,"璎珞你不会真的要背叛本宫吧"
1953,"瞧这大眼袋鱼尾纹呵呵呵"
1953,"肯定没信啊，反将一军信不信"
1953,"发际线演得好"
1953,"在本宫背后编排本宫，是不是不要命了"
1954,"魏璎珞你既然聪明了这么多集我希望你现在也聪明"
1954,"每次都说舒贵人要领盒饭到底什么时候"
1954,"少爷好容易掉东西，掉了还不挂失"
1954,"竟敢把我当傻子，看我不憋个大招弄死你们俩"
1954,"舒贵人多久没睡了，眼袋那么大"
1954,"肯定没信啊，反将一军信不信"
1955,"好了不用说了，到时候你们整个储秀宫的人都凉凉"
1955,"不要信都是套路"
1955,"纯妃，有多不简单"
1955,"本宫出来透透气"
1955,"感觉不加上皇后还有可能信，加上皇后？还会信吗？"
1955,"噗嗤，你以为我媳妇会信吗？"
1956,"你知道人家端庄贤良的脸吃香，还打扮的跟老巫婆一样"
1956,"锅好重、背不下去了"
1956,"你也知道你长得不贤良吗"
1956,"高老太婆，我忍你很久了"
1956,"大猪蹄子是什么梗"
1956,"敌军还有五秒到达战场"
1957,"皇后:我本就长得端庄贤良，天生的，没办法嫉妒不来。"
1957,"那你你也没有那张端庄贤良的脸阿"
1957,"这么明显的嫁祸看不出来吗？不是很聪明的吗！"
1957,"哟哟哟!宁馨儿你好厉害！来来来皇后给你当!"
1957,"璎珞这么聪明，难道会信吗"
1957,"锅好重、背不下去了"
1958,"你有端庄娴良的脸也行啊"
1958,"看来看去，还是高贵妃最是单纯小可爱"
1958,"第一次听说长得贤良的"
1958,"发际线认真的吗"
1958,"这么多集了，舒贵人盒饭麻烦热一下好不"
1958,"好吧，那我再陪你们玩一局。"
1959,"我非常想知道为什么坏人为什么没有端装贤良的脸"
1959,"清者自清，浊者自浊"
1959,"觉得高贵妃演的特别好"
1959,"宝宝你要相信为夫啊"
1959,"你也知道你长的不端庄啊"
1959,"你有端庄娴良的脸也行啊"
1960,"坏人长得确实情况"
1960,"高贵人我劝你善良"
1960,"夸张一个宫女胆子太大了，导演神剧吗"
1960,"谁叫你没长一张贤良淑德的脸"
1960,"如果只说少爷我还担心会信，但扯到皇后璎珞绝对不信"
1960,"舒贵人我劝你善良"
1961,"肯定不信啊，说少爷还好点，但说皇后娘娘坏话，璎珞还"
1961,"高贵妃和舒贵人的盒饭怎么还没热好"
1961,"妈呀舒贵人笑得我头皮发麻笑得跟厉鬼一样"
1961,"我有什么办法就不能因为我帅诬陷我啊"
1961,"魏璎珞：我信你个大猪蹄子"
1961,"信是一回事，背叛做不到"
1962,"这书柜人和高贵妃看得我眼睛疼"
1962,"会不会是海兰茶啊跟傅恒关系好"
1962,"感觉有幕后啊？不是一般的宫廷剧情啊"
1962,"添油加醋的够了……这后面说的几句败笔"
1962,"御膳房准备好了你门的盒饭"
1962,"信是一回事，背叛做不到"
1963,"舒贵人是饭盒太好吃了？想来一碗？"
1963,"敢陷害我不想活了吗"
1963,"这个舒贵人活不过这两集"
1963,"高贵妃，不得体"
1963,"本宫是真的善良"
1963,"不听不听王八念经"
1964,"这样就相信的话，这编剧就玷污了魏璎珞之前的聪明"
1964,"锅太重了我弟弟要倒了"
1964,"我就是爱绿色，我有十件绿衣服"
1964,"我媳妇最聪明了，才不会信的"
1964,"你就是嫉妒皇后娘娘太美啦"
1964,"说白了你就是想做皇后"
1965,"贵妃在直言不会，也许现实中的皇后就没那么好。"
1965,"你真以为你当不上皇后是因为没有一张贤良淑德的脸?"
1965,"不是说高贵妃认识和阿满很好吗"
1965,"我还是戴上帽子更帅"
1965,"一起生活了那么久，皇后是什么样的人家不清楚吗？？"
1965,"先从你身上套出话来，再去告诉皇后"
1966,"不喜欢高贵肥"
1966,"信不信我盒饭分分钟热好给你啊"
1966,"作为妃子，都过去这么多集了，难道都没有衣服么"
1966,"你错就错在要扯上皇后不知道她是姐要护的人么"
1966,"高贵人的声音变了"
1966,"那么我就来一招将计就计好啦"
1967,"我觉得高贵妃可以去大档案栏目进行讲解，与主持，"
1967,"本宫这脸可不是装的，本来就很贤良淑德"
1967,"拿上帝视角看问题的人在这据里你能活几集？"
1967,"我信你个大猪蹄子"
1967,"省省吧，你们现在有多得意以后死的就有多惨"
1967,"真热闹，貌似没我什么事"
1968,"璎珞脖子好长"
1968,"我和我姐做错了什么，要背这么重的锅"
1968,"高贵妃是啥子吗，说的这么快，队友一个个都被他害死了"
1968,"高贵妃你饿不饿，璎珞给你热盒饭"
1968,"本宫希望你高贵妃善良！"
1968,"那是雍正帝让她坐上皇后宝位的拜托"
1969,"说皇后害死姐姐已经是焊跳了啊。皇后为人还需要怀疑吗"
1969,"高贵妃不怕领盒饭？好胆量"
1969,"璎珞那么聪明不会信的"
1969,"本宫最贤良，你给本宫滚"
1969,"贵妃的这套衣服穿太久了"
1969,"就假装相信你们一下好了"
1970,"魏姐不能信啊姐夫不可能做那种不得体的事"
1970,"这黑锅太重我背不动了"
1970,"其实贵妃看久了还可以"
1970,"不是别的，主要本宫是真的没衣服穿了"
1970,"高可爱要领盒饭了"
1970,"到我出场了没，要回香港了"
1971,"最招人喜欢的猫是那种行为举止像狗的猫。"
1971,"我长得善良，怪我咯"
1971,"爱是一道光，绿到我发慌"
1971,"长的好像焦俊彦呀？"
1971,"本来编的还行后头添油加醋说皇后就编过头了"
1971,"舒贵人该吃盒饭了"
1972,"多大的脸敢说弃暗投明"
1972,"她姐姐和贵妃很好贵妃以为是富恒杀了她才和皇后作对"
1972,"高贵妃年纪太大了吧，真的适合演太后"
1972,"我不会纵容任何人做坏事的，即使是傅恒"
1972,"高贵妃总是被身边的人坑咋那么单纯呢"
1972,"媳妇让她们领盒饭"
1973,"媳妇儿她们不得体你要相信为夫啊"
1973,"璎珞那么聪明，会信？不会的"
1973,"如果真的为高效力高就真的是神挡杀神了……"
1973,"我媳妇儿一定是想玩反间计"
1973,"2倍真的是贵妃的正常语速诶"
1973,"人在家中坐，锅在天上飞"
1974,"都是长得太帅惹的祸啊"
1974,"高贵妃想挖本宫的人你还嫩点儿！"
1974,"电子设备太重要了"
1974,"就是没手机闲的"
1974,"说那么多，这正题"
1974,"你太菜了带不动带不动"
1975,"魏瓔珞：飯盒準備好"
1975,"人在家中坐，锅从天上来，这锅好重，臣背不动啊"
1975,"别想太多太多了"
1975,"我聪明，我骄傲"
1975,"书柜人饿了想吃盒饭"
1975,"我来凑个热闹"
1976,"舒贵人眉毛一挑演得好"
1976,"好吧。我假装信你们吧"
1976,"魏璎珞演技太好了，贵妃太天真了。"
1976,"让你们得意一会儿"
1976,"说白了就是后宫的女人太闲"
1976,"人在家中坐，锅从天上来，这锅好重，臣背不动啊"
1977,"舒贵人你眼袋好重啊快去补觉吧"
1977,"锅好重，背不动"
1977,"脖子是真的长"
1977,"你们高兴的太早了"
1977,"快录音做证据！"
1977,"黑锅太重我不背"
1978,"真相大白就不会有这么多集好吗"
1978,"弟弟你可真不叫姐姐省心"
1978,"呵！你个大猪蹄子，以为我会相信你"
1978,"看来要帮你们热盒饭了"
1978,"又有新套路"
1978,"演得真好！以为我会相信吗？别做梦了"
1979,"她能当皇后是先帝让他当的好吗"
1979,"好啊我投奔你们。你们俩等着领盒饭吧"
1979,"舒贵人这脸看的真不顺眼"
1979,"这么聪明的人，本宫想留为己用"
1979,"不会是纯飞杀的吧"
1979,"高贵妃这个大猪蹄子"
1980,"舒贵人，我劝你善良"
1980,"锅好重、背不下去了"
1980,"顺水推舟，厉害了"
1980,"聪明的人都会将计就计的"
1980,"现在报仇还重要么"
1980,"舒贵人什么时候领盒饭啊"
1981,"无间道要开始了，爆米花可乐备好"
1981,"想让我毒皇后，毒你个大猪蹄子"
1981,"舒贵人的声音好作，耳朵疼"
1981,"我家媳妇就是聪明"
1981,"可能是璎珞利用这件事来扳倒高贵妃"
1981,"嗯，套路已准备好，你俩想选什么风格的死法"
1982,"开挂的人生不需要解释，到哪都是香馍馍"
1982,"姐姐你看这个锅又大又圆"
1982,"这些演员耳朵都有那么多耳洞吗"
1982,"你以为我会信你们？天真"
1982,"没手机闲的站住"
1982,"这么多人惦记我"
1983,"魏璎珞：我就看你怎么演，姐陪你玩儿"
1983,"本宫都没出来看热闹，再热闹点本宫就出场"
1983,"感觉璎珞是装的"
1983,"好吧我就陪你们演这场戏"
1983,"输贵人又要坑队友了"
1983,"你以为我会信你们？天真"
1984,"搞不定的对手拿来当手下，你的池子够深么？能养住？"
1984,"最近我有点闲，戏不多啊"
1984,"淑贵人的演技好浮夸啊"
1984,"我富察傅恒表示这锅我不背"
1984,"舒贵人是个大猪蹄子"
1984,"我觉得布星"
1985,"主角光环太重如果是贵妃单从她进宫另有目的就可以刺死"
1985,"想挖本宫的人美的你哟"
1985,"高贵妃说身上总得带点绿，在宫里面的生活才过的去"
1985,"这个锅太大我背不动"
1985,"这么简单的逻辑，璎珞也会信，为了故事情节什么都编"
1985,"第一PS:刚才就说叫你别和傻子玩，看吧￣￣)σ"
1986,"皇后那么好，为什么就是要和她作对呢"
1986,"你们想的美"
1986,"反间计是个不错的选择"
1986,"这个锅我不背，我弟弟也不是这种人"
1986,"舒贵人和高贵妃的声音都让人不能理解"
1986,"你要相信本宫啊"
1987,"我信你个鬼你们一群大猪蹄子"
1987,"娘娘贵人你们看我这演技还好吗"
1987,"舒贵人这对不笑也横在脸上的卧蚕是玻尿酸打的吧"
1987,"太好了.你们竟然敢让我参与！那你们就等死吧！"
1987,"魏璎珞:你们想的太多了"
1987,"锅太重我背不起"
1988,"贵妃既然有这么多证据为什么不去搬到皇后"
1988,"第二PS:看吧￣￣)σ，现在又多了一个"
1988,"嘻嘻嘻嘻嘻休息下惊喜惊喜嘻嘻嘻嘻手机就删吧自己生手"
1988,"偶买嘎这锅劳资不背"
1988,"哟，贵人那眉毛演的好"
1988,"太好了.你们竟然敢让我参与！那你们就等死吧！"
1989,"你亮的发光发绿光"
1989,"好大一个锅"
1989,"录音笔是个好东西啊"
1989,"真的智商堪忧，老娘说要帮你们了吗"
1989,"贵妃劝你善良"
1989,"偶买嘎这锅劳资不背"
1990,"胆子也太大了吧，还没确定投靠她，就把陷害的主意说了"
1990,"帮你热盒饭吗"
1990,"舒贵人到50多集都没死"
1990,"信你个大头鬼"
1990,"哭不会回去急"
1990,"你们两个是真的傻吧……"
1991,"这绝对是神探柯南真相只有一个马上还原真相了"
1991,"如何才能证明清白"
1991,"魏璎珞：你们想的美"
1991,"我不管我最帅"
1991,"给你挖个坑把你埋了在拍两锹"
1991,"这怕是两个傻子吧"
1992,"魏璎珞，我跟傻子玩了这么久，哎，饿了，领盒饭了"
1992,"异想天开了吧，这么肥的胆儿"
1992,"少爷很单纯的，不要伤害少爷"
1992,"本宫不用你们来杀本宫会自行了断的"
1992,"两位娘娘怕是已经入了璎珞的套路了"
1992,"我劝你善良"
1993,"唉呀呀呀急了急了"
1993,"对不起了，这次得体夫妇又没糖了"
1993,"这两个人真是大傻子周围的人都聋了吗"
1993,"唉善良的人容易背锅"
1993,"拿腰带去问不就行了"
1993,"魏璎珞，我跟傻子玩了这么久，哎，饿了，领盒饭了"
1994,"大猪蹄子这个梗是过不去了"
1994,"嘴巴总是长好大"
1994,"高贵妃这坑挖大了饭盒妥妥的"
1994,"我媳妇智商这么高，是你们一句两句能蒙骗的嘛"
1994,"太纯吧这智商和璎珞谈条件"
1994,"璎珞我待你不薄！"
1995,"一条腰带能证明什么。真的做了还会留下这么明显的证据"
1995,"媳妇儿你那聪明劲儿呢"
1995,"这两个人真天真啊，被反坑死还不知道"
1995,"我怕这包药是你喝"
1995,"急着领盒饭？也不用这么明显吧"
1995,"可惜没有录音，都是证据呀"
1996,"要是能录个音多好🙄"
1996,"本宫这么美"
1996,"不上当不上当，肯定会去问清楚"
1996,"怕不是两个傻子哟"
1996,"这种事知道的人越少越好。。。那么多宫女听着真的好么"
1996,"皇后启是你能杀的？"
1997,"如果那时候有录音笔该多好"
1997,"媳妇相信我不是大猪蹄子"
1997,"要是有录音机多好"
1997,"录音和监控是个好东西"
1997,"令后大旗永不倒"
1997,"怕不是两个傻子哟"
1998,"这个输贵人连皇上都还没碰到就那么多名堂"
1998,"不知怎滴了，本宫连续打了好几个喷嚏，尔晴说是感冒了"
1998,"这两个怕是个傻子吧，这么明显的招数魏璎珞会上套？"
1998,"媳妇稳住别浪"
1998,"舒贵人我劝你善良"
1998,"录音和监控是个好东西"
1999,"舒贵人比高贵妃的腔调欠打多了"
1999,"好的舒贵人，你的盒饭已经加好了"
1999,"璎珞的戏演得好"
1999,"我劝你们善良，我最帅，不接受任何反驳"
1999,"贵妃贵人你们太单纯了这样就信了？"
1999,"这个输贵人连皇上都还没碰到就那么多名堂"
2000,"当着这么多人的面说杀皇后的事？"
2000,"本宫去劝二位善良。"
2000,"让别人跪了这么久，傻子才为你们效力"
2000,"这锅太重我不被"
2000,"贵妃真的不换衣服，钱都拿去买戏服了"
2000,"拿录音笔录下来"
2001,"当着一屋子太监丫鬟的面说要毒杀皇后，你可长点心吧"
2001,"我媳妇那么聪明，肯定不会信得"
2001,"难道那天去糟蹋宫女就代表啊满也是被他糟蹋"
2001,"女人我劝你善良"
2001,"你也太快了吧？想利用我去毒杀太后，太小看我了"
2001,"舒贵人还嫩着呢"
2002,"带着皇上来偷听多好"
2002,"贵妃戏份没我多尽管你们说"
2002,"你们都太菜了，本王者不屑和你们组排，带不动带不动"
2002,"录音笔是个好东西。"
2002,"这个贵人真的是。。。。无语，笨猪。估计也快了"
2002,"舒贵人怕是要领盒饭了"
2003,"看这舒贵妃真想打两巴掌，话都不会正常的说嗲里嗲气的"
2003,"我可不是普通宫女智商"
2003,"今天没有磕到不得体CP的糖差评"
2003,"舒贵人我劝你善良"
2003,"之前在用这招不就好了，非要璎珞做"
2003,"带着皇上来偷听多好"
2004,"舒贵人好大的眼袋啊😄"
2004,"本宫劝你们善良"
2004,"要有录音笔就好了"
2004,"你们既然想跟我玩那我就陪你们玩到底"
2004,"傅璎大旗永不倒！"
2004,"不听不听贵妃念经"
2005,"他如果真如前边所演聪明绝对不会信"
2005,"认真的吗？人家还没投诚呢就来这么刺激的计划"
2005,"相处了那么久，当然相信皇后"
2005,"舒贵人还有多久才能领盒饭"
2005,"要是把皇上带来就精彩了"
2005,"我就假装上当玩死你们"
2006,"不会要在剧情需要的时候让主角变成笨蛋吧"
2006,"天赐大恨，是个好苗子"
2006,"璎珞早就知道这是陷阱"
2006,"跟皇后有屁关系，又不是皇后玷污了我姐姐"
2006,"我觉得高贵妃他们会被反套路"
2006,"我就假装上当玩死你们"
2007,"璎珞破了三个月的案子就让你们这么快就破了？长点心吧"
2007,"智商不高会传染，离我远点儿"
2007,"就算是报仇自己做就好了，为啥非得加速贵妃啊明显利用"
2007,"笑死了，我看两大傻子在这演戏"
2007,"不要听他们几个王八念经不听不听王八念经不听不听"
2007,"跟我玩?你还太年轻"
2008,"舒贵人的盒饭热好了吗？热好了热好了🍱"
2008,"全天下都在冤枉我害我丢了媳妇"
2008,"舒贵人的卧蚕真的是太刻意了……"
2008,"这锅好重我背不动"
2008,"舒贵人和原来的嘉嫔还真不是一个档次的智商。。。"
2008,"感觉我快说不清了，这锅我不背"
2009,"舒贵人的眼袋好重"
2009,"你们盒饭热好了"
2009,"璎珞那么聪明你们真能骗得了她？？"
2009,"你不能这么天真"
2009,"这么简单的离间··猪也看得出来啊"
2009,"全天下都在冤枉我害我丢了媳妇"
2010,"高贵妃和阿满不是关系蛮好，说出这点不比什么都好？"
2010,"大家帮我录下来发给皇上"
2010,"跟皇后还有傅恒相处了这么久，怎么可能信她一夕之言"
2010,"这个智商也只能是个贵人了"
2010,"我觉得可以把毒放到愉贵妃的饭里"
2010,"来人拖出去枪毙"
2011,"智商是个好东西"
2011,"你觉得我会信你吗？大猪蹄子！"
2011,"这是不是叫人赃并获？转手来一个举报"
2011,"舒贵人，我劝你善良"
2011,"这个智商也只能是个贵人了"
2011,"来人拖出去枪毙"
2012,"舒贵人能活得好后，盒饭太早了"
2012,"媳妇儿送她吃盒饭，我热好了"
2012,"好了舒贵人，给你加鸡腿了，你可以退下了"
2012,"大眼泡我劝你善良！"
2012,"电话那头都听着呢，你说的每一句话都将做呈堂证供"
2012,"两个死女人，盒饭已备好"
2013,"皇后这么久了没看到你的爱婢不见了么去救人啊"
2013,"我就配合你们演一下让你们开心开心"
2013,"舒贵人你就不想多活两集吗"
2013,"贵人盒饭给你热好了，马上到"
2013,"舒贵人啥时候死？好急"
2013,"这么多人一起密谋毒杀皇后"
2014,"盒饭热好了"
2014,"本宫和弟弟那么善良怎么老是背锅"
2014,"做卧底吧干脆"
2014,"我怕是演技太好"
2014,"可以录音就好了"
2014,"哇你们好单纯"
2015,"如果古代有录音笔该多好"
2015,"录音可是个伟大的发明啊"
2015,"贵妃的王者段位也会叫队友坑成青铜"
2015,"媳妇，我劝你淡定"
2015,"说三个耳洞的，你们怕不是不知道有个东西叫耳夹"
2015,"别吵吵，，都给本宫安静"
2016,"这部戏还是主角光环太重，璎珞也太聪明了谁也玩不过他"
2016,"怨有仇债有主，退一万步说就算是真的，也只会找傅恒"
2016,"听见这贵人说话就不舒服…"
2016,"不要说舒贵人领盒饭了，人家做了舒妃的，现在还没到"
2016,"到底谁杀了满姐啊"
2016,"我这演技贼好"
2017,"讲个笑话，傅恒的最大靠山是皇后。"
2017,"输贵人快领盒饭吧，太阔怕了"
2017,"这脖子好长"
2017,"聪明如我，怎么可能会信"
2017,"還有四十多集欸"
2017,"我这就去告诉我姐你们要下毒"
2018,"不会背叛皇后的简介不是说皇后劝她放下仇恨了"
2018,"舒贵人你眼袋怎么回事"
2018,"不觉得那个小太监好可爱么？？？"
2018,"这点智商还敢进宫"
2018,"这傻子最大的忌讳是自作聪明啊"
2018,"你以为我媳妇儿斗不过你们这智商吗"
2019,"每次到璎珞说话声音就好大"
2019,"舒贵人你话太多，等下领盒饭吧"
2019,"璎珞你信妖妃的话，她们是想男人想疯了"
2019,"看你们演戏真好玩儿"
2019,"便当好了吗"
2019,"舒贵人你屁话真多"
2020,"让这两个反派多活几集不想看佘佘黑化"
2020,"我劝你们要善良不然乖乖给我领盒饭去吧"
2020,"魏柯南眉头一紧，此事不简单"
2020,"锅太大背不动"
2020,"贵妃，你们是清宫剧看多了"
2020,"看你们演戏真好玩儿"
2021,"舒贵人长的有点像王子文哇"
2021,"你以为我会信吗呵可笑"
2021,"如果璎珞相信了，我就不看了！毕竟她那么聪明"
2021,"看客们我劝你们善良"
2021,"黑眼圈，本宫劝你善良"
2021,"我劝你们要善良不然乖乖给我领盒饭去吧"
2022,"高可爱一直以为是傅恒，所以才会那么恨皇后"
2022,"你们老是说大猪蹄子，害得我大半夜想吃烤猪蹄！"
2022,"这种女人不多，懂得珍惜的男人更是不多"
2022,"来人，把当天的监控掉出来"
2022,"舒贵人衣服好大啊"
2022,"舒贵人，你马上就可以领盒饭了"
2023,"好，我来帮你们出掉你们自己"
2023,"媳妇儿盒饭🍱热好了拿去给她吧"
2023,"其实是我穿越到那时一时兴起觉得模样端正就没忍住"
2023,"舒贵人,你话真多，不让本宫说几句"
2023,"舒贵人，你马上就可以领盒饭了"
2023,"来人，把当天的监控掉出来"
2024,"她那么聪明怎么会信呢，这电视这样就没看头了"
2024,"两个大猪蹄子"
2024,"高贵妃的队友好坑"
2024,"两个大傻子"
2024,"地毯演的好啊"
2024,"我劝我善良一点"
2025,"舒贵人你可长点心吧"
2025,"你俩等着，一会儿让你们吃饭盒吃个饱"
2025,"璎珞根本没信好吧"
2025,"隔夜的盒饭给你们热好了"
2025,"这毒药包演得好"
2025,"你是安徒生吗？故事编的那么长"
2026,"贫道这就帮你把你姐姐魂召来问个清楚"
2026,"我不能太强，不能太强，太强会被削的"
2026,"这舒贵人戏挺多啊"
2026,"这锅又大又圆"
2026,"肯定不信啊皇后为了不认识的宫女气的几天没吃饭怎可能"
2026,"璎珞根本没信好吧"
2027,"皇上的女人都好厉害啊，心机真是无话可说"
2027,"舒贵人，我劝你善良"
2027,"舒贵人跟高贵妇的智商真的是让人无语"
2027,"你咋知道是被掐死的，这事不是没外传么？你家干的？"
2027,"舒贵人还能活几集啊？可以去领盒饭了"
2027,"你屁话真多"
2028,"舒贵人，我劝你聪明点，不要害高贵妃"
2028,"输贵人你知道的太多了"
2028,"舒贵人长的还可以"
2028,"掐死的好吗宝贝"
2028,"别欺负我媳妇，我媳妇聪明着呢"
2028,"胡说，本宫是让人掐死的不是勒死"
2029,"漏洞太大了，他姐姐不是被累死的，是被掐死的。"
2029,"这点智商还想蛊惑聪明的璎珞"
2029,"我那么善良怎么可能做出那种事"
2029,"我劝你善良，不然让你领盒饭"
2029,"输贵人你知道的太多了"
2029,"掐死的好吗宝贝"
2030,"舒贵人多饿几天才能多吃一份盒饭"
2030,"我已经开始热盒饭"
2030,"眼睛红了鼻子也红了"
2030,"舒贵人本宫劝你少说两句"
2030,"秘密还是不能太多人知道"
2030,"我劝你们善良"
2031,"高贵妃：“要想生活过得去，身上总得带点绿。”"
2031,"看来是本宫太温柔了"
2031,"这就是言多必失，坏人死于话多"
2031,"你们害我就算了你们害还这么美丽的皇后"
2031,"舒贵人怎么知道那么多"
2031,"我已经开始热盒饭"
2032,"漏洞百出，细节说的那么清楚，她们不是主谋谁是啊！"
2032,"都是朕的错没有把你们都伺候好"
2032,"舒贵人好白啊"
2032,"舒贵人说书说的挺厉害的"
2032,"媳妇相信我这行为很不得体所以我只对你做啊呜呜呜"
2032,"看来是本宫太温柔了"
2033,"纳兰妹子饭盒热好了。你看你什么时候有空。来领一下。"
2033,"贵妃娘娘无脑，是皇后娘娘仁慈您才活了这些集"
2033,"这事谁都不知道，舒贵人查到怎么多就很不错了"
