time,content
1977,"心地善良的明玉宝宝"
1977,"明月好善良啊"
1978,"大嘴猴大旗扛起来"
1978,"明玉真是个善良的小天使"
1978,"明玉真的很好很好呀"
1978,"明玉你太善良了，还在为她人着想"
1978,"不，你错了，本宫这生注定不平凡"
1978,"心地善良的明玉宝宝"
1979,"明月就是单纯直性子本质还是很好的"
1979,"明月才是最单纯的"
1979,"海兰察好温柔，明玉好可爱"
1979,"傻丫头，我没白疼你"
1979,"其实明玉最单纯善良了，以前还错怪她，给她道歉。"
1979,"太善良了明玉"
1980,"不愧为皇后带出来的宝宝明玉很好"
1980,"明玉好可爱妈呀好可爱"
1980,"才没有，璎珞活的很开心"
1980,"明玉太善良了以前我们都错怪你了"
1980,"好善良的姑娘"
1980,"明月才是最单纯的"
1981,"明玉真好现实中这种人也好耿直善良"
1981,"大猪蹄子你明明很开心"
1981,"明玉樱诺是替本宫照顾好五阿哥呢"
1981,"朕来亲亲抱抱举举高。"
1981,"明玉好可爱妈呀好可爱"
1981,"明玉太善良了以前我们都错怪你了"
1982,"明玉你好单纯，璎珞太心机了，她就是要当皇上的女人"
1982,"哎，明玉和海兰察多好的一对，后来明玉却死了"
1982,"之前觉得明玉坏死了，现在觉得她好善良啊"
1982,"璎珞大了，本宫很是欣慰"
1982,"好善良的孩子"
1982,"大猪蹄子你明明很开心"
1983,"算了算了出宫嫁给贫民也不一定幸福个人有个人命"
1983,"明玉真的好善良，性子直又单纯"
1983,"明玉怎么这么可爱，哭起来好心疼"
1983,"本宫的明玉一定要活的久一点"
1983,"之前觉得明玉坏死了，现在觉得她好善良啊"
1983,"明玉你好单纯，璎珞太心机了，她就是要当皇上的女人"
1984,"海兰茶的家庭环境肯定很很和睦很轻松"
1984,"傅璎大旗我来扛"
1984,"海兰察和明玉没有明显的感情戏，在戏外的时候海兰察说"
1984,"明玉真的好善良，性子直又单纯"
1984,"本宫的明玉一定要活的久一点"
1984,"明玉怎么这么可爱，哭起来好心疼"
1985,"乖，别哭，大猪蹄子是不可能放她出宫的"
1985,"明玉本宫是为了你也是为了皇后娘娘啊"
1985,"人家叫明玉好嘛，别乱给人取名"
1985,"明玉太好了"
1985,"困得好啊，人家以后是皇贵妃"
1985,"明月你好善良啊"
1986,"明玉能这样想真好我还以为她不高兴璎珞侍寝了"
1986,"明玉宝宝你什么时候这么懂事了本宫好开心"
1986,"其实璎珞跟着大猪蹄子也挺幸福的"
1986,"出宫是不可能的这辈子都不可能成功的"
1986,"乖，别哭，大猪蹄子是不可能放她出宫的"
1986,"人家叫明玉好嘛，别乱给人取名"
1987,"明玉是嘴不饶人心底善地人，现在感觉她太善良了"
1987,"明玉才是主角吧，这么单纯能活到现在"
1987,"明玉的盒饭热了那么多天，突然不想给他吃了"
1987,"明玉变好了，亏我之前还让她死"
1987,"明玉能这样想真好我还以为她不高兴璎珞侍寝了"
1987,"明玉越看越顺眼是阿姨以前错怪你了哎"
1988,"不是你的错啊小可爱，大猪蹄子不会放她的"
1988,"谁给解释一下.大猪蹄子的来由"
1988,"明玉才是心地最善良的人"
1988,"纯妃/娴妃，我劝你们善良！"
1988,"12岁她姐进的宫她等姐姐九年21进的这么多年才25"
1988,"明玉你怎么了？放心，本宫会原谅你的，只要你不哭。"
1989,"好可爱的明玉，明玉其实挺好的，希望不要很快领盒饭"
1989,"英明大旗我来扛"
1989,"纯妃不会让她活着出宫的"
1989,"扛起大嘴猴大旗"
1989,"好心疼你，我以为至少明玉和海兰察会幸福"
1989,"总是担心明玉身体里会不会还有残留的银针……"
1990,"不你是辅助大乔放个圈让人回家了"
1990,"多好的亲事啊"
1990,"大猪蹄子快给这俩人赐婚吧"
1990,"英明cp我看不错啊"
1990,"明玉啊，没有你，她们也不会让她过得舒服的"
1990,"好心疼你，我以为至少明玉和海兰察会幸福"
1991,"你不说大猪蹄子也不会放她出去滴"
1991,"我家明玉最可爱"
1991,"她俩好甜啊，海蓝查好撩啊哈哈哈哈哈好喜欢"
1991,"两倍速的太后笑声真可爱啊"
1991,"海芋大旗永不倒蛤蛤蛤"
1991,"多好的亲事啊"
1992,"你说我一个大老爷们三天就看了四十集容易吗我"
1992,"明玉，你没错，是本宫这一生注定不平凡"
1992,"大猪蹄子是什么梗"
1992,"这个明月看久了还挺耐看"
1992,"璎明大旗扛起来"
1992,"海兰察好可爱！！！"
1993,"果然皇后大天使的身边就有明玉这样的小天使"
1993,"不要担心乖我有主角光环"
1993,"这俩好甜哟"
1993,"明玉也不是什么单纯之人"
1993,"木子洋你个大猪蹄子在看吗"
1993,"要是你不说我们还有啥看呢"
1994,"名誉简单、天真、无邪"
1994,"璎珞是皇后的希望如今希望也变成了自己失了自由与自我"
1994,"索伦：来，亲亲抱抱举高高"
1994,"为什么叫朕大猪蹄子"
1994,"你是善良小可爱啊"
1994,"明玉我劝你不要再善良"
1995,"真心的明玉，这么多集都没哭，看到这竟把我看哭了😭"
1995,"好了大嘴猴夫妇本宫原谅你们了"
1995,"明玉好暖心啊"
1995,"本宫可高兴了"
1995,"到最后感觉还是明玉最善良了"
1995,"索伦：来，亲亲抱抱举高高"
1996,"明玉海兰察长得真像，有木有一个模子刻出来的感觉"
1996,"你比我善良多了"
1996,"明玉被傅恒拒绝一次就放弃那会，觉得她性格真心好"
1996,"明玉你这么懂事本宫就放心了"
1996,"大嘴猴夫妇好可爱"
1996,"明玉好暖心啊"
1997,"明玉也是厉害角色改变历史的人没她就没后来的历史了"
1997,"高可爱来喽"
1997,"说索伦敦海兰察分不清的那个，他们是一个人，服气"
1997,"排好队形领盒饭"
1997,"明玉真的太可爱了太单纯善良了"
1997,"大嘴猴夫妇好可爱"
1998,"海兰察好温柔"
1998,"明玉你可真聪明"
1998,"王明珠大猪蹄子"
1998,"哎，媳妇把我绿了"
1998,"明玉乖不哭，璎珞很厉害的"
1998,"明玉和海兰察他俩好有夫妻相"
1999,"最喜欢这一对好可爱啊哈哈哈哈"
1999,"我领盒饭有点早了"
1999,"大嘴猴好可爱"
1999,"明玉要好好的"
1999,"明玉你可真聪明"
1999,"海兰察好温柔"
2000,"明玉好可爱好单纯"
2000,"本宫的明玉最单纯了"
2000,"别哭，导演都安排好的，还给钱呢"
2000,"这门婚事朕准了"
2000,"木子洋就厉害了卜凡在看吗"
2000,"她是你们下一个主子的娘亲"
2001,"璎珞嫁给大猪蹄子其实也挺幸福的，生了6个孩子"
2001,"下水道亮了"
2001,"这下好了真的绿了"
2001,"我不怪你冲了钱注定打怪"
2001,"明玉挺好一姑娘"
2001,"琼瑶剧吗，说个话还要背对着人"
2002,"大猪蹄是个什么梗啊？"
2002,"明玉跟海兰察一定在一起了，算是圆了傅璎的情了"
2002,"明玉真的很真实"
2002,"明玉好可爱(/ω＼)害羞"
2002,"这对儿单纯的cp"
2002,"明玉挺好一姑娘"
2003,"魏璎珞好厉害啊"
2003,"你们俩抓紧时间在一起吧，不然大猪蹄子就来了"
2003,"大嘴猴好可爱"
2003,"明玉好可爱(/ω＼)害羞"
2003,"这对儿单纯的cp"
2003,"明玉真的很真实"
2004,"殷医师好善良"
2004,"停停停，疼疼疼"
2004,"沈智鹏是大猪蹄子！敲里吗！"
2004,"我怎么不绿了"
2004,"对对对好可爱"
2004,"明玉长大了，成熟了"
2005,"富察皇后:高举大嘴猴夫妇大旗。"
2005,"我就是大猪蹄子"
2005,"你不说，以她的聪明也会看出来"
2005,"还是你套路最深阿明玉"
2005,"不不不她两儿四女可幸福了"
2005,"没有你，璎珞也会为本宫报仇而进宫的"
2006,"刚开始给明玉热了二十遍盒饭，现在突然不想让他吃了"
2006,"明玉虽一开始处处为难璎珞，但终究有颗善良的心"
2006,"说她善良的人认真的吗"
2006,"明玉你太可爱了叭"
2006,"大嘴猴夫妇善良又可爱！"
2006,"皇后走的第三天，想她想她还是想她"
2007,"明玉真的很单纯善良"
2007,"明云你变聪明了，连我都敢算计了啊。"
2007,"明玉好善良啊啊"
2007,"刚开始给明玉热了二十遍盒饭，现在突然不想让他吃了"
2007,"明玉虽一开始处处为难璎珞，但终究有颗善良的心"
2007,"说她善良的人认真的吗"
2008,"不不不宝贝儿你很好你别哭，你说了才有后面三十多集"
2008,"好单纯换作别人会嫉妒"
2008,"想起了当初的坏女人明玉好可爱"
2008,"你是个很善良的人"
2008,"别怕明玉。璎珞一定帮你讨回公道"
2008,"明玉真的很单纯善良"
2009,"逻辑好紧密，好剧"
2009,"抱走我家明小玉，都要看哭了"
2009,"诶呀，我们明玉好可爱好可爱"
2009,"你是个可爱的人"
2009,"明玉不哭不哭，就算你让璎珞出宫，皇上也不会放她走的"
2009,"可爱的明玉"
2010,"明明是要为皇后报仇，但是不能说出口，可爱的明玉"
2010,"好了好了不怪你"
2010,"最后最甜的可能是玉察啊"
2010,"抱走我家明小玉，都要看哭了"
2010,"你是个可爱的人"
2010,"可爱的明玉"
2011,"說自己惡毒的人一般骨子裏是善良的"
2011,"明玉真可爱不愧是本命的人嘤嘤嘤"
2011,"明玉好可爱好可爱好可爱被小姐姐圈粉"
2011,"高可爱原谅你了"
2011,"导演好眼力，演员长相配的都这么好，他俩一对cp诶"
2011,"不不不明玉你别哭你最可爱了"
2012,"如果你不这样做，璎珞欠皇后的太多太多了"
2012,"好善良的明玉，本宫没看错人"
2012,"善良的明玉啊，别乱想了，帮璎珞报仇才是最重要的，"
2012,"哎本宫也就踩踩你们的小手手纯妃要你们的命耶"
2012,"拉一个人下水，影响得是整个国运，你也很不错了"
2012,"明玉好可爱好可爱好可爱被小姐姐圈粉"
2013,"你是最可爱最善良的人了你说什么呢"
2013,"一箭三雕痛快，一群青铜竟敢与王者对抗，等着被团灭吧"
2013,"明玉其实特别简单善良单纯，开始还不喜欢她呢"
2013,"明玉好可爱啊"
2013,"如果你不这样做，璎珞欠皇后的太多太多了"
2013,"善良的明玉啊，别乱想了，帮璎珞报仇才是最重要的，"
2014,"这就是心地善良嘴巴凌厉的人"
2014,"呦，我还得感谢你啊，都孝仪纯皇后了"
2014,"明玉好可爱呀嘤嘤嘤"
2014,"摸摸头，乖不哭"
2014,"明玉是一个善良的人"
2014,"小花在看吗小明在看吗小花在看吗"
2015,"明玉跟着容音还是学到很多东西的，蛮可爱的人设"
2015,"乖，别抬举自己了，明明就是个单纯的小可爱"
2015,"高贵妃也很单纯单纯的只想弄死你们而已"
2015,"两个人都好可爱呀真好！"
2015,"明玉劝你不要太善良但也要善良哈哈哈哈"
2015,"摸摸头，乖不哭"
2016,"高贵妃：大猪蹄子你看，本宫才是最善良，最单纯的人"
2016,"好喜欢明玉，可爱又善良"
2016,"当然善良，在深宫里会自责的女人很少见了"
2016,"大嘴猴好可爱哈哈"
2016,"两个人都好可爱呀真好！"
2016,"明玉宝宝大概是全剧最单纯的了"
2017,"你能酱说就证明你很可爱很善良很体贴"
2017,"朕是大猪蹄子，谁都不能和朕抢这个名号"
2017,"哼，你们这些大猪蹄子，以前还想让明玉领盒饭"
2017,"好喜欢明玉，可爱又善良"
2017,"当然善良，在深宫里会自责的女人很少见了"
2017,"大嘴猴好可爱哈哈"
2018,"多幸福啊大猪蹄子又上肩膀"
2018,"我盒饭吃好了"
2018,"富察·傅恒说我美了美了美了，我绿了绿了绿了"
2018,"你是好明玉"
2018,"放心吧，就算没有你，猪蹄子也不会让她出宫的，你很好"
2018,"明玉太可爱了吧"
2019,"哈哈哈哈突然想起来明玉叫璎珞坏女人的时候也超级可爱"
2019,"明玉你是个好孩子心直口快而已心却是好的"
2019,"明玉是除了皇后娘娘以外全剧最善良的人好嘛"
2019,"海兰察好温柔啊"
2019,"大猪蹄子我劝你善良"
2019,"明玉太可爱了吧"
2020,"海蓝察好可爱啊"
2020,"人家娴妃，哦不，皇后才是王者，你这娃这叫可爱好吧"
2020,"不看脸就听海蓝察声音很好听"
2020,"哈哈哈哈突然想起来明玉叫璎珞坏女人的时候也超级可爱"
2020,"明玉你是个好孩子心直口快而已心却是好的"
2020,"海兰察好温柔啊"
2021,"大嘴猴夫妇好可爱"
2021,"快亲亲抱抱举高高，朕给你们赐婚"
2021,"说明玉单纯的怕都是男人吧"
2021,"咱俩都是单纯可爱的人啊"
2021,"洗白了以后好可爱"
2021,"不看脸就听海蓝察声音很好听"
2022,"在这紫禁城这么多年还能这么善良真的很难得了"
2022,"不明玉你最可爱最善良了"
2022,"真的好可爱呀，这脑回路实在太善良了"
2022,"汪帆是大猪蹄子"
2022,"海兰察宝贝好可爱"
2022,"这么多朋友里面还是你最靠谱"
2023,"感觉明玉还不错，就是性子直"
2023,"不，你是个善良可爱的姑娘"
2023,"海兰察声音好可爱"
2023,"明玉你最可爱了，乖，别哭了"
2023,"来来来大嘴猴大旗"
2023,"两个人都好可爱ớ₃ờ"
2024,"亲亲抱抱举高高我家明玉最妥耐"
2024,"之前一直夸本宫可爱，现在是不是都把本宫忘了"
2024,"大猪蹄子大猪蹄子到底什么意思"
2024,"你是除了本宫最单纯的人"
2024,"大猪蹄子大猪蹄子"
2024,"海兰察也不错啊。暖"
2025,"好可爱的cp不能取个更好听的cp名吗"
2025,"你俩下去吧，本宫同意这桩婚事了。镜头转大猪蹄子那"
2025,"现实中的海兰察有好几块腹肌全身都是肌肉很帅的"
2025,"亲亲抱抱举高高就好了"
2025,"嘴巴真的好大啊哈哈哈"
2025,"亲亲抱抱举高高我家明玉最妥耐"
2026,"海兰察哥哥可爱可爱可爱嘻嘻嘻嘻"
2026,"你是个好菇娘"
2026,"看第二遍更有味道，每一个角色的演技精彩到都不愿错过"
2026,"她俩是一家的最都那么大"
2026,"明玉演的好，不是前些日子叫领盒饭了"
2026,"好可爱的cp不能取个更好听的cp名吗"
2027,"海兰跟付恒是好哥们，喜欢的女孩也都是善良的"
2027,"明玉你是一个很善良的人"
2027,"傅恒等了那么久，就是要等她出宫好娶她"
2027,"海兰察你这是纯素颜啊"
2027,"大猪蹄子就是男人都是一样的意思"
2027,"朱思豪你个大猪蹄子"
2028,"明玉长得好可爱"
2028,"朕要给你们赐婚，生下的孩子小名就叫大嘴猴"
2028,"海兰察才是真正的翩翩公子，真的好温柔"
2028,"擦擦擦出爱情的火花耶"
2028,"好善良的明玉"
2028,"明玉你是一个很善良的人"
2029,"海兰察的声音好可爱啊"
2029,"高小可爱不在的第N天啊，想她想她想她"
2029,"这两个的声音都好可爱啊"
2029,"唯一一个劝她善良成功的人"
2029,"明月好可爱啊"
2029,"海兰察才是真正的翩翩公子，真的好温柔"
2030,"一想到明玉身体里还有两根针就觉得好疼啊"
2030,"大嘴察好暖啊"
2030,"我觉得还是这对靠谱，不是很甜不是很虐"
2030,"这俩发展速度太慢了"
2030,"真正善良的人才会这么怪罪自己"
2030,"唔怎么都没我戏份了。盒饭吃腻了"
2031,"现在发现高贵妃好可爱"
2031,"本宫带出来的人都那么杰出啊"
2031,"确定你俩不是兄妹，长得太像了"
2031,"你个大猪蹄子你啥也不知道"
2031,"一想到明玉身体里还有两根针就觉得好疼啊"
2031,"这俩发展速度太慢了"
2032,"我给你们普及一下大猪蹄子聂远是大猪蹄i子哈哈哈哈"
2032,"明玉真的好乖啊好可爱啊❤❤"
2032,"如果连这些话都是刻意的话，明玉才是最厉害的人"
2032,"这两个人真的是一脸夫妻相，这门亲事朕准了"
2032,"高可爱走的第n天，想她，想她"
2032,"喜欢高可爱"
2033,"海兰察声音好嫩"
2033,"好久没见到高可爱啦，想她了"
2033,"高贵妃:好可爱原谅你了"
2033,"绿就是这么帅"
2033,"嘿哟好甜哟"
2033,"海兰察，这样不得体，不得体"
2034,"善良的明玉可惜走的太早"
2034,"大嘴猴夫妇好可爱"
2034,"没想到明玉的戏份这么多，导演重点栽培"
2034,"我盒饭吃好了，快扶我起来斗斗这魏璎珞"
2034,"海兰茶好暖啊"
2034,"海兰察，这样不得体，不得体"
2035,"爱是一道光，绿的你迁發光"
2035,"让本宫吃几根针冷静下"
2035,"两个都是善良的人却没能得到善终"
2035,"头上种满绿"
2035,"大嘴猴好可爱"
2035,"你们是撒糖了，可我绿了"
2036,"海兰察感觉好贴心"
2036,"这样秀恩爱真的好吗？本宫真的很想拆你们"
2036,"可爱的明玉，真的好善良"
2036,"你们俩躲好了，被我发现了哼哼"
2036,"大明湖畔的追剧女孩们，还记得曾经让明玉领盒饭吗"
2036,"让本宫吃几根针冷静下"
2037,"希望海篮差这对会很好很好"
2037,"明玉，本宫觉得你有善良又可爱，以前有你陪伴很温暖"
2037,"高可爱不在的N天想她想她"
2037,"大猪蹄子我就问你他俩你拆不拆？"
2037,"其实明玉笑起来的模样倒是很可爱的粉了粉了"
2037,"海兰察感觉好贴心"
2038,"你们这些键盘侠好阔爱"
2038,"明玉是个好姑凉"
2038,"好单纯好不做作的明玉小可爱[000]"
2038,"我劝你善良"
2038,"你才是最善良可爱的"
2038,"求你俩在一起吧不然这局从头到尾都是爱而不得的悲剧"
2039,"你是本剧唯一善良单纯的人"
2039,"转身抹眼泪觉得很可爱"
2039,"明月想通过海兰察向傅恒解释璎珞跟了皇上是有原因的"
2039,"爱是一道光绿的人发慌"
2039,"明玉变聪明咯，特意等在巡逻的地方就等这句了"
2039,"嗯海兰察也要被明玉套路，看来明玉才是最有心计的哈哈"
2040,"李雪洋大猪蹄子李雪洋大猪蹄子李雪洋大猪蹄子"
2040,"高可爱离开好多天，想她想她想她！"
2040,"天呀这俩人好可爱"
2040,"把我们家明玉尽快娶回去就好"
2040,"高可爱走了好几年了"
2040,"你是本剧唯一善良单纯的人"
2041,"这么善良能活这么久，明玉才是气运爆棚的主儿"
2041,"天啊，明玉变乖了，本宫好欣慰，好开心啊！！😄😄"
2041,"真的是相由心生，明玉变好了看着顺眼多了"
2041,"明玉，你变聪明了，不愧是本宫的贴心人"
2041,"明玉真的很可爱，可爱的让人心疼"
2041,"把我们家明玉尽快娶回去就好"
2042,"明月好可爱好可爱"
2042,"朕是大猪蹄子"
2042,"明察大旗举起来，大嘴猴夫妇"
2042,"本宫才是最单纯的人啊喂"
2042,"找大猪蹄子赐婚吧"
2042,"明玉真的很可爱，可爱的让人心疼"
2043,"明玉2万人中选出来的能不可爱么"
2043,"抱紧傅璎大旗在墙角哭唧唧"
2043,"快来人啊，这里有侍卫宫女私会"
2043,"明玉是唯一一个劝她善良成功了的"
2043,"想高贵的好"
2043,"傅璎大旗怎么倒了"
2044,"大嘴猴夫妻好阔爱啊"
2044,"吴金宇是大猪蹄子"
2044,"希望明玉能有好归宿"
2044,"好有夫妻相的一对这门亲事朕准了"
2044,"明玉头上的多肉都开花了"
2044,"还是觉得高贵妃可爱"
2045,"前几集你们都把明玉盒饭热好了诶"
2045,"要亲亲抱抱举高高才能好不懂么"
2045,"这部剧里就希望他俩能有个好结果了"
2045,"明玉，你很善良，以前有你陪伴我很温暖"
2045,"感觉海兰察才是全剧最单纯的人"
2045,"大嘴猴夫妻好阔爱啊"
2046,"我觉得海兰察配音真厉害完全看不出破绽"
2046,"把我们家明玉娶回去就好"
2046,"阔爱阔爱明玉"
2046,"本宫的明玉唱歌很好听哦"
2046,"大猪蹄子是董岩磊说的"
2046,"爱是一道光～绿到我发慌"
2047,"他俩太有夫妻相了要是能一辈子相守该多好啊"
2047,"可爱的明玉请你再多活好多集陪陪我"
2047,"黄明昊大猪蹄子🐷🐽陈立农大猪蹄子🐷🐽￼"
2047,"把我们家明玉娶回去就好"
2047,"我觉得海兰察配音真厉害完全看不出破绽"
2047,"阔爱阔爱明玉"
2048,"明玉要的就是海兰察这句话，要知道皇上的御前侍卫可是知道很多消息的"
2048,"好你个明月和我一起久了学会套路了又拉一个上贼船不错"
2048,"我好喜欢海兰察啊呆萌呆萌的"
2048,"大嘴猴的配音好可爱"
2048,"明玉是听劝的，现在变善良了"
2048,"真的好甜呀"
2049,"明玉要是不领盒饭也会很幸福的"
2049,"妈耶，老娘都多少年了还不出场？"
2049,"说海明cp不虐的记住你的话，后面明玉死的时候不要哭"
2049,"小玉儿，跟着我以后都变聪明了呢"
2049,"这对好甜呜呜"
2049,"海兰察好暖呀！"
2050,"这部剧的第一个泪点来自明玉，好可爱好心疼"
2050,"海兰察好可爱嘤嘤嘤"
2050,"好甜啊，大嘴猴夫妇好可爱呀"
2050,"哇哇哇好甜哟"
2050,"老师还是很重要的，跟了魏主子明玉也会套路了"
2050,"本宫给明玉买了一套新衣服"
2051,"甜到吐恋爱的酸臭味"
2051,"你看这不就把太医太后皇上侍卫都搞定了吗崛起很简单"
2051,"海兰察是自始至终都善良的人"
2051,"大猪蹄子说这个剧演技全部到位"
2051,"明玉也值了，一个这么优秀爱自己的男人"
2051,"朕准你们母凭子贵，快去吧"
2052,"海兰察啊，长点心吧，看看人家姑娘多主动"
2052,"明玉的套路好深"
2052,"就希望璎珞能真的爱上大猪蹄子"
2052,"甜到吐恋爱的酸臭味"
2052,"海兰察是自始至终都善良的人"
2052,"朕准你们母凭子贵，快去吧"
2053,"快快快快把明玉小可爱抱走"
2053,"我绿了彻底绿了"
2053,"明玉也很好真的好"
2053,"又发好人卡估计死的快了"
2053,"人在家中坐，绿从屋顶来"
2053,"海兰察啊，长点心吧，看看人家姑娘多主动"
2054,"不得体不得体，罪过罪过"
2054,"哥们祝你幸福可是我好绿啊"
2054,"这个剧只有海兰察不是大猪蹄子"
2054,"套路太深太深太深了，兄弟小心"
2054,"我绿了彻底绿了"
2054,"又发好人卡估计死的快了"
2055,"好喜欢明玉说坏女人和大好人好可爱啊"
2055,"搂搂抱抱不得体啊不得体"
2055,"高可爱离开的第三天，想她"
2055,"不得体不得体，罪过罪过"
2055,"套路太深太深太深了，兄弟小心"
2055,"早知道就不嫁给那个大猪蹄子了"
2056,"新的不得体夫妇诞生！"
2056,"明玉，你很善良，以前有你的陪伴很温暖"
2056,"好甜哟姨母笑"
2056,"为什么他们的名字都好长的感觉"
2056,"海兰察长得跟袁分不清"
2056,"搂搂抱抱不得体啊不得体"
2057,"除了富察，玉估计是这部戏里面最单纯善良的人了"
2057,"这两大嘴猴不错，准婚"
2057,"哎呦，好甜好甜的大嘴猴"
2057,"是不是不太得体啊"
2057,"明玉是个单纯可爱的小仙女"
2057,"新的不得体夫妇诞生！"
2058,"这两cp生个孩子嘴不知道有多大哦"
2058,"明玉真的好可爱，全剧最可爱，长得也可爱"
2058,"奏是羡慕她们这满脑袋满脑袋的头发"
2058,"你是个大猪蹄子"
2058,"除了富察，玉估计是这部戏里面最单纯善良的人了"
2058,"明玉是个单纯可爱的小仙女"
2059,"哇好甜啊大嘴猴夫妇，可惜现在有多甜以后就有多虐"
2059,"大嘴猴夫妇可爱"
2059,"明玉比刚开始好特别多哦"
2059,"明察秋毫大旗扛起！"
2059,"变好了但曾经也做过那些事，现在好了"
2059,"这两cp生个孩子嘴不知道有多大哦"
2060,"明玉嫁给海兰察该多好"
2060,"明玉做得很好，切不可像本宫这样，本宫要你们给我报仇"
2060,"开心开心举高高"
2060,"不得体不得体。哎？我怎么绿了"
2060,"明玉的指甲好可爱"
2060,"像我高可爱了没？"
2061,"我只想知道明玉以后能不能有个好归宿"
2061,"本宫才是大可爱。高可爱"
2061,"海兰察嘴真太大了，到耳朵根了都"
2061,"这盒饭真好吃都来陪本宫吃盒饭把"
2061,"张染你个大猪蹄子"
2061,"明玉嫁给海兰察该多好"
2062,"大嘴猴好高兴"
2062,"海兰察可比袁帅多了。谁说的分不清"
2062,"他们好可爱"
2062,"哼哼哼媳妇今天晚上绿了我了，不开心"
2062,"道明枫这个大猪蹄子。"
2062,"本宫早晚给大猪蹄子戴绿帽子"
2063,"明玉在快和海兰察成亲的时候因为身体里残留的针死了"
2063,"你们这样不得体不得体"
2063,"卫龙女孩好开心"
2063,"本宫的明玉真单纯"
2063,"大嘴猴那个你站住，形容的如此贴切，本宫要赏你"
2063,"本宫早晚给大猪蹄子戴绿帽子"
2064,"感觉珍珠是真的为魏璎珞开心，演的不错"
2064,"大猪蹄子还不赶快赐婚"
2064,"其实明玉和海兰察结婚，也许还会有孩子，明玉太单纯了"
2064,"明玉和海兰察两个大嘴猴，哈哈哈哈。纯属娱乐"
2064,"明玉后面演的特别舒服"
2064,"卫龙女孩好开心"
2065,"两个善良的人走上一条没有回头的路"
2065,"我喜欢陆晚晚！！"
2065,"大嘴猴女孩大旗扛起来！"
2065,"来啊我请你们吃盒饭"
2065,"宁凤宇是个大猪蹄子"
2065,"明玉该不会是故意的吧"
2066,"这可能是最甜最幸福长久的cp了求原地结婚！"
2066,"📢全部给朕把大旗摇好了"
2066,"哈哈哈明玉笑起来嘴都到耳根了好可爱"
2066,"兄弟不得体啊"
2066,"别再说什么劝善良的话了，皇后连自己的孩子都护不住。"
2066,"大嘴猴女孩大旗扛起来！"
2067,"看乐就好，这又不是正剧，认真就输了。。。"
2067,"明玉的真实身份是慈禧"
2067,"好直接的明玉"
2067,"这不得体不得体呀"
2067,"玩的一手好心机"
2067,"来啊快活啊"
2068,"说海兰察嘴大的你们不想想王大陆姚晨吗"
2068,"大猪蹄子什么梗？"
2068,"兄弟小心啊美女投怀送抱没什么好事啊"
2068,"一切竟在本宫掌握之中"
2068,"感觉明玉的衣服都没有以前鲜艳了"
