time,content
669,"最大的印象就是先发制人，后发制于人"
669,"蜡烛穿绑了"
669,"胆子大的可爱"
669,"害得我掉段"
670,"高贵妃匹配到对友都是猪🐷，皇后匹配到的都是大神"
670,"要亲亲抱抱，举高高"
670,"放心吧舒贵人命长着呢"
670,"你俩是不是穿错衣服了"
670,"这主角光环强大"
670,"本宫带不动，队友太坑了"
671,"说高贵妃单纯的，你是脑壳有包吧"
671,"尔晴和明玉衣服是不是穿反了"
671,"除了璎珞其他人一无用处啊，这主角光环"
671,"怎么感觉明玉和尔晴换了衣服穿呢"
671,"你做过什么你自己知道，你不消失，别怪我气你"
671,"说烛光晚餐的那个你是魔鬼吗"
672,"尔情好可爱"
672,"这个皇宫想怎么玩都可以啊"
672,"打不过我吧，没有办法我就是这么强大"
672,"哼本宫不要面子吗"
672,"最开始看璎珞每回都机智反击解气现在多了也烦厌了"
672,"我啥时候上场嘤嘤嘤"
673,"这个时候的尔晴好单纯啊"
673,"我感觉我好可爱好温柔"
673,"璎珞又想办法了他要把皇后供起来反正他也不吃饭"
673,"尔晴很可爱啊"
673,"这剧斥巨资，就连一把扇子都是手工制作"
673,"皇后娘娘真像仙女下凡了"
674,"这剧现在是穿的艳的是坏人，穿的素的是好人吗？"
674,"看我多聪明"
674,"这时候尔晴真好阿没黑化就好了"
674,"我媳妇儿如此优秀"
674,"拜皇后娘娘不是大不敬吗"
674,"本宫只想吃火锅"
675,"尔晴多好呀！后来不黑化就好了"
675,"我媳妇真可爱"
675,"这时候的尔晴多好啊"
675,"明月长得像慈禧"
675,"太善良了皇后"
675,"设定没读过书，结果什么典故都知道"
676,"主子和下人都分不清，穿的都差不多"
676,"来来来，逗本宫开心一下"
676,"芝兰脸歪到出戏啊"
676,"看我厉害吗"
676,"高贵妃演的好，"
676,"为什么大家都说我可爱😘"
677,"笑的时候出现是卧蚕不笑出现是眼袋"
677,"我弟妹真好聪明，会讨好媳妇我都不用愁了，哈哈哈……"
677,"这贵妃馊主意全是别人出的结果都贵妃背锅"
677,"感觉这个剧的宫女都挺厉害的"
677,"快！放下手中的香！"
677,"因为璎珞倒下多少人了？还有人敢惹她？"
678,"哈哈哈哈男女同撩厉害了"
678,"本宫不高兴了，需要皇上抱抱才能好"
678,"贵妃从王者被猪队友坑到青铜"
678,"我最可爱我最可爱"
678,"高贵妃穿的是皇宫棒球服吧"
678,"这贵妃馊主意全是别人出的结果都贵妃背锅"
679,"这件事情告诉我们选择一个好队友有多重要"
679,"皇后就是小仙女皮炎平不接受反驳"
679,"璎珞的嘴可真甜"
679,"你们太不懂事了"
679,"舒嫔妃，做的好，记住你的任务"
679,"我生气你就哄我了我可真是个小机灵鬼"
680,"这个舒贵人怕是皇后请来的吧"
680,"我这个大猪蹄子什么时候出场"
680,"我璎珞真聪明啊啊"
680,"这顿夸啊，本宫受不起"
680,"一根蜡烛认真的吗？"
680,"你在干哈子"
681,"不能拿香拜人的不吉利的啊"
681,"我怎么这么帅，这么帅怎么办？"
681,"哈哈哈什么时候夸小仙女都是好的"
681,"该我上场表演啦"
681,"蛮喜欢这样可爱的舒贵人"
681,"这顿夸啊，本宫受不起"
682,"我一件坏事没做成净背锅了"
682,"媳妇开心点"
682,"魏璎珞我劝你善良"
682,"我现在很善良"
682,"皮皮出现的太是时候了鸭啊哈哈哈哈哈哈哈哈哈"
682,"我什么时候出场阿"
683,"尔晴一直这样多好啊"
683,"没有办法我就是这么强大。"
683,"令后大旗摇起来"
683,"我不是药神里很美"
683,"皇后就是小仙女"
683,"嘴甜招人爱"
684,"眼睛不一样大很正常，世界上长得最标致对称的是赫本"
684,"我最美最聪明"
684,"尔晴的扇子是给皇后扇的好吗"
684,"你别是爱上本宫了吧"
684,"幸亏皇后身边有个璎珞还有人真心待她…"
684,"我去😓，着都行，开大了吧！"
685,"明玉的嘴像鲶鱼有木有"
685,"没有了戏服，以后我可怎么勾引皇上呀！"
685,"明玉和尔晴不会是换了衣服穿吧？！！！"
685,"还是我最聪明"
685,"仙女本仙！"
685,"你别是爱上本宫了吧"
686,"本仙了！皇后娘娘最可爱最美丽啦！"
686,"主角光环来强大"
686,"皮炎平演的太好了c位出道吧皮炎平"
686,"是时候要哄媳妇儿啦"
686,"璎珞好可爱"
686,"仙女本仙！"
687,"在古代，年龄相差再大一些就能成母女辈分"
687,"谁说朕是大猪蹄子？好吃吗？"
687,"嘴别撅那么高好么"
687,"本宫这么躺着脖子疼"
687,"真的是后宫团宠宝宝皇后娘娘大家一起操心怎么哄"
687,"皮炎平是认真的吗"
688,"本宫不开心，本宫要抱抱"
688,"媳妇可真辛苦这么晚了还要哄姐姐开心"
688,"你俩好吧，要皇上干嘛"
688,"本宫是仙女，你们都是大猪蹄子，哼！"
688,"轻巧的节奏"
688,"哼宝宝不开心了"
689,"妈鸭好可爱"
689,"上辈子当绿萍的时候也有人说本宫是仙女来着"
689,"令后大旗扛起来"
689,"哼，本宫是仙女，是喝露水的，不用吃饭"
689,"小仙女儿快消消气吧"
689,"说到仙女就来气，就是你惹的祸"
690,"合不合理暂且不说，我就是觉得解恨，过瘾。"
690,"大胆！居然说本宫只有绿衣服，本宫还有红的！"
690,"双下巴好明显"
690,"我媳妇儿最厉害，最棒，最可爱"
690,"哎呦，好前卫阿，还仙女呢"
690,"我媳妇儿才是仙女好吧？"
691,"皮炎平是认真的吗？"
691,"大猪蹄子都来学学怎么哄女人🌚"
691,"一身仙女味的皇后娘娘"
691,"这个彩虹屁我给满分，不愧是皇后粉头"
691,"这和璎路有什么关系王后为什么要她们"
691,"我家璎珞咋这么会哄快把持不住了"
692,"大绿袄子也不错"
692,"媳妇你看我可爱吗。美吗？"
692,"明玉贼可爱哈哈哈，变好了越来越喜欢她了！！！"
692,"真有这么好的皇后吗"
692,"我家璎珞咋这么会哄快把持不住了"
692,"一身仙女味的皇后娘娘"
693,"璎珞好可爱"
693,"人家是小仙女，人家不高兴了，嘤嘤嘤。"
693,"本宫的升降床是认真的"
693,"小仙女要喝露水，不想吃饭"
693,"璎珞就是个人精"
693,"我该黑化了"
694,"璎珞真会哄女孩子开心"
694,"宝宝没戏宝宝不开心"
694,"我们这里给活人烧香拜拜很不吉利的"
694,"本仙女不高兴要抱抱"
694,"皮炎平是认真的吗"
694,"媳妇你可真是个小机灵鬼"
695,"明玉这一次说马屁精比上一次看着顺眼多了"
695,"本仙女不开心，要哄"
695,"妈惹令后大旗给我扛起来啊！"
695,"本宫仙女本仙"
695,"明玉笑得好可爱"
695,"媳妇你可真是个小机灵鬼"
696,"明玉变好了也太可爱了吧！"
696,"明月说马屁精好可爱，她有的时候挺可爱的"
696,"居然被皇后回话了，好激动。"
696,"璎珞鼻翼两侧的肌肉太紧张了"
696,"本仙女不开心，要哄"
696,"明玉笑得好可爱"
697,"如果尔晴不黑化，这三个人多好，多可爱啊"
697,"我媳妇儿好可爱啊"
697,"尔晴不黑化该多好"
697,"本宫原谅你了"
697,"人活着就拜，这是诛九族大罪"
697,"明玉变好了也太可爱了吧！"
698,"明玉嘴好大"
698,"尔晴好可爱呀"
698,"我们娘娘那么善良会原谅你们的"
698,"我好聪明阿"
698,"明玉这么变好了"
698,"尔晴不黑化该多好"
699,"四个人一直这样多好"
699,"媳妇儿一个劲儿的夸姐姐，人家吃醋了啦"
699,"说尔晴可爱的，你们看到后面就知道了"
699,"妈妈不要生气了"
699,"也就这个皇后娘娘性格好"
699,"这个音乐出来就知道璎珞要干大事"
700,"不黑化，三个人这样多好"
700,"就你嘴甜会说话，你就仗着我喜欢你吧"
700,"这三个人真好，尔晴不变坏该多好"
700,"什么时候本宫出场"
700,"这样的仙女是真实存在的吗"
700,"你个小别致长得真东西"
701,"现在多好啊，不想让尔晴黑化"
701,"哼本宫要纯贵人哄才行"
701,"大嘴猴明玉笑起来挺可爱的"
701,"我真聪明嘻嘻嘻"
701,"那些人，现在会觉得明玉可爱了吧"
701,"我媳妇真可爱"
702,"以后只能穿大绿袄子唱戏了呵呵"
702,"老娘盒饭领的太早了吧"
702,"皇后好慈祥"
702,"本宫就是被你拜的领饭盒的"
702,"明玉的嘴巴的确长得像慈禧"
702,"现在多好啊，不想让尔晴黑化"
703,"感觉明玉好像变好了对璎珞好了"
703,"如果一直像现在这样那该多好呀。"
703,"大猪蹄子男人们都来学一学人家"
703,"本宫现在很高兴"
703,"尔晴和明玉的衣服来回换着穿！导演组赶快给加戏服"
703,"我媳妇好棒"
704,"我家皇后好可爱"
704,"我就是这么可爱"
704,"上个那么好的皇后，就是朱元璋的马皇后了"
704,"主角光环太重了"
704,"仙女仙女，今天要嫁给你，秦岚说，咋那么熟悉呢"
704,"如果一直像现在这样那该多好呀。"
705,"明玉看起来顺眼多了"
705,"高举我令后大旗！！！令后大旗永不倒！！！"
705,"明玉笑的好甜啊"
705,"我这是养了一个什么精啊"
705,"眉毛端庄又心地善良"
705,"我家皇后好可爱"
706,"高贵妃就没赢过，还一直努力着，很是不容易啊，哈哈哈"
706,"你这么说本仙女不原谅能行吗噗嗤"
706,"明玉好可爱啊"
706,"皇后娘娘可真好"
706,"我以为她要给皇后上三柱香呢"
706,"我这是养了一个什么精啊"
707,"娘娘心好软"
707,"本宫就是嫦娥，你也只能是那个颠当"
707,"吴谨言谨言慎行这个名字寓意很好诶"
707,"我可真是个小机灵鬼儿"
707,"如果你不让皇后伴洛神，就不会让他们以此为计"
707,"拿你没办法啊"
708,"那句我看你是要成精啊，语气神态好可爱啊"
708,"尔晴我劝你善良"
708,"妈呀，皇后笑的好可爱"
708,"求生欲很强，哈哈"
708,"对啊，皇后娘娘就是仙女本仙啊，拜得不错"
708,"本宫就是小仙女"
709,"本宫温柔这么久，本宫也想发发小脾气，哼！"
709,"我喜欢魏璎珞，记住你是我女人"
709,"璎珞不是凡人是先知，能预测未来未发生的事"
709,"我就是小仙女哈哈哈哈"
709,"好欢乐哦俩个人"
709,"对啊，皇后娘娘就是仙女本仙啊，拜得不错"
710,"她们几个要是一直这样下去，该多好啊"
710,"本宫是娴妃才是最贤良的世界上真有皇后这么好的人吗"
710,"多亏了秦岚和皇上等演员。还不错"
710,"明玉其实挺可爱的"
710,"皇后脾气太好了"
710,"本宫知道自己是仙女"
711,"也只有这样的皇后能让这样的宫女活着么久"
711,"我媳妇儿真可爱"
711,"富察皇后这个角色就是为秦岚预定的一样导演眼光真不错"
711,"哈哈你真聪明"
711,"哈哈哈哈好可爱啊这拜几下"
711,"本宫知道自己是仙女"
712,"要是尔晴能一直这样好下去多好为啥要黑化啊"
712,"高级玩家和普通玩家的区别。"
712,"哎，真想不到这么好的尔晴竟然是第一大反派"
712,"没有我，你这个皇后能当这么舒服？？"
712,"大猪蹄子什么梗"
712,"哈哈哈哈好可爱啊这拜几下"
713,"本来他就是主角主角光环不重那就得配角光环重啊"
713,"啊媳妇好可爱"
713,"在宫斗里面不是你死就是他亡有一点善良就是对自"
713,"我媳妇就是优秀"
713,"高贵妃这个反派貌似还没成功过，真是窝心"
713,"高级玩家和普通玩家的区别。"
714,"明月变好以后还是蛮可爱的"
714,"我姐是仙女你们都是大猪蹄子"
714,"明玉变好立马就觉得她可爱了"
714,"我岚生起气来也这么美"
714,"嫦娥颠当的典故?敢问你俩平日都看的什么书"
714,"本仙女要忍住，不能笑🙊"
715,"看了二十多集了还有人在说唇妆"
715,"媳妇就是可爱"
715,"仇源彬就是大猪蹄子"
715,"本宫最可爱"
715,"皇后真可爱"
715,"一人做事一人当，我小叮当做事小叮当"
716,"秦岚演的皇后很舒服，圈粉"
716,"本宫是仙女，才不和你们一帮妖怪做朋友"
716,"你又想闹哪样我脑壳疼"
716,"本宫就是仙女娘娘"
716,"嘤嘤嘤明玉好可爱"
716,"小仙女要发话了，哼！"
717,"谨言不就是璎珞的本命吗？好的好的"
717,"璎珞，你这辈子话太多了，本宫就罚你下辈子叫谨言吧。"
717,"令后大旗扛起来"
717,"哼你以为这样我就原谅你了吗"
717,"皇后仙子下凡辛苦了"
717,"我怎么还不出来想我媳妇"
718,"璎珞脑袋上多肉长挺好阿"
718,"我还以为她要烤烤串馋皇后😂😂"
718,"她真不可爱，扮可爱也不像"
718,"你好大的胆子！"
718,"能有皇后这样的媳妇就好了"
718,"令后大旗扛起来"
719,"好可爱又善良的皇后娘娘啊"
719,"本宫是可爱可爱的宝宝"
719,"皇后真的好善良"
719,"媳妇好可爱"
719,"皇后：本宫知道的可比你多"
719,"我怎么会如此聪明"
720,"女人就爱听好听的"
720,"媳妇好可爱呀"
720,"尔晴很好呀，为啥会黑化呀"
720,"姐姐你把璎珞许给我吧"
720,"我媳妇们真可爱"
720,"我什么时候出来呀"
721,"我媳妇好厉害"
721,"我媳妇儿真阔爱(╯3╰)"
721,"聊斋看得好，颠当也入戏了"
721,"媳妇过去了"
721,"刚刚在地上的时候蜡烛都已经熄了一会又亮了"
721,"媳妇好可爱呀"
722,"床好高级的样子"
722,"媳妇乖乖哒哄好我姐有奖励哦"
722,"魏璎珞怎么长的那么像老鼠"
722,"你不是没读书么怎么懂这么多典故"
722,"白蜡烛，，，能行么"
722,"我媳妇怎么呢这么可爱啊"
723,"洛殷的嘴说话自然点就好了"
723,"我很开心你继续夸"
723,"本宫还活着呢你拜什么"
723,"姐姐，我这个媳妇儿不错吧"
723,"璎珞太可爱啦"
723,"本宫就是小仙女本仙无疑了"
724,"坏人身边总会有忠心耿耿的，心好的人身边总有人黑化"
724,"我喜欢玩明玉"
724,"这彩虹屁吹的厉害"
724,"本宫是嫦娥。"
724,"感觉剧情有点作"
724,"我姐就是仙女🧚‍♀️"
725,"我觉得皇后至少要有点硬气，这个也太过温柔了"
725,"本宫再不理你，估计你要拜死我!"
725,"仇源彬是大猪蹄子"
725,"我媳妇也是小仙女"
725,"嫦娥不是神仙吗怎么会效仿别人"
725,"感觉剧情有点作"
726,"不是说没有知识没有文化吗"
726,"我看你是要成精啊这一句笑到我了皇后娘娘好可爱"
726,"傅恒:我媳妇最棒了"
726,"因为这部剧的主角是奴才"
726,"本宫就是仙女"
726,"这也太可爱了吧wor"
727,"我就是这么厉害哈哈哈哈"
727,"媳妇最棒了！"
727,"魏璎珞:兵线给我我带飞"
727,"我怎么还没出来"
727,"太会豁人了"
727,"傅恒:我媳妇最棒了"
728,"本宫不开心了，要亲亲抱抱举高高"
728,"本宫就是小仙女本宫最可爱～"
728,"璎珞笑起来很可爱啊"
728,"哎，我就是脾气好啊"
728,"姐姐不要说我媳妇"
728,"谁说令妃没怎么读书的。。"
729,"我看你是要成精这句好逗"
729,"本宫是最可爱的，不接受反驳！"
729,"这不是皇后，这是娘亲"
729,"我弟媳妇真可爱"
729,"本宫就是小仙女本宫最可爱～"
729,"璎珞笑起来很可爱啊"
730,"这皇后好皮啊，成精。哈哈哈哈"
730,"本宫不容易啊"
730,"皇后不亏是当家主母"
730,"总算哄好了"
730,"这不是皇后，这是娘亲"
730,"我看你是要成精这句好逗"
731,"成精实在可爱"
731,"戏精本精无疑了"
731,"令后大旗扛起来"
731,"已经成精了"
731,"这皇后好皮啊，成精。哈哈哈哈"
731,"本宫不容易啊"
732,"耸肩好可爱啊"
732,"我本来就是戏精"
732,"哎，当偶像剧看看还是可以的，当正经宫廷剧就算了，"
732,"对了，我就是戏精"
732,"成精实在可爱"
732,"已经成精了"
733,"皇后娘娘说话好温柔"
733,"我媳妇真聪明呐，不错不错"
733,"皇后太温柔了！好爱"
733,"现在多好，我为什么要黑化"
733,"没错，就是个戏精"
733,"又来哄人家开心，小拳拳捶你，哼"
734,"皇后好温柔，女人都喜欢她了"
734,"没办法，小宫女儿太可爱"
734,"好甜嘻嘻嘻令后好甜！！！"
734,"我不用学本来就已经是精了"
734,"其实也挺好的皇后这么多年都很拘束，直到遇见了璎珞"
734,"皇后娘娘说话好温柔"
735,"说书先生好厉害，把璎珞教的这么聪明"
735,"不瞒娘娘说我觉得皇上就是大猪蹄子"
735,"璎珞读书不多但还知道这么多典故"
735,"没办法，小宫女儿太可爱"
735,"皇后好温柔，女人都喜欢她了"
735,"我取了个好媳妇"
736,"皇后真的好温柔啊"
736,"皇后，你还记得朕说过她是个成了精的狐狸麽"
736,"皇后真的美丽大方"
736,"皇后好可爱啊哈哈哈"
736,"皇后好可爱"
736,"皇后好可爱，亲亲"
737,"本宫批评人也是那么的温柔"
737,"这三人一直这样多好呀"
737,"所以说还是要多读书啊"
737,"皇后真的好温柔啊"
737,"皇后真的美丽大方"
737,"皇后好可爱啊哈哈哈"
738,"我看你是要成精啊，这句话从皇后口说出好萌啊"
738,"我怎么这么可爱这么可爱怎么办"
738,"秦岚把富察皇后演的太好了"
738,"我媳妇棒棒哒"
738,"皇后好温油嘻"
738,"我饿了，顺着台阶下来能吃点东西"
739,"皇后啊，白月光啊，太好了，太温柔了"
739,"好喜欢皇后!好可爱"
739,"大猪蹄子到底是什么"
739,"本宫是你的小仙女，最最最可爱"
739,"秦岚的声音太好听了"
739,"我看你是要成精啊，这句话从皇后口说出好萌啊"
740,"秦岚好有气质好温柔啊"
740,"我媳妇太聪明了常人驾驭不了"
740,"璎珞和皇后是真爱，皇上是个意外"
740,"小狼狗变小奶狗了，我把媳妇让给姐姐你，要好好待她"
740,"“皇后就是仙女，皮炎宁不接受反驳”哈哈哈哈笑死我了"
740,"好喜欢皇后!好可爱"
741,"娘娘好温柔好温柔啊"
741,"我才是高级玩家啊"
741,"以前明玉说马屁精都是嘟着嘴说的，这次她笑着说的诶"
741,"我家媳妇真可爱"
741,"皇后真的太温柔太善良了"
741,"本宫哄哄就好了"
742,"真的好善良"
742,"没错我就是戏精本精"
742,"戏精戏精。"
742,"我媳妇又聪明又可爱"
742,"我才是高级玩家啊"
742,"我家媳妇真可爱"
743,"一个个说主角光环戏份多，主角戏份不多还叫主角吗ZZ"
743,"我今天订婚了开心"
743,"皇后好哄呀，美丽温柔善良大方贤惠"
743,"哎呀我好温油"
743,"皇后这个角色真讨喜，好可爱"
743,"本宫只是饿了想吃饭饭"
744,"是戏精本精了"
744,"我看你是要成精啊！我怎么这么可爱☺"
744,"皇后真的好温柔，小仙女"
744,"璎珞最可爱"
744,"大猪蹄子到底是什么梗"
744,"一个个说主角光环戏份多，主角戏份不多还叫主角吗ZZ"
745,"皇后多好，一哄就好了"
745,"建国前是可以成精的"
745,"璎珞好可爱"
745,"本宫太好哄了这不成事儿啊"
745,"看这么多清宫戏，这是最好的皇后，比心❤️"
745,"我看你是要成精啊！我怎么这么可爱☺"
746,"有个好的主子太重要了"
746,"未婚妻很可爱吗！"
746,"好可爱的秦岚"
746,"本宫气饿了，要吃东西了"
746,"仔细看明玉颜值很高的"
746,"皇后多好，一哄就好了"
747,"令妃喜欢小燕子不是全无道理啊，这不就是翻版小燕子嘛"
747,"本宫肚子饿了怕是有皇子了"
747,"这都二十多集了，尔晴不是挺可爱的吗[愉快]"
747,"皇后太可爱了"
747,"好可爱的秦岚"
747,"有个好的主子太重要了"
748,"皇后好可爱呀"
748,"哄好了哄好了你们进来吧"
748,"就是不读书比读书人懂的还多"
748,"我小媳妇儿太可爱了"
748,"璎珞眼睛好大。"
748,"我自己也太可爱了吧"
749,"好温柔的娘娘"
749,"我就是这么美"
749,"现在的尔晴多好"
749,"看我多六匹"
749,"我这么可爱当然选择原谅我"
749,"哄好了哄好了你们进来吧"
750,"这可能是最高兴最单纯的一段记忆吧，一直这样该多好啊"
750,"璎珞白眼球太大了"
750,"尔晴竟然好了二十多集"
750,"娘娘好温柔啊！"
750,"历史上的皇后会这么随和额吗"
750,"我这么可爱当然选择原谅我"
751,"感觉像一家人好幸福"
751,"魏璎珞眼睛好大呀😄"
751,"其实是一桌子饭菜太香了，本宫忍不住了"
751,"皇后最可爱，到最后吧，不要领盒饭"
751,"秦岚真的是把皇后的柔和演绎的淋淋尽致"
751,"尔晴竟然好了二十多集"
752,"一直这样多好啊多好的尔晴多好的明玉多好的容音和璎珞"
752,"就是想让你哄哄本宫亲亲抱抱举高高才能好"
752,"明玉变好了后多可爱啊，就这样的多好"
752,"这个时候的尔轻真好"
752,"其实是一桌子饭菜太香了，本宫忍不住了"
752,"秦岚真的是把皇后的柔和演绎的淋淋尽致"
753,"没读过书是璎珞故意藏的不想暴露太多"
753,"这个氛围真的好温馨啊"
753,"皇后多好多温柔，如果一直这样多好，为什么皇后要死"
753,"本宫就是这么可爱，没办法"
753,"好幸福和谐的场面"
753,"本宫的脾气真好"
754,"就保持现在这个氛围多好呀，三个好姐妹哄皇后娘娘开心"
754,"一直这么和谐该多好"
754,"一人演了正经婆婆和正经媳妇儿"
754,"一切都像现在这样该多好"
754,"一直这样三个人齐心协力保护好皇后多好……哎……"
754,"我好温柔啊"
755,"说聊斋早的，逗吗，蒲松林是明末清初的，不是很正常吗"
755,"尔晴看着挺好啊，谁说她会腹黑"
755,"要是一直这样多好啊，四人合力共斗贵妃"
755,"像这样多好啊"
755,"就保持现在这个氛围多好呀，三个好姐妹哄皇后娘娘开心"
755,"一直这么和谐该多好"
756,"真怕尔晴黑化这样多好"
756,"我媳妇什么时候才跟我秀恩爱逗我开心啊"
756,"画面停止在这一刻该多好"
756,"哄个皇后我容易吗"
756,"璎珞笑起来好可爱啊"
756,"我劝我自己要善良"
757,"这可能是她们四个最和谐的一段时光吧"
757,"我媳妇可真是可爱"
757,"三个人多好为什么有个黑化"
757,"自打我进宫以来啊，我就独得皇后娘娘恩宠"
757,"看着好温馨"
757,"哄个皇后我容易吗"
758,"有这些得力助手非常好"
758,"好你个大猪蹄子"
758,"尔晴不要黑化好嘛，现在太好了"
758,"朕可真可爱"
758,"我就想说璎珞这么强大，娘娘怎么会跳楼"
758,"我怎么那么壮啊"
759,"四个人好温馨天下没有不散的延席"
759,"本宫早就想吃了，谁叫你们这么晚才来道歉！"
759,"一想到尔晴要黑化就觉得好伤"
759,"目前为止，长得美又自然的皇后，尔晴，"
759,"尔晴这二十多集都很好啊"
759,"我媳妇就是好"
760,"多美好的画面都是男人害的"
760,"一直这样下去多好不想皇后领盒饭"
760,"真的是好温柔的娘娘"
760,"我媳妇眼睛好大"
760,"要是能一直这么下去该多好啊"
760,"我好想跟傅恒秀个恩爱"
761,"这个时候的尔晴多好"
761,"你们这届学生是本宫教过最皮的"
761,"皇后好可爱！想吃"
761,"劝你们善良"
761,"真的是好温柔的娘娘"
761,"我媳妇眼睛好大"
762,"秦岚这个皇后太适合了，美丽端庄优雅高贵大方得体"
762,"我觉得我好善良啊"
762,"尔晴为什么要变坏呀？现在多好"
762,"朕的皇后就是溫柔"
762,"古时候的人不是不吃晚饭吗"
762,"我媳妇儿怎么这么可爱，越看越喜欢"
763,"多和谐，就这样一直下去多好"
763,"能不能别变坏，就这样多好"
763,"她们要是能一直这样该多好啊"
763,"就喜欢我媳妇这么聪明"
763,"我如果说一句尔晴有点可爱，会不会被追杀呢"
763,"朕的皇后就是溫柔"
764,"皇后一直活着就好了说不定不记得体夫妇就能圆满了"
764,"我们四个要能一直这样该多好啊我不想变坏啊"
764,"感觉皇后肩膀好宽"
764,"我家小璎珞鬼点子真多，编剧可否将此女赐给我？"
764,"秦岚肩好宽啊"
764,"这样多好啊，不明白为什么会黑化"
765,"其实感觉璎珞演员找的还是不太好，说话嘴幅度太大"
765,"为什么要变坏，四个人在一起多好"
765,"爱听说书的一般都厉害"
765,"多好的姑娘"
765,"尔晴现在多好，真的不想见她变坏"
765,"都二十多集了，尔晴还没黑化"
766,"皇后婢女都换衣服了高贵妃怎么除了那个戏服没件衣服换"
766,"看，这样多好"
766,"尔晴要一直这样多好！"
766,"本宫不管本宫最可爱"
766,"羡慕明玉有个好队友"
766,"尔晴我劝你善良"
767,"说蒲松龄出来那么早的是认真的吗？明朝出的人好吗猪"
767,"全是闲的一人给他们一部手机就好了"
767,"我还以为她说皇后是仙女不用吃饭吃香就饱"
767,"我最美最可爱，小仙女本仙"
767,"新的一天新的祈祷，高贵妃快点快点领盒饭"
767,"傅恒是尔晴和纯妃黑化的原因，都是因爱生恨"
768,"贵妃抗击打能力比较强，要是皇后可能要气死"
768,"看到这我还觉得尔晴很好"
768,"这是家啊…若是能一直这样该多好…"
768,"其实我看起来最舒服啦"
768,"皇后能有他们几个知心的人真好"
768,"是不是我没充钱，怎么就居配不到这样的队友"
769,"论有个帅弟弟的重要性。本宫这些助攻都冲本宫弟弟来的"
769,"我媳妇就是这么好，温柔善良善解人意"
769,"皇后娘娘多大岁数"
769,"璎珞好可爱"
769,"真的好白月光啊好爱啊"
769,"我媳妇就是这么强大"
770,"我突然觉得尔晴好可爱啊，还有明玉"
770,"瞧我多聪明"
770,"富察皇后是大清最善良贤淑的女人"
770,"我负责美丽端庄，你负责心狠手辣。"
770,"咋感觉一点也不灰暗啊，去皇城当宫女这么舒服刺激的么"
770,"都不带我飞全是你们在c不开心"
771,"现在看尔晴很好啊很温柔啊为啥会黑化"
