time,content
1421,"高段位的斗争开始"
1422,"以后高手对决开始"
1422,"我就不出来嘻嘻嘻"
1422,"好了剩下的都能打了"
1422,"现在咱们来对决吧"
1422,"纯贵妃还没领盒饭啊"
1422,"本宫走了，大家保重"
1423,"璎珞不该说破心里明白嘴上不说多好"
1423,"纯贵妃一点也不纯"
1423,"令妃怎么这么聪明，主角就是不一样。开了挂的聪明"
1423,"璎珞演的好。"
1423,"以后高手对决开始"
1423,"本宫走了，大家保重"
1424,"唉服个软多好"
1424,"我可真是个小机灵鬼"
1424,"现在剩下的都是高段位的"
1424,"该我上场表演了！！！！~"
1424,"璎珞妆浓了"
1424,"小吉娃娃精，你就不会敷衍两句好话吗？"
1425,"璎珞又要表现自己多聪明吗"
1425,"今天就有盒饭🍱吃了好开心😃"
1425,"璎珞妆容越来越浓了，看来越来越会算计了"
1425,"一眼看穿你的如意算盘"
1425,"层层筛选，最后留下的都是厉害人物"
1425,"又可以剪蜡烛了"
1426,"璎珞不要这么耿直说话好担心啊，心里清楚就行了啊"
1426,"看破不说破好吧"
1426,"这么耿直的说真的好吗"
1426,"成功晋级决赛"
1426,"阿佘太会演了，一脸不愠不怒色真是棒"
1426,"又可以剪蜡烛了"
1427,"害了那么多人杀了那么多没把她杀了都不错了"
1427,"令妃，你怎么可以这样，净说大实话"
1427,"璎珞假装应付皇后不是更好吗，干嘛要挑着来呢"
1427,"看我多厉害"
1427,"成功晋级决赛"
1427,"看破不说破好吧"
1428,"阿佘长的真的好大气"
1428,"皇后的盒饭也热好了，加了猪蹄"
1428,"要开始王对王了。这才是最厉害的"
1428,"接下来的剧情娴妃要VS璎珞了，本宫的小可爱要小心啊"
1428,"马上高手对决"
1428,"看我多厉害"
1429,"高手对决会更加精彩嘛，兄dei们说说看。"
1429,"纯答应你去吃盒饭吧"
1429,"不不不不是纯答应是苏答应"
1429,"我怎么这么聪明"
1429,"这么大的事只是进冷宫"
1429,"要开始王对王了。这才是最厉害的"
1430,"本宫要去给纯贵妃理发了"
1430,"本宫又能剪蜡烛了，开心！"
1430,"大猪蹄子你居然不赐死她，你忘了皇后吗"
1430,"魏璎珞我劝你善良"
1430,"主角啥大实话都敢往外勒"
1430,"纯妃，本宫要帮你梳中分了"
1431,"表示不想投靠皇后，但是好直接"
1431,"能活着，都是明白人"
1431,"为什么不杀了，打入冷宫也是便宜她了"
1431,"要开启巅峰赛了"
1431,"放心他俩不会斗起来的俩人约定互不斗互不相干"
1431,"主角啥大实话都敢往外勒"
1432,"说处罚太轻的人家也是生了孩子的看着孩子没有妈妈吗"
1432,"晚上又可以拉纯妃去照镜子咯开心"
1432,"哈哈令妃好耿直"
1432,"看到本高可爱单纯了吧!"
1432,"纯贵妃不杀？...有故事了，请开始你的表演"
1432,"要开启巅峰赛了"
1433,"乖乖！看来这个还是有很深的套路啊！魏璎珞和贤妃宣战"
1433,"你的高可爱突然出现"
1433,"皇后肩好宽"
1433,"盒饭没有肉呀，早知道这样就善良一点了😊"
1433,"纯贵妃，你麻麻叫你吃盒饭咯"
1433,"晚上又可以拉纯妃去照镜子咯开心"
1434,"纯妃害死皇后和永琮两条命竟然还能活着这处罚也太轻了"
1434,"不说了，纯贵妃饭盒热好了，本宫要去勒人了"
1434,"一般在古装剧里，妆一浓就是要黑化的前兆"
1434,"好了现在是王者段位pk"
1434,"全局最厉害的两个人擦出了火花"
1434,"你的高可爱突然出现"
1435,"好了好了你俩可以决赛了"
1435,"想拉拢我，没这么容易"
1435,"好了本宫要回去剪蜡烛了"
1435,"一个哼也能飚演技这就是演员"
1435,"好可爱我记得你啊"
1435,"好了，现在是王者局了"
1436,"皇后怎么不继续装了……装着贤惠大度多好"
1436,"本宫什么都敢说就是不投靠皇后😂就是那么强大"
1436,"璎珞最近的眼线画得好浓"
1436,"王者局要开始了吃瓜真开心"
1436,"佘把这个角色诠释得不错，但璎珞也可以"
1436,"一个哼也能飚演技这就是演员"
1437,"好了本宫宣布顶峰王者总决赛开始"
1437,"好了该本宫出场了"
1437,"好开心又要剪蜡烛了"
1437,"冰箱里面的东西都收拾好了"
1437,"皇后毕竟是皇后，令妃也太直白了吧"
1437,"接下来就是高手对高手了"
1438,"不不不，还有个青铜躺赢的陆晚晚"
1438,"这下知道本宫有多好了吧"
1438,"这么说话就轻松多了"
1438,"纯妃盒饭好吃吗"
1438,"好了本宫宣布顶峰王者总决赛开始"
1438,"好开心又要剪蜡烛了"
1439,"纯妃段位掉的好快"
1439,"看到纯贵妃有报应，太开心了"
1439,"导演真是不错，演的太好了，别的都不爱看"
1439,"本宫最大的优点就是诚实"
1439,"要是继后是好的多好啊"
1439,"不不不，还有个青铜躺赢的陆晚晚"
1440,"愉妃果然是好的啊"
1440,"要开始真正的对决了好紧张"
1440,"以后就是高手间的对决了"
1440,"拜拜，小伙伴们，本宫下线了，你们接着玩"
1440,"现在发现高贵妃才是最善良的"
1440,"璎珞是吃避孕药了吗"
1441,"闲妃也不容易"
1441,"两大高手马上要过招了"
1441,"两大佬要准备开大了"
1441,"要准备嗦哈咯精彩精彩啊"
1441,"说荣耀王者战场的厉害了"
1441,"纯妃高可爱等着你哦～"
1442,"感觉皇后盒饭也热好了"
1442,"本宫酷不酷鸭？啊？"
1442,"后面就是高手对招强强对决了"
1442,"本宫就是这么厉害"
1442,"这剧两个皇后角色都选的很好"
1442,"两大高手马上要过招了"
1443,"好开心，快走回去剪灯啦😄"
1443,"纯贵妃我劝你善良"
1443,"顺妃是什么回事，帮哪边的"
1443,"好开心，掩饰不住的开心"
1443,"马上开始了高段位的对决"
1443,"后面就是高手对招强强对决了"
1444,"令妃：排好队一个一个的黑化，一个个的来领盒饭"
1444,"本宫又可以剪蜡烛了，好开心啊！"
1444,"干嘛要说出来自己知道就好"
1444,"好了本宫要去剪蜡烛了各位"
1444,"高手之间的较量要开始了"
1444,"本宫要剪蜡烛了你们瞧好了"
1445,"难怪看还珠的时候只剩皇后和令妃了，都是王者段位"
1445,"本宫就剩最后一根蜡烛了好开心啊"
1445,"下个就是闲贵妃皇后了"
1445,"大畅，你个大猪蹄子"
1445,"这片子的礼仪方面一点都不严谨啊~~"
1445,"好了本宫要去剪蜡烛了各位"
1446,"难怪香妃死那么快"
1446,"本宫要剪蜡烛🕯️了你分们瞧好了各位亲们。"
1446,"娴妃皇后才是魏瑛珞最强大的敌人。"
1446,"又可以回去剪蜡烛了，好开森"
1446,"又干掉了一个好开心啊"
1446,"好了现在只剩下王者们"
1447,"为什么处罚那么轻？让人毫无悔改之意"
1447,"高可爱想出来作妖"
1447,"高手要过大招了"
1447,"好开心又要剪蜡烛了"
1447,"好了，后宫四分之一决赛结束了，你们买了吗"
1447,"纯贵妃你等着"
1448,"手举这么高酸不酸"
1448,"完了完了，接下来就要对付本可爱了。好怕怕好怕怕…"
1448,"突然觉得高贵妃好单纯，现在好想念她"
1448,"就本宫最厉害大猪蹄子"
1448,"因为纯生了皇子，按规定是不能处死的"
1448,"高可爱可爱死了"
1449,"这样对比一下觉得佘诗曼演技好精致"
1449,"两大高手要对战了"
1449,"高贵妃死的最体面"
1449,"谁是最后的赢家，都要努力哦！"
1449,"心疼纯妃还好历史上她是皇贵妃"
1449,"完了完了，接下来就要对付本可爱了。好怕怕好怕怕…"
1450,"剪蜡烛的那个是认真的吗"
1450,"纯妃已被踢出群聊顺嫔即将加入群聊"
1450,"看到璎珞就感觉可能到了希望特别喜欢她性子"
1450,"不要认为少了一个对手，还有我呢。编剧快放我出来。"
1450,"高手对决，招招致命"
1450,"本宫才是王者段位"
1451,"这巅峰赛打得真激烈"
1451,"好开心本宫又可以剪蜡烛了"
1451,"这音乐厉害了，感人"
1451,"好开心，接下来到我领盒饭了"
1451,"最厉害的顺嫔，还没出场呢"
1451,"好了，剩下都是王者了"
1452,"好开心啊，又可以回去剪蜡烛啦"
1452,"明玉你太天真了没看到娴皇后这么厉害嘛"
1452,"皇后娘娘好眼光，走之前就培养了一个最强王者"
1452,"对我好开心"
1452,"害了两条命就只是打入冷宫这么简单"
1452,"宝宝好开森"
1453,"非要打着给富察皇后的名义，直接说自己要步步高升多好"
1453,"本宫要去了！生的伟大，死的光荣"
1453,"纯贵妃虽害了七阿哥，但也生了儿子，所以皇上不会杀的"
1453,"太好了找到了杀七阿哥的人"
1453,"五阿哥小组赛到淘汰赛到现在的半决赛，真不容易啊"
1453,"我做鬼也不会放过纯贵妃的"
1454,"太扯了之前纯妃智商这么高现在也太刻意明显了"
1454,"突然想想本宫还真是单纯可爱"
1454,"好开心呀好开心"
1454,"可想而知，本宫才是最善良的人呐！"
1454,"尔晴的盒饭也快好了"
1454,"我好开心啊！"
1455,"做了这么多坏事，就只降为答应，太便宜她了"
1455,"我单纯，我骄傲，我为后宫省布料"
1455,"本宫留了盒饭给纯答应，快来快来"
1455,"纯贵妃为什么没被诛九族"
1455,"可想而知，本宫才是最善良的人呐！"
1455,"我好开心啊！"
1456,"杀了皇上最宠爱的皇子就只是降为答应这么简单？"
1456,"好，待会有人下来给本宫赔罪了"
1456,"皇后出来吧七阿哥得死弄清楚了"
1456,"这下好了皇后就剩我和你了"
1456,"皇后的段位高你们是斗不过的"
1456,"好开心嘤嘤嘤"
1457,"好了好了现在该我领盒饭了吧"
1457,"你的高可爱突然冒出"
1457,"马上要进决赛圈了，好紧张"
1457,"你以为就完了我还妹出场呢你以为我善良？"
1457,"两个高段位过招真是火花带闪电，真刺激"
1457,"好，待会有人下来给本宫赔罪了"
1458,"明天我们看尔晴领盒饭，好激动"
1458,"纯可爱快来啊，一起吃盒饭"
1458,"等容妃一出场，就是最厉害的三个在斗了！！精彩"
1458,"感觉本宫才是最单纯的人"
1458,"冷宫就完事了？？一个皇后一个太子，命就这么便宜？？"
1458,"马上要进决赛圈了，好紧张"
1459,"这么一看，高可爱真的是青铜段位"
1459,"回家剪蜡烛咯本宫好开心好开心"
1459,"若再来一次，你是否会对那个一生善良的女人有一点悔恨"
1459,"你们这帮大猪蹄子，小浪蹄子！看朕爱妃交钱了吗"
1459,"璎珞相信的，拼死也要保护，她懂感恩又极其忠诚～"
1459,"虽然我走了，但是大家也要元气满满哦"
1460,"这么大的罪，没有让纯妃去死呢"
1460,"本宫去剪蜡烛了"
1460,"一提到皇后娘娘魏姐眼睛一片光明"
1460,"我什么时候死啊"
1460,"令后大旗永不倒"
1460,"回家剪蜡烛咯本宫好开心好开心"
1461,"每次提到皇后璎珞的眼神就很温柔"
1461,"别急我还没棒我前皇后报完仇现在这个皇后也必须盒饭"
1461,"该高手对决了"
1461,"肯定是一波刚平，一波又起"
1461,"这么大的罪，没有让纯妃去死呢"
1461,"一提到皇后娘娘魏姐眼睛一片光明"
1462,"璎珞说妈呀报完仇了我可以去找傅恒了"
1462,"本宫不开心，做鬼也不会放过纯答应的"
1462,"错，高兴的太早还有娴妃也得死"
1462,"别忘了我，我耳晴也参与了谋害皇后娘娘"
1462,"每次提到皇后璎珞的眼神就很温柔"
1462,"别急我还没棒我前皇后报完仇现在这个皇后也必须盒饭"
1463,"别的剧都是蛰伏很久，这部剧这么轻松就复仇，太快了"
1463,"纯贵妃本宫劝你善良"
1463,"璎珞真的长的好像吉娃娃"
1463,"本宫太高兴了，高兴得不得了"
1463,"杀害自己孩子珍重竟然是闺蜜，要对身边人防备啊"
1463,"璎珞说妈呀报完仇了我可以去找傅恒了"
1464,"漏洞太大怎么就知道丫鬟说的是真的，如果是被逼说的呢"
1464,"别怕别怕纯妃，我和皇后准备了很多好吃的"
1464,"两个最聪明的人之后还有得斗"
1464,"本宫实在是太单纯了…太单纯了"
1464,"我真是太厉害了，到现在了还没有出场"
1464,"本宫太高兴了，高兴得不得了"
1465,"高贵妃：靠，你们都玩这么大？是老娘太单纯"
1465,"快去帮我热饭盒吧，待会儿我就来吃了"
1465,"为啥璎珞眉毛不一般高啊"
1465,"宝宝最可爱，宝宝最单纯"
1465,"这妆顺眼多了"
1465,"看来还是本宫最单纯"
1466,"这么容易就召供了，是为了让纯贵妃赶紧领盒饭吧"
1466,"感觉璎珞跟先皇后长得越来越像了....怎么回事"
1466,"这部剧复仇成功的点来得都好快好突然"
1466,"皇后再厉害也斗不过小燕子"
1466,"要是没有那个太监。我觉得皇后一直不会下马，智商高"
1466,"本宫劝你们善良"
1467,"开心到大小眼~好可爱"
1467,"大猪蹄子脑瓜疼"
1467,"眼睛画的好圆"
1467,"我这集没出来好开心啊"
1467,"就是害死了两个重要的人还不处死"
1467,"皇后再厉害也斗不过小燕子"
1468,"令后大旗我来抗"
1468,"我大鸡腿都备好了什么时候能吃上"
1468,"又可以回家剪蜡烛了，想想就兴奋！"
1468,"本宫，还没给你发现，这些都是本宫布的局吧，快给饭盒"
1468,"纯妃杀青后要去天庭做上仙了，下凡历劫而已"
1468,"愉妃牺牲大了"
1469,"怎么不播纯贵妃听到打入冷宫这一段，好想看她表情"
1469,"本可爱吃着盒饭都怕这几个本可爱哪里玩的过"
1469,"好了该顺嫔上场参战了"
1469,"哼小样厉害的还在后头"
1469,"只是打入冷宫太轻了，为何不直接赐死"
1469,"我大鸡腿都备好了什么时候能吃上"
1470,"魏璎珞和纯妃左右脸差别太大了吧，看着我总觉得花眼"
1470,"纯妃来盒饭帮你热好了吃吧"
1470,"皇后早就知道是纯贵妃干的"
1470,"怎么不播纯贵妃听到打入冷宫这一段，好想看她表情"
1470,"好了该顺嫔上场参战了"
1470,"哼小样厉害的还在后头"
1471,"这一段戏那么精彩节奏快的完全让人看了不激动啊……"
1471,"还好本宫死的早也算体面"
1471,"想看看在冷宫的纯答应是什么样子"
1471,"好了，本宫去香蜜了"
1471,"尔晴:快了快了，快领盒饭了"
1471,"皇后早就知道是纯贵妃干的"
1472,"真的太聪明看得太清楚了，皇后"
1472,"高可爱富察可爱她们等我我搓麻将呢，赶紧安排下我啊"
1472,"这么大的罪只是冷宫难怪那么多人范错"
1472,"本宫回家剪蜡烛喽好开心"
1472,"那些说蜡烛的，那是灯芯好吗😂️"
1472,"最喜欢的就是明玉，爱恨分明"
1473,"有时候让人活着比死还难受，纯贵妃要是死了才是便宜他"
1473,"来来来静好一起斗地主"
1473,"看来看去还是宁馨儿最善良"
1473,"我好开心啊现在都还没出场"
1473,"我说璎珞看起来眼熟👻原来是像董卿"
1473,"本宫还没出场呢。别高兴得太早。😂"
1474,"好想念富察皇后，温暖又善良的皇后"
1474,"看起来还是本可爱最单纯"
1474,"那些给纯妃准备饭的也太善良了，让她吃屁吧"
1474,"本宫范了这大的罪，想去死"
1474,"前半辈子为姐姐而活，后半辈子为先皇后而活。"
1474,"大猪蹄子你居然不杀了纯妃"
1475,"尔情明天就要领盒饭了好开心"
1475,"本宫的好闺蜜纯妃快来搓麻将"
1475,"皇上下人尊卑演的很得体的。比其他剧好。"
1475,"哇，你们的手段好厉害呀"
1475,"这么容易被别人搬到纯贵妃，当时何必想为容音报仇"
1475,"好想念富察皇后，温暖又善良的皇后"
1476,"那些耍高贵妃善良单纯的人怕是对这两个词有什么误会"
1476,"被打入冷宫我好开心啊"
1476,"知道什么叫母凭子贵了吧，生下一位阿哥等于免死金牌"
1476,"本宫劝你还是不要那么客气"
1476,"突然觉得膏贵妃好善良啊"
1476,"皇上纯妃已经去领盒饭了，什么时候轮到我啊，"
1477,"你们一天不是大猪蹄子，就是盒饭，很饿好吗"
1477,"纯贵妃，快来和本宫一起吃盒饭🍱！可好吃了！"
1477,"纯贵妃的盒饭领得快"
1477,"你们都忘了本可爱和富可爱了吗？"
1477,"这么大的罪，怎么罚的这么轻"
1477,"我好像又要拉人照镜子了，好嗨森"
1478,"第几集是尔晴的盒饭之日[疑问]祝他死的愉快哈"
1478,"剧情跳得好快，都没我什么事了"
1478,"璎珞长得像吉娃娃"
1478,"看看都看看，这都是啥阴招呀，顿时觉得本宫是最单纯的"
1478,"富察皇后：好可爱"
1478,"高兴的想爬起来跳支舞"
1479,"据说皇后和纯贵妃还是闺蜜呢真是防火防盗防闺蜜啊"
1479,"尔晴，盒饭已经帮你热好了，还给你加了个鸡腿。"
1479,"问为什么不杀纯贵妃那个，她是六阿哥的亲妈不可能杀她"
1479,"娘娘您看璎珞现在越来越乖了也懂得隐忍了"
1479,"愉妃是故意的吧拖垮纯贵妃"
1479,"本宫想把纯答应赐给袁春旺"
1480,"高贵妃：纯可爱快来，本宫等你❤"
1480,"高贵妃嘉嫔富察皇后纯贵妃可以凑一桌打麻将了"
1480,"生了皇子的，犯了天大的错也不会杀的"
1480,"丽丽丽丽丽丽我看到这里啦你个大猪蹄子"
1480,"原来只有高可爱最单纯啊"
1480,"娘娘您看璎珞现在越来越乖了也懂得隐忍了"
1481,"有效抑制细菌引起炎症了你可曾想到他被咬掉鼻子又塞着"
1481,"好开心又要回去剪蜡烛了"
1481,"主角光环真的大，她姐姐报仇是让雷劈死仇人。"
1481,"纯妃本宫热了盒饭来一起吃"
1481,"没有凌迟处死真实便宜她了"
1481,"自古以来后宫的人犯错很少被处死的，会死的都是暗斗死"
1482,"不知道为什么每次看愉妃都会看成偷妃"
1482,"看的本宫好激动啊"
1482,"高可爱走的第n天，想她"
1482,"傅璎大旗不倒"
1482,"本宫要去跟容音还有宁馨儿打麻将了"
1482,"虽然本宫走了，希望大家也努力加油一起去领饭盒"
1483,"毛骏元你个大猪蹄子！大猪肘子！大猪尾巴！"
1483,"就我最可爱，最天真最单纯"
1483,"盒饭热一热，打包带走"
1483,"盒饭里有个大猪蹄子"
1483,"还是高可爱善良啊"
1483,"外面的雨下的跟本宫黑化那天一样大"
1484,"高可爱走的的第N天想她想她想她"
1484,"瑜妃纯妃快来和我还有高可爱一起打麻将"
1484,"那个说令妃长得像壁虎的人才请站出来"
1484,"好激动呀！晚上又可以拉人照镜子啦"
1484,"玉壶怎么不说出来纯贵妃因为傅恒才这样的呢？"
1484,"朕宠信多年的女人却不配为人！！脑仁疼！！"
1485,"大猪蹄子是什么意思"
1485,"来来来，这盒饭贼香，尔晴也来一份？"
1485,"纯贵妃赶紧领盒饭吧"
1485,"纯贵妃领盒饭去吧"
1485,"皇上的龙好抢镜啊"
1485,"大猪蹄子你不帮我报仇"
1486,"我觉得纯妃害了两个人，罪罚太轻了"
1486,"何止两张面孔！现在知道本宫多善良美好了吧？"
1486,"啥时候到我啊，等着热盒饭"
1486,"听说你们觉得本宫最单纯了"
1486,"纯妃饭盒领的太轻松了"
1486,"别再说高贵妃单纯了好吗。她只是单蠢，害人不成功而已"
1487,"对比纯妃，高可爱算还好"
1487,"女人真阔怕"
1487,"香蜜那边纯妃也要领盒饭了"
1487,"今个是真呀真高兴"
1487,"海兰察越看越帅怎么办？谁来救救我"
1487,"本宫最可爱啦！"
1488,"海兰茶越看越顺眼"
1488,"现在是半决赛，比赛进入了白热化阶段"
1488,"纯妃盒饭领的有点随意啊"
1488,"小丫头片子竟然还有两副面孔呢"
1488,"果然小燕子的脾气都是令妃教出来的"
1488,"嗯～这盒饭真香!"
1489,"谋害皇子，间接害死皇后才进冷宫，这惩罚太轻了吧"
1489,"还是本可爱最单纯"
1489,"只能是是得到了慰藉，高兴谈不上"
1489,"导演我可以吃盒饭了吗饿死本宫了本宫要七个鸡腿"
1489,"为什么都要热盒饭啊.他们哪还有脸吃盒饭"
1489,"皇上的地毯好次啊"
1490,"呵大猪蹄子受到了惊吓来自灵魂深处的发问"
1490,"快到我了，好紧张，我已经闻到香味了"
1490,"这海兰察多大了啊还不娶妻"
1490,"本宫直接从钻石掉到青铜了"
1490,"大嘴察真可爱"
1490,"哎，纯飞吧"
1491,"皇上小可爱这个问题问得好"
1491,"女人好阔怕"
1491,"所谓的好闺蜜会害死你"
1491,"饭盒热好了没"
1491,"大猪蹄子也有"
1491,"呵大猪蹄子受到了惊吓来自灵魂深处的发问"
1492,"大猪蹄子你女人太多了，一个容音就够了也不会打架"
1492,"大猪蹄子才发现女人都有两张面孔？"
1492,"大猪蹄子：女人真阔怕"
1492,"我马上要准备领盒饭了，好开心啊"
1492,"海兰察：我踏马哪知道我还没谈恋爱呢你个大猪蹄子"
1492,"大猪蹄子你可以直接问你的金姐"
1493,"温柔还是没有用的，娴妃在这里诠释的皇后真的是好太多"
1493,"纯贵妃下来打麻将了"
1493,"说七夕一个人好开心的，怕别人不知道你单身"
1493,"女人都是大猪蹄子"
1493,"女人太多，皇上看不清了"
1493,"大猪蹄子才发现女人都有两张面孔？"
1494,"大猪蹄子，不只是女人有两张面孔，是人都有两张面孔！"
1494,"大猪蹄，什么意思，开始怀疑本宫了？"
1494,"富璎大旗不倒"
1494,"我明晚领盒饭有人帮我热嘛？"
1494,"大猪蹄子你最有经验，干嘛问别人"
1494,"女人太多，皇上看不清了"
1495,"不止两张面孔大猪蹄等着看吧"
1495,"大猪蹄子，你没听明白海兰察这是在问你要媳妇儿吗"
1495,"现在的皇上比年轻时候的齐三公子有魅力"
1495,"恭喜纯贵妃妹妹领盒饭来我们一起吃"
1495,"海兰察气质真好，越看越顺眼。"
1495,"大猪蹄子，不只是女人有两张面孔，是人都有两张面孔！"
1496,"皇上好可爱"
1496,"高可爱还真是可爱"
1496,"你不用出现了，精彩环节你出现干什么"
1496,"纯妃领盒饭，愉妃也不远了"
1496,"皇后要开始虐卫龙cp了吗"
1496,"大猪蹄子什么梗"
1497,"大猪蹄子可能是最单纯的人了哈哈"
1497,"大猪蹄子我告诉你不止两张😂😂😂😂"
1497,"高贵妃静好去陪你了"
1497,"哟，小丫头片子竟然有两幅面孔"
1497,"大猪蹄子脑瓜疼"
1497,"我可没有两张面孔"
1498,"璎珞眼神温柔说明演技好"
1498,"哪天有个孩子不是自己的都不知道"
1498,"导演给我热饭，我快饿死了"
1498,"静好，本宫好孤单啊，快来呀！"
1498,"纯妃倒的好容易呀"
1498,"大猪蹄子可能是最单纯的人了哈哈"
1499,"大猪蹄子怀疑人生了"
1499,"好开心快要吃饭了"
1499,"容音和明玉都是单纯的只有一张面孔的"
1499,"喝喝比起你们的段位本宫顶多是个钻石本宫佩服"
1499,"海蓝察好可爱呀"
1499,"海兰茶大人怎么这么可爱"
1500,"大猪蹄子，你还不明白，只有容音才是真正的小天使"
1500,"海兰察这羞涩是怎么回事"
1500,"海兰察：我都那么暗示你了赶紧赐婚于我啊大猪蹄子"
1500,"还记得高可爱吗？"
1500,"大猪蹄子怀疑人生了"
1500,"容音和明玉都是单纯的只有一张面孔的"
1501,"令妃你锋芒太露了是主角光环太强了吗"
1501,"大猪蹄子的印章是真滴多啊"
1501,"皇上：啊脑阔疼"
1501,"你们看吧还是本宫最单纯"
1501,"你这么多女人都不知道，小海怎么知道呢"
1501,"大猪蹄子你也有"
1502,"海兰察好温柔正直，想嫁"
1502,"你们段位太高，幸好走的早，玩不过你们，怕了怕了"
1502,"海兰察说话声音好温柔"
1502,"我真滴好单纯呦"
1502,"每个人都有两张面孔好吧，又不是只有女人"
1502,"纯妃姓苏，名静好"
1503,"奴才还没有娶妻，不像皇上已娶了那么多"
1503,"大猪蹄子才发现女人有两张面孔"
1503,"不光女人，是人都有多张面孔"
1503,"海兰察套路很深啊，很聪明"
1503,"这么害羞的吗哈哈哈好可爱"
1503,"海兰察好温柔正直，想嫁"
1504,"感觉在疯狂暗示快给我赐婚婚婚婚婚"
1504,"皇后娘娘，帮我热好饭，马上到！"
1504,"两张嘴是肯定的。面孔有木有这不清楚。"
1504,"傅璎大旗不倒"
1504,"你不要娶明玉小可爱，娶了就活不长了"
1504,"不光女人，是人都有多张面孔"
1505,"海兰察你害羞的样子好可爱"
1505,"让你去娶那么多女人"
1505,"在暗示你赐婚阿你个大猪蹄子"
1505,"海兰察不要怕。明玉很单纯的"
1505,"追我阿佘而来，真心演技好"
1505,"朕的女人有几个好的"
1506,"大猪蹄子怀疑人生了"
1506,"女人好阔怕"
1506,"真希望海和明玉能圆满"
1506,"大嘴猴好可爱"
1506,"哇哥怎么长得像令妃"
1506,"海兰察不要怕。明玉很单纯的"
1507,"和纯贵妃交好背叛了皇后皇上还没听出来吗"
1507,"是啊，女人都是两张面孔，你看看尔晴就知道了"
1507,"谁让你曹那么多女人呢？你只曹一个不就天下太平了？"
1507,"顺妃:是时候表演真正的技术了"
1507,"金星:看到姐这姐怎么收拾你"
1507,"大猪蹄子怀疑人生了"
1508,"就是你们话多，看的人多了去了"
1508,"叫你们从良都不听排好队领盒饭"
1508,"纯贵妃不纯.领盒饭去吧"
1508,"我绿到现在，马上就要去领盒饭了"
1508,"看剧的朋友们为了五阿哥，都宽容了愉妃"
1508,"是啊，女人都是两张面孔，你看看尔晴就知道了"
1509,"公公表情好可爱"
1509,"问我问我，我为皇上详细解答"
1509,"纯贵妃不纯啊"
1509,"我为什么还不领盒饭，快饿死了"
1509,"所以说你是大猪蹄子啊"
1509,"明玉也快下来打麻将了吗"
1510,"尔晴、纯贵妃和娴妃都是一家啊！这基因遗传的太好了！"
1510,"你们不觉得最近没风吗？我渡劫完毕要回天上刮风去了"
