time,content
628,"自古深情留不住，总是套路得人心。皇上个大猪蹄子！！"
628,"晚晚好可爱"
628,"这个小浪蹄子又出来作妖了"
628,"本宫的妃位还没降你们胆也忒大了吧"
628,"额头都疼让人"
629,"大眼袋大眼袋大眼袋"
629,"我家晚晚最善良"
629,"晚晚是个好菇凉"
629,"最爱晚晚了"
629,"能活这么久不容易这个鼠贫"
629,"舒贵人我劝你善良"
630,"晚晚请做永远的天使吧！现在已经没有天使了"
630,"好大只的这个姑凉别跟着这女人了，跟本宫吧，带你翻盘"
630,"本宫听说舒嫔都能活到最后，本宫好冤阿"
630,"我劝你善良"
630,"庆贵人好高啊"
630,"我都放下屠刀了你非要来惹我"
631,"庆贵人跟着这么久也没变坏真是不容易"
631,"舒贵人我劝你善良不然让你活不过下集"
631,"晚晚是心地最善良的"
631,"这么多集才知道她叫庆贵人"
631,"晚晚好善良喜欢你"
631,"活腻了敢动明玉姐姐"
632,"晚晚好高啊花盆底几乎没有高度"
632,"晚晚太可爱了"
632,"纳兰纯雪自作孽不可活啊"
632,"盒饭可好吃了，舒嫔快来和我一起吃啊"
632,"晚晚是最大的赢家"
632,"越看大个子越可爱"
633,"庆贵人安安份份活了五十多集才是最大的赢家😂"
633,"庆贵人好高啊"
633,"完了完了本来魏姐报完仇就此收手，你这是逼她热盒饭啊"
633,"谁敢欺负明玉，谁就是大猪蹄子"
633,"不作妖活的久，庆嫔娘娘就是最好的证据。"
633,"越看大个子越可爱"
634,"庆贵人，一定有大用。要不然不会有这么多镜头"
634,"纳兰活这么久也是难为她了。快来陪我吃盒饭"
634,"晚晚以后会是璎珞的好朋友"
634,"晚晚好温油"
634,"晚晚衣服好清新"
634,"晚晚才是最后的赢家"
635,"晚晚后面还有重要戏吗"
635,"庆贵人这么美，导演能不能安排我宠幸一下啊"
635,"旁边那个好善良，就是没得戏份"
635,"舒贵人我劝你善良"
635,"晚晚你是最大赢家"
635,"下一个大眼袋领饭盒"
636,"晚晚小天使会不会变坏啊"
636,"晚晚继承了本宫的温柔"
636,"一直不明白陆晚晚的存在是为了什么."
636,"庆贵人跟本宫最单纯了"
636,"你就是最大的大猪蹄子"
636,"庆贵人喝纳兰是一对cp吗"
637,"晚晚不要跟这个坏女人玩"
637,"你可以去死了"
637,"这人怎么活了这么长时间"
637,"沉不住气，蠢货"
637,"晚晚是真的好。"
637,"我什么时候出来。"
638,"庆贵人远看像个魁梧的男子，近看又很柔弱的样子"
638,"上一个死的告诉你们盒饭好吃"
638,"人陆晚晚可是历史上的太后娘娘啊"
638,"这么多集了，老娘还没出来"
638,"晚晚和容音真是全剧最善良的两人了"
638,"敢欺负我明玉，看我后面怎么给你一巴掌"
639,"晚晚单纯善良啊"
639,"我怎么没发现书品边上有个声音这么好听的贵人"
639,"晚晚好善良啊"
639,"舒贵人我看你是想吃盒饭了"
639,"我就叫晚晚"
639,"纳兰戏份好多，难道带资进组？"
640,"演晚晚的作用是什么"
640,"本宫劝你善良你不听给我等着"
640,"晚晚是下一个贤妃"
640,"树皮我劝你善良"
640,"舒贵人能活那么久，这是大清的奇迹"
640,"晚晚单纯善良啊"
641,"晚晚一直有舒嫔护着"
641,"舒嫔你是不是饿了？"
641,"眼袋和卧蝉分不清的是不是二傻子"
641,"怎么还不放我出来"
641,"还是晚晚最善良"
641,"怎么感觉舒贵人很蠢呢"
642,"庆贵人是个傻白甜啊哈哈哈好可爱"
642,"舒贵人我劝你善良"
642,"晚晚才是最善良的"
642,"老娘还会回来的哈哈哈哈哈哈"
642,"就你活的最久"
642,"我还没出来?"
643,"舒贵人好棒，50多集都没领盒饭，叫你一声舒坚强"
643,"敢欺负我家大可爱？活够了？"
643,"这两个人怕是一张脸吧。长得这么像我去脸盲"
643,"活的真久这女人"
643,"晚晚陪着劝了50多集了，也不嫌烦"
643,"头皮屑演的好"
644,"这个陆晚晚存在的意义是什么"
644,"舒嫔活的真是够久了"
644,"晚晚小可爱是怎么会下来的"
644,"婉婉你的盒饭热好了"
644,"晚晚的花瓶底是平的"
644,"盒饭热一热"
645,"因为她就演的是陆晚晚这个角色不知道的人回去看第一集"
645,"舒贵人，我劝你善良"
645,"晚晚好高啊"
645,"舒贵人你是想吃盒饭了"
645,"晚晚也成了皇贵妃"
645,"这个陆晚晚存在的意义是什么"
646,"你怕是不知道厉害"
646,"盒饭我给你热好了，是时候给你吃的"
646,"盒饭热一热"
646,"一个从来没有得过宠的嫔妃橫什么横"
646,"这脑袋上的蓝莓是认真的吗?方便吃?"
646,"你也要有那个智商才行啊"
647,"晚晚并不善良吧，所有的事都看着也不拦，还一直在一起"
647,"别人都是伪君子，只有舒嫔是真小人。咋看咋不像好人"
647,"晚晚才是最强王者"
647,"纳兰下一个是你领盒饭"
647,"同问，晚晚的作用是什么"
647,"本宫啥儿时候能出场啊"
648,"晚晚到后面帮了大忙"
648,"舒嫔是饿太久了吧？盒饭管够"
648,"晚晚这么善良怎么活到现在的"
648,"我就算死也不吃盒饭！嗯~真香"
648,"晚晚太高了"
648,"哎。我都放下屠刀了你们还是要找死"
649,"温柔的那个妃子是晚晚？"
649,"我劝你们都给我善良"
649,"那是陆晚晚吗"
649,"又一个送人头的"
649,"你的盒饭热好了"
649,"舒嫔是饿太久了吧？盒饭管够"
650,"袁春旺长的真像鹦鹉，特别是嘴巴看了好出戏"
650,"那个晚晚的太高了，穿的鞋都不一样"
650,"还是晚晚最可爱"
650,"风水轮流转，舒贵人等着吃盒饭吧"
650,"庆贵人最后的赢家从这里就有铺垫了善良"
650,"想吃盒饭是吧"
651,"因为晚晚很高"
651,"我看你该洗干净手吃饭了"
651,"舒嫔头上的珠钗是掏耳朵用的吗"
651,"人家位份还是比你高"
651,"一直喜欢这个庆贵人太美了"
651,"善良得没有一点用"
652,"还以为高贵妃挂了舒嫔也会挂，结果活怎么久"
652,"来比比谁脖子更干净"
652,"舒贵人旁边那个个子比较高的那个叫啥"
652,"你饿了就来本宫这里吃盒饭吧，纳兰妹妹"
652,"大猪蹄子现在咋不出现啊？"
652,"想领盒饭了吗"
653,"晚晚是嘉庆的养女母，和令妃笑到最后"
653,"舒嫔总怕本宫忘了你你是担心盒饭馊的太厉害吗🤪"
653,"晚晚和舒嫔活到了最后，躺赢"
653,"你段位不高不配和我刚"
653,"晚晚是后妃吗"
653,"就你，快省省吧"
654,"你敢动海兰察和令妃的人，怕是急着杀青吧"
654,"等着就等着！来呀！我告诉你，我还叫大猪蹄子来观战！"
654,"这个好高好高的贵人好可爱"
654,"盒饭已经为你热好"
654,"庆贵人是怎么活到这么多集的啊"
654,"为啥要洗干净脖子。"
655,"洗干净脖子等死吧舒嫔"
655,"一个青铜也敢挑战王者！！厉害了！！等着领盒饭吧！！"
655,"我喜欢晚晚"
655,"心疼死我家明玉了呜呜呜呜呜"
655,"爱是一道光，绿到你发慌"
655,"脖子洗干净了，好熟悉的话"
656,"晚晚最善良了"
656,"舒嫔你是想吃盒饭了啊，本宫给你热"
656,"晚晚才是最后赢家"
656,"洗干净脖子，等死吧！，"
656,"看样子你想领盒饭了"
656,"你跟人家令妃可不是一个段位的"
657,"晚晚才是最高段位"
657,"大胆舒嫔！晚上等着我去找你！"
657,"杨幂好温柔"
657,"大眼袋开始了"
657,"装什么大尾巴狼。。"
657,"舒嫔是活够了吧"
658,"晚晚是最后的赢家，抚养了下一届皇上"
658,"你也好好等着盒饭"
658,"头上的塑料花演得好"
658,"你可拉倒吧就你那智商"
658,"来的真及时"
658,"这眼袋真像猪儿虫一样"
659,"可爱的晚晚"
659,"我看你个小家雀能怎么得瑟"
659,"你想多了，以你的能耐那是不可能的事"
659,"也不看看你什么段位"
659,"海兰察快爱来"
659,"明玉，你在做什么啊"
660,"大嘴猴大旗扛起来"
660,"本宫劝你善良"
660,"舒嫔我劝你善良"
660,"我连尔晴都敢赐死，你是也想吃盒饭吗"
660,"我劝你善良"
660,"不知道魏樱珞还能不能翻牌"
661,"没想到舒贵人能活这么久"
661,"哭了哭了来的刚刚好"
661,"艾伦:洗干净脖子等死吧"
661,"大嘴猴大旗摇起来"
661,"护妻模式强制开启"
661,"庆贵人，很适合做妻子"
662,"舒嫔充钱了吧活这么久？！"
662,"皇上个大猪蹄子"
662,"庆常在每次说话都觉得很突兀，像在背台词"
662,"纳兰才是真爱，永不下线"
662,"饭盒给你准备好了，还有你最喜欢吃的西兰花"
662,"就没见皇上找过舒嫔"
663,"庆贵人很好，但是太善良"
663,"朕这么聪明，居然让这后宫女人耍的团团转"
663,"晚晚小天使"
663,"盒饭已经在热了"
663,"树欲静而风不止啊"
663,"盒饭很好吃，一起来啊"
664,"舒嫔我劝你善良，什么时候领盒饭"
664,"我以为舒嫔是个青铜，没想到还是个倔强青铜"
664,"为什么要洗干净脖子"
664,"刀剑无眼，舒嫔我劝你善良"
664,"这个陆晚晚挺不错的"
664,"盒饭已经在热了"
665,"明玉和海兰察大人长的好像，是亲兄妹还是所谓的夫妻相"
665,"舒嫔穿这么高的鞋还是矮"
665,"海兰察明玉夫妻相夫妻相夫妻相重要的事情说三遍"
665,"晚晚也要黑化？没理由吧"
665,"舒嫔穿那么高的鞋子还那么矮，她的鞋子好高"
665,"明玉最后那个表情演的好"
666,"为什么晚晚和舒嫔在一起那么久还没有被黑化"
666,"这舒妃最后都没死的"
666,"看你这纳兰纯雪还能活几集"
666,"你们去小红书看看侍卫的现代照吧，太帅了，比傅恒还帅"
666,"晚晚后来是贵妃"
666,"天道好轮回"
667,"陆晚晚才是最大的赢家，当了永琰的养母"
667,"好你个舒嫔下来陪本宫"
667,"超级喜欢晚晚"
667,"明玉马上也要领盒饭了是不是？"
667,"洗干净脖子等死吧"
667,"就你?担心自己脖子再说"
668,"晚晚衣服好清新"
668,"舒嫔玩归玩，闹归闹，别拿我明玉开玩笑，等着领盒饭吧"
668,"明玉的眼袋好重呀！"
668,"看着就疼啊"
668,"哎哟海兰察来的真是时候，娶了明玉吧，别让她受苦了"
668,"你只是个嫔，好歹是个妃，尊卑懂不懂？你这蠢货"
669,"晚晚是令妃儿子的养母你说她成在的意义大不大"
669,"舒嫔想吃盒饭了么快把舒嫔拖出去斩了"
669,"舒嫔能活这么久完全是因为她对谁都没有威胁力"
669,"你喜欢明玉吧为什么不打她"
669,"就这水平能活下来就是大吉了"
669,"舒嫔你的盒饭已经在等你了"
670,"令妃和晚晚笑到最后"
670,"一个青铜也想跟我斗？"
670,"我有个疑问，侍卫不是不能进后宫吗？"
670,"那两条眼袋是用水性笔画的么"
670,"有这么想吃饭盒的人？"
670,"欺负我明玉小可爱赶紧送他去领盒饭！！！！！！！！"
671,"看来苏菲是饿急了，急等着盒饭"
671,"来人把舒嫔的盒饭拿去喂狗"
671,"晚晚小天使"
671,"是不是活够了"
671,"书品怎么不换衣服"
671,"气死我了，欺负明玉"
672,"晚晚是好的跟着令妃"
672,"原以为是青铜，没想到是王者，晚晚加油"
672,"晚晚不会黑化"
672,"本宫劝你善良"
672,"你个青铜还敢跟王者打，怕是活腻了"
672,"这是个什么东西"
673,"庆贵人是不会得宠了吧，毕竟比皇上高啊"
673,"快让本宫看看，是不是都把本宫忘了"
673,"没想到是个倔强的青铜"
673,"舒嫔居然能活到现在"
673,"洗干净脖子厉害了👍"
673,"晚晚是好的跟着令妃"
674,"舒嫔对晚晚挺好的，做啥都带着，做坏事的时候就不带"
674,"我劝你善良"
674,"高妃二十多集就死了，舒妃这个二货居然五十集多都没死"
674,"舒嫔快领饭盒了"
674,"索伦侍卫和先皇后在现实中是一对朕真的又绿了"
674,"是我没收拾你，这个嘚瑟啊"
675,"陆晚晚其实人可善良了，就是不受宠爱"
675,"劝你善良你死定了"
675,"明玉皮肤真好啊"
675,"后宫佳丽三千在哪里后宫没有看到啊"
675,"本宫劝你善良"
675,"从第一集活到最后一集，哈哈"
676,"晚晚小仙女"
676,"导演本宫要举报舒贵人故意送人头。"
676,"后面宫女眼神演的好"
676,"我看你是找死"
676,"舒飞?真是涨的快"
676,"看哭了，心疼明玉"
677,"死眼袋是不是加钱了，戏这么多"
677,"她貌似还没被宠幸过"
677,"陆晚晚的鞋跟和魏璎珞的差别也太大了"
677,"盒饭好咯，快来领"
677,"陆晚晚是好的"
677,"导演本宫要举报舒贵人故意送人头。"
678,"这个眼袋我还以为双眼皮长反了呢"
678,"少说点话，看看晚晚活的就很长"
678,"海兰察也挺可爱的哈哈哈"
678,"这个配觉活的太久了"
678,"你是不是想领盒饭你自己说"
678,"你是不是想陪着我一块领盒饭"
679,"这个舒嫔啊，就是典型的小人"
679,"舒嫔，你是不是饿了"
679,"有血。。人家站在阴凉处看不见就说没血？"
679,"哦，我可不知道哦!。"
679,"后面那宫女戏怎么那么多"
679,"纳兰家怎么出了个这么没品位的"
680,"哇！手上戴的东西这么锋利的吗？就不怕不小心划到自己"
680,"劝你善良。要不然叫你下来陪我打麻将"
680,"索伦的刀反了吧？真遇到刺客拔的出来吗"
680,"盒饭味道很好吧个个都抢着吃"
680,"这集标题舒服"
680,"这个舒嫔啊，就是典型的小人"
681,"看过还珠格格都知道令妃有多受宠"
681,"等下欺负明玉的人也要穿绿衣服了"
681,"大眼袋什么时候领盒饭？"
681,"舒妃我劝你善良"
681,"这就是男人真好"
681,"舒嫔，你头上的花是认真的吗"
682,"这么多年还是个侍卫"
682,"是不是想领盒饭"
682,"快来快来排位就差你这一场就上王者了"
682,"快给她发盒饭"
682,"待会魏姐扇你巴掌了"
682,"舒嫔你走路都是歪的"
683,"庆贵人安排这个角色是有什么深意？"
683,"舒嫔你的眼袋是认真的吗？"
683,"那个时候戴的指甲原来是这样玩的呀"
683,"你那个卧蚕打多了玻尿酸吧😄"
683,"是时候该领盒饭了"
683,"待会魏姐扇你巴掌了"
684,"这一切都是因为大猪蹄子，但是大猪蹄子没有保护好樱珞"
684,"舒嫔盒饭给你热着了"
684,"这蠢驴怎么能活这么久"
684,"纳兰快来和我一起吃盒饭，我让导演给你加鸡腿"
684,"要是有坤坤就好了"
684,"纳兰最好玩了，一点都不像坏人"
685,"鹦鹉也绿了"
685,"是不是快要扇舒嫔耳光了？好激动！！！！！"
685,"人家起码还有自己的思维与意志，你不过是深宫的附庸"
685,"唉，这群人，迟早会遭报应滴"
685,"这群娘们儿没一个省油的灯"
685,"这些坏人，就等我收了你们吧"
686,"晚晚好高啊"
686,"晚晚好像是以后的太后真正的荣耀王者"
686,"居然敢伤害我们明玉，等着领盒饭吧你"
686,"这女该领盒饭了"
686,"欺负我马子命不要了"
686,"人倒霉低谷时候才能看清身边每一个人的嘴脸！人性恶！"
687,"这个大眼袋什么时候下线"
687,"这个卧蚕厉害了"
687,"站起来脸色的口子就没有了"
687,"舒嫔快领盒饭啦"
687,"舒贵人赶紧领盒饭。"
687,"这个高个子的挺好的"
688,"超级喜欢晚晚小天使"
688,"这死女人咋还没领盒饭😡"
688,"庆贵人真的好善良"
688,"好了护妻大佬上线"
688,"太气人了春望我劝你善良"
688,"舒嫔好大的眼袋丑绝了"
689,"陆晚晚长得好高，鞋底是最薄的，还比舒嫔高一头"
689,"纳兰我劝你善良不然就领盒饭吧"
689,"舒嫔的眼袋好重啊"
689,"全剧最不是猪蹄的男人是海兰察"
689,"海兰察的声音真的是嫩嫩的"
689,"舒嫔好大的眼袋丑绝了"
690,"晚晚好温柔啊"
690,"贵人说的好"
690,"舒嫔活了这么久了"
690,"晚晚多好呀。"
690,"双眼皮倒着长"
690,"这个头花认真的吗？"
691,"纳兰手上功夫了得不是扣人就挠人领盒饭好吗"
691,"好一个袁春望"
691,"晚晚多可爱有点像李沁"
691,"都死去吧！"
691,"善良的人还是美"
691,"你看你的眼袋，丑的要命"
692,"舒贵人是嫌命长"
692,"晚晚都还没侍寝"
692,"为啥这蠢货能活这么久"
692,"书评活的太久了"
692,"纳兰我劝你善良"
692,"算了，我现在支持璎珞，他们太墨迹"
693,"海兰察：你敢欺负媳妇，怕是不想活了吧"
693,"猪鼻猪脑，这情商给你1分不能更多了"
693,"我喜欢晚晚"
693,"陆雯雯好可爱呀"
693,"妃不是比嫔大吗？怎么还被欺负"
693,"舒嫔头上戴的花，以为自己是头牌吗"
694,"晚晚人超好的"
694,"这大眼袋吓我一跳"
694,"晚晚后面会黑化吗"
694,"舒嫔我劝你善良"
694,"眼袋好大哦"
694,"舒嫔这卧蚕真是厉害了"
695,"舒嫔是得了脊柱侧弯吗，就没见她站直过"
695,"少侠你眼袋有点大啊"
695,"高贵妃：本宫都吃盒饭这么久了，她还活着"
695,"袁春望善良不了了"
695,"晚晚是好人"
695,"你头上的花有点随意！"
696,"历史上舒嫔活的挺久的希望在剧里她快领盒饭"
696,"你先治治你眼袋好吗"
696,"觉得晚晚留着一定有用"
696,"一个舒嫔胆子这么大？"
696,"晚晚好像关格格"
696,"这个傻子怎么还活着"
697,"晚晚是最善良的路人"
697,"老舒，你的盒饭快热好了"
697,"晚晚活到现在真厉害"
697,"舒嫔活的有点久了"
697,"索伦要是求皇上赐婚就好了"
697,"这个纳兰长得像张庭啊"
698,"庆贵人说话真的好温柔啊！居然跟舒和的来？"
698,"纳兰我劝你善良，不然有你好果子吃的"
698,"路晚晚是个好姑娘"
698,"舒嫔怎么能活这么久"
698,"纳兰眼袋真的眼袋好大啊"
698,"舒嫔活的有点久了"
699,"其实陆晚晚什么都知道，能宫中活下来的人每个都不简单"
699,"你是不是想吃盒饭了"
699,"皇上再怎么不宠幸璎珞也好歹是个妃子嫔咋还比她高呢"
699,"好一个袁春望🙃"
699,"晚晚这个名字也好好听"
699,"为啥这蠢货没有发言权"
700,"舒嫔眼袋好重快去领盒饭了"
700,"舒嫔竟然活了那么长，快去拿盒饭"
700,"庆贵人是不是以后有什么大作用一直出现"
700,"舒嫔快领盒饭吧，帮你热好了。"
700,"舒贵人活的太久了吧"
700,"纳兰本宫劝你善良"
701,"皇上到现在都没宠幸成功舒嫔，她在整天还挺美"
701,"你的眼袋略大"
701,"舒萍，活太久了，是时候该领盒饭了"
701,"看你一天天挺闲的"
701,"晚晚好高呀"
701,"舒嫔快来快来，一起玩捉迷藏"
702,"这大眼袋也是很独特"
702,"我喜欢晚晚"
702,"晚晚不会黑化的"
702,"你为什么能活这么多集！"
702,"还是晚晚好"
702,"你的眼袋略大"
703,"明玉长得好可爱"
703,"活得最久的是陆晚晚庆贵人，92岁，比乾隆活得还久"
703,"这个舒嫔活得很长，还升妃了"
703,"这个坏东西居然欺负可爱的明玉"
703,"晚晚是真天使"
703,"庆妃你真好"
704,"明玉的黑眼圈和眼袋好明显啊"
704,"大眼袋演的好"
704,"庆贵人好高啊"
704,"瞧你老的眼袋都下垂"
704,"舒嫔怎么活这久，还没死"
704,"好人不长命祸害活千年[敲打]"
705,"晚晚是怎么活下来的"
705,"我可真是大猪蹄子"
705,"这个大眼袋活的真久"
705,"舒嫔，我劝你善良"
705,"晚晚今天台词真多！"
705,"看你那二斤半的眼袋就烦"
706,"舒嫔这智商能活着就是个奇迹了"
706,"纳兰的眼袋都能夹死苍蝇了"
706,"这傻子怎么能活那么多集"
706,"眼袋好明显"
706,"晚晚小天使💕"
706,"你就是闲的"
707,"淑贵妃这样没脑，还能活到现在"
707,"本宫劝你善良"
707,"大眼袋什么时候领盒饭"
707,"巧奇不要灰心一切都会好起来的"
707,"等我休息好了回来慢慢收拾你"
707,"小丑永远是小丑舒频永远上不了大雅之堂"
708,"纳兰活的够长的"
708,"这妹子心肠好，长得也不赖"
708,"庆贵人好人一个会有好报的"
708,"眼袋眼得好"
708,"舒嫔怎么能活这么多集"
708,"感觉好善良的"
709,"是化妆画出的眼袋，毕竟多少年多少级了，眼袋代表成长"
709,"这是庆贵人有史以来说过的最多台词"
709,"这么多年了舒嫔还是舒嫔庆贵人还是庆贵人"
709,"怎么可以这样子划别人的脸"
709,"陆晚晚好温柔"
709,"我最近去哪儿了？咋没出来？？！"
710,"晚晚多好呀，不过不知道后面会不会黑化"
710,"想吃盒饭告诉我，我让你吃个够"
710,"这个很温柔的就是顺妃吗？"
710,"又是一个小天使叭"
710,"你们是分不清眼袋和卧蚕吗"
710,"快下来快下来啊"
711,"这个晚晚是好的以后会帮璎珞的"
711,"晚晚小天使"
711,"晚晚是怎么在深宫中活下来的呢"
711,"朕劝你善良！"
711,"晚晚可爱，看她躺赢也开心"
711,"我什么时候回来"
712,"晚晚太可爱了"
712,"庆贵人一直都很乖很善良"
712,"晚晚太温柔了"
712,"朕的晚晚真好"
712,"好温柔的挽挽"
712,"晚晚你可真是个小天使👼"
713,"这可能是唯一没有心计又活得最多集数的了"
713,"本宫很欣慰，这后宫还有一位小天使"
713,"晚晚真好，这演员选的真好呀"
713,"这是哪个妃为啥对令妃那么好"
713,"晚晚是真的好"
713,"晚晚太可爱了"
714,"晚晚不争皇上也不抢宠爱，性格也好，对她们造不成威胁"
714,"晚晚身上看到了本宫的影子"
714,"晚晚不会黑化，晚晚是小天使"
714,"本宫不要的大猪蹄你啃的还挺香"
714,"晚晚为啥会和舒嫔一起玩"
714,"晚晚最可爱了"
715,"晚晚情商高"
715,"晚晚跟本宫都是小天使"
715,"这陆晚晚怎么这么善良"
715,"本宫劝你善良"
715,"晚晚好可爱好温柔"
715,"这个庆贵人不错么么哒(｡･ω･｡)ﾉ♡"
716,"这是晚晚说的第一句没有被舒嫔怼回去的话"
716,"晚晚这个名字是不是意思她要最晚被宠幸啊"
716,"皇上最渣了，这头爱的要死要活，转身又宠幸别人"
716,"本宫觉得晚晚的设定不能这么简单"
716,"晚晚混这么久还是个还是个贵人，也是无语了"
716,"晚晚情商高"
717,"晚晚为啥能在后宫活得这么顺"
717,"晚晚小天使一定要活下去QAQ"
717,"晚晚比海兰察都要高?"
717,"晚晚太好了"
717,"晚晚就是富查皇后二代"
717,"庆贵人是怎么活下来的"
718,"晚晚是好的最后和令妃成好朋友了"
718,"舒嫔你好深的眼袋啊哈哈好深的眼袋好深的眼袋呢"
718,"晚晚真的是天使呀，声音也好温柔"
718,"庆贵人个小白兔，能活这么久也是不容易"
718,"晚晚从进宫一直这么好"
718,"晚晚比海兰察都要高?"
719,"晚晚是一直被忽略的小天使啊"
719,"有的妃子鞋子好高。婉娩的好低"
719,"手重要还是脸重要啊....大猪蹄子"
719,"庆贵人好高啊"
719,"淑平什么时候吃盒饭"
719,"这个是哪个妃子，好温柔，和本宫一样"
720,"活的最久的就是陆晚晚，舒，和令"
720,"我喜欢晚晚"
720,"超喜欢晚晚姐姐又美又善良啊"
720,"女孩子更在意脸好吧"
720,"晚晚是个王者"
720,"晚晚是一直被忽略的小天使啊"
721,"这晚晚开局善良到现在啊！"
721,"容音和晚晚都是小天使呀"
721,"善良的晚晚好高呀"
721,"晚晚小可爱"
721,"还有个心好的难得"
721,"活的最久的就是陆晚晚，舒，和令"
722,"舒贵人好单纯也挺温柔的还不喜欢惹事"
722,"晚晚小天使👼"
722,"这里面从头到尾晚晚送好的不争不妒"
722,"瞬间又没那么气了，还觉得挺值"
722,"庆贵人这样的性格，确定活了那么多集？"
722,"我还不想领盒饭呢"
723,"爱晚晚的请举手"
723,"超喜欢晚晚啊～"
723,"晚晚的情商最高了"
723,"晚晚从不说别人坏话"
723,"什么卧蚕，明明就是黑眼圈，这是给它取了个新名字吧"
723,"明明脸上伤口更明显和更重要吧"
724,"脸上那么大口子看不见啊大猪蹄子"
724,"晚晚真不错"
724,"晚晚这么久都是贵人，没威胁，所以活的久"
724,"纳兰的跟班不错啊，人美心善"
724,"晚晚后面会不会领盒饭"
724,"超喜欢晚晚啊～"
725,"这个舒嫔能活着么久真的是不敢相信"
725,"晚晚和本宫一样都是小天使"
725,"晚晚才是最后的赢家，你说会黑化吗！😒"
725,"我劝你善良"
725,"晚晚好善良"
725,"陆晚晚第二个仙女"
726,"晚晚父亲是舒嫔父亲的下属，所以她才总是跟舒嫔在一块"
726,"好细心呀海兰察对朕就没这么贴心"
726,"心真大不管脸去管手这未婚夫真的不看颜值的"
726,"晚晚真的好温柔"
726,"好想看璎珞和少爷甜蜜恋爱阶段"
726,"晚晚是天使吧"
727,"令妃的孩子后来给陆晚晚养着呢"
727,"你要强大起来，不然明玉又得受罪了啊"
727,"最后晚晚成了皇后"
727,"晚晚小姐姐"
727,"晚晚是真正的赢家"
727,"兄弟不错嘛"
728,"晚晚是善终的，而且是嘉庆帝的养母"
728,"晚晚小天使，以后本宫会对你好的"
728,"感觉海兰察头好大啊"
728,"晚晚很好啊"
728,"明明最重要的是脸那么明显的一道划痕"
728,"好心疼啊好心疼"
729,"晚晚是个小天使诶"
729,"怎么看都是脸重要点啊!!"
729,"晚晚是未来的皇后"
729,"脸不是更重要吗"
729,"挫伤看起来好真实"
729,"真是大猪蹄子"
730,"晚晚最后把令贵妃的十八阿哥养大成人了"
730,"晚晚太纯了"
730,"晚晚就是以前的娴妃，不争不抢，如果有人害她肯定反击"
730,"朕的庆常在好温柔"
730,"大猪蹄子果然是大猪蹄子"
730,"本剧最甜的一对夫妇——大嘴猴夫妇"
731,"晚晚陪令妃走到了最后"
731,"晚晚是个好姑娘"
731,"晚晚其实也是个高段位"
731,"脸那么大疤，破相了，不弄脸吗？"
731,"就喜欢皇后和晚晚你们不反对吧"
731,"你们这样不得体不得体！"
732,"晚晚最后做了永炎的养母，做了太后"
