time,content
792,"娴肥的戏太多了，盒饭热几次了"
792,"乾隆你个大猪蹄子"
792,"粪水叫金汁这也是厉害了"
792,"大猪蹄子，你不要你是富察皇后了吗？！"
792,"糞水不就很明显吗"
793,"粪水啥时候有个这样的美妙的名字了？"
793,"本宫就这么领盒饭了"
793,"长见识了，金枝原来是这个意思"
793,"皇上好坏呀"
793,"多情的男人"
793,"粪水叫金汁这也是厉害了"
794,"这是大清朝又不是秦朝，感染这词咋了"
794,"好大的胆子"
794,"那么高的温度，也算肖过毒了吧"
794,"嘿，我说你，我好不容易穿上衣服你又叫我脱下来"
794,"不是，这么高的温度，粪水不也被消毒了"
794,"氨水吧怕不是"
795,"哟，打细菌战……高实在是高啊！"
795,"不科学啊，粪水在那么高的温度下也都会被杀菌了吧"
795,"那么高的温度，粪水里也没什么细菌了吧"
795,"大猪蹄子，你忘了我吗"
795,"你个大猪蹄子，想非礼啊"
795,"好了该领盒饭了"
796,"粪水都可以说成是金汁，长见识了，受教了。"
796,"大粪厉害了"
796,"那么高的，不知道那个细菌活的下去"
796,"男人都是大猪蹄子"
796,"金汁原来是粪呀还觉得这么好听"
796,"我还以为金汁是金子练出来的呢原来是便便哈哈哈"
797,"皇后:啊！大猪蹄子你等着!导演!古代有搓衣板吗!"
797,"没事我都见过高贵妃了"
797,"宝宝金水好厉害啊"
797,"原来粪水还有一个这么高大上的名字"
797,"金汁可是很珍贵的，香水里就有"
797,"金汁原来是粪呀还觉得这么好听"
798,"大肠杆菌做得好"
798,"你个大猪蹄子白枉费本宫对你那么痴情了"
798,"学了个新词，金汁，长见识了"
798,"大猪蹄子，你把本宫置于何地"
798,"那娴妃被烫到的铁水里也有金汁喽，怎么没被感染？"
798,"高贵妃，我劝你善良"
799,"那么高的温度还有细菌能活。？"
799,"我还没醒你就到处撩你个大猪蹄子"
799,"金汁好贵的"
799,"大猪蹄子，本宫还在昏迷呢"
799,"我去，我还是太单纯，我以为是金子水"
799,"皇上下旨让所有人听佐迩弟弟唱的歌"
800,"还以为金汁就是金子化了呢还在想魏璎珞哪来那么多钱啊"
800,"还为是金子液化，看来是想多了..."
800,"这戏份还叫多？现在三十二集，就这两集出来的多点"
800,"我一打来，就吓了皇上一跳"
800,"没有对比就没有伤害，大猪蹄子"
800,"呵！大猪蹄子！"
801,"加入蜜汁更好，可以直接开吃"
801,"看本宫厉不厉害"
801,"金子融化的你是认真的嘛"
801,"哈哈，大肠杆菌演得好"
801,"大猪蹄子上线了"
801,"我还以为是金子水呢"
802,"那么高的温度不知道里面能有多少细菌"
802,"大猪蹄子，说好的心里只有本宫呢！"
802,"叫的好高级"
802,"高贵妃领盒饭倒计时⌛"
802,"大猪蹄子对谁都好！"
802,"金子融化的你是认真的嘛"
803,"大猪蹄子大猪蹄子"
803,"好多人说我可爱嘻嘻好开心"
803,"皇后才病多久？皇上就对别的女人这么好"
803,"皇上没伤着就好"
803,"男人都是多情"
803,"贤妃什么时候领盒饭"
804,"皇上挺重情义的啊，居然要去护着高贵妃"
804,"本宫玩得一手好苦肉计"
804,"还以为是金子熔的水哈哈"
804,"这么厉害的名字"
804,"舍不得孩子套不住狼"
804,"还叫金汁服了"
805,"一点就这么多那高岂不是满背都是"
805,"哼，本宝宝也超想哭的"
805,"娴妃才是藏的最深的"
805,"唯有套路得人心"
805,"大猪蹄子太好攻略了吧"
805,"还以为是金子熔的水哈哈"
806,"皇后快醒醒大猪蹄子在四处留情"
806,"放心老娘会活到最后一集的"
806,"一想到金水我就好兴奋"
806,"如果和璎珞在一起多好"
806,"直接说粪汁不就好了吗"
806,"唯有套路得人心"
807,"果然是厉害，心机到皇上都看不出来，不是一个段位的"
807,"好疼啊皇上，快给我撒点盐"
807,"金汁演的好！金汁演的好！"
807,"最单纯的是皇上，每个女人都骗得了他"
807,"皇上好甜啊啊"
807,"皇后快醒醒大猪蹄子在四处留情"
808,"人前一直温柔的人狠起来更招人恨！尔晴和闲妃就是如此"
808,"这个女人不得了。这么大伤叫都不叫"
808,"大猪蹄子的声音好苏"
808,"她的怎么不危及生命呢"
808,"大猪蹄子哼"
808,"好疼啊皇上，快给我撒点盐"
809,"佘诗曼太棒了"
809,"我最可爱呢嘻嘻"
809,"TVB准备把这剧改成娴妃为主角"
809,"就不相信你不上钩"
809,"这样能穿衣服吗"
809,"皇后什么时候醒来"
810,"她叫的很不能全天下人都听见"
810,"好一个苦肉计啊皇上真的是个猪蹄子"
810,"身子好白哦！"
810,"我还躺着呢，大猪蹄子"
810,"金汁演的好"
810,"金汁演得好哦⊙∀⊙！"
811,"本宫饿了吃点夜宵，大猪蹄子就不要了！"
811,"有味道的伤口"
811,"大猪蹄子你还怀疑她"
811,"皇上真多情"
811,"烫成那样也能穿上衣服"
811,"好一个苦肉计啊皇上真的是个猪蹄子"
812,"你也不看看人家多大面积，我就不信你被烫了不叫"
812,"本宫要气醒了哼大猪蹄子"
812,"大猪蹄子，你忘了皇后了么"
812,"本宫以前不屑争斗还真以为本宫是病猫。"
812,"皇上真多情"
812,"烫成那样也能穿上衣服"
813,"他叫是因为伤很多啊大猪蹄子"
813,"我可厉害了"
813,"乾小四你个大猪蹄子"
813,"我就是矫情怎么了"
813,"刚才说金汁很贵的你出来"
813,"哇大猪蹄子"
814,"原来我金汁有如此大威力，下次上厕所不敢坐着拉了"
814,"你这个大猪蹄子，我还没醒呢"
814,"那可不啊高贵妃全后背都是"
814,"哎我还在昏迷啊！"
814,"张瑜佳是大猪蹄子"
814,"乾小四你个大猪蹄子"
815,"娴妃的苦肉计演的好难怪后面当了皇后"
815,"大猪蹄子！这多严重叫还不让了！真想给你一片绿"
815,"金汁这个戏份演得好"
815,"还是皇后好"
815,"大猪蹄子你沙币啊!小高满背都是伤好吗!整个背都是!"
815,"本宫这是单纯"
816,"好大的一盘棋啊"
816,"大猪蹄子大猪蹄子大猪蹄子"
816,"唉，你个大猪蹄子，不来看皇后娘娘了[流泪]"
816,"我那是被人算计你个大猪蹄子"
816,"佘诗曼给我把衣服穿好，不准给别人看！"
816,"本宫坚强！要的就是这效果"
817,"人家贵妃伤痕面积多大啊，叫唤两声怎么了？？？"
817,"你个大猪蹄子，看够了没有"
817,"皇上的耳朵好可爱"
817,"大猪蹄子，人家痛啊，能不叫吗，高高太单纯"
817,"你也不看看伤口面积，，你个大猪蹄子"
817,"人家就是疼嘛"
818,"高贵妃烫得更重好吗？猪蹄"
818,"好了朕是大猪蹄子"
818,"一声不吭才可怕好吗你个大猪蹄子，心疼高可爱三秒"
818,"所以说我能够博得好名声，而她只是个宠妃"
818,"大猪蹄子，高贵妃那是满背"
818,"人家贵妃伤痕面积多大啊，叫唤两声怎么了？？？"
819,"附凤女孩有点高兴是怎么回事"
819,"皇上不是很聪明吗？还不是被我耍得团团转"
819,"也不看看高贵妃烫了多少啊，大猪蹄子"
819,"果然是大猪蹄子"
819,"人家那面积多大呢"
819,"高贵妃烫得更重好吗？猪蹄"
820,"大猪蹄子不愧是大猪蹄子啊"
820,"本宫还昏着呢你这个大猪蹄子!"
820,"现实生活中就是这样外表柔弱的人才是狠角色"
820,"我还在呢大猪蹄子"
820,"高贵妃的面积是多大"
820,"人家可厉害着呢"
821,"贵妃烫的多好不，大猪蹄子"
821,"大猪蹄子，男人没一个好东西"
821,"因为贵妃烫的面积和深度都大的多"
821,"人家高可爱都要死了好吗能不叫吗"
821,"娴妃阔怕了，这段位不是一般的高啊"
821,"我好单纯好不做作"
822,"她的才多大点地方，贵妃的后背全是"
822,"关键是高可爱是整个背啊"
822,"关键是贵妃面积那么大。。佘诗曼心机那么重"
822,"妈也本宫的受伤面积更大啊"
822,"哈哈哈哈小高叫的全天下人都听见。就愿意就愿意哈哈"
822,"因为贵妃烫的面积和深度都大的多"
823,"这么明显的好话大猪蹄子听不出来吗？"
823,"这次是真疼啊，本宫伤口那么多"
823,"你个大猪蹄子，快把手拿开"
823,"你看看她多大点伤口你看看我多少！！！"
823,"你个大猪蹄子是不是忘了我皇后小天使啊"
823,"她的才多大点地方，贵妃的后背全是"
824,"那么高温度烫不熟吗"
824,"皇上也不看看人家高可爱烫了多大的伤口"
824,"乾隆你个大猪蹄子！！！忘了你的富察荣音了么！！！"
824,"谁让本宫是高可爱"
824,"你看看她多大点伤口你看看我多少！！！"
824,"这次是真疼啊，本宫伤口那么多"
825,"皇上：哭是本分，不哭是坚强。哭是本分，不哭是坚强啊"
825,"大猪蹄子人家那么大一片叫叫不行吗？高高还是太单纯"
825,"真正城府深有心计的就会装的很善良例如闲妃"
825,"一想到大仇得报，开心到飞起好吗！"
825,"大猪蹄子！大猪蹄子！你个大猪蹄子！你把皇后给忘了吗"
825,"本宫以后可以要当皇后的人怎么会被这区区金水吓到"
826,"高贵妃受伤面积大啊大猪蹄子！"
826,"乾隆你个大猪蹄子"
826,"就算皇上再怎么厉害终究是斗不过后宫的女人啊"
826,"画上去的哪里会疼"
826,"这贤妃真不简单，但还是希望你善良"
826,"真正城府深有心计的就会装的很善良例如闲妃"
827,"大猪蹄子阿大猪蹄子"
827,"本宫实力演绎语言的艺术"
827,"高可爱有什么可爱的"
827,"因为本宫是王者她是青铜"
827,"因为高可爱的皮比较嫩"
827,"高贵妃受伤面积大啊大猪蹄子！"
828,"人家不是说了及时治疗就好虽然会留疤"
828,"本宫牛乳洗澡！皮肤太嫩，你这大猪蹄子"
828,"大猪蹄子他的多啊"
828,"大猪蹄子我还在呢，我没死"
828,"三个女人一台戏这么多的女人这一天全是戏哈哈哈哈"
828,"？？你个大猪蹄子也不看看我伤了多少"
829,"她叫是因为伤口多！你这大猪蹄子！"
829,"小鹿乱撞本宝宝的心跳的好快"
829,"大猪蹄子不是很聪明吗？"
829,"大猪蹄子，那是真疼啊"
829,"厉害了闲妃"
829,"还不允许我这个高可爱叫了嘛"
830,"可以苦肉计用的妙救了太后又救了皇上"
830,"大猪蹄子你烫一下就知道了"
830,"臣妾的忍耐力不是一般的厉害"
830,"叫我高可爱"
830,"大猪蹄子，那是真疼啊"
830,"她叫是因为伤口多！你这大猪蹄子！"
831,"大猪蹄子！！！真疼还不让人叫！"
831,"大猪蹄子，本宫烫的可是整个背啊！不然你来试试"
831,"大猪蹄子，伤这么重还不让叫了"
831,"大猪蹄子你忘了臣妾"
831,"疼啊等你来疼"
831,"化上去的怎么会疼呢"
832,"闷不吭的才是最厉害的嘴上乱叫唤的没多大能耐"
832,"你个大猪蹄子老娘才躺下多久你就见一个爱一个"
832,"你试试整个背都是啊大猪蹄子"
832,"人家烫了一整个背还说人家，你这个大猪蹄子哼"
832,"等本宫醒了就打你个大猪蹄子"
832,"大猪蹄子，贵妃烫成那样换你你不叫？？"
833,"会说话啊会说话，我得多看看"
833,"大猪蹄子再不回来我就领盒饭了"
833,"大猪蹄子你眼里还有本宫吗"
833,"我已经改名高可爱了"
833,"你试试整个背都是啊大猪蹄子"
833,"等本宫醒了就打你个大猪蹄子"
834,"高贵妃都烫的危及生命了啊，皇上大猪蹄子"
834,"你这个大猪蹄子本宫昏迷不醒你就忘了本宫了是吧"
834,"都是大猪蹄子！大猪蹄子！"
834,"我怎么活了这么多集，不容易"
834,"手段高明，佩服啊，怪不得会成为皇后，最后的赢家"
834,"我就是一个大猪蹄子"
835,"妈个比你个大猪蹄子你个大猪蹄子"
835,"待本娘娘醒来有你们好果子吃的"
835,"什么叫高级这就是高级"
835,"你个大猪蹄子，我被烫这么大片能不叫吗"
835,"要是烫到大猪蹄子的光头哈哈"
835,"你个大猪蹄子本宫还没醒呢"
836,"高贵妃本身就皮肤嫩。牛乳泡出来的啊。况且满背都是"
836,"大猪蹄子臣妾还有你的孩子，臣妾还昏迷了，你咋不关心"
836,"好可爱满背都是能不叫吗"
836,"你们这帮蠢材，最后才会发现本宫才是最单纯的"
836,"高级高级学到了学到了"
836,"要是烫到大猪蹄子的光头哈哈"
837,"你们不能因为他一个大猪蹄子就把男人都定义成大猪蹄子"
837,"高可爱烫的可是整个背好嘛"
837,"大猪蹄子大猪蹄子大猪蹄子"
837,"本宫伤得重好伐"
837,"你们这帮蠢材，最后才会发现本宫才是最单纯的"
837,"高级高级学到了学到了"
838,"大猪蹄子我还没醒呢你快活得很啊"
838,"她有我受伤多吗？我就不能喊疼啦，大猪蹄子"
838,"大猪蹄子把你的手拿开"
838,"大猪蹄子也烫一下就知道疼不疼了"
838,"告诉我们男人还是喜欢有心机和会耍手段的表面女人"
838,"我段位不是一般人能比"
839,"大猪蹄子贵妃是满背好吗"
839,"疼还不让人叫唤...不爱了就会有一百种理由厌恶对方"
839,"说高可爱？哪天坏人把你爸妈杀了，你是不要夸可爱？"
839,"大猪蹄子本宫还躺着你都开始看人后背了"
839,"烫到叫几声还不让叫了不叫成对的了大猪蹄子"
839,"大猪蹄子也烫一下就知道疼不疼了"
840,"高贵妃满背都是，叫一下怎么了，是真的疼啊"
840,"大猪蹄子伤成那样还不让叫疼"
840,"人家高可爱烫伤了一大片，你呢"
840,"高贵妃的为什么没治好，娴妃的就能治好了呢"
840,"好厉害的咸妃"
840,"大猪蹄子贵妃是满背好吗"
841,"喂喂喂，大猪蹄子。。高贵妃整个背都烫秃噜皮了啊"
841,"这个大猪蹄子老娘伤得那么重"
841,"她才是心机深，有手段，为达目的不择手段，拿自己实践"
841,"大猪蹄子，烫烫你试试疼不疼！！！"
841,"高贵妃一次都没成功过，每次都是偷鸡不成蚀把米"
841,"皇上，大猪蹄子，我姐姐还没醒呢"
842,"古代人身体好神奇！没抗生素都能活！"
842,"你个大猪蹄子，老娘背上烫了一大片好嘛！"
842,"高贵妃可能是这部剧漏得最多的了"
842,"大猪蹄子你是不是把我忘了"
842,"突然想还珠格格，皇后你曾经是多么温柔贤淑的一个人啊"
842,"这个大猪蹄子老娘伤得那么重"
843,"大猪蹄子=林俊杰到处撩不负责任"
843,"本宫比这个心机女客气多了好嘛"
843,"一个人表现得太完美了就是有问题"
843,"帮了娴妃了，白捡了个便宜"
843,"高贵妃展露的是真性情，强过装的"
843,"大猪蹄子你继续忙别管我了"
844,"之前的贤良淑德人设太成功…以至于黑化了都还人畜无害"
844,"大猪蹄子你再给我带帽子我领盒饭去了"
844,"乾隆时最多情的你们忘了么"
844,"只有高贵妃活的最为潇洒了吧"
844,"😂再不醒大猪蹄子就被人吃了"
844,"因为我单纯！大猪蹄子"
845,"但是我还是觉得疼就像高贵妃那样说出来的好。！"
845,"啧啧啧本宫是真的可爱单纯又萝莉"
845,"大猪蹄子你又被娴妃三言两语哄住了"
845,"你不看看老娘烫了多大一块叫叫咋了"
845,"不得体不得体，你这肚兜都不穿的女人"
845,"大猪蹄子你还记得你的皇后么"
846,"这就是普通坏人和高段位的区别"
846,"大猪蹄子你是不是把本宫给忘了"
846,"没有高贵妃皮肤好皮肤白"
846,"老娘是整个后辈好么"
846,"但是我还是觉得疼就像高贵妃那样说出来的好。！"
846,"不得体不得体，你这肚兜都不穿的女人"
847,"你能不能别说可爱可爱了感觉你们都玷污可爱这个词了"
847,"佘诗曼不太适合，演技很棒，长相出戏"
847,"皇上n你当本宫昏迷就是死了吗你个大猪蹄子"
847,"为什么叫朕大猪蹄子"
847,"来人，把高可爱的盒饭热一热"
847,"高可爱还好吗？"
848,"你个该死的大猪蹄子，贵妃整个背烫伤好吗，是皇上"
848,"本宫刚一躺下你个大猪蹄子，就跟她们这群女人戏这么多"
848,"这是雍正被叫大猪蹄子最多的一部剧了吧"
848,"大猪蹄子，你还记得江南湖畔的皇后娘娘吗？"
848,"皇上大猪蹄子！我们小可爱高贵妃烫成那样还不让叫了啊"
848,"大猪蹄子，快去看皇后娘娘"
849,"我觉得后妃只有将皇上当儿子一样疼才会那样尽心的付出"
849,"大猪蹄子嘛，怎会知道本宫有多疼"
849,"后宫没一个省心的，皇后还没醒你们又来作妖"
849,"本宫背上面积大啊，而且粪也比他多"
849,"为什么要叫大猪蹄子？好奇"
849,"大猪蹄子，快去看皇后娘娘"
850,"大猪蹄子是个多情的种"
850,"唐唐大猪蹄子竟要女人来保护"
850,"臭男人，根本分不清谁心机，高贵妃才是耿直的呀"
850,"喜欢高可爱"
850,"不得不说古代皇上就是好，这得糟蹋多少女人"
850,"本宫背上面积大啊，而且粪也比他多"
851,"说贵妃可爱的都是大猪蹄子吗？可爱和蠢分不清？"
851,"你个大猪蹄子因为本可爱单纯伤的面积是一整个背"
851,"皇后娘娘：大猪蹄子我还没醒呢你还到处跟别的女人调情"
851,"大猪蹄子也不来看看本宫老娘还昏迷着了"
851,"竟然不沾衣服上好厉害的伤口"
851,"老娘烫那么厉害不喊不叫还是人吗"
852,"璎珞：大猪蹄子，你不要来勾引我哦，我跟傅恒才是真爱"
852,"装给你看的苦肉计，你个大猪蹄子"
852,"皇后我娶你！皇上就是个大猪蹄子"
852,"大猪蹄子、她的能和臣妾的比吗"
852,"大猪蹄子还记得大明湖畔的富察皇后吗？"
852,"大猪蹄子也不来看看本宫老娘还昏迷着了"
853,"一整个后背被烫伤大猪蹄子你来你试试"
853,"只有本宫活的最自在想哭哭想笑笑疼了就喊疼"
853,"你个大猪蹄子，皇后还躺着，你就叫起淑慎了？??"
853,"好了是大猪蹄子准没错了"
853,"大猪蹄子，大猪蹄子"
853,"本宫还没醒呢，大猪蹄子"
854,"本宫还病着呢，你个大猪蹄子！都不来看本宫"
854,"大猪蹄子快来看本宫！本宫快疼死了哎哟"
854,"突然觉得高贵妃好可爱"
854,"大猪蹄子！我还晕着呢你居然去看别的女人！"
854,"大猪蹄子滚不想见到你"
854,"你个大猪蹄子，忘记本宫还在昏迷了吗？"
855,"大猪蹄子你手放在哪里真的好吗？几万双眼睛看着你捏"
855,"大猪蹄子大猪蹄子大猪蹄子！！！"
855,"剧播到这里你都没叫过容音吧？怎么就叫人家淑慎了呢！"
855,"唤朕大猪蹄子的全部拖出去斩了"
855,"爱是一道光，如此的美妙，知道绿豆让你发慌"
855,"大猪蹄子，大猪蹄子"
856,"高贵妃一背多是好吗大猪蹄子"
856,"大猪蹄子疼还不让叫"
856,"高贵妃很疼的耶。而且伤疤还多，你怎么就不让呢？"
856,"佘诗曼就不能演个好人吗看得脑壳疼"
856,"你个大猪蹄子你还嫌弃老娘你一点事都没有"
856,"快点非礼我啊，我好激动"
857,"高可爱就是可爱可爱！就喜欢她"
857,"我烫了一整个后背啊！你才烫了多点，还好意思喊疼啊！"
857,"皇上也太多情，居然还会想扑上去救高贵妃"
857,"能不疼嘛，我能装能忍啊，稳住才能赢啊～哼～"
857,"你这个大猪蹄子！最善良的皇后还昏迷着呢！！"
857,"大猪蹄子。你这么没脑怎么行"
858,"大猪手，每个女人都给你的大猪手看过了😂"
858,"满屏幕大猪蹄子"
858,"她烫的是一整个背啊大猪蹄子"
858,"大猪蹄子，本宫还没醒呢！见一个爱一个！！！"
858,"心机都好重"
858,"皇上也太多情，居然还会想扑上去救高贵妃"
859,"大猪蹄子没一个好东西"
859,"好你个大猪蹄子，竟然趁本宫不注意的时候跟别人鬼混"
859,"所以不要惹聪明的人不是不争是不想争"
859,"大猪蹄子，坏蛋，忘记人家了吗"
859,"大猪蹄子！皇后还晕着呢好嘛！"
859,"满屏幕大猪蹄子"
860,"大猪蹄子！！！乾小四你个大猪蹄子"
860,"你为什么不叫我容音？你个负心大猪蹄子"
860,"还是媳妇多好啊，一个下去另一个补上"
860,"其实高贵妃才是最单纯可爱的人!"
860,"这样看娴妃脸好大"
860,"大猪蹄子，坏蛋，忘记人家了吗"
861,"欣赏不来娴妃的颜，演技可以，鼻子真的好容易让人出戏"
861,"你这个大猪蹄子"
861,"皇上真是好记性，这么多女人名字都记得住"
861,"为什么看到了透明的肩带"
861,"大猪蹄子就是大猪蹄子"
861,"我媳妇儿真好"
862,"以前后宫这么多妃子，皇上还能记得名字真是不容易"
862,"美则美矣，脸长长了"
862,"人家高可爱烫到了一大块诶哼嘤嘤嘤"
862,"大猪蹄子，你都没有这么叫过臣妾"
862,"娴妃有能力没有家族的依靠一个人可以走到皇后的位置"
862,"你这个大猪蹄子"
863,"娴妃本来就很爱皇上的好吧！在后宫就得这么聪明才能活"
863,"呀，我还记得你名字耶，我好了不起"
863,"突然觉得佘诗曼鼻子好大"
863,"爱妃你咋这么会说话，比蔡康永还厉害，朕就服你"
863,"感觉皇上好单纯啊"
863,"高高就是可爱"
864,"皇上真是个大猪蹄子又是很多年没有叫宁馨又是淑慎"
864,"果然是大猪蹄子，本宫还躺在那儿呢"
864,"大猪蹄子能不能看清楚状况"
864,"大猪蹄子，回来跪搓衣板"
864,"为什么同样烫伤一个活不长了一个没事"
864,"大猪蹄子这么快忘了臣妾了"
865,"皇后昏迷的时候大猪蹄子跟多少人好了啊"
865,"大猪蹄子就是大猪蹄子！"
865,"大猪蹄子大猪蹄子"
865,"黑化好快，都要有一个触发点"
865,"皇上真累啊，一个男人怎么能对那么多女人好呢"
865,"我就是大猪蹄子你们能拿我怎么样！"
866,"这么多媳妇还都能记住名字厉害厉害"
866,"还是坏人好，做好人的时候给皇上做的那么多也没好脸色"
866,"前几天看了个小说里有个叫淑慎的，别人叫她叔婶"
866,"乾小四你个大猪蹄子忘了你大明湖畔的富察容音了吗"
866,"大猪蹄子你把皇后忘了吗她还怀着你的孩子啊"
866,"本宝宝的饭盒热好了没有！"
867,"皇上心真大能装下这么多女人"
867,"本宫是高级玩家"
867,"一个方方面面都做得好对所有人好的人一般都是坏人"
867,"能记得那么多嫔妃的名字朕也是厉害啊"
867,"皇上真辛苦要想这么多女人的名字"
867,"你个大猪蹄子忘了本宫还在昏迷吗还在和别人卿卿我我"
868,"这皇上真是学霸竟然能记住这么多小名并叫不错"
868,"谁再说朕是大猪蹄子拉出去斩了。。"
868,"黄桑每个妃子的名字都能记住不叫错也是不简单"
868,"戏精们本宫什么时候说了这些话"
868,"皇宫就是个大熔炉，各色各样的人都会变成黑色"
868,"本宫是高级玩家"
869,"大猪蹄子就是大猪蹄子，气死我了，我皇后娘娘还活着啊"
869,"大猪蹄大猪蹄完全把我忘了"
869,"大猪蹄子，就是大猪蹄子呗"
869,"我这个大猪蹄子天天被女人套路"
869,"大猪蹄子人家以前给你做衣服你还嫌弃"
869,"皇上真的是抚慰这个抚慰那个真像青楼女子一样还是红牌"
870,"男人都是些眼盲心盲的大猪蹄子吧"
870,"大猪蹄子，现在想起来晚了"
870,"大猪蹄子你可长点心吧"
870,"你个大猪蹄子，也不去看看皇后"
870,"为难皇上能记住这么多女人的名字"
870,"你个大猪蹄子本宫还没死呢"
871,"大猪蹄子真的是大猪蹄子"
871,"大猪蹄子一点都不专情，学学我"
871,"是的！！这么大第一个月了、不想活了吗！不"
871,"你个大猪蹄子是忘了我嘛"
871,"这部剧里皇上是最单纯的小可爱"
871,"你个大猪蹄子，见一个忘一个"
872,"大猪蹄子本宫要是醒着还轮得着她保护你吗"
872,"你个大猪蹄子，还不来看看本宫，是不是把本宫忘了？"
872,"所以自作清高没有用在后宫就得有心机"
872,"大猪蹄子刷起来，为本宫刷起来"
872,"皇上大猪蹄子本蹄啊见一个爱一个"
872,"你个大猪蹄子是忘了我嘛"
873,"大猪蹄子也不容易，还能记得妃子们的名字"
873,"戏精就是我，我就是戏精，，本宝宝已上线"
873,"大猪蹄子啊大猪蹄子"
873,"大猪蹄子本宫还没走呢"
873,"去找皇后吧求你了别理苏菲的行吗"
873,"大猪蹄子忘记本宫还昏迷不醒了吗？"
874,"还是觉得嫁给富恒好，皇上这么多情，吃醋都要吃饱了"
874,"这皇上真是学霸竟然能记住这么多小名并叫不错"
874,"只能说皇上记性也好那么多嫔妃都能记住名字"
874,"你们怎么能叫朕大猪蹄子呢！那明明这么好吃，哼"
874,"伤口蹭到衣服上多疼啊"
874,"后宫佳丽三千，你疏忽的可不止她一个呢大猪蹄子"
875,"皇后呢，皇上，别忘了你美丽温柔贤惠体贴的皇后啊"
875,"大猪蹄子，大猪蹄子"
875,"乾隆记得名字算什么101那么多姐妹大家不都记得清"
875,"本宫感到头上一绿"
875,"你这个大猪蹄子，见一个爱一个，本宫还活着呢"
875,"我还晕着呢大猪蹄子"
876,"大猪蹄子皇后才躺下多长时间你就被坏女人蛊惑了"
876,"还说本宫是你的白月光，哼！大猪蹄子的话真不可信！"
876,"大猪蹄子是什么梗大猪蹄子是什么梗"
876,"大猪蹄子本宫还没醒呢你是不是把本宫忘了"
876,"皇上心中完美的人，其实心机好重"
876,"皇后呢，皇上，别忘了你美丽温柔贤惠体贴的皇后啊"
877,"说大猪蹄子的还不是你们女人心机重呵女人！！！！！"
877,"大猪蹄子大猪蹄子大猪蹄子!!!!"
877,"富察皇后:你这个大猪蹄子，难道这么快就忘了我吗？"
