time,content
2045,"演员们的后幕真大这个弘昼不是之前的吗"
2045,"烤瓷牙快去吃盒饭吧"
2046,"精彩精彩真是精彩"
2046,"这是大猪蹄子最聪明的一刻"
2046,"整场演技最好的一次啊大白牙"
2046,"跟袁春望比起来我很善良啊"
2046,"大白牙，看你还能不能"
2046,"我都快演不下去了！"
2047,"密道厉害了"
2047,"盒饭都热好了，皇弟快来吃啊"
2047,"小溪是个大猪蹄子"
2047,"为什么叫我大猪蹄子"
2047,"大猪蹄你胡子怎么回事"
2047,"我这个发型还不错吧"
2048,"感觉皇后这刘海显得人美多几分了"
2048,"和亲王，盒饭已经给你热好了，快来领吧"
2048,"太后的头饰好可爱"
2048,"弘昼你居然敢跟朕斗,赏你个大猪蹄子"
2048,"皇后的龙须刘海真美"
2048,"我这个发型还不错吧"
2049,"历史上康熙就很看重弘历的，弘历疑心病也是很重的"
2049,"弘昼.本宫把盒饭热好了.快来吃吧"
2049,"不都说了太后的头饰在历史上也是有考究的嘛"
2049,"还是没我有用"
2049,"太后的蝴蝶结好抢眼"
2049,"皇后的龙须刘海真美"
2050,"别说太后的头饰了，有历史考究的"
2050,"是他，是他，就是他，大猪蹄子的弟弟，大板牙"
2050,"大猪蹄子你都不找你的璎珞嘛"
2050,"右下脚的大猪蹄子好可爱"
2050,"太后七十多了没有白头发啊"
2050,"我儿子被虫子咬了你们还在这闲聊"
2051,"后面的剧情发展快灵些"
2051,"感觉本宫今天好美啊"
2051,"龙舟演得好"
2051,"我劝你善良，否则就和我一样"
2051,"剪头发剪头发剪头发"
2051,"本宫已经准备好领盒饭"
2052,"这集完了都领盒饭了"
2052,"盒饭已备好"
2052,"嬛嬛的发饰挺好的啊"
2052,"你把朕当大傻子呢"
2052,"太后的蝴蝶结"
2052,"演技好尬呀"
2053,"佘诗曼演技真的好"
2053,"大猪蹄子真聪明"
2053,"怪你们出来太早了，😂😂😂不然就能抓个现形的了"
2053,"刺杀的不真实"
2053,"皇后的是龙须刘海唉"
2053,"太后被亲情蒙蔽了双眼"
2054,"好水的剧情"
2054,"皇上的小胡子真神气"
2054,"牙精领盒饭了要"
2054,"弟弟，你马上可以领盒饭了"
2054,"佘演技真不是盖的"
2054,"领盒饭去吧"
2055,"皇后穿绿衣服了"
2055,"盒饭准备好了！"
2055,"看到这里,感觉写得好简单好潦草"
2055,"袁春望，你是吃夸张长大的吗？"
2055,"环环演得好"
2055,"朕岂是你们能糊弄的"
2056,"这部剧袁春旺是先帝的孩子！他在报复！不是说太监厉害"
2056,"怎么不见本宫的影子"
2056,"大猪蹄子眼睛雪亮得很"
2056,"领盒饭去吧"
2056,"和亲王眉毛演得好"
2056,"来人，带下去斩了。"
2057,"大猪蹄子真棒！"
2057,"太后的蝴蝶结🎀好抢镜"
2057,"看五月天直播去了"
2057,"弘昼朕要诛你九族"
2057,"唉呀我就想知道哇哥怎么样啦"
2057,"最好的还是容音"
2058,"人老成精。老戏骨的演技不容置疑"
2058,"本宫今天没有褶子，好开心啊"
2058,"皇后娘娘全身都是戏，准确到位，本宫领盒饭也是最美的"
2058,"拖出去斩了"
2058,"盒饭准备好了"
2058,"娴妃你还是说了吧"
2059,"这种发饰前几集富恒的额娘就是这样的用布包起来的这种"
2059,"善恶终有报，善良懂事儿的活着"
2059,"嬛嬛不打怪升级之后怎么智力退化了好多"
2059,"傻眼了吧，我最聪明"
2059,"快去吃盒饭吧"
2059,"是你是你就是你！"
2060,"怎么就是大猪蹄子了"
2060,"想看刘真刘真演的好！"
2060,"朱奕霆大猪蹄子"
2060,"就你们几个这两下子还敢跟朕试吧试吧？"
2060,"皇后的发型不错"
2060,"是你是你就是你！"
2061,"所有人的盒饭都热好了，这集吃不上的，还有下集"
2061,"打不过我吧，我就是这么强大。"
2061,"聂远很帅，演技好，但是该有威严的时候没出来"
2061,"本宫在治疗你们的永琪，要不就没有还珠格格了"
2061,"大猪蹄子太聪明了"
2061,"后十集毫无意义"
2062,"大猪蹄子真厉害"
2062,"大猪蹄子你还管不管我们母子了"
2062,"鬼精鬼精的"
2062,"太后头上的蝴蝶结太跳戏了！"
2062,"和亲王居然能活那么长😂"
2062,"王长烈你个大猪蹄子"
2063,"我只想知道五阿哥还好吗"
2063,"本高可爱亲自给你热的盒饭，快趁热吃"
2063,"非常完美男嘉宾这口牙看的真是出戏。。"
2063,"本宫和哇哥被虫子咬了"
2063,"是皇后做的"
2063,"和亲王居然能活那么长😂"
2064,"佘诗曼演技太好了"
2064,"皇后发型不错呦"
2064,"窝是软软吖qwq胡凡凡看到这里了吗🤣"
2064,"本宫这样好美"
2064,"估计是皇后通风报信了"
2064,"本宫的发型美美哒~"
2065,"这么多人居然被一个太监弄得团团转"
2065,"打不过我吧我就是这么强大"
2065,"圆春旺怎么还不去领盒饭啊"
2065,"五阿哥小可爱怎么了，你们倒是说，本宫快急死了"
2065,"娴妃满满都是戏"
2065,"还想骗本宝宝"
2066,"佘诗曼演的就像皇后本尊，太棒了，全是戏！"
2066,"皇后发型真不错"
2066,"是他是他就是他大白牙"
2066,"是本宫的演技撑起了这部剧"
2066,"是他是他，就是他，皇上的弟弟，大～板～牙！"
2066,"这么多人居然被一个太监弄得团团转"
2067,"袁春望好高兴他们出事谁也想不到是自己，心里美滋滋的"
2067,"是他是他就是他大板牙"
2067,"让袁春望再淹一次好吗"
2067,"大猪蹄子，厉害啊！"
2067,"皇后眼镜一直是红的"
2067,"要是我来动手，肯定不会出现这些纰漏"
2068,"太监戏真多。于正下次注意可别让太监戏这么多了。失败"
2068,"此刻的阿佘好美啊"
2068,"是我大钢牙咋滴，我有大钢牙咋滴"
2068,"本宫身边的人一个个都领盒饭了"
2068,"闲妃，你真淡定，一句话都不说哈！马上给你领盒饭"
2068,"想皇后娘娘了"
2069,"袁什么旺这个死出！导演就不能好好找个演员吗！败笔"
2069,"太后蝴蝶结好可爱！"
2069,"不会是皇后告的密吧？皇后毕竟爱皇上"
2069,"为什么给袁春旺那么多镜头"
2069,"死太监，竟然还活了那么多集"
2069,"哥，你还笑，疯的不清啊你"
2070,"袁春望：太棒了太棒了，可以领盒饭喽"
2070,"觉得袁春旺演技很好，，，，，一个角色，别牵连个人吧"
2070,"袁春望真的是很多余啊"
2070,"本宫劝你善良"
2070,"皇后的刘海演的好"
2070,"袁什么旺这个死出！导演就不能好好找个演员吗！败笔"
2071,"袁春望演的不错，兴奋的眼里都闪光"
2071,"看袁春旺那个虎王八犊子样"
2071,"惊不惊喜意不意外"
2071,"袁春望真的是很多余啊"
2071,"袁春望：太棒了太棒了，可以领盒饭喽"
2071,"皇后的刘海演的好"
2072,"袁哥哥命好大呀！"
2072,"四菜一汤米饭管饱来吧"
2072,"袁春望，你的盒饭🍱朕替你热好了"
2072,"一会儿袁春望知道他不是皇子就精彩"
2072,"大猪蹄子加油"
2072,"看袁春旺那个虎王八犊子样"
2073,"袁春旺演的很好啊一个反面角色就是得让人厌烦才是成功"
2073,"想本可爱了吗"
2073,"这袁春旺这么重要的角色就不能找个好点的演员来演吗？"
2073,"还好我机智"
2073,"袁春望准备领盒饭吧，真是看够你了居然让你待了那么久"
2073,"袁春旺我劝你善良"
2074,"皇后也爱皇上的刚才月冲进火场去救皇上能"
2074,"呀呀呀大猪蹄子"
2074,"袁春望好高兴的样子啊"
2074,"蛙哥有点帅啊，心疼"
2074,"弘昼自以为自己很聪明，其实就是一莽夫"
2074,"袁春望，继续得意吧！"
2075,"来来来不要挤排好队大家都有盒饭"
2075,"诶呀妈呀脑瓜疼脑瓜疼"
2075,"阿佘好美好美"
2075,"还是我聪明，在最后关头没有合作"
2075,"这一口陶瓷牙盒饭肯定吃的香"
2075,"都是袁春望"
2076,"开始以为嬛嬛变成了青铜越看才发现你爸爸终究是你爸爸"
2076,"袁春望你戏真的多，拖出去斩了"
2076,"皇后头发演得好"
2076,"各怀鬼胎，眼神说明一切"
2076,"没有办法我就是这么强大"
2076,"袁春望那发光的眼睛"
2077,"皇上和璎珞一样聪明好嘛，只是不愿拆穿罢了"
2077,"就是这么聪明没办法"
2077,"打不过我吧我就是这么强大追不上我吧啦啦啦啦啦"
2077,"本宫的刘海好美腻"
2077,"一个奴才这么多戏，真佩服写"
2077,"袁春望你戏真的多，拖出去斩了"
2078,"其实这件刺杀的事无论成功与失败袁春望都是最大的赢家"
2078,"于妈对于配角加戏的把握还是值得肯定的，看看隔壁某剧"
2078,"皇上：和亲王，朕已经为你热好盒饭了"
2078,"还是我聪明"
2078,"梁栋你就是个大猪蹄子"
2078,"想看蛙哥怎么样了"
2079,"佘诗曼演技真好，眼神绝了，她是真的还是希望皇上安全"
2079,"为什么不等和亲王说自己要当皇上的时候再出来"
2079,"这些人都没那个太监聪明啊海燕啊你可长点心啊😄"
2079,"富察皇后走的第不知道多少天想她想她"
2079,"袁春旺是先帝的儿子……不是太监戏多，是他在复仇"
2079,"演技最上不了台面的就是前义兄了"
2080,"为什么袁春望能活这么久为什么袁春望不去领盒饭"
2080,"佘诗曼好美"
2080,"大猪蹄子好可爱"
2080,"大猪蹄子🐷你忘记我了吗？"
2080,"这部剧太监是个大败笔，宁可多几个亲王"
2080,"袁春望什么时候死啊"
2081,"真是醉了袁春望根本没有站的住脚的原因来谋划这一切"
2081,"皇后这样，真的超美，眼睛亮晶晶的"
2081,"袁春望都快想笑出声了"
2081,"袁春望一个太监未免戏太多了吧！"
2081,"袁春旺眼睛瞪直了"
2081,"袁春望什么时候死啊"
2082,"袁春望是关系户吗，竟这么多特写这么多镜头主角光环吗"
2082,"袁春望眼睛里我看到了惊喜🤪要不然这抢戏也可以的"
2082,"大猪蹄子迷之微笑"
2082,"我只想看傅恒"
2082,"要领盒饭了，好开心"
2082,"袁春望怎么还不领盒饭"
2083,"历史这个皇后也是下江南呗废的，还真是还原真实"
2083,"大猪蹄子真聪明"
2083,"舒服舒服舒服"
2083,"我这么帅咋还不出来"
2083,"大猪蹄子迷之微笑"
2083,"我只想看傅恒"
2084,"大龅牙你们完了"
2084,"太好了，我好高兴，就要看到大板牙领盒饭了"
2084,"袁春旺演技真的很好"
2084,"牙精你还有什么话说😂！"
2084,"本宫还是可爱的"
2084,"历史这个皇后也是下江南呗废的，还真是还原真实"
2085,"无语，一部剧让一个太监那么多戏"
2085,"皇后的龙须演得好"
2085,"一个太监哪来这么多戏"
2085,"郑接舆才是大猪蹄子！"
2085,"粉色粉色好开森"
2085,"不怕神一样的对手，就怕猪一样的队友"
2086,"袁春望角色设定不要攻击演员本身好吧"
2086,"袁春望到底是一个什么样子的存在"
2086,"意不意外，惊不惊喜"
2086,"袁春旺戏份不少啊"
2086,"袁春望活太久了"
2086,"还是我厉害😄"
2087,"大猪蹄子太聪明啦"
2087,"袁春旺你真以为自己最聪明"
2087,"袁春望这表情，是高兴还是哭呢"
2087,"我就是这么强大"
2087,"不听话，我就让袁春望把你带走"
2087,"看了这部剧之后，臣妾认识了好多字哦"
2088,"大猪蹄子除了面对女人的时候总被套路其他时候智商爆表"
2088,"我儿可安好"
2088,"说袁春望戏多的都是傻子吗，没有他，剧情怎么走下去"
2088,"请问袁春望什么时候领盒饭"
2088,"袁春望的戏是真的多"
2088,"皇后太美了吧！！"
2089,"引起强烈的舒适感"
2089,"还有我还有我嘻嘻"
2089,"袁春望的戏真多"
2089,"什么我们设下圈套！？你这不是圈套！？"
2089,"别再给袁春望镜头了好吗，辣眼"
2089,"一首凉凉送给你"
2090,"袁哥哥表情好惊喜吖"
2090,"感觉袁春旺可有可无啊他是不是导演亲戚，或给导演钱了"
2090,"太后的蝴蝶结🎀好可爱"
2090,"呦，你们玩的挺热闹"
2090,"佘诗曼演技太好了"
2090,"一首凉凉送给你"
2091,"余诗曼演技很棒，希望看她多演剧。很有气质！"
2091,"啦啦啦啦，打不到我吧，没有办法，我就是这么强大"
2091,"你们谁看今晚的疯狂的麦吉的呀！是延禧剧组哟！"
2091,"有密道？都不跟我讲一下"
2091,"这部剧的被袁春望演的有点缺憾。换了他就更完美了"
2091,"太后的蝴蝶结🎀好可爱"
2092,"强烈要求给袁春旺打马赛克"
2092,"就说帅不帅😎️"
2092,"本宫倒要好好瞧瞧这碗盒饭袁春望是吃还是不吃"
2092,"不不不，我可没那闲工夫"
2092,"袁春望戏多！怎么他还不领盒饭呢"
2092,"我就看你们玩"
2093,"袁春望差不多可以下线了吧，这个大祸害"
2093,"我这么帅怎么还没出场"
2093,"大猪蹄子真有你的"
2093,"如果你没有这个贼心，也自然不会中圈套，我们还是兄弟"
2093,"皇上这表情演的好啊"
2093,"啧啧啧烤瓷牙可以摘了吗"
2094,"还是少爷厉害啊"
2094,"袁春望就想看皇家兄弟相残父子反目吧"
2094,"注意是第三次南巡，按时间推算夏雨荷是第几次呢"
2094,"就你这智商，还是去打呐亲吧"
2094,"妈呀，计中计啊，这是皇上故意设计的让他被害"
2094,"我可聪明了"
2095,"没有觉得他演的好，而且是太作了过了"
2095,"惊不惊喜意不意外感不感动"
2095,"是他是他就是他，就是那个大白牙"
2095,"弄死你个大板牙"
2095,"刘永龙才是大猪蹄子"
2095,"发型美美哒"
2096,"跟袁春望比起来，感觉高贵妃好太多"
2096,"袁春望也快了"
2096,"袁春旺会说出身世吗大家说"
2096,"小子，你长点心吧"
2096,"哇哥还好吗"
2096,"你还是太年轻了"
2097,"都没看到令妃大肚子，就生了那么多，导演太能省略了。"
2097,"我大猪蹄子要封李大雪为贵妃"
2097,"袁春望不会到最后是好的吧，和樱咯一起设的局……"
2097,"弘昼受死吧"
2097,"大猪蹄子真厉害"
2097,"你的范何弄好了"
2098,"说佘诗曼演技好的人无非是想把佘字打出来"
2098,"把大龅牙的盒饭热一热"
2098,"原来段位最高的是大猪蹄子"
2098,"你的盒饭热好了"
2098,"说什么好呢"
2098,"我怎么这么聪明，哈哈"
2099,"终究还是太嫩"
2099,"袁春望再不吃盒饭要馊了"
2099,"一群人竟然都被一个太监利用了"
2099,"本宫演技炸裂啊"
2099,"原来段位最高的是大猪蹄子"
2099,"把大龅牙的盒饭热一热"
2100,"少爷就是厉害"
2100,"開心嗎，意不意外"
2100,"袁春望算计的是皇上还是皇后"
2100,"那个虫是袁春旺方的"
2100,"袁春望怎么还不死翘翘啊"
2100,"袁春望快去领盒饭🍱"
2101,"同志们，盒饭已热好，快来取"
2101,"好了好了大家安静，不要再夸我了"
2101,"赶紧去领盒饭吧让你活这么久了"
2101,"幸亏我聪明哈。"
2101,"袁春旺，语文课代表给你当好吧，播音员也给你当"
2101,"我可是令贵妃呀，不能不管我一"
2102,"大龅牙还嫩了点"
2102,"我儿可安好？若如此,我便安心"
2102,"哪里去看直播"
2102,"大猪蹄子，你居然去选美"
2102,"真是不见棺材不掉泪"
2102,"本宫为救五阿哥要领盒饭了"
2103,"袁春望这台词功夫不红是有理由的"
2103,"袁春望是这部剧的败笔，好好的剧全被他这个角色糟蹋了"
2103,"心疼皇后，真的，其实是个好皇后的"
2103,"饭盒到了，快去吃吧！给你加鸡腿！"
2103,"古代人的头发都不长的吗？"
2103,"大龅牙还嫩了点"
2104,"袁春望的演技好吗没看出来"
2104,"厉不厉害～"
2104,"为什么不想好托词呀"
2104,"本宫不见了"
2104,"我现在看到袁春望就想吐啊"
2104,"我大猪蹄子也要封小糖糖为贵妃"
2105,"是他是他就是他你们的大龅牙和亲王"
2105,"我既可爱，又厉害"
2105,"傅恒贼聪明"
2105,"袁春望还有故事啊！这么说"
2105,"为什么要叫瘦马？"
2105,"我希望你快点回来吧"
2106,"要是我我直接扔个手榴弹就好了。。。"
2106,"五阿哥没事吧"
2106,"不要告诉我袁春旺活到了最后"
2106,"难道不是吗选美？"
2106,"总结了又总结了"
2106,"快别说了，我儿子在哪啊？"
2107,"哦不是，像一个人格分裂的傻子"
2107,"大板牙，你活的太久了"
2107,"#R袁春旺演技有点尬"
2107,"我就是这么厉害"
2107,"古道西风瘦马🐴"
2107,"柯南上身谁敢拦我"
2108,"傅恒这人设太完美了吧心疼，付出最多啊"
2108,"来来来，和亲王，你的盒饭已经热好了，趁热吃吧"
2108,"朕就是这么强大"
2108,"于正没办法，必须得安排袁春旺这个角色"
2108,"你是不是也该领盒饭了你这个祸害"
2108,"袁春望这个形象真是……"
2109,"太后害怕的样子好可爱"
2109,"朕才是最大的玩家"
2109,"不愧为是宋春丽演的太后太好了"
2109,"本宫在大明湖畔安排紫薇"
2109,"朕就是这么强大"
2109,"袁春望这个形象真是……"
2110,"嬛嬛好可爱啊"
2110,"大猪蹄子的胡须真霸气"
2110,"惊不惊喜，意不意外"
2110,"我这样真美"
2110,"袁是想报复皇上和太后"
2110,"本宫要大爆发了！！！"
2111,"一个太监都那么多戏"
2111,"c！朕好厉害"
2111,"笑的这么开心"
2111,"朕早就看穿一切"
2111,"袁春旺演得太入戏有他的以后都不看了"
2111,"袁春望好像搞得自己是主角一样"
2112,"袁春望，就是个多余的角色"
2112,"我家大猪蹄子最聪明了"
2112,"给乾隆演的这个厉害"
2112,"盒饭已热，袁春望赶快来吃吧！"
2112,"都被那个太监骗了"
2112,"没办法，我就是这么聪明"
2113,"女神佘诗曼"
2113,"我真是太正直了"
2113,"怎么觉得袁春旺在帮璎珞啊？"
2113,"完了，我中了袁春望圈套"
2114,"大猪蹄子智商赛高"
2114,"惊不惊喜，意不意外，刺不刺激"
2114,"论文总分总，开头是因为他，结尾也是因为他，厉害"
2114,"大猪蹄子这回明白了"
2114,"皇后也是为皇上好"
2114,"女神佘诗曼"
2115,"我们大猪蹄子就是聪明"
2115,"选什么美，朕有璎珞就够了，朕要一夫一妻"
2115,"大猪蹄子厉害"
2115,"哎！死太早了！没看成好戏！"
2115,"没袁春旺哪来后面这些戏？还多余。。。"
2115,"今天更新早"
2116,"大猪蹄子好机智"
2116,"演得太好了"
2116,"大猪蹄子怎么这么帅"
2116,"朕是不是很机智"
2116,"主谋是袁春望这条狗"
2116,"皇后顶住，小燕子紫薇还没来报到呢"
2117,"富恒真的是个可怜人，付出最多，还得不到自己最爱的人"
2117,"没有袁春旺哪来的钱拍给你们看"
2117,"皇后要开始了，好激动！！！！！1"
2117,"你个大猪蹄子，都不问问你的令妃哪去了吗？"
2117,"袁春旺到底是咋回事"
2117,"你以为朕白活那么久？？"
2118,"大猪蹄子就是卢云雄"
2118,"本大猪蹄子就是这么聪明"
2118,"刘生权你个大猪蹄子"
2118,"朕什么不知道，快夸本宝宝聪明"
2118,"富恒真的是个可怜人，付出最多，还得不到自己最爱的人"
2118,"没有袁春旺哪来的钱拍给你们看"
2119,"还说袁春旺演技好呢？就这台词功力？"
2119,"皇上太有范儿了！睿智又霸气！"
2119,"皇上就是皇上啊太厉害了"
2119,"总感觉这个剧情在别的剧也有"
2119,"你们是不是都把我媳妇忘了"
2119,"朕什么不知道，快夸本宝宝聪明"
2120,"袁春望怎么戏那么多"
2120,"哎呀，我好骄傲啊"
2120,"皇后告的密"
2120,"想容音小天使了吗"
2120,"袁春望已经是合同工，不能够领饭盒了"
2120,"朕的腰带呢？腰带呢？"
2121,"宋春丽不愧是老戏骨，这部戏选演员用心了每个人都很好"
2121,"袁春望我劝你善良"
2121,"佘诗曼真的好演技，一个眼神就够了"
2121,"到现在还说袁春望在帮璎珞的真是无语了"
2121,"原春望不领盒饭吗"
2121,"瘦马是什么意思"
2122,"大猪蹄子的衣服是后妃给你穿的吗"
2122,"你们都别说了，快救救我儿子"
2122,"那个卤蛋精袁春望你可别吵吵了"
2122,"超喜欢佘诗曼，演技不错"
2122,"好，好，好，历害，鼓掌鼓掌👏"
2122,"丸美我劝你善良"
2123,"大猪蹄子厉害了"
2123,"大猪蹄子。别说了。我还没找到呢。"
2123,"少爷好厉害啊~~~先做准备"
2123,"感觉袁这样做是在帮我吧？"
2123,"大猪蹄子威武！！😎"
2123,"大猪蹄子，我呢？不管我了？？"
2124,"大白牙要挂了"
2124,"皇上个大猪蹄子有我还要选美吗？"
2124,"你还敢选美，大猪蹄子"
2124,"本宝宝就是如此聪明"
2124,"哭了这什么台词功底"
2124,"皇上，您要替臣妾做主啊"
2125,"原来历史上乾隆南巡找歌舞伎的事是被他陷害的"
2125,"袁春旺是朕的亲兄die"
2125,"瘦马一点都不瘦"
2125,"袁春望是时候该你表演了~~~"
2125,"袁春旺是推动剧情发展的阿各位"
2125,"就因为我长得帅？你们羡慕？"
2126,"聂远越到后面戏越好呀"
2126,"容音最可爱了"
2126,"乾隆:你好大的胆子啊"
2126,"猴钰洁有在看吗"
2126,"感觉袁春望是好人啊"
2126,"瘦马一点都不瘦"
2127,"多尔衮好的啊"
2127,"皇上帅呆了"
2127,"傅恒真的是个好孩子"
2127,"太后头上的是蝴蝶结吗"
2127,"袁春旺掏过钱的"
2127,"我就是名侦探！！！"
2128,"说他是多尔衮那给他定得罪很大了"
2128,"大猪蹄子你咋就这么聪明"
2128,"说劝这个善良那个善良的有意思吗？？"
2128,"哈哈想象力挺丰富的"
2128,"哪来的想象力这个词?😂好现代昂😂"
2128,"多尔衮好的啊"
2129,"禀奏皇上大龅牙的盒饭已经热好了"
2129,"朕好聪明啊"
2129,"嬛嬛斗了那么多年该识别和亲王的呀"
2129,"我好聪明鸭～"
2129,"大猪蹄子演技可真好"
2129,"我太英明神武了"
2130,"多尔衮比和亲王聪明多了"
2130,"朕好聪明啊，朕的智商上线了"
2130,"惊不惊喜，意不意外，刺不刺激"
2130,"这句想象力说的膨胀了"
2130,"一直喜欢啊佘，希望还有更好的作品"
2130,"看朕的胡子"
2131,"惊不惊喜，意不意外"
2131,"认了是条汉子"
2131,"一个太监掀起了这么大风浪"
2131,"多尔衮可没那么龌龊"
2131,"想象力丰富莫名搞笑"
2131,"多尔衮比和亲王聪明多了"
2132,"一直说一个太监戏多的搞清楚他的真实身份了吗"
2132,"少爷好厉害啊"
2132,"多尔衮这个例子太好了，他也是与孝庄太后有情"
2132,"朕太英明了厉害"
2132,"大猪蹄子太棒了"
2132,"朕的想象力当然要丰富了"
2133,"皇兄你想象力挺丰富得啊，哈哈~不小心笑出了声"
2133,"大烤瓷牙真是够了"
2133,"想几道哇哥的腿好没好"
2133,"哼让你糟蹋我姐"
2133,"余海帆你个大猪蹄子"
2133,"多尔衮这个例子太好了，他也是与孝庄太后有情"
2134,"大龅牙戏太多"
2134,"大猪蹄子你想象力挺丰富呀"
2134,"哈哈，你想象力挺丰富呀，乐死我了"
2134,"你就是戏精本精了"
2134,"皇兄您想象力挺丰富的啊~~~没忍住，哈哈哈哈"
2134,"皇兄你想象力挺丰富得啊，哈哈~不小心笑出了声"
2135,"想象力挺丰富的呀！这么新颖的词，编剧大大得走心了！"
2135,"那个时候就有‘想象力挺丰富的呀’这句话了这么超前？"
2135,"皇上吉祥皇上好聪明"
2135,"不不不，没有你丰富。"
2135,"啥也别说了叫嬛嬛给颗大药丸"
2135,"大猪蹄子，你是不是忘了本宫了？"
2136,"大猪蹄子居然敢质疑多尔衮，这是对先祖的大不敬之罪啊"
2136,"我这大猪蹄子可是有智商的！"
2136,"这叫聪明不是想象力丰富"
2136,"想象力太丰富了"
2136,"袁浩是个大猪蹄子"
2136,"朕聪不聪明呢～"
2137,"这台词好现代和亲王你是穿越来的吗"
2137,"大猪蹄子就是大猪蹄子"
2137,"想象力丰富笑喷"
2137,"刘琪你个大猪蹄子"
2137,"我弘昼就是喝多了"
2137,"朕聪不聪明呢～"
2138,"“想象力丰富？”台词认真的吗？和亲王你是魔鬼吗？"
2138,"想象力这个词是认真的吗"
2138,"服装、道具和剧情都好，台词能不能注意点啊"
2138,"你想象力挺丰富的呀。。。这台词认真的吗"
2138,"爱情公寓跳戏了想象力挺丰富"
2138,"哼，还装，非逼我全说了全发盒饭"
2139,"我大猪蹄子就是这么机智"
2139,"哈哈，一般一般"
2139,"多尔衮是很厉害的好吗"
2139,"想象力真丰富我"
2139,"大猪蹄子太厉害了"
2139,"“想象力丰富？”台词认真的吗？和亲王你是魔鬼吗？"
2140,"大猪蹄子真是厉害"
2140,"想象力挺丰富的，哈哈哈哈哈"
2140,"想象力丰富？？？这剧真是分分钟出戏啊"
2140,"张超凡你看到这了嘛"
2140,"那么多人都以为八点才更么"
2140,"你们都疯了吗"
2141,"你看晚点出来多好啊"
2141,"厉害了大猪蹄子"
2141,"想象力太丰富好好好"
2141,"陌陌、记住要保持愉悦的心情哈"
2141,"多尔衮多好啊"
2141,"来人呐，把他们的盒饭端上来"
2142,"大猪蹄子就是聪明"
2142,"是真的呀！"
2142,"好时髦的词，想象力挺丰富"
2142,"好厉害的一句，你想象力好丰富啊"
2142,"台词好耳熟，挺现代啊"
2142,"帝王家的智商都高"
2143,"看来皇上不只是个大猪蹄子，还是聪明啊"
2143,"牙亲王盒饭给你热好了快去领吧"
2143,"大猪蹄子还满厉害的嘛。"
2143,"皇上的胡子是掉了吗"
2143,"想象力丰富出戏了"
2143,"本宫是无辜的"
2144,"你想象力挺丰富的呀😂为什么莫名戳中笑点"
2144,"朕不光想象力丰富而且还智商爆表"
2144,"皇后是不知情的吧。。不然为什么瘦马那事还要去劝。"
2144,"我怎么了，我心里清楚哈"
2144,"好调戏啊，想象力丰富"
2144,"我非常厉害吧！没想到吧……"
2145,"好大的板牙"
2145,"我最机智啦啦啦"
2145,"多儿滚儿哈哈"
2145,"顾小娜在看吗"
