time,content
2014,"原来是你这个老女人，我还以为是皇上"
2014,"说了多少遍了，袁春旺的胳膊是假肢假肢！！"
2014,"要联手了，合作愉快"
2015,"大猪蹄子，你的紫薇小燕子还流落民间呢！赶紧去找"
2015,"这身衣裳也太美了吧"
2015,"皇后衣服看着好赞"
2015,"只是不知道你喜欢什么味道的盒饭。"
2015,"感觉皇后的衣服最多了"
2015,"哟哟切克闹"
2016,"真大猪蹄子，见一个爱一个"
2016,"娴妃才是最毒的人"
2016,"你拘谨的时候也是缩手缩脚，不信自己看～"
2016,"又有人来帮我除人了真开心"
2016,"皇后这个衣服太美了"
2016,"这身衣裳也太美了吧"
2017,"原来皇后说的令妃回来将是另一个天下说的是顺妃啊"
2017,"皇后这条衣服质感好高级"
2017,"尔康还没生出来，五阿哥怎么能见到小燕子？早着呢"
2017,"哼，皇后娘娘你离盒饭不远了"
2017,"感觉这个剧只有娴妃的衣服看起来比较华丽"
2017,"本宫刚不过顺嫔你来"
2018,"皇后娘娘，您座位好高啊"
2018,"本宫以前没生过娃，现在一生就要生个痛快"
2018,"令妃跟着太后在圆明圆学了三年的技能回来收拾你们了"
2018,"衣服演得好"
2018,"袁春望我劝你善良"
2018,"皇后这条衣服质感好高级"
2019,"这么多太监咋就袁春望走路不甩胳膊"
2019,"我劝皇后你善良，你有两个孩子"
2019,"这是要强强联手了"
2019,"本宫衣服就是多"
2019,"打野发育神装，准备一波团了"
2019,"有必要坐那么高么，哼"
2020,"魏璎珞头上的总感觉是多肉🤔"
2020,"换新衣服了。高兴"
2020,"还是吴总管听着顺耳"
2020,"老娘四级了可以开大了"
2020,"坐那么高是要死吗"
2020,"此刻我好像愉妃"
2021,"大猪蹄子什么意思？奴才不懂，请赐教"
2021,"猜都是皇后布置的人还是不要自视过高皇后需要你去战斗"
2021,"皇后想让他对付那个厉害角色"
2021,"惊不惊喜，意不意外，刺不刺激"
2021,"皇后凉凉新衣服"
2021,"原来大猪蹄子已经把我忘了"
2022,"大猪蹄子就是大猪蹄子"
2022,"不就是想让老娘帮你给顺嫔送盒饭吗？"
2022,"可以看出，袁春望性格好极端"
2022,"本宫的皮肤还真是白的发光啊！"
2022,"皇后坐的好高哦"
2022,"本宫有几套衣服就是几天把戏拍完的"
2023,"这样的打击可是比任何打击都要重多了"
2023,"要不要座这么高"
2023,"那拉氏的这套衣服好华丽"
2023,"我就知道你要利用我去对付顺嫔"
2023,"闲妃老女人了还生孩子"
2023,"感觉这后宫一直在打无销烟战争，"
2024,"袁春旺黑化好气啊本来多好啊"
2024,"本宫衣服太美"
2024,"屏幕真的太有趣了，个个都是戏精哈哈哈哈"
2024,"注意你的坐姿，这是皇后该有的样子吗"
2024,"皇后的座位好高"
2024,"要不要座这么高"
2025,"傅恒见皇上和沉壁还有沉壁进宫都剪了"
2025,"本宫当了皇后生了娃，剧组给了我好几套新衣服呢"
2025,"本宫劝你们都善良"
2025,"皇后娘娘你快让座了"
2025,"衣服和头饰都很美"
2025,"敌人的敌人，就是朋友"
2026,"皇后好美丽啊"
2026,"走，我们一起去给顺嫔理个发"
2026,"皇上是因为皇后死了才离开大明湖畔的死的那个皇后？"
2026,"有了共同的敌人"
2026,"这皇后演的好啊，不愧是老戏骨了"
2026,"三年了，我耳环怎么还是这副"
2027,"质量好赞确实让你知道你"
2027,"杜比音效，本宫劝你善良。"
2027,"高手开始过招了"
2027,"这个嘴唇是认真的吗！？"
2027,"袁春望最近还是不要出门的好"
2027,"看得本宫心里发怵"
2028,"袁春望现在这样过的一点不开心，跟着璎珞才开心呢"
2028,"原来是我太自信了"
2028,"突然发现此剧娴妃衣服最多"
2028,"皇后，我可是海龟，就问你怕不怕"
2028,"受点挫折才好"
2028,"你走之后，本宫三年生了两个"
2029,"坐的高真舒服"
2029,"本宫脖子都抬酸了"
2029,"想知道皇后能活几集"
2029,"本宫这身衣服不错"
2029,"这个嘴画的是认真的吗"
2029,"你走之后，本宫三年生了两个"
2030,"皇后把所有人支走，安稳的生两个阿哥"
2030,"本宫要你一起组队，发起攻击"
2030,"座位空了这么多"
2030,"气场上我赢了"
2030,"嬛嬛教了很多好东西啊"
2030,"看破一切的眼神"
2031,"所以说还是开心最重要，早日放下心结，得过且过吧"
2031,"本宫的咬唇妆演得好"
2031,"这咬唇妆可能是化妆师困的时候画的"
2031,"嘴唇厉害了"
2031,"就不能让璎珞利用一次娘娘吗？璎珞回来又是被利用"
2031,"本宫看着你跟顺嫔斗"
2032,"令妃刀收好了吗，本宫想再借用下。"
2032,"有人想我高可爱吗"
2032,"王者对决，精彩精彩"
2032,"感觉这个咬唇好败笔啊。"
2032,"这咬唇妆可能是化妆师困的时候画的"
2032,"所以说还是开心最重要，早日放下心结，得过且过吧"
2033,"魏大哥嘴唇好厚"
2033,"本宫的口红是认真的吗"
2033,"皇后演的好刻意"
2033,"化妆师真是不想活了"
2033,"再厉害也是个反派，迟早领盒饭"
2033,"坐的高，看得远嘛"
2034,"坐那么高我脖子好酸"
2034,"本宫的耳朵好疼啊"
2034,"今天的口红怕是没画好"
2034,"这口红没涂好啊"
2034,"口红能不能涂好了"
2034,"上届冠军联赛的徒弟你们打得过？"
2035,"佘诗曼好强大的配角，演的真好"
2035,"高贵妃可美多了。"
2035,"这是要令妃跟新来的妃嫔打架，她在边上看呢"
2035,"这嘴像吃了孩子"
2035,"这是清朝的唇妆好吗"
2035,"这口红没涂好啊"
2036,"再说一遍顺嫔是大猪蹄子用来气璎珞的"
2036,"皇后做那么高不怕摔死吗"
2036,"魏姐口红没涂好"
2036,"你看生的的这两个阿哥，没一个是争储焦点人物"
2036,"这咬唇妆能不能化得认真点"
2036,"佘诗曼好强大的配角，演的真好"
2037,"咬唇没涂好啊，是急着拍戏吗？"
2037,"今天本宫回宫，化妆师咬唇妆给我涂成这样？"
2037,"这个口红涂的好随意啊"
2037,"要不要组个队一起吃鸡？"
2037,"顺嫔，本宫提前劝你善良"
2037,"没事，等着你的十五阿哥"
2038,"快了快了十五阿哥要到了"
2038,"都是啊哥，没有格格，真厉害"
2038,"好随意的涂了两下"
2038,"还珠里面的皇后也生了12阿哥，就是这个坏女人没错了"
2038,"两大王者要联手开黑了吗"
2038,"合作愉快啊"
2039,"生太早了，乾隆太能活了"
2039,"口红涂的如此随意，在圆明园呆久妆都不会画了吗💄"
2039,"皇后作为垫高了吧"
2039,"我升完级回来啦"
2039,"快了快了十五阿哥要到了"
2039,"都是啊哥，没有格格，真厉害"
2040,"袁春旺这个名字好编剧不愧是王者哈哈哈哈"
2040,"我实在厉害都是儿子"
2040,"她马上要开始生孩子了，生的太多了"
2040,"本宫比顺嫔美一万倍"
2040,"璎珞头上带的是多肉吧😄"
2040,"把我当化妆师拿出去斩了"
2041,"我只关心五阿哥多大了"
2041,"全他喵的是儿子，有那么多皇位吗！"
2041,"咬唇妆本宫劝你善良"
2041,"口红没画好"
2041,"以前那么对皇上现在喜欢就晚了自己太作"
2041,"口红是认真的吗？"
2042,"早就想吐槽，皇上还活着你们说什么乾隆"
2042,"你生那么多，马上该我生了"
2042,"皇后坐的好高😄"
2042,"大家想本可爱吗"
2042,"口红没画好"
2042,"该轮到我生猴子了"
2043,"说多肉的那是绒花，非物质文化遗产，不懂就别乱开腔"
2043,"这阿哥增长的咋这么快"
2043,"璎珞头上的是多肉吗"
2043,"待我慢慢收拾你们"
2043,"黄尚厉害了，个个都生的啊哥，没有一个格格"
2043,"谁给本宫画的唇，怎么歪了"
2044,"怎么到现在都还有蠢蛋在说头上戴的是多肉？"
2044,"看本宫多厉害，就生儿子"
2044,"皇后真厉害，生俩孩子一点模样都不变"
2044,"突然觉得我好善良"
2044,"璎珞这口红是认真的嘛"
2044,"演了什么久，朕一个小棉袄都没得到"
2045,"要联手了，强强联手，开心开心"
2045,"袁春旺我劝你善良"
2045,"准备好，集合打团！"
2045,"永基只能活24岁"
2045,"还差一个阿哥，接着就是璎珞生的了"
2045,"莫非是要py了？"
2046,"不中意令妃的唇妆，一点不大气，不符合她身份"
2046,"袁春旺鸡蛋汤浇饭你喜欢吗？我这就请你吃饭盒！"
2046,"令妃口红没涂好"
2046,"十五阿哥快了"
2046,"这是点绛唇，不是没涂好"
2046,"永基只能活24岁"
2047,"说多肉的去学学历史吧，那是绒花，不懂别乱说……"
2047,"原来是叫我回来做帮手"
2047,"只生阿哥没有格格这不科学"
2047,"放心吧，继承皇位的是你的十五阿哥！！！"
2047,"十五阿哥快了"
2047,"朕的女人都能生儿子"
2048,"魏璎珞头好大阿"
2048,"杜比音效，没有多好听啊"
2048,"都好聪明啊"
2048,"我去，皇后一下生了二个娃这也太快了吧"
2048,"本宫的口红没涂好"
2048,"只生阿哥没有格格这不科学"
2049,"总觉得口红没涂对称"
2049,"让你得意三个月，我这就回来给你送盒饭"
2049,"皇后本宫劝你善良"
2049,"皇上是没有女儿吗，都是儿子"
2049,"娴妃我劝你善良"
2049,"把令妃的化妆师给朕拖出去斩了"
2050,"来来来，大家一起母凭子贵"
2050,"我不管我最美最可爱"
2050,"那不叫多肉，那叫绒花"
2050,"老娘就是荣耀王者"
2050,"袁春望就是个多余的"
2050,"久违了各位小伙伴们"
2051,"大猪蹄子果然见一个爱一个"
2051,"流弊流弊.生这么多"
2051,"王者之间的对话就是直接"
2051,"怎么说得本宫像猪生崽一样"
2051,"感觉皇上的孩子全是阿哥"
2051,"还有人记得阿满吗"
2052,"皇后和令妃都是王者，只是令妃得到了大猪蹄子的心"
2052,"袁春旺走路都不摆臂的吗"
2052,"总是要香港的女演员才能撑得住皇后的角色"
2052,"佘诗曼也是主角了"
2052,"吹得这么夸张吗？还要皇后令妃联手"
2052,"圆明园那张图打完了该回去了"
2053,"现实中令妃这种为人处世，一天都活不了"
2053,"好，那我就让皇后见识下，什么叫钻次被窝就能重得圣宠"
2053,"就是要这个咬唇妆、不懂的学着点"
2053,"朕的妃嫔们太厉害了，从来都是给朕生儿子。"
2053,"袁春望我劝你最后是个双面间谍"
2053,"吹得这么夸张吗？还要皇后令妃联手"
2054,"那叫点缀唇好吗，什么没涂好"
2054,"顺嫔再厉害也别忘了我才是这一届冠军"
2054,"蓝色衣服好高级好评"
2054,"一出场就憋个大"
2054,"因为顺嫔是维吾尔族的，只是没见过那样的人图新鲜罢了"
2054,"朕的妃嫔们太厉害了，从来都是给朕生儿子。"
2055,"也没有多美"
2055,"我就是大猪蹄子"
2055,"这伏笔埋得太深了"
2055,"吗的好好奇啊"
2055,"顺嫔再厉害也别忘了我才是这一届冠军"
2055,"一出场就憋个大"
2056,"魏璎珞真的好瘦，看她好多衣服都大了。"
2056,"你单排是上不去的现在双排才是王道"
2056,"大猪蹄子被别人啃得光剩骨头了"
2056,"我名声真大"
2056,"我就是大猪蹄子"
2056,"这伏笔埋得太深了"
2057,"魏璎珞这脸削骨削得太明显了吧，好畸形"
2057,"行了，别忌惮了，快给本宫热盒饭！"
2057,"感觉吴谨言和佘诗曼都是耐看型了，越看越美"
2057,"本宫才是最厉害的"
2057,"也就是另一个璎珞了，和璎珞得宠的一样，都是三个月"
2057,"哎呀呀，不要这样说嫔妾啦，嫔妾才没有那么夸张呢"
2058,"紫菱真的可以撑起来这个角色吗吹的好厉害"
2058,"是我这个勇敢坚强美丽善良，又有让你们嫉妒的心呢"
2058,"说得太神了，顺嫔妃有这么美？"
2058,"矮马我好厉害啊"
2058,"有点期待这位天仙是如何妖艳"
2058,"我名声那么大"
2059,"妈呀铺垫好长啊"
2059,"本宫就是美"
2059,"没有能打的了，强行加一个厉害角色"
2059,"我有那么厉害吗"
2059,"并没有多美"
2059,"我段位太高"
2060,"哎妈，果然敌人的敌人就是朋友"
2060,"恐惧本宫干嘛？我可爱温柔善良美丽"
2060,"三个月嫔位厉害啦"
2060,"因为我太美了，比我还要美得就只有香妃了，怕不怕"
2060,"乾隆几年是在位的时候就开始算了吗"
2060,"我有那么厉害吗"
2061,"高手之间对话就这么直接"
2061,"大胆剧组，竟敢给本宫喝白水"
2061,"大猪蹄子都是生儿子"
2061,"盒饭热好了"
2061,"你以为是朱茵和黎姿啊,吹得这么高."
2061,"是啊没想到我这么厉害啊不愧是压轴"
2062,"说实话缨络长得很符合那个时候的审美。。。"
2062,"倒是让我看看顺嫔有多美啊"
2062,"有那么夸张吗顺就是对眼啊"
2062,"绿衣服我劝你善良"
2062,"不是有說高貴妃幫阿滿那一幕怎麼沒有了?"
2062,"我就是这么强大没办法"
2063,"好厉害的样子"
2063,"说的好厉害"
2063,"有人注意到皇后说的是顺嫔，璎珞说的是常贵人吗……"
2063,"哇吹得我好厉害"
2063,"有那么夸张吗顺就是对眼啊"
2063,"我就是这么强大没办法"
2064,"难道就我一人发现魏璎珞头上有多肉吗"
2064,"我有多厉害"
2064,"能快让那什么顺嫔领盒饭吗，凑什么热闹啊"
2064,"璎珞，本宫才是最完美的"
2064,"为什一生孩子就是男孩，基因太强大了"
2064,"我真是一个大猪蹄子"
2065,"高可爱最可爱"
2065,"这背景是高贵妃出场的古琴声看样子不是善茬"
2065,"张嘉倪确实古装美，美得不要不要的！"
2065,"我怎么这么厉害把皇后都吓着了"
2065,"想知道最后顺嫔和璎珞谁厉害"
2065,"我有多厉害"
2066,"张嘉倪还没秦岚长得好"
2066,"可以上场了好开心"
2066,"张佳妮演一个像天仙级的人合适吗"
2066,"魔镜魔镜谁是这个世界上最美丽的女人?"
2066,"讲真，并没有觉得有多美"
2066,"猜一猜顺嫔能活几集"
2067,"好夸张哦也不怕顺嫔出来的时候没那么惊艳"
2067,"就我一个人看出来茶碗是空的吗？"
2067,"头上是绒花不是多肉"
2067,"吼吼好厉害的样子"
2067,"不美别出来，铺垫的太好了"
2067,"张嘉倪还没秦岚长得好"
2068,"顺嫔这是什么段位？让这些高级玩家都怕成这样"
2068,"我好厉害我好厉害"
2068,"真没get到顺嫔有特别美"
2068,"我回来就是为了弄死顺妃的"
2068,"比魏姐确实是美得多"
2068,"呵呵老娘就是美"
2069,"皇后凉凉坐的好高啊"
2069,"她当然没我单纯没我可爱"
2069,"没觉得多美啊"
2069,"老娘厉害吧，面还没露呢？就让你们闻风丧胆的"
2069,"感觉抬得有点高"
2069,"我多少集可以领便当"
2070,"本宫也想看看，如何美艳动人"
2070,"本可爱可是很单纯的"
2070,"哈哈哈好厉害的顺嫔啊，闻风丧胆的。"
2070,"本宫战斗力就是这么强"
2070,"切，纵使千般好，你没有主角光环"
2070,"听说老娘很厉害"
2071,"张嘉倪真的担的起这么多集的铺垫吗出场会多惊艳"
2071,"杯子里没水啊喝了50多集的空碗"
2071,"一直看不懂他们的咬唇妆啊，是粉太厚了吗"
2071,"珞珞，你竟然还记得本宫，本宫甚是开心啊"
2071,"谁，赶紧出来我瞧瞧多完美"
2071,"听说老娘很厉害"
2072,"意思就是:完全没穿衣服光溜溜的"
2072,"好激动啊该我上场了"
2072,"太夸张了有这么美吗无语"
2072,"好想高可爱"
2072,"皇后杯子里是空的"
2072,"谁想我高可爱了"
2073,"沉壁表示压力好大"
2073,"我不美。我觉得我很丑。嘴巴很大"
2073,"不高兴，不喜欢顺嫔，她出现意味着明玉就要领盒饭了"
2073,"噱头做足了"
2073,"高贵妃长得真的没有那么美好嘛"
2073,"本宫才是美哒"
2074,"演顺嫔的人压力好大"
2074,"哈哈好开心你们又想起来我了，还这么抬举我！！！"
2074,"原来高贵妃的人设是美"
2074,"本宫也算美吗"
2074,"别铺垫得太多了，免得掉下来"
2074,"高贵妃?是我么，我都不觉得我美"
2075,"牛皮吹大了啊，哪有那么美"
2075,"大猪蹄子今晚等你"
2075,"提前炒作好了，铺垫好了"
2075,"乾隆你个大猪蹄子"
2075,"快出来好激动"
2075,"原来高贵妃的人设是美"
2076,"哼我小高最棒最妖娆"
2076,"刚刚好像听到有人在唤本可爱呢"
2076,"高贵妃:看到你们还觉得我美我很感动"
2076,"背景可真精致啊"
2076,"顺频什么时候吃盒饭"
2076,"怎能和本宫比呢，本宫可是最讨皇上喜爱的"
2077,"还没出来就夸上天了，我好好奇啊"
2077,"本宫是高可爱"
2077,"怕各位娘娘对美好像有什么误解"
2077,"本宫最美你们都是大猪蹄子"
2077,"是大明湖畔的夏雨荷是大明湖畔的夏雨荷"
2077,"背景可真精致啊"
2078,"高贵妃美吗？顺嫔有皇后娘娘美吗？"
2078,"我活了多长时间？"
2078,"这顺嫔是个啥，感觉好厉害的样子"
2078,"谁说老娘不美！其他人：您最可爱了"
2078,"看来当年的高贵妃是很美的"
2078,"区区一个高贵妃，斗得过我家魏姐"
2079,"演顺嫔的人得多完美啊，压力好大"
2079,"本宫才是集美丽于一身的完美女子"
2079,"好生气真是大猪蹄子"
2079,"我知道我长得美"
2079,"顺嫔的扮演者没有多惊艳啊……"
2079,"高贵妃美吗？顺嫔有皇后娘娘美吗？"
2080,"高贵妃美？？？还是富察皇后最美好嘛"
2080,"你们话真多还让不让本宫出场了"
2080,"保护我方高可爱"
2080,"顺嫔无非就是新出的英雄，无视就好"
2080,"从来没有感觉到张嘉倪的美丽"
2080,"我知道我长得美"
2081,"那个说别抛了半天玉引来一块砖的实在是幽默又有才"
2081,"没有比本可爱更美丽的女人"
2081,"感觉顺嫔好厉害的样子🙄"
2081,"嘤嘤嘤本宫最可爱"
2081,"高贵妃可以当皇上的娘，还美个球"
2081,"我觉得我很美"
2082,"小高要是多演十多二十集改多好，想念高贵妃了"
2082,"本宫就是厉害啊，还没出场就有这么强的人设"
2082,"张嘉倪美是美没有夸张的美吧…"
2082,"最后十二集写不下去了吗，编剧还要派个人进来怕了怕了"
2082,"还珠格格的香妃确实很美但是这个容妃没那么美吧"
2082,"我就是靠脸吃饭你要爪子嘛"
2083,"没觉得高贵妃美啊觉得她最老气都说她没很违和"
2083,"本宫是这个剧里最单纯的人了"
2083,"高可爱一般人可比不了"
2083,"高贵妃本来就很美不要以现代的审美批评古人"
2083,"有一种美叫做高贵妃的美"
2083,"璎珞你是想我了吗好感动哦"
2084,"现实中根本就没有这么美，也就一般呗，都是虚夸"
2084,"我会唱戏，我会穿绿衣服戴红花，顺嫔她会吗？"
2084,"这铺垫做的快把顺嫔夸上天了"
2084,"当然是本宫最美最可爱了"
2084,"女人那么多急什么"
2084,"我好厉害啊"
2085,"多肉厉害了"
2085,"想我高可爱了没有"
2085,"看来是有有趣的灵魂"
2085,"看来是我活好了"
2085,"璎珞你的口红是认真的嘛"
2085,"皇上才不会为一张脸去养一身伤"
2086,"美不重要光环亮才重要"
2086,"本宫比他美多了"
2086,"顺嫔的铺垫做得好足啊"
2086,"本宫才是最厉害的角儿"
2086,"说得这么神，我都好好奇"
2086,"想我高可爱了没有"
2087,"顺嫔是不是大猪蹄子的计膜"
2087,"你们铺垫这么多，出场的时候压力好大呀😂"
2087,"扯上我高可爱了"
2087,"本宫最美丽最可爱"
2087,"好紧张，好阔怕"
2087,"我好厉害我好崇拜我自己"
2088,"如果现代人回到过去皇上叫他洗个脸是不是欺君之罪"
2088,"当然是高可爱更可爱"
2088,"我好好奇啊"
2088,"璎珞你这口红涂的也太任性了吧"
2088,"香妃会出来吗"
2088,"哈哈哈，没有办法我就是这么强大"
2089,"说高贵妃美绝对是对美有误解"
2089,"顺嫔听说你比我美下来让本宫看看"
2089,"高贵妃:你的高可爱突然出现"
2089,"导演，今天这口红涂的不认真啊"
2089,"令妃这口红是认真的吗"
2089,"知道本功的厉害了吧"
2090,"顺嫔长得真的很一般"
2090,"没有办法，我就是这么强大，啦啦啦啦啦啦啦啦"
2090,"就是活好啊"
2090,"嫔妾就是这么厉害哈哈哈哈"
2090,"不会又是纯贵妃吧"
2090,"我就是这样一个大猪蹄子！"
2091,"张嘉倪是美，但莫名觉得厌烦，不是对这个角色，这个人"
2091,"令妃娘娘也很美呀"
2091,"这演员压力得多大"
2091,"妄想与本宫比美！不想活了！"
2091,"这纯妆化的，实在是欣赏不了[冷汗]"
2091,"铺垫做得好"
2092,"你们别把她抬那么高好吗，不就是张嘉倪吗，皇后的妹妹"
2092,"能不能帮本宫把口红涂好"
2092,"那时候27是老女人了吧？乾隆口味挺重"
2092,"人家比顺嫔美多了"
2092,"真没觉得顺妃长的好，感觉丑，死鱼眼"
2092,"只有我欣赏不来顺嫔吗顺嫔还没出现我就想她下线"
2093,"我魏璎珞先给自己定一个小目标，给大家热三份盒饭"
2093,"本宫的口红没有涂好"
2093,"顺嫔居然有三个称号厉害啊"
2093,"棒棒哒快点出来"
2093,"璎珞你的嘴巴没画好"
2093,"本宫最可爱"
2094,"皇后令妃王者段位也打不过职业选手，要组团开战了"
2094,"我现在觉得我好善良"
2094,"令妃娘娘虽然美。但是没有气质。"
2094,"顺嫔，来吧，我都准备给你热盒饭了"
2094,"想到皇上宠爱顺嫔就心疼皇上爱的两个女人都不爱他，哈"
2094,"欧耶！我快出场了！！！好激动！"
2095,"在那个年代说不定高贵妃才是美的典范。你们懂什么"
2095,"整部剧容音最美好不啦"
2095,"好想把她们的口红画正补好啊"
2095,"因为本宝宝长的像极了先皇后"
2095,"不是顺嫔？怎么又是常贵人，两人说的是同一个人吗"
2095,"朕才不会为一张脸去养一身伤"
2096,"铺垫这么多美美美的张嘉倪从出道时就跟美没啥关系啊"
2096,"本宫再美，也没有富察皇后美"
2096,"有觉得魏璎珞太瘦撑不起这身衣服吗？"
2096,"真的是有点太过自信了"
2096,"本宫瞧着也没有本宫可爱呀"
2096,"整部剧容音最美好不啦"
2097,"突然好想看看这位顺嫔的厉害"
2097,"在强大也没有我强大我才是赢家"
2097,"有个疑问还珠里面令妃是尔康的姑姑那令妃在这里？"
2097,"高贵妃多可爱"
2097,"嘴巴好好涂行吗"
2097,"本宫最美最萌"
2098,"大猪蹄子就是大猪蹄子"
2098,"本宫才是世界上最可爱的"
2098,"高宁馨太太太善良了太可爱了"
2098,"我怎么这么晚才能出来"
2098,"令妃的口红强迫症表示不舒服"
2098,"没错我就是香妃"
2099,"高手之间的对话就是不用拐弯抹脚"
2099,"本宫才是最单纯最可爱的"
2099,"皇上太厉害后宫全是阿哥都不生女儿"
2099,"宫本的口红怎么看怎么不顺眼，化妆师你给本宫出来"
2099,"台词错了吧！常贵人？是顺嫔好吧"
2099,"大猪蹄子就是大猪蹄子"
2100,"顺嫔进宫前就绿了皇上。请叫皇上绿皇"
2100,"可真是让人头大呢"
2100,"小高多单纯啊"
2100,"你不是个好王后"
2100,"真实的令妃长得实在是。。。"
2100,"都没有我美"
2101,"没有晚晚美吧"
2101,"再厉害也比不过令妃"
2101,"最起码一出对话里一个人两个封号不合理吧"
2101,"我还是在我不是药神里比较美"
2101,"美怎么可能就仅仅指一张脸🙄"
2101,"我和尔晴孰美乎？"
2102,"感觉说话速度快了"
2102,"我现在觉得我好善良"
2102,"张嘉倪是真的很美啊"
2102,"口红能不能涂好"
2102,"今天口红没涂好啊"
2102,"谁说顺嫔最完美了"
2103,"没出现顺嫔这两个字啊人家只说了叫沉璧"
2103,"本宫可是好可爱"
2103,"皇后你这衣服是要驾鹤归去吗"
2103,"为何我那么优秀区区就只是一届嫔妃"
2103,"茶叶都过滤掉了好吧。。。"
2103,"这有什么不明白？后宫中怎可有两位太后？"
2104,"皇上是大写的大猪蹄子唉"
2104,"听说刚刚有人夸我美"
2104,"答应了，但是令妃是自己厉害"
2104,"本宫的紫菱，当然美了"
2104,"我以为就我一个人想吐槽璎珞口红"
2104,"我就是那么厉害"
2105,"高手碰撞无需掩饰看得带劲"
2105,"大猪蹄子你逼我放大招"
2105,"璎珞心里不舒服了"
2105,"当当要上场啦"
2105,"璎珞说的常贵人，皇后说的顺嫔，咋回事儿"
2105,"我就是那么厉害"
2106,"我不会说活了两集就领盒饭了"
2106,"令妃你让我多活两集吧"
2106,"这一波侧面描写厉害"
2106,"我到底有多美"
2106,"能有我富察皇后美吗？"
2106,"璎珞心里不舒服了"
2107,"口红是认真的吗"
2107,"没错就是我略略略"
2107,"高贵妃还叫美"
2107,"忘记本宫了是么？"
2107,"璎珞这演员的演技在皇后面前被比下去了！完全没气场"
2107,"令妃你让我多活两集吧"
2108,"我家高可爱最美"
2108,"朕果然是大猪蹄子"
2108,"大猪蹄子你忘了我容音吗"
2108,"劝我自己善良"
2108,"口红是认真的吗"
2108,"没错就是我略略略"
2109,"张嘉倪特别适合古装那种美"
2109,"听你们这么聊我都觉得自己好厉害了呢"
2109,"哎呦升级和本宫差不多快啊"
2109,"本宫的美，害得自己都不敢照镜子"
2109,"总觉得这个口红没涂好呢"
2109,"因为我很完美"
2110,"常贵人顺嫔容妃咋那么多名字"
2110,"这个顺嫔不和当年的璎珞一样吗升级速度超快"
2110,"历史上唇妆就是这样的，演纯妃的人说的"
2110,"哈哈我厉害"
2110,"张嘉倪真的美"
2110,"张嘉倪特别适合古装那种美"
2111,"张嘉倪演戏真的很一般最后她被揭穿的时候演技一言难尽"
2111,"顺嫔再厉害不还是败在了本宫的手里？"
2111,"调子已经这样高了，看他怎么写"
2111,"扎心了，这升位和我一样快"
2111,"升级速度比你还快"
