time,content
1427,"贵妃就是靠山大，其实就是个棒槌，害人也是被利用"
1427,"段位好高啊"
1428,"越是外表柔弱的让人就会放松警惕其实是个狠角色"
1428,"我来帮你把盒饭热好了"
1428,"本以为高贵妃是王者，结果却是高级装备的青铜"
1428,"黑化之后本宫心情舒畅多了"
1428,"怕的就是铂金钻石以为自己玩的厉害高贵妃自以为是"
1428,"最棒我最强我"
1429,"不知道是闲妃厉害还是纯妃厉害哈？"
1429,"我能活到三十多集挺不错了"
1429,"跟本宫作对的人都好厉害啊"
1429,"本宫盒饭吃饱了该我上场了吧"
1429,"高贵妃急火攻心，舌头大了？"
1429,"我来帮你把盒饭热好了"
1430,"温容善良的女人要是狠起来比谁都厉害"
1430,"高可爱领完盒饭估计妹妹就要登场了"
1430,"加了金汁不是还有那么厚的衣服吗，都渗进去了？"
1430,"看过一遍居然还在看哎这一段太精彩"
1430,"录音笔是个好东西，可惜你们没有"
1430,"一般一般世界第三"
1431,"不想看娴妃，还我高可爱"
1431,"高实在是高啊比我还高"
1431,"盒饭热好了，快来领吧"
1431,"本宫那么可爱那么厉害居然要我去领盒饭。。。"
1431,"祝高贵妃杀青成功，领盒饭喽"
1431,"一般一般世界第三"
1432,"天啊，阿佘凑下来的时候好乖啊"
1432,"本宫的盒饭热好了没"
1432,"导演！高贵妃的盒饭热好了现在端上来吗？"
1432,"我老高活了三十多集还不是赚了"
1432,"高贵妃真的是后宫最真实的人，不像纯妃娴妃"
1432,"越单纯的人，黑化后就越厉害"
1433,"这部剧演技派真多，看着好给力"
1433,"盒饭热好了吗"
1433,"锦绣厉害啊，告密间接害了高贵妃"
1433,"人家看的是后位当然厉害了"
1433,"这样子的落魄的发型觉得高贵妃超美的呢。真话"
1433,"请叫我宁馨儿好吗？"
1434,"厉害是厉害还不是输给了令妃最后"
1434,"高手都低调！"
1434,"这名字一个个的真好听就是记不住哈哈哈哈"
1434,"是傅园慧给哀家配的音吗"
1434,"娴妃演的好"
1434,"这个故事告诉我们：平时默默无闻与世无争的人你不能惹"
1435,"高贵妃成功过好么，她把娴妃一家都害死了"
1435,"几天没上分了，他们咋这么快呐"
1435,"不想让高可爱下线"
1435,"不容易啊，活到32集了"
1435,"最可爱的高高要领盒饭了"
1435,"娴妃演的好"
1436,"问娴妃没事的是傻子吧她就烫了一点点又没有高贵妃的多"
1436,"只有我跟吉娃娃活到最后一集你说厉害不厉害"
1436,"佘诗曼让人又爱又恨演技太好了"
1436,"哼一开始我就是大坏蛋，但是从来没有成功过"
1436,"玲珑耳朵咋这么好"
1436,"所以说我多厉害"
1437,"最后娴妃身边要不是有个袁春旺和璎珞和平相处也挺好"
1437,"我可比姚金玲厉害多了"
1437,"高贵妃这样看着还挺美的可能是变弱势了"
1437,"这段看的本宫很是过瘾啊"
1437,"高贵妃说话的语气真是无语了看到现在说话都是那个鸟性"
1437,"会咬人的狗不叫，高贵妃难道你不知道吗。哼哼"
1438,"本宫还想多活两集，叶太医不要走"
1438,"不错不错演技都很好"
1438,"娴妃心机好深啊"
1438,"打不过我吧没有办法我就是这么强大，啦啦啦啦啦啦"
1438,"高贵妃好像灰太狼，三十多级了，一只羊都没抓住"
1438,"同学们本宫完了你们开心吗"
1439,"演了这么多集不错了该领盒饭了"
1439,"把盒饭给本宫热上，马上去领"
1439,"盒饭热好了吗？本宫要吃"
1439,"盒饭好了来领吧"
1439,"娴妃我劝你善良高贵妃就是你未来的下场"
1439,"本宫还想多活两集，叶太医不要走"
1440,"不得不说，高贵妃真的是整剧最单纯的"
1440,"快！热热本宫的盒饭！本宫要来吃啦！"
1440,"刷佘诗曼演技好的你们够了啊！"
1440,"没有办法我就是这么强大"
1440,"这部剧能请来佘诗曼，真的不错"
1440,"啦啦啦啦啦，打不过我吧我就是这么强大"
1441,"知道了，是锦绣或者袁春望告的密"
1441,"白白了奥，要去领盒饭了"
1441,"佘诗曼的演技看得好过瘾"
1441,"毕竟本宫是高段位玩家，充了钱的"
1441,"会咬人的旺看来真的是不会叫"
1441,"快，快来人啊，快把本宫的盒饭热热"
1442,"看不到刘三好的影子才是厉害现在只要看孙俪就是嬛嬛"
1442,"本宫演的棒不棒"
1442,"袁春望确定是她的人了密函还有粪水"
1442,"本宫此时可真美"
1442,"哎，高可爱要领盒饭了"
1442,"本宫为本宫骄傲"
1443,"花是零落成泥长开不败"
1443,"好厉害啊，打了人还不能哭那种"
1443,"高贵妃：盒饭热好了请慢用"
1443,"香港演员佘诗曼太让人惊艳了。"
1443,"现在才知道比你厉害的多了去了吧"
1443,"果然整饿个后宫就我最单纯了"
1444,"高贵妃的盒饭🍱一定要比任何人好！快去热"
1444,"这个姿势，本宫也是很美的"
1444,"贵妃天然去雕饰，清水出芙蓉啊"
1444,"知道本宫的厉害了吧"
1444,"其实高贵妃是妃子里最不会耍心机的人就是喜欢害人"
1444,"高宁馨。。超前时尚的名字"
1445,"我们家高可爱就这样领盒饭啦"
1445,"芝兰本宫的盒饭热好了没？"
1445,"善良的人如果变坏，你连跪下的机会都没有"
1445,"哈哈哈，报仇了好开心"
1445,"真的好精彩名场面啊"
1445,"本宫心情大好"
1446,"所以说我劝你善良不是不报时候未到"
1446,"阿曼最后一句台词都说中文辛苦了"
1446,"来人，快把本宫的盒饭热好"
1446,"老娘这叫一击致命，你那些小打小闹太稚嫩了"
1446,"佘诗曼黑化了好过瘾"
1446,"本宫心情大好"
1447,"高贵妃换张馨予来演，估计看头过瘾"
1447,"你们居然让本宫吃盒饭！大胆！"
1447,"高贵非能活这么久"
1447,"本宫才是厉害的"
1447,"一天就叫叫叫声音最大就是她了"
1447,"你们每个人都比我聪明呜呜呜呜"
1448,"看来害人知心不可有啊，不是不报时候未到！"
1448,"本宫的饭盒还没热好"
1448,"后宫本就高手对决，输了就是死呢"
1448,"就欺负我单纯可爱"
1448,"高贵妃这样显得好年轻啊"
1448,"嘻嘻嘻基本操作"
1449,"高贵妃害人没一次成功还树了那么多敌"
1449,"姓高的叫你欺负本宝宝，哼"
1449,"娴妃黑化多少集了说快的没看剧吧"
1449,"佘诗曼真的演技很好"
1449,"高贵妃那不叫单纯，叫蠢好吧？别什么人都用单纯来形容"
1449,"心情好的一批"
1450,"死的好，真是不知为啥叫高可爱"
1450,"当然要开心了，之前的耻辱如今还回去为何不高兴"
1450,"这剧除了富察皇后都是坏人，不过是看谁最聪明罢了"
1450,"一般一般世界第三"
1450,"黑化的好黑化的妙"
1450,"佘诗曼真的演技很好"
1451,"看的出的厉害真不算厉害，娴妃这种才真厉害"
1451,"本宫一次也没有成功过"
1451,"据说后面的剧情，尔晴绿了富恒怀的孩子不是富恒的。"
1451,"本宫心情大好"
1451,"娴妃的盒饭也快好了"
1451,"可爱如我高贵妃"
1452,"佘诗曼演技好，宫心计她就反派，是让人恨不起来的反派"
1452,"想吃盒饭盒饭好吃"
1452,"这一段看得过瘾，这演技绝对的"
1452,"本宫对她不错了，好歹没在她背上踩上几脚"
1452,"真心演的好，本宫黑化不需要装"
1452,"哈哈，本宝宝好开心啦"
1453,"好了皇后也病着整个后宫她最大了厉害呀厉害"
1453,"这么聪明的人之前竟然能隐忍这么久，本宫有些怕"
1453,"佘诗曼的演技是真厉害这一段看的很过瘾"
1453,"会是以后最强大的对手吧￼"
1453,"盒饭热好了"
1453,"佘诗曼演技好，宫心计她就反派，是让人恨不起来的反派"
1454,"抬轿子的人好辛苦啊"
1454,"这么多人黑化之后感觉还是我最可爱了"
1454,"说佘诗曼不适合古装的看一下金枝欲孽好吧"
1454,"本宫段位可比你高多了"
1454,"高贵妃的盒饭热好了吗？赶紧送过去😂"
1454,"段位竟然比我高了那么多，失策失策"
1455,"有录音机多好"
1455,"本宫坐这么高，会不会掉下来？"
1455,"大可爱要下线啦"
1455,"坤哥畅畅你俩看到这没呀"
1455,"佘诗曼的普听话是怎么样的呢"
1455,"本宫段位可比你高多了"
1456,"这段看得爽娴皇后威武霸气哈哈"
1456,"做人呢最重要的就是开心呐"
1456,"零落成泥捻作尘，只有香如故"
1456,"抬轿子的都不扶着，这功夫练的不错"
1456,"这后宫中除了皇后最没心机的就是可爱的本宫啦哈哈"
1456,"这粪水加的好，本宫等候多时了。"
1457,"喜欢娴妃黑化，演技太好了一点都不像刘三好"
1457,"本宫的盒饭热好了吗？"
1457,"阵仗太大了，皇后一倒你最厉害了"
1457,"青铜蹦哒了这么久"
1457,"难道就我一个人觉得佘诗曼长得奇怪吗"
1457,"我就是厉害"
1458,"闲妃是要做皇后的人"
1458,"皇后和高贵妃领盒饭后，就都是高段位了"
1458,"这叫还没成功过那皇后的孩子是风吹走了吗"
1458,"抱抱单纯的高贵妃"
1458,"请给本宫一支录音笔好吗"
1458,"本宫心情不错"
1459,"觉得高贵妃可爱的那个品味独特，眼光独到啊！佩服佩服"
1459,"闲妃一点都不闲。纯妃一点都不纯，高贵妃一点都不高"
1459,"高贵妃怎么活这么久的一点智谋也没有全都是别人出注意"
1459,"演技不是一般的好"
1459,"得意的表情能不能收一收，不怕被人看到啊"
1459,"还是本宫最善良"
1460,"周建你个大猪蹄子，你看你家娴妃好坏"
1460,"国色天香艳压群芳是认真的吗"
1460,"看了花絮我觉得贵妃很可爱"
1460,"录音笔和监控真是好东西啊"
1460,"娴妃也没个好下场的"
1460,"还是本宫最善良"
1461,"贤妃打野发育成熟来抓人了"
1461,"把高贵妃羞辱一顿，好开心啊，好开心。"
1461,"密函是玲珑给的啊"
1461,"本宫甚是高兴啊，哈哈哈哈"
1461,"这嘴角的这个笑演的太好了"
1461,"本宫咋这么善良"
1462,"我就算饿死也不会吃你们一点盒饭啊！盒饭真香真好吃"
1462,"呵呵哈哈哈活该，谁叫你把我踢下去"
1462,"贵妃啊别人都是集集升段位你倒好是集集掉段位"
1462,"娴妃在宫里走路的方式都变了。。。"
1462,"皇后任性一回然后躺了，贵妃也要任性了"
1462,"我不愧是一姐"
1463,"往后看就知道为什么说高贵妃可爱了"
1463,"芝兰好低调啊"
1463,"用肩膀抬轿子厉害了群演们"
1463,"不听劝就是这个下场"
1463,"能做到妃都不一般"
1463,"皇后任性一回然后躺了，贵妃也要任性了"
1464,"平板支撑演的好"
1464,"本宫可是未来太厚，你们这些小喽啰，要注意了"
1464,"长得像女版郑嘉颖"
1464,"贵妃死了我可以出来没有"
1464,"其实高贵妃挺单纯的"
1464,"我和贵妃谁先吃盒饭"
1465,"每次这么多人捧一堆东西是干嘛的"
1465,"本宫开心到一摇一摆的呢"
1465,"做人最紧要开心啊嘛"
1465,"整部剧就我最单纯"
1465,"高贵妃戏腔范，演的很好啊"
1465,"高贵妃，可以去领盒饭了"
1466,"演坏人最过瘾，演好人最考验演技"
1466,"现在头脑简单和单纯一个意思了？？"
1466,"盒饭热好了再加做一份"
1466,"好想看高贵妃变好然后逆袭"
1466,"宫女不是什么好东西"
1466,"唯一的倔强青铜已下线"
1467,"做人最重要的呢就是要开心"
1467,"大猪蹄子快来救我，我感觉下一个就是我了"
1467,"曼曼很棒，拍戏最后几句话都用中文说，所以拍的很快。"
1467,"自己太厉害了👍优秀"
1467,"不希望贵妃娘娘这么快领盒饭，想在看贵妃娘娘被践踏！"
1467,"宫女不是什么好东西"
1468,"二倍速打开新世界大门"
1468,"你再得意也是家破人亡"
1468,"娴妃黑化都不带丫鬟，珍儿还是傻白甜啥也不知道的状态"
1468,"阿佘太厉害了"
1468,"本宫之前不打排位你们还以为本宫青铜"
1468,"大猪蹄子。"
1469,"佘的演技真是很细腻"
1469,"高贵妃下场了"
1469,"本来以为是青铜，原来是个王者"
1469,"高贵妃能洗白吗"
1469,"自己也烫到了，不会留疤吗"
1469,"高贵妃振作啊"
1470,"敌人的敌人就是朋友看的好开心"
1470,"阿佘演技好"
1470,"铁水那么高温度什么细菌病毒都活不了了吧。。"
1470,"本宫还是去演药神吧"
1470,"佘诗曼的演技真的是太好了"
1470,"除掉两个了"
1471,"可是娴妃你为啥要借高妃之手害皇后！皇后是多么好的人"
1471,"我劝我自己善良"
1471,"说佘诗曼不美的，你是港姐冠军？"
1471,"我以为我已经去领盒饭了"
1471,"高手都是在低调"
1471,"我好害怕，太可怕了"
1472,"好了，这个死了，剩下的都是真正厉害的角色"
1472,"他说得好有道理，我竟无言以对"
1472,"佘诗曼演技炸裂啊配音也好厉害"
1472,"我怎么还不醒"
1472,"后背受伤又不是腿受伤站都站不起来吗"
1472,"就不能多更新点"
1473,"笑那么开心真的好吗"
1473,"嘤嘤嘤～我不想领盒饭啊"
1473,"高高才是最纯的"
1473,"那就这样吧"
1473,"想知道什么细菌可以在这种温度下还没杀死"
1473,"我马上就要走了，拜拜ﾉBye~"
1474,"为何高可爱在这里一点也不厉害"
1474,"冤有头债有主，本宝宝是来复仇的"
1474,"还是很喜欢闲妃，更喜欢黑化后的"
1474,"我就是怕容妃来找事，先当上皇后，还怕以后管不了她？"
1474,"莫名觉得高贵妃好美"
1474,"你们是不是忘了一个叫富察容音的人😂"
1475,"高贵妃也算是死的明白"
1475,"我就是厉害"
1475,"气的本宫指甲都红了"
1475,"高贵妃走了坏角色谁扮演"
1475,"古代要是有录音笔就好了"
1475,"莫名觉得高贵妃好美"
1476,"贵妃这智商怎么活了这么多集啊，他真是赚大发了！"
1476,"烫的那么厉害还能穿衣服"
1476,"这个时候皇上刚刚听到，剧情就简单多了"
1476,"吓到伦家了"
1476,"坏事做多了必有报应"
1476,"啊！这个坏女人"
1477,"娘娘这个时候好美啊"
1477,"娘娘平板支撑不是这样做的"
1477,"高贵妃说话带气声，是很符合她喜欢唱戏的背景设置的"
1477,"本宫不想领盒饭"
1477,"高贵废我劝你去领盒饭"
1477,"高贵妃这个样子挺美啊"
1478,"一入宫门深似海，从此萧郎是路人。该回家了高贵妃"
1478,"娘娘好壮实的身材"
1478,"演得太好了太好了"
1478,"本宫要死了还是一个大美女啊"
1478,"满屏的吃盒饭，大猪蹄子"
1478,"娘娘这个时候好美啊"
1479,"贤妃段数高太多了"
1479,"你得势之时有点太蹬鼻子上脸了，活该这个下场啊"
1479,"高贵妃美不美"
1479,"谁来给我出出主意呗"
1479,"不是很懂一个劲佘诗曼夸演技的谭卓电影咖也没说什么呀"
1479,"本宫开始打排位"
1480,"复仇也需要头脑，一般人复仇直接拿把刀就上去了"
1480,"这样细看，高贵妃还挺美的"
1480,"编剧也太没文化了，铁水那么高温度怎么还有细菌"
1480,"奴才不是站在门口"
1480,"这样看贵妃还美的"
1480,"你得势之时有点太蹬鼻子上脸了，活该这个下场啊"
1481,"宫心计佘诗曼是好的好吗说反派的看过吗"
1481,"说高贵妃单纯，也是无语了，哪单纯了，害死那么多人"
1481,"后宫的女人，能说有好下场吗"
1481,"高贵妃这个眼神看着好心疼"
1481,"就这个时候觉得高贵妃美"
1481,"这样看贵妃还美的"
1482,"高可爱这样看挺美的"
1482,"本宫还想多演几集"
1482,"突然感觉贵妃娘娘美了"
1482,"感觉本宫现在有点美"
1482,"居然觉得贵妃这妆容有点美"
1482,"喜欢高贵妃的第一天，高贵妃卒"
1483,"高贵飞不穿绿衣服还是可以的"
1483,"你们的嘴唇都没有涂唇膏"
1483,"高宁馨这智商是怎么活了这么多集的"
1483,"演技炸裂了"
1483,"高可爱这样看挺美的"
1483,"突然感觉贵妃娘娘美了"
1484,"高贵妃是戏里唯一适合这种古装发型的演员，这里好美"
1484,"这里是高桂芬的颜值巅峰！"
1484,"黑化后人都多了仗势都大了"
1484,"给高贵妃的盒饭一定要加鸡腿"
1484,"余诗曼演技好，黑化和以前完全不一样的感觉"
1484,"都会学我说狗奴才了！"
1485,"妆淡一点看的舒服多了"
1485,"讲道理，你们说本宫现在这模样美不美就完了！！"
1485,"没口红顺眼多了"
1485,"这样的贵妃好美，令人心疼"
1485,"贵妃娘娘这样比之前那样美多了"
1485,"气的本宫指甲都红了"
1486,"耳朵边没安那两个麻花辫真是美丽多了"
1486,"这样子体面看的"
1486,"也怪她自己对生命太漠视了身边一个靠谱的人都没有"
1486,"劝你善良你不听"
1486,"这样的贵妃好美，令人心疼"
1486,"贵妃娘娘这样比之前那样美多了"
1487,"高贵妃演技还不错啊为了演好爱好唱戏的贵妃还特地去学"
1487,"本宫现在看起来挺美"
1487,"高贵妃还是单纯的，害人的都是手下出的主意下的黑手"
1487,"诶，我怎么越看越像张羲予"
1487,"单纯？杀了四个人可真是单纯"
1487,"本宫要领盒饭了"
1488,"卸了烟熏妆美多了"
1488,"本宫换眉形了可爱吧"
1488,"你早就该死了高贵妃，盒饭都快馊了，快点去领吧"
1488,"本宫这个画面好美啊"
1488,"我很好奇她加了粪水自己伤口不怕感染吗"
1488,"这个适合你，高贵妃现在很美"
1489,"导演你和本宫多大的仇啊？一次也没有赢过就让我领盒饭"
1489,"此时的高贵妃甚是美丽如牡丹花"
1489,"所以劝你要善良阿你看落难了人人想踩一脚"
1489,"我这样好美啊!淡妆美"
1489,"高贵妃好的时候妆容太过老成。"
1489,"卸了烟熏妆美多了"
1490,"现在看高贵妃长得还不错"
1490,"如今这副妆容顺眼多了"
1490,"自己做的太绝树敌太多也没有时刻防备"
1490,"本宫领盒饭去咯开心"
1490,"好美太美真美"
1490,"我这样好美啊!淡妆美"
1491,"谁说余诗曼不火在港剧圈子里都是大前辈的级别了好吗"
1491,"这个时候的贵妃最美哈哈快领盒饭快快"
1491,"不是因为你之前有厉害！因为你用之前的厉害欺负别人。"
1491,"一下子从王者掉到了青铜，都是你自找的，活了个该"
1491,"高可爱不化妆还是很美的"
1491,"全剧我最善良"
1492,"仇恨值被贤妃拉走了，所以你们突然觉得高妃美了"
1492,"本宫再无大猪蹄子了"
1492,"高贵妃的盒饭热好了"
1492,"我这碗盒饭，恐怕要早一点领。"
1492,"这一刻高贵妃好年轻"
1492,"全剧我最善良"
1493,"拜拜吧高贵妃和饭给你热好了"
1493,"本宫是不是不带耳罩美多了"
1493,"贵妃眼睛好大啊"
1493,"这样看，感觉本宫好美"
1493,"要怪只能怪你，自作孽不可活"
1493,"第一次发现高贵妃这么美啊，哈哈哈"
1494,"可以仗着皇上的怜悯活着呀皇上不想让你死"
1494,"这样的高贵妇美多了"
1494,"这个宫女也不是个好东西，等人走了才进来"
1494,"我感觉我精神很好，怎么会死"
1494,"换了衣服，看了舒服多了"
1494,"要怪只能怪你，自作孽不可活"
1495,"高高好美啊不想让她领盒饭"
1495,"高贵妃还是很美的，只是平常妆太严肃了"
1495,"剧情衔接的太好了好剧"
1495,"还没揭出高贵妃是陷害皇后的凶手呢她不能就这样领盒饭"
1495,"我佘姐进四强了，高大妈惨遭淘汰"
1495,"本宫就说了你还是要善良"
1496,"高贵妃只要不画大烟熏就会变美"
1496,"本宫眼角开的厉害瞪得有些疼啊"
1496,"高贵妃是得罪化妆师了么？还是淡妆美"
1496,"我嘴巴好大"
1496,"这高贵妃是江映蓉演的吗？风尘味很浓郁"
1496,"已经很厉害了！从第一集活到30多集"
1497,"不想听高贵妃说话，听着好不舒服"
1497,"心疼一秒不能在多"
1497,"眼角切的好深"
1497,"本宫就能穿黄色睡衣怎么招"
1497,"也不看看自己做的事有多绝"
1497,"原来本宫这么美"
1498,"眼中带泪高可爱好美啊"
1498,"自作虐不可活"
1498,"不画深眼影还是很美的"
1498,"高贵妃这角度还挺美的"
1498,"剧情变化的好快"
1498,"也不看看自己做的事有多绝"
1499,"善良是个相对的概念，俺觉得高贵妃最性情没有失去自我"
1499,"高贵妃演技不错"
1499,"这个时候才觉得高贵妃长得还不错"
1499,"自作孽不可活"
1499,"是你自己得罪的人太多好吗"
1499,"看了药神就懂高贵妃演技了"
1500,"贵妇这个发型比以前美多了"
1500,"给本宫煮点粥就行了，多了吃不下"
1500,"不知道为什么觉得余诗曼有种温暖让人想依靠"
1500,"要领盒饭了，好开心"
1500,"法令纹好深"
1500,"宝宝这么好美啊皇上快来"
1501,"大姐，你要是平时对别人客气点，哪会落得今天这步田地"
1501,"眼含热泪，演技很棒"
1501,"感觉是高贵妃看的最顺眼的时候"
1501,"演技都超好"
1501,"贵妃人美，演技又好！棒棒哒！"
1501,"自作孽不可活"
1502,"觉得看的好过瘾，一点都不恨贤妃，自作自受"
1502,"一首凉凉送给你，拿好你的盒饭吃去吧"
1502,"坏事做多了，没好下场"
1502,"本宫演技真是棒棒哒"
1502,"该，谁让你做了那么多的坏事"
1502,"大姐，你要是平时对别人客气点，哪会落得今天这步田地"
1503,"这个角度高妃极美"
1503,"准备好了领饭盒了阿！"
1503,"高贵妃努力站起来脸还美不怕"
1503,"出来混的迟早是要还的"
1503,"高妃长的一副高级脸，适合做模特"
1503,"你都被那猪队友坑成这样了，还想她来啊"
1504,"高可爱要领盒饭了，不舍得，喜欢高贵妃"
1504,"皮肤真好我很羡慕"
1504,"高贵妃说话的时候一定要调2倍速，才是正常语速"
1504,"我去给你寄点药去，你坚持住，还要看你演下去呢！"
1504,"高可爱演技好"
1504,"这个角度高妃极美"
1505,"这个唇妆看着好干呀"
1505,"本宫到死也没好好说过话呜呜呜"
1505,"能活这么久不容易了，，，佩服佩服"
1505,"本宫做鬼也不会死心的"
1505,"这一刻高贵妃好年轻"
1505,"皮肤真好我很羡慕"
1506,"古时候的金汁原来是好东西啊！高贵妃用得可好了"
1506,"做人要善良，贵你活该。"
1506,"这时候都没力气说话了还用高八调起音，这演技真是无语"
1506,"还是皇后好"
1506,"这个样子的贵妃看着顺眼多了"
1506,"这个唇妆看着好干呀"
1507,"害皇后的淑贵人什么时候领盒饭"
1507,"都劝你善良了"
1507,"这盒饭热的太久了"
1507,"贵妃其实真的很美"
1507,"高贵妃不适合大浓妆"
1507,"这个样子的贵妃看着顺眼多了"
1508,"贵妃在药神跳钢管舞的时候也美翻啊"
1508,"现在这妆容很别致啊"
1508,"最单纯的高贵的要领盒饭了"
1508,"还是我最善良"
1508,"这个演员顔值够，就是年龄大"
1508,"本宫在练平板支撑"
1509,"厉害厉害演技超赞"
1509,"高贵妃演技确实不错"
1509,"你是坏事做多了"
1509,"妆容很重要"
1509,"也就芝兰对贵妃好了"
1509,"本宫怎么越来越美，唉"
1510,"你这人最多活两集，让你多活了"
1510,"好桑心！好桑心！"
1510,"高贵妃确实作恶太多，这样下场也不算冤枉"
1510,"本宫的盒饭准备好了没"
1510,"高贵妃该不会今天才懂得跟红顶白这个现实吧……"
1510,"我觉得我还可以再抢救一下"
1511,"养好病再起来斗呀高高"
1511,"哼本宫领盒饭的时候你们一个个才get到本宫的美法克"
1511,"高贵妃：本宫有点饿了，盒饭热好了吗"
1511,"本宫眼角开的大不大"
1511,"其实高贵妃真的没有心思，就是任性"
1511,"现在是看高贵妃最顺眼的时候"
1512,"贵妃娘娘挺美的…是不是得罪了化妆师呀"
1512,"本宫孩子的帐还没和你算"
1512,"还是晚晚最善良。"
1512,"活该谁让你害我姐姐"
1512,"是真的觉得演技好"
1512,"养好病再起来斗呀高高"
1513,"女人呵，成天追剧的比高贵妃美你怕是要上天"
1513,"芝兰额头的汗水演得好"
1513,"牙板太大，实在你适合咬唇妆，要领盒饭了"
1513,"下辈子一定要投个好胎"
1513,"这样子年轻多了"
1513,"是真的觉得演技好"
1514,"大夏天拍速度片针不容易👀哪芝兰额头上的汗一直流"
1514,"高可爱要挂了"
1514,"别人主动向你献策的时候你就不该信，还是因为你妒心太重了"
1514,"芝兰你把额头上的汗先给擦擦"
1514,"哇演戏的时候肯定很热吧芝兰都滴了好大一颗汉"
1514,"我最单纯了"
1515,"这部剧质量高，所有演员的演技都超好！！！！！"
1515,"本宫还没醒呢你们这帮大猪蹄子"
1515,"看不懂高桂芬人设的可以去演员微博，知乎看过了再来"
1515,"谁叫你做的好事太多了呢"
1515,"最单纯？搞笑呢。皇后才是最单纯"
1515,"热的都出汗了。真是为难你了"
1516,"貴妃是美，現在才發現，但是妝容不適合她"
1516,"本宝宝不开心了"
1516,"高贵妃到底是戴了美瞳还是本身瞳距大啊"
1516,"盒饭在门口走的时候记得带上"
1516,"坚持我给你寄点头孢来就好了"
1516,"我就说怎么不见舒贵人"
1517,"一想到再也不用看这大板牙就很开心"
1517,"贵妃小可爱真是后宫最单纯的反派了"
1517,"本宫饿了本宫的盒饭要加鸡腿[害羞]"
1517,"本宫的妆花了，来人给本宫补妆"
1517,"那可是滚烫的铁水，就算再厚的衣服那也是棉花，没有用"
1517,"坚持我给你寄点头孢来就好了"
1518,"这会儿的高贵妃才有正常的年龄，以前活脱脱老妖婆"
1518,"是我太单纯了"
1518,"被璎珞盯上的，没有一个有好下场的！"
1518,"高贵妃好美"
1518,"这大概是高馨儿颜值高峰了"
1518,"本以为是青铜原来是个王者"
