time,content
1445,"鸟心理健康的问题谁负责"
1445,"袁春旺我劝你善良"
1446,"袁厉害了，以后这只鸟还会说一些不该说的话。"
1446,"袁春望，本宫劝你善良。。。"
1446,"袁春望演技好尬，是投资人亲戚吗"
1446,"袁春望谁也不帮他就在帮他自己，要除掉所有人"
1446,"这么多人被一个太监耍的团团转"
1446,"鹦鹉做错了什么，要这样对鹦鹉"
1447,"袁春望是于娘娘腔的什么人啊？这么多戏"
1447,"鸟演的不错"
1447,"本宫的细纹又回来啦惊不惊喜"
1447,"我这个大傻子"
1447,"我觉得皇后越后面就越没有之前那么聪明了"
1447,"袁春旺的目的是啥"
1448,"那么聪明一个人被一个太监给玩了演的有点悬了😡"
1448,"你们是不是疯了，袁春望怎么可能善良了？他已泯灭良知"
1448,"一个太监说话语气这么爷们，剧组请不起配音吗"
1448,"本宫背的锅太重了，想吃盒饭"
1448,"越看越觉得不该叫延禧攻略，袁春旺成主角了"
1448,"袁春望是纯作"
1449,"袁春望是要跟所有人过不去，并不是要对璎珞好"
1449,"年纪大了，皇后，你该退休了"
1449,"继后聪明这么多集，最后还是输给袁春望"
1449,"皇后看来是真的疯了哈哈"
1449,"袁春望想让皇后完全抛弃对皇上的顾恋跟纯妃斗"
1449,"居然欺负王者段位的鹦鹉啊"
1450,"大猪蹄子生气还很帅的"
1450,"镜子照多了真的会领盒饭"
1450,"这个猿猴真实此剧最大的败笔"
1450,"本猪蹄子劝你善良"
1450,"一个太监怎么嫩么多戏"
1450,"年纪大了，皇后，你该退休了"
1451,"鹦鹉脑阔疼"
1451,"本宫演技真好"
1451,"你看看你的法令纹，比眼尾纹深"
1451,"鹦鹉都劝你善良"
1451,"这么聪明的皇后能发现不了么"
1451,"演技太棒了"
1452,"袁春旺想报复皇室因为他觉得自己是皇子"
1452,"本宫活着活着就疯了"
1452,"皱纹演得不错"
1452,"盒饭准备好了"
1452,"皇后你脸真神奇"
1452,"本宫就是喜欢照镜子"
1453,"皇后那么聪明，怎么让一个太监骗的团团转不是虚构的吧"
1453,"皇后一照镜子就开始魔怔，不照镜子就好了"
1453,"袁春旺的棋下的好大"
1453,"完了本宫精神不正常了"
1453,"心态真的好重要。"
1453,"袁春旺想报复皇室因为他觉得自己是皇子"
1454,"袁和珍是皇后的左膀右臂，结果两人一起骗她，皇后吩咐，都是他两出面做事，都默认他两说的话是皇后吩咐"
1454,"这部剧是演袁春望的还是演本宫的呀戏份这么多"
1454,"如果当初璎路不会来和袁春望在圆明园袁春望也不想报仇"
1454,"袁春望本宫劝你善良"
1454,"的确是她更年期看不清身边的人了"
1454,"袁春望也有主角光环的感觉，em……什么时候去领盒饭"
1455,"褶子得有多深那么远都能看到"
1455,"鱼尾纹演的好"
1455,"病的不轻啊快请太医吧"
1455,"本宫生气都这么可爱"
1455,"快来人给本宫滴一点莎普爱思"
1455,"这群人的智商都掉的厉害👍"
1456,"感觉袁春望是想让皇后误会是令妃想让他她们斗起来"
1456,"角色太多余，演技太浮夸，朕命你去领盒饭！！！！！"
1456,"袁春望能走了吗好心疼皇后"
1456,"怪谁，你不打云香，不让皇上碰见也不会出这事"
1456,"人最多亏心事就会有疑心病的"
1456,"皇后病得不轻啊哈哈哈"
1457,"是告诉我们每天保持好心情吗"
1457,"快宣太医，我觉得我还能活"
1457,"鹦鹉演的不错"
1457,"做太监都不安生"
1457,"麦吉利，素颜霜三部曲。用多了吧？"
1457,"本宫劝你善良"
1458,"皇后是不是被下药了，怎么掉级掉了这么厉害"
1458,"聪明呢。明明很聪明的娴妃啊"
1458,"年纪大了眼神倒还不错"
1458,"闲妃你疯了？"
1458,"老袁讲话太作了，根本不符合场景语气，很不舒服"
1458,"皇后心理出问题了"
1459,"叫你天天让别人照镜子，现在自己照了舒服了吧"
1459,"袁春望，本宫劝你赶紧作妖，领盒饭去吧~"
1459,"其实皇后还是很不错的，挺善良的，只是被身边人坑了"
1459,"本宫智商已经领盒饭了"
1459,"快下线了就智商也下降了"
1459,"皇后被袁春旺玩的团团转"
1460,"佘诗曼是香港视后啊，得了好几次奖，很多剧都很厉害"
1460,"这两个人都病的不轻啊"
1460,"这袁春望好深的心机"
1460,"褶子演的好"
1460,"真的不是被下药了吗这性情变得太快了吧"
1460,"本宫就是那么任性"
1461,"袁春望，盒饭已经热好了"
1461,"袁春望不是普通的太监，他是皇上的兄弟呀"
1461,"珍儿跟两个精神分裂在一起可还开心"
1461,"袁春旺是被潜了吧？戏那么多"
1461,"还是袁春旺最心机"
1461,"元春旺不是普通的太监。"
1462,"这是正常的更年期症状，充钱可以解决"
1462,"本宫就爱照镜子，不是自个照就是和别人一起照"
1462,"演员的最高境界似疯非疯"
1462,"执念太深，得癔症了吧害怕"
1462,"感觉贤妃被控制了，难得药有问题。"
1462,"妈呀眼睛真厉害👍，我都看不出来"
1463,"古时候没有指纹识别，杀个人真容易"
1463,"最厉害的还是富察皇后。魏璎珞是她的"
1463,"珍儿也不是好东西，这是背叛啊"
1463,"后面几集纯是在凑数"
1463,"这是正常的更年期症状，充钱可以解决"
1463,"演员的最高境界似疯非疯"
1464,"皇后是不是被下药了，神志不清了"
1464,"看看咯来咯来咯咯女咯哦偷了"
1464,"皇后变了变的不淡定了"
1464,"皇后怕是得了失心疯"
1464,"皇后那么聪明，居然被袁春望暗算了"
1464,"我知道了，袁春望就是来祸害本宫的！"
1465,"好快啊你的皱纹在主迷藏"
1465,"佘诗曼演技真的很好"
1465,"这是更年期啊！吃点静心口服液"
1465,"镜子照多了哈哈哈哈"
1465,"因为皇后快，快领盒饭了吧"
1465,"皇后是不是被下药了，神志不清了"
1466,"多敷面膜吧娘娘"
1466,"珍儿也不是个东西，为了一个太监害自己多年的主子"
1466,"皱纹演的好"
1466,"看来本宫着实病得不轻啊"
1466,"皇后我劝你正常"
1466,"这是更年期啊！吃点静心口服液"
1467,"珍儿自从跟了袁春旺明显底气不足"
1467,"真是皇后不急，太监急"
1467,"皇后的智商真是下滑的厉害啊"
1467,"人一老智商下降的厉害"
1467,"皇宫怨气太重了"
1467,"本宫居然是被两个奴才玩弄于股掌之间？！"
1468,"皇后只是想好好做个新发型呀"
1468,"四十多岁这样已经很美啦"
1468,"操心太多，精神分裂了"
1468,"我容音小甜甜最可爱"
1468,"褶子演的不错"
1468,"皇后的智商真是下滑的厉害啊"
1469,"娴妃这么聪明的人竟被两个狗奴才耍得团团转"
1469,"哇偶好神奇，皇后会变魔术"
1469,"袁春望怎么可以活这么久"
1469,"本宫岁数大了智商也下降了"
1469,"要就变坏这种低等的剧皇后能看不出来"
1469,"四十多岁这样已经很美啦"
1470,"我不恨袁春望是因为之前看过他演的一部电影，一人分饰三角，神一般的演技啊"
1470,"皇后算计别人这么厉害，怎么还被个奴才算计了"
1470,"能坐后位的人被区区一个太监设计这编剧是多推崇太监啊"
1470,"快！快把本宫的面膜端上来！"
1470,"这剧情皇后前后性情大变的不合理不会编了吧"
1470,"还是本宫当皇后好！"
1471,"袁春望盒饭热了又热，还不领盒饭"
1471,"本宫从王者掉到青铜全是老袁猪队友，坑了我"
1471,"她的镜子好先进"
1471,"皇后盒饭快到了🍱快来签收啊"
1471,"袁春望是坑主啊。好一个螳螂捕蝉黄雀在后啊！"
1471,"来人，给我拖出去斩了"
1472,"自作孽不可活，竟伤害无辜"
1472,"演出了精神病患者的感觉，精神敏感"
1472,"戏来的真快，一下子眼睛就红红的了"
1472,"皱纹演得好"
1472,"被袁春旺下药了，长期服用的，精神会出现问题"
1472,"本宫得了更年期都让开"
1473,"她以前挺淡定的啊，以前皇上也不喜欢她也没见她这样儿"
1473,"袁春旺！其实是挑拨皇上，陷害后宫的女人，甚至是皇子"
1473,"智商为负自己照镜子该是要下线了……顶起"
1473,"皇后被袁春望下💊了导致神志不清……"
1473,"佘诗曼这几集演的真心不错"
1473,"皇后唯一错的就是留着袁春望"
1474,"安逸日子过久了"
1474,"佘诗曼演技太好了"
1474,"快，本宫的麦吉丽三部曲拿来"
1474,"我饿疯了，快上盒饭"
1474,"袁春望他是来报仇的吗感觉皇后娘娘杀了他全身一样😄"
1474,"皇后唯一错的就是留着袁春望"
1475,"压力好大哦，看着皇后，演的真不错"
1475,"你个大猪蹄子"
1475,"袁春旺带资进组的吧，活了那么久"
1475,"我怕是疯了"
1475,"皇后这样珍儿也有很大的责任"
1475,"佘诗曼演技太好了"
1476,"找一个帅一点的人来演多好"
1476,"其实四十多岁的女人这样很年轻了"
1476,"袁春望报复心重，因为皇后没救他，现在又设计害皇后"
1476,"本宫就是喜欢照镜子"
1476,"眼角纹演得好"
1476,"袁春旺你是去当卧底吗"
1477,"演技不是一般的好"
1477,"坏事做多了的后果"
1477,"阿佘演的真的很好"
1477,"本宫智商哪去了"
1477,"奴才戏太多了"
1477,"袁春旺才是王者"
1478,"皇后娘娘是明显的更年期症状啊"
1478,"我美我美我最美"
1478,"娘娘，快求皇上帮你弹弹弹弹走鱼尾纹！"
1478,"真是风水轮流转，现在本宫也要被人坑了"
1478,"演技不是一般的好"
1478,"坏事做多了的后果"
1479,"一群高段位被一个太监耍得团团转"
1479,"本宫演技就是好，哈哈哈哈"
1479,"一生气又长皱纹了"
1479,"掉段了掉段了，玩不动了玩不动了"
1479,"珍儿到底是对谁好"
1479,"快要赶上本宫背的锅了"
1480,"袁春望真的是最大的败笔"
1480,"本宫变善良后就都来欺负本宫"
1480,"袁春旺戏太多败笔"
1480,"佘诗曼把更年期妇女演活了😂"
1480,"袁春望是想让大清无后他要对付的是皇上"
1480,"阿佘演技太棒了"
1481,"皇后娘娘来我家做皮肤管理吧"
1481,"本宫眼睛就是这么好，比戴了放大镜还要好呢😂好开森"
1481,"后宫年轻的女人太多，皇后羡慕他们也会担心自己老去"
1481,"坏事做太多"
1481,"一帮人被一个太监刷的团团转"
1481,"本宫怕不是疯了吧"
1482,"袁春旺好厉害，看惯了女人斗争，来个阉人也不错"
1482,"天天就知道脸啊脸,也不想想怎么背的锅,活该下线啊"
1482,"袁春望这种人会帮别人？？？想多了吧一群大蠢驴"
1482,"袁春望给皇后下药了吧"
1482,"脸好大，脸好大"
1482,"本宫已经疯了"
1483,"好演技啊不需要大浓重的黑化棒棒哒"
1483,"朕一看袁春望就不是什么好东西"
1483,"在宫里待得时间长了都心理有问题了吗"
1483,"这个电视叫，论身边有个尽忠奴才的重要性"
1483,"袁春望给皇后下药了吧"
1483,"本宫已经疯了"
1484,"佘诗曼演技太好了，演反派也让人恨不起来"
1484,"来点静心口服液吧"
1484,"导演你是不是收了袁春旺礼给他那么多戏"
1484,"袁春望，你要是再不来吃你的盒饭，本宫就吃完了"
1484,"那只鹦鹉活了10多年"
1484,"在宫里待得时间长了都心理有问题了吗"
1485,"佘诗曼演技真的不是一般的好教科书级别的演技"
1485,"喜怒无常啊好怕怕"
1485,"阿佘演技太棒了喜欢看她和聂远对的对手戏"
1485,"看你们斗那么开心"
1485,"皇后需要的只是太太静心口服液"
1485,"佘诗曼演技的确好"
1486,"春哥好手段啊，皇后楞是给你拖下水。"
1486,"你想长生不老吗，怎么不能正确看待衰老啊"
1486,"袁春望是想教唆皇后杀皇上吧，他不是以为自己是皇子吗"
1486,"你们想我高小可爱了吗？"
1486,"化妆师能走点心化个皱纹啥的看她啥都没的脸在那发疯"
1486,"喜怒无常啊好怕怕"
1487,"你看这个脸它又大又圆"
1487,"演技真不是盖的眼泪说来就来四阿哥哭诉半天没眼泪"
1487,"皇后多年养了两条白眼狼"
1487,"我怎么突然转性了一点都不淡定"
1487,"皇后更年期了，来点静心口服液吧"
1487,"本宫居然也会被算计，不可能，不可能，哈哈哈哈，报应"
1488,"阿佘你比隔壁的美多了"
1488,"认了吧你都50多岁了给你演成20多岁的很厉害了"
1488,"贤妃四十多岁这个样子真的很棒啦"
1488,"看看本宫多美"
1488,"没掉头发都算你走运了，长点细纹算什么"
1488,"本宫得了抑郁症"
1489,"一个太监能搞出这么多事情，也真是醉了"
1489,"为什么叫皇上大猪蹄子？"
1489,"佘诗曼演的就是好，不亏香港视后"
1489,"你们都是疯子，只有我善良"
1489,"皇后喝的药有问题，神志不清了"
1489,"本宫演技怎么那么好"
1490,"香港演员咋不能演技好？不要乱说哦"
1490,"z这个珍儿成功被太监训练成了卧底哈哈哈哈可真行"
1490,"皇后以前不是很聪明的嘛现在跟个傻子一样"
1490,"本宫这是因为锅背多了"
1490,"荷叶看起来很逼真呢"
1490,"还好本宫没跟你们斗本宫清醒着呢"
1491,"古时候没有指纹识别，杀个人真容易"
1491,"娘娘你这智商掉的也太快了吧"
1491,"演技好真好"
1491,"镜子镜子谁是世界上最美的女人."
1491,"演技是真的好"
1491,"本宫这是因为锅背多了"
1492,"这个剧没有袁那该有多好"
1492,"本宫帮你把盒饭热一热啊"
1492,"以前的镜子真的好清楚好亮哦"
1492,"袁春望我劝你善良"
1492,"皇后感觉被下了药，智商掉的太快了。"
1492,"用丸美啊，弹弹弹，弹走鱼尾纹"
1493,"皇后演技太好了，每一个眼神都让人入戏太深👍👍"
1493,"娴妃那脸长的和马脸有啥区别"
1493,"魏樱络不是很聪明的吗？怎么查不到袁春望"
1493,"娴妃的眼睛和郭羡妮的眼睛很像啊"
1493,"坏事做多了就是报应"
1493,"佘佘演技就是棒"
1494,"说袁春望是令妃的助攻恐怕你没看懂看剧认真点好吗？"
1494,"本宫被袁春旺坑的不轻啊"
1494,"跟袁春望呆久了皇后心理也出问题了"
1494,"墨镜，墨镜，谁是最美丽的女人？"
1494,"袁春旺真的是这部剧最大的败笔"
1494,"心态决定一切"
1495,"没监控杀个人好容易"
1495,"还是本宫最可爱善良，永远艳冠后宫"
1495,"照镜子戏份太多了很烦诶"
1495,"这荷花不错，给本宫带回去"
1495,"最晚你们明天都得领盒饭"
1495,"袁春望是想自己当皇后么"
1496,"袁春望着，你敢害本宫，我这就去给你热盒饭"
1496,"再美业美不过本宫"
1496,"袁春望是最大的卧底吗"
1496,"袁春望心机好重"
1496,"荷叶演得不错"
1496,"本宫想问，太监进宫不都阉了吗"
1497,"珍儿不是个丫鬟么，怎么带着么多耳环"
1497,"本宫的段位怎么降得这么厉害"
1497,"珍儿也是智商有问题，为了半个男人这样对她主子"
1497,"本宫这样的人居然会因为这种理由疯了，果然早更要命"
1497,"袁春望认为自己也是皇子，对比自己的遭遇"
1497,"我最善良了"
1498,"更年期戏太多，太监戏多过主角"
1498,"珍儿我劝你长点儿心吧"
1498,"这皇后不正常了，才像小燕子里面那个容嬷嬷侍候的皇后"
1498,"袁春望是要害皇后娘娘吗？"
1498,"一个太监有那么大能耐吗？"
1498,"珍儿也是智商有问题，为了半个男人这样对她主子"
1499,"这部剧里除了袁春望没一个正经的反派了"
1499,"本宫的儿子是多么帅气!圈粉了!"
1499,"你从来都没没年轻过好吧"
1499,"袁春望干得好"
1499,"猿蠢旺怎么那么多戏，导演这不科学"
1499,"袁春望是要害皇后娘娘吗？"
1500,"珍儿就是装善良，皇后对她这么好"
1500,"我就是新一届"
1500,"还好本宫盒饭领的早"
1500,"珍儿你疯了！袁春旺你疯了！"
1500,"袁春望是不是大卧底"
1500,"更年期到了"
1501,"心慈则貌美，皇后娘娘你要善良"
1501,"好长时间没被点名了"
1501,"袁春旺是不是充钱了哦这么多戏"
1501,"本宫的演技真的好"
1501,"女人是个谜，更年期的女人是大迷啊！"
1501,"本宫菜四十多岁就更年期了"
1502,"珍儿她自己也不想想她和皇后于荣俱荣一损俱损的道理"
1502,"不想看袁春望"
1502,"珍儿，我劝你长点儿心吧"
1502,"集合，攻击敌方水晶"
1502,"掉血太厉害了"
1502,"本宫要将袁春旺碎尸万段，"
1503,"佘诗曼演技实力派厉害厉害"
1503,"珍儿放心吧，等袁春望利用完你就该送你盒饭了"
1503,"皇后娘娘最大的失败就是珍儿"
1503,"本宫的演技棒棒哒，就问你们“还有谁”"
1503,"感觉珍儿也要死在袁春望手里，知道的太多"
1503,"所有的后宫就袁春望的演技，让人甚是担忧"
1504,"珍儿最终也难有好下场"
1504,"只希望袁春望不要荼毒珍儿了~至少珍儿之前是个好人~"
1504,"皇后养的好狗"
1504,"后宫真有趣"
1504,"珍儿每次都是问你怎么能这么做，结果还是听袁春望的"
1504,"本宫智商突然下线了"
1505,"季相君大猪蹄子"
1505,"想我高可爱了吗"
1505,"珍儿，你知道的太多，也该被灭口哦"
1505,"袁春望你的盒饭超好吃🍱快去吃吧"
1505,"这太监多余"
1505,"好你个太监，戏这么多"
1506,"王者太久没玩，掉段到青铜了"
1506,"本宫原来是后宫起火"
1506,"果然是老戏骨演技太棒了皇后"
1506,"只为看佘诗曼而来"
1506,"袁春望戏比主角都多"
1506,"臣妾冤枉啊"
1507,"太监戏太多戏太多"
1507,"袁春旺我劝你善良"
1507,"小袁，你真不是一般人呢"
1507,"新一届背锅王"
1507,"丸美我劝你善良"
1507,"没事就吃溜溜梅"
1508,"真的厉害，进宫十多岁就这么有心机的！"
1508,"珍儿，你好歹也是本宫的大宫女，衣服能熨烫一下吗"
1508,"佘诗曼演技太好了，他十五天就拍完了自己的戏份"
1508,"背锅侠后继有人了，本宫放心打麻将去了"
1508,"珍儿你就是大傻瓜了，"
1508,"皇后娘娘你忘了你有麦吉丽了吗？"
1509,"大兄弟，你长点心吧，皇上从未贪过你的美色"
1509,"还是我善良"
1509,"大猪蹄子袁春望"
1509,"一个太监压轴整个戏吗"
1509,"又一个痴情的女子。袁春望看着好自以为是"
1509,"元春王想让皇后跟和亲王造反"
1510,"袁春旺是想报复整个皇室，别误会他并不是只报复一个人"
1510,"袁春望你戏太多，盒饭给你热好了快去领吧！"
1510,"看到袁春旺浑身不自在"
1510,"养了两个叛徒"
1510,"袁春旺不会是要替璎珞害皇后吧"
1510,"若是本宫还在呵"
1511,"袁春望我劝你善良"
1511,"现在想想我还是很善良吧不过盒饭很好吃，袁春望快来吧"
1511,"袁春望这种人你也敢用你就知道自己的下场了"
1511,"袁春望你这个赔钱货还来害本宫，本宫要把你赐给尔晴"
1511,"容嬷嬷还是那么善良，"
1511,"袁春旺啥时候领盒饭"
1512,"皇后都没啥好下场"
1512,"有人想我高小可爱吗？"
1512,"信不信我来一句“嗨，多磨！”来一个降智打击"
1512,"珍儿一点都不护主……看了真难受"
1512,"不能听袁春望这个太监说话，气人"
1512,"袁春望就是想害皇上"
1513,"李雅慧大猪蹄子"
1513,"一个丫鬟都知道。皇后那么聪明都不知道，"
1513,"袁春望我劝你善良"
1513,"袁春旺的声音真是不像个太监"
1513,"一个太监声音那么尖"
1513,"珍儿开开眼"
1514,"袁春望长的一点都不帅小说里他可是帅过傅恒的"
1514,"袁春旺本宫劝你善良！！！"
1514,"佘诗曼演技绝对的棒棒棒的"
1514,"袁春旺说话现在听着就想吐"
1514,"袁春望我都懒得劝你善良"
1514,"本宫要领盒饭去喽"
1515,"大猪蹄子大猪蹄子大猪蹄子"
1515,"袁春望给令妃说过他是一位皇子，当时令妃睡着了没听见"
1515,"所以说身边的人很重要！皇后就是被袁春望坑死的"
1515,"袁春旺，你是敌人派来的卧底吧！"
1515,"袁春旺长得一付鬼样子"
1515,"袁春望说话慢几拍听着很难受2倍速听着就好了"
1516,"袁春望这几集戏份比璎珞还多"
1516,"珍儿填充脸恢复了！自然多了！"
1516,"珍儿，你为了一个太监，就不管那么多年的主仆情谊了"
1516,"你都知道你不告诉我"
1516,"袁春不是魏璎珞派来的奸细吧"
1516,"袁春旺长得一付鬼样子"
1517,"珍儿好聪明"
1517,"袁春望好大的胆子公然勾引宫女拖出去斩了"
1517,"看过余诗曼的演技感觉回家后要感觉敷一张面膜"
1517,"袁春忘你手往哪放呢"
1517,"皇后是伪后，璎珞才是真正的大后期啊"
1517,"本宫怕是更年期了"
1518,"珍儿也是胆挺大的，敢和袁春望一队"
1518,"能不能不要放这死太监看着就心烦"
1518,"袁春旺要是让他死的太痛快就太气人了"
1518,"心疼本宫自己五秒钟"
1518,"锦绣也是袁春望害死的吧"
1518,"袁春望好大的胆子公然勾引宫女拖出去斩了"
1519,"一个宫女都能看清楚的事，皇后，你醒醒啊醒醒吧"
1519,"一个太监的戏敢再多一点吗"
1519,"你们忘了容嬷嬷了吗这个珍儿还算好的了"
1519,"跳着来看杨志悦"
1519,"能不能不要放这死太监看着就心烦"
1519,"袁春旺要是让他死的太痛快就太气人了"
1520,"这两口子不是好东西"
1520,"袁春望真是好手段"
1520,"珍儿吃错药了吗，皇后对她那么好"
1520,"珍儿等我杀了袁春望，你就改名容儿。"
1520,"袁春望我劝你善良"
1520,"跳着来看杨志悦"
1521,"盒饭热好了"
1521,"阔怜的珍儿"
1521,"这个角色好多余"
1521,"把袁春望给我拉出去杖毙"
1521,"元春旺不说皇上弟弟他就是山匪得儿子只是他误会了"
1521,"袁春望这锅本宫不背"
1522,"袁春旺!你的盒饭热好了!"
1522,"皇后娘娘是忘了身边有袁春望这个毒蛇了吧"
1522,"珍儿你可长点心吧"
1522,"打个除皱针就好了"
1522,"什么第一眼就知道不是好人，袁春旺演员就是坏人专业户"
1522,"把袁春望给我拉出去杖毙"
1523,"事实证明，找男人不能只看长的帅，何况还是个太监"
1523,"好一个区区三十鞭"
1523,"袁村晚好槽点领盒饭啦"
1523,"袁怎么跟珍儿差不多高"
1523,"从一开始就不喜欢这个死太监，满满的坏人样"
1523,"珍儿怕是冲昏了头"
1524,"袁春望完全是多余人物，他给导演塞钱了吧戏份这么多？"
1524,"看到袁春旺就想吐赶紧领盒饭吧"
1524,"袁春望有什么好的，大嘴猴，赶紧让他去领盒饭🍱"
1524,"袁春旺，你就是仗着一张何炅的脸欺骗人"
1524,"珍儿就是一个大傻子被一个男人耍得团团转"
1524,"袁春望在报复一切和皇上有关的人"
1525,"袁春旺本身角色就是一个心理比较扭曲的人物演员很好"
1525,"大监还这么多戏份"
1525,"真是跟什么人学什么人，珍儿多好的人"
1525,"袁春望，你的盒饭快好了"
1525,"看到最后惊讶地发现袁春望才是主角"
1525,"看到袁春旺就想吐赶紧领盒饭吧"
1526,"余佘曼下巴上的印子好明显啊？下巴整的刀印都还在？"
1526,"袁春望本宫劝你善良"
1526,"珍儿为啥能看上个太监。大宫女完全可以嫁的更好啊"
1526,"都是本宫的错，袁春旺本宫当初就该把你"
1526,"那么多人恨尔情就没有恨袁春旺的吗？"
1526,"看到最后惊讶地发现袁春望才是主角"
1527,"爱情真让人蒙蔽了眼睛，珍儿那么多年了还是没点长进"
1527,"珍儿也是个大傻子，被人卖了还要帮别人数钱"
1527,"这个演员本身就娘娘腔，所以看了总是让人浑身不舒服"
1527,"还是我最帅最正直"
1527,"就是声音大了没错，这是杜比音效"
1527,"袁春望换个配音会好一点点吧"
1528,"袁春旺的盒饭热好了吗"
1528,"一个太监的美男计都用的这么好"
1528,"珍儿是猪吗为了情人背叛皇后皇后还对她那么好！"
1528,"珍儿额头垫太高了"
1528,"这哈皇后洗不干净必斗的然后就会输了"
1528,"一个宫女为什么会和太监有爱情，他不能上啊！！！"
1529,"总感觉说话声音听着好熟，原来像何炅阿"
1529,"我劝你们善良"
1529,"珍儿:空有一副好面皮，却有一颗蛇蝎心"
1529,"袁春望朕要给你热盒饭！！！"
1529,"一个太监的美男计都用的这么好"
1529,"袁春旺的盒饭热好了吗"
1530,"珍儿这么多年在宫里白呆了,居然让袁春旺耍的团团转"
1530,"袁春望一出来就觉得是个心理扭曲的人"
1530,"袁就是不想让皇上好过啊"
1530,"小太监居然比我戏份还多"
1530,"袁春旺演的太过了，声音让人出戏"
1530,"袁春王珍是个不知好歹的人居然还误会自己的主子。"
1531,"不要把大猪蹄子用到袁春望身上他不配！"
1531,"珍儿长点心吧你和袁春汪把你家娘娘弄得人不人鬼不鬼"
1531,"搞不懂一个太监这么多戏"
1531,"历史上没有袁春望这个人物，导演你小舅子演的太绝了！"
1531,"这大宫女什么时候变得这么好了"
1531,"一个太监戏份怎么这么多"
1532,"袁春旺在这部剧中没有起一点好作用"
1532,"珍儿算下来有40多了吧"
1532,"闲妃的手段呢，这么明显，她怎么想不通呢"
1532,"袁春望，你敢害本宫，想吃盒饭了么"
1532,"孙红雷演袁春望比较合适"
1532,"珍儿长点心吧你和袁春汪把你家娘娘弄得人不人鬼不鬼"
1533,"猪儿你可长点心吧"
1533,"看到袁春旺本宫就想笑哈哈哈哈哈哈哈再多活两集"
1533,"还好璎珞早点看清了他离开了他"
1533,"我刚看十分钟！我提前来留个言"
1533,"李雅慧大猪蹄子"
1533,"不想再见到这个死太监"
1534,"珍儿这么好的姑娘怎么会喜欢袁春望啊"
