time,content
1328,"傅璎大旗摇起来！"
1329,"傅璎大旗摇起来，傅璎女孩永相随"
1329,"想我这个小可爱了吗"
1329,"本宫头好重"
1329,"问什么时候成贵妃和生孩子的，能不能不要跳着看剧？？"
1329,"要是有监控就好了"
1329,"历史上令妃比这还厉害"
1330,"最有默契的傅璎大旗永不倒"
1330,"傅璎大旗扛起来扛起来😊"
1330,"大旗是啥意思"
1330,"少爷少爷，少爷最帅"
1330,"大旗举起来！"
1330,"最不喜欢袁春旺的声音，听着很不喜欢"
1331,"两个人平淡得快要忘记二十多年前的事情了好想哭"
1331,"本宫又可以报仇了，好开心"
1331,"蛙哥偷柿子的时候跑的挺快"
1331,"举旗举旗举旗！"
1331,"傅璎现在还同框傅璎女孩就满足了已经很好了"
1331,"最有默契的傅璎大旗永不倒"
1332,"璎珞走路都不甩袖子的，和当奴婢时候一样"
1332,"如果再见不能红着脸"
1332,"富恒就没再娶一个"
1332,"傅瓔夫妇永不倒"
1332,"柯南的妈……真相只有一个"
1332,"我还是个处"
1333,"贵妃娘娘这句话是配音吧"
1333,"傅璎大旗永不倒！！！"
1333,"哼海兰察呢"
1333,"蛙哥不要走"
1333,"j还是处处帮着她"
1333,"张鹏在看吗"
1334,"于正的宫和演戏攻略真的是特别会碰瓷了"
1334,"为什么声音变了啊"
1334,"张太医肯定又被袁春旺收卖了"
1334,"这是刚从军事基地捡来的98k"
1334,"后面配音都变了好像"
1334,"原来是98k伤了我儿"
1335,"这剧里四阿哥是大嘉嫔的儿子啊，大嘉嫔被娴妃勒死了"
1335,"你们想我高可爱了吗？"
1335,"在你之后遇到姓魏的人都会特意关注"
1335,"傅璎女孩最后一笑"
1335,"五阿哥可是璎珞看着长大的"
1335,"袁春望你是不是疯了！！"
1336,"拜托那是平礼好么"
1336,"小燕子快来救救五阿哥"
1336,"声音也有改变"
1336,"这不是98k吗"
1336,"他俩现在可以这么自然了么"
1336,"这就是传说中的98k吗"
1337,"这么巧？刚好拿了动了手脚这个？"
1337,"本宫要出手了"
1337,"傅恒想扶她却忍住了，真爱啊"
1337,"是98这么重k吗，"
1337,"爱是伸出又收回的手"
1337,"瞧我这小劲"
1338,"袁春旺本宫现在就送你去吃盒饭"
1338,"这98k是在机场捡的"
1338,"叶馨怡你也可以去吃盒饭了"
1338,"傅恒真的越来越懂璎珞了，想的都是一样的"
1338,"他们同框都是糖"
1338,"这风刮的怎么那么奇怪"
1339,"都这么多年了肯定不爱了但还会有久违二字"
1339,"？？？？长胡子了声音也变了？"
1339,"这太阳可真够大的"
1339,"我什么时候成贵妃了"
1339,"傅璎大旗永不倒"
1339,"来啦，老弟！"
1340,"卫龙女孩扛大旗"
1340,"这火铳演得好"
1340,"八斤就这么大反应？"
1340,"我得给永琪报仇"
1340,"五阿哥都这么大了，尔康在哪儿呢？"
1340,"这98K怎么这么重啊？"
1341,"璎珞从第一集开始就特别理智，总是“干这个就有用吗”"
1341,"这枪好重啊"
1341,"傅璎大旗永不倒"
1341,"吓死本宫了"
1341,"很想问，军营的人见到贵妃娘娘都不用行礼的吗？"
1341,"我怎么这声儿"
1342,"同框就是傅璎女孩的糖！知足了！"
1342,"同框好甜，画面好美。"
1342,"傅恒孤零零的一个人，一直守护这个被他弄丢了的人"
1342,"傅缨女孩永远在"
1342,"刚才听到乔峰的声音了"
1342,"这感觉像八十斤"
1343,"如果她是和傅恒结婚会是怎样"
1343,"大家是不忘了我了"
1343,"这是抠图了吗？这么模糊"
1343,"小全子还挺帅的"
1343,"傅恒孤零零的一个人，一直守护这个被他弄丢了的人"
1344,"还珠格格历史上是不存在的好吗？"
1344,"高举傅璎大旗傅璎大旗永不倒"
1344,"她给皇上生了孩子皇上已经完全信任她了"
1344,"哪位啊哥继承皇位啦？"
1344,"配音换了?"
1344,"如果她是和傅恒结婚会是怎样"
1345,"有的时候拿水的时候想错了重量还会下一跳呢更不用说枪"
1345,"璎珞一直在看着少爷的脸"
1346,"好温柔啊对喜欢的人"
1346,"手无缚鸟之力"
1346,"还是傅缨看着舒服"
1346,"八斤就把你给重成这样了？有点夸张吧璎珞"
1346,"讪讪的收回了手"
1346,"只有这两个人在找原因"
1347,"完美诠释了手无缚鸡之力"
1347,"朕吃醋了!!不开心嘤嘤嘤"
1347,"太夸张，8斤都拿不动"
1347,"98k啊，厉害了"
1347,"好温柔啊对喜欢的人"
1348,"98k原来这么重吗，怪不得声音听着这么爽"
1348,"八斤都拿不动怪不得不能看孩子啊"
1348,"傅璎大旗举起来！！！！"
1348,"本宫都拿不动八斤"
1348,"柯南.魏已上线"
1348,"手无缚鸡之力啊"
1349,"傅璎女孩的倔强，同框就是糖"
1349,"媳妇儿，你瞅我帅不"
1349,"好温柔的声音"
1349,"确认过眼神，是98k"
1349,"傅恒好贴心哦"
1349,"肯定是这十年间封的胃"
1350,"这两个人不管在干嘛都好甜，跟皇上截然不同"
1350,"傅璎大旗永不倒"
1350,"…我家猫今年十斤天天搂着感觉没那么重呀"
1350,"八斤其实那种反应是正常的"
1350,"袁春望本宫劝你善良"
1350,"傅璎女孩的倔强，同框就是糖"
1351,"傅缨大旗扛起来啊"
1351,"八斤都拿不起来，过了吧，还怎么捉妖"
1351,"很正常，她们从来不拿东西"
1351,"傅璎女孩的春天"
1351,"果然还是她的傅恒最懂她"
1351,"还是甜甜的"
1352,"傅璎大旗最后的倔强"
1352,"袁春望伤害本宫的儿子罪不可恕来人呐斩了"
1352,"哎呀妈呀好重"
1352,"傅璎女孩最后倔强一次"
1352,"傅璎大旗举起来"
1352,"果然还是她的傅恒最懂她"
1353,"傅璎大旗在哪里"
1353,"我让你看看我开枪有多帅"
1353,"突然发现傅恒的配音是果郡王的配音啊"
1353,"傅璎大旗永不倒"
1353,"张院判怕是买进来的"
1353,"侍卫演的好"
1354,"傅璎女孩最后的倔强"
1354,"傅恒好温柔"
1354,"呜呜呜傅璎女孩爆哭"
1354,"今天晚上人好少"
1354,"才八斤璎珞你太夸张了吧"
1354,"小全子演得好"
1355,"要是你看着挺轻结果一拿这么重，你也会这样，没准备好"
1355,"傅璎女孩坚强"
1355,"你看这俩画面多美"
1355,"海兰察呢？"
1355,"总会想到如果他们结婚了会不会比这更甜"
1355,"傅璎女孩最后的倔强"
1356,"没想到有那么重，一下子拿的时候当然会是这个反应"
1356,"袁春旺本宫劝你善良"
1356,"后面的巡逻队是认真的吗？有有两个排了"
1356,"谁欺负我儿子了？"
1356,"好美的同框"
1356,"8斤都拿不动，活不长"
1357,"声音好温柔好好听哦"
1357,"傅璎女孩勇敢飞"
1357,"后面的侍卫演得好"
1357,"要不是袁春旺是不是大清就不会亡国"
1357,"贫道掐指一算，令妃你49岁过世"
1357,"海兰察呢，好久不见了，甚是想念"
1358,"为什么非说珍儿是容嬷嬷呢容嬷嬷比皇后大很多"
1358,"又开始勾引斗角"
1358,"少爷好温油"
1358,"是68k吗，这么重。"
1358,"你大猪上线了"
1358,"没有小说里描述的暧昧呀"
1359,"张院判没害过太后，是开的药比较温和，没啥用处"
1359,"只有我最了解璎珞"
1359,"傅璎大旗永不倒"
1359,"我咋变声了"
1359,"好久不出手了大家估计都忘了魏璎珞的手段"
1359,"少爷好温油"
1360,"傅璎女孩最后的倔强，傅恒好温柔啊呜呜呜"
1360,"大旗扛起来"
1360,"傅樱大旗永不倒！！"
1360,"把那个太监给本宫送下来"
1360,"说八斤轻的，你试试？"
1360,"只有我最了解璎珞"
1361,"他们是知己曾经相爱过现在互帮互助也很难得了"
1361,"高举傅璎大旗"
1361,"那个说是98k的，是认真的？？？"
1361,"傅樱女孩举旗"
1361,"都去看tf演唱会了么"
1361,"初恋相遇了"
1362,"看了这么多集还是希望璎珞和傅恒在一起"
1362,"认的这个哥哥就是个祸害，皇后也要被他害死"
1362,"同框了还开心"
1362,"富察这衣服穿的好像僵尸"
1362,"傅璎大旗用不倒！！！"
1362,"傅璎最好了知己最好了"
1363,"傅缨女孩抗住大旗"
1363,"我心上人心疼我，好开心"
1363,"很是温柔啊，少爷还是那个少爷啊"
1363,"少爷好高啊😊"
1363,"演的好像有80斤那么重"
1363,"同框糖支持傅璎我绝不低头"
1364,"傅璎大旗我来扛"
1364,"本宫要挂了吗？八斤都搬不动了"
1364,"傅璎大旗摇起来"
1364,"为什么一看到傅璎就有想哭的冲动呢"
1364,"后面的侍卫是遛弯的吗"
1364,"老夫的少女心"
1365,"璎珞这是担心啊"
1365,"傅璎大旗永不倒！！！！"
1365,"同框就是糖！！！"
1365,"傅璎女孩坚持到底！！！！"
1366,"不是女子娇弱，八斤真的很重好吗?"
1366,"傅璎大旗摇起来！！"
1366,"袁春望快来吃盒饭"
1366,"傅璎的糖啊最后的糖了"
1366,"璎珞这是担心啊"
1366,"同框就是糖！！！"
1367,"如果有监控就好了"
1367,"傅璎女孩暴哭"
1367,"富恒总是这么温柔。"
1367,"这不是98k吗"
1367,"为什么是贵妃还跟富恒行礼"
1367,"傅璎的糖啊最后的糖了"
1368,"高举傅璎珞大旗"
1368,"朕劝你善良"
1368,"傅璎大旗永不倒"
1368,"怎么看怎么甜～～"
1368,"魏侦探又开始了"
1368,"还是担心了，真情流露"
1369,"傅恒璎珞在一起就好了"
1369,"傅璎大旗扛起来"
1369,"都生了这么多了，你们也真是坚强2333"
1369,"我担心你少爷"
1369,"巍璎珞现在又要破案了，什么时候才能破案呢？"
1369,"想的总是跟别人不一样"
1370,"是没料到那么重不是拿不动好吧"
1370,"过了啊呜，老了还是个处那条哈哈哈哈哈"
1371,"还是傅缨看着舒服"
1371,"朕的小胡子比傅恒的帅多了"
1371,"嘤嘤嘤不管跟皇上生了多少孩子还是爱富恒的"
1371,"这个圆蠢旺好像个鬼"
1371,"担心了吧嘤嘤嘤"
1371,"别！担心你！"
1372,"看着很轻突然一拿，当然会觉得好重，8斤托起是好重啊"
1372,"那个虫子是认真的吗"
1372,"现在妆面更自然了，说明那会时代也在进步，哈哈"
1372,"还是心疼傅璎"
1372,"嘤嘤嘤不管跟皇上生了多少孩子还是爱富恒的"
1373,"傅璎女孩都给我把大旗扛起来！！我们绝没有认输！"
1373,"什么计俩都逃不过本宫的法眼👀"
1373,"傅缨大旗扛起来!"
1373,"好甜啊，呜呜呜"
1373,"不用言语，一个眼神就知道对方想什么呜呜呜我傅璎啊"
1373,"妈啊这是什么中年知己糖"
1374,"全是汗水证明有多热哦"
1374,"璎珞就像个大侦探一样，这是古代的侦探剧吧"
1374,"这就是心有灵犀吧，一个眼神就明白对方在想什么"
1374,"你用过鸟冲我爱过你。……"
1374,"这小太监还挺忠心"
1374,"傅璎女孩都给我把大旗扛起来！！我们绝没有认输！"
1375,"傅璎大旗永不倒"
1375,"傅璎女孩吃糖了"
1375,"怎么感觉袁春望比尔晴还不是人"
1375,"一个眼神就懂对方说的什么"
1375,"天啊，这一声等等好感动"
1375,"你用过鸟冲我爱过你。……"
1376,"是不是98k没有这根火绳我才老是打不中啊"
1376,"衣领口都是汗，大热天拍戏，不容易"
1376,"傅璎女孩上线"
1376,"傅璎大旗立起来"
1376,"傅樱女孩前来报到！"
1376,"热死我了，汗水把我衣领都打湿透了"
1377,"傅恒的衣领都是湿的，好热好热"
1377,"脖子都是汗呀衣服都是湿的"
1377,"傅璎女孩更心酸了"
1377,"傅璎女孩上线"
1378,"看着心爱的女人为了别人一个个的生孩子是什么心情啊"
1378,"领子都是汗热额"
1378,"高举傅璎大旗"
1378,"傅璎女孩都给我把旗扛起来"
1378,"就是来约会的吧"
1378,"他们两个真像兄妹"
1379,"因为音乐演的好"
1379,"这个唇色显得好俏皮"
1379,"你们少爷有你们呀，去为他哭啊，都给我哭"
1379,"好希望他俩你在一起"
1379,"领子都是汗热额"
1379,"傅璎女孩都给我把旗扛起来"
1380,"天热领边都是汗啊"
1380,"傅璎大旗摇起来"
1380,"璎珞越来越美了"
1380,"我老了还是个处🌚"
1380,"你是没事，你小弟在枪口前走路呢"
1380,"求璎珞口红色号"
1381,"大猪蹄快杀了袁春望"
1381,"袁一进，大猪蹄子"
1381,"傅缨女孩最后的倔强"
1381,"确实同框也很感动啊"
1381,"还以为永琪要被爆头~"
1381,"天热领边都是汗啊"
1382,"很热啊演员真不容易"
1382,"好气又竟敢陷害本宫的五啊哥"
1382,"傅恒好温柔对她"
1382,"本宫还是心疼你"
1382,"这段五阿哥腿受伤，很符合历史"
1382,"袁春枉太极端"
1383,"傅璎大旗我来扛"
1383,"傅璎大旗我来扛"
1383,"嘤嘤嘤太棒啦"
1383,"什么逃得过本宫的法眼"
1383,"傅璎怒磕糖"
1383,"袁春旺你就快领饭盒了"
1384,"整个皇宫的人都被一个太监给耍了"
1384,"就喜欢看傅缨cp"
1384,"大清误我中华啊"
1384,"傅璎女孩集合啦！"
1385,"夏天穿这么多拍戏真的好热"
1385,"然后就有了炸药"
1385,"傅璎女孩觉得很甜了"
1385,"辣条里面捡糖渣，傅璎女孩最后的倔强"
1385,"傅璎女孩流泪了"
1385,"就喜欢看傅缨cp"
1386,"皇上虽好但不专情希望从一而终的感情他们在一起就好了"
1386,"傅恒还是那么帅"
1386,"璎珞领子上有个小虫子，来，把它吃了吧"
1386,"璎珞爱傅恒。但是她选择了这辈子藏在心底。"
1386,"现在俩人是知己，这样也挺好的"
1386,"同框就是糖"
1387,"高举傅璎女孩的大旗"
1387,"本宫要去给永琪报仇了。袁春望准备好领盒饭"
1387,"你喜欢鸟冲我爱过你"
1387,"又要开始战斗了"
1387,"璎珞领子上有个小虫子，来，把它吃了吧"
1387,"同框就是糖"
1388,"傅恒贴了胡子也帅"
1388,"我一生只爱魏璎珞"
1388,"同框就是发糖。傅璎女孩暴风哭泣。"
1388,"我举起你们啊啊"
1388,"傅璎大棋在这"
1388,"少爷还是这么帅"
1389,"富恒是多么优秀啊，温文尔雅风度翩翩又铁骨铮铮男子汉"
1389,"傅缨大旗摇起来"
1389,"有胡子没没有胡子帅"
1389,"大猪蹄子·哈哈"
1389,"没有气质，嘴巴太大，说话时很奇怪"
1389,"傅恒贴了胡子也帅"
1390,"这是得有多热，衣领全是汗水💦"
1390,"也有可能是他杀"
1390,"没感觉换配音"
1390,"袁春望真残忍"
1390,"为啥他们都留胡子了"
1390,"傅恒都快热死了"
1391,"傅璎大旗扛起"
1391,"本帅还是很帅"
1391,"拍古装戏太辛苦了"
1391,"蛋袋是什么呢？好奇怪哦"
1391,"没错！傅璎女孩是不会放弃的！"
1391,"作为一个傅璎女孩我非常感动"
1392,"傅璎大旗永不倒！！！"
1392,"傅璎大旗永不倒"
1392,"傅璎女孩上线"
1392,"你想我了吗？傅恒。"
1393,"意外是不存在的"
1393,"有谁告诉我魏璎珞呃呃呃"
1393,"为什么衣服穿的像个福晋不像贵妃"
1393,"傅璎大旗用不到qaq"
1393,"最后一颗糖"
1393,"感觉这是98k的雏形"
1394,"这一定是心理作用于明明细纹根本就没有过啊"
1394,"看来这洋人的东西也不过如此"
1394,"这俩还是挺配的。"
1394,"调监控，给我看遍回放"
1394,"傅璎大旗用不到qaq"
1394,"最后一颗糖"
1395,"好了，知道你们很热了，不用太明显哦"
1395,"评本宫的经验这不是意外"
1395,"傅恒璎珞在一起就好了"
1395,"袁春旺戏份比我都多"
1395,"新的风暴已经出现，怎么能够停滞不前……"
1395,"本宫领子怎么有只虫在爬"
1396,"领子上的虫子演的好"
1396,"傅恒还是那么帅"
1396,"傅璎女孩最后的倔强"
1396,"肯定不是意外"
1396,"这该不会是傅璎最后的糖了吧傅璎女孩哭死"
1396,"孩子生完了吗？"
1397,"人家学芭蕾的你说人家没气质你们到底在杠什么精"
1397,"不经意的璎珞让傅璎女孩暴风哭泣"
1397,"同框便是糖傅璎女孩最后的倔强"
1397,"都生好几个孩子了傅璎女孩还不放弃哈哈哈"
1397,"演员真的都不容易夏天拍的衣服都湿透完了"
1397,"傅璎女孩最后的倔强"
1398,"为什么你的人出事就是人为的别的人出事就是意外？"
1398,"请叫我名侦探璎珞"
1398,"皇上:四阿哥，我劝你善良"
1398,"我好热，可以换个低领么"
1398,"怎能，对璎珞的孩子下手"
1398,"哈哈哈.来报个到"
1399,"这里璎珞演的好点"
1399,"眼睛一眨发现事情并不简单"
1399,"我靠叫她本名了，太监都吓一跳"
1399,"本宫最聪明"
1399,"鸟铳哈哈我来试一下"
1399,"意外不存在的"
1400,"这届网友眼神都很好"
1400,"本宫的智商离家出走了吗"
1400,"你叫我什么呢，大猪蹄子"
1400,"本宫认为有人陷害"
1400,"璎珞你头上的罩子是什么造型"
1400,"我靠叫她本名了，太监都吓一跳"
1401,"高举傅璎大旗！"
1401,"不，不是意外，是为人所害"
1401,"来！大家一起刷不得体夫妇"
1401,"敢伤本宫的五阿哥"
1401,"我觉得是意外"
1401,"想听你叫我璎珞"
1402,"坚强的傅璎大旗"
1402,"朕还记得大明湖畔的夏雨荷！"
1402,"没有了斗争瞬间感觉这集没有一点意思了"
1402,"本宫来看看你"
1402,"就你最聪明"
1402,"高举傅璎大旗！"
1403,"永琪能活着真不容易啊！"
1403,"令妃，本宫劝你善良"
1403,"在宫里发生的事都没有意外的，"
1403,"不是意外！"
1403,"傅璎大旗我来抗！"
1403,"谁敢害我五阿哥"
1404,"这么长时间他俩彼此都不经意间的真情流露，这是真爱啊"
1404,"你竟然不相信本宝宝！宝宝不开森了"
1404,"感觉令妃还变白了"
1404,"还是不经意间喊了璎珞😢"
1404,"他们的领子都是湿的"
1404,"永琪能活着真不容易啊！"
1405,"璎珞太神奇了，一猜一个准"
1405,"是啊哥我劝你善良，你说气人不"
1405,"富恒一瞪眼特像吴亦凡怎么回事"
1405,"贵妃娘娘，你疑心也太大了吧"
1405,"富恒还是太天真了"
1405,"你为什么认为不是意外？？"
1406,"傅恒好暖啊让人心疼"
1406,"这担心是发自内心的，藏不住的，喊璎珞也是"
1406,"小虫子演得好"
1406,"叫我璎珞了，有点心动怎么回事"
1406,"真的是最后的甜了吗"
1406,"璎珞太神奇了，一猜一个准"
1407,"看了这么多集还是希望璎珞傅恒在一起"
1407,"看来本宫又要给人准备盒饭了"
1407,"袁磊你这个大猪蹄子"
1407,"我那么可爱"
1407,"眼神演得好"
1407,"这担心是发自内心的，藏不住的，喊璎珞也是"
1408,"傅婴女孩哭倒长城"
1408,"还是忘不掉"
1408,"傅璎女孩爆哭"
1408,"真相只有一个!"
1408,"璎珞脖子上有虫子啊"
1408,"有了同框也不放弃"
1409,"富恒衣领湿，热的吗"
1409,"不能叫璎珞心好痛"
1409,"小虫子是袁春望派来的"
1409,"杀了袁春望"
1409,"有未来大佬的大军吗"
1409,"出手了，不怕人欺我"
1410,"不知道演璎珞的这个演员能不能红感觉长的一般呀"
1410,"傅璎大旗扛起来，就爱傅恒璎珞"
1410,"傅璎大旗摇起来"
1410,"这一对太老实了不像我呵呵"
1410,"这个称呼这里太虐了吧为什么后期还要虐我们傅璎呜呜呜"
1410,"不能叫璎珞心好痛"
1411,"在本宫眼里没意外"
1411,"大猪题是什么意思"
1411,"想去看看还珠格格了"
1411,"这不是来活了吗这不是"
1411,"软绵绵的配音"
1411,"傅璎大旗摇起来"
1412,"导演能不能不要大热天的拍清宫戏"
1412,"本宫劝你善良"
1412,"傅璎大旗会摇到最后一集"
1412,"相爱却不能相守的什么神仙爱情"
1412,"袁春旺比傅恒的出镜率都高"
1412,"别跟我抢女人"
1413,"璎珞的头饰好大"
1413,"我太聪明了"
1413,"少爷还是那么爱璎珞哭了哭了"
1413,"眼神里还有爱"
1413,"也有可能是他杀"
1413,"你们两个在干什么，忘了我吗"
1414,"那声璎珞已经让我哭死了"
1414,"嗯我很聪明"
1414,"这声璎珞叫的好自然"
1414,"一想五阿哥就想到小燕子"
1414,"璎珞在，没意外"
1414,"五阿哥腿要是受伤了，怎么保护小燕子？"
1415,"感觉所人有都没有缨络聪明"
1415,"傅璎大旗不会倒"
1415,"太监眼神亮了"
1415,"嘤嘤嘤好心疼啊"
1415,"喊璎珞都是暗戳戳的糖啊"
1415,"那声璎珞已经让我哭死了"
1416,"傅恒的眉毛是认真的吗搞得好像李逵"
1416,"傅璎大旗永不倒"
1416,"袁春望就是要留在皇后身边才可以害皇后啊。哈哈"
1416,"好后悔啊呜呜呜"
1416,"还是二倍的可爱"
1416,"还是喜欢叫璎珞"
1417,"大热天的穿这么厚，肯定很热"
1417,"傅璎女孩要坚强"
1417,"最后几集就是败笔，就是为了給太监加戏"
1417,"我等了好久"
1417,"说傅恒够了的你才是够了吧"
1417,"感觉璎珞没有一个当贵妃的样子"
1418,"妈呀那声璎珞好温柔"
1418,"傅璎的女孩绝不能怂"
1418,"傅樱女孩坚强"
1418,"弟弟，你后悔了吗？"
1418,"傅璎女孩是一把一把的眼泪呀"
1418,"傅璎女孩要坚强"
1419,"坚强地扛起傅璎大旗"
1419,"不是意外的不可能是意外的"
1419,"好一句令贵妃呀"
1419,"看到头发上的网子了"
1419,"富恒，为何你还不娶妻生子"
1419,"用什么鸟冲，我这里有98K，快拿走，不谢"
1420,"充分证明这个镜头是一次拍下来的，因为小虫一直在"
1420,"五阿哥还有苏有朋帅"
1420,"感觉傅恒大人的声音变了"
1420,"我衣服上有虫子，你们看到了吗"
1420,"怎么有张杰的声音"
1420,"不能再给了他自己做"
1421,"富璎大旗永不倒"
1421,"傅璎大旗我来扛"
1421,"傅恒啊太专情长情了"
1421,"这傅恒的声音没有以前好听了！"
1421,"他俩肯定是有爱的，眼神，不经意的真情流露都骗不了人"
1421,"尔晴居然还在看戏？不是领盒饭了吗"
1422,"我家傅恒咋这么高啊"
1422,"说实话媳妇就要生气了"
1422,"太监微表情到位演技可以"
1422,"永琪你要好好的小燕子还在等你"
1422,"傅璎大旗永不倒！！！"
1422,"有未来大佬的大军吗"
1423,"傅璎大旗比山高傅璎之情似海深"
1423,"绿一下很开心"
1423,"得体夫妇哭昏在厕所"
1423,"我为什么这么帅"
1423,"都多少年了为何还是改不了口"
1423,"傅璎大旗永不倒！！！"
1424,"陈松你个大猪蹄子"
1424,"太温柔了吧"
1424,"恍恍惚惚好纠结"
1424,"为什么本宫用不了二倍"
1424,"说监控那个，你是魔鬼吧哈哈哈哈哈哈"
1424,"破案还得靠我媳妇😎"
1425,"傅璎大旗举起来"
1425,"皇后该领盒饭了"
1425,"傅璎女孩最后的倔强"
1425,"傅璎女孩已哭晕在厕所里"
1425,"丧偶后的傅恒一天比一天开心"
1425,"谁是娴妃呀？人家现在是皇后。"
1426,"两人同框好甜"
1426,"傅璎的糖真好吃"
1426,"傅恒好高啊"
1426,"历史上根本就没有小燕子之类的还珠格格"
1426,"说麦吉丽的那个你是魔鬼吗😂"
1426,"唉，世事难料"
1427,"小燕子你在哪儿呢五阿哥受伤了需要你"
1427,"后面的太监小哥腰弯得很用心啊"
1427,"历史里傅璎根本就没戏更别说其它的了"
1427,"小全子，你老弯着腰不累吗"
1427,"我只爱不得体cp"
1427,"不是张杰的声音是马正阳的。"
1428,"傅璎女孩大旗永不倒"
1428,"又是这个袁春望"
1428,"五阿哥是愉妃的儿子"
1428,"真要有这么多抢了还有八国联军侵华?"
1428,"虫子演的好！"
1428,"真的有只虫子还换了位置"
1429,"现在看璎珞，真是越看越顺眼"
1429,"聪明如我，一个个都长得那么简单"
1429,"他叫了声璎珞却没有等到那声少爷"
1429,"放不下她了，这辈子都放不下。"
1429,"有时候还爱却没有在一起的必要了"
1429,"导演，调监控…"
1430,"蛋袋是认真的吗?"
1430,"璎珞你怕是穿越而来的吧"
1430,"五阿哥是瑜妃的儿子啊"
1430,"肯定很热啦"
1430,"五阿哥瑜妃的儿子"
1430,"这段刷三遍"
1431,"领子总是湿的"
1431,"哪里有卖这种枪本宫也想玩玩儿"
1431,"这怎么能是意外呢？"
1431,"我最帅，颜值爆表"
1431,"感觉这叫谋害不叫陷害啊"
1431,"我还是这么美"
1432,"傅恒有颜值，有身高，有才华，又痴情，还是傅恒好"
1432,"他俩没在一起，地位悬殊怎么甜"
1432,"袁春望像幽灵一样阴魂不散不知道什么时候死啊"
1432,"傅樱傅樱傅樱"
1432,"冒个泡，证明在看"
1432,"落后就要挨打"
1433,"你们都不看剧情的吗？五阿哥是瑜贵人儿四阿哥是嘉嫔儿"
1433,"傅璎大旗由我们来扛！"
1433,"老家就有很重呢"
1433,"璎珞你能当侦探了。可会破案了"
1433,"四阿哥是不是要挂了"
1433,"越看到后面越没看头"
1434,"太监这么弓着背好吃力每次看到这个演员感觉好认真的演"
1434,"你用过鸟冲，我爱过你"
1434,"这天色看着是又闷又热的天辛苦这些演员了"
1434,"请叫我名侦探柯南"
1434,"璎珞如果能和傅恒在一起就好了"
1434,"我支持你们"
1435,"傅璎大旗何在"
1435,"璎珞，你是最棒的"
1435,"傅璎大旗永不倒"
1435,"更年期到了"
1435,"曹颖在看吗"
1435,"姓袁的怎么还不消失[衰][衰]"
1436,"傅璎女孩最后的倔强！"
1436,"傅樱大旗举起来"
1436,"名侦探令贵妃"
1436,"袁春望我劝你善良"
1436,"他们俩要是在一起多好"
1436,"我好想喊璎珞但是不可以"
1437,"儿子太多了可不是好事，要斗啊打啊"
1437,"还有人记得本可爱吗"
1437,"傅恒演的好辛苦，太拘束"
1437,"本宫要出山了哼"
1437,"耳环是认真的吗"
1437,"他们俩要是在一起多好"
1438,"刚哈更会哈更刚哈说切让送说切让送说切让送"
1438,"还记得我吗？"
1438,"小太监演的很好啊"
1438,"魏柯南登场"
1438,"这皇后怎么还不死啊"
1438,"小全子可以跟珍珠配一对~"
1439,"扛起傅缨大旗"
1439,"永琪能活到现在真的是个奇迹"
1439,"大夏天的，能不能把衣服袖子挽起来"
1439,"当年的名侦探魏璎珞又回来啦"
1439,"本宫觉得是他杀！并不是意外！"
1439,"我就是侦探"
1440,"富恒讲话一扭一扭有点可爱啊哈哈哈"
1440,"嘤嘤嘤傅缨大旗永不倒"
