time,content
1238,"袁春望不是好东西"
1238,"看到他那么极端我有点怕"
1239,"吴总管比袁春望演的好"
1239,"袁春旺的演技好尬"
1239,"看到袁春旺头都疼"
1239,"这一堆灰尘，唾沫星子演的好"
1239,"这是要反清啊"
1239,"袁春旺长得就像精神分裂"
1240,"袁春旺他不是皇子她想多了后来璎珞去调查真相的"
1240,"袁春望我劝你善良不然就会下来陪我"
1240,"吴总管演技6到起飞，唾沫处理的太好了"
1240,"怎么那么多秘密吗"
1240,"演的确实好"
1240,"吴总管比袁春望演的好"
1241,"袁春望才是这部戏里最大的疯子还是加了变音器的那种"
1241,"袁春旺这种人生活里特可怕。太极端啥都能做出来"
1241,"袁春旺这么多年真的精神有问题了，，一直在装正常吧。"
1241,"告诉我袁春望是不是带资进组多余！"
1241,"我觉得吴总管人不错诶"
1241,"袁春望是个大猪蹄子"
1242,"你们要知道，如果春忘不黑化，他和璎珞就无敌了。历史"
1242,"口水演的好"
1242,"袁春望劲儿使大了演的有点过"
1242,"都是唾沫啊"
1242,"袁春望才是这部戏里最大的疯子还是加了变音器的那种"
1242,"袁春旺这么多年真的精神有问题了，，一直在装正常吧。"
1243,"口水演的好"
1243,"袁春旺够夸张的，一直瞪眼，从他出场就神烦"
1243,"袁以为这封信是他的身世解释"
1243,"这唾沫星子绝了"
1243,"口水演得好"
1243,"元春望一直活在误会里"
1244,"这皇宫里谁还没一个惊天大秘密呢"
1244,"口水好开心"
1244,"为啥觉得袁春旺演的过猛"
1244,"灰尘演的好"
1244,"袁春旺这个角色塑造的太好了"
1244,"这口水可真多。"
1245,"这唾沫星子演的是极好"
1245,"吐沫星子演的好"
1245,"这大唾沫星子喷的"
1245,"我妈多我怕谁"
1245,"为啥觉得袁春旺演的过猛"
1245,"灰尘演的好"
1246,"都现在了还有人说袁春望角色多余，长点心好吗？？"
1246,"唾沫星子演的好😄"
1246,"该进一批新的妃嫔了像人格分裂"
1246,"唾沫星子淹了本宫了都"
1246,"竟然有人站望璎，请你们善良去站望晴"
1246,"唾沫星子演得好"
1247,"为什么要有袁春旺这个角色，看着真不舒服"
1247,"哥没有黑化该多好啊。"
1247,"袁春旺是这部剧最大的败笔啊！"
1247,"口水演的不错"
1247,"喷出的吐沫星子演的不错。"
1247,"袁春旺，吃盒饭吧！"
1248,"袁春望是老戏骨了。演得好，真有精神分裂的样子"
1248,"这波口水厉害啊"
1248,"袁春望就是个疯子，璎珞还和他结拜兄妹，相处那么久"
1248,"以为老吴是个王者，没想到是个青铜"
1248,"吴总馆挺好的，挺可爱的不会就这么领盒饭了吧"
1248,"袁春旺精神分裂吧"
1249,"袁春望好多余啊每次看到他都感觉跳戏了"
1249,"我可开心了"
1249,"袁春望这演员自己加戏太多了"
1249,"那哪是血，分明是唾沫星子"
1249,"纳兰说话声音好不舒服"
1249,"这口水和雨一样多哈哈哈"
1250,"看来不是我一个人觉得袁春旺演技太浮夸"
1250,"皇后最美最善良"
1250,"这公公给演活了啊"
1250,"灰尘演的好"
1250,"春望演技。很好啊"
1250,"鼻子里有血"
1251,"春望本就演的就是个心里扭曲的人物，演的很棒"
1251,"袁春望有什么背景，能演上这个角色………"
1251,"吴总管比袁春望演技好一百倍"
1251,"难道朕是捡来的？"
1251,"吴总管求您争争气"
1251,"戏过了那谁"
1252,"袁春旺这个角色最大的作用是挑拨皇后和皇上"
1252,"袁春旺开场就说帅可真没看出来而且演得做作夸张"
1252,"袁春望还不配叫大猪蹄子"
1252,"太后，带臣妾走吧！我还会讲很多故事"
1252,"演的好都是王者"
1252,"就说你一个太监就算是亲生的，后宫那么多人你能宠幸？"
1253,"不是长的有精神分裂，是演的有精神分裂，说明演技好"
1253,"本宫还没出场，舒嫔你别得意的太早，哼！"
1253,"能别上升真人吗？你们恨他说明他演得好啊！"
1253,"头上顶的颗多肉"
1253,"袁春望，你的盒饭本宫热了好几次了，你都不来吃，哎"
1253,"袁春旺这个角色最大的作用是挑拨皇后和皇上"
1254,"要打耳光了开心"
1254,"此剧竟然有人比我还疯狂不敢当"
1254,"这唾沫演的好"
1254,"知道了，袁太监是乳娘生的"
1254,"淑妃的存在就是来发嗲的吗？"
1254,"袁春旺心理有问题"
1255,"讨好别人这么辛苦，还是自己靠自己的好"
1255,"你们懂什么？元春旺的夸张证明了他黑化已经严重到极端"
1255,"袁春望真的是多余的角色！"
1255,"袁春望，我劝你善良"
1255,"吴总管演的好"
1255,"什么时候开始领盒饭啊"
1256,"剧情比小说快的多了"
1256,"刀子有血是杀了他徒弟进来的"
1256,"倘若当初璎珞嫁给了傅恒一定会很幸福吧"
1256,"本宫不出场，后宫一片祥和"
1256,"舒贵人无论外表或是声音，都让人不讨喜"
1256,"李维嘉演得好"
1257,"袁春望的身世是个大秘密"
1257,"不喜欢你们了，都没我阔爱"
1257,"袁春望就是个多余的角色"
1257,"袁春望才是皇上"
1257,"吴总管怎么喝完酒就被袁抓了"
1257,"本宫要崛起了"
1258,"让你看着不正常的本身就不正常，所以你看着不正常"
1258,"不想再看到袁春望"
1258,"这波口水跟那晚杉菜和道明寺分手一样大呢(🐶"
1258,"接下来就是太后的系了"
1258,"想起来之前璎珞刺的东西现在还被以为是纯妃的呢"
1258,"本宫要崛起了"
1259,"求求了别说多肉了。。。那不是多肉可长点心吧"
1259,"春旺演的不错，他就是演了一个心理扭曲的人物形象。"
1259,"袁春望长得跟演鬼片儿的似的"
1259,"太监演的好"
1259,"都不是男人能不能团结"
1259,"都木有我温柔"
1260,"他也配当大猪蹄子，大猪蹄子不可能这样没家教"
1260,"本宫得攒着放大招"
1260,"但愿这些饰演反面角色的人别入戏太深"
1260,"谁出来解释一下袁春望"
1260,"还没抹脖子了，刀子上就涂好了血"
1260,"小嘉嫔去哪了"
1261,"袁春旺本来就是精神分裂症演的没有问题好吗"
1261,"我什么时候出厂，妃子都不多了"
1261,"舒嫔怎么活这么久的"
1261,"我啥时候出来"
1261,"然后旁边那个长得可真像尔晴啊"
1261,"吴总管演技才是真的好"
1262,"看多了小鲜肉再看到吴总管的演技真舒服"
1262,"袁春望他以为他跟皇上是一个爹生的，他山贼的儿子"
1262,"太后收礼物收到手软"
1262,"到底谁是魏璎珞的哥哥啊？"
1262,"春望，我都不想劝你善良"
1262,"人家到底什么时候出场呀"
1263,"舒嫔竟然在后宫活了这么久"
1263,"别太后太后了你快领盒饭我好出来"
1263,"袁春望演技很好的呀，都在眼神里恨他不起来"
1263,"袁春望这个演什么角色都很用力"
1263,"太后活的真久"
1263,"袁春旺还能在出戏一点吗？"
1264,"看舒嫔那个大卧蚕就想给她拽下来"
1264,"米老鼠演得好"
1264,"袁春旺最大的用处就是留给大家吐槽"
1264,"袁春旺病得不轻"
1264,"怎么有孩子了都有孩子没有孩子时候谁都没孩子"
1264,"袁春望排队领盒饭了"
1265,"没有聪明的脑袋和姿色，就要会讨好别人，这是生存法则"
1265,"皇上都没有妃子了不宠她宠谁"
1265,"太后不是好东西"
1265,"我咋没看到你呢"
1265,"刀上的血演的不错"
1265,"这个是典型的人格分裂"
1266,"不管妃嫔对太后多好永远都是一句，有心了哈哈"
1266,"竟敢穿本宫的衣服"
1266,"袁春望真实身份是什么"
1266,"看到舒嫔就想加速"
1266,"太后不是和魏走的很近吗？这会子又不管人家了"
1266,"嫌弃嫌弃，你的字很丑"
1267,"以后你就是苏菲了！！！！多高兴"
1267,"袁春望是个山贼的儿子"
1267,"舒肤佳的眼袋是认真的吗"
1267,"你们都好坏呀"
1267,"配角演的都很好"
1267,"傅璎女孩喊起来!!!!"
1268,"一个皇室人变了太监，他内心本就是扭曲吧，演的很好"
1268,"舒嫔你活得太久了"
1268,"春旺早点领盒饭吧，这演技难怪红不了"
1268,"舒贵人，你头上是长蘑菇了吗"
1268,"这声音连个普通话都说不清楚"
1268,"说春汪是果郡王儿子的人是魔鬼吗"
1269,"在这里刷别的XX都按XX的黑粉处理一律举报"
1269,"吴总管怕是个喷泉"
1269,"我好喜欢庆贵人啊小仙女"
1269,"春望什么时候领盒饭"
1269,"都已经做到太后了还有一大堆破事ε=(´o｀)"
1269,"行了，我算是凉了"
1270,"根本是一个宇宙观的好么这是怜儿"
1270,"郑吩咐袁春望演的精神病患者"
1270,"袁春望演的很好呀演出了心里扭曲"
1270,"嬛嬛要出手了"
1270,"后面太厚被娴妃气疯了"
1270,"我什么时候出场"
1271,"戴的花是认真的吗那么多花"
1271,"永感觉舒嫔明明缺心眼，还非要假装自己很有计谋！"
1271,"舒嫔头好大啊哈哈哈"
1271,"话说是不是后宫就没几个妃子了"
1271,"舒嫔不会也服用避子汤了吧从开始到结束都怀不上"
1271,"这个女人说话好作👇"
1272,"大猪蹄子不是亲生的袁春旺才是太子皇上本该袁春旺当的"
1272,"袁春旺，劝你善良"
1272,"坏人演到被人恨成这样说明演技是真的"
1272,"该本宫出场了吗"
1272,"长得有点像李依晓"
1272,"瞧你只有这一套衣服么"
1273,"大眼袋的声音好乖"
1273,"演太后的人和角色太不合适，一点霸气威严的感觉都没有"
1273,"舒嫔，你头发怎么插那么多花，你得罪化妆师了吗？"
1273,"我啥时候回来"
1273,"这一脑袋上插这么多花，跟刘姥姥似的"
1273,"你是怎么撑到现在的？"
1274,"2倍速才是看延禧的正确打开方式"
1274,"太后长得咋这么像宋晓峰呢？"
1274,"舒嫔我劝你善良"
1274,"有人想我吗"
1274,"只见新人笑不见旧人哭"
1274,"皇后真牛把太后都干下去了"
1275,"说袁春望演技感人的，是魔鬼吗"
1275,"这个舒嫔谁选进来的。？辣么抽"
1275,"好慈爱的太后"
1275,"太后活的真久"
1275,"米老鼠演得好"
1275,"不是绿色领饭盒吗，怎么变粉色了"
1276,"这下坐等圆公公领盒饭了"
1276,"大家还想本宫吗？"
1276,"也不打听打听《华严经》多长"
1276,"？我还出得来吗"
1276,"看袁春望让人不舒服"
1276,"一听她声音就烦"
1277,"你这个大粉衣服能不能不穿了"
1277,"舒嫔怎么活了这么久，盒饭都热了一部剧了"
1277,"舒肤佳没地位了地位不稳"
1277,"大猪蹄子和我分分合合好玩吗？？？"
1277,"突然发现太后身边的那位是最好的时光里耿耿的继母"
1277,"舒嫔这脑袋上都开花了"
1278,"这部剧不该有袁春望这个角"
1278,"穿帮了，璎珞就在旁边准备好了"
1278,"真的是人格分裂·"
1278,"舒嫔的演技也差"
1278,"坏了坏了要开学了"
1279,"庆贵人是宫里活的最久的妃子，比乾隆活的还久"
1279,"这大猪蹄子脾气不小啊"
1279,"太后的眉毛好可爱"
1279,"舒嫔演的太做作了，跟袁春望一起下线吧"
1279,"袁春望不会才是皇上吧"
1279,"这《华严经》可长着呢~"
1280,"舒嫔怎么还不穿绿衣服"
1280,"一直站门后等着叫我呢"
1280,"哎哟叫的真亲切"
1280,"我觉得我有机会了"
1280,"皇后我劝你善良"
1280,"本宫要崛起了！！？"
1281,"太后演的太慈详了"
1281,"得宠的时候不见来陪太厚不得宠了天天跑去陪太厚"
1281,"袁春望心理扭曲的人演的浮夸是对的"
1281,"惊不惊喜，意不意外"
1281,"这声音真受不了，干嘛那样说话，那什么嫔的作"
1281,"太后都喜欢别人抄经"
1282,"袁春望演得刻意戏里戏外都把自己当角儿"
1282,"本宫要发大招了"
1282,"别给舒嫔热盒饭了她活到了最后"
1282,"还好有太厚撑腰。。满血复活。。"
1282,"嬛嬛你长点心吧！"
1282,"就喜欢这个背景音乐"
1283,"嬛嬛你可一定要给力呀"
1283,"纳兰你笑的真作"
1283,"魏姐开大了"
1283,"等下璎珞和太后肯定站成了一对"
1283,"袁春望什么时候领盒饭"
1283,"袁春望是不是皇上私生子啊"
1284,"可爱装的挺不错"
1284,"本宫不吃素！旧仇五十多集就报完了，何况新恨！"
1284,"后宫套路深啊"
1284,"袁春望赶紧领盒饭吧"
1284,"袁春望演戏看着太作了。。"
1284,"等下璎珞和太后肯定站成了一对"
1285,"这刚刚就只是端着华严经站在屏风后面等着出来，正哥用点心吧，别那么明显呀"
1285,"我劝你们善良"
1285,"璎珞为身边的人开始崛起了"
1285,"本宫又要放大招了"
1285,"所以袁春望到底是怎么回事？"
1285,"太后我怎么越瞅你越像天山童姥?"
1286,"璎珞等的太明显了吧"
1286,"这个人从第一集活到现在，还不来陪本宫"
1286,"我就说一洛不会倒吧他找到太后这个大树"
1286,"眼袋演的好"
1286,"嬛嬛，要正式上线喽！"
1286,"太后不是皇上的亲娘，所以她也不爱皇上"
1287,"乾隆本来就是熹妃带大的，历史上他们本来就不是母子"
1287,"我喜欢这件衣服"
1287,"刚刚看到令妃娘娘和明玉姑娘躲在角落里"
1287,"真是有一套啊"
1287,"没有宠幸就只能抄经了"
1287,"璎珞等的太明显了吧"
1288,"是我错觉吗？一直都觉得璎珞的鞋底子比别人厚"
1288,"本宫这套衣服不错"
1288,"令妃真聪明"
1288,"要打耳光了吗，好期待"
1288,"现在是为身边的人而崛起"
1288,"本宫不是好欺负的"
1289,"舒嫔很可爱，就是卧蚕做得有点过了～"
1289,"想不到吧，我就是这么强大"
1289,"每次听他们说到佛经，重点落不稳，就闹心。"
1289,"太后真是老糊涂了，令妃不想生孩子你忘了"
1289,"璎珞真是够努力的"
1289,"翻身农奴把歌唱"
1290,"太后不会让娴妃独大的好吗"
1290,"本宫重出江湖了"
1290,"这不是片尾纯贵妃穿的衣服吗怎么成璎珞的了"
1290,"璎珞已经开始有容音的那种稳重的感觉了"
1290,"袁春望是这部剧最大的败笔"
1290,"舒嫔咋活这么久"
1291,"意外不意外，惊不惊喜，舒嫔"
1291,"皇上并没说禁足"
1291,"舒妃快穿绿衣服吧"
1291,"太后难道不知道避子汤的事吗"
1291,"纳兰挺可爱的其实"
1291,"晚晚穿的绿。。。。"
1292,"这两个人的声音一听就能比出高下来，舒嫔太作了"
1292,"哈哈，想不到吧"
1292,"袁春望我劝你善良，否则你就要挂了"
1292,"袁春不是男人不配叫猪蹄子"
1292,"袁春望是不是皇上私生子啊"
1292,"皇上并没说禁足"
1293,"樱太后大旗扛起来！"
1293,"都看看看看我不肯给皇上生孩子太后都爱我🌚"
1293,"王者开大了"
1293,"要挨揍了准备好了么？"
1293,"要想在深宫生存怎末也有点底盘吧"
1293,"我怎么还不出来"
1294,"又有新衣服了"
1294,"还好我教璎珞写字了"
1294,"这不是富察皇后的蓝衣服么"
1294,"这个舒女宾眼睛可"
1294,"昆凌看到这儿了"
1294,"现在有人看吗？"
1295,"皇上的生母不是是个很丑的宫女么"
1295,"跟老娘我斗！你们全加一起也不是我个儿！"
1295,"声音都温柔了"
1295,"这卧蚕敢不敢再丑一点？活脱脱就是大眼袋嘛！"
1295,"别人那是卧蝉懂吗你，还眼袋笑死我了。"
1295,"嬛嬛要被暗算了"
1296,"舒贵人的卧蚕真的好大"
1296,"我换大腿了"
1296,"刚看到这，依琳你够快的"
1296,"给劳资等着"
1296,"好无语的主角"
1296,"舒嫔后面生的孩子死了"
1297,"演员演的不错，衣服和妆不喜欢"
1297,"本宫要翻身"
1297,"你旁边的丫鬟比你美多了"
1297,"舒嫔头上的葡萄好吃吗"
1297,"舒嫔你那头上是个秘密花园吗"
1297,"舒嫔该有50岁了吧"
1298,"这小楷写的真好啊！剧组用心了。好评！"
1298,"太后：这是哀家新要扶持的下一届皇后"
1298,"袁春望是有抑郁症吧"
1298,"袁春旺有啥演技就一个表情"
1298,"要被扇耳光了吧"
1298,"还好有太后"
1299,"哈哈，，你们说舒妃敢不敢正常说话，，笑四人了"
1299,"傅恒咋还不回来"
1299,"啥时候回宫啊"
1299,"其他妃子去哪了"
1300,"嬛嬛准备放大招了"
1300,"又来巴结太后了"
1300,"璎珞要崛起了"
1300,"癫痫发作啦"
1301,"晚晚好温柔"
1301,"庆贵人长得像李沁"
1301,"庆常在最温柔了"
1301,"复印的还不错吧嘻嘻嘻"
1301,"就我一个人一直觉得太后发型像米老鼠么？？？？？？"
1301,"字不错，欣慰啊"
1302,"说历史上不是亲母子的那个，你也是野娘带大的"
1302,"本宫，不会放过袁春旺的。"
1302,"陆晚晚看人很准"
1302,"用血不吉利吧"
1302,"又要崛起啦这么快"
1302,"这明明是印刷品，欺上，拉出去斩"
1303,"璎珞的字写得这么好了？开什么国际玩笑"
1303,"乾隆是抱来的"
1303,"挡不住的令妃"
1303,"不会有一股味儿吗？"
1304,"所以失宠的都去找太后了"
1304,"别急，本宫最后一集就上线"
1304,"璎珞的配音换了吧"
1304,"确定不是打印出来的？"
1304,"反正每个月都有"
1304,"血经这让我"
1305,"明明就是红笔字"
1305,"呜呜呜哈哈哈急急急嘎嘎嘎"
1305,"这是要用多少人牺牲的血！"
1305,"抄的都贫血了"
1305,"我还以为是月经"
1305,"这么明显打印的"
1306,"璎珞的字也太好了吧？"
1306,"快快快魏姐放大了"
1306,"看上去好像印刷出来的"
1306,"血经，那么拼"
1306,"一个月总有那么几天"
1306,"那不是卧蚕是眼袋太严重了"
1307,"字真的好很多~"
1307,"好不卫生，我去"
1307,"这个舒嫔很像张庭"
1307,"这个背景音乐是什么"
1307,"皇上本人也在看"
1307,"地上好脏啊"
1308,"晚晚总跟着舒嫔"
1308,"抄得脑壳都疼了"
1308,"真不喜欢这个太后，心机深，处处针对娴妃"
1308,"看到这大眼袋就来气"
1308,"舒嫔还不领盒饭"
1308,"明明是红墨水"
1309,"璎珞后面越来越好"
1309,"做什么都依秀"
1309,"这剧情总感觉熟悉"
1309,"我什么时候出来？"
1309,"为了明玉复宠"
1309,"大嫂也看吗？？"
1310,"令妃换鞋子了看着舒服多啦"
1310,"不对自己狠一点，怎么钓大猪蹄子"
1310,"魏姐声音变温柔了"
1310,"感觉配音变了"
1310,"苏凡小可爱看到这里了吗"
1310,"王振宇来追剧"
1311,"抄经都这么有特色"
1311,"皇上这智商跟嬛嬛斗？嬛嬛那可是赢了雍正的人"
1311,"对啊，没有皇上讨好太后也行"
1311,"本宫就觉得舒嫔必须领盒饭"
1311,"这个卧蚕怕是割的"
1311,"璎珞太狠了，对自己也那么狠，心疼你啊"
1312,"其实舒嫔才是长得最好的"
1312,"这不是容音的衣服吗"
1312,"袁春旺去做卧底了"
1312,"舒萍要领饭盒了"
1312,"放大招了，太后是后盾"
1312,"拍马屁的精髓啊"
1313,"晚晚小天使😊😊好可爱"
1313,"我觉得太后"
1313,"璎珞进步也太快了吧"
1313,"因为舒嫔，宫墙柳这首歌我都不想听"
1313,"袁春旺就是疯子"
1313,"其实舒嫔才是长得最好的"
1314,"说周杰伦追剧认真的吗"
1314,"本宫说过，璎珞任何时候都能崛起"
1314,"尔情才领盒饭就想其他人领了"
1314,"舒嫔不会领盒饭吧"
1314,"这血还真厚啊！哈哈"
1314,"失宠的都去找太后去了吧"
1315,"璎珞声音变了，口红变了，要放大招了"
1315,"媳妇你这么瘦，还放自己的血，心疼"
1315,"我晕血不吵了不吵了"
1315,"放久了会不会发霉？"
1315,"后面怎么又出了个顺平啊"
1315,"我每个月一次血管够了"
1316,"本宫又升级了，大招伤害满了，你们等着"
1316,"本宫今天的唇色美吗"
1316,"令妃这套衣服真美0"
1316,"这是来找太后庇佑了"
1316,"靠，人家让你感同身受，以身作则，你理解有偏差吧"
1316,"什么时候出来"
1317,"这个衣服好像是容音小天使的衣服"
1317,"套路不过我吧我就是这么强大"
1317,"好喜欢庆贵人啊不争不抢最后是皇贵妃"
1317,"哥，你快走我不想看到你"
1317,"真的血经在法国博物馆里放在圆明园被抢走"
1317,"这个血太淡了点叭"
1318,"晚晚才是王者段位"
1318,"不要说人家只有一套衣服拉。因为每套衣服成本都很高。"
1318,"魏璎珞太瘦了撑不起衣服"
1318,"请记住这个人，她才是笑到最后的！"
1318,"道具组：其实是彩打"
1318,"卧蚕笑起来才有的"
1319,"好可爱的晚晚"
1319,"太后什么时候领盒饭"
1319,"晚晚又助攻了"
1319,"我什么时候登场啊"
1319,"血写，不得宠了，下本够大的，"
1319,"好有学问啊我到死都学不会"
1320,"舒到现在还只是嫔？这么久都上不了妃是有多菜"
1320,"本宫今天的唇妆不错"
1320,"都说袁春望多余但历史上确实有他啊"
1320,"请不明白的人去查下舒嫔的背景和历史"
1320,"明玉长得好可爱哟"
1320,"嬛嬛已不复年轻时的模样了"
1321,"看还珠格格的时候就觉得令妃是最善良的"
1321,"可不是嘛，一个月只能超一次"
1321,"高可爱在看吗"
1321,"这个是晚晚吗"
1321,"明玉的脸已经好了"
1321,"佛教这也叫慈悲为怀？"
1322,"晚晚小可爱"
1322,"吴亦凡你个大猪蹄子"
1322,"人聪明，又肯努力。"
1322,"红墨水演的好"
1322,"这样能瘦吗"
1322,"袁春望不过是个预告戏后面之所变的"
1323,"说庆贵人像李沁的你怕是脸盲"
1323,"注意，本宫换口红了"
1323,"你们想想本来一个皇子被割了叽叽能不扭曲吗"
1323,"舒嫔卧蚕打得过了吧"
1323,"璎珞的性格变得……终究还是走了皇后的老路"
1323,"陆晚晚是关晓彤姐妹吗"
1324,"好喜欢庆贵人真可爱"
1324,"并不是这个意思"
1324,"有点像热巴"
1324,"你们现在流行缩写了？"
1325,"皇后最大的错误就是没杀璎珞"
1325,"我喜欢陆晚晚"
1325,"晚晚像李沁呀"
1325,"看看这字我教得好吧"
1325,"璎珞的妆变浓了"
1325,"刘德华前来追剧"
1326,"晚晚小天使"
1326,"大家鼻子下都长了一颗痘痘"
1326,"魏姐都走了"
1326,"都快帮我做作业"
1326,"有点像关晓彤"
1326,"这个嫔妃还可以"
1327,"为什么每次陆晚晚都跟着舒嫔一起出现？"
1327,"晚晚真可爱"
1327,"晚晚像关晓彤"
1327,"大猪蹄子也走了"
1327,"令妃什么时候书法这么好了"
1327,"每个月来姨妈可不就是血色由乌变青嘛"
1328,"晚晚小可爱这集台词最多噢"
1328,"晚晚好可爱啊"
1328,"令妃死的早跟皇上真是脱不开关系啊"
1329,"虹奏和袁春望角色换下，我觉得会很好"
1329,"我什么时候出来啊"
1329,"她的声音好温柔"
1329,"这特效甚好"
1329,"这不就是红笔写的吗"
1329,"明明红笔字非说血经"
1330,"晚晚眼睛👀好大呀"
1330,"雍正没有宠幸过袁春望的娘然后知道这个袁春望就疯了"
1330,"不是红笔？"
1330,"这么好的书法？"
1330,"这不是红色墨水打印的吗"
1330,"因为发明了一种叫做红墨水的东西"
1331,"晚晚好大的一颗痘"
1331,"想本宫了没"
1331,"晚晚真善良"
1331,"璎珞一直都为身边的人而活身边的人又为她而活"
1331,"分明就是用红笔写的😥😥"
1331,"冯文俊你这个大🐷蹄子。"
1332,"大眼袋大眼袋大眼袋!"
1332,"哼!也不哄哄人家"
1332,"晚晚好温柔的声音"
1332,"纯妃又活了吗"
1332,"这段位真的高啊"
1332,"袁春望其实就是个山匪的儿子"
1333,"就我自己感觉庆贵人是后宫最美的女人吗"
1333,"Gxt姐妹的，你是魔鬼吗"
1333,"怎么那么像打印的呀"
1333,"令妃这字也太好了吧，岂不显得有假？！"
1334,"说熹妃和乾隆不是母子的怕是小说看多了"
1334,"杰伦杰伦，爱了你十几年了"
1334,"这牛吹的好"
1334,"就你最优秀"
1334,"古人真会玩不要命了"
1334,"怎么那么像打印的呀"
1335,"每次看到晚晚都好开心"
1335,"快放我出来"
1335,"嬛嬛好可爱"
1335,"不是用的染料，就是加的肝素"
1335,"都长痘痘了"
1336,"月经和粑粑一起吃的出来"
1336,"怎么阔能？？"
1336,"跟太后混了。"
1336,"嬛嬛，你胖了"
1337,"原来吃素这么久也是有预谋的"
1337,"令妃什么时候写得一手好字了"
1337,"开始努力了"
1337,"加了抗氧化剂就可以了"
1337,"昨天开始看，今天看到这里了"
1337,"因为这是红墨水啊"
1338,"晚晚才是最大赢家啊"
1338,"我家晚晚美丽善良，完美，儿子以后交给她我很放心"
1338,"我音乐越看越顺眼了"
1338,"你那大眼袋也敢来见太后？"
1338,"晚晚小可耐"
1338,"涂口红了？"
1339,"令妃吃不到肉"
1339,"好可怕听着都像邪教了"
1339,"晚晚才是最大赢家啊"
1340,"小说说什么就信什么。居然还敢说乾隆不是熹妃儿子"
1340,"本宫化了妆这代表着本宫要崛起了"
1340,"口红换色儿了"
1340,"怎么没有杜比了"
1340,"厉害了👍"
1340,"这是青莲吧？"
1341,"舒嫔这是双眼皮贴倒了吧"
1341,"明明就是红墨水抄的吧"
1341,"记住这个女人"
1342,"晚晚长痘痘了，是被热的吧"
1342,"聪明用心做什么都能与众不同"
1342,"晚晚这集台词好多"
1342,"其实也吃不到肉"
1342,"这纸质量真好！打印的也恰到位！满分"
1342,"都是2你段位不够别和我斗"
1343,"令妃是成大事的人对自己够狠"
1343,"我只擁有你。面臨了？你不會知道結果如何！但在這裏也"
1343,"倘若当年璎珞嫁给了傅恒得多幸福啊"
1343,"我到底什么时候出来？"
1343,"好阔怕的经书"
1343,"打印机演得好"
1344,"晚晚小天使，跟容音一样善良的小可爱"
1344,"晚晚可以让乔欣演"
1344,"陆婉婉好可爱"
1344,"真是下血本儿啊"
1344,"陈祺斌是不是猪"
1344,"令妃是成大事的人对自己够狠"
1345,"舒嫔竟然活了这么多集"
1345,"是不是要升级为纯贵妃了"
1345,"魏做任何事情都会成功"
1345,"现在周一也更新啦开心"
