time,content
1952,"要去吃盒饭楼好开心！"
1952,"皇上就是大猪蹄子"
1952,"皇上的好意本宫心领了！臣妾要去领盒饭了！"
1952,"问贵妃为什么姓宁的人可以去把眼角膜捐了。"
1952,"古代的女子特别大户女子一生是多么无奈，哭得稀里哗啦"
1953,"感觉每次高贵妃一哭皇上就特紧张眼神里都是爱"
1953,"拿开你的大猪蹄子，本宫后背疼"
1953,"你嫩么好，为什不爱宁馨儿呢"
1953,"你们男人才是大猪蹄子。"
1953,"谁说高贵妃没有害过人？娴妃一家谁害的？皇后的孩子？"
1953,"居然为一个反派哭了。行。高贵妃你厉害"
1954,"来来来高贵妃你的盒饭热好了"
1954,"大猪蹄子好像谁都喜欢'不愧是大猪蹄子"
1954,"皇后娘娘还没醒呐！你个大猪蹄子"
1954,"妈耶！我哭了😭高宝宝别走！你一直都可爱的"
1954,"导演，导演今晚要加餐要有肉"
1954,"这一段好感动😹，"
1955,"外亲势力大的都不让妃子有孩子"
1955,"高可爱，不让你领盒饭了，快好起来"
1955,"高贵妃和皇后是唯一好的妃子"
1955,"被好可爱感动哭了"
1955,"后背真的好疼"
1955,"完美谢幕已感动哭"
1956,"虽然是阿佘的路人粉但最爱高可爱"
1956,"大猪蹄子就是大猪蹄子，这也下的去口"
1956,"已经看哭～高可爱阿，不要走，你是最美的！"
1956,"大猪蹄子清醒！是她推了本宫"
1956,"皇上臣妾退了往后余生照顾好自己"
1956,"外亲势力大的都不让妃子有孩子"
1957,"看什么都没哭，为高小可爱掉了眼泪。高贵妃真的好美。"
1957,"好疼啊看着"
1957,"这是要洗白？那你把皇后推下去的事怎么说"
1957,"现在才发现高贵妃是善良的"
1957,"左胜你那么好为什么不爱我呢？"
1957,"现在上面不是写着从周二开始更新吗？估计是太多人说了"
1958,"看了这么多集第一次哭好心疼"
1958,"要美美得的去领盒饭了"
1958,"高贵妃再心狠手辣，在皇上面前也是一个安分的妃子。"
1958,"本宫就是那么美"
1958,"盒饭好了别墨迹了"
1958,"现在才发现高贵妃是善良的"
1959,"快点儿热好盒饭，马上本宫就去吃。"
1959,"大猪蹄子我该出场了"
1959,"想哭了高贵妃真的是很单纯的爱着皇上"
1959,"我疼猪蹄子再别抱我了！"
1959,"不是用最后时间报复，而是为最爱的人留下最美好的回忆"
1959,"其实我很单纯"
1960,"现在的女人多好一人一个男人，都不用挣高贵妃没有错，"
1960,"高贵妃演的真的超级好"
1960,"越来越喜欢高贵妃，可后面就再也看不到这样可爱的贵妃娘娘了。"
1960,"全局剧第一次流泪居然是因为高贵妃"
1960,"都是红墙让她们变成这样的，原本个个都是单纯的少女啊"
1960,"快给本宫闪开，本宫要替姐姐报仇"
1961,"贵妃:皇上，臣妾的饭盒热好了没"
1961,"一觉醒来，高可爱去了，好舍不得啊"
1961,"说高贵妃善良是认真的吗"
1961,"我就想知道我什么时候出场"
1961,"看哭了，馨儿爱皇上爱的深切"
1961,"全局剧第一次流泪居然是因为高贵妃"
1962,"贵妃是个单纯的坏人，不是伪装好人的坏人"
1962,"本宫再善良又怎样，本宫还是害皇后娘娘失去了孩子啊"
1962,"那个咬唇妆的站住，这就是清朝时代的妆容好吧！"
1962,"说完了吗说完了快点去领盒饭话这么多"
1962,"乾小四你个大猪蹄子"
1962,"我去演药神去了快给我领盒饭"
1963,"大猪蹄子此生真的够够的了这么多女人都真心爱他"
1963,"我好长时间没出现过了"
1963,"看了这么久，没想到是被反派给看哭了…厉害…"
1963,"皇上，这么抱着臣妾，好疼"
1963,"其实都是皇上的错，早呀雨露均沾，后宫就不会这样了"
1963,"本宫这么可爱的，啧啧，要走了，不舍得各位爱卿"
1964,"皇后那么善良多难得啊你为啥就不能跟她一伙呢"
1964,"一入宫门深似海，都是人精"
1964,"别说了去领盒饭吧你个大猪蹄子"
1964,"盒饭快快我居然掉泪了"
1964,"别走那么快，意味着皇后没多久了"
1964,"本宫这么可爱的，啧啧，要走了，不舍得各位爱卿"
1965,"背景音乐演的好导演加鸡腿"
1965,"我高可爱还可以再抢救一下"
1965,"本宫的盒饭热好了"
1965,"给本宫退下，这是本宫的大猪蹄。"
1965,"为什么最后一刻会忽然发现高贵妃挺美的"
1965,"别走那么快，意味着皇后没多久了"
1966,"高贵妃好白啊脸跟脖子一样白皮肤真好"
1966,"饭热好了没，本宫该走了"
1966,"她对乾隆是真爱呀很单纯的就是想乾隆爱她可是爱错了人"
1966,"本宫那么骄傲走也要走的体面"
1966,"这是我看这剧这么久唯一想哭的点"
1966,"要给他留下最美好的回忆"
1967,"其实高贵妃最潇洒最坦荡可爱又迷人的反派角色"
1967,"本宫要美美的领盒饭了呦"
1967,"看了那么多集第一次哭居然是因为高妃"
1967,"高可爱，原来真的误解你了"
1967,"高贵妃是最单纯的，他只是单纯的想得到恩宠"
1967,"新衣服被我弄脏了"
1968,"这样看上去头好大"
1968,"突然不想小高高领盒饭。毕竟他还是蛮有意思的高可爱"
1968,"心疼贵妃宫里最单纯的人"
1968,"高贵飞您的双眼皮贴出戏了"
1968,"爱皇上的女人都没好下场"
1968,"看了那么多集第一次哭居然是因为高妃"
1969,"皇后是长昆曲的所以说话都带戏腔"
1969,"本宫的盒饭热好了没"
1969,"皇上总是有那么多女人要宠幸"
1969,"好了，赶紧去领盒饭了，别说了"
1969,"都是男人惹的祸！大猪蹄子！"
1969,"拿开你的大猪蹄"
1970,"唯一一个爱皇上且任性的女人，比皇后任性"
1970,"本宫的盒饭热好了吗"
1970,"最后跳舞的贵妃比较美，衣服头发都美"
1970,"看喜剧之王，就知领盒饭的意思了。代表你的戏结束了"
1970,"大猪蹄子是要忘记本宫了吗"
1970,"好了，赶紧去领盒饭了，别说了"
1971,"大猪蹄子大猪蹄子大猪蹄子"
1971,"有点心疼高可爱"
1971,"我居然哭了，眼睛疼，只能说贵妃演技太好了，同情她"
1971,"盒饭要多吃"
1971,"我怎么看哭了。。。。这段真感情总是让人鼻子酸"
1971,"唯一一个爱皇上且任性的女人，比皇后任性"
1972,"看哭了高贵妃演技真的很细腻感染力很强"
1972,"本宫都吃饱了，还不到本宫上场"
1972,"说第一次流泪是为高贵人的，告诉你，后面有你哭的时候"
1972,"买点阿莫西林不就好了吗"
1972,"牙好白，洗了真干净"
1972,"我高宁馨要走了皇上一定要记得我呀"
1973,"高贵妃这一舞在皇上心里刷了好一波好感度"
1973,"突然觉得贵妃好美"
1973,"盒饭快好了"
1973,"后宫的女人活的是真的明明白白"
1973,"大猪蹄子要哭了"
1973,"看哭了高贵妃演技真的很细腻感染力很强"
1974,"心疼高贵妃多么希望她身体康好人心变好而不是离开"
1974,"突然好心疼高可爱"
1974,"莫名戳中泪点，贵妃才是最单纯的在后宫善良的人活不了"
1974,"管谁叫大猪蹄子呢"
1974,"阿你个大猪蹄子，伤了这么多女人"
1974,"突然觉得贵妃好美"
1975,"果然宫里活着的女人没有不聪明的"
1975,"感觉下线太早了还没到一半呢"
1975,"满满都是大猪蹄"
1975,"其实高贵妃其实没有那么心机都是别人帮她出的主意"
1975,"哭了，哭了，高可爱别走"
1975,"阿你个大猪蹄子，伤了这么多女人"
1976,"别说她单纯了，单纯的人还能推孕妇？"
1976,"某贵妃要领盒饭了，好开心"
1976,"看哭了，其实高贵妃深爱着皇上也最是单纯"
1976,"唉，高高也是个可怜人"
1976,"大猪蹄本宫还没醒呢别被迷惑了"
1976,"哭了，哭了，高可爱别走"
1977,"看得我背好疼"
1977,"害皇后没好下场，皇后那么善良"
1977,"其实高贵妃都是被那些心机重的女人给利用的"
1977,"害皇后是要付出代价的"
1977,"看哭了，其实高贵妃深爱着皇上也最是单纯"
1977,"唉，高高也是个可怜人"
1978,"皇上不能宠爱她，不能让她的家族势力太大"
1978,"你的盒饭备好了，赶紧去叭"
1978,"导演：高贵妃啊快来领盒饭了"
1978,"馨儿是美的"
1978,"高贵妃才是真正全力斗宫之人呐把一生都献给了皇上"
1978,"就要吃盒饭了，有点开心"
1979,"看了那么久，第一次眼眶湿润"
1979,"本宫对自己的唇妆甚是满意"
1979,"典型的，女人不要太聪明"
1979,"你喜欢绿色我绿过你"
1979,"大猪蹄子被套路了"
1979,"馨儿是美的"
1980,"高可爱试我误会你了"
1980,"大猪蹄子你该当何罪"
1980,"其实高贵妃活的才最真实"
1980,"这么久还没领盒饭"
1980,"宫里过得久的，都是明白人"
1980,"典型的，女人不要太聪明"
1981,"除我白月光皇后以外算不算最单纯的人不接受批评"
1981,"你要心地善良，皇上能不喜欢你吗"
1981,"看了这么久，居然被高贵妃对皇家的痴情给感动哭了😭"
1981,"好疼呀呜呜呜"
1981,"高贵妃跳舞那刻真心美，突然不想高贵妃领盒饭了😂"
1981,"感觉好幸福啊！！"
1982,"大猪蹄子活得真幸福，这些女人居然都真爱他"
1982,"也没觉得多聪明啊使计最后都是自己背锅"
1982,"高贵妃牙齿好整齐好白啊"
1982,"此时的高女士好美"
1982,"你那么可爱朕是爱的你，要封你慧贤连富察皇后都羡慕"
1982,"能不能不走啊高可爱"
1983,"这里要加上满脸的汗就更入戏了，看着就让人疼"
1983,"台词怎么那么多呢，本宫都饿了"
1983,"原来高贵妃才是最大的戏精"
1983,"大猪蹄子弘小四！"
1983,"哭得最多的一次到现在"
1983,"此时的高女士好美"
1984,"皇上高贵妃我劝你们两个善良饭盒热好了，皇上挨搞定了"
1984,"一入皇宫深似海！不容易啊"
1984,"皇上这两集又是淑慎，又是宁馨，大猪蹄子"
1984,"大猪蹄子阿莫西林都舍不得给我买"
1984,"高女士现在太美了吧，就这么领盒饭了吧以后谁来背锅"
1984,"谁还不是个戏精宝宝呢"
1985,"最单纯的先挂了哎后面都是高段位"
1985,"最单纯最真实的女子"
1985,"闲妃才是真正的厉害呀，一出场杀无赦了"
1985,"本宮活了三十集足已"
1985,"为什么恨不起来高天真反而有点泪奔"
1985,"30多集没吃饭了，本宫要去吃饭了"
1986,"以为是倔强青铜，结果还是最强王者，厉害了"
1986,"本宫已经活了30多集了，是时候该走了"
1986,"我看到这里居然看哭了，看她跳最后一支舞居然这么伤感"
1986,"本宫就要领盒饭了，热好了没"
1986,"她是真爱皇上。至少在爱情里她是善良的"
1986,"最单纯最真实的女子"
1987,"好了，好了，放开大猪蹄子，人家要吃盒饭了"
1987,"娘娘好白的牙"
1987,"大猪蹄子，大猪蹄子，大猪蹄子"
1987,"朕是四处留情的大猪蹄子"
1987,"领盒饭才有新衣服穿不容易啊"
1987,"一直以为高贵妃是个青铜没想到竟然是个王者"
1988,"可以对那么多女人说，皇上是滥情还是博爱啊"
1988,"皇上要跟这么多女人谈情说爱，也是怪不容易的"
1988,"大猪蹄子清宫最红的姑娘"
1988,"皇上怎么那么三心二意那么多女人真的是雨露均沾啊"
1988,"妹妹，盒饭热好了，快去吃吧"
1988,"朕是四处留情的大猪蹄子"
1989,"皇后只是不单纯但是人是善良的，没害过人，高害人害己"
1989,"行吧我承认自己是个大猪蹄子"
1989,"大猪蹄子大猪蹄子大猪蹄子"
1989,"你个大猪蹄子，一定要记得替我报仇哦"
1989,"导演盒饭给我们好可爱加个鸡腿"
1989,"大猪蹄子！老娘还怀着你的孩子昏迷不醒呢！"
1990,"真的是个不可多求的好演员"
1990,"盒饭热好了"
1990,"大猪蹄子真是大猪蹄子。"
1990,"为了拍这部戏头发几个月没洗了头上的油都能炒菜"
1990,"皇上的宽容心真大对弘昼对高贵妃"
1990,"哼你个大猪蹄子"
1991,"说她单纯，是因为她说啥做啥，不做作，又不是心地好"
1991,"本宫的盒饭热好了吗"
1991,"到目前为止哭的最厉害的一回"
1991,"领盒饭吧行了行了"
1991,"卫英络心机好重"
1991,"本宫就是说话慢，不然早领盒饭了"
1992,"好了好了别说了快吃饭去吧求你了"
1992,"本宫没有这么好的演技就不会来演好贵妃了！"
1992,"好可爱的一群女人。男人都是大猪蹄子"
1992,"快点，本宫盒饭咋还没好，本宫马上就要领盒饭了。"
1992,"最重要的是保住父亲和高家吧。。。"
1992,"要领饭盒了，才给一身看着舒服一点儿的衣服😔"
1993,"觉着乾隆是个大猪蹄子"
1993,"仇人要走了，本宫好高兴"
1993,"高贵妇演得好"
1993,"高可爱完美谢幕"
1993,"能在后宫待久的没有一个蠢人"
1993,"好可爱的一群女人。男人都是大猪蹄子"
1994,"三十二集了朋友们别再问这个唇妆好吗到现在还弄不清啊"
1994,"人长得不错就是被化妆师坑啦"
1994,"家世如此注定没有办法得到真爱皇上爱他是有顾忌的"
1994,"干嘛一直说盒饭的，人家要杀青了不能吃点好的吗？"
1994,"一入宫门深似海啊"
1994,"盒饭准备好了没？我马上就来领了"
1995,"令人有点感动高贵人是真爱啊还一直称皇上您"
1995,"大哥你这么抱我我背疼"
1995,"这段看哭贵妃演技赞让人恨的彻底也爱的真挚"
1995,"我都要走了，大家就别计较那么多了哈"
1995,"头发上的发夹好眼熟"
1995,"领盒饭领盒饭快领盒饭"
1996,"如果高贵妃不进宫该多好"
1996,"其实我聪明"
1996,"历史上贵妃病重的时候封了皇贵妃，然后就死了"
1996,"这个时候该直接叫馨儿呀皇上！"
1996,"大猪蹄子什么意思啊各位大神们能解释一下吗"
1996,"为什么反派对皇上都是真爱？"
1997,"牙齿戏份太足了，谭卓如果鼻子再回回炉就好了"
1997,"劳资斗这么久从来没有赢过，算了让你们斗。"
1997,"贵妃实际很美，也很好。就是太爱皇上"
1997,"高贵妃皮肤棒棒哒"
1997,"行了行了，盒饭里面给你加个鸡腿行没？？？？"
1997,"这个时候该直接叫馨儿呀皇上！"
1998,"高贵妃你的盒饭已经热好了嘞，快去吃吧"
1998,"本宫要领盒饭了，以后绿袍子全是皇上的"
1998,"死得好唯美"
1998,"高活不成了"
1998,"这才是深爱一个人的模样，不论她做了什么，爱没有错"
1998,"高贵妃也不容易啊"
1999,"高说到她母亲每一次很感人"
1999,"目前还是贵妃这段把我看哭了贵妃都是最痴情的"
1999,"好了。再加个大猪蹄子"
1999,"大猪蹄子，本宫还没醒呢"
1999,"突然心疼是怎么肥事"
1999,"看了三十几成功地哭了"
2000,"你们没有做过皇上就不要说皇上是大猪蹄子"
2000,"绿到最后自然红啊"
2000,"疼得声音都颤了，作为烧伤科的人，声音绝对给满分"
2000,"买药的你是认真的嘛"
2000,"贵妃的牙好白"
2000,"突然心疼是怎么肥事"
2001,"本宫活了三十多集，够了，，领盒饭前让皇后她儿子一起"
2001,"韩旭我劝你善良"
2001,"罢了后宫妃子早死早超生"
2001,"本宫要走了，你们后宫那些嫔妃现在称心如意了吧"
2001,"大猪蹄子是什么意思？什么梗？"
2001,"突然有点舍不得贵妃领盒饭了"
2002,"盒饭已热好。高贵妃您可以去吃了"
2002,"大猪蹄子你轻点啊，手别使那么大劲"
2002,"心疼高贵妃三秒钟，隔着屏幕都觉得疼"
2002,"来人呐本宫这都饿了20多集了这盒饭到底还让不让吃了"
2002,"皇后才是真爱，生病那次高贵妃躲的远远的"
2002,"看一次哭一次贵妃是真坏人跟娴妃是不一样的"
2003,"那么多集第一次哭可爱的宁馨儿要走了"
2003,"早说出来有多好啊哎"
2003,"大猪蹄子们天天让我哭一天哭几时回"
2003,"你的盒饭热好了说完快去领了吧"
2003,"被高可爱感动哭了"
2003,"心疼高贵妃三秒钟，隔着屏幕都觉得疼"
2004,"看这么多集既然看高贵妃流泪了"
2004,"一入皇门深似海"
2004,"她真的演的好认真"
2004,"大猪蹄子，趁我没醒到处浪"
2004,"说贵妃可爱的忘了她做了些什么吗"
2004,"我很喜欢她，死了都好可惜，为她哭了，虽然任性但可爱"
2005,"好了好了高贵妃吃大餐去了"
2005,"感觉小高一直变来变去的模样"
2005,"看哭了高贵妃不过只是痴情而已心思很单纯"
2005,"大猪蹄子！"
2005,"高贵妃和导演是亲戚，这是艳压群芳吗，有点年纪大了"
2005,"再让我捏着嗓子说一会儿"
2006,"退了那个烟熏眼妆，美多了"
2006,"一直喜欢高贵妃，坚强的让人心疼"
2006,"哭了哭了。鼻子好酸"
2006,"说高贵妃嗓子的，别忘了高贵妃可是唱戏的"
2006,"好了好了高贵妃吃大餐去了"
2006,"大猪蹄子！"
2007,"这样说话感觉有好大的口气冒出来"
2007,"早点聊开多好啊"
2007,"皇上再不搞高巫婆她准备死了，你们两个害人害己👋"
2007,"本宫活得不容易"
2007,"贵妃是个大明白啊"
2007,"退了那个烟熏眼妆，美多了"
2008,"心疼，最爱皇上的往往都是没好下场不爱的都是身居高位"
2008,"这坏人我居然会有点想哭，果然演的好"
2008,"这个样子好美比平时美多了"
2008,"皇上我好疼"
2008,"演技很好演员都没有大哭。。观众哭的稀里哗啦"
2008,"别了，大猪蹄子"
2009,"马鸭！刚敷了面膜给我看哭了……演技太好了🌝"
2009,"长的美都被化妆师耽误了"
2009,"她要是不在她那个家族，可能命运会好一点"
2009,"别抱那么紧可疼死我了"
2009,"其实她想多了，他老爸对他还蛮好"
2009,"让你任性一次"
2010,"看得透透儿的"
2010,"哼大猪蹄子本宫要去领盒饭了"
2010,"唉搞这么多，其实高贵妃也是为了能立足，但却害了自己"
2010,"舍不得她死怎么回事。明明蛮可爱的反派角色"
2010,"牙齿白的不正常"
2010,"谁给朕解释一下什么是大猪蹄子"
2011,"看了这么多集，高贵妃演的真好，倔强的高贵妃让人心疼"
2011,"吃个盒饭怎么要等这么久"
2011,"她那么聪明，次次害人，次次不成功，是不敢成功啊"
2011,"本宫要一直美下去"
2011,"感觉芝兰对贵妃的感情很深阿"
2011,"她本来可以很好的"
2012,"说出了跟皇后一样的话。宫墙内无自由"
2012,"大猪蹄子，还抱我背，疼死本宫了"
2012,"第一次看哭竟然是因为高贵妃~不得不说演得真的好"
2012,"你个大猪蹄子，为何不来看看本宫，气人"
2012,"她说的跟皇后一样，时间久了都不是真正的自己了"
2012,"盒饭快好了？本宫马上就来！😂😂"
2013,"贵妃皮肤好，不化浓妆，可以说是清新脱俗了"
2013,"为高可爱泪流了"
2013,"其实高贵妃演的才让人触动感情，璎珞主角光环太重"
2013,"本宫就是脸大脸长"
2013,"皇上待遇可真好,抱那么多女人"
2013,"说出了跟皇后一样的话。宫墙内无自由"
2014,"皇上的爱情好丰富啊，满世界都是真爱都是情"
2014,"本宫说话全用气声，听不舒服就忍着！本宫就是这么装！"
2014,"贵妃的声音好飘渺"
2014,"皇上把你的大猪蹄子拿开！疼！"
2014,"看了快30集了第一次发现高贵妃原来这么美"
2014,"贵妃皮肤好，不化浓妆，可以说是清新脱俗了"
2015,"最爱皇上的其实是闲妃，她不救弟弟也是为皇上着想"
2015,"好了，你洗白成功了赶紧去领盒饭吧"
2015,"高贵妃盒饭热好了快来吃了吧，热乎着呢"
2015,"你怎么能忘了我呢？我还没醒呢，大猪蹄子。"
2015,"坚强的让人心疼，高高不要走"
2015,"贵妃的声音好飘渺"
2016,"好可爱的一群女人男人就是大猪蹄子"
2016,"我还想多活两集混个领衔主演"
2016,"长得那么老非要叫的这么嫩"
2016,"这么久第一次哭，高贵妃是真心爱皇上，这么早领盒饭了"
2016,"贵妃演的绝了，这疼的说话声音都颤抖了"
2016,"突然觉得贵妇美炸了"
2017,"都是妃子多了惹的祸"
2017,"一夫一妻制多好，皇上女人太多，争宠"
2017,"怎么这部剧那么多地方都不符合逻辑"
2017,"盒饭热好了吗"
2017,"老匹夫要作妖把三妹四妹送进宫吗！"
2017,"别说了赶紧走你死了我就活了"
2018,"突然看了想哭好感动"
2018,"她做了这么多坏事活该死，别煽情一下就忘了皇后坠楼"
2018,"大猪蹄子是什么梗呢？一集没落依旧不明白"
2018,"皇上脑袋旁边的是青筋还是假发没有贴好啊"
2018,"快去吧别说了，朕脑阔疼"
2018,"好了，本宫要去补睫毛了"
2019,"高大姐你是大天蝎嘛说话太直接白了"
2019,"可爱又迷人的反派角色就是本宫了"
2019,"可爱？把皇后推下去的时候你怎么不说可爱"
2019,"大猪蹄子害的本宫临走之前都要哭一场"
2019,"可你害人之心常有活着所有的意义就是害人"
2019,"突然看了想哭好感动"
2020,"看了一半了头一次哭竟然是为了高可爱"
2020,"可爱又迷人的反派角色"
2020,"好心疼最单纯的就是高贵妃了还保护阿满哭了"
2020,"朕头上好大条蚯蚓！"
2020,"大猪蹄子女人真多"
2020,"可爱又迷人的反派角色就是本宫了"
2021,"高贵妃害了皇后害了那么多工匠，说她单纯是什么人啊！"
2021,"高贵妃是唯一一个死能让本宫落泪的反派角色"
2021,"我一个大男人竟然看高可爱看哭了"
2021,"好心疼最单纯的就是高贵妃了还保护阿满哭了"
2021,"看了一半了头一次哭竟然是为了高可爱"
2021,"朕头上好大条蚯蚓！"
2022,"皇上真的诠释了男人可以同时爱多个女人"
2022,"大猪蹄子，大猪蹄子，大猪蹄子。"
2022,"高贵妃其实很好的，相比娴妃她真的太好了"
2022,"大猪蹄子你背着我都干什么了"
2022,"高可爱要领盒饭了"
2022,"将死才会醒悟、活着继续作"
2023,"好了大猪蹄，本宫要去吃盒饭啦"
2023,"哎呀妈跳饿了本宫的盒饭热好了吗"
2023,"甚至忘记是她推了你的皇后，到现在都没醒吗大猪蹄子"
2023,"盒饭热好，我马上来"
2023,"皇上真的诠释了男人可以同时爱多个女人"
2023,"大猪蹄子你背着我都干什么了"
2024,"看这剧第一次哭居然是为了高贵妇演技太好了吧"
2024,"别抱这么紧老娘背疼"
2024,"可别，养好病后又该祸祸别人了"
2024,"大猪蹄子，你还记得大明湖畔的夏雨荷吗？"
2024,"原来高贵妃一直这么聪明后宫之道她比谁都清楚"
2024,"盒饭怎么这么慢啊，找人催催啊"
2025,"其实贵妃对皇上的爱是单纯执着的"
2025,"看了这么久，为高贵妃看哭了，心疼高贵妃😔"
2025,"大猪蹄子你忘了还在昏迷中的本宫了吗"
2025,"朕盒饭已经给你热好了"
2025,"她是幸福的能死在皇上怀里"
2025,"别抱这么紧老娘背疼"
2026,"她现在都没有喊疼，这本是多么娇弱的身体"
2026,"盒饭快给我热好本宫马上到"
2026,"大猪蹄子大猪蹄子"
2026,"其实贵妃对皇上的爱是单纯执着的"
2026,"朕盒饭已经给你热好了"
2026,"她是幸福的能死在皇上怀里"
2027,"其实宁馨儿自己没主动动过害人的心思只怪身边小人太多"
2027,"说高贵妃好的人是什么心态"
2027,"别死啊还想看可爱的高贵妃"
2027,"大猪蹄子我还没醒呢"
2027,"她现在都没有喊疼，这本是多么娇弱的身体"
2027,"来不及啦我盒饭都热好了"
2028,"好白好整齐的牙齿"
2028,"盒饭好了没，本宫要杀青领盒饭了"
2028,"看了这么久被一句你那么可就是不爱我看哭了"
2028,"高贵妃你的盒饭已热好"
2028,"皇宫里每个女人都活的不容易"
2028,"皇上这个大猪蹄子"
2029,"高贵妃推皇后也是舒贵人的注意，高贵妃是挺单纯的"
2029,"嘤嘤嘤大猪蹄子再见了本可爱先去领盒饭了"
2029,"大猪蹄子给我憋回去别为了这娘们哭"
2029,"你个大猪蹄子把我都忘到脑后了哼不开心☹️"
2029,"大猪蹄子你忘记谁杀了你的皇后和孩子吗"
2029,"真的很喜欢好贵妃最单纯"
2030,"说高可爱是最单纯的你怕是忘了谁把皇后推下去的"
2030,"本宫盒饭热好没还有多少台词啊"
2030,"一直没哭，给高可爱弄哭了可还行"
2030,"本宫爱的最痴情"
2030,"皇上大猪蹄子，为什么不去看皇后"
2030,"她只爱他，争宠只是想让他在乎、注意，高贵妃！呜呜"
2031,"高贵妃倔强的可爱，让人心疼！"
2031,"行了，高可爱盒饭热好了你去领吧"
2031,"高可爱是太单纯了才这样的"
2031,"我还要杀皇后，不急不急"
2031,"早这样温柔些多好"
2031,"说高可爱是最单纯的你怕是忘了谁把皇后推下去的"
2032,"高桂芬儿到这一步真的是自己作的"
2032,"大猪蹄子你抱着我真疼"
2032,"能原谅的才是真大猪肘子"
2032,"哭了！高贵妃是一个非常优秀的女人"
2032,"大猪蹄子本宫还在昏迷中呢"
2032,"我错过了这么多好戏"
2033,"她说话声音听着好不舒服，听得我感觉自己嗓子里有东西"
2033,"男人就是大猪蹄子不能照顾好自己的女人帝王更是如此！"
2033,"感觉口气好重的，你是认真的吗"
2033,"那个太监说对了，能活这么多年的妃嫔怎么可能简单"
2033,"看这剧第一次哭竟然是为了高贵妃，太不合理了"
2033,"哭了！高贵妃是一个非常优秀的女人"
2034,"这大猪蹄子见一个爱一个"
2034,"大猪蹄子每次哄女人都厉害"
2034,"我哭了，高贵飞居然把我弄哭了"
2034,"老娘要去酒吧跳钢管舞了再见了皇宫"
2034,"高贵妃才是最性情中人啊"
2034,"看这剧第一次哭竟然是为了高贵妃，太不合理了"
2035,"舍不得高可爱，她其实算善良的，后面才是真正王者局"
