time,content
1371,"小燕子：快了快了，你们宫里先安排好我马上就来"
1372,"愉妃做的最聪明的事就是把五阿哥让令妃照顾了"
1372,"明玉坐的太多，衣服都是皱的"
1372,"她本来就聪明看的明白只是以前不耍心眼而已"
1372,"哇哥都这么大了"
1372,"难怪令妃对五阿哥好呢"
1372,"五阿哥好可爱"
1373,"蛙哥长这么大真不容易"
1373,"转了怎么久才来见璎珞"
1373,"还是俞妃最有远见看人准"
1373,"我怎么变好了"
1373,"永琪啊，要好好疼你的知画，她是很好的人"
1373,"知画也要出生了吧"
1374,"这里活的最真实的就是富察皇后和愉妃"
1374,"听到五阿哥觉得特别亲切"
1374,"再过几年，小燕子就要跟五阿哥红尘做伴活的潇潇洒洒了"
1374,"吃饲料能不大么"
1374,"五阿哥是个好孩子"
1374,"我儿子就是聪明"
1375,"阿佘的演技...甩有的人几大条街"
1375,"为啥令妃还没孩子，蛙哥都这么大了"
1375,"小燕子多大了？"
1375,"小时候的蛙哥"
1375,"袁春望，你个坑队友的！本宫就是被你玩死了！！！"
1375,"五阿哥是个好孩子"
1376,"这已经算好的呢，现实中宫里女人都是各家族的急先锋"
1376,"导演你搞清楚我才是主角"
1376,"哇哥多大了"
1376,"五阿哥本宫来找你了"
1376,"原来令妃把五阿哥养大了"
1376,"高贵妃哪里单纯，她是蠢"
1377,"与世无争的愉妃才会教导出五阿哥这样懂礼仪的孩子"
1377,"两个人怎么好了"
1377,"这个女人愉妃也挺有心机，虽然柔弱"
1377,"看在蛙哥的面子上先放过你"
1377,"永琪大了小燕子来找你了"
1377,"好想看五阿哥和小燕子"
1378,"突然觉得愉妃是个明白人儿"
1378,"本宫最大的对手就要上线了，想想就激动"
1378,"我还能长得更大"
1378,"包殊琪我劝你善良"
1378,"四岁就这么高了，不错哦"
1378,"我说为啥令妃一直向着五阿哥和小燕子呢"
1379,"经济学学的真好"
1379,"小唐僧很孝顺"
1379,"后宫的人怕是一个个都有抑郁症"
1379,"快去找小燕子啊蛙哥"
1379,"你只要当了皇上才能保护你的家人"
1379,"五阿哥小燕子找你呢"
1380,"永琪我给你算一卦你此生有两情劫你媳妇叫小燕子和知画"
1380,"自己烤饼吃太多孩子才黄的"
1380,"蛙哥都长这么大了"
1380,"沈文婷你个大猪蹄子"
1380,"怎么愉妃又好了？"
1380,"五阿哥小燕子找你呢"
1381,"让我们嗨起来好吗"
1381,"当初悔不该救你们"
1381,"令母妃，好有爱的称呼"
1381,"哇哇哇哇蛙哥。。。你们给我站住"
1381,"永琪你以后会娶小燕子"
1381,"永琪我给你算一卦你此生有两情劫你媳妇叫小燕子和知画"
1382,"编剧让他活着必有大用...说不定还能写出下部攻略"
1382,"还不是因为你饼吃多了"
1382,"是挺大你们保养得不错还是原来的模样"
1382,"姐姐你眼光真好"
1382,"这样的愉贵人顺眼多了"
1382,"永琪不容易呀"
1383,"这个剧就是告诉我们太善良就会死"
1383,"你们都是大猪蹄子"
1383,"璎珞：五阿哥乖，等我给你找个小燕子！"
1383,"看到永琪突然想起来该看看环珠格格了"
1383,"令妃护五阿哥的时候还是个宫女"
1383,"是的，他就是妖物，只有小燕子镇的住"
1384,"看了那么多集最喜欢的还是魏璎珞饱满迷人的额头"
1384,"你们不要劝我善良我不听"
1384,"富察皇后：本宫走得早是要去投胎成知画的"
1384,"永琪你未来的媳妇叫小燕子"
1384,"不要怂大猪蹄子在你身后"
1384,"以后有个叫小燕子的，你要留心呀"
1385,"好可爱的永琪"
1385,"五阿哥乖～都这么大了，再过几年我让你滑玛带你去狩猎"
1385,"感觉愉妃在交代后事一样"
1385,"原来你是这样的皇后"
1385,"不是可能，是绝对"
1385,"他太可怜了"
1386,"不是魏璎珞只用了一年时间成为令妃吗，这孩子都这么大"
1386,"哇哥真可爱"
1386,"我还以为愉贵人要带他见纯贵妃"
1386,"本宫也要做出牺牲了"
1386,"蛙哥是好孩子"
1386,"五阿哥小燕子呢"
1387,"遇到劝你善良的人要离他远点小心他被雷劈时伤到自己"
1387,"五阿哥长得很帅啊！"
1387,"愉妃才是聪明呢"
1387,"阿哥演的好啊"
1387,"蛙哥长的不错"
1387,"蛙哥是好孩子"
1388,"五阿哥好呆萌，长大要离宫出走找小燕子呢"
1388,"永琪你媳妇叫小燕小燕子，记住，别把她绿了。"
1388,"永琪又可爱又懂事"
1388,"五阿哥好可爱"
1388,"小男孩好可爱"
1388,"五阿哥从小帅到大吗"
1389,"愉妃不是要儿子讨好一个人吗，估计这个人就是魏璎珞"
1389,"这个娃娃还挺乖哈"
1389,"后来得令妃是除了愉妃外最疼，最护着五阿哥的人"
1389,"所以，愉妃洗白了"
1389,"诸位：这剧情说的是没有自保能力的善良并不长远！"
1389,"永琪又可爱又懂事"
1390,"五阿哥长得好快"
1390,"永琪耳朵好大"
1390,"是啊，长得快极了跟吹的是的"
1390,"愉妃在交代身后事吗……"
1390,"永琪好优秀啊"
1390,"永琪，你的招风耳真可爱"
1391,"愉妃过了纯贵妃不知道嘛"
1391,"好可爱的蛙哥"
1391,"这孩子耳朵好大"
1391,"哇哥好可爱啊"
1391,"永琪好懂事啊"
1391,"永琪耳朵好大"
1392,"原来这和还珠格格可以连起来看……所谓的温柔都是骗人"
1392,"永琪从小帅到大"
1392,"五阿哥好可爱啊，小燕子等你长大"
1392,"五阿哥长得很像富恒啊"
1392,"五阿哥果然是要继位的，演员选的也可爱"
1392,"哇哥好可爱啊"
1393,"蛙哥好懂事好可爱"
1393,"永琪，尔康，小燕子，紫薇呢"
1393,"真的比那个傻蛋四阿哥强多了"
1393,"于是变成了小唐僧😂😂😂"
1393,"永琪长大了都跟小燕子私奔了，还孝顺个鬼"
1393,"哇哥好可爱"
1394,"看着令妃和蛙哥，感觉好亲切啊"
1394,"你长大后会爱上一个疯一般的女子"
1394,"真不知道愉妃是不是真的有那么好心，"
1394,"嗯蛙哥很乖很可爱"
1394,"就是，还不是因为你饼吃多了"
1394,"永琪，尔康，小燕子，紫薇呢"
1395,"完了愉妃托孤了怕是要去和纯妃PK了"
1395,"乖儿子，给你找个好媳妇，叫小燕子"
1395,"永琪活多大？"
1395,"永琪，以后遇上知画，一定要对她很好很好"
1395,"你可拉倒吧，你长大找的媳妇都要折腾死令妃了"
1395,"永琪长大后帅不帅"
1396,"刚才明玉气走的时候愉妃那句话就已经暗示了要拉纯妃下"
1396,"永琪真可爱，快让本宫好好瞧瞧"
1396,"永琪你四十多岁的时候就和小燕子私奔到中餐厅啦"
1396,"长大了，你就和小燕子私奔了，还指望你孝顺?"
1396,"这小永琪长得好像苏有朋…是巧合么"
1396,"你大了之后就有小燕子了，更操心"
1397,"永琪好懂事！"
1397,"不谢不谢，五阿哥以后记得疼本宫的转世就好。"
1397,"还孝顺，长大了就只知道小燕子"
1397,"难怪令妃对五阿哥那么好"
1397,"目前皇上儿子里最帅的了"
1397,"蛙哥真可爱"
1398,"蛙哥长得真快"
1398,"可别让小燕子烦我"
1398,"这孩子是挺可爱的，靠山是找对了"
1398,"五阿哥好呆萌啊！！！！！！"
1398,"这两只大耳朵好可爱"
1398,"永琪活了22岁"
1399,"五阿哥好可爱"
1399,"有朋长的好快啊"
1399,"难怪永琪和令妃关系那么好"
1399,"这是你未来大腿，抱好了千万别松手"
1399,"永琪都这么大了，尔康和紫薇小燕子尼？"
1399,"廖梦皮你也要孝顺我"
1400,"我璎珞听见有人要孝顺她，她还真是浑身不自在"
1400,"等着孩子长大后就管着你了"
1400,"永琪记住你以后还会有一个媳妇长的和富察皇后一模一样"
1400,"五阿哥就是不一样"
1400,"皇后和魏璎珞都是厉害人物只是两个方向不同"
1400,"这是你未来大腿，抱好了千万别松手"
1401,"能在后宫呆久的哪有好东西"
1401,"你大概小时候太老实了，长大才会娶小燕子"
1401,"历史上永琪很优秀的就是生病了才活了25岁"
1401,"唉，小燕子也这么大了呢"
1401,"我记得尔康和永琪一样大啊永琪生了尔康呢"
1401,"就你最不正经"
1402,"这部剧的孩子长的都好快呀"
1402,"我跟你说啊你以后要小心知画滋道不"
1402,"愉妃要把娃托付给璎珞了，马上放大招了，"
1402,"我猜五阿哥长大了会娶一位叫小燕子的格格"
1402,"五二哥好可爱呀，萌萌的"
1402,"长大了给我把小燕子娶回来，乖~"
1403,"永琪长大也蛮帅就是个子不高"
1403,"叫你起来就起来啊"
1403,"五阿哥好可爱好聪明"
1403,"永琪你的小燕子呢"
1403,"果然五阿哥是令妃带大的，有感情"
1403,"呵呵，亏你还记得"
1404,"令妃是希望五阿哥多不正经啊？"
1404,"记住，以后有一个叫苏有朋的人和你长得很像"
1404,"你那么大说话还不正经"
1404,"说好的好好孝顺呢，结果和小燕子私奔了"
1404,"这是给小燕子准备的听话郎君"
1404,"本可爱好像一件事也没做成"
1405,"难怪令妃会对五阿哥那么好啊"
1405,"这孩子这么帅还好当时本宫让她们救了"
1405,"这就是以后令妃对永琪那么好的原因吗"
1405,"有一个菇凉她有一点正经"
1405,"我去瑜妃变好了、"
1405,"记住，以后有一个叫苏有朋的人和你长得很像"
1406,"五阿哥跟小燕子私奔到法国开餐厅去了"
1406,"正经个啥，还不是带着小燕子跑路了"
1406,"邢瑞大猪蹄子"
1406,"是你不正经惯了"
1406,"蛙哥，你长大后会带着小燕子气你令母妃🌝"
1406,"本宫甚是欣慰"
1407,"原来这个就是喜欢小燕子的五阿哥，开始这名字听起好熟"
1407,"好孩子都有个好母亲，好家教"
1407,"愉妃好聪明"
1407,"就数我令妃最活泼"
1407,"永琪小的时候好可爱好聪慧"
1407,"正经个啥，还不是带着小燕子跑路了"
1408,"璎珞手里拿着容音的手串😭令后大旗扛起来！"
1408,"我这么大了说话都不正经，你这么小说话就这么正经"
1408,"永琪以后你的生命里会出现一个美丽的女人她叫小燕子"
1408,"你长大了可没少给你令母妃找事儿"
1408,"抱紧了令母妃带你飞"
1408,"永琪小的时候好可爱好聪慧"
1409,"五阿哥有一个好娘亲啊，把他教的这么好"
1409,"剧组的孩子都好乖好可爱啊"
1409,"你们这帮人真会省事，五阿哥直接变成哇哥了"
1409,"纯妃什么时候来陪本宫盒饭给你准备好了"
1409,"难道你们不觉得五阿哥长得像承欢格格吗"
1409,"你长大了可没少给你令母妃找事儿"
1410,"愉妃也是个明白人，知道谁更厉害"
1410,"你的小燕子给你安排好了"
1410,"哦原来这就是还珠的令妃五阿哥皇后啊真想看她们拍续集"
1410,"别说哇哥只活了25本宫也就四十几"
1410,"每次看到璎珞拿着富察皇后的手珠，都觉得很是感动"
1410,"哎哟真可爱"
1411,"看哇哥多可爱"
1411,"五阿哥这是你未来的靠山"
1411,"余诗曼演心机表最演的好"
1411,"眼神交流很到位，这演技真的可以"
1411,"我突然有个脑洞令妃让永琪娶知画是知画跟容音长一样？"
1411,"朕给你说，小五，你以后会喜欢小燕子"
1412,"永琪好懂事"
1412,"永琪，令母妃祝你长得越来越像苏有朋"
1412,"相信榆妃是好的"
1412,"你好好发育，以后会娶到富察皇后的转世"
1412,"让本宫高唱一曲。当山峰没有棱角的时候。当河水不再流"
1412,"等他遇到小燕子你就知道他懂不懂事了"
1413,"说永琪长大个子不高的，信不信苏有朋打你"
1413,"五阿哥，以后有个叫古巨基的人长得跟你也很像"
1413,"永琪是除了皇后生的嫡子外乾隆最喜欢的，可以命不长"
1413,"永琪，长大以后要小心一个女人，她叫小燕子"
1413,"哇哥你以后会有个媳妇是你阿玛的多皇后"
1413,"我告诉你哦，你以后会遇到个叫小燕子的"
1414,"难怪令妃对五阿哥那么好，那么好，原来是有原因的"
1414,"儿子真孝顺"
1414,"愉妃本来一直都是好的好不"
1414,"这小阿哥不错，长得真可爱"
1414,"感觉阿哥鞋子好大"
1414,"本宫本来有这么可爱的两个儿子的，都怪大猪蹄子"
1415,"发现这个剧最大的特色就是主子喜欢和贴身丫头说心里话"
1415,"妈呀好可爱这孩子"
1415,"愉妃被陷害了，被赶出去紫紧城了"
1415,"看你们一个个说的话你们才是演员"
1415,"五阿哥好贴心啊，娘亲教的啊"
1415,"儿子真孝顺"
1416,"我蛙哥呀……长大后记得对知话好点，要很好的那种"
1416,"本宫的儿子是不是很孝顺啊？"
1416,"还珠格格里温柔的令妃年轻的时候居然这么的自由不羁"
1416,"五阿哥从小就这么懂事"
1416,"愉妃长得好像张娅姝"
1416,"不知道说什么啊"
1417,"好可爱好懂事的小朋友"
1417,"今天也要绿绿的"
1417,"愉妃的家教挺好的，五阿哥好乖啊"
1417,"我咋成了知画了？"
1417,"蛙哥从小到大，有困难就找令妃娘娘"
1417,"愉妃把永琪教的很好啊"
1418,"永琪脚好大"
1418,"我劝我自己善良"
1418,"五阿哥好乖"
1418,"永琪样样都好可也活不过25岁"
1418,"永琪好可爱"
1418,"好可爱好懂事的小朋友"
1419,"不是五阿哥帅是苏有朋更帅哈"
1419,"朕的令嫔真是太可爱了"
1419,"谁跟你说根本不符合了？小说作为一种体裁，势必与历史有所不同，变化。但是它就是以历史原型为版。"
1419,"大猪蹄子呢？"
1419,"五阿哥好可爱啊"
1419,"我儿子就是棒"
1420,"好了，纯贵妃要领盒饭了"
1420,"小燕子飞五阿哥追阿康在家玩紫薇"
1420,"娃娃的鞋子好大哦"
1420,"五阿哥，一定要对知画好啊！"
1420,"五阿哥好可爱啊"
1420,"纯妃，今晚本宫送你上路"
1421,"愉妃好家教"
1421,"蛙哥快来看看小时候的你"
1421,"孝顺不了啊，你要陪小燕子闯天下"
1421,"你将来的媳妇是小燕子"
1421,"永琪又帅又乖啊"
1421,"疼死老娘了"
1422,"五阿哥好乖呀"
1422,"老娘以为要来讨好我呢"
1422,"长大后你也是个大猪蹄子"
1422,"盒饭吃完了，我什么时候上场"
1422,"五阿哥，你即将遇到你人生中最大的劫难"
1422,"愉妃好家教"
1423,"蛙哥好懂事"
1423,"莫名其妙想到了苏有朋"
1423,"瑜妃好慈祥的样子。"
1423,"以后他就是你儿子了"
1423,"好清秀的啊哥☺"
1423,"五阿哥好乖呀"
1424,"小娃娃长得好可爱"
1424,"你长大就去跟着小燕子跑了，怎么孝顺"
1424,"纯儿不会就是容嬷嬷吧"
1424,"这部剧这个瑜妃最讨人厌，高贵妃都比她可爱"
1424,"做母亲的都能理解瑜妃的爱子之心"
1424,"呕吼，我儿子最可爱了"
1425,"哇哥好可爱"
1425,"朕的儿子必须优秀"
1425,"没有太大气场"
1425,"尔晴，你的盒饭到了"
1425,"一直都对五阿哥好"
1425,"小燕子飞完五阿哥飞"
1426,"大猪蹄子别忘了大明湖畔的夏雨荷"
1426,"你们想多了，五阿哥只活到二十五岁"
1426,"愉妃其实是很好的只是无奈"
1426,"好可爱，本宫受不了了"
1426,"魏姐长的太像吉娃娃了了"
1426,"我长得像不像陈浩民"
1427,"明玉的表情亮了"
1427,"所以还珠格格里我对五阿哥那么好，是有原因的"
1427,"璎珞当奴才时的打扮更有气场"
1427,"快把本宫的小燕子娶回来"
1427,"永琪以后你还会遇见小燕子的"
1427,"你们想多了，五阿哥只活到二十五岁"
1428,"永琪说了句很有意义的话，愉妃很能忍，为反转铺垫"
1428,"五阿哥好可爱"
1428,"好聪明优秀的永琪"
1428,"五阿哥有点可爱"
1428,"难怪令妃对小燕子永琪那么好"
1428,"樱落不会就是还珠格格里面恶毒皇后，珍儿就是容嬷嬷！"
1429,"永琪太可爱了吧"
1429,"今天也是容音的头七啊"
1429,"蛙哥你的小燕子发货了"
1429,"苏有朋小时候原来长这样"
1429,"令妃是不是还珠格格的令妃啊"
1429,"翩翩最不一样！！！！"
1430,"皇后投胎成了知画因为前世太善良了所以投胎后做坏人"
1430,"本宫还有两个阿哥没生呢急什么😏"
1430,"愉妃好厉害"
1430,"你可是要遇上小燕子的人"
1430,"五阿哥吗，小燕子将是你未来的媳妇"
1430,"他成了位贵人。"
1431,"五阿哥好可爱啊"
1431,"好可爱的永琪呀"
1431,"活的潇潇洒洒接下去"
1431,"我有点疼，但是我还能忍"
1431,"永琪小时候还是蛮可爱的啊，"
1431,"陶星宇，今晚你喝高兴了吗😊"
1432,"五阿哥可真懂事，又乖，又聪慧，讨人喜欢😘"
1432,"等不及了！！！大猪蹄子！！放我出去男人都是大猪蹄子"
1432,"魏的嘴巴要那么刻意么"
1432,"五阿哥快点长大，让你的小燕子出来"
1432,"你会载在一个叫小燕子的玩意手上"
1432,"永琪小时候还是蛮可爱的啊，"
1433,"永琪是个你小燕子一起的啊，恩苏有朋演的帅"
1433,"我家永琪，超级可爱。"
1433,"总是觉得璎珞的气质压不住庄重的衣服"
1433,"不得不说，魏樱络的演技好做作"
1433,"永琪和小燕子好"
1433,"五阿哥以后要好好对知画"
1434,"愉妃看五阿哥的时候眼睛里有光"
1434,"愉妃家教好"
1434,"愉妃好温柔"
1434,"这个时候皇上应去了大明湖畔找了夏雨荷了"
1434,"五阿哥。你长大会进娱乐圈，成立的组合叫，小虎队"
1434,"快点更新，本宫还等着看还珠格格"
1435,"愉妃演得真好，那一眼多温柔可亲"
1435,"我今天好美"
1435,"愉妃长的好"
1435,"五阿哥，快去找你的小燕子吧"
1435,"用2倍看明玉走真的炒鸡可爱"
1435,"这个时候皇上应去了大明湖畔找了夏雨荷了"
1436,"头发上的戴的是肉肉嘛好可爱啊"
1436,"本宫才是主人"
1436,"感觉瑜妃好温柔啊"
1436,"我儿媳妇小燕子呢？？"
1436,"愉妃好温柔"
1436,"我们不一样!!!"
1437,"难怪令妃对五阿哥这么好"
1437,"下一集看我送纯贵妃上路"
1437,"永琪你还记得大明湖畔的小燕子吗"
1437,"五阿哥好可爱！！！！！！"
1437,"头发上的戴的是肉肉嘛好可爱啊"
1437,"愉妃好温柔"
1438,"我觉得娃哥他娘和和亲王的娘长得一摸一样"
1438,"尔康和尔泰呢？"
1438,"永琪说话好厉害"
1438,"愉妃好眼光啊"
1438,"令母妃你要好好疼五阿哥哦"
1438,"哇哥。好可爱"
1439,"蛙哥好懂事"
1439,"谁要和我一起过七夕？"
1439,"明玉好可爱，越来越喜欢了"
1439,"五阿哥长大了依然要令妃救啊😂太不省心了"
1439,"宇飞娘娘也美美的"
1439,"五阿哥是不是因为喜欢令妃所以后来喜欢小燕子啊"
1440,"哇哥真的好可爱呀"
1440,"策马奔腾，共享人世繁华，得架"
1440,"小燕子飞飞五阿哥追追尔康喜欢夏紫薇"
1440,"一个个过的不错嘛……"
1440,"看来现在还在看剧的都是单身狗吧"
1440,"蛙哥好懂事"
1441,"愉妃粉底有点厚～"
1441,"苏有朋绿了"
1441,"哇哥是认真的吗"
1441,"朕的夏雨荷呢"
1441,"皇上啥时候去大明湖畔"
1441,"蛙哥好可耐"
1442,"怪不得还珠里面五阿哥和令妃关系这么好"
1442,"过节去了吗"
1442,"璎珞每次说话张那么大的嘴干嘛"
1442,"五阿哥好可爱"
1442,"这孩子好懂事"
1442,"蛙哥好可耐"
1443,"感觉这是秦岚塑造得最完美的角色"
1443,"本宫要是知道你长大絮叨本宫，本宫就不接这活了"
1443,"为什么还珠格格里令妃对五阿哥那么好，不想自己孩子当"
1443,"我这么肤白貌美居然不受宠"
1443,"怪不得还珠里面五阿哥和令妃关系这么好"
1443,"璎珞每次说话张那么大的嘴干嘛"
1444,"蛙哥真可爱"
1444,"本宫何时出场"
1444,"五阿哥不错，加戏"
1444,"大嘴猴这是怎么了"
1444,"这剧成功就是因为每个人都很出彩别总是挑拨"
1444,"你的小燕子更不一样"
1445,"愉妃好温柔啊"
1445,"还记得我高可爱吗"
1445,"这句台词好耳熟阿"
1445,"本宫的儿子能不出色吗"
1445,"演尔晴这个演员叫什么名字？知道告诉我"
1445,"本宫何时出场"
1446,"愉贵人好温柔，好美"
1446,"怪不得五阿哥对令妃那么好"
1446,"愉妃就是在交代后事"
1446,"明玉的表情很可爱"
1446,"女本柔弱为母则刚"
1446,"朕的儿子，当然优秀"
1447,"明玉的眼神好可爱啊"
1447,"永琪活下来真的不容易"
1447,"明玉演得好，一副怨愤的样子"
1447,"我儿子是所有阿哥里最帅的"
1447,"说小燕子的你们是认真的吗"
1447,"这奴婢是怎么了"
1448,"璎珞大概是明白了愉妃的本意"
1448,"愉妃演技不错啊"
1448,"明珠的样子好可爱"
1448,"看了看我其实最善良"
1448,"以后你和小燕子别气你的母妃就好了"
1448,"好早熟的孩子"
1449,"长大了就开始管着你令母妃不让吃吃吃"
1449,"明玉表情好可爱"
1449,"永琪好可爱"
1449,"什么时候能让皇后领盒饭"
1449,"是不是有很多男人也在看这部女人电视"
1449,"我什么时候领盒饭"
1450,"好大的风啊"
1450,"永琪你要记住你未来媳妇儿叫小燕子，别搞错了"
1450,"璎珞长得就像淋了雨的猫"
1450,"这五阿哥长点有点像我"
1450,"大嘴猴看起来有些不开心"
1450,"小燕子紫薇晴儿尔康，你们快来"
1451,"愉妃是好人"
1451,"你们都是大猪蹄子，都忘了本宫了"
1451,"五阿哥才没死，25岁和小燕子幸福去了！"
1451,"这孩子黄黄的嘴倒挺甜"
1451,"接下去的剧情请大家看还珠格格"
1451,"明玉宝贝又不开心了"
1452,"愉妃要舍身取义吗？"
1452,"本宫就是这么耐看"
1452,"这永琪五阿哥是还珠格格里小燕子一个人吗！"
1452,"本宫什么时候出来"
1452,"永琪在历史上也是极尽孝道之人"
1452,"永琪真会说话"
1453,"五阿哥永琪长的好可爱啊"
1453,"在抖音里刷到了明玉，真是可爱极了"
1453,"愉妃不和纯妃好了吗"
1453,"本宫不会是在交托后事吧，不敢相信"
1453,"孝顺个啥呀还不是跟个女人跑了"
1453,"看把明玉给气的，都快变成小包子了"
1454,"知画才是永琪的真爱"
1454,"有儿子就是好"
1454,"为什么叫五阿哥蛙哥呀"
1454,"还是五阿哥孝顺"
1454,"五阿哥，长大后要好好对小燕子"
1454,"看把明玉给气的，都快变成小包子了"
1455,"明月好可爱，我好喜欢"
1455,"明玉好可爱，心直口快，有什么都写在脸上"
1455,"哇哥好可爱"
1455,"蛙哥好乖啊☺"
1455,"小明玉太可爱了"
1455,"知画才是永琪的真爱"
1456,"明玉嘴好大"
1456,"完了圈粉了想看皇后的戏"
1456,"哇哥好乖啊"
1456,"呜哇哥好像活不长〒_〒"
1456,"可以永琪只活了25岁，愉贵人却活了78岁"
1456,"e눈_눈您的好友【节操君】已下线！"
1457,"现在你是小猪蹄子，以后你是大猪蹄子"
1457,"宝宝不开心，这后面这么好玩，竟然让我领盒饭了"
1457,"永琪都这么大了皇上怎么还不去大明湖"
1457,"永琪你情商这么高,长大怎么倒退了"
1457,"现在小燕子也这么大"
1457,"有朋辛苦了"
1458,"蛙哥是这里面最帅的阿哥了"
1458,"好可爱的永琪，好乖"
1458,"明玉说得好"
1458,"小时候的头发是头顶一坨，而现在后脑勺打这么长的辫子"
1458,"明玉:我就是这么可爱"
1458,"我们包场了耶耶耶"
1459,"蛙哥好可爱，还这么懂事"
1459,"五阿哥好可爱"
1459,"永琪好可爱"
1459,"朕这个大猪蹄子就是喜欢你这样的人儿"
1459,"富察皇后的手串是主角，到现在令妃手上都戴着呢"
1459,"好可爱的永琪，好乖"
1460,"五阿哥好可爱啊"
1460,"永琪记住:你的妻子叫小燕子"
1460,"怪不得皇后欺负小燕子紫薇的时候令妃那么护着"
1460,"这就有点尴尬了，咳咳咳"
1460,"可惜五阿哥20多岁就挂了。。。天妒英才啊。。"
1460,"五阿哥好可爱"
1461,"抖音里明玉弹吉他🎸唱歌很好听的，撒fafa"
1461,"大嘴猴嘟嘟嘴好可爱"
1461,"大嘴猴明玉好可爱"
1461,"哈哈哈本宫的明玉最可爱"
1461,"明玉太可爱了。笑死我了"
1461,"不用不用，你长大了好好照顾小燕子就好了"
1462,"苏有朋：我来看看自己小时候有多么可爱"
1462,"明玉小姐姐唱歌很好听哦！"
1462,"让本宫瞧瞧这孩子倒是有点像我弟弟富恒"
1462,"我明玉真可爱"
1462,"哈哈哈本宫的明玉最可爱"
1462,"抖音里明玉弹吉他🎸唱歌很好听的，撒fafa"
1463,"哈哈哈哈明玉好可爱"
1463,"哇哥，这称呼有意思"
1463,"五阿哥聪明啊，怪不得都喜欢他"
1463,"璎珞难道是还珠格格里面的令妃永琪就是五阿哥吗"
1463,"现在丫鬟的脾气都这么大么？"
1463,"明玉太可爱了"
1464,"对啊，她以后会有最尊贵的阿哥孝顺"
1464,"这么多年也就这一身衣服"
1464,"为啥璎珞皇上宠幸这么久还没有孩子？"
1464,"你还是那么耿直"
1464,"明玉很可爱的"
1464,"哈哈哈哈明玉好可爱"
1465,"明玉醋死了好可爱啊哈哈哈哈哈哈"
1465,"五阿哥都这么大了朕早就去过大明湖喽"
1465,"蛙哥好懂事啊"
1465,"明玉你能不能走点心"
1465,"这丫鬟说话真不招人待见...富察就不喜欢她"
1465,"对啊，她以后会有最尊贵的阿哥孝顺"
1466,"五阿哥一看就和平常阿哥不同啊"
1466,"七夕单身狗当然要追剧了而且今天是本宫的头七"
1466,"不是永琪是太子吗怎么会是永琰为太子？？？"
1466,"我把你打入辛者库信不信？"
1466,"还珠格格令妃身边的丫头叫明月彩霞是吗"
1466,"啧啧啧，真热闹……"
1467,"明玉好可爱怎么看都可爱"
1467,"小燕子何时出来"
1467,"对明玉太单纯了"
1467,"这孩子心机深沉"
1467,"小燕子不知道在哪练杂技呢"
1467,"五阿哥一看就和平常阿哥不同啊"
1468,"都这么久了，魏贵人竟然还没怀上"
1468,"明玉你又开始犯病了"
1468,"大嘴猴，好可爱"
1468,"想知道口红色号"
