time,content
1287,"演凤囚凰的太后印象深刻"
1287,"莞莞的声音"
1287,"大猪蹄子我只想到了贤佑"
1287,"放手，你刀拿反了"
1287,"演员看的是演技好吗"
1287,"我这暴脾气"
1288,"特别喜欢烽火佳人，很喜欢她和舒畅两人演对手戏"
1288,"你个大猪蹄子"
1288,"这么刚不是主角光环能活？"
1288,"马上放开了手毫不掩饰"
1288,"上一休四啊这么好的工作啊"
1288,"别太得意了魏璎珞"
1289,"说得好解气"
1289,"哈哈表情无敌了"
1289,"泡了姐姐还想泡妹妹"
1289,"璎珞的配音是季冠霖老师呀"
1289,"衣服的吊牌都没有剪下来么😂"
1289,"侍卫像做贼似的"
1290,"学了一招，说话声音大就能吓到对方哈哈😄"
1290,"大猪蹄子你快说点什么"
1290,"表情用得着这么用力吗？看着脸都跟着不舒服了"
1290,"帽子上的百奇看起来很好吃"
1290,"这里面的演员演得太刻意了"
1290,"泡了姐姐还想泡妹妹"
1291,"她在烽火佳人是一人分饰两角，一好一坏，好的出场惊艳"
1291,"这个班舒服啊"
1291,"这是后期的配音呀，如果同期声就不会那么出戏"
1291,"等一个真香"
1291,"感觉璎珞的脸好小啊，好瘦"
1291,"莫名感觉有点丑。"
1292,"璎珞本就是为报仇而来，怎么会有好脾气到处讨好？"
1292,"我就喜欢这暴脾气"
1292,"璎珞长得真的是一般"
1292,"还想姐妹通吃？"
1292,"这个侍卫也太瘦了，衣服都撑不起来"
1292,"吴谨言演技还是不错的"
1293,"不怕表情学人家，最怕拿没表情当演技好吗"
1293,"快放开你的大猪蹄子"
1293,"璎珞好可爱"
1293,"你喜欢大海我爱过你"
1293,"好大的眼睛"
1293,"男人都是大猪蹄子"
1294,"说话声音好大啊，她不怕被人听到吗"
1294,"璎珞说话嘴巴张那么大，太出戏了"
1294,"璎珞就是为了演这部戏才瘦成这样的"
1294,"男人就是大猪蹄子"
1294,"好可爱的表情"
1294,"这人长得像冯远征"
1295,"这段表演要情绪激动表情用力一点是正常的"
1295,"姐姐被姑姑吃了"
1295,"她们拍这个戏的时候正好最热的时候，好几场有40多度"
1295,"上1休5真好"
1295,"五天才上一次班好幸福"
1295,"这刀拿的太过分了哈"
1296,"你才是大猪蹄子你全家都是大猪蹄子！"
1296,"玲珑，我劝你善良"
1296,"主角光环太强大了，戏可真多，莫名其妙的烦她"
1296,"二刷的有吗"
1296,"感觉她演技太过了。入戏太深啦！眼睛嘴巴抢戏了"
1296,"五天才上一次班好幸福"
1297,"说话好气势"
1297,"佩服自己说话一直不眨眼"
1297,"配音比演技都好"
1297,"主角真的不知道说什么好！！"
1297,"我劝你善良"
1297,"啊，好紧张"
1298,"衣服上的牌子换成一块玉就好了"
1298,"璎珞脾气好大呀"
1298,"行行行，我做你丈夫行了吧"
1298,"这戏服是不是租的全新的感觉好像标牌没拆一样哈哈"
1298,"这侍卫不是相好她姐吗，连他姐都不照顾，来照顾她？"
1298,"确实浮夸啊，眼瞪那么大。"
1299,"最新的宫心计不就是找姐姐"
1299,"这衣服料子很好哟"
1299,"要不是主角，怕是活不过两集"
1299,"眼睛瞪的那么大"
1299,"我才那个婴宁是不是因为知道了贵妃该死了皇后的儿子，"
1299,"演技真的很好啊"
1300,"这个男人也不是什么好东西"
1300,"你说嘴巴嘟嘟嘟嘟嘟，嘟一下你就回来啦"
1300,"璎珞的配音好听"
1300,"嘴巴奇怪啊那么大"
1300,"璎珞嘴巴为什么张得那么大"
1300,"要不是主角，怕是活不过两集"
1301,"璎珞长得好像周迅啊"
1301,"朕要好好读书"
1301,"大猪蹄子什么意思"
1301,"璎珞怎么有点像金星，我一直会出戏，对不起"
1301,"保安都这么高级了"
1301,"这个侍卫为什么总有公公的即视感"
1302,"看了第二遍还是不错，感觉挺好，这个人只有这一次露脸"
1302,"一个普通的人，没有底，怎么会那么有底气，不符合逻辑"
1302,"估计这是大热天拍的戏"
1302,"这样性格，经历的人，没有表情是很正常的"
1302,"长得很像安嘉和"
1302,"这个侍卫为什么总有公公的即视感"
1303,"季冠霖的配音好吗，不是乔诗语"
1303,"你斗得过我吗"
1303,"姐夫可还行"
1303,"还想姐妹通吃"
1303,"衣服是棉麻的"
1303,"我喜欢璎珞这么说话"
1304,"新衣服吊牌没扯"
1304,"想起了雪姨"
1304,"樱诺的配音和芈月是一个人"
1304,"姐夫这宫廷局太现代化了吧"
1304,"季冠霖配音的"
1304,"演的有点夸张"
1305,"魏璎珞太主角光环了吧，像她这样在宫里活不过一集好嘛"
1305,"真是蠢钝如猪啊"
1305,"不然看一集最多"
1305,"眼睛瞪得有点大"
1305,"璎珞被陌生人拉走还不喊？？"
1305,"侍卫是妖帝旁边的"
1306,"哪像陈晓了，陈晓比他帅多了好吗，啥眼神呢"
1306,"本宫运气每次都这么好"
1306,"樱诺啊，表情能柔和一点不，看得想打人"
1306,"讲真，感觉璎珞看起来不是很善良"
1306,"不明白哪来的自信"
1306,"说猪蹄子就想起乔爸了"
1307,"璎珞当了主子后也不是什么好货色！看他说是的样子！"
1307,"妈耶还有约会这一说"
1307,"演技真的很好啊，不错不错"
1307,"男人就是大猪蹄子"
1307,"感觉这侍卫好痞"
1307,"哈哈哈璎珞的白眼太可爱了吧"
1308,"为啥不找好的演员演"
1308,"一群傻子哎没救"
1308,"浮夸？我觉得演得很好👌"
1308,"生气才会瞪眼睛"
1308,"那个时候还有约会这个词？"
1308,"这剧到底谁是主角"
1309,"性格相差好大"
1309,"来人拉出去～"
1309,"不是我一个人觉得演技有点夸张感觉她好尖酸刻薄相"
1309,"还有约会一词啊，清宫戏改穿越了？"
1309,"不觉得瞪眼睛像孙俪瞪眼睛？"
1309,"璎珞挺好的有些人能不能别喷了"
1310,"大猪蹄子是说男人都不是好东西"
1310,"方姑，你搞错了！"
1310,"她姐姐是怎么死的呀"
1310,"能不能演出自己的本色"
1310,"这个长相根本不像主角"
1310,"演技浮夸，"
1311,"这个侍卫演的很好啊，眼神飘忽不是好货"
1311,"人物性格演得很好了"
1311,"别躲在里面不出声，我知道你在家"
1311,"这台词他现代了吧"
1311,"傅文佩你给我出来😂"
1311,"哥哥，弟弟"
1312,"你们这么厉害怎么不是你们来演？"
1312,"方姑姑你个大猪蹄子还偷看"
1312,"这敲门的声音语气怎么那么像雪姨叫傅文佩啊哈哈哈哈"
1312,"在宫里那叫私会"
1312,"说像晓的站住，什么眼光。真的是哪里像了"
1312,"男配二十三号成功了"
1313,"璎珞好瘦啊"
1313,"方姑姑，你等着，等本宫普升为妃，我……"
1313,"璎珞这演员也是演的太过了"
1313,"她怎么知道在这，woc！"
1313,"人家生气演夸张点怎么了？"
1313,"侍卫演的跟流氓一样"
1314,"人情绪高涨的时候，就是容易控制不住自己的表情，正常"
1314,"璎珞演技是学的孙俪的，但没有孙俪收放自如，稍显夸张"
1314,"比守护丽人的时候演得好"
1314,"不是季冠霖好吗"
1314,"演技也好不太爱的不看呗吐槽啥"
1314,"怎会有约会这个词"
1315,"该重的不重，不该重的讲话太重了"
1315,"那叫私会，那时候没有约会这词儿"
1315,"果然是，新衣服。"
1315,"好喜欢璎珞的性格"
1315,"这你都找得到"
1316,"厉害厉害👍"
1316,"约会这个词"
1317,"这地方像晴川住过的地方"
1317,"世卫演的像个小流氓一样"
1317,"佘诗曼呢，为了佘诗曼来的"
1317,"怕是，嫉妒哦！这姑姑"
1317,"能不能好好说话"
1317,"陈晓＋周冬雨"
1318,"魏璎珞这张扬的性格如不是有主角光环早就该领饭盒了。"
1318,"看过守护丽人她演的猪七七没有"
1318,"哇，太大胆了吧"
1318,"出来啊出来啊"
1318,"古代有约会吗"
1318,"怎么都不拆标签的"
1319,"妈妈来啦可爱"
1319,"有些人就喜欢看傻白甜"
1319,"不是该说私会吗"
1320,"侍卫表情就是个流氓吧"
1320,"我家梦杭是小猪蹄子"
1321,"非常好的演技"
1321,"那时候有约会这说法？"
1322,"呃着光环怕是能上天"
1322,"来来来，打一架吧"
1322,"非常好的演技"
1323,"哦对我就说眼熟。原来是朱七七"
1323,"这是尔康他爹啊"
1323,"魏姐要打人了"
1323,"咳咳，不会这都认不出来吧，这……"
1323,"咋觉得这皇后有点抑郁啊"
1324,"哈啊哈哈哈哈啊哈哈哈好厉害，还敢打姑姑还把脑袋蒙上"
1324,"打的好打的妙啊"
1324,"哈哈，机智如我"
1324,"哈~厉害了"
1324,"这怂货能是男二？"
1324,"他们是怎么关门的"
1325,"她是不要命了吗，敢打好姑姑"
1325,"还好我聪明"
1325,"这可以在宫里活得下去？"
1325,"厉害了，璎珞，下手挺狠"
1325,"这太猛了吧，内宫里都这样的啊"
1325,"哈~厉害了"
1326,"主角好厉害呀！"
1326,"璎珞怼天怼地怼姑姑"
1326,"妈呀厉害了"
1326,"别躲在里面不出声"
1326,"什么情况？"
1326,"这可以在宫里活得下去？"
1327,"这波操作厉害"
1327,"厉害姑姑都敢打"
1327,"哇胆子真大"
1327,"她这么厉害吗"
1327,"这璎珞演技有点太过用劲了吧"
1327,"璎珞怼天怼地怼姑姑"
1328,"wdf，厉害了啊，主角光环强大"
1328,"主角光环也太强大了"
1328,"哈哈哈哈,好样的,这剧不错"
1328,"哈哈哈厉害了"
1328,"晴川战斗过的地方"
1328,"这波操作厉害"
1329,"好厉害不会怎么样吗"
1329,"璎珞，你太棒了！本宫就让尔晴当你姐姐吧"
1329,"厉害了厉害了哈哈哈"
1329,"混账东西，混账东西"
1329,"是感觉像谁突然像起了金星"
1329,"我靠，这么猛"
1330,"好可爱的贼喊捉贼"
1330,"我就是这么6"
1330,"魏樱珞霸气啊这剧追定了"
1330,"s哈哈😄笑死我了出乎意料啊给力"
1330,"厉害厉害👍"
1330,"看到第三集觉得这部戏是喜剧吗？"
1331,"说面无表情的难道是要装可爱吗"
1331,"打打打，打她使劲儿～"
1331,"这波操作厉害了，我劝你们都善良"
1331,"好可爱的贼喊捉贼"
1331,"我就是这么6"
1331,"厉害厉害👍"
1332,"编剧喝多了写的吧"
1332,"打得太爽了"
1332,"打得好打得好"
1332,"主角这样也能活下来那真是让人无语了…"
1332,"演技真好，呵"
1332,"主角厉害了"
1333,"这宫女厉害厉害"
1333,"这个贵妃真的是毫无灵性的一双眼睛"
1333,"哈哈哈太猛了"
1333,"令人窒息的操作"
1333,"挺喜欢她演的魏璎珞"
1333,"打得好打得好"
1334,"对她好的不是这个，怎么看剧的"
1334,"这个女人不简单，有头脑"
1334,"皇后的气质真好"
1334,"宫心计2也是进宫为姐姐报仇，哎，创新呢？"
1334,"胆子这么大？"
1334,"璎珞也是个狠角色"
1335,"哈哈，好厉害"
1335,"不太符合实际"
1335,"可爱的贼喊捉贼"
1335,"这是另外一个姑姑好吗，←_←"
1335,"古代也叫姐夫吗"
1335,"这是小燕子吗"
1336,"和珅是真的杰克苏人设、各方面堪称完美的男人"
1336,"不愧是朕的女人"
1336,"好厉害呀，果然不是傻白甜看着好过瘾……"
1336,"分不清方姑姑和张麽麼的人损失"
1336,"我觉得璎珞这样半集都活不下去"
1336,"不是那个姑姑"
1337,"好玩了好玩了"
1337,"演技傍身,打遍天下也不怕"
1337,"瘦的跟骨架似的"
1337,"皇后不是以前还珠格格的令妃吗"
1337,"我去厉害了"
1337,"本宫就是故意的"
1338,"写得也太厉害，能横行宫里"
1338,"我就是这么厉害"
1338,"这是主角光环过于强大了吧"
1338,"主角光环也太强了吧有点夸张了"
1338,"混账东西厉害了"
1338,"主角太厉害了"
1339,"哈哈哈哈璎珞好厉害"
1339,"有些人是不是姑姑跟嬷嬷分不清?rz"
1339,"感觉璎珞长得像金星，"
1339,"贼喊捉贼，太好了，早就该教训这个方姑姑了"
1339,"得罪姑姑，不想活了"
1339,"太厉害了。聪明"
1340,"厉害了厉害了，打得好"
1340,"主角光环你们没有"
1340,"方姑姑好眼熟"
1340,"惊不惊喜，意不意外"
1340,"不错有仇当场就报了"
1340,"不是同一个姑姑好吧"
1341,"这里不是那个好的姑姑好吗？有两个姑姑，你们脸盲？"
1341,"糟了，摊大事儿了。"
1341,"姑姑和嚒嚒不同好不能不能看明白"
1341,"姑姑脸好长"
1341,"用鼻子看剧吗。一个姑姑一个嬷嬷，而且长的也不一样啊"
1341,"厉害了厉害了，打得好"
1342,"那个对璎珞好的叫张麼麽好吗，连人物都记不住"
1342,"为什么姑姑态度变了好快"
1342,"姑姑和嬷嬷不是一个人看清楚好吧？？？"
1342,"厉害了厉害了厉害了"
1342,"这个不是对他好的那个姑姑是脸盲吗？"
1342,"这是另一个姑姑啊，看清楚"
1343,"你们怎么看的剧？说姑姑变好了，压根就是两个姑姑，"
1343,"天呐姑姑是坏人嬷嬷是好人好吗？不是同一个人"
1343,"这个姑姑是吃骨灰那个你们眼睛咋长的"
1343,"这个姑姑不是绣坊的姑姑好嘛"
1343,"这个宫女还能活"
1343,"不是一个人好吧"
1344,"你们是真的眼盲啊，不是一个姑姑好吗，那个是嬷嬷"
1344,"机智反应好快"
1344,"那个是馍馍，这个是姑姑，不一样的，认真看剧好么"
1344,"锦绣好眼熟啊"
1344,"璎珞表情好可爱[微笑]"
1344,"姑姑和嬷嬷是两个人好吗"
1345,"不是同一个姑姑，说什么姑姑变好了？看剧走点心吧"
1345,"看到没，我打得多好，来劲儿啊"
1345,"这么聪明怎么不知道衣服是方姑姑的"
1345,"傻子诶，这个是姑姑，对她好的是馍馍，能走点心吗"
1345,"姑姑和磨磨不一样好吧"
1345,"麽麽跟姑姑分不清你们眼神是真好"
1346,"对她好的是那个嬷嬷，衣服和姑姑一样而已"
1346,"哎呀姑姑怎么会是你啊"
1346,"长得好像杨蓉"
1346,"我可真会逢场作戏"
1346,"这个侍卫瘦不拉几"
1346,"我劝你善良"
1347,"对她好的是馍馍不是姑姑，有的人会不会看剧啊"
1347,"哇塞，，魏璎珞太厉害了，打的好！"
1347,"分不清方姑姑和张麽麼的人是否该去瞧一下眼疾了"
1347,"哈哈我好聪明"
1347,"嬷嬷和姑姑都分不清哎你看的是什么呀"
1347,"哎呀姑姑怎么会是你啊"
1348,"演员好几个眼睛里空的嘴一遮看眼睛根本看不出情绪"
1348,"对她好的是麽麽不是姑姑"
1348,"这是方姑姑，好的那个是张嚒嚒，怎么看电视的你们"
1348,"确认过眼神，是个大戏精"
1348,"你们到底是怎么看电视的姑姑麽墨分不清么"
1348,"灵柏托梦让我揍你！"
1349,"戏精啊戏精😂"
1349,"我喜欢两次攻击，一次打在你身上，另一次打在棺材上。"
1349,"对她好的是张嬷嬷不是方姑姑"
1349,"那个是嬷嬷"
1349,"衣服也能认出是姑姑级别啊，演的好久"
1349,"确认过眼神，是个大戏精"
1350,"这么明显的衣服，一看就是管事的，居然说没认出来……"
1350,"没错我就是无辜"
1350,"确实好聪明"
1350,"我像陈晓，哪里像金星？"
1350,"对他好的是麽麽，不是姑姑，二货"
1350,"戏精啊戏精😂"
1351,"戏精本精了哈哈"
1351,"锦绣什么时候领盒饭"
1351,"演戏哪家强"
1351,"嬷嬷对她超好"
1351,"姑姑咋长得都一样"
1351,"对他好的是麽麽，不是姑姑，二货"
1352,"红姐，我劝你善良啊"
1352,"你看我怎么秀你一脸"
1352,"那个长的好像杨蓉"
1352,"璎珞挺美的啊"
1352,"这部剧的滤镜就是这个年代感"
1352,"侍卫左耳是打了耳洞吗"
1353,"这个是吃她姐骨灰的姑姑对她好的是嬷嬷"
1353,"朕的令妃就是厉害啊"
1353,"亲啊是一个姑姑，一个是嬷嬷"
1353,"装傻才能走到最后好吗！"
1353,"这部剧不一般，值得追"
1353,"红姐，我劝你善良啊"
1354,"红姐多活几集啊"
1354,"不记得这个人的名倒记住她是吃骨灰的那个了"
1354,"衣服都不一样好吧"
1354,"光看衣服也知道是姑姑了吗"
1354,"这衣服一看就是姑姑啊还打"
1354,"厉害了哈哈"
1355,"像她这么作正常都活不过两集"
1355,"呀！姑姑是你呀！怎么不早说23333"
1355,"都是嬷嬷跟那个差别这么大"
1355,"这姑姑不是个好东西"
1355,"这剧是机智的宫中生活哈哈哈哈"
1355,"那个是麽麽年纪大啊"
1356,"脸盲的可真多，嬷嬷姑姑分不清"
1356,"主角和配角都是锥子脸，下巴都好尖噢"
1356,"牛鼻子玲珑一看就不是好货"
1356,"这个方姑姑是之前对璎珞好的姑姑吗?怎么不像呢"
1356,"方姑姑：哎呦我去，都被打得腰间盘突出了"
1356,"都是嬷嬷跟那个差别这么大"
1357,"人家的礼仪比你家强太多，被掌嘴还有脸活着"
1357,"一个是姑姑一个是嬷嬷差距怎么这么大"
1357,"姑姑长的像开心麻花那个谁"
1357,"主角光环就是厉害"
1357,"方姑姑我劝你善良"
1357,"哎细节经不起推敲走了走了"
1358,"佘佘戏份可以多点吗"
1358,"这个主角心眼子太多"
1358,"主角光环太重"
1358,"不是三个耳洞，耳夹耳夹知道吗？不知道的了解一下"
1358,"这个姑姑还挺厉害的"
1358,"主角光环啊！没有璎珞解决不了的事情"
1359,"锦绣什么时候领盒饭啊，真的是没眼看"
1359,"臣妾太厉害了，谁让这位大妈多管。"
1359,"这个玲珑一看就不是什么好货"
1359,"没有主角光环根本活不过两集"
1359,"演技在疯狂的飚着"
1359,"这个宫女真是剑走偏锋呀这么也行？"
1360,"还以为腰打好了"
1360,"用来干什么呀，死的远远的"
1360,"红姐劝你善良"
1360,"这性格解气啊"
1360,"这是现代剧吗"
1360,"这脸咋那么怪呢！😂"
1361,"这么点宫女真么有性格？？嫌命长？？"
1361,"这个姑姑怎么一会善良一会。。"
1361,"主角光环好闪亮啊"
1361,"玲珑什么时候死"
1361,"开始飙演技"
1361,"这个不是对她好的那个姑姑、另外一个啊"
1362,"当所有人傻子主角任性玩啊"
1362,"这个玲珑也不是什么好东西"
1362,"姑姑长得像张紫妍"
1362,"这该不是和深宫计2一样，最后她姐姐是皇上派人杀的吧"
1362,"这剧里面的妆，眉毛画的太好了！！"
1362,"那几个都不是啥好东西"
1363,"这个长得像陶红"
1363,"只有我觉得方姑姑和刘维很像吗😁"
1363,"长得像郑希怡"
1363,"心机太厉害了"
1363,"为了这个戏好多演员都扎了三个耳洞也是蛮拼的"
1363,"这个姑姑长的好像梁xy"
1364,"对她好的是张嬷嬷，不是方姑姑"
1364,"有主角光环就是厉害，这样还不死"
1364,"这姑姑长得像郭晶晶"
1364,"真聪明，戏精啊"
1364,"演技太好了红红火火恍恍惚惚呵呵哈哈哈哈哈哈"
1364,"宝宝就是这么聪明"
1365,"方姑姑你是李冰冰变得吗？太像了！你是她亲姐姐吧哈哈"
1365,"不知道你们怎么看电视的，这个姑姑都不是好的那个姑姑"
1365,"大猪蹄子是什么意思"
1365,"祝红，原来是祝红，我就说咋那么眼熟呢😊"
1365,"主角光环厉害了"
1365,"方姑姑我劝你善良"
1366,"这个姑姑不是那个姑姑啊喂各位你们脸盲吗"
1366,"好生聪明机智啊！"
1366,"太扯了，这样得罪顶头上司根本活不下去"
1366,"肯定要说来着上厕所，以为有人偷看，哈哈"
1366,"天啊，一部没有逻辑的剧情"
1366,"哇哇哇哇这是梅姐姐么"
1367,"主角就是厉害皇上他都能打"
1367,"姑姑我劝你善良"
1367,"真的能活吗这样"
1367,"厉害了，，"
1367,"这姑姑是宫里欺负晴川的那位吧啊哈哈哈"
1367,"一群小菜🐔"
1368,"谁说锦绣像杨蓉啊，她和杨蓉能比吗，人家杨蓉长相甜美"
1368,"看这骄傲样"
1368,"一个磨磨一个是姑姑都分不清楚醉了在看什么"
1368,"红姐我劝你善良，能多活几集😂"
1368,"璎珞长得很像周迅啊"
1368,"不怕姑姑来的是两个人"
1369,"这不是之前那个好吗"
1369,"好浮夸的演技"
1369,"这人怎么都长一样"
1369,"刚开始演的好好的突然浮夸起来"
1369,"她们头上的花是用毛条做的吗？！"
1369,"这演技好浮夸..."
1370,"好剧能不能搭配好演员啊，唉"
1370,"红姐过分了啊"
1370,"看璎珞总有zly的感觉，是楚乔传的配音吧？"
1370,"我忍不住大笑出猪声"
1370,"这个姑姑不都是三个耳洞吗"
1370,"姑姑好像郭晶晶啊"
1371,"告状的那个不是好东西"
1371,"6个耳洞看着都疼"
1371,"这个姑姑是不是唐朝好男人里面演公主那个"
1371,"我就是六个耳洞一个耳朵有三个耳洞"
1371,"不是这个姑姑对她好"
1371,"看璎珞总有zly的感觉，是楚乔传的配音吧？"
1372,"还好古时候没有监控😂"
1372,"尤长靖是可爱的大猪蹄子[000]"
1372,"主角光环太强大哈哈"
1372,"法令纹太深"
1372,"怎么这么多坏女人啊。。。"
1372,"玲珑太挖心了"
1373,"红姐反派不适合你"
1373,"璎珞，我劝你善良"
1373,"这么多人没围住一个侍卫？"
1373,"香港片子的既视感"
1373,"姑姑很好的呀？"
1373,"原来是故意装傻打人"
1374,"开头还以为玲珑是好的，没想到啊没想到"
1374,"主角光环好强大"
1374,"就这样的，在宫里估计就能活一集"
1374,"脸盲症的么说话"
1374,"不是这个姑姑"
1374,"红姐反派不适合你"
1375,"我劝你善良"
1375,"编剧很有想法"
1375,"太聪明了吧？"
1375,"主角光环太强大，古代不是等级深严吗？"
1375,"她们也带三个耳环啊"
1375,"竟然都带了三对耳环"
1376,"厉害厉害把姑姑打了还能这样"
1376,"红红你怎么变这样了"
1376,"这是两害相较取其轻吗"
1376,"这个方姑姑好眼熟、"
1376,"红姐我劝你善良啊哈哈哈哈"
1376,"令妃的智商了解一下"
1377,"敢这么说皇上！也太大胆了吧！"
1377,"五天才值一次班啊。这是做一休六啊"
1377,"这么厉害。"
1377,"这是不是主演丫头逆袭的，，😂😂"
1377,"真傻，还真的等着你进去找啊"
1378,"好像真的是翰轩棋社的老板娘"
1378,"一演戏马上就夸张了，平时都很沉稳"
1378,"朕的爱妃厉害"
1378,"是时候展示真正的主角光环了"
1378,"感觉都是真的打了三个耳洞哎"
1378,"玲珑也太坏了"
1379,"为啥带这么多耳环"
1379,"这个姑姑不错"
1379,"就说想谁，原来是卫良人"
1379,"姑姑为什么一个人来"
1379,"人家那是骨灰"
1379,"嘴巴好夸张"
1380,"还好古代没有监控"
1380,"女人事真多"
1380,"看到姑姑耳朵上3个洞莫名心疼"
1380,"这璎珞没有一句实话"
1380,"杨蓉是你吗"
1380,"这剧自带加速的吗？"
1381,"这姑姑是章子怡的大嫂演的"
1381,"姐姐我聪明绝顶"
1381,"调监控看看"
1381,"红姐……你让我多看几集吧"
1381,"这要是门外一堆人该怎么办"
1381,"第一次追剧，有点意思"
1382,"这点过瘾！看玲珑吃瘪的样子！"
1382,"这个锦绣走路也太造作了点"
1382,"玲珑是云巅之上季晴的助理，还有那个嬷嬷"
1382,"说三个耳洞的人，耳夹了解一下。"
1382,"我劝你善良"
1382,"三生三世的瑶光上神"
1383,"红姐，你咋这么积极啊"
1383,"方姑姑要作妖了"
1383,"那是她姐姐的骨灰吧"
1384,"这嘴太出戏"
1384,"玲珑演宇文紫的时候嘴巴不是歪的吗怎么正了"
1385,"这招儿好厉害啊"
1385,"不想看五斤盐"
1385,"好喜欢红姐啊"
1385,"红姐，你要稳住啊"
1385,"脸盲是智商低的表现之一"
1385,"这嘴太出戏"
1386,"姑姑的双眼皮演的好"
1386,"我什么时候才能出场啊！"
1386,"是嬷嬷对她好。搞错了吧"
1386,"烽火佳人的那个小白鸽儿"
1386,"都是心机女"
1386,"这个真的是不敢恭维..."
1387,"女人多是非多，很聪明😄"
1387,"主角光环又亮了"
1387,"主角光环太重"
1387,"打的真是过瘾，"
1387,"姑姑跟嬷嬷不是同一个人啊"
1387,"幸亏谎话说得溜"
1388,"我觉得她凭一张嘴就能时时脱险也神奇"
1388,"戏精本人啊"
1388,"哇哇哇好崇明"
1388,"姑姑和那个嚒嚒不一样是吗"
1388,"长的尖嘴猴腮的不说法令纹还重的不行老的啊"
1388,"这样的人最可怕"
1389,"这前后的性格差异也太大了吧"
1389,"这些人是傻子吧"
1389,"真厉害！还真是那老板娘"
1389,"嘴太浮夸了吧"
1389,"这个剧是不是没有耳洞就不能演了。。。"
1389,"看他表情真的醉了"
1390,"感觉璎珞很适合这个角色，眼神很棒"
1390,"不打也可以夹住吧"
1390,"心机就是聪明嘛"
1390,"梅艳芳演得好"
1390,"这脑袋转的溜"
1390,"她说话嘴巴好夸张啊"
1391,"主角长得真像金星"
1391,"我只能给你9分。剩下1分只因你没用全力！！！！"
1391,"不是很聪明吗，为什么这种时候显得那么假"
1391,"这么蠢的剧情"
1391,"心机就是聪明嘛"
1392,"大活人跑出去你看不见啊"
1392,"为什么我一点都不俏皮…感觉俏皮的时候全靠配音"
1392,"这耳坠就是打得你看那耳朵坠的"
1392,"我喜欢两次攻击，一次打在你身上，另一次打在棺材上。"
1392,"女神怎么还不出来"
1392,"主角长得真像金星"
1393,"告密的那个宫女长得好像窝瓜"
1393,"好，笑死本宫了"
1393,"找不到厕所，尿在房子里吗"
1393,"满嘴胡说八道，还能活这么久扯"
1393,"这个嘴太有戏了"
1393,"当观众都是傻子吗？"
1394,"聪明鬼主意多哈哈"
1394,"一点尊敬的意味都没有"
1394,"调监控看看"
1394,"这都能活下去吗"
1394,"主角光环😇🐮"
1395,"姑姑长得像郭晶晶"
1395,"我媳妇儿就是厉害👍"
1395,"她做的事情都是用她口中看不上的方法解决"
1395,"天天满嘴说谎，真的好吗"
1395,"打的真过瘾"
1395,"这眼神太直"
1396,"戏精本精没错了"
1396,"你们不知道有这种样式的耳夹吗？不一定都是打了耳洞的"
1396,"尾随说得好"
1396,"谎话连篇啊，说的真溜"
1396,"其他都不错，就台词真的是败笔……"
1396,"打的真过瘾"
1397,"没看到是因为她被箩筐罩住了好嘛"
