time,content
1356,"站着看是有点厉害的还说火势大"
1356,"出差也带这么多家属"
1356,"袁春望是不是充钱了活这么多集"
1356,"除了我弟和海兰察，其他侍卫真的是挑出来的吗"
1357,"这个太监肯定跟导演关系不一般一个太监戏也太厉害了吧"
1357,"袁春望，你的盒饭热好了。"
1357,"虫子演的多好啊还会自己充气呢"
1357,"袁春望这个角色就是多余的"
1357,"这船是有多大"
1357,"袁春望是不是充钱了活这么多集"
1358,"小燕子出现了令妃才生十五阿哥，这里十五阿哥都好大了"
1358,"袁春望才是最后赢家"
1358,"就不能最后甜俩集结束吗非要扯袁春望？"
1358,"这几个侍卫是来看戏的？"
1358,"袁春望我劝你善良"
1358,"为什么侍卫那么水都打不过"
1359,"感觉大猪蹄子早已看穿一切"
1359,"祝春磊你个大猪蹄子在看吗"
1359,"袁春望！你的盒饭热好了"
1359,"本宫命令那些虫子去把袁春旺一口口吃掉"
1359,"从水里出来衣服怎么没有湿呢"
1359,"袁春望的演技真的欣赏不来，有点过了"
1360,"皇后真的爱皇上，如果皇上多关心她就好了"
1360,"隔着屏幕都想捶死袁春望"
1360,"怎么感觉袁春望好妩媚"
1360,"袁春望本宫命你赶紧去死！"
1360,"圆春旺有后台，谁让你这么牛"
1360,"都是袁春旺惹的祸"
1361,"白衣服来把袁春望杀了啊"
1361,"船上还有石壁？合着船是石头造的？导演太不靠谱了吧？"
1361,"这船比泰坦尼克号大呀"
1361,"其实袁春望是朕的小舅子"
1361,"不会又是将计就计吧，不想五阿哥走"
1361,"着火了一群人就站那看着"
1362,"又乱编历史，这么大的事历史怎么可能没有记载"
1362,"于正我劝你善良"
1362,"袁春望这个大猪蹄子"
1362,"有人想本宫吗"
1362,"袁春望你的戏咋这么多呢？"
1362,"袁春望，你疯了!"
1363,"想知道袁春望是历史上真实存在的吗"
1363,"阿佘演的不错，本宫喜欢"
1363,"不喜欢袁春望不是因为他演的好，是过了"
1363,"袁春望，朕劝你善良！"
1363,"这群人在船上作妖，不怕船沉了啊"
1363,"一切都在袁春望的计划中"
1364,"袁春望自以为演技很好"
1364,"袁春望你个小太监比本宫的戏还多"
1364,"袁春望不会是皇上的哥哥或弟弟吧"
1364,"这是大猪蹄子的套路"
1364,"袁春望不是皇室的人，最后疯了"
1364,"袁春旺本宫不想劝你了，赐你自己了结"
1365,"席城是个大猪蹄子"
1365,"朕是有准备的，己经移驾了"
1365,"大猪蹄子死了吗"
1365,"为啥太监这么多戏份"
1365,"改名叫袁舂望报仇记得了"
1365,"皇上救人戏份都没有吗"
1366,"这个太监演得很好，就是戏太多"
1366,"袁春望的复仇都是雍正到处留情的后果啊！"
1366,"袁春望：你劝我善良，我让你们都得死"
1366,"本宫不会死"
1366,"什么是大猪蹄子，什么意思啊"
1366,"为啥太监这么多戏份"
1367,"袁春望贷资进组好厉害。戏真多"
1367,"还是我善良"
1367,"马忠良我劝你善良"
1367,"好想看袁春望被凌迟的样子"
1367,"太监左右大局，演技太过了，收一收"
1367,"王爷居然听太监的话"
1368,"真假这叶天士不是大张旗鼓找来的怎么可能换虫子"
1368,"我劝你们都善良"
1368,"这种叛乱终归会失败，不回京城了吗"
1368,"我鼻孔太大了！"
1368,"是山匪的儿子"
1368,"还是我善良"
1369,"这部剧干脆叫太监逆袭记好了"
1369,"烤瓷牙本宫劝你善良"
1369,"一个太监这多戏，谁给的？谁给的？谁给的？赏一丈红"
1369,"韩付林你是大猪蹄子"
1369,"别劝盒饭了，马上大家都有饭吃了，聚餐走起来"
1369,"不会根历史上一样是十五阿哥救了皇上吧"
1370,"袁春旺带巨资进组的吧这戏份是不是太多了"
1370,"袁春旺同学你的戏太多了"
1370,"多好的船啊"
1370,"哼他们比本宝宝坏多了"
1370,"大猪蹄子保重啊"
1370,"真精彩啊可惜本宫不在"
1371,"肯定有密道"
1371,"朕难道已经活了八十了?"
1371,"船上有密道吗"
1371,"历史上这场火是永琪救了猪蹄子"
1371,"袁也是皇子啊，他要复仇"
1371,"仪姐你看了吗"
1372,"这部剧改名吧叫袁春望传吧"
1372,"袁春旺真的很厉害了"
1372,"易燃物?逗我呢?船都是木头，把船扔了吧"
1372,"这怕不是泰坦尼克号"
1372,"请袁春望原地爆炸"
1372,"等着吃饭了"
1373,"皇上早暗道藏好了"
1373,"珍儿怎么会喜欢袁春望"
1373,"靠着水着火了，这是火烧赤壁吗"
1373,"你们想让朕死是不是"
1373,"看到最后才明白原来主角是个太监"
1373,"请袁春望原地爆炸"
1374,"可能是劫到了皇后的信件。查袁春旺查出了问题"
1374,"我早就知道事情不简单所以我和太后早就溜了"
1374,"我猜有密道"
1374,"袁的眼神好夸张"
1374,"这可是船要打水还不容易"
1374,"连皇上都不救这一船的侍卫都去领盒饭吧"
1375,"袁春望是不是给导演塞钱了戏这么多z导演什么时候死"
1375,"袁春望本宫劝你善良啊"
1375,"皇上还有更重要的事情做"
1375,"这两个戏真多"
1375,"宁愿看字幕也不愿看到袁春旺的脸"
1375,"女人呐，狠下心就完事了"
1376,"打不过我吧没有办法我就是这么强大"
1376,"娴妃做的好，本宫重重有赏"
1376,"袁春旺在小说里是很重要的角色"
1376,"皇后娘娘是真的爱皇上，，，"
1376,"看历史说是永琪救了皇上，不知道是不是这里"
1376,"我怎么还不出来"
1377,"袁春望你的盒饭热好了，快去吃"
1377,"本宫也是交足了戏啊"
1377,"居然所有人被一个太监耍的团团转让他害那么多阿哥"
1377,"看的好无语，棺材板都快压不住了"
1377,"希望大家不要迁怒于饰演袁春望的演员，他的演技真的好"
1377,"我猜你们一定会被抓而且还是成对！！"
1378,"有密道的，大猪蹄子已看穿一切"
1378,"大猪蹄子还是你对我好"
1378,"看到这个死太监和大龅牙就来气"
1378,"谁布置的？竟如此大胆。"
1378,"这些侍卫一个比一个怂···平时吹的多厉害"
1378,"我对皇上是真爱"
1379,"袁春旺演技是不错的，就是浮夸了点‘要是能收一点就好"
1379,"本宫不想看袁春旺这个浮夸的演技，快！把盒饭热好啊！"
1379,"这船又大又好古代的豪华游轮啊"
1379,"本宫还是爱大猪蹄子的"
1379,"居然敢篡位大龅牙可以的"
1379,"袁春旺咱俩真合适"
1380,"也就烧了一只手没事"
1380,"看到现在才发现原来袁春望才是主演"
1380,"70集都是袁春望的戏真无语"
1380,"能不能把袁春望弄走"
1380,"皇后真爱啊"
1380,"本宫这是在演戏给他们看"
1381,"这太监演的真好啊遭人恨啊"
1381,"皇上估计早就带着太后逃掉了！你们还在这演"
1381,"突然觉得自己好善良"
1381,"袁春望，本宫劝你善良！！！"
1381,"後面幾集好水"
1381,"娃不能没有他爹"
1382,"其实娴皇后早就变好了"
1382,"整个船都是木头做的你这样怕是个傻子吧"
1382,"袁春旺最大败笔"
1382,"心地善良就是我"
1382,"太监戏太多"
1382,"得不到的就更加爱太容易来的就不理睬"
1383,"痴情的人注定没有好结果，现实何尝不是如此？"
1383,"大猪蹄子，你在哪儿呀"
1383,"大夏天，火烧起来很热吧"
1383,"大板牙你太疯了"
1383,"明明知道这两个人叛乱，还说过什么爱，可笑"
1383,"戏精故意的"
1384,"皇后是真心爱皇上"
1384,"好大的船啊"
1384,"莫子珺大猪蹄子"
1384,"这船是航母吗，这么大"
1384,"皇后真是不错"
1384,"强大的太监"
1385,"刺客的白衣服？"
1385,"船都是木头，说拆掉是真的"
1385,"就是袁太监害的五阿哥啊"
1385,"本宫还是有点心软"
1385,"永琪不会领盒饭了吧"
1385,"皇后是真心爱皇上"
1386,"你看到他就恨他，说明袁春望演技好"
1386,"不管那么多了，先晕再说"
1386,"你个大板牙你是什么东西"
1386,"看这烤瓷牙还带着毛"
1386,"那个虫子不会弄东西打开吗"
1386,"我有录音笔"
1387,"叛党从水里爬到船上，衣服都是干的"
1387,"好的朕听见了"
1387,"皇上和太后都坐别的船走了"
1387,"什么时候袁春望，和亲王一起领盒饭啊？等着呢"
1387,"有密道！！！！！都是猪嘛"
1387,"都是聪明人，到最后被袁春望耍"
1388,"袁春望快来催吐吧！我今吃多了"
1388,"俩倍速是个好东西"
1388,"他本来就是夺皇位的，皇后是要救皇上"
1388,"还是我善良"
1388,"其实皇后对皇上是真爱。她被袁春望迷惑了心智"
1388,"这大牙。赶紧下来陪本宫"
1389,"这个王爷比大猪蹄子痴情呀"
1389,"呵呵哈哈哈哈大火烧的好啊！"
1389,"袁春旺是小时候看多了无间道吧总是这种表情…"
1389,"快来陪我吃盒饭"
1389,"历史上没有袁春望这个私生子这部剧是强加"
1389,"该死的和亲王"
1390,"皇后真的很爱皇上"
1390,"我劝你善良"
1390,"和亲王去死"
1390,"反清复明的'主吗？"
1390,"皇上走了吧"
1390,"想看五阿哥"
1391,"袁春望的目的不是为了皇后，是为了杀皇上，杀他兄弟"
1391,"感觉皇上知道，所以有密道"
1391,"我靠僵尸大哥主持大局，难道你还想该写历史"
1391,"你们怕是忘了谁有主角光环"
1391,"和亲王的鼻子有自己的想法吧"
1391,"是要造反的节奏"
1392,"皇后爱大猪蹄子"
1392,"好精彩，可惜我不在"
1392,"大猪蹄子就等着你这句话"
1392,"哈哈哈，说牙哥的那个你在说一遍，没笑够"
1392,"有知道这部戏是太监传"
1392,"弘昼，朕对你那么好，你竟然这样"
1393,"袁春望你的盒饭热好了"
1393,"大猪蹄子大猪蹄子"
1393,"说皇后装的太傻了吧，他是被设计的好吗"
1393,"这大板牙，厉害啊"
1393,"李智威大猪蹄子"
1393,"皇后是真爱"
1394,"袁春旺就是个败笔啊聪明的皇后都被他骗？不合理"
1394,"这么大声真的好吗"
1394,"大龅牙劝你善良"
1394,"袁春旺可能原来是皇子，但是被阉了"
1394,"哎皇后娘娘这下真说不清了"
1394,"袁春望你的盒饭热好了"
1395,"好紧张好紧张好紧张"
1395,"大龅牙，你还真以为本宫稀罕你啊，蠢货"
1395,"弘昼乖乖，你的鼻音好重啊"
1395,"大龅牙朕劝你善良"
1395,"任何时候用人都是成功的关键"
1395,"好想把袁春望的嘴抠开，把盒饭灌进去"
1396,"皇后对皇上是真心的，可惜捧出的这颗真心不是皇上要的"
1396,"比我更痴情"
1396,"难道不是皇上最重要吗，船算什么，人算什么"
1396,"袁死太监滚远一点"
1396,"皇上已经穿白衣服上船了"
1396,"李玉去干嘛了"
1397,"皇后本质上是好的"
1397,"大龅牙子…有你玩的了"
1397,"这个大龅牙"
1397,"竟然还我五阿哥"
1397,"为了皇上一人数百性命在当时又算什么"
1397,"葵花点穴手"
1398,"应爽是个大傻子"
1398,"皇上好计策"
1398,"袁春旺是给钱了吗？一个太监贯穿了整部剧真是败笔"
1398,"这鼻子做的真是失败"
1398,"这个王爷真是个败类，没有皇上照顾你能有今天吗？"
1398,"本宫敲一下就晕"
1399,"一个小太监能闹得这么大动静？"
1399,"这狗奴才给了多少钱，镜头那么多，剧组又让我出征"
1399,"他一出来准没有好事"
1399,"没看到有的时候朕给李玉的眼神吗"
1399,"杨胖子你个大猪蹄子"
1399,"本宫这么容易就倒了"
1400,"这个剧到底谁是主角袁春望戏不要太多"
1400,"一巴掌拍死了？厉害！"
1400,"大板牙好出戏"
1400,"其实朕早已看穿一切"
1400,"太监都不怕诛九族吗？让皇上去救人？？"
1400,"袁春旺本宫命你快点领盒饭"
1401,"你们会不会觉得袁春望和魏樱珞演技都会不会太浮夸"
1401,"皇后好专一，感觉好好哦"
1401,"她是真的好爱皇上啊"
1401,"我太善良了"
1401,"佘诗曼厉害了"
1401,"突然对皇后恨不起来"
1402,"天地父母反清复明"
1402,"袁春望戏真的多"
1402,"烤瓷牙我劝你善良"
1402,"袁春旺语气像演小品的一样浮夸"
1402,"不喜欢皇后这个演员，没有皇后的气势"
1402,"这不是小燕子，紫薇，晴儿的桥段吗"
1403,"还是自己得儿，对娘好，没有一个冲进去的，"
1403,"朕活到八十多岁，你们都太嫩了"
1403,"烤瓷牙会葵花点穴手"
1403,"袁春旺本宫劝你善良"
1403,"令贵妃会不会也中毒"
1403,"皇后还爱着皇上"
1404,"皇后就失败在对皇上太用情，巩固权利才是重要的"
1404,"烤瓷牙我劝你善良"
1404,"技术可行性有多大啊"
1404,"你们懂什么，本宫计划继续捡漏。"
1404,"大清数百性命比得上皇上一个人的命重要？"
1404,"皇后始终是好的，被太监设计了"
1405,"看下来觉得皇后好无辜，思想一直被左右"
1405,"本宫要你们善良"
1405,"大猪蹄子可能在暗中观察"
1405,"佘诗曼演技太好了"
1405,"袁春望真多余"
1405,"皇后是好的，"
1406,"好的朕听见了"
1406,"这辈子不会再看袁春忘演的剧"
1406,"哈哈哈哈袁春望说话语气我快笑死了"
1406,"让你们继续演"
1406,"雪雪正在看"
1406,"张科升张科升"
1407,"皇后是真爱皇上。我就不信那么多人就让皇上一个人进？"
1407,"袁春望本宫命令你立刻去领盒饭"
1407,"袁春晚演技真的，睁眼睛太慢了"
1407,"听说我绿了"
1407,"主角袁春旺吧？戏这么多？充钱了？"
1407,"好的朕听见了"
1408,"技术果然是高了很多，这特效比较真实。"
1408,"人在家中坐绿从天上来大蹄子不开心哼。。。。"
1408,"袁春旺一个小太监比皇上身边的太监总管厉害？？？？"
1408,"皇上已经安全了，再看你们演戏"
1408,"袁快下线啊"
1408,"太监都不怕诛九族吗？让皇上去救人？？"
1409,"一个太监戏那么多"
1409,"这太监讲话感觉好刻意"
1409,"为什么不能上岸了再让人治疗"
1409,"袁卤蛋什么时候领盒饭"
1409,"应了那一句老话，太主动的太廉价，先说出口的爱最卑微"
1409,"说的真是大义凌然害怕"
1410,"孙玉洁你个大猪蹄子在看吗？"
1410,"烤瓷牙我劝你善良"
1410,"娴皇后真的很爱皇上啊"
1410,"袁春旺，说话拿腔拿调的，找死！"
1410,"袁春望能换个说话方式吗？这样不是有演技"
1410,"总觉得皇上看透和亲王了！知道会发生什么事"
1411,"一个太监戏太多，片名改成叫大太监好了"
1411,"袁春的盒饭热好了没有"
1411,"红昼这个演员演技好"
1411,"说话能不能正常点"
1411,"袁春望一说话就出戏，音调太夸张，老是说重音"
1411,"袁春忘你嗓子能不能不作妖"
1412,"皇后也是造孽背了那么多锅，最后还要背个更大的锅😂"
1412,"袁春望，你声音再大一点就把我吓醒了"
1412,"咸妃一辈子都洗不清了"
1412,"袁春旺你他们不能好好说话?非得带着劲儿"
1412,"这个太监真是有能力啊，后宫与朝廷都被他搅和了"
1412,"一直注意着喷火的道具，，都曝光了"
1413,"王爷，太君托我给您带个话"
1413,"袁春旺每句话都特别夸张做作"
1413,"袁春旺说话像演讲"
1413,"袁春旺朗读诗歌呢"
1413,"袁春旺你只配做个太监！"
1413,"袁春旺你他们不能好好说话?非得带着劲儿"
1414,"无论主配角，演戏是为了整部剧流畅舒适，袁就是戏过了"
1414,"袁春望讲话都像在演讲"
1414,"袁春旺只是一个太监，怎么这么多细粉"
1414,"这船好大啊"
1414,"聪明反被聪明误"
1414,"皇后真的一直爱皇上啊，可惜为势所迫"
1415,"不是自己的虫子都看不出来，大手术前都不检查？"
1415,"还是对皇后恨不起来，哎，和本可爱一样痴情"
1415,"这群演也太不专业了吧，躺的真舒服1还得胳膊垫着"
1415,"袁春望，本宫，劝你善良"
1415,"一群配音员会不会想拍死旁边的袁啊嗓门都高人一等"
1415,"依本宫看，后面几集都是一个太监引发的血案。"
1416,"这船到底有多大脑洞大啊"
1416,"太监都不怕诛九族吗？让皇上去救人？？"
1416,"袁春旺我劝你善良"
1416,"自古真心留不住唯有套路得人心"
1416,"皇后本质还是好的"
1416,"袁春望，本宫，劝你善良"
1417,"袁春旺演的过了办坏事就那一个表情"
1417,"袁春汪什么东西，太过了演的"
1417,"话真多一个太监"
1417,"人家还能活到80呢"
1417,"袁春望每次说话都这么刻意"
1417,"蛙哥还躺着呢！！！"
1418,"袁春望有点演技行吗，台词念那么死，不是坏人也不会火"
1418,"袁春望长得好像颗卤蛋"
1418,"刺客为什么要穿白衣服呢？"
1418,"这个小太监这么多戏！！！"
1418,"袁春望这反派光环太强大了吧"
1418,"袁春汪什么东西，太过了演的"
1419,"袁春望为什么要活这么久"
1419,"袁春旺我劝你善良"
1419,"袁春旺演技太刻意了"
1419,"袁春望的演员演得好让人恨到咬后槽牙👍🏻"
1419,"这个大瓷牙怎么还不死"
1419,"袁春望有点演技行吗，台词念那么死，不是坏人也不会火"
1420,"感觉袁春旺说话用的劲好大"
1420,"袁春望，本宫劝你善良"
1420,"估计是割的不干净，说话声音不像太监"
1420,"袁春旺就是演太监的料"
1420,"后妈爱皇上却不爱皇上的孩子是真爱吗?不是爱屋及乌啊"
1420,"袁春汪你真的是一直在汪汪汪啊"
1421,"元春忘就不能给他用个配音吗。听着火大"
1421,"皇后娘娘，袁总管说你重"
1421,"皇后自作孽不可活"
1421,"袁春汪的最终目的是什么"
1421,"这局好水，演技太浮夸"
1421,"怎么都要谋害朕啊"
1422,"请不要用大猪蹄子这么可爱的词形容袁春望"
1422,"这个和亲王，对皇后是真爱啊，当初那个小流氓哪儿去了"
1422,"袁春望活的真久一个小太监"
1422,"袁春望你一天吼啥吼"
1422,"剧组怎么安排的一个太监戏那么多"
1422,"皇后有一群猪队友"
1423,"皇后害得都是那些害过她的人不曾伤害无辜和璎珞一样"
1423,"袁春望演戏好浮夸啊"
1423,"袁春旺是真的多余"
1423,"本宫被你们害惨了"
1423,"袁春旺你演的是话剧吧，有你这样说台词的吗"
1423,"点一下就晕了"
1424,"袁春旺这样是不是自以为演技很好，做呕吐状"
1424,"袁春望怎么这么多戏"
1424,"编剧怎么想的让袁春旺起那么大的作用"
1424,"袁春旺，越看越想吐"
1424,"元春望毛孔好大"
1424,"袁春望演戏好浮夸啊"
1425,"两个皇后都是真心爱大猪蹄子"
1425,"袁春旺竟然活到最后一集，于妈妈，把他拖出去斩了"
1425,"袁春望你这大声音至于啊，演技堪忧"
1425,"把袁腌人给我打上马赛克"
1425,"一个太监这么多戏，投资了多少钱"
1425,"袁春望带资进组啊"
1426,"袁春旺戏真多快领盒饭啊"
1426,"袁春望弘昼你们疯了"
1426,"皇上南浔居然把最厉害的御前都派出去了哎嘘"
1426,"璎珞，对不起，没能保护你"
1426,"如果袁春望这个角色让于朦胧演，看在颜值也不会拉仇恨"
1426,"大龅牙你还不领盒饭"
1427,"心有多大！舞台就有多大！"
1427,"朕乃十全老人那是那么容易挂的"
1427,"请问这部剧是叫大太监吗？袁春旺戏这么多"
1427,"一个太监有这么大能耐"
1427,"袁春望让何炅来演可能更好一些"
1427,"我现在看少年包青天3⃣️觉得公孙策声音和袁春望像"
1428,"不穿白衣服谁认识谁杀错都不知道"
1428,"这袁哥也太厉害了吧，能做编剧了"
1428,"太监有多大的深仇大恨"
1428,"你们是不是都疯了，我今天就要让你们知道什么是规矩"
1428,"袁春望你演技自然一点好哇"
1428,"袁春望盒饭还没好吗"
1429,"搞得袁春望是主角一样，一个太监能活到这么久真是醉了"
1429,"这部剧原来是写一个太监。所有的一切都是为他铺垫呵呵"
1429,"是腐虫演的好才对"
1429,"看把你厉害的"
1429,"堂堂大清皇后亲王被一个小太监玩弄于股掌之间"
1429,"这袁哥也太厉害了吧，能做编剧了"
1430,"感觉像袁春望帮的是魏璎珞多些"
1430,"朕的卡姿兰大眼睛早已看透一切"
1430,"袁春望是最大的败笔"
1430,"盘档就这么几个人"
1430,"袁春望多余啊为什么有这个人物呢"
1430,"资料里说袁春望是导演"
1431,"说袁春望的可以去看一下半妖倾城。演技真的棒。"
1431,"说皇后还是好的😄是二了吧"
1431,"皇后是挺善良的只是被人利用"
1431,"现在还是觉得我可爱吧"
1431,"小袁演的太好了"
1431,"弘昼你该吃盒饭了"
1432,"早的时候干嘛去了，王爷求你还是善良吧"
1432,"我来救璎珞"
1432,"一个太监戏太多"
1432,"姓袁到说话好作，听了作呕"
1432,"本宫脑壳疼这都是什么操作"
1432,"袁春旺快领盒饭去吧"
1433,"和亲王就这一次感觉到自己如此强大吧"
1433,"为什么朕和袁春旺从来没说过话"
1433,"佘诗曼演的不错"
1433,"你们还记得阿满么？？"
1433,"傅恒在就好啊"
1433,"看到袁春旺的地方就想拖"
1434,"富恒在该有多好！"
1434,"本帅在的话早把你们都拿下了"
1434,"哈哈那个白衣服的。是自己躺过去的hhhh"
1434,"袁春望好有心机啊"
1434,"和亲王就这一次感觉到自己如此强大吧"
1434,"傅恒在就好啊"
1435,"大龅牙：是时候开始真正的表演了!"
1435,"袁春望本宫劝你善良"
1435,"袁春望的生存环境让他的心理扭曲了"
1435,"脸上有道疤哎"
1435,"心疼皇后娘娘"
1435,"看看吧，让你们不带我，出事儿了吧"
1436,"导演智商下线了，这集败笔真多"
1436,"我躲起来看你们好戏"
1436,"原春望这个演员就是一辈子演太监小人吧"
1436,"王八，是你害了她"
1436,"自己演戏厉害了"
1436,"大龅牙：是时候开始真正的表演了!"
1437,"大猪蹄子有计谋的"
1437,"蛙哥怎么样了"
1437,"一个太监戏太多了，就没看头了"
1437,"袁春望大猪蹄子"
1437,"光头演的好"
1437,"给你威风一会，反正马上领盒饭了"
1438,"元春网演的太好了黑子要气死了哈哈"
1438,"袁春望是非常重要的一个角色，这个演员演技明显不过关"
1438,"这太监也太厉害了吧"
1438,"朕站在上帝视角看你们真的好想笑"
1438,"好一招大义灭亲"
1438,"谁敢杀我大猪蹄子"
1439,"李涛你个大猪蹄子"
1439,"你以为你能斗得过我？天真！"
1439,"给一个太监的戏份太多了"
1439,"你看看你那个死出样"
1439,"牙是真的大"
1439,"我都看迷了"
1440,"你是不是觉得自己帅呆了"
1440,"什么直播？去哪看直播"
1440,"都是演戏呢，你们能不能认真点看，😂"
1440,"还是更关心剧情。"
1440,"竟然觉得有点帅"
1440,"你看看你那个死出样"
1441,"这时候皇后也比皇上少不了几岁了吧，还能有这么大魅力"
1441,"袁春望戏真多"
1441,"韦小宝哪时候不就有反清复明"
1441,"和亲王，本宫劝你善良"
1441,"春望，我不劝你善良了，你准备领盒饭吧"
1441,"可恶，真想当你的闺蜜"
1442,"大僵尸来吃盒饭了"
1442,"什么时候把我放出来"
1442,"袁春望不是皇子好吗，他根本不是"
1442,"大牙你疯了"
1442,"一个太监的戏实在是太多了吧"
1442,"袁春望戏真多"
1443,"白衣服一滴血都没，就挂了，奇怪哦"
1443,"白色上船的时候都是侍卫被砍要杀白衣了都是白衣被砍"
1443,"那是个啥虫子？还能变大！我去"
1443,"这王爷不是体弱多病吗？这分钟这么厉害了"
1443,"导演让士兵厉害了"
1443,"一帮人让太监耍的团团转"
1444,"大猪蹄子和太后肯定有密道"
1444,"弘昼你才是戏精啊"
1444,"心疼蛙哥那么优秀懂事的孩子"
1444,"先让你帅3秒钟"
1444,"袁春旺是给了编辑多少钱啊一个太监戏份那么多"
1444,"袁春旺这种人也能活到最后"
1445,"袁春旺是带钱进剧组的是不是，要不然也不会这么多戏"
1445,"这批兵不错，一看都是王者，刚才那些都是青铜"
1445,"和亲王带的这群人好厉害"
1445,"弘昼这是典型的玩火自焚还不自知"
1445,"袁春望怎么进剧组的，明显演技不过关啊"
1445,"大猪蹄子呢"
1446,"刚开始白衣服还厉害的了不滴现在就这样了？太水"
1446,"自己人杀自己人精彩演出"
1446,"为什么这个大猪蹄子带的人就比之前的好"
1446,"大龅牙你竟敢打我"
1446,"打的这么激烈，你还有时间念这么多台词。。。"
1446,"弘昼这是典型的玩火自焚还不自知"
1447,"说和亲王帅的怕是眼睛近视加散光一千度➕吧……"
1447,"有这厉害的侍卫，早安排哪里去啦"
1447,"刚才白衣服还那么勇猛，他一出现就怂了"
1447,"这集领盒饭🍱的挺多的"
1447,"牙精戏挺多的了"
1447,"哟喂，刚刚的侍卫都没武功，现在全变成高手了～"
1448,"反清复明啊反清复明"
1448,"大牙，盒饭给你备好了￼"
1448,"说袁春旺是先帝子嗣的雍正都被你气活了"
1448,"皇后，你要小心，朕没事"
1448,"袁春旺太不会演戏了，听他说话脑壳疼"
1448,"哟喂，刚刚的侍卫都没武功，现在全变成高手了～"
1449,"大晚上穿白衣服是怕别人找不到地方砍吗"
1449,"永琪真的好无辜啊，袁春望盒饭已热好，快去领！"
1449,"袁春望不是先帝儿子那是很早的谣言了还在这说"
1449,"有傅恒在就不会有那么多幺蛾子"
1449,"刚刚的侍卫跟闹着玩儿似的，怎么和亲王一来就变厉害了"
1449,"皇后，你要小心，朕没事"
1450,"感觉就像换了一批人比刚刚那些守卫强多了"
1450,"这架打的笑得本宫盒饭都抬不稳了"
1450,"袁春望就是因为演的好才特别袁春望啊"
1450,"牙精你疯求了"
1450,"大半夜你们穿白衣服是为哪般"
1450,"大晚上穿白衣服是怕别人找不到地方砍吗"
