time,content
2001,"璎珞演得挺好啊"
2001,"更年期女人真阔怕"
2002,"璎珞嘴并不是用力太猛而是脸太瘦嘴大带起来的"
2002,"手举这么高酸死本宫了"
2002,"除佘诗曼的台词听着舒服，其他人听她们讲话都容易跳戏"
2002,"我不看闲妃头脑不疼，我就想让她死"
2002,"佘诗曼演技真的很好，气场很强"
2002,"本宫要剪头发了，好高兴"
2003,"璎珞这个嘴呀！戏太多了！说话那么大动作干嘛"
2003,"感觉继后要领盒饭了"
2003,"璎珞演技不错，比小鲜肉好"
2003,"好像要起飞"
2003,"吉娃娃好可爱"
2003,"我什么时候复活"
2004,"璎珞其实是想把台词说清楚一点吧"
2004,"皇上不急太监急，皇上，我不20，嘿嘿"
2004,"感觉璎珞说台词都是一个字一个字蹦出来的"
2004,"现在看来，高贵妃真的太善良了"
2004,"璎珞说话嘴巴为什么要那么大动作。。"
2004,"本宫就是想早领盒饭"
2005,"这个剧最火的从来都不是主角不是阿佘就是容音"
2005,"皇后娘娘啊，袁春旺不可信啊"
2005,"吴谨言怎么这么瘦？瘦成闪电了"
2005,"你说嘴巴嘟嘟嘟嘟嘟嘟嘟一下我就升级啦"
2005,"能旅游多好啊"
2005,"太瘦了没有气场"
2006,"格格是王爷阿哥的侍妾好吧"
2006,"吴谨言和和历史上的令妃长的超级像，所以找她来演一点都不奇怪"
2006,"这胳膊伸的好长啊"
2006,"本宫胳膊伸的那么长真的扶的上吗"
2006,"说实话都没有皇后研的好"
2006,"朕南巡不是带了小燕子和紫薇一起去吗？"
2007,"吴谨言演技的确没有佘诗曼好"
2007,"觉得有猫腻"
2007,"璎珞衣服袖子演得好"
2007,"本宫演得真好"
2007,"吴谨言脖子长，就显得脸小了"
2007,"千玺在看吗"
2008,"那么多丫头她走的挺久"
2008,"本宫演技真好，从语气就能听出心情"
2008,"珍珠竟然活了这么久"
2008,"妈呀胳膊不酸嘛"
2008,"胳膊好疼啊"
2008,"是更年期到了好嘛"
2009,"珍珠现在的生活多好"
2009,"本可爱最可爱"
2009,"珍珠声音好听"
2009,"本宫带了牙套居然没一个人发现"
2009,"不是所有阿哥都被封王的，也不是所有格格都被封公主的"
2009,"我去准备盒饭🍱"
2010,"整部剧没有一个像槿汐一样聪明的宫女，全不懂主子心思"
2010,"这皇后有点东西"
2010,"缨珞有些表情很刻意，看着不舒服"
2010,"嘴巴看着甚是难受"
2010,"令贵妃头饰太简单了吧"
2010,"最后几集令妃的台词说的有些刻意了"
2011,"整部剧就晚晚和少爷看着顺眼"
2011,"珍珠活的久"
2011,"璎珞脖子好长"
2011,"忽然觉得自己好纯洁啊!"
2011,"为什么要拖着手手很重吗"
2011,"给朕安静点"
2012,"明玉能活到现在多好啊"
2012,"听惯了1.5。原因真的好慢！！！"
2012,"阿佘确实是演技派，更年期的症状都演的这么好"
2012,"本宫好像更年期了哦呵呵呵"
2012,"珍珠长的和太后的嬷嬷好像"
2012,"珍珠早就到了25岁了吧，还在璎珞身边"
2013,"明玉在该多好"
2013,"本宫要剪头发废后了"
2013,"令妃预感这事不简单"
2013,"嘴巴怎么了。从刚开始就说说到现在？搞不懂"
2013,"为什么古装戏讲话速度那么慢"
2013,"明玉能活到现在多好啊"
2014,"珍珠带资进组吧？活了那么多集，还是那么单纯。"
2014,"本宫这眼睛眨得有点频繁啊"
2014,"刘邦开大保护他们没事的"
2014,"哼皇后你完了"
2014,"这么扶手不是更走不稳么"
2014,"还记得本宝宝吗？"
2015,"自从看过吃面呃呃呃表情包，现在都自动脑补有跟面了"
2015,"睫毛膏涂得不舒服，一眨一眨好难过…"
2015,"黑色衣服一看到就想起僵尸。鬼。什么的"
2015,"皇后这怕是更年期到咯"
2015,"让我们一起去屠龙"
2015,"本宫好得很"
2016,"端的高走的稳"
2016,"你这是更年期到了"
2016,"令妃太爱眨眼睛了"
2016,"这走路派头真是没得说了"
2016,"一直眨么眼，是有毛笔吗"
2016,"不喜欢璎珞一字字的说话"
2017,"袁春汪饭盒我替你热好了，打算啥时候吃啊"
2017,"璎珞说话嘴唇可以不要那么刻意嘛…好奇怪"
2017,"璎珞的头饰也太过简单了吧，好歹也是令贵妃啊"
2017,"本宫是更年期了，别惹本宫"
2017,"珍珠最大的赢家"
2017,"果然只有我才是王者"
2018,"珍珠不错演到最后"
2018,"人在家中坐锅从天上来"
2018,"才发现珍珠是三生三世里面的缪青公主"
2018,"南巡得带着紫薇和小燕子"
2018,"珍珠和庆妃才是赢家"
2018,"本宫架着手走路好累啊"
2019,"不知自己美得晚晚太美了"
2019,"都是傻子，拉出去砍了"
2019,"山海皆可平，难平是人心"
2019,"这个双眼皮有点"
2019,"这俩孩子是永远活在台词里吗"
2019,"😄被我猜中了吧"
2020,"本部剧配角珍珠活的时间最长"
2020,"本宫想皇上的"
2020,"璎珞的嘴巴说话好刻意"
2020,"为什么我这么快死"
2020,"刘鉴锋大猪蹄子"
2020,"老娘冤啊！"
2021,"一个字一个字的吐吗"
2021,"朕后宫佳丽三千，可朕就偏偏宠璎珞一人"
2021,"这是珍珠吗"
2021,"这眉毛绝了"
2021,"这太后是珍瑗吗，如果是也差太远了"
2021,"现在皇后好惨哦"
2022,"说太瘦没气场的认真的吗，不是嫉妒吗"
2022,"皇后这次也是被冤枉了，给袁春旺背锅"
2022,"一分钟能眨一百下眼睛"
2022,"令妃为什么老是眨眼睛"
2022,"历史上这次南巡皇后就gg了"
2022,"朱明睿在看吗？"
2023,"珍珠好可爱呀"
2023,"我怎么感觉魏璎珞还是像个丫鬟没有贵妃的感觉啊"
2023,"璎珞妆变浓了"
2023,"关心下，怎么了！"
2023,"好一个激将法"
2023,"我一猜就是酱，为了孩子，故意激她"
2024,"太瘦了，撑不起头发和衣服，怕压着她"
2024,"本宫如果想动手，留不留下又有何区别"
2024,"魏璎珞一说话感觉嘴太刻意了"
2024,"高段位玩家"
2024,"魏说话好不自然"
2024,"南巡是要去见大明湖畔的夏雨荷啦😄"
2025,"珍珠活的也挺久的哈哈哈"
2025,"纳兰姐姐你们家宝贝真多"
2025,"璎珞为什么老是用力眨眼睛，说话也很用力很刻意"
2025,"尹维大猪蹄子"
2025,"珍珠活的好久"
2025,"还是我聪明❤️"
2026,"为什么舒妃总有好东西"
2026,"璎珞的眼眨的也真是厉害了"
2026,"祝琰大傻子"
2026,"庆妃人美心善"
2026,"璎珞的嘴说话故意那样的吗"
2026,"珍珠咋还不嫁人啊"
2027,"死为璎珞，不是挺聪明吗，呵呵"
2027,"本宫的激将法用得炉火纯青"
2027,"皇后现在这个阶段什么也不知道"
2027,"一直盯着魏璎珞的嘴，好魔性"
2027,"为什么总是要人搀着"
2027,"珍珠竟然活到最后"
2028,"大明湖畔的夏雨荷是不是要出现了，😄"
2028,"快南巡了，皇后该领盒饭了"
2028,"皇后掉段了啊"
2028,"要剪发了吗"
2029,"珍珠才是活得最久的~"
2029,"活不过两集说的就是本宫。。"
2029,"感觉2倍速才是正常语速"
2029,"我怎么这么聪明"
2029,"今天的杜比有点不正常"
2029,"字幕一会有一会没得"
2030,"服装很精致呀"
2030,"我算准了皇后是叛逆少女"
2030,"开始斗了，好啊"
2030,"璎珞可别忘了还有个袁春望，他才是危险人物"
2030,"陈洋在看么"
2030,"怎么哪都有袁春望呢"
2031,"令妃娘娘嘴巴说话好不自然，感觉在一个个读台词"
2031,"璎珞的眼睛太能眨了吧"
2032,"舒妃能活着做的最对的就是没干坏事"
2032,"本宫没有害孩子"
2032,"这部剧服装款式真多，中华文化博大精深"
2032,"天太热了你们的粉补的太厚了"
2032,"各位还记得我吗？"
2032,"璎珞的眼睛太能眨了吧"
2033,"晚晚的衣服是又接了一块布子嘛"
2033,"魏璎珞最关键的是嘴巴！一出戏总是先看到嘴巴在动！"
2033,"晚晚衣服好温柔"
2033,"现在开始喜欢舒妃了"
2033,"淑妃哪来的那么多礼物"
2033,"本宫没有害孩子"
2034,"眨眼睛可能是妆不舒服吧"
2034,"本宫怕这个老女人作妖"
2034,"刚开始也就宫女虽便插嘴是不合理"
2034,"这眼袋也是没谁了"
2034,"明玉活到现在，孩子也跟十五阿哥一样大了"
2034,"还记得我吗"
2035,"苏菲真的好贴心就喜欢送东西"
2035,"还有公主不一定非得是皇后生的，太后的女儿也可获得"
2035,"王者就是厉害"
2035,"还是佘的演技好"
2035,"导演怎么找这么个人演魏英落"
2035,"求璎珞口红色号"
2036,"晚晚好高呀，舒妃那么高鞋底穿着都没她高"
2036,"怕你动手脚"
2036,"舒妃活的级数好长啊"
2036,"珍珠才是美女啊"
2036,"这样看晚晚好像王源啊"
2036,"郭婷婷在看吗"
2037,"晚晚真的好高啊"
2037,"纳兰，你走路肚子都要拽上天了，想吃盒饭吗？"
2037,"陆晚晚好高啊"
2037,"嘴巴有问题"
2037,"远看那个高的好像男人"
2037,"本宫是好人"
2038,"晚晚这么高"
2038,"为什么你总炫富"
2038,"晚晚小天使的鞋子怎么还没宫女高"
2038,"这两个人活的还挺长"
2038,"皇后太久没斗，段位掉的不少"
2038,"难道皇后走了令妃居然不晓得不是皇后害的吗"
2039,"其实舒贵人才是最单纯的，虎萌虎萌的"
2039,"晚晚个子真高"
2039,"晚晚是冠军啊"
2039,"晚晚没有生孩子吗？"
2039,"眼睛眨太多了吧"
2039,"晚晚这么高"
2040,"晚晚没有穿花盆底嘛"
2040,"晚晚好可爱"
2040,"晚晚好像很高啊"
2040,"不听话的下场就是中圈套"
2040,"晚晚太像男人了"
2040,"其实舒贵人才是最单纯的，虎萌虎萌的"
2041,"晚晚个头好高啊"
2041,"皇后在宫中才好，出了事就是在她头上"
2041,"令贵妃你可真高尚啊"
2041,"舒贵人家是义乌的吧，啥都有"
2041,"那些总爱对别人演技说三道四的人，导演怎么没请你去？"
2041,"袁春望什么时候领盒饭"
2042,"晚晚到现在还是慢舒妃一步"
2042,"陆晚晚真的很好啊"
2042,"晚晚的花盆底为什么那么薄"
2042,"本宫准备要吃盒饭啦"
2042,"舒妃那么多好东西，送我们点～😜"
2042,"这部剧演技担当的是皇后诗曼姐姐啊~~~"
2043,"这个舒妃怎么还没吃盒饭但是看着顺眼多了"
2043,"舒妃，你哪来的那么多好东西?！"
2043,"晚晚这个子猛啊"
2043,"皇上难寻是要去寻大明湖畔的夏雨荷了么"
2043,"历史上的庆妃比今妃大三岁诶"
2043,"扇子和衣服很搭嘛"
2044,"绿衣服是要开始作妖了吗"
2044,"好了南巡，皇后快领盒饭了"
2044,"皇后也有今天"
2044,"旁边那个咋一看像明玉"
2044,"永琪都这么大了还夏雨菏你们傻了吧"
2044,"我们小十五什么时候出来啊"
2045,"那时候生孩子都早医疗也不发达所以感冒都可能要命"
2045,"这是朕，为你打下的江山"
2045,"晚晚好高啊，都不用穿花瓶底鞋"
2045,"储秀宫出来的人都穿绿衣服"
2045,"这俩个活的最久"
2045,"聪明的王者段位，为了孩子，高！"
2046,"晚晚走起路来像男人"
2046,"小燕子和紫薇怎么还不进宫"
2046,"皇后被下药了"
2046,"能看到永炎了吗"
2046,"为啥有点像安陵容"
2046,"这俩怎么没生孩子啊"
2047,"舒妃才是最厉害活了快九十岁"
2047,"本宫还活着哈哈"
2047,"晚晚长得好像男人"
2047,"晚晚是真的聪明"
2047,"晚晚太高了"
2047,"皇后被下药了"
2048,"晚晚个子真高"
2048,"她们两位才活到了最后😃"
2048,"舒妃怎么这么多好东西"
2048,"郭碧婷在看😏"
2048,"舒妃的眼睛，化妆师不是刻意的吗[偷笑]"
2048,"璎珞是好人，但是演的没气质"
2049,"眼袋是认真的吗"
2049,"袁春望才必须跟着去呢！"
2049,"顾凌伟在看吗"
2049,"所有人智商都变低了"
2049,"舒妃什么时候领盒饭？"
2049,"晚晚个子真高"
2050,"感觉晚晚有两米"
2050,"我之前还不有发现庆妃这么高啊"
2050,"晚晚长大了"
2050,"舒妃就不能把你的眼袋给熨平？？？？？？"
2050,"皇后别跟去，去回来就得进冷宫了"
2050,"金毛和博美那个，你是魔鬼吗？"
2051,"庆妃好高啊"
2051,"y因为你太高了"
2051,"为什么叫晚晚"
2051,"陆晚晚走路像男人"
2051,"这回声，棒棒哒"
2051,"感觉晚晚有两米"
2052,"晚晚的宫女也好高"
2052,"纳兰妹妹你咋也是绿衣服"
2052,"都这么长时间了，这个舒妃哪来的自信还这样"
2052,"诺大的皇宫只剩下四个?"
2052,"为啥叫晚晚"
2052,"你的眼睛成功引起了朕的注意"
2053,"晚晚本来就长得高"
2053,"感觉晚晚像女版胡歌"
2053,"演技太好了"
2053,"舒妃其实不算很坏，只是有点心眼，不会真害孩子"
2053,"璎珞的眼睛每次都眨的很奇怪"
2053,"璎珞演的挺好，就是说话的时候用力过猛。"
2054,"庆妃身高很高，穿的高了比其他人都高出很多"
2054,"太高了，有点不协调"
2054,"五阿哥都那么大了，夏雨荷怕是早该遇见了"
2054,"宫里人成天跪来跪去的，膝盖会不会起茧子"
2054,"为什么伸右胳膊走路，还伸的那么长"
2054,"晚晚好有气质，97年的！"
2055,"晚晚是模特出身吧"
2055,"庆妃，长的还可以"
2055,"伸胳膊让人撑着走路很舒服的哈哈！"
2055,"许丹在看吗"
2055,"其实皇后留下孩子们出事都是皇后的责任"
2055,"庆妃长的怎么那么像蒙娜丽莎。。。"
2056,"纳兰也没真正害人呀，好可爱"
2056,"永炎人气好高啊，都宠他"
2056,"这个纳兰好东西真多……"
2056,"太敏感了吧快用液体卫生巾"
2056,"这里突然觉得舒妃好可爱"
2056,"我下线啦？"
2057,"把胳膊举那么高走路舒服吗！"
2057,"屁的没害过人命容音第二个儿子就是她弄的蝙蝠"
2057,"纳兰感觉变好了"
2057,"谢定云就个大猪🐷蹄子"
2057,"本宫是舒可爱"
2057,"舒菲其实特别可爱"
2058,"晚晚肩膀真宽"
2058,"想我了吗你们"
2058,"她变善良了"
2058,"俩人就带一个轿子啊"
2058,"怎么没有见那三个孩子"
2058,"两件衣服刺绣一样诶"
2059,"舒妃眉头一皱，发现事情并不简单"
2059,"庆妃太高了，朕有压力，不敢宠她啊"
2059,"这对姐妹好了几十年"
2059,"庆妃你要好好的"
2059,"确实有点像居老师…"
2059,"皇后这算是以前太坏变好了人家不信了"
2060,"纳兰姐姐单纯不做作"
2060,"这俩人从第一集就没消停过，每次盒饭饿了？！！！"
2060,"晚晚都不用宫女扶着"
2060,"庆妃长得像文松呀"
2060,"舒妃这个表情演的好"
2060,"淑妃虽然是反派，但挺可爱的"
2061,"衣服上绣的花瓶好可爱"
2061,"都是大美女演员羡慕"
2061,"晚晚说话还是那么温柔"
2061,"你也太敏感了吧？用护舒宝卫生巾，身心轻如云"
2061,"吉祥:你也太敏感了吧"
2061,"纳兰姐姐单纯不做作"
2062,"想多了，害人也的有想象力创造力这几样你都没有。"
2062,"我最可爱ớ₃ờ了"
2062,"只有我觉得舒妃很可爱吗"
2062,"你不会动我儿子吧"
2062,"本宫要出现了"
2062,"衣服上绣的花瓶好可爱"
2063,"瞧着庆妃又高又瘦，貌似男子啊"
2063,"史书记载皇后去南巡的时候死的"
2063,"说舒妃一米五的你是魔鬼吗"
2063,"最萌身高差吗。这是"
2063,"舒妃不坏啊还好"
2064,"庆妃身架子好大肩好宽想男人"
2064,"晚晚是有多高啊，舒妃那么厚的花盆底还是矮"
2064,"我觉得纳兰对晚晚是真心的"
2064,"被袁春望听见了，给换了，小十五中毒了"
2064,"晚晚好善良啊"
2064,"觉得陆晚晚和容音演的有点像眼神和摇头晃脑都像"
2065,"这一对好可爱啊，有人吃庆舒吗？"
2065,"纳兰，你怎么这么敏感！"
2065,"纳兰嫣然我劝你善良"
2065,"本宫那有的是宝物，不饶舒妃用心了"
2065,"哈哈哈哈这姐妹俩真可爱"
2065,"超喜欢庆妃。大家没意见吧"
2066,"这句话的经典话语：你为什么这么看着我"
2066,"晚晚是真的温柔可爱善良"
2066,"纳兰这个智商从第一集活到了最后"
2066,"咦，舒妃是绿色的衣服耶"
2066,"朱海月在看嘛"
2066,"想傅察皇后了"
2067,"跟令妃不和为什么对她儿子那么好"
2067,"舒妃这个跑龙套的竟然活那么久"
2067,"纳兰是好人"
2067,"舒妃也是个小可怜呐"
2067,"她俩就这么两身衣服吗"
2067,"怎么我一走大家都变了"
2068,"晚晚说话有点儿像容音啊"
2068,"盒饭🍱我已经热好了"
2068,"晚晚和舒妃还挺配"
2068,"绿衣服就是领盒饭的征兆"
2068,"就我一个人觉得庆妃长得像李沁么？？？"
2068,"咋个舒妃不会生孩子，庆妃也不会生孩子？"
2069,"这个纳兰居然活了这么久"
2069,"你太敏感了"
2069,"晚晚好可爱啊。。"
2069,"反正也怼不过我，何必怼呢"
2069,"纳兰啊，你能活到现在已经是奇迹了。"
2069,"怎么感觉像小两口吵架"
2070,"她怎么这么可爱蛤蛤蛤"
2070,"吉祥：你也太敏感了吧"
2070,"太敏感了吧哈哈哈哈"
2070,"纳兰淳雪其实也不坏"
2071,"纳兰姐姐，你也太敏感了吧"
2071,"你们都是更年期了吗"
2071,"大眼袋也更年期了"
2071,"璎珞说话好不自然。。。"
2071,"太敏感了吧哈哈哈哈"
2071,"纳兰淳雪其实也不坏"
2072,"刚才有一幕突然觉得晚晚好胖啊"
2072,"你也太敏感了吧"
2072,"紫薇都长大了好吗"
2072,"你也太敏感了"
2072,"衣服扣子上为什么都挂了东西"
2072,"纳兰是富二代"
2073,"其实这部剧里好的就是不到万不得已大家都不伤孩子"
2073,"你这是到了敏感期了吧"
2073,"晚晚好高哦"
2073,"这卧蚕是认真的吗"
2073,"淑妃也是挺好的至少这个时候也不会害人了"
2073,"庆妃是像男扮女装"
2074,"舒嫔真挺可爱的"
2074,"你太敏感了8"
2074,"庆妃蛮好的"
2074,"这演了两集的孩子到底是个啥样儿"
2074,"这两人才是真爱呀"
2074,"后宫还剩几个了？除了太后还剩四个？"
2075,"扇子这动作好可爱"
2075,"舒妃长大了，懂事了"
2075,"舒妃挺可爱的有话说话哈哈哈哈"
2075,"我觉得她好可爱啊"
2075,"这两人才是真爱呀"
2075,"后宫还剩几个了？除了太后还剩四个？"
2076,"这些衣服贵啊做不了那么多了"
2076,"庆妃太壮了"
2076,"这种心直口快的，挺好。简单"
2076,"谁是以小人之心度君子之腹哦"
2076,"盛一伦那个你是魔鬼吗"
2076,"塑料姐妹花"
2077,"舒妃能活到现在是有道理的对晚晚跟永琰是很好的"
2077,"舒妃对晚晚是真爱啊"
2077,"晚晚已经被晋升为庆妃了。"
2077,"你太敏感了，液体卫生巾了解一下？"
2077,"哈哈，这两个关系挺好的，喜欢晚晚"
2077,"舒妃还是没长大啊"
2078,"最厉害就是纳兰姐姐，既然活这么久。"
2078,"衣服看起来都很高级"
2078,"您还君子呢，明明就是猪队友好吧"
2078,"这么敏感？"
2078,"她还是有点良知的不然怎么活这么久"
2078,"舒妃对晚晚是真爱啊"
2079,"纳兰好可爱啊"
2079,"怎么哪都有袁春旺"
2079,"她的眼袋好重"
2079,"不是这扇子一推怎么有点可爱啊哈哈哈哈哈哈哈"
2079,"吉祥：苏菲你也太敏感了！"
2079,"这俩cp我有点想磕"
2080,"纳兰其实一直挺照顾晚晚，就是话多了点😂"
2080,"为何舒妃这段我觉得有点阔爱"
2080,"舒妃真的好可爱啊"
2080,"扇子演的不错"
2080,"好可爱啊刚刚"
2080,"纳兰好可爱啊"
2081,"舒妃对晚晚才是真爱"
2081,"舒妃好可爱呀"
2081,"晚晚怎么没有孩子"
2081,"扇子怼那一下好可爱"
2081,"嘉贵妃好可爱啊"
2081,"扇子演的不错"
2082,"舒妃刚刚戳晚晚这个小动作好可爱啊哈哈哈"
2082,"叶鹏程是个大猪蹄子"
2082,"太宠溺了哈哈哈要是别人舒妃好像一个大耳刮子就上去了"
2082,"哎呀妈呀。舒妃竟然有那么一丝可爱"
2082,"这俩都好可爱啊"
2082,"舒妃好可爱呀"
2083,"舒妃对晚晚挺好，生气样子也挺可爱"
2083,"我给你钱去做眼袋手术"
2083,"拿话怼她哈哈哈哈哈哈哈哈哈哈对不起笑出猪叫"
2083,"庄妃从远处看像男扮女装啊"
2083,"庆妃真的超级好"
2083,"戳一下认真的吗哈哈哈哈"
2084,"晚晚是李维嘉演的，你看演员表"
2084,"舒妃的眼袋是认真的吗"
2084,"这个怼字好可爱"
2084,"舒妃这样还有点可爱，"
2084,"晚晚以后是不是慈禧啊"
2084,"舒妃对晚晚挺好，生气样子也挺可爱"
2085,"舒妃也挺可爱的啊拿扇子轻轻戳了戳哈哈"
2085,"拿话怼她这么先进吗"
2085,"怼用得好哈哈"
2085,"舒妃眼泪演的好"
2085,"舒妃真的萌萌哒好可爱啊😱"
2085,"这个怼字好可爱"
2086,"庆妃好高，没有女人的感觉"
2086,"你们怕是忘了她和高可爱召来蝙蝠害本宫的时候了"
2086,"我觉得舒妃长得是最可爱的一个"
2086,"突然觉得舒妃好可爱啊"
2086,"你太敏感了，让吉祥来打救你"
2086,"怼用得好哈哈"
2087,"妈耶这俩人CP大旗举起来感觉这么多年有感情了"
2087,"怼是认真的吗哈哈哈哈"
2087,"舒妃是低配的高贵妃吧！说话那么直"
2087,"怼这个字这么早就有了吗"
2087,"晚晚有一米八吗？"
2087,"这个时候就有怼这个字了？？？"
2088,"突然觉得舒妃不是一般的可爱！！！"
2088,"怼是认真的？"
2088,"活的时间最久"
2088,"那时候就有怼这个字了吗"
2088,"这里觉得纳兰挺可爱的"
2088,"朕怎么不记得古代有怼这个字"
2089,"舒妃好可爱啊"
2089,"小心你的大眼袋吓到皇上"
2089,"我觉得其实舒妃才是真单纯"
2089,"怼怼更健康"
2089,"宝贝你太敏感了"
2089,"这里觉得纳兰挺可爱的"
2090,"说庆妃晚晚是慈禧的那个回去多看看历史好吗，没文化"
2090,"舒妃这段演的真好"
2090,"舒妃对晚晚是好的"
2090,"没有我能生"
2090,"山海皆可平，难平是人心"
2090,"怼她哈哈哈哈，我小时候都没这个词"
2091,"突然觉得舒飞好可爱"
2091,"这句没有令贵妃能生笑死我了"
2091,"舒妃天天晚上等皇上熬夜眼袋好大😂😂😂😂😂"
2091,"瞬間覺得舒妃可愛的不得了😄"
2091,"舒妃对晚晚是好的"
2091,"山海皆可平，难平是人心"
2092,"晚晚？晚晚以后可能就是现在的皇后"
2092,"本宫认为舒妃是可爱的"
2092,"不错变可爱了"
2092,"你的命好，坏人角色还活到现在"
2092,"好人来的就妒忌心有点重"
2092,"这句没有令贵妃能生笑死我了"
2093,"晚晚才是最后的大赢家"
2093,"怼怼怼，不错不错"
2093,"眼袋是认真的吗"
2093,"怼字是认真的吗(⊙x⊙;)"
2093,"不错变可爱了"
2093,"晚晚？晚晚以后可能就是现在的皇后"
2094,"妆容白到看不清眼泪"
2094,"你是说本宫是小猪呐😂"
2094,"突然觉得舒妃是个小可爱，还是个家里有矿的小可爱"
2094,"心疼我媳妇"
2094,"这个下眼袋演的好"
2094,"舒贵妃深得我心"
2095,"所以舒嫔能活着也是有理由"
2095,"活该你舒妃没孩子！心机重"
2095,"我觉得你命已经很好了，还能活到最后"
2095,"舒妃你背景好啊，这么怼都下不了线啊"
2095,"怼？好先进啊"
2095,"突然觉得舒妃是个小可爱，还是个家里有矿的小可爱"
2096,"她是真心待晚晚的"
2096,"我没太后能生，太后有4个"
2096,"你算好了能活这么久"
2096,"这是命的问题吗"
2096,"突然觉得舒嫔有点可爱"
2096,"怼？好先进啊"
2097,"错了，不是三个是生了六个。惊不惊喜，意不意外！"
2097,"晚晚真善良"
2097,"舒妃娘娘您有2个可爱的卧蚕"
2097,"没错在古代能生就行"
2097,"她是真心待晚晚的"
2097,"我没太后能生，太后有4个"
2098,"庆妃是晚晚吗？"
2098,"舒妃那一戳好可爱啊"
2098,"舒妃好可爱哦"
2098,"有就该知足了"
2098,"晚晚有孩子吗"
2098,"你忘了当初怎么和高贵妃一起害富察皇后了？"
2099,"舒妃对晚晚一直都特别好的"
2099,"纳兰小姐姐也是人生赢家啊，活的集数除了令妃就是他了"
2099,"这个怼字用得好，你怼的也很可爱😊"
2099,"宝贝，你根本不是敏感，就是防着你"
2099,"你能活着就不错了啊"
2099,"袁春旺这个人是来搞笑的吗"
2100,"不得不说，几个配角演技都不错，舒妃，陆晚晚，太后"
2100,"哦嚯嚯嚯是你自己不受宠还说我媳妇能生哦"
2100,"庆妃怕是有一米八了吧还特意配了个高的宫女"
2100,"我还会生三个，就问你气不气？"
2100,"不觉得晚晚很像胡歌吗"
2100,"袁春旺这个人是来搞笑的吗"
2101,"没孩子还在宫里活那么久，不错啦"
2101,"宝贝别哭，你才是人生赢家"
2101,"纳兰好可爱"
2101,"眼袋好明显"
2101,"古时候不能生双胞胎么"
2101,"哭啥你是侍寝最多的人"
2102,"演技不错，眼睛都红了"
2102,"舒妃演的不错嘛"
2102,"不，是四个可爱的孩子"
2102,"哈哈，怼他，台词好现代"
2102,"你爱咋咋地人家不稀罕呢还"
2102,"纳兰好可爱"
2103,"这个舒妃看久了竟然觉得有点甜"
2103,"你的眼袋兜住了眼泪💧"
2103,"她对晚晚倒是真的不错"
2103,"那是我不孕不育"
2103,"晚晚演的好好啊"
2103,"不，是四个可爱的孩子"
2104,"庆妃好可爱啊啊抱走"
2104,"生不过我吧！！没有办法我就是这么强大"
2104,"你能活着就不错了"
2104,"大家想我了吗"
2104,"这个舒妃看久了竟然觉得有点甜"
2104,"晚晚演的好好啊"
2105,"乾隆把他孩子的寿福都吸走了自己活那么久"
2105,"舒妃其实可以的算是比较善良有正义的"
2105,"瞬间感觉舒妃也不容易啊"
2105,"孩子毛都没一个是吗"
2105,"毕竟家里有矿的人"
2105,"庆妃好可爱啊啊抱走"
2106,"不是能不能生的问题，是皇上去的勤不勤的问题"
2106,"说好后宫佳丽三千的了？"
2106,"还那么年轻生呗多生几个"
2106,"我生一大堆，气不死你"
2106,"眼袋长上边是不是就成双眼皮了"
2106,"舒妃这样看还挺可爱的"
2107,"淑贵妃，乖，不哭"
2107,"这么久没出现，想璎珞了"
