694,何止抽他，我都想拿炮轰他,0.5472,0.4528,0.0560057,1
694,这个太后感觉比太妃大很多，可以当她母亲。,0.656476,0.343524,0.236613,2
694,说愉贵人的看看眼睛,0.556135,0.443865,0.0136332,2
695,慈母多败儿,0.609399,0.390601,0.131999,2
695,朕脸盲又犯了不是愉妃吗,0.140099,0.859901,0.688668,0
694,我儿子什么时候那么大了？,0.474435,0.525565,0.488698,1
695,为啥我觉得扶摇开两倍还慢…,0.234717,0.765283,0.478407,0
695,这个太妃看着咋这么眼熟,0.267952,0.732049,0.404552,0
695,这个人怎么和我长得一个样,0.340637,0.659363,0.243029,0
696,太后演员没选好，没有富贵相，长了一张嬷嬷脸。,0.323277,0.676722,0.281605,0
695,打一顿就好了,0.419166,0.580834,0.0685203,0
696,按常理，这种时候露脸的女人不简单！有可能是幕后主使,0.201996,0.798004,0.55112,0
696,叶大夫好可爱呀,0.753531,0.246469,0.452291,2
696,我就问问这不是愉嫔吗,0.122394,0.877606,0.728013,0
696,太后的声音跟穆桂英挂帅里那谁的声音是一个配的音,0.188773,0.811227,0.580505,0
696,太后的发际线是认真的吗,0.590098,0.409902,0.0891059,2
697,看预告的时候以为愉嫔黑化了，原来不是一个人啊,0.400897,0.599103,0.109117,0
697,本宫好久都没有镜头了,0.536545,0.463455,0.269093,1
697,弘昼娘长得好像愉贵人呀,0.531775,0.468225,0.364506,1
697,这是愉贵人的娘吗，咋这么像,0.364734,0.635266,0.189481,0
697,我什么时候能上场啊,0.561521,0.438479,0.0256027,2
698,愉贵妃这么久没出来原来在这呢,0.412721,0.587279,0.082843,0
697,不是说是皇上的亲弟弟吗,0.122239,0.877761,0.728357,0
698,这不是生五阿哥的鱼肥吗,0.116255,0.883745,0.741656,0
698,艾薇巴蒂，来次够,0.696715,0.303285,0.326033,2
698,怎么太后和妃子年纪差这么多,0.0777943,0.922206,0.827124,0
698,弘昼娘长得好像愉贵人呀,0.531775,0.468225,0.364506,1
698,尔晴我劝你善良,0.324823,0.675177,0.278172,0
699,明明说钮祜禄氏比弘历大七岁这看上去怕是七十岁也有,0.209542,0.790458,0.534352,0
699,长得好像愉妃,0.56969,0.43031,0.0437546,2
699,您订阅的抽儿子礼包已到货，请签收,0.442911,0.557089,0.0157535,0
699,这额良看起来这么温婉不像后面的嘴脸啊,0.237009,0.762991,0.473314,0
699,我来帮大猪蹄子抽,0.718051,0.281949,0.373447,2
699,嬛嬛，你太温柔了。,0.337803,0.662197,0.249327,0
700,不是这个太妃跟愉贵人长的好像,0.172033,0.827967,0.617705,0
700,我确实是个大猪蹄子,0.497283,0.502717,0.945666,1
700,那高贵妃就是得罪了服装师,0.43509,0.56491,0.0331338,0
700,我都不记得愉嫔长什么样了,0.448581,0.551419,0.00315415,0
700,这个贵妃长的怎么像愉贵人,0.436524,0.563476,0.0299471,0
701,天下好母亲，什么都舍得给孩子,0.632719,0.367281,0.183819,2
701,这个太妃的脸肉毒素打多了吧,0.206096,0.793904,0.54201,0
701,太后跟太妃差这么大年龄啊,0.0526669,0.947333,0.882962,0
702,说眉毛一轻一重的。打光知道不？拖下去。下一个。,0.170706,0.829294,0.620653,0
701,我对他好，让他永登极乐,0.626437,0.373563,0.16986,2
702,太后的发际线有点高,0.374651,0.625349,0.167443,0
701,弘昼他娘也不是什么好东西，人就是他杀的,0.361671,0.638329,0.196287,0
702,这是雍正的纯悫皇贵妃耿氏,0.56222,0.43778,0.0271561,2
701,是不是后宫嫔妃太多，女人不够演了，一人多角,0.255797,0.744203,0.431563,0
702,我妈也来当群演了,0.363586,0.636414,0.192032,0
702,我劝我善良。,0.271273,0.728727,0.397172,0
702,弘昼的老娘怎么跟皇后长得那么像的,0.483086,0.516914,0.661716,1
703,尔晴，我劝你善良,0.324823,0.675177,0.278172,0
703,长得帅就是好，这么多女人喜欢，唉,0.738196,0.261804,0.418213,2
703,看上一辈的后宫关系多好,0.601376,0.398624,0.114168,2
703,怎么又像愉贵人又像皇后，脸盲,0.426528,0.573472,0.0521608,0
703,我什么时候可以去见我媳妇,0.669915,0.330085,0.266479,2
704,太后居然是宋春丽才认出来变化好大,0.445121,0.554879,0.0108422,0
703,长广王高湛她娘,0.505711,0.494289,0.885788,1
704,太后好慈祥,0.710947,0.289053,0.357659,2
704,愉贵人又活了,0.546687,0.453313,0.0662517,1
704,眉毛好细啊,0.769285,0.230715,0.4873,2
700,舍得舍得，有舍才有得,0.833981,0.166019,0.63107,2
704,这太后发型跟葫芦娃似的,0.475547,0.524453,0.510942,1
704,别急别急，我就快出场了,0.443549,0.556451,0.0143366,0
705,其实这个太妃是长得有点点像愉贵人,0.392425,0.607575,0.127944,0
705,我就想问一下这历史考究孙俪知道她以后长这样吗,0.469372,0.530628,0.387434,1
705,她们的耳坠都是剧组统一批发的嘛,0.630396,0.369604,0.178658,2
705,不一样啊哪里像了你是有多脸盲,0.437604,0.562396,0.0275474,0
705,我告诉自己要善良,0.395766,0.604234,0.120519,0
705,太后长得像男人,0.506412,0.493588,0.871767,1
706,我觉得尔晴娴妃好可爱啊,0.73149,0.26851,0.403311,2
706,这是瑜贵人多垫了几成肉吧,0.367959,0.632041,0.182313,0
706,太后说什么就是什么，太后最大,0.314446,0.685554,0.301231,0
706,人家不是愉妃好吧,0.286239,0.713761,0.363914,0
706,大胆！竟有如此长得像我之人！,0.363602,0.636398,0.191995,0
707,这个太厚长得很像赵丽蓉,0.236805,0.763195,0.473766,0
706,皇后的声音跟西游记里一个声音好像，但又想不起来,0.517106,0.482894,0.657875,1
707,我劝你善良，我劝我自己也善良🙃,0.136375,0.863625,0.696944,0
707,根本分不清，为什么着M多人,0.189279,0.810721,0.579381,0
707,这个剧里面除了皇后其她人都让我脸盲，这不是逾贵人吗,0.121743,0.878257,0.729461,0
707,这是个好角色吗？,0.468967,0.531033,0.379344,1
708,怎么我娘什么时候给我生了个弟弟,0.40339,0.59661,0.103578,0
708,说愉贵人的怕是没多大吧，这是个老戏骨了，演了挺多剧,0.443224,0.556776,0.0150587,0
708,原来不止一个人觉得像怡嫔,0.468503,0.531497,0.37006,1
708,这太后有点像海涛的妈妈,0.557653,0.442347,0.0170068,2
708,感觉这剧最大的败笔就是一个个的咬唇妆啦,0.374519,0.625481,0.167736,0
709,嬛嬛，你看人家保养得多好,0.413767,0.586232,0.0805166,0
708,我太聪明了！,0.45446,0.54554,0.0892073,1
709,说弘昼妈和愉嫔一人的脸盲吧！,0.265322,0.734678,0.410395,0
709,这太妃好眼熟啊！就是废了,0.321994,0.678006,0.284457,0
709,不是同一个人啊。长得像而已。什么眼神,0.0899594,0.910041,0.80009,0
709,说愉贵人的怕是没多大吧，这是个老戏骨了，演了挺多剧,0.443224,0.556776,0.0150587,0
710,什么叫愉贵人又活了？愉贵人就没死过好嘛,0.321356,0.678644,0.285874,0
710,别等我了，我50多集才出来呢,0.579169,0.420831,0.0648197,2
710,这夫人怎么和我长得这么像,0.331671,0.668329,0.262954,0
710,太后眉毛好细啊,0.758812,0.241188,0.464026,2
710,第一眼见这个嬛嬛就很出戏，太违和了，这多集还是违和,0.607393,0.392607,0.127541,2
710,本宫要出来作妖了,0.491371,0.508629,0.827413,1
711,太后的唇妆好随意,0.737781,0.262219,0.41729,2
711,我来冒个泡,0.580119,0.419881,0.0669306,2
709,弘昼他娘和愉嫔长得好像,0.501552,0.498448,0.968953,1
711,正常啊，皇后一般很早就嫁了是太子妃,0.36548,0.63452,0.187822,0
711,这不是鱼贵人？,0.159116,0.840884,0.646409,0
711,莫名觉得太后可爱,0.679885,0.320115,0.288634,2
711,这不是我吗,0.20696,0.793041,0.54009,0
712,同个爹就是亲的了好吗你们这些笨蛋,0.185571,0.814429,0.587619,0
712,太后的眉毛够细啊,0.751242,0.248758,0.447205,2
712,这郭太妃是瑜贵人失散多年的妈,0.546793,0.453207,0.0641477,1
712,吼吼，看媳妇开大,0.73627,0.26373,0.413933,2
712,我果然是脸盲，我觉得这就是愉妃,0.586661,0.413339,0.0814684,2
712,莫不是愉贵人的亲妈,0.600274,0.399726,0.11172,2
713,同父异母也是亲弟弟好吧,0.663201,0.336799,0.251557,2
713,是因为光的问题，所以眉毛才一重一轻的,0.464284,0.535716,0.285684,1
713,朕要好好教训他，额娘就放心吧,0.60577,0.39423,0.123932,2
713,说是愉妃的都脸盲啊,0.482634,0.517366,0.652684,1
714,乾隆：好了好了不要吵了,0.798095,0.201905,0.551323,2
714,这太后的眉毛是认真的吗,0.577951,0.422049,0.0621135,2
713,这看着真像个好人呐呵,0.46899,0.53101,0.3798,1
713,快了，我快出城了。,0.741807,0.258193,0.426238,2
714,就是这个女人杀了啊满,0.658206,0.341794,0.240458,2
714,姐姐就是她杀的,0.783096,0.216904,0.517991,2
714,同父异母也是亲弟弟好吧,0.663201,0.336799,0.251557,2
715,裕太妃历史上比孝圣宪皇后大三岁啊这里保养的不错啊,0.956274,0.0437258,0.902831,2
714,这不是愉贵人，长得还是有区别的好吧。。。,0.309093,0.690906,0.313125,0
715,根本不是一个人，不要在这哗众取宠好吗？,0.0934329,0.906567,0.792371,0
715,这部戏的女人都打三个耳洞了好敬业,0.602602,0.397398,0.116894,2
715,我下不去手,0.203421,0.796579,0.547954,0
715,这是令妃啊一群大猪蹄子,0.658967,0.341033,0.242149,2
715,皮卡皮卡皮卡丘,0.54686,0.45314,0.0627935,1
716,就是像年龄大点儿的愉贵人,0.729665,0.270335,0.399256,2
716,这是我娘吗长得一毛一样,0.24649,0.75351,0.452244,0
716,这部剧把太后年龄演大了,0.339929,0.660071,0.244602,0
716,裕太妃太毒了，怕姐姐说出去就把姐姐杀了,0.576271,0.423729,0.0583796,2
716,我就是开个玩笑,0.614525,0.385475,0.14339,2
717,觉得长得像愉贵人，说明化妆师厉害，都能化成一个样,0.464789,0.53521,0.29579,1
716,三岁定八十，现在教已经没有意义了,0.368518,0.631482,0.181072,0
717,嬛嬛认真的嘛,0.744494,0.255506,0.432209,2
717,好的额娘，马上就去,0.751476,0.248524,0.447724,2
717,和愉嫔长的好像呀,0.594617,0.405383,0.0991484,2
717,皇额娘太可爱了8哈哈哈哈！,0.848072,0.151928,0.662382,2
717,这愉妃怕是太子妃生的，基因太强大,0.535026,0.464974,0.299482,1
718,看到老太后的耳洞了吗分明是带了很多年撑的，细节好评,0.74731,0.25269,0.438467,2
718,讲真啊，脸这么白，显得牙齿好黄啊。。。。。,0.464224,0.535776,0.284486,1
718,我就客气一下你还当真了,0.514044,0.485956,0.719127,1
718,太后年轻时一定很美,0.842488,0.157512,0.649973,2
718,因为画的妆都一样所以看起来都长得一样,0.531963,0.468037,0.36074,1
718,我还要阻挠小燕子和五阿哥的爱情！不能轻易领盒饭！,0.345703,0.654297,0.231772,0
719,长得和我好像,0.575837,0.424163,0.0574166,2
719,一人分饰两觉,0.533368,0.466632,0.33265,1
719,这太妃长得比高贵妃年轻,0.37617,0.62383,0.164066,0
719,这太妃老戏骨了好吗，你们脸盲关别人什么事,0.078778,0.921222,0.824938,0
720,嬛嬛好可爱,0.665773,0.334227,0.257273,2
719,本宫什么时候才能出来,0.480815,0.519185,0.616304,1
720,怎么长得这么像愉妃啊,0.38267,0.61733,0.149622,0
720,这空调还蛮凉快的么,0.530063,0.469937,0.398737,1
719,这太后和太妃看起来年龄外貌相差也太大了吧,0.061762,0.938238,0.862751,0
720,这太后长的像黑山老妖一样,0.410637,0.589363,0.0874722,0
720,一人分饰两觉,0.533368,0.466632,0.33265,1
720,怎么还不放我出来皮,0.22117,0.77883,0.508511,0
721,我这个大猪蹄子,0.518627,0.481373,0.62746,1
721,不是亲弟弟吗，怎么是两个娘,0.10302,0.89698,0.771066,0
721,我劝我善良,0.271273,0.728727,0.397172,0
721,同父异母也是亲的,0.599604,0.400396,0.110231,2
721,好嘞，我一定抽,0.758504,0.241496,0.463342,2
722,亲弟弟是同父啊，那些都是皇叔的孩子，是堂弟堂哥了,0.654895,0.345105,0.233101,2
721,感觉太后比较适合演红楼梦的贾母,0.71953,0.28047,0.376733,2
722,裕太妃怎么跟我长得这么像啊,0.395225,0.604775,0.121723,0
722,这衣服都好古典加考究,0.804324,0.195676,0.565165,2
723,这个太厚一点太厚的模样都没有。,0.115577,0.884423,0.743161,0
722,我就是太善良了！,0.296534,0.703466,0.341035,0
722,这不是我双胞胎姐姐吗,0.286451,0.713549,0.363442,0
723,节奏好慢，24集了感觉啥也没干,0.327399,0.672601,0.272446,0
723,前边说葫芦娃的明明是米奇好吗,0.247069,0.752931,0.450958,0
723,太后的头型像米老鼠一样，这样好吗,0.366982,0.633018,0.184484,0
724,太后也很可爱哎，怪不得皇上也可爱,0.825779,0.174221,0.612842,2
723,是玉不琢不成器吧没文化还当太后？,0.375375,0.624625,0.165833,0
724,皇额娘你这皮一下很开心啊哈哈哈,0.915823,0.084177,0.81294,2
722,长得好像愉贵妃,0.568977,0.431023,0.0421704,2
724,不是皇上的亲弟弟吗，太后的儿子吗？怎么变成,0.0730959,0.926904,0.837565,0
723,怎么还没到我,0.32062,0.67938,0.287511,0
724,太后好耿直啊哈哈,0.932384,0.0676155,0.849743,2
724,哼，过的好听,0.558761,0.441239,0.0194685,2
724,怎么？不忍心让朕拿鞭子抽一顿啊？,0.392357,0.607643,0.128097,0
725,说句大不敬的话，太后发型像米老鼠,0.371342,0.628658,0.174796,0
725,嬛嬛好皮啊,0.710035,0.289965,0.355633,2
725,嬛嬛好厉害,0.544264,0.455736,0.114715,1
725,我滴妈呀，这个太妃和愉贵人我根本就分不清啊,0.150403,0.849597,0.665771,0
725,我怎么在这儿？,0.329672,0.670328,0.267395,0
725,怎么？不忍心让朕拿鞭子抽一顿啊？,0.392357,0.607643,0.128097,0
726,这俩人确定都是先皇的女人，年龄差的有点大了吧,0.156802,0.843198,0.651551,0
726,这不西游记里喝人血的那个妖精吗,0.191376,0.808624,0.57472,0
726,好可爱的太后,0.746742,0.253258,0.437204,2
726,同父异母的亲弟弟，别的是堂弟,0.538441,0.461559,0.23119,1
726,姐姐就是被这个女人杀害的,0.638659,0.361341,0.197021,2
726,这太后跟我祖母似得,0.340181,0.659819,0.244042,0
727,本宫就故意调戏妹子,0.484899,0.515101,0.697972,1
727,嬛嬛：上一代我活了70多集,0.682177,0.317823,0.293727,2
727,我们一家都是吃可爱长大的,0.891235,0.108765,0.758299,2
727,其实，无论是咬唇妆还是点绛唇在这里都不太合适,0.470775,0.529225,0.415494,1
727,太后的发际线和头发好像一只大米奇,0.602851,0.397149,0.117446,2
728,太后岁数太大了，就比皇上大七岁好吗,0.28552,0.71448,0.365511,0
727,这人怎么这么像皇后呢,0.471854,0.528146,0.437083,1
728,好可爱的太后,0.746742,0.253258,0.437204,2
728,说太后是米奇的别走哈哈哈哈笑得肚子疼,0.65833,0.34167,0.240734,2
729,太后才比乾隆大十多岁，怎么老成这样😂,0.361454,0.638546,0.196768,0
728,这剧是吃可爱火的吧,0.744391,0.255609,0.43198,2
728,越看自己越舒服😍,0.731559,0.268441,0.403465,2
728,太后真可爱,0.549576,0.450424,0.0084877,1
729,寰寰皮一下也很开心😂,0.866965,0.133035,0.704367,2
729,你不亏是我亲娘，一样皮,0.156691,0.843309,0.651798,0
729,太后岁数太大了，就比皇上大七岁好吗,0.28552,0.71448,0.365511,0
729,好可爱的太后,0.746742,0.253258,0.437204,2
729,杨大力你这个大猪蹄子也在看吗,0.386775,0.613225,0.1405,0
730,这太妃和太后年龄差距好大,0.121308,0.878692,0.730428,0
730,等着我马上就要替姐姐报仇了！先让你多活几集,0.816015,0.183985,0.591143,2
730,异母一样是新兄弟好吧，从血缘上来说😂,0.462964,0.537036,0.259286,1
730,我妈妈好可爱,0.737401,0.262599,0.416447,2
730,太后是老戏骨了，但怎么梳古代头发脸这么大,0.261146,0.738854,0.419675,0
730,太后，这不得体,0.369447,0.630553,0.179007,0
731,太后好可爱,0.66815,0.33185,0.262556,2
731,嬛嬛好厉害,0.544264,0.455736,0.114715,1
731,这是愉嫔和皇后的结合体啊,0.688859,0.311141,0.308575,2
731,我妈妈也太可爱了,0.660627,0.339373,0.245837,2
731,这太妃和太后年龄差距好大,0.121308,0.878692,0.730428,0
731,我妈妈好可爱,0.737401,0.262599,0.416447,2
732,一个个擦了多厚的粉，这嘴都下不去嘴！,0.122455,0.877545,0.727878,0
732,嬛嬛好可爱吖,0.703498,0.296502,0.341108,2
732,太后好调皮哟,0.83046,0.16954,0.623244,2
732,嬛嬛好可爱,0.665773,0.334227,0.257273,2
732,慈母多败儿,0.609399,0.390601,0.131999,2
732,这种大脸盘子很符合清朝宫廷女性的特点啊,0.633488,0.366512,0.185528,2
733,真是跟嫔妾长的一模一样啊,0.435766,0.564234,0.0316301,0
733,这大后的妆是照着六小灵童的脸画的吗,0.336298,0.663702,0.252671,0
733,发现一个大秘密，太后居然不是咬唇妆,0.096378,0.903622,0.785827,0
733,一千多点了,0.275,0.725,0.388889,0
733,我以为是愉贵妃呢,0.629678,0.370322,0.177062,2
733,嬛嬛好可爱吖,0.703498,0.296502,0.341108,2
734,别什么都说耿直有时根本就不沾边，玩笑话都要当真🙄,0.151584,0.848416,0.663147,0
734,这个剧里所有人都好可爱呐！,0.72129,0.27871,0.380645,2
734,太后好可爱,0.66815,0.33185,0.262556,2
734,嬛嬛你是得罪造型师了吗？这发型让我不能直视呢。。。,0.340772,0.659228,0.24273,0
734,这太后笑起来真阔怕,0.48553,0.51447,0.710603,1
734,妈呀，在嬛嬛笑起来太妖娆了,0.260679,0.739321,0.420713,0
735,太后阿姨好可爱啊,0.714446,0.285554,0.365435,2
735,太厚的发际线,0.244572,0.755428,0.456507,0
736,皮一下好开心的呀太后,0.772696,0.227303,0.494881,2
736,成功的让本姑凉黑化了,0.615552,0.384448,0.145671,2
736,黑山老妖笑得好妩媚,0.703647,0.296353,0.341437,2
735,哈哈哈哈2倍太好玩了，特别是太后笑的时候,0.740837,0.259163,0.424083,2
735,嬛嬛好可爱,0.665773,0.334227,0.257273,2
735,黑山老妖太后,0.537287,0.462713,0.254266,1
735,确实愉贵人跟这太妃长得很像,0.379843,0.620157,0.155904,0
736,依萍的妈妈呀,0.66048,0.339521,0.24551,2
737,太后是乾隆亲妈怎么可能就大七岁,0.455899,0.544101,0.117971,1
737,皇上的妃子那么多，晚入宫的就是会很年轻啊,0.84817,0.15183,0.662599,2
737,是我脸盲么，这人跟愉嫔长得一毛一样,0.26809,0.73191,0.404244,0
736,真香真香真香,0.569807,0.430193,0.0440158,2
737,这人是嫔妾的双胞胎姐姐,0.645306,0.354694,0.211791,2
737,这个太妃不就是长广王的老妈子,0.260875,0.739125,0.420279,0
737,皮一下好开心的呀太后,0.772696,0.227303,0.494881,2
736,不是记忆中的嬛嬛了,0.23569,0.76431,0.476244,0
738,这块太后演的特别好,0.817823,0.182177,0.595162,2
738,2倍播放，，魔性的笑声,0.49456,0.50544,0.891193,1
738,聂超你个大猪蹄子在看吗,0.329002,0.670998,0.268885,0
738,嬛嬛，你怎么变坏了，会拿人开心了,0.440899,0.559101,0.0202237,0
738,这太后的M发型真的好时尚,0.843091,0.156909,0.651314,2
738,太后一口好牙,0.683017,0.316983,0.295594,2
739,太后发际线不是一般高啊,0.124907,0.875093,0.722428,0
739,感觉皇上额娘和愉贵人长得好像啊,0.554991,0.445009,0.011091,2
739,饭盒热好了,0.663108,0.336892,0.25135,2
740,宫棕山这个大猪蹄子估计是不看延禧攻略的,0.51685,0.48315,0.663004,1
739,太后好可爱,0.66815,0.33185,0.262556,2
740,文静的妈妈杀了宁宁,0.595873,0.404127,0.101941,2
739,这个太妃好眼熟,0.443376,0.556624,0.0147194,0
740,你们都多大年龄,0.512578,0.487422,0.74843,1
740,裕太妃和愉贵人长得挺像的,0.728689,0.271311,0.397087,2
739,别急等我来对付弘昼,0.401277,0.598723,0.108274,0
740,还好还好哈,0.74446,0.25554,0.432132,2
741,现在是愉嫔了好吧,0.608921,0.391079,0.130936,2
741,嬛嬛好可爱,0.665773,0.334227,0.257273,2
741,太后牙真白,0.398481,0.601519,0.114488,0
741,宋老师好亲切,0.909727,0.0902735,0.799392,2
741,历史上太后是乾隆生母，怎么可能只大七岁？,0.505159,0.494841,0.896818,1
740,太后这个动作真的不是美猴王？,0.159145,0.840855,0.646344,0
742,看鞋子的摆放就能看出来性格,0.609526,0.390474,0.13228,2
741,怎么长得那么像我？难道这才是亲妈？,0.270103,0.729897,0.399771,0
742,每次都觉得海兰察声音好奶好可爱,0.857373,0.142627,0.68305,2
742,太后没咬唇妆是因为嘴唇太薄了,0.122527,0.877473,0.727718,0
742,我怎么还不上场,0.162393,0.837607,0.639127,0
743,以后能不能别让郭德纲演太后了，长得太厚,0.285034,0.714966,0.36659,0
743,能当到太后位置的女人都不简单那。,0.209738,0.790262,0.533915,0
743,这回知道为什么朕这么皮了吧,0.364022,0.635978,0.191061,0
742,他们俩都是雍正的妃子，太后比她老太多了吧,0.595335,0.404665,0.100744,2
743,太后：那是，我媳妇熬成婆皮一下开心,0.702376,0.297624,0.338614,2
742,想我媳妇儿,0.524215,0.475785,0.515696,1
743,也是最接地气的太后,0.597154,0.402846,0.104787,2
743,太后笑的好销魂,0.771879,0.228121,0.493065,2
744,寰寰是比较年轻的太后一点都不像,0.335645,0.664355,0.254123,0
744,嬛嬛好可爱,0.665773,0.334227,0.257273,2
744,皮一下很开心,0.8261,0.1739,0.613555,2
744,本来整部剧，就傅恒有看头，现在又多了个五爷弘昼有趣,0.449789,0.550211,0.00046889,0
745,2倍播放是个好东西,0.45278,0.54722,0.0556034,1
744,这不是情深深雨蒙蒙的那个傅文佩,0.166785,0.833215,0.629366,0
745,这个弘昼的娘是好演员都演好角色，这个角色演回坏的,0.534536,0.465464,0.309288,1
744,这一家人都皮,0.619761,0.380239,0.155025,2
746,太后多大年纪了还翘兰花指,0.497461,0.502539,0.949216,1
745,皮一下很开心,0.8261,0.1739,0.613555,2
745,我说怎么看着眼熟，原来愉妃一人饰两个角色,0.355895,0.644105,0.209122,0
746,朱梦露今晚朕要你侍寝,0.586598,0.413402,0.0813279,2
746,恰是这样玩世不恭的小流氓才不会对皇位造成威胁,0.119388,0.880612,0.734693,0
746,天下都是朕的,0.65512,0.34488,0.2336,2
746,这咬唇也是没谁了，外面那么白，里面一点红,0.301501,0.698499,0.329998,0
746,这太后是个爷们儿吧。。。。,0.404445,0.595555,0.101234,0
747,2倍速好好玩,0.583491,0.416509,0.0744241,2
747,尔晴我劝你善良,0.324823,0.675177,0.278172,0
747,还想出宫？朕让你自宫,0.508303,0.491697,0.833937,1
747,不是愉贵人也不是依萍她妈,0.0783001,0.9217,0.826,0
747,那么可爱的吗,0.684986,0.315014,0.29997,2
747,你就是脸盲这完全两个人我真是醉了,0.249395,0.750605,0.44579,0
748,太厚眉毛细了点呀,0.215596,0.784404,0.520898,0
748,主角光环已上线,0.557384,0.442616,0.0164093,2
748,完了完了，现在一看太后就觉得像季检察长,0.63646,0.36354,0.192134,2
745,把速度调成2倍会很欢乐啊哈哈,0.850504,0.149496,0.667787,2
748,不是说和皇上是亲兄弟吗？怎么又是太妃的儿子了呢？,0.146663,0.853337,0.674082,0
748,二倍速有惊喜,0.732327,0.267673,0.405171,2
749,一天能更新完多好,0.529637,0.470363,0.407265,1
748,看来看去就是像榆贵人啊,0.470501,0.529499,0.410013,1
749,这个太妃和我长得有点像啊,0.349026,0.650974,0.224388,0
745,太后杀的她姐姐。还说太后可爱，呵呵→_→,0.850302,0.149698,0.667337,2
749,确实就是惯大的熊孩子,0.593824,0.406176,0.0973856,2
749,这太后长的跟嬷嬷一样,0.406443,0.593557,0.0967937,0
750,这太后岁数大了点，太后不是皇上亲妈，就大个十几岁,0.294473,0.705528,0.345617,0
750,为什么非得带那么多耳环,0.414325,0.585675,0.0792772,0
750,两倍速好魔性,0.677436,0.322564,0.283192,2
750,古人曰：名师出高徒，慈母多败儿。,0.635159,0.364841,0.189243,2
749,太后宋春丽扮演，老戏骨大家嘴下留情，造型不是她的错,0.564223,0.435777,0.0316066,2
749,这皇上对他真的不错了,0.879797,0.120203,0.732883,2
750,太后笑起来好像张瀚,0.566039,0.433961,0.0356416,2
750,皇上的发际线不是一般高啊,0.153934,0.846066,0.657925,0
751,为什么这家人都这么可爱呢,0.605183,0.394817,0.122628,2
751,米奇是认真的吗？？？,0.631058,0.368942,0.18013,2
751,啥时候更新啊,0.503572,0.496428,0.928555,1
751,输了爸爸了,0.688504,0.311496,0.307786,2
751,这太后是嬛嬛?,0.351079,0.648921,0.219825,0
751,这太后是甄环吗？,0.318191,0.681809,0.292909,0
752,这太后脸好方好大,0.569317,0.430683,0.0429262,2
752,我这个大猪蹄子,0.518627,0.481373,0.62746,1
752,这是怡嫔的妈妈？,0.663654,0.336346,0.252564,2
752,皇上这么闲的吗,0.297242,0.702758,0.339462,0
752,我怎么还不露面啊,0.18496,0.81504,0.588977,0
752,皮一下很开心,0.8261,0.1739,0.613555,2
753,尔晴我劝你善良,0.324823,0.675177,0.278172,0
753,根本不是渝妃好吧,0.123687,0.876313,0.725139,0
753,这是怎么回事，五阿哥不是皇上儿子吗,0.113934,0.886066,0.746813,0
753,我多走了一步,0.489207,0.510793,0.78414,1
754,太后看上去还满慈祥的,0.518627,0.481373,0.627466,1
753,黄莛婷，我迟早会去找你,0.353826,0.646174,0.21372,0
753,一对比王爷好大一只哈哈,0.907084,0.0929162,0.79352,2
754,该我出手了,0.406585,0.593415,0.0964767,0
754,咋瞅着一个个面粉吃多了呢,0.201594,0.798406,0.552013,0
754,我最可爱🐸,0.539351,0.460649,0.212977,1
754,弘昼还蛮可爱的呦,0.921251,0.0787487,0.825003,2
754,太后好喜感,0.790179,0.209821,0.533731,2
755,莫名感觉弘昼挺可爱的,0.531128,0.468872,0.377445,1
755,剧情不懂魏璎珞来的时候他才出生怎么能害她姐姐呢,0.40291,0.59709,0.104644,0
755,看到这龅牙，就浑身不舒服,0.197154,0.802846,0.561881,0
755,这个王爷有点帅啊,0.66813,0.33187,0.262511,2
756,弘昼和他额娘要是好的该多好,0.547453,0.452547,0.050931,1
755,兄弟感情真好,0.848203,0.151797,0.662674,2
755,这太后笑声好魔性,0.678956,0.321044,0.28657,2
756,我还敢放你个大猪蹄子出宫,0.374296,0.625704,0.168231,0
756,我觉得弘昼这演员演得不错,0.798146,0.201854,0.551436,2
756,我觉得着王爷挺好玩了...那一晚到底是故意还是醉了,0.55905,0.44095,0.020111,2
