695,纯妃画了个圆蛋,0.67155,0.32845,0.27011,2
690,朕的纯妃心机太重了,0.331649,0.668351,0.263003,0
696,才想起来贤妃刚刚说天气热，纯妃还穿个大袍子,0.601096,0.398904,0.113547,2
695,看来你也不简单,0.140874,0.859126,0.686947,0
696,就知道你没安好心,0.380055,0.619945,0.155434,0
696,Tvb演员出门带着配音听着真舒服一部戏配音很重要,0.771623,0.228377,0.492496,2
695,没那么简单,0.374014,0.625986,0.168857,0
696,我就这么简单,0.510797,0.489203,0.784068,1
696,能不能说人话,0.495983,0.504017,0.919658,1
696,纯妃心里好深最后也死了,0.729326,0.270674,0.398503,2
697,纯妃的丫鬟长得不错,0.881581,0.118419,0.736846,2
697,我有多好，以后就有多坏，明玉有多坏，以后就有多好,0.302973,0.697027,0.326726,0
697,喜欢绿色的都带了绿🎩子吧,0.865018,0.134982,0.70004,2
697,衣服带子没系好,0.539103,0.460897,0.217942,1
698,妃子都很闲啊，到处串门,0.658018,0.341982,0.240041,2
698,于正的戏红了很好演员,0.895923,0.104077,0.768717,2
697,佘诗曼真的特别美,0.736626,0.263374,0.414725,2
698,本宫一点也不纯,0.255868,0.744132,0.431404,0
697,绿绿更健康,0.580046,0.419954,0.0667682,2
698,剧情不错啊越看越有味道了,0.885002,0.114998,0.744449,2
699,你们一个个说的跟真的似的干脆你们来演好了就知道哔,0.156028,0.843972,0.653271,0
698,真的也是厉害,0.293732,0.706268,0.347263,0
699,老娘咋还不出场,0.116993,0.883007,0.740016,0
699,现在两位娘娘都是高段位玩家拭目以待,0.57973,0.42027,0.0660659,2
699,纯妃长的像袁姗姗呢,0.696858,0.303142,0.326351,2
698,看到闲妃有种看港剧的感觉,0.508007,0.491993,0.839864,1
699,来啊～来求我啊～,0.764478,0.235522,0.476617,2
699,纯妃看起来也不纯啊,0.408742,0.591258,0.0916843,0
700,纯妃心机好重啊,0.681394,0.318606,0.291987,2
700,纯妃思想不纯但身体还是很纯的,0.79334,0.20666,0.540755,2
700,只有本宫套路最多,0.366571,0.633429,0.185397,0
700,感觉剧情好慢,0.408312,0.591688,0.0926394,0
700,我一点点也不纯,0.261611,0.738389,0.418641,0
700,纯妃，朕要绿了吗？,0.415495,0.584505,0.0766785,0
701,娴妃看的好眼熟,0.736127,0.263873,0.413615,2
701,女人多的地方是非多，头发也多,0.688863,0.311137,0.308584,2
701,这个纯妃好深的心机，真是怕怕呀！！！之前还挺善良的,0.857035,0.142965,0.6823,2
701,难怪看纯妃怎么眼熟看着像坏人原来是在,0.264692,0.735308,0.411795,0
701,好深的心机,0.794737,0.205263,0.54386,2
701,纯妃也不是什么好鸟,0.337139,0.662861,0.250803,0
702,纯妃是个大傻子吧成妃子还想着一个不可能的男人,0.299093,0.700907,0.335349,0
702,都是学富五车之人，若为男儿，必定封侯拜相之才,0.624122,0.375878,0.164715,2
702,纯妃以后天天晚上来我这,0.68678,0.31322,0.303956,2
702,每次皇后和娴妃一出事，纯妃就来做好人帮助她们太心机,0.814621,0.185379,0.588046,2
702,到第九集都觉得尔晴是好人？她是什么时候变坏的,0.76083,0.23917,0.468511,2
702,都是大猪蹄子,0.594916,0.405084,0.0998141,2
703,纯元是雍正的皇后啊怎么总问,0.544834,0.455166,0.103312,1
703,纯妃看着不像好东西,0.397151,0.602849,0.117442,0
703,你们都不纯,0.215111,0.784889,0.521977,0
703,不求通达显贵只为无愧于心说好几遍了,0.194065,0.805935,0.568745,0
703,这个袍子超美哦,0.921561,0.0784385,0.825692,2
703,反正老娘赢到了最后,0.363589,0.636411,0.192025,0
704,不是无欲无求是所求甚大,0.0815249,0.918475,0.818833,0
704,娴妃戏多点就好了,0.573074,0.426926,0.0512748,2
704,纯妃心眼太多太多了！,0.381179,0.618821,0.152936,0
704,纯妃是正经纯妃不,0.346994,0.653006,0.228902,0
705,纯妃怎么感觉很厉害的样子、皇后和贵妃之间游刃有余,0.626807,0.373193,0.170683,2
704,别管闲事好吗,0.45714,0.54286,0.142793,1
705,这世道怎么变了啊你们不争宠活着干啥,0.18256,0.81744,0.59431,0
704,没点心机怎能在后宫活下去,0.326548,0.673452,0.274337,0
705,纯妃可一点都不纯,0.363347,0.636653,0.192562,0
705,皇后端庄大气,0.853013,0.146987,0.673362,2
705,未来的纯皇后，嘉庆的母亲,0.703157,0.296843,0.340349,2
706,说话声音都好温柔，高贵妃除外,0.705676,0.294324,0.345946,2
705,我只是表面纯而已,0.340489,0.659511,0.243359,0
706,我怎么觉得佘诗曼像大猴子,0.315515,0.684485,0.298855,0
706,佘诗曼脸看着最舒服,0.668523,0.331477,0.263385,2
706,纯妃心机才是真的重,0.525878,0.474122,0.482432,1
706,感觉这个纯妃不纯,0.297362,0.702638,0.339195,0
707,摸着良心说佘诗曼在这些水灵年轻的姑娘里还真不美,0.313021,0.686979,0.304397,0
706,你们差不多行了，改该到我了,0.264283,0.735717,0.412704,0
707,我劝你们都要善良,0.216242,0.783758,0.519462,0
707,爱妃们真懂事啊,0.453883,0.546117,0.077669,1
707,觉得纯妃才是最有心机的，最后她不是纯元皇后嘛？,0.602137,0.397863,0.11586,2
707,你们这些小妮子要造反啊,0.389032,0.610968,0.135485,0
708,纯妃才是心机最深最厉害的人,0.766536,0.233464,0.481192,2
708,总感觉这个纯妃不纯，最有心计的,0.605995,0.394005,0.124434,2
707,听这声音就知道纯妃不简单啊,0.289269,0.710731,0.357179,0
708,我一点也不纯,0.217166,0.782834,0.51741,0
708,咋那么不听话呢,0.374165,0.625835,0.168521,0
708,两个丫鬟好眼熟ya,0.654559,0.345441,0.232354,2
709,有于诗曼这片稳稳的管看，再请来黎姿就完美了！,0.608131,0.391869,0.12918,2
708,来这里就为了跟我说这些？肯定有阴谋,0.436668,0.563332,0.029627,0
709,我劝你善良,0.221201,0.778799,0.508442,0
709,娴妃纯妃都是厉害的主,0.562211,0.437789,0.0271346,2
709,都是水何必装纯,0.336721,0.663279,0.25173,0
709,心机太深了,0.317075,0.682925,0.295389,0
709,不听不听王八念经,0.470377,0.529622,0.40755,1
710,她为了自己不去给家族求情?她爹都不愿意求情好吧,0.0959003,0.9041,0.786888,0
710,哼，一群大猪蹄子,0.441162,0.558838,0.0196408,0
710,我就是想挑拨皇后和皇上之间的关系,0.660582,0.339418,0.245737,2
711,妈蛋，纯妃可是设计了璎珞姐姐的人，竟然说她一直都好,0.603698,0.396302,0.119328,2
710,我劝你善良,0.221201,0.778799,0.508442,0
711,很明显啊。两次拉拢她进皇后派,0.530014,0.469986,0.399715,1
711,纯妃动机可不纯啊,0.611102,0.388898,0.135783,2
711,纯妃这个人真的好难琢磨哦,0.801637,0.198363,0.559192,2
711,纯妃貌似就是大明湖畔的夏雨荷,0.740396,0.259604,0.423102,2
710,纯妃的心思好缜密啊,0.784681,0.215319,0.521514,2
711,哼本宫要你死,0.267612,0.732388,0.405306,0
710,硬气佘诗曼演这种有质感的角色真的很立体,0.599968,0.400032,0.111041,2
712,佘诗曼和王丽坤都是人中位置很深，长得像猴,0.650843,0.349157,0.224095,2
712,我还很善良,0.68054,0.31946,0.290089,2
712,纯妃好深的心机,0.840407,0.159593,0.64535,2
712,纯妃有问题,0.326301,0.673698,0.274886,0
712,于正就喜欢袁珊珊这类型，可以一直捧不红,0.744173,0.255827,0.431496,2
713,一个个的好厉害啊,0.533477,0.466523,0.330458,1
712,来人，给朕拉下去仗毙！,0.428712,0.571288,0.0473064,0
713,完美诠释了古代的大家闺秀，书香门第的教养！！,0.809415,0.190585,0.576478,2
713,我可不简单哦,0.66458,0.33542,0.254623,2
713,纯妃才是主场，城府太深,0.590896,0.409104,0.0908792,2
713,感觉纯妃是找皇上报仇来的,0.717536,0.282464,0.372303,2
713,纯妃不简单啊,0.354194,0.645806,0.212901,0
714,你这个大猪蹄子，来求我不就好了,0.234615,0.765385,0.478633,0
714,感觉娴妃看起来很舒服独特。其他都感觉脸盲,0.888082,0.111918,0.751293,2
714,纯妃我劝你善良,0.360083,0.639917,0.199816,0
714,各位大锅，纯元皇后是上一辈的事了,0.292938,0.707062,0.349026,0
714,于师慢脸好长看起来很老,0.433381,0.566619,0.036931,0
715,娴妃的鼻子越看越像尔康呢,0.65432,0.34568,0.231822,2
715,纯妃心思缜密心机重啊,0.530689,0.469311,0.386213,1
714,你这么心机，当我看不出来吗哼,0.111866,0.888134,0.75141,0
715,纯妃这是在试探哪些人是跟她一派的，城府很深,0.748252,0.251748,0.44056,2
715,这些妃子每一个心机都好重,0.66953,0.33047,0.265623,2
715,放心。总有一天我会弄死纯妃,0.886162,0.113838,0.747027,2
715,本宫才不会后悔,0.0837194,0.916281,0.813957,0
716,在后宫就是看谁的套路深😏,0.546646,0.453354,0.0670838,1
716,纯妃是乾隆的妃子纯元是乾隆他爸的皇后这都分不清,0.560145,0.439855,0.0225437,2
716,这群人，真不让朕放心，还是皇后不让朕操心,0.547444,0.452556,0.0511205,1
716,我真真是不简单啊,0.12276,0.87724,0.727199,0
716,丫鬟娘娘一样的发型，分不清,0.325432,0.674568,0.276817,0
717,闲妃的丫鬟很眼熟，哪部剧里见过,0.558524,0.441476,0.0189432,2
717,喜欢高可爱,0.941329,0.0586708,0.86962,2
717,年轻版容嬷嬷可能会火,0.468352,0.531648,0.367031,1
716,不简单啊不简单,0.12675,0.87325,0.718332,0
717,感觉这个纯妃不怎么纯呢？有点像纯爷们,0.496551,0.503449,0.931011,1
717,你们对朕看法很大？,0.506221,0.493779,0.875581,1
717,感觉是纯妃找人非礼了璎珞的姐姐，纯妃喜欢皇后的弟弟,0.921432,0.078568,0.825405,2
718,纯妃该不会是要废汉兴满吧,0.263082,0.736918,0.415374,0
718,没心机像吉祥那样？活得下去？,0.41575,0.58425,0.0761102,0
718,这货领子这么高,0.29813,0.70187,0.337489,0
718,感觉纯妃不纯,0.315129,0.684871,0.299714,0
718,佘诗曼的法令纹好重,0.589806,0.410194,0.0884575,2
718,我就知道你不纯,0.258685,0.741315,0.425144,0
719,總有一天我會讓皇后姐姐看到皇上有多無能,0.672414,0.327587,0.27203,2
719,写信是认真的吗？拿袖从左至右才对吧，细节真的不严谨,0.168266,0.831734,0.626076,0
719,要想生活过得去头上就得添点绿,0.400626,0.599374,0.10972,0
719,皇后好温柔,0.800786,0.199214,0.557303,2
719,长得一看就是港姐,0.43635,0.56365,0.0303335,0
720,纯妃不简单不简单好像是想当皇后啊,0.34742,0.65258,0.227955,0
719,不找皇后找谁皇后管理六宫是一国之母,0.272325,0.727675,0.394833,0
720,尔晴，我劝你善良,0.324823,0.675177,0.278172,0
720,闲妃的性格果然跟还珠格格里面很像,0.771655,0.228345,0.492567,2
720,不要后悔撒，后面妹妹可不会帮你,0.0586483,0.941352,0.86967,0
720,纯妃不纯，心机太深,0.439832,0.560168,0.0225957,0
720,是时候展现真正的力量了,0.593692,0.406308,0.0970923,2
721,看着纯妃人挺好，难道不是好的？,0.487785,0.512215,0.755698,1
721,纯妃动机不纯啊！,0.410437,0.589563,0.0879173,0
721,感觉纯妃一点都不纯，而且看起好有心机,0.607638,0.392362,0.128085,2
721,感觉纯贵妃很强呀。。。啥时候登场呀,0.80297,0.19703,0.562155,2
721,每当这曲子一出来，我就想起金枝欲孽了,0.484779,0.515221,0.695579,1
722,紫色蹲完下一个,0.580652,0.419348,0.0681153,2
722,后宫妃子哪有一个简单的，简单的能活过3集？,0.383468,0.616532,0.147849,0
721,mad路好长,0.684104,0.315896,0.298009,2
722,本宫是坏人,0.515666,0.484334,0.686676,1
722,这个纯妃好厉害的感觉,0.702957,0.297043,0.339905,2
722,不听不听，王八念经,0.470377,0.529622,0.40755,1
722,能不写这么多字吗,0.35684,0.64316,0.207022,0
723,娴妃我劝你善良,0.306924,0.693076,0.317948,0
723,闲妃写那么久都没写上一个字，穿帮镜头,0.321809,0.678191,0.284869,0
723,纯妃好计谋,0.774071,0.225929,0.497936,2
723,如果这个时候听了纯飞的话，娴妃可能不会黑化。,0.228176,0.771824,0.492941,0
723,刚把皓澜传追完又回来继续看这集吕不韦,0.509976,0.490024,0.800478,1
723,我准备要出现了,0.395531,0.604469,0.121043,0
724,闲妃的观念很正确啊,0.79617,0.20383,0.547044,2
724,我藏得太深、你们谁也看不透！等着瞧吧……,0.334862,0.665138,0.255862,0
724,纯妃你完了,0.618356,0.381644,0.151903,2
724,里面的都好美，宫女都美,0.868233,0.131767,0.707184,2
724,这部戏伺候的仆人戏真多,0.52385,0.47615,0.523002,1
724,本宫要是听了纯妃的话剧情还怎么发展,0.521662,0.478338,0.566755,1
725,深宫中没有心机能活吗,0.35654,0.64346,0.20769,0
725,旁边这个宫女话真多,0.444851,0.555149,0.0114432,0
725,我可真优秀,0.587096,0.412904,0.0824359,2
725,纯妃现在是好的，喜欢皇后弟弟,0.918807,0.0811929,0.819571,2
725,纯妃心思不纯也就是个妃子了,0.52604,0.47396,0.479191,1
726,纯妃什么身份！好神秘！,0.714027,0.285973,0.364505,2
726,纯飞要黑化了,0.500522,0.499478,0.989552,1
726,服装精致，好剧,0.860419,0.139581,0.68982,2
726,纯妃不纯啊，还叫什么纯妃,0.536761,0.463239,0.264773,1
726,阿佘的画风比其他人美多了,0.740487,0.259513,0.423305,2
727,纯妃哪里美？快告诉我,0.789385,0.210615,0.531968,2
726,纯妃，没想到你是这样的人。,0.660093,0.339907,0.24465,2
727,佘诗曼长得好像蜡笔小新他爸爸,0.574952,0.425048,0.0554493,2
727,都说了珍儿不是容嬷嬷，珍儿在最后会吃盒饭的,0.566373,0.433627,0.0363839,2
728,佘诗曼的人中好深,0.762638,0.237362,0.472528,2
727,珍儿就是牛香香，我就说嘛这么眼熟,0.610276,0.389724,0.133947,2
727,后宫的女人心机最深的的就是纯妃，然后就是嘉嫔,0.84525,0.15475,0.656112,2
727,听说皇后被纯妃害死了……,0.416107,0.583893,0.0753175,0
728,纯妃是看能利用则利用，不能利用也要知根底，为以后,0.281505,0.718495,0.374432,0
728,这个背景音乐前三个调调让我串戏金枝玉孽,0.488783,0.511217,0.775655,1
728,我劝你们都善良,0.257905,0.742095,0.426877,0
728,我最可爱嘤嘤嘤,0.560527,0.439473,0.0233923,2
729,我怎么可以拉磨帅,0.629264,0.370736,0.176142,2
728,纯妃后来成了皇贵妃啊肯定厉害,0.446612,0.553388,0.00752793,0
725,略略略就不让你求皇后,0.32913,0.67087,0.268599,0
729,原来魏璎珞是凤囚凰的冯太后啊演技太好了,0.76553,0.23447,0.478955,2
729,我可厉害了我跟你们讲,0.280493,0.719507,0.376683,0
729,最后利用五阿哥出生把高贵妃禁足了,0.68857,0.31143,0.307934,2
729,纯飞怎么那么爱管闲事,0.422106,0.577894,0.0619868,0
730,法令纹好明显，好容易出戏,0.504498,0.495502,0.910034,1
730,后宫的丫鬟长得太像。。分不清,0.272655,0.727345,0.3941,0
730,一入宫门深似海,1,0,1,1
730,大猪蹄子我最懂事了,0.662911,0.337089,0.250912,2
729,手机上计算机技术你撒尿牛丸,0.5001,0.4999,0.998008,1
730,这个阿玛给女儿教的这么好儿子怎么就废了呢,0.416607,0.583393,0.0742073,0
730,我不简单哦,0.461967,0.538033,0.239338,1
731,佘诗曼年轻的时候超美,0.82721,0.17279,0.616022,2
731,配音的声音很好听,0.525592,0.474408,0.488155,1
731,说好话做好事，存好心,0.485219,0.514781,0.704388,1
731,像纯妃这种神秘兮兮的人心机可以说是超级深了,0.82328,0.17672,0.60729,2
731,红色蹲完下一个蹲,0.582956,0.417044,0.0732353,2
731,去就去！你好大的胆子！把他拉出去涨80,0.66092,0.33908,0.24649,2
732,那个说写信从左到右的你多看点书吧,0.20223,0.797769,0.550599,0
732,看着纯妃，总是跳戏去了香蜜,0.670199,0.329801,0.267108,2
732,悟空还不来救为师这些女人总想害为师,0.337054,0.662946,0.250992,0
732,能害一个是一个,0.390925,0.609075,0.131278,0
732,快来求我啊,0.738447,0.261553,0.418771,2
733,高贵妃好可爱,0.688729,0.311271,0.308286,2
733,可以，很好的妃子，坚持本心,0.967036,0.0329643,0.926746,2
733,为什么感觉这个娴妃很眼熟,0.55421,0.44579,0.00935581,2
733,我劝你们都要善良,0.216242,0.783758,0.519462,0
732,就是前期承受的太多后来才会抱怨,0.632569,0.367431,0.183488,2
734,佘诗曼鼻子好尖啊,0.691741,0.308259,0.314981,2
733,纯妃是个对手,0.633307,0.366693,0.185126,2
733,是好人就命不长,0.40553,0.59447,0.0988228,0
734,我就是那么聪明,0.600321,0.399679,0.111825,2
734,这个声音记忆深刻呀,0.463016,0.536984,0.260321,1
734,我一点都不纯,0.216076,0.783924,0.519831,0
734,佘诗曼演的这个皇后是因为小燕子那一伙人被废了吗😊,0.247958,0.752042,0.448982,0
734,什么时候到我出场啊？本宫等了好几天了哇！快点快点！,0.719056,0.280944,0.375679,2
735,这丫鬟那么眼熟呢,0.566368,0.433631,0.0363743,2
735,纯妃那还叫纯,0.574027,0.425973,0.0533933,2
735,太倔强了，一根筋，以后会有祸根,0.305179,0.694821,0.321825,0
735,给我点钱什么都能办成,0.390687,0.609313,0.131806,0
735,娴妃的人中看上去真的很像孙悟空,0.537055,0.462945,0.258897,1
736,纯妃才是心机表，还好关键时刻主角帮着化解了,0.778684,0.221316,0.508187,2
735,娴妃这么好为什么要黑化啊,0.553807,0.446193,0.00845962,2
736,衣服看起来是真心的好，丝绸之感,0.58071,0.41929,0.0682435,2
736,这部剧的人都是一人演多角色吗,0.482667,0.517333,0.653338,1
736,余诗曼超美,0.851862,0.148138,0.670804,2
736,果真是朕的好爱妃,0.78355,0.21645,0.519,2
736,谁说我不纯,0.195227,0.804773,0.566163,0
737,现实中，纯妃的方法是好办法,0.702269,0.29773,0.338377,2
737,皇后娘娘好善良啊！,0.714203,0.285797,0.364896,2
737,好久没镜头了,0.502077,0.497923,0.958464,1
738,不听不听王八念经,0.470377,0.529622,0.40755,1
737,听说有人想坑我,0.201882,0.798118,0.551374,0
737,本宫出淤泥而不染，，，,0.538599,0.461401,0.228014,1
737,天真，纯妃说的不错，可惜后来也黑化,0.776079,0.223921,0.502398,2
738,贤妃性格现在这么好，怎么会演绎到还珠格格那个皇后的,0.667257,0.332743,0.260571,2
738,我什么时候能出来,0.503737,0.496263,0.925259,1
739,觉得佘诗曼以及她旁边的宫女妆容都好正常,0.561577,0.438423,0.0257262,2
738,这个纯妃目标是做皇后，她要干掉皇后,0.782388,0.217612,0.516418,2
739,娴妃长的有点出戏，总感觉在看港剧,0.557933,0.442067,0.0176284,2
738,皇后最好了,0.788845,0.211155,0.530767,2
738,丫鬟长得像胡静,0.489481,0.510519,0.789614,1
739,纯妃是给乾隆生孩子最多的一个,0.75603,0.24397,0.457844,2
739,我跟你们讲啊我可厉害了,0.222722,0.777278,0.505062,0
739,配乐好耳熟,0.710684,0.289316,0.357076,2
740,这些想法真的是上学时候的想法奈何这样不太现实,0.180485,0.819515,0.598923,0
740,还是黑化了啊双面女王,0.383299,0.616701,0.148224,0
739,纯妃不纯啊,0.419916,0.580084,0.0668523,0
740,闲妃才是皇后最佳人选啊！,0.775275,0.224726,0.50061,2
740,纯妃心机深,0.697247,0.302753,0.327215,2
741,不是那个纯皇后好吧！你搞错朝代了吧,0.179513,0.820487,0.601082,0
740,朕今晚想尝尝你了,0.505012,0.494988,0.899765,1
740,纯妃是为了给皇后拉拢队友啊哈哈真爱了,0.920978,0.0790219,0.824396,2
741,我只想单手五杀,0.34268,0.65732,0.238489,0
741,说的好听，不勾引斗角，还针插紫薇,0.382095,0.617905,0.1509,0
741,闲妃才是皇后最佳人选啊！,0.775275,0.224726,0.50061,2
741,支持闲妃感觉她这个事情做得对。,0.720312,0.279688,0.378471,2
741,最后还是听了纯妃的话,0.557421,0.442579,0.0164914,2
742,纯妃长得像新白娘子传奇的兔子精彩茵,0.704984,0.295016,0.344408,2
742,这是金枝玉孽的背景音乐吧！,0.465503,0.534497,0.310067,1
742,娴妃真是贤良淑德秀外慧中，天真淳朴但待后宫不易啊,0.547896,0.452104,0.0420868,1
742,写了那么多笔画不见纸上有字...,0.467557,0.532443,0.351146,1
742,我可真是个小机灵鬼,0.399381,0.600619,0.112487,0
742,看。朕为你打下的江山,0.593991,0.406009,0.0977582,2
743,纯妃：这年头发展下线可真不容易,0.707679,0.292321,0.350397,2
743,我只想自己做皇后,0.390626,0.609374,0.131942,0
743,容嬷嬷年轻时好美,0.525274,0.474726,0.494513,1
743,赐毒酒一杯,0.581223,0.418777,0.069384,2
743,好样的皇后，今晚就轮到你侍寝了,0.51342,0.48658,0.731604,1
743,给佘诗曼配音的一直是同一个人，声音很好听,0.566754,0.433246,0.0372308,2
744,佘诗曼法令纹好深,0.75404,0.24596,0.453423,2
744,这是百里敏香么,0.560734,0.439266,0.0238532,2
744,做好事说好话存好心,0.4912,0.5088,0.823996,1
744,这个丫鬟好面熟啊,0.701952,0.298048,0.337671,2
745,到最后纯妃不纯娴妃不贤因为心中的信仰崩塌了,0.642519,0.357481,0.205597,2
745,皇后娘娘好温柔,0.774351,0.225649,0.498557,2
744,我人太好啦,0.417197,0.582803,0.0728965,0
744,真不让人省心,0.281347,0.718653,0.374784,0
745,这部戏最美就是佘诗曼和皇后，看着比较舒服,0.861603,0.138397,0.692451,2
745,每个人的配乐都好用心,0.893879,0.106121,0.764175,2
745,这时候的娴妃还是很好的，家教也很好,0.97072,0.0292799,0.934934,2
745,纯妃才是最心机的,0.781585,0.218415,0.514633,2
746,纯妃为了拉拢人加入她心爱的女人的阵营,0.742231,0.257769,0.427181,2
746,娴妃这种人在生活中也是大大的有，但是会过的不愉快,0.608539,0.391461,0.130087,2
746,人就要有决心，演的真好。,0.880723,0.119277,0.734939,2
746,啥时候该我上场表演啦,0.61087,0.38913,0.135267,2
746,不愿？后来你比谁都厉害,0.200936,0.799064,0.553476,0
746,哎呦你可真善良早晚老娘砍了你的头,0.129709,0.870291,0.711758,0
747,你大爷的，真是你亲弟看你去不去求情，戏子就是戏子,0.126354,0.873646,0.719213,0
747,这部剧的背景音乐都没停过,0.515082,0.484918,0.698364,1
747,越是这种一天一副楚楚可怜大善人模样的人沉浮越深,0.337166,0.662834,0.250742,0
747,纯妃怕是..喜欢皇后,0.85802,0.14198,0.684488,2
747,比亲弟的性命重要吗,0.544489,0.455511,0.110215,1
747,阿吗就是神,0.445302,0.554698,0.0104403,0
748,纯妃哪有我纯,0.55015,0.44985,0.000333786,2
748,你是认真的吗，那拉氏,1,0,1,1
748,说樱络姐姐是纯妃杀的，能不能好好去看看简介,0.749691,0.250309,0.443757,2
749,确实天真后面她会明白，对皇上的好都是枉然然后黑化,0.502819,0.497181,0.943613,1
749,纯妃希望多一些人在皇后阵营纯妃是真爱皇后啊,0.813927,0.186073,0.586505,2
748,皇后那么善良的人，你们宁愿得罪皇上也不愿意求助人家,0.0952191,0.904781,0.788402,0
748,我才是纯妃,0.629673,0.370327,0.177051,2
749,我不简单昂你们小心点,0.218144,0.781856,0.515235,0
749,闲妃真的好，可惜这样的人一般不会被器重,0.211816,0.788184,0.529299,0
750,可是对你一点好处都没有啊做了善事也不会有人知道,0.0490741,0.950926,0.890946,0
749,亲弟弟都不救，管他犯什么事，先救下再说，哼,0.360878,0.639122,0.19805,0
750,纯元是雍正的妻子现在是乾隆时期了纯妃关纯元什么事,0.639443,0.360557,0.198762,2
750,要是我我能哭着大鼻涕去求情,0.387472,0.612528,0.13895,0
750,纯妃心机好重,0.66022,0.33978,0.244933,2
749,我就是不纯，你们能拿我怎么办,0.405083,0.594917,0.0998155,0
751,不想娴妃黑化啊。。。。多好的人啊很难得哎,0.443149,0.556851,0.0152245,0
750,我就是爱皇后,0.582744,0.417256,0.0727648,2
751,好直白的台词,0.700377,0.299623,0.334172,2
751,后宫套路深啊,0.630877,0.369122,0.179728,2
751,这么好的人黑化了真心心疼啊！,0.639096,0.360904,0.197992,2
752,现在的娴妃多好呀，可惜到最后也变了,0.844399,0.155601,0.65422,2
751,我来救你弟弟,0.607656,0.392344,0.128124,2
750,本宫还没真正上线呢，劝你们善良。,0.238605,0.761395,0.469766,0
752,我太聪明了吧！,0.404245,0.595755,0.101679,0
752,等我当皇后帮你,0.495632,0.504368,0.91265,1
751,好彩妹是你么,0.439338,0.560662,0.0236924,0
752,为了一个站队亲弟的命就不要了,0.202092,0.797908,0.550907,0
753,纯妃本宫劝你善良，挑拨离间没好下场,0.231105,0.768895,0.486433,0
752,劝你们善良,0.21246,0.78754,0.527866,0
752,佘诗曼真的演的好喜欢纯妃不纯,0.680163,0.319837,0.289251,2
753,记住我系讲白话噶,0.4683,0.5317,0.366009,1
753,丫鬟好眼熟啊,0.73126,0.26874,0.4028,2
753,什么时候开通啊,0.556769,0.443231,0.0150412,2
753,我才是宠儿,0.552734,0.447266,0.00607623,2
753,为了不失本心弟弟都不要了，也是厉害,0.145451,0.854549,0.676775,0
754,高贵妃登场,0.566169,0.433831,0.0359309,2
754,你那话说的皇后勾心斗角,0.509846,0.490154,0.803081,1
754,娴妃长得像猴,0.532751,0.467249,0.344981,1
754,娴妃的弟弟自己作死，难道做姐姐的能保护他一世？,0.611479,0.388521,0.136621,2
754,扶弟魔滚好吧,0.674793,0.325207,0.277317,2
754,怎么没下人,0.25292,0.74708,0.437957,0
755,贤妃隐藏的最深,0.776722,0.223278,0.503826,2
755,听说有人要绿朕,0.463498,0.536502,0.269957,1
755,背景音乐太多了质感确实是被拉低了,0.230901,0.769099,0.486887,0
755,这个剧不错，正能量还是很多的,0.868282,0.131718,0.707294,2
756,太正直的人也最容易人设崩塌,0.303801,0.696199,0.324887,0
755,听说有人给我打电话,0.447446,0.552553,0.00567436,0
756,这配乐太金枝欲孽了好怀念,0.475901,0.524099,0.518017,1
755,为原则才不去救弟弟多,0.40078,0.59922,0.109379,0
756,现在这么好，为什么后来对小燕子那么坏,0.387639,0.612361,0.13858,0
756,看着娴妃就不恨不起来不像坏人,0.194337,0.805663,0.568141,0
757,是那个弟弟太不争气了好吧，娴妃很好的,0.835563,0.164436,0.634585,2
756,我不是坏人,0.137177,0.862823,0.695161,0
756,只因为他弟弟没那么重要,0.357849,0.642151,0.204781,0
757,又有想领盒饭的找劳资的事了,0.38223,0.61777,0.1506,0
757,好彩妹不是她演的好吧,0.241996,0.758004,0.462231,0
757,要是没黑化是真的好啊,0.491131,0.508869,0.822614,1
