768,那娴妃不是也被泼了金汁吗，为神马她没事,0.263346,0.736654,0.414787,0
768,只想看不得体cp,0.425784,0.574216,0.0538127,0
768,想看皇后的举手,0.550481,0.449519,0.00106891,2
769,你都不来看看人家，人家要跳楼了,0.235582,0.764418,0.476485,0
768,好像只有皇上没受伤,0.252181,0.747819,0.439598,0
768,本宫可以去领盒饭了，也不用演了,0.618208,0.381792,0.151574,2
769,贤妃心机重死了为啥还害皇后,0.236032,0.763968,0.475484,0
768,娴妃被伤了就不会感染？,0.146356,0.853644,0.674764,0
769,皇上的光头尽然没有伤,0.41756,0.58244,0.0720894,0
769,你还记得大明湖畔的容音吗,0.402147,0.597853,0.10634,0
769,本宫还要睡到什么时候,0.589282,0.410718,0.0872937,2
770,导演玩心计之前剧情不错现在剧情越来越狗血,0.793145,0.206855,0.540321,2
770,大猪蹄子你怎么可以酱紫说人家,0.699463,0.300537,0.332139,2
770,娘娘问得好,0.546436,0.453564,0.0712705,1
770,别装天真，不是你放的金汁吗你还问,0.145742,0.854258,0.67613,0
770,大猪蹄子你忘了皇后吗,0.502132,0.497868,0.95736,1
771,这么高的温度，还有细菌能活吗,0.379288,0.620712,0.157137,0
770,你还在装，不是你加进去的吗？,0.106792,0.893208,0.762684,0
771,什么叫大猪蹄子,0.492041,0.507959,0.840812,1
771,古时候不是都这样叫？贤妃不知道？穿越的吧,0.212381,0.787619,0.528042,0
771,这剧组没钱吗服装就只有那么一两套穿的都要发霉了,0.0923272,0.907673,0.794828,0
771,金枝欲孽娴妃你以前拍的都忘了啊,0.547728,0.452272,0.0454378,1
772,我可厉害了,0.327415,0.672585,0.272412,0
772,我发现贵妃其实是最单纯的,0.472073,0.527927,0.441466,1
772,真不想看嫌肥,0.194606,0.805394,0.567543,0
772,想看娴妃领盒饭,0.426878,0.573122,0.0513813,0
771,高温不是杀菌吗？？？你以为本宫没有读过书？？,0.166076,0.833924,0.630942,0
772,本宫也不知道什么是金汁,0.415891,0.584109,0.0757979,0
773,还好我脸没事，我太开心了,0.453472,0.546528,0.0694477,1
773,大猪蹄子何解,0.590333,0.409668,0.0896278,2
772,一生不坑的，再没点心思，那不废了,0.0137801,0.98622,0.969378,0
773,我来领盒饭了,0.431325,0.568675,0.0414998,0
773,特地刚刚去问度娘,0.417537,0.582463,0.0721396,0
774,纯妃的衣服比其他人的多,0.701762,0.298238,0.337248,2
774,这不是容嬷嬷好吗…容嬷嬷是皇后的乳娘,0.254746,0.745254,0.433898,0
774,不要我了么大猪蹄子,0.267341,0.732659,0.405909,0
774,真会演戏阿，佩服佩服,0.426124,0.573876,0.0530579,0
774,原来是粪水，我以为是金子融化了,0.281584,0.718416,0.374257,0
773,原来古代人没手机玩，玩这个,0.477024,0.522976,0.540473,1
774,如果不是因为经历那些事，她恐怕是最无争的那个,0.0472559,0.952744,0.894987,0
775,大猪蹄子＝不是好东西但是我莫名很喜欢大猪蹄子😂,0.765662,0.234338,0.479248,2
775,本宫还没醒呢大猪蹄子,0.419082,0.580918,0.0687064,0
773,咋不是浓硫酸呢，可能那会还没有吧……,0.0563032,0.943697,0.874882,0
737,还是佘诗曼演技好，都不用画眼线就完成黑化,0.746524,0.253476,0.43672,2
775,古代人说话就是好听。哈哈哈哈大粪水,0.806514,0.193486,0.570031,2
775,本宫领盒饭了,0.380235,0.619765,0.155033,0
775,娴妃心机太深了,0.435721,0.564279,0.0317317,0
776,哇粪水，忍住不笑,0.300026,0.699974,0.333274,0
776,大猪蹄子本宫还在昏迷呢,0.737071,0.262929,0.415714,2
775,那个说金子的出来！！！说不跟化学反映的粗来！,0.148376,0.851624,0.670276,0
776,你个大猪蹄子你放的还问,0.373647,0.626353,0.169673,0
776,宝宝真聪明,0.533592,0.466408,0.328165,1
776,一个个的表面一套背地一套现实也有这么多,0.46762,0.53238,0.352405,1
777,虽然是小说改电视，能不能多点合理性,0.467452,0.532548,0.349036,1
777,好演技啊纯妃娘娘,0.775275,0.224725,0.500612,2
777,佘诗曼演技一流，演坏人都让人爱呀！,0.872283,0.127717,0.716184,2
776,绿色衣服烧坏了，看你以后还穿不穿绿色衣服了,0.431882,0.568118,0.0402624,0
777,哇粪水，忍住不笑,0.300026,0.699974,0.333274,0
777,好高大上的名字，金汁,0.696692,0.303308,0.325982,2
778,是闲妃弄的吗,0.365934,0.634066,0.186812,0
777,什么叫金汁？你心里没个数？,0.288561,0.711439,0.358753,0
778,我昏个迷你们也要看，把本宫当动物园宠物了吗,0.122942,0.877058,0.726796,0
778,再也不能直视金汁麻辣烫了,0.206428,0.793572,0.541271,0
778,尝一碗就知道啥是金汁了,0.503775,0.496225,0.92449,1
778,你还有脸问郑，还不是你做的好事,0.153954,0.846046,0.657881,0
765,大猪蹄子你都不来看看本宫,0.465835,0.534165,0.316698,1
778,快让我出来,0.680083,0.319917,0.289073,2
779,打的一手好牌本宫佩服佩服,0.654252,0.345748,0.23167,2
779,皇上大猪蹄子,0.606232,0.393768,0.12496,2
779,我不要面子了？,0.470541,0.529459,0.410814,1
779,紫禁城的人活在台词里,0.569248,0.430752,0.042773,2
779,不就是娴妃放的吗,0.274266,0.725734,0.390519,0
779,你是认真的吗，竟然问皇上什么是金汁？,0.277071,0.722929,0.384287,0
780,谁来告诉我，谁是顺嫔,0.368623,0.631377,0.180838,0
780,还装不懂？,0.45818,0.54182,0.1636,1
780,我还没醒呢!大猪蹄子!!你快死掉吧!!,0.417513,0.582487,0.0721942,0
780,贤妃没有黑化只是为自己报仇而已,0.32959,0.67041,0.267577,0
780,哈哈，就是我，大猪蹄子看得出来吗,0.863906,0.136094,0.69757,2
780,臣妾并不知情啊～,0.595438,0.404562,0.100973,2
781,宝宝金水，细思极恐啊！,0.494192,0.505808,0.88385,1
781,那我没事吧？,0.433028,0.566971,0.0377144,0
781,金汁好有内涵⊙∀⊙！,0.769163,0.230837,0.487029,2
782,这分明就是要跪妃命啊,0.629639,0.370361,0.176975,2
782,大猪蹄子夸本宫歹毒，好开心啊,0.88641,0.11359,0.747578,2
782,在你的心里，有真心爱过的人吗?,0.241124,0.758876,0.46417,0
782,都给我退下,0.653039,0.346961,0.228976,2
783,粪水得多大的味啊，就那么好混进去,0.450847,0.549153,0.0169444,1
783,粪水说得这么清新脱俗,0.359245,0.640755,0.201678,0
782,说的这么好听,0.53639,0.46361,0.272193,1
783,我还以为金汁是金水……太单纯了……,0.296418,0.703582,0.341294,0
783,朕，太忙了，安慰了这个又安慰那个,0.358548,0.641452,0.203227,0
783,这分明就是要跪妃命啊,0.629639,0.370361,0.176975,2
783,就是这个女人命人放的金汁,0.616734,0.383266,0.148298,2
784,粪的威力好大,0.6432,0.3568,0.20711,2
784,那时候就懂感染这个词嘛？,0.587671,0.412329,0.0837125,2
784,我这几天都没有出现过,0.451056,0.548944,0.0211263,1
784,哎哟喂，粪水叫得这么好听，我还以为是什么呢,0.331608,0.668392,0.263094,0
784,粪水说得这么清新脱俗,0.359245,0.640755,0.201678,0
784,话说，本宫怎么还不上场?,0.210639,0.789361,0.531913,0
785,大肠杆菌是不是你在作妖,0.534849,0.465151,0.303016,1
785,人不犯我我不犯人，人若犯我虽久必诛,0.782,0.218,0.515555,2
785,呀，粑粑这么厉害,0.38654,0.61346,0.141021,0
786,那么高的温度什么细菌烫不没啊？,0.149664,0.850336,0.667413,0
785,那时候知道什么是感染吗？,0.361583,0.638417,0.196482,0
785,哈哈哈，我马上就要去领盒饭啦,0.72693,0.27307,0.393178,2
786,💩c位出道,0.497979,0.502021,0.959582,1
786,金汁演的好,0.796419,0.203581,0.547597,2
785,高贵妃准备领盒饭了,0.423731,0.576269,0.0583756,0
786,贵妃娘娘，你好狠毒啊,0.648902,0.351098,0.219782,2
786,樱洛出的主意啊，关娴妃啥事,0.468415,0.531585,0.368309,1
786,大肠杆菌是不是你在作妖,0.534849,0.465151,0.303016,1
787,大猪蹄来啦,0.641521,0.358479,0.20338,2
787,贤妃：高贵妃打不过我吧，我就是那么强大,0.72637,0.27363,0.391933,2
787,老套路又是扑上去救人没谁了,0.224271,0.775729,0.501621,0
787,叶天士是尝了尝就知道有金汁的，好口福！,0.694468,0.305532,0.321041,2
787,皇上的口红要妖艳,0.543264,0.456736,0.134721,1
787,樱洛出的主意啊，关娴妃啥事,0.468415,0.531585,0.368309,1
788,太后搞个聚会，皇后差点挂了，现在过个寿，贵妃要挂了,0.235669,0.764331,0.476291,0
788,好厉害的大粪,0.600828,0.399172,0.112951,2
788,顺嫔是香妃呀,0.642136,0.357864,0.204747,2
788,本宫何时为妃,0.533172,0.466828,0.336555,1
788,我还以为是把金子融化了叫金汁呢,0.581962,0.418038,0.0710262,2
789,本宫何时能醒,0.472945,0.527055,0.458907,1
788,天呐，粪水还有那么好听的名字,0.583819,0.416181,0.0751526,2
789,古时候打仗也这么味儿吗,0.308029,0.691971,0.315492,0
789,反派就是反派到底哪里可爱了,0.697284,0.302716,0.327298,2
789,谁起的名字……粪水起的这么高大上,0.323819,0.676181,0.280403,0
789,娴妃这个角色好，演得也好,0.791764,0.208235,0.537254,2
789,我还以为是把金子融化了叫金汁呢,0.581962,0.418038,0.0710262,2
790,皇上这个大猪蹄子把本宫忘了,0.60029,0.39971,0.111757,2
790,niu牛乳白洗了，宝宝不开心,0.379787,0.620213,0.156029,0
790,重复感染？这么高的温度，什么毒也消了吧。,0.361307,0.638692,0.197094,0
790,男人都是大猪蹄子，大猪蹄子,0.658519,0.341481,0.241152,2
790,古时候打仗也这么味儿吗,0.308029,0.691971,0.315492,0
790,麻辣香锅是个大傻蛋,0.427633,0.572367,0.0497035,0
791,妈呀，以后牛奶浴都洗不香了,0.20135,0.79865,0.552556,0
791,大猪蹄子是啥意思,0.480438,0.519562,0.608754,1
791,高贵妃真是很直言直语了,0.483338,0.516662,0.666769,1
791,本宫还在躺尸,0.532597,0.467403,0.348066,1
791,糞水不就很明显吗,0.143245,0.856755,0.681678,0
791,用碘伏消毒！,0.537566,0.462434,0.248688,1
792,娴肥的戏太多了，盒饭热几次了,0.361609,0.638391,0.196424,0
792,大肠杆菌的那位，你懂得太多了，比魏缨络还优秀啊,0.652756,0.347244,0.228347,2
792,粪水叫金汁这也是厉害了,0.187006,0.812994,0.584431,0
792,乾隆你个大猪蹄子,0.468191,0.531809,0.363821,1
792,糞水不就很明显吗,0.143245,0.856755,0.681678,0
792,大猪蹄子，你不要你是富察皇后了吗？！,0.221658,0.778342,0.507426,0
793,粪水啥时候有个这样的美妙的名字了？,0.376848,0.623152,0.16256,0
793,本宫就这么领盒饭了,0.329189,0.670811,0.26847,0
793,长见识了，金枝原来是这个意思,0.28136,0.71864,0.374756,0
793,皇上好坏呀,0.607159,0.392841,0.127021,2
793,多情的男人,0.615053,0.384947,0.144562,2
793,粪水叫金汁这也是厉害了,0.187006,0.812994,0.584431,0
794,好大的胆子,0.770826,0.229174,0.490725,2
794,这是大清朝又不是秦朝，感染这词咋了,0.133786,0.866214,0.702698,0
794,那么高的温度，也算肖过毒了吧,0.521188,0.478812,0.576231,1
794,嘿，我说你，我好不容易穿上衣服你又叫我脱下来,0.257517,0.742483,0.427741,0
794,不是，这么高的温度，粪水不也被消毒了,0.0323596,0.96764,0.92809,0
795,哟，打细菌战……高实在是高啊！,0.67385,0.32615,0.275222,2
794,氨水吧怕不是,0.16099,0.83901,0.642244,0
795,那么高的温度，粪水里也没什么细菌了吧,0.182714,0.817286,0.593968,0
795,大猪蹄子，你忘了我吗,0.421017,0.578983,0.0644071,0
795,不科学啊，粪水在那么高的温度下也都会被杀菌了吧,0.314055,0.685945,0.302101,0
795,你个大猪蹄子，想非礼啊,0.474709,0.525291,0.494183,1
796,粪水都可以说成是金汁，长见识了，受教了。,0.258849,0.741151,0.42478,0
795,好了该领盒饭了,0.491666,0.508334,0.833323,1
796,大粪厉害了,0.339728,0.660271,0.245048,0
796,那么高的，不知道那个细菌活的下去,0.365133,0.634867,0.188594,0
796,我还以为金汁是金子练出来的呢原来是便便哈哈哈,0.587614,0.412386,0.0835869,2
796,男人都是大猪蹄子,0.598097,0.401903,0.106882,2
796,金汁原来是粪呀还觉得这么好听,0.571771,0.428229,0.0483796,2
797,皇后:啊！大猪蹄子你等着!导演!古代有搓衣板吗!,0.623866,0.376134,0.164147,2
797,宝宝金水好厉害啊,0.591828,0.408172,0.0929512,2
797,原来粪水还有一个这么高大上的名字,0.376483,0.623517,0.163371,0
797,金汁可是很珍贵的，香水里就有,0.688426,0.311574,0.307613,2
797,没事我都见过高贵妃了,0.554853,0.445147,0.0107851,2
797,金汁原来是粪呀还觉得这么好听,0.571771,0.428229,0.0483796,2
798,大肠杆菌做得好,0.679058,0.320942,0.286795,2
798,你个大猪蹄子白枉费本宫对你那么痴情了,0.400355,0.599645,0.110323,0
798,大猪蹄子，你把本宫置于何地,0.584387,0.415613,0.0764154,2
798,学了个新词，金汁，长见识了,0.542201,0.457799,0.155982,1
798,那娴妃被烫到的铁水里也有金汁喽，怎么没被感染？,0.326035,0.673965,0.275478,0
799,我还没醒你就到处撩你个大猪蹄子,0.304615,0.695385,0.323078,0
799,那么高的温度还有细菌能活。？,0.577417,0.422583,0.0609272,2
798,高贵妃，我劝你善良,0.297414,0.702586,0.33908,0
799,金汁好贵的,0.696959,0.303041,0.326576,2
799,我去，我还是太单纯，我以为是金子水,0.19883,0.80117,0.558155,0
799,大猪蹄子，本宫还在昏迷呢,0.737071,0.262929,0.415714,2
799,皇上下旨让所有人听佐迩弟弟唱的歌,0.642861,0.357139,0.206358,2
800,还以为金汁就是金子化了呢还在想魏璎珞哪来那么多钱啊,0.539133,0.460866,0.21733,1
800,我一打来，就吓了皇上一跳,0.5399,0.4601,0.201999,1
800,还为是金子液化，看来是想多了...,0.460367,0.539632,0.207349,1
800,这戏份还叫多？现在三十二集，就这两集出来的多点,0.56925,0.43075,0.0427772,2
800,没有对比就没有伤害，大猪蹄子,0.251405,0.748595,0.441323,0
800,呵！大猪蹄子！,0.572339,0.427661,0.0496431,2
801,加入蜜汁更好，可以直接开吃,0.838854,0.161146,0.641899,2
801,哈哈，大肠杆菌演得好,0.911165,0.0888345,0.80259,2
801,看本宫厉不厉害,0.150332,0.849668,0.665928,0
801,金子融化的你是认真的嘛,0.697775,0.302225,0.328389,2
802,那么高的温度不知道里面能有多少细菌,0.492453,0.507547,0.849057,1
801,我还以为是金子水呢,0.450726,0.549274,0.0145155,1
801,大猪蹄子上线了,0.629643,0.370357,0.176985,2
802,叫的好高级,0.751863,0.248137,0.448585,2
802,高贵妃领盒饭倒计时⌛,0.476623,0.523377,0.532465,1
802,大猪蹄子对谁都好！,0.778474,0.221526,0.507721,2
802,金子融化的你是认真的嘛,0.697775,0.302225,0.328389,2
803,好多人说我可爱嘻嘻好开心,0.965138,0.0348624,0.922528,2
803,大猪蹄子大猪蹄子,0.678312,0.321688,0.285138,2
802,大猪蹄子，说好的心里只有本宫呢！,0.579416,0.420584,0.0653699,2
803,皇后才病多久？皇上就对别的女人这么好,0.297343,0.702657,0.339239,0
803,皇上没伤着就好,0.407025,0.592975,0.0954998,0
803,贤妃什么时候领盒饭,0.518731,0.481269,0.625375,1
803,男人都是多情,0.554568,0.445432,0.010152,2
804,皇上挺重情义的啊，居然要去护着高贵妃,0.377841,0.622159,0.160354,0
804,还以为是金子熔的水哈哈,0.7977,0.2023,0.550444,2
804,这么厉害的名字,0.32909,0.67091,0.268688,0
804,还叫金汁服了,0.419329,0.580671,0.0681579,0
804,舍不得孩子套不住狼,0.693018,0.306982,0.317818,2
805,一点就这么多那高岂不是满背都是,0.323048,0.676952,0.282115,0
805,哼，本宝宝也超想哭的,0.683007,0.316993,0.295571,2
804,本宫玩得一手好苦肉计,0.740692,0.259308,0.423761,2
805,娴妃才是藏的最深的,0.845123,0.154877,0.655828,2
805,唯有套路得人心,0.48364,0.51636,0.672803,1
805,还以为是金子熔的水哈哈,0.7977,0.2023,0.550444,2
806,如果和璎珞在一起多好,0.446238,0.553762,0.00836015,0
806,皇后快醒醒大猪蹄子在四处留情,0.709442,0.290558,0.354316,2
806,一想到金水我就好兴奋,0.696964,0.303036,0.326586,2
805,大猪蹄子太好攻略了吧,0.523868,0.476132,0.522637,1
806,直接说粪汁不就好了吗,0.156072,0.843928,0.653173,0
806,放心老娘会活到最后一集的,0.920488,0.079512,0.823307,2
806,唯有套路得人心,0.48364,0.51636,0.672803,1
807,果然是厉害，心机到皇上都看不出来，不是一个段位的,0.383476,0.616524,0.14783,0
807,金汁演的好！金汁演的好！,0.859963,0.140037,0.688806,2
807,好疼啊皇上，快给我撒点盐,0.722366,0.277634,0.383035,2
807,皇上好甜啊啊,0.777763,0.222237,0.50614,2
808,这个女人不得了。这么大伤叫都不叫,0.20677,0.79323,0.540511,0
807,最单纯的是皇上，每个女人都骗得了他,0.192388,0.807612,0.572472,0
807,皇后快醒醒大猪蹄子在四处留情,0.709442,0.290558,0.354316,2
808,她的怎么不危及生命呢,0.286613,0.713387,0.363081,0
808,大猪蹄子的声音好苏,0.682693,0.317307,0.294872,2
808,好疼啊皇上，快给我撒点盐,0.722366,0.277634,0.383035,2
808,人前一直温柔的人狠起来更招人恨！尔晴和闲妃就是如此,0.470037,0.529963,0.400737,1
809,佘诗曼太棒了,0.71217,0.28783,0.360378,2
809,TVB准备把这剧改成娴妃为主角,0.48199,0.51801,0.639809,1
809,就不相信你不上钩,0.143211,0.856789,0.681754,0
809,我最可爱呢嘻嘻,0.878331,0.121669,0.729625,2
809,皇后什么时候醒来,0.613232,0.386768,0.140515,2
809,这样能穿衣服吗,0.260375,0.739625,0.421389,0
808,大猪蹄子哼,0.565012,0.434988,0.0333591,2
810,好一个苦肉计啊皇上真的是个猪蹄子,0.515483,0.484517,0.690338,1
810,身子好白哦！,0.844912,0.155088,0.655361,2
811,本宫饿了吃点夜宵，大猪蹄子就不要了！,0.3507,0.6493,0.220666,0
810,金汁演的好,0.796419,0.203581,0.547597,2
810,金汁演得好哦⊙∀⊙！,0.824981,0.175019,0.611069,2
811,有味道的伤口,0.65911,0.34089,0.242466,2
811,大猪蹄子你还怀疑她,0.305284,0.694716,0.321591,0
811,皇上真多情,0.413924,0.586076,0.080168,0
811,好一个苦肉计啊皇上真的是个猪蹄子,0.515483,0.484517,0.690338,1
811,烫成那样也能穿上衣服,0.517695,0.482305,0.64609,1
810,我还躺着呢，大猪蹄子,0.595638,0.404362,0.101417,2
812,本宫要气醒了哼大猪蹄子,0.205219,0.794781,0.543958,0
812,大猪蹄子，你忘了皇后了么,0.555989,0.444011,0.0133089,2
812,你也不看看人家多大面积，我就不信你被烫了不叫,0.115125,0.884875,0.744166,0
812,烫成那样也能穿上衣服,0.517695,0.482305,0.64609,1
812,皇上真多情,0.413924,0.586076,0.080168,0
810,她叫的很不能全天下人都听见,0.427187,0.572813,0.0506949,0
812,本宫以前不屑争斗还真以为本宫是病猫。,0.187837,0.812163,0.582584,0
813,乾小四你个大猪蹄子,0.501558,0.498442,0.968847,1
813,我就是矫情怎么了,0.465123,0.534877,0.302457,1
813,他叫是因为伤很多啊大猪蹄子,0.566818,0.433182,0.0373734,2
813,我可厉害了,0.327415,0.672585,0.272412,0
814,原来我金汁有如此大威力，下次上厕所不敢坐着拉了,0.439312,0.560689,0.0237523,0
813,刚才说金汁很贵的你出来,0.432657,0.567343,0.0385392,0
814,你这个大猪蹄子，我还没醒呢,0.418207,0.581793,0.0706502,0
814,哎我还在昏迷啊！,0.279912,0.720088,0.377973,0
814,乾小四你个大猪蹄子,0.501558,0.498442,0.968847,1
814,张瑜佳是大猪蹄子,0.608138,0.391862,0.129195,2
815,娴妃的苦肉计演的好难怪后面当了皇后,0.472958,0.527042,0.459166,1
813,哇大猪蹄子,0.66985,0.33015,0.266333,2
814,那可不啊高贵妃全后背都是,0.436514,0.563486,0.0299692,0
815,大猪蹄子！这多严重叫还不让了！真想给你一片绿,0.191972,0.808028,0.573395,0
815,金汁这个戏份演得好,0.744619,0.255381,0.432487,2
815,还是皇后好,0.640672,0.359328,0.201493,2
815,大猪蹄子你沙币啊!小高满背都是伤好吗!整个背都是!,0.42293,0.57707,0.0601554,0
815,本宫这是单纯,0.412269,0.587731,0.0838467,0
816,好大的一盘棋啊,0.759306,0.240694,0.465125,2
816,唉，你个大猪蹄子，不来看皇后娘娘了[流泪],0.157179,0.842821,0.650713,0
816,我那是被人算计你个大猪蹄子,0.333459,0.666542,0.258981,0
816,大猪蹄子大猪蹄子大猪蹄子,0.730325,0.269675,0.400722,2
817,人家贵妃伤痕面积多大啊，叫唤两声怎么了？？？,0.565821,0.434179,0.0351585,2
816,佘诗曼给我把衣服穿好，不准给别人看！,0.428458,0.571542,0.0478707,0
816,本宫坚强！要的就是这效果,0.520166,0.479834,0.596684,1
817,你个大猪蹄子，看够了没有,0.510173,0.489827,0.796536,1
817,大猪蹄子，人家痛啊，能不叫吗，高高太单纯,0.386679,0.613321,0.140713,0
817,人家就是疼嘛,0.575855,0.424145,0.0574552,2
818,高贵妃烫得更重好吗？猪蹄,0.552094,0.447906,0.00465247,2
818,一声不吭才可怕好吗你个大猪蹄子，心疼高可爱三秒,0.431454,0.568546,0.0412137,0
817,你也不看看伤口面积，，你个大猪蹄子,0.32693,0.67307,0.27349,0
818,所以说我能够博得好名声，而她只是个宠妃,0.647531,0.35247,0.216735,2
818,大猪蹄子，高贵妃那是满背,0.637894,0.362106,0.195321,2
818,好了朕是大猪蹄子,0.716,0.284,0.368889,2
817,皇上的耳朵好可爱,0.696519,0.303481,0.325597,2
819,附凤女孩有点高兴是怎么回事,0.379842,0.620158,0.155906,0
818,人家贵妃伤痕面积多大啊，叫唤两声怎么了？？？,0.565821,0.434179,0.0351585,2
819,皇上不是很聪明吗？还不是被我耍得团团转,0.0807852,0.919215,0.820477,0
819,也不看看高贵妃烫了多少啊，大猪蹄子,0.44189,0.55811,0.0180211,0
819,果然是大猪蹄子,0.696552,0.303448,0.325672,2
819,人家那面积多大呢,0.612411,0.387589,0.138691,2
820,大猪蹄子不愧是大猪蹄子啊,0.891381,0.108619,0.758625,2
819,高贵妃烫得更重好吗？猪蹄,0.552094,0.447906,0.00465247,2
820,本宫还昏着呢你这个大猪蹄子!,0.399296,0.600704,0.112675,0
820,现实生活中就是这样外表柔弱的人才是狠角色,0.646066,0.353934,0.21348,2
820,高贵妃的面积是多大,0.624182,0.375818,0.164849,2
820,我还在呢大猪蹄子,0.585481,0.414519,0.078846,2
820,人家可厉害着呢,0.493783,0.506217,0.875659,1
821,贵妃烫的多好不，大猪蹄子,0.596559,0.403441,0.103465,2
821,大猪蹄子，男人没一个好东西,0.650596,0.349403,0.223548,2
821,因为贵妃烫的面积和深度都大的多,0.734204,0.265796,0.409341,2
821,人家高可爱都要死了好吗能不叫吗,0.233533,0.766467,0.481038,0
821,娴妃阔怕了，这段位不是一般的高啊,0.35889,0.64111,0.202467,0
822,关键是高可爱是整个背啊,0.828044,0.171956,0.617875,2
821,我好单纯好不做作,0.577562,0.422438,0.0612496,2
822,关键是贵妃面积那么大。。佘诗曼心机那么重,0.623739,0.376261,0.163865,2
822,她的才多大点地方，贵妃的后背全是,0.48692,0.51308,0.738391,1
822,因为贵妃烫的面积和深度都大的多,0.734204,0.265796,0.409341,2
822,哈哈哈哈小高叫的全天下人都听见。就愿意就愿意哈哈,0.926147,0.0738531,0.835882,2
823,这么明显的好话大猪蹄子听不出来吗？,0.131872,0.868128,0.706951,0
822,妈也本宫的受伤面积更大啊,0.523889,0.476111,0.522224,1
823,这次是真疼啊，本宫伤口那么多,0.606072,0.393928,0.124603,2
823,你个大猪蹄子，快把手拿开,0.589677,0.410323,0.0881713,2
823,你看看她多大点伤口你看看我多少！！！,0.381768,0.618232,0.151627,0
823,你个大猪蹄子是不是忘了我皇后小天使啊,0.463836,0.536164,0.276716,1
824,那么高温度烫不熟吗,0.168011,0.831989,0.626642,0
824,乾隆你个大猪蹄子！！！忘了你的富察荣音了么！！！,0.394541,0.605459,0.123243,0
823,她的才多大点地方，贵妃的后背全是,0.48692,0.51308,0.738391,1
824,皇上也不看看人家高可爱烫了多大的伤口,0.688504,0.311496,0.307787,2
824,谁让本宫是高可爱,0.585034,0.414966,0.0778539,2
825,皇上：哭是本分，不哭是坚强。哭是本分，不哭是坚强啊,0.440924,0.559076,0.0201696,0
824,你看看她多大点伤口你看看我多少！！！,0.381768,0.618232,0.151627,0
825,大猪蹄子人家那么大一片叫叫不行吗？高高还是太单纯,0.188908,0.811092,0.580205,0
825,一想到大仇得报，开心到飞起好吗！,0.724167,0.275833,0.387038,2
824,这次是真疼啊，本宫伤口那么多,0.606072,0.393928,0.124603,2
825,真正城府深有心计的就会装的很善良例如闲妃,0.735803,0.264197,0.412895,2
825,大猪蹄子！大猪蹄子！你个大猪蹄子！你把皇后给忘了吗,0.71782,0.28218,0.372933,2
826,高贵妃受伤面积大啊大猪蹄子！,0.6254,0.3746,0.167555,2
826,乾隆你个大猪蹄子,0.468191,0.531809,0.363821,1
826,就算皇上再怎么厉害终究是斗不过后宫的女人啊,0.110909,0.889091,0.753535,0
826,画上去的哪里会疼,0.536979,0.463021,0.260414,1
826,真正城府深有心计的就会装的很善良例如闲妃,0.735803,0.264197,0.412895,2
826,这贤妃真不简单，但还是希望你善良,0.278259,0.721741,0.381647,0
825,本宫以后可以要当皇后的人怎么会被这区区金水吓到,0.362353,0.637647,0.19477,0
827,大猪蹄子阿大猪蹄子,0.66431,0.33569,0.254023,2
827,本宫实力演绎语言的艺术,0.768655,0.231345,0.485899,2
827,因为本宫是王者她是青铜,0.514301,0.485699,0.713974,1
827,高可爱有什么可爱的,0.925405,0.074595,0.834233,2
828,人家不是说了及时治疗就好虽然会留疤,0.505605,0.494395,0.887891,1
827,高贵妃受伤面积大啊大猪蹄子！,0.6254,0.3746,0.167555,2
828,本宫牛乳洗澡！皮肤太嫩，你这大猪蹄子,0.487828,0.512172,0.75656,1
827,因为高可爱的皮比较嫩,0.855143,0.144857,0.678096,2
828,大猪蹄子他的多啊,0.73603,0.26397,0.4134,2
828,大猪蹄子我还在呢，我没死,0.483943,0.516057,0.678853,1
828,三个女人一台戏这么多的女人这一天全是戏哈哈哈哈,0.717615,0.282384,0.372479,2
828,？？你个大猪蹄子也不看看我伤了多少,0.262935,0.737065,0.415699,0
