1353,Y本来觉得贵妃演的太过了，现在觉得这贵妃演的还不错,0.578044,0.421957,0.0623189,2
1353,说得好，本宫的璎珞,0.621859,0.378141,0.159686,2
1353,這倆一場一和皇后成空氣了,0.520776,0.479224,0.584478,1
1353,高贵妃厉害厉害,0.561451,0.438549,0.0254473,2
1353,一本正经的胡说八道,0.60826,0.39174,0.129467,2
1353,这高贵妃宫斗是认真的吗,0.528423,0.471577,0.431533,1
1354,不错，不错，我媳妇儿真不错,0.978667,0.0213335,0.952592,2
1354,贵妃好可爱,0.698493,0.301507,0.329985,2
1354,我好可爱啊,0.698045,0.301955,0.328989,2
1354,高贵妃太可爱了哈哈啊,0.897915,0.102085,0.773145,2
1354,也许你大爷,0.481003,0.518997,0.620065,1
1355,除了人物反转厉害点~真没啥演技可说~除了佘诗曼~,0.128538,0.871462,0.71436,0
1355,贵妃屁事真多,0.511332,0.488668,0.773369,1
1355,剧情智商感人,0.624062,0.375938,0.164582,2
1355,哪有那么多也行,0.481335,0.518665,0.62669,1
1355,演，继续演，贵妃你好棒棒哦,0.867745,0.132256,0.706099,2
1355,高贵妃造型跟大妈一样,0.504538,0.495462,0.909248,1
1356,胸口的血渍是✌️吗,0.367593,0.632407,0.183126,0
1356,高贵妃有点像爵迹里郭采洁演的……,0.641335,0.358665,0.202967,2
1356,这高贵妃早点领盒饭吧,0.401561,0.598439,0.107642,0
1356,不应先救孕妇吗,0.382861,0.61714,0.149199,0
1356,贵妃要领盒饭了啊,0.483386,0.516614,0.667716,1
1354,不是头撞的门么,0.136777,0.863223,0.696051,0
1357,贵妃什么时候领便当,0.602327,0.397673,0.116283,2
1357,高贵妃让嘉嫔玩弄于股掌之间,0.399035,0.600965,0.113255,0
1356,戴着帽子怎么撞,0.487197,0.512802,0.74395,1
1357,我什么时候死,0.376258,0.623743,0.163872,0
1357,皇后娘娘捡到宝了,0.603076,0.396924,0.117948,2
1358,高贵妃怎么年纪看上去好大，40？,0.340676,0.659324,0.242942,0
1358,这小丫头气死本宫了,0.194771,0.805229,0.567176,0
1357,高贵妃什么时候领盒饭呐，恨死我了都,0.477583,0.522417,0.551665,1
1357,贵妃智商下线了,0.556533,0.443467,0.0145169,2
1358,大晚上的看到高贵妃的衣服有点害怕,0.597098,0.402902,0.104661,2
1358,贵妃智商下线了,0.556533,0.443467,0.0145169,2
1358,魏樱络现在这个造型还真是像极了精神有问题的傻大姐,0.355451,0.644549,0.210108,0
1359,为什么不叫太医！于正片子可以了好演员,0.306544,0.693456,0.318792,0
1359,这高贵妃的眉毛舞挺厉害,0.601777,0.398223,0.115059,2
1359,哪儿来那么多也许没准儿，,0.239421,0.76058,0.467954,0
1359,贵妃怎么可以活那么多集,0.560631,0.439369,0.0236238,2
1359,璎珞你好棒啊又为皇后解围了继续说下去封住高妃的嘴,0.960436,0.0395645,0.912079,2
1358,直接问愉贵人就好了他那时候还没晕呢,0.350578,0.649422,0.220938,0
1360,请叫我福尔摩罗,0.429529,0.570471,0.0454907,0
1359,贵妃不是背景强，这智商早真活不了几天,0.180534,0.819466,0.598814,0
1360,发现贵妃智商不高,0.198366,0.801634,0.559186,0
1360,愉贵人：我都要死了你们先救救我好吧,0.304741,0.695259,0.322799,0
1360,高贵妃真力海,0.446507,0.553493,0.00776225,0
1360,太敬业了，脖子上的勒痕,0.288293,0.711707,0.359348,0
1360,高贵妃有意思吗这样……,0.493141,0.506859,0.862812,1
1361,这个高贵妃是个大猪蹄子,0.530371,0.469629,0.392574,1
1361,高贵妃快去领盒饭了大丑鬼,0.300019,0.699981,0.333292,0
1361,救人要紧呐不管我了吗,0.391197,0.608803,0.130674,0
1361,璎珞你脖子上的勒痕勒痕勒痕重要的事情说三遍。,0.227285,0.772715,0.494923,0
1361,挑刺的那么多，怎么不去吃鱼,0.191115,0.808885,0.575299,0
1362,哈哈哈哈贵妃一脸无辜太可爱了吧,0.709725,0.290275,0.354944,2
1362,这个贵妃智商感人,0.609247,0.390753,0.13166,2
1361,我魏璎珞干一行爱一行,0.693067,0.306933,0.317927,2
1362,魏璎珞脖子上的勒痕就是证据,0.372049,0.627951,0.173224,0
1362,贵妃我劝你善良,0.285488,0.714512,0.365583,0
1362,什么叫魔高一尺道高一丈,0.451297,0.548703,0.0259405,1
1363,孕妇早就送去救了好吗,0.484589,0.515411,0.691777,1
1362,这头发咋还没散呢？,0.196823,0.803177,0.562616,0
1363,好咄咄逼人啊这样真的好吗？,0.605676,0.394324,0.123724,2
1363,一个贵妃穿得跟个唱戏的一样……受不了了,0.178207,0.821793,0.603985,0
1363,高贵妃你装装啊,0.474216,0.525784,0.484327,1
1363,太医怎么还没来,0.290313,0.709687,0.35486,0
1363,也许……也许你是个傻子呢,0.316405,0.683595,0.296878,0
1364,璎珞脖子上的红印子，剧组有心了，细节给满分,0.787083,0.212917,0.526851,2
1364,这些人智商真高,0.410398,0.589602,0.0880036,0
1364,早就救走了，你们没带眼睛看电视?,0.239634,0.760366,0.46748,0
1365,高贵妃的戏真多,0.549392,0.450608,0.0121701,1
1364,我有队友带我飞，哈哈……,0.886799,0.113201,0.748442,2
1365,我媳妇最棒,0.888751,0.111249,0.75278,2
1364,高贵妃其实很可爱的嘤嘤嘤,0.821595,0.178405,0.603546,2
1364,我觉得我还能抢救一下,0.579228,0.420772,0.0649521,2
1365,贵妃像精神病院出来的,0.622906,0.377094,0.162013,2
1365,高贵妃啥时候死啊,0.407068,0.592932,0.0954043,0
1365,不是高贵妃，就是纯妃,0.262277,0.737723,0.417163,0
1365,俞贵人不是已经被那两个丫鬟拖走了嘛，救什么救,0.129434,0.870566,0.712369,0
1366,不用猜了一定是高贵人😌😡,0.754975,0.245025,0.455499,2
1366,可能是皇后为了洗脱嫌疑故意让璎珞晚一点去救场啊,0.285644,0.714356,0.365236,0
1366,全屋都是皇后的人贵妃你何必呢,0.563058,0.436942,0.0290185,2
1366,高贵人：这话我没法接,0.457843,0.542157,0.156854,1
1366,本宫什么时候领盒饭？,0.465021,0.53498,0.30041,1
9,0.0190264,1
1366,好心疼这件衣服,0.673927,0.326073,0.275393,2
1367,朕的后宫事儿真多,0.537447,0.462552,0.251051,1
1367,这贵妇这声音好像要断气了似的,0.281184,0.718816,0.375146,0
1367,皇后太没用,0.176515,0.823485,0.607744,0
1368,不觉得吴谨言散下头发顺眼多了吗,0.286891,0.713109,0.362465,0
1367,地上的妃子抬走了吗？,0.428668,0.571332,0.047405,0
1367,让高僵尸领盒饭吧丑的一比,0.125627,0.874373,0.720829,0
1368,说查监控的真是智商感人,0.369114,0.630886,0.179746,0
1368,还是我家令妃厉害👍👍👍,0.492167,0.507833,0.84333,1
1368,高贵妃声音不错,0.806181,0.193819,0.569292,2
1368,哈哈哈哈哈哈妈呀，要笑死我了,0.616412,0.383588,0.147582,2
1369,竟然觉得贵妃很可爱,0.631162,0.368838,0.18036,2
1369,这剧情这台词，于正还是得好好学学啊,0.456364,0.543636,0.127273,1
1369,真相只有一个,0.358473,0.641527,0.203394,0
1369,贵妃比皇后还大吗,0.509746,0.490254,0.805086,1
1368,气的昏古七,0.211946,0.788054,0.529008,0
1369,这一段我倒回去看了好几遍，嘴皮子太溜了,0.292849,0.707151,0.349225,0
1369,看不了高贵妃,0.205749,0.794251,0.542781,0
1370,本宫就是看中你这张巧嘴,0.535479,0.464521,0.290424,1
1370,我觉得愉贵人可以在抢救一下，大家先救人好吧,0.650792,0.349208,0.223982,2
1370,高贵妃你想象力真丰富,0.623273,0.376727,0.162828,2
1370,你们认真点好吗，愉贵人早都出去了,0.651565,0.348435,0.2257,2
1371,璎珞这个样子好可爱,0.647161,0.352839,0.215913,2
1370,有可能你是一头猪呢。,0.501939,0.498061,0.961227,1
1371,哈哈哈哈哈哈高贵妃让我笑出猪叫，这演技是故意的吧,0.596195,0.403806,0.102654,2
1371,居然斗不过一个宫女。。嘉嫔快来，本宫被人欺负了。,0.137366,0.862634,0.694742,0
1370,五阿哥生下来真心不容易,0.555812,0.444188,0.0129151,2
1371,我我我地说，你不是丫鬟吗，自称奴婢才行啊,0.117316,0.882684,0.739299,0
1371,导演让高贵妃领盒饭吧,0.378414,0.621586,0.159079,0
1371,也不是没有这种可能,0.128778,0.871222,0.713827,0
1372,不看了，这就是个圣斗士，总结完毕,0.324519,0.67548,0.278845,0
1372,我就是主角我最厉害你们都聪明不过我,0.565927,0.434073,0.0353936,2
1372,贵妃就只会装,0.56066,0.43934,0.0236887,2
1372,我一人撑起宫斗，也不容易,0.892941,0.107059,0.762092,2
1372,瑜贵人身旁的人呢,0.660204,0.339796,0.244898,2
1372,我靠收了个宝贝小弟,0.339533,0.660467,0.245481,0
1373,也许，是皇后娘娘想把你也害了呢,0.208914,0.791086,0.535747,0
1373,好好笑啊哈哈哈哈哈哈哈莫名好笑,0.939344,0.0606562,0.865208,2
1373,讲话的感觉特别是嘴形有点像丽颖在楚乔传里面,0.540248,0.459752,0.195038,1
1373,对对对，就是像罗海琼，我一直想不起来名字是什么,0.612157,0.387843,0.138126,2
1373,瑜贵人不就知道了吗还用分析什么呀,0.319011,0.680989,0.291086,0
1374,可能是看魏璎珞装傻子看出戏了，怎么看怎么像傻子,0.138155,0.861845,0.692989,0
1373,脖子上有掐痕，为什么不用,0.513365,0.486635,0.732704,1
1374,神探夏洛克的旋律回响在脑海中,0.58065,0.41935,0.0681118,2
1374,璎珞怎么有点像周冬雨,0.43433,0.56567,0.0348217,0
1374,愉贵人已经走了你们在想什么啊扶,0.494824,0.505176,0.896473,1
1374,高贵妃怎么没去死,0.175956,0.824044,0.608986,0
1374,这锅我可不背,0.462305,0.537695,0.246104,1
1375,自从有了璎珞帮本宫怼高贵妃，本宫舒心多了,0.920789,0.0792115,0.823974,2
1375,这死丫头的嘴，气死本宫了,0.205621,0.794379,0.543064,0
1375,这贵妃哪来这么多也许？,0.428562,0.571438,0.0476401,0
1375,贵妃智商堪忧,0.486949,0.513051,0.738981,1
1375,高贵妃这个眼睛牛眼一样，丑爆了,0.304862,0.695138,0.322529,0
1375,这锅我可不背,0.462305,0.537695,0.246104,1
1376,皇后太善良了根本就不是这些坏人的对手,0.0931202,0.90688,0.793066,0
1376,一个王者和青铜之间的对决，看着好过瘾,0.810014,0.189986,0.577808,2
1376,我突然喜欢尔情,0.759714,0.240286,0.46603,2
1376,这贵妃说话是在唱戏吗,0.309262,0.690738,0.312752,0
1376,高贵妃真的是智商下线啊,0.532111,0.467889,0.357783,1
1376,高贵妃：也不是没有这种可能,0.179929,0.820071,0.600157,0
1377,高贵妃这个老妖婆智商都没有还想作妖,0.479174,0.520826,0.583486,1
1377,脖子上那个痕迹很好说明啊,0.815341,0.184659,0.589647,2
1377,高贵妃啥时候死,0.382706,0.617294,0.149542,0
1377,你牛，行了吧,0.349638,0.650362,0.223026,0
1377,长得最丑本宫,0.343013,0.656987,0.237748,0
1378,有点像安以轩,0.533937,0.466063,0.321259,1
1377,宫女称霸整个后宫啊,0.53432,0.46568,0.313592,1
1378,嘴皮子很厉害吗,0.341325,0.658675,0.2415,0
1378,要是明玉来，肯定说不清楚,0.39611,0.60389,0.119755,0
1379,我竟无言以对,0.406464,0.593536,0.0967466,0
1379,看了甄煌再看这些宫斗剧，真是看不起劲,0.275258,0.724742,0.388315,0
1379,说太监要掐死她更有说服力,0.596353,0.403647,0.103007,2
1379,看过历史书没皇后原型就这样醉了,0.240764,0.759236,0.464969,0
1378,这个皇后一点威严都没有，被一个高贵妃任由戏弄,0.367608,0.632392,0.183093,0
1379,哈哈哈厉害了,0.521644,0.478356,0.567118,1
1378,亲自赶到案发现场，不破案对不起她的一番苦心啊！,0.459882,0.540118,0.197647,1
1378,她就是上三白,0.552536,0.447464,0.00563622,2
1379,到底救不救愉贵人，他估计都快死了,0.413204,0.586796,0.0817687,0
1380,高贵妃下去吧！领盒饭去吧昂！乖！王者和青铜不一样的,0.536723,0.463277,0.26554,1
1380,哎哟，原来我这么厉害呢，吓死本宝宝了,0.348453,0.651547,0.225661,0
1380,看本宫的眼睛比你大,0.328957,0.671043,0.268983,0
1380,推论鞭辟入里，真不愧是通天神探,0.505443,0.494557,0.891131,1
1380,贵妃的确装扮很丑，演技浮夸，也许是故意这么演？,0.253589,0.746411,0.436468,0
1381,也许是皇后娘娘想作死呢,0.404442,0.595558,0.10124,0
1381,快去领盒饭,0.645171,0.354829,0.211491,2
1381,这个贵妃挺有感觉的,0.759548,0.240452,0.465663,2
1381,孕妇不能吃人参啊,0.57698,0.42302,0.0599547,2
1381,皇后心地本就善良，不太懂也正常,0.327482,0.672517,0.272261,0
1381,贵妃的确装扮很丑，演技浮夸，也许是故意这么演？,0.253589,0.746411,0.436468,0
1382,你推理能力厉害，行了吧。,0.263988,0.736012,0.413359,0
1382,这下看着真痛快,0.411398,0.588602,0.0857817,0
1382,高贵妃身边也是有嘉嫔，不然活不到现在,0.488373,0.511627,0.767456,1
1383,还会来的是因罗，不然皇后洗不清,0.607126,0.392874,0.126947,2
1383,我竟无言以对,0.406464,0.593536,0.0967466,0
1382,争气啊！太酷了！,0.523569,0.476431,0.528626,1
1382,璎珞真的太厉害了,0.264266,0.735734,0.412741,0
1383,高贵妃长的好像刘雪华,0.680782,0.319218,0.290627,2
1383,璎珞有点帅啊,0.625528,0.374472,0.167839,2
1383,不是说高贵妃是顺便进来的吗,0.105964,0.894035,0.764523,0
1382,小样跟我斗,0.520019,0.479981,0.599627,1
1384,皇后是大家闺秀温柔优雅,0.809949,0.190051,0.577663,2
1383,璎珞真的太厉害了,0.264266,0.735734,0.412741,0
1384,吴谨言演技已经不错了就算是古觉光环演技也很好,0.959972,0.0400279,0.911049,2
1384,高贵妇我劝你善良,0.279343,0.720657,0.379239,0
1384,真的是捡到宝了，能说会道的！哈哈哈,0.753223,0.246777,0.451608,2
1384,这个贵妃为什么能活什么久,0.385202,0.614798,0.143995,0
1385,我感觉，皇后才是幕后指使者,事情不可能这么简单,0.346898,0.653102,0.229115,0
1384,会说话是真的好,0.679488,0.320512,0.287752,2
1385,好厉害啊！点评到位,0.71937,0.280629,0.376379,2
1385,过瘾啊，好过瘾,0.971482,0.0285179,0.936627,2
1385,好聪明的丫头,0.78174,0.21826,0.514979,2
1385,这女孩子我喜欢啊,0.81826,0.18174,0.596132,2
1385,主角光环强大,0.696995,0.303005,0.326657,2
1386,高贵飞内心os:老娘一人撑起宫斗也是不容易,0.850392,0.149608,0.667537,2
1386,这么大问题为何不禀报皇上？这几个人能处理了吗？,0.0746255,0.925375,0.834166,0
1386,说得好，我果真没有看错你,0.427729,0.572272,0.0494923,0
1387,贵妃：好厉害的丫头啊,0.660967,0.339033,0.246594,2
1386,我牛吧，先叉会腰,0.571816,0.428184,0.0484804,2
1386,此刻这么精彩的一幕，皇上竟然不在😂,0.382245,0.617755,0.150567,0
1387,我好菜玩不过你们,0.591605,0.408395,0.0924545,2
1386,为什么你们觉得尔情好坏，我觉得她现在好善良,0.455591,0.544409,0.111817,1
1387,主角开大，拿高贵妃一血，,0.58476,0.41524,0.0772455,2
1387,这个贵妃太猖狂,0.292345,0.707655,0.350344,0
1387,高贵飞内心os:老娘一人撑起宫斗也是不容易,0.850392,0.149608,0.667537,2
1387,我牛吧，先叉会腰,0.571816,0.428184,0.0484804,2
1388,遇事要冷静,0.506132,0.493868,0.877355,1
1388,认真你就输了,0.724761,0.275239,0.388358,2
1388,贵妃能给皇上当妈了，心疼皇上,0.44334,0.55666,0.0147998,0
1388,这个皇后是怎么当上去的,0.405262,0.594738,0.0994168,0
1388,不是说救愉贵人吗,0.131978,0.868022,0.706717,0
1389,高贵风什么时候死啊,0.437939,0.562061,0.0268012,0
1389,遇事要冷静,0.506132,0.493868,0.877355,1
1389,本宫眼光真好，这丫头真机灵。,0.762239,0.237761,0.471643,2
1389,把她拖出去斩了,0.180219,0.819781,0.599513,0
1389,贵妃好霸气，演得好好,0.861583,0.138417,0.692407,2
1389,聪明的人就是不一样,0.707072,0.292928,0.349048,2
1390,皇后原型就是很善良！！！,0.733581,0.266419,0.407958,2
1390,笑死我了带了一堆太监，凶神恶煞,0.565369,0.434631,0.0341539,2
1390,我来活跃下气氛,0.640193,0.359807,0.200428,2
1390,头上一片绿,0.427703,0.572297,0.0495481,0
1390,高贵妃:这让本宫如何是好,0.520778,0.479222,0.584435,1
1390,总是先问了再自己说出来,0.404508,0.595492,0.101094,0
1391,主角光环太强了吧,0.374079,0.625921,0.168714,0
1391,谁先来救救我？？,0.49794,0.50206,0.958805,1
1391,鬼鬼，你咋那么能说呢,0.273439,0.726561,0.392357,0
1391,头上一片绿,0.427703,0.572297,0.0495481,0
.33908,0
1391,皇后原型就是很善良！！！,0.733581,0.266419,0.407958,2
1392,高贵妃是吃饱了没事，闲的吧,0.625502,0.374498,0.167783,2
1392,我就是这么强大,0.625694,0.374306,0.168208,2
1392,这高贵妃也是挺厉害的啊能够这么中气十足,0.498055,0.501944,0.96111,1
1392,本场最佳辩手，反方三辩魏璎珞,0.532214,0.467785,0.355711,1
1392,本宫带来一群无鸟之人？,0.362001,0.637999,0.195554,0
1393,我真是太棒了,0.620757,0.379243,0.157238,2
1392,主角光环太强了吧,0.374079,0.625921,0.168714,0
1393,傅恒那担心的眼神是认真的,0.743931,0.256069,0.430958,2
1393,这个丫鬟太厉害了，果然是主角光环,0.512708,0.487292,0.745836,1
1393,这锅我不背,0.248714,0.751286,0.447303,0
1394,贵妃感觉快下线了,0.655911,0.344089,0.235357,2
1393,主角是真的聪明喜番,0.76949,0.23051,0.487755,2
1394,老高我劝你善良、盒饭还惹着呢,0.201195,0.798805,0.552901,0
1393,眼神太直接了低调点啊跟人吵架一样,0.153414,0.846586,0.65908,0
1394,五阿哥好顽强！,0.708165,0.291835,0.351479,2
1394,反正我已经录屏了我告诉皇上去,0.414336,0.585664,0.0792537,0
1395,这么大个事皇上都不管几个人从这唠嗑,0.422422,0.577578,0.0612835,0
1394,这个丫鬟太厉害了，果然是主角光环,0.512708,0.487292,0.745836,1
1395,这个魏璎珞长得像张钧甯,0.455908,0.544092,0.118165,1
1394,这片过瘾！说的好,0.743894,0.256106,0.430876,2
1395,这丫头好生厉害啊本宫快演不下去了,0.240924,0.759076,0.464613,0
1395,太厉害了。就喜欢看这种。傻白甜没看头,0.32611,0.67389,0.275311,0
1396,璎珞的嘴好大啊,0.756467,0.243533,0.458816,2
1396,我媳妇好聪明好棒,0.823767,0.176233,0.608372,2
1396,璎珞好厉害,0.545089,0.454911,0.0982141,1
1396,不久要领盒饭了,0.212266,0.787734,0.528297,0
1395,我媳妇就是聪明,0.618234,0.381766,0.151631,2
1396,太厉害了璎珞支持你,0.65557,0.34443,0.234599,2
1395,看我冷静辨是非,0.451892,0.548108,0.0378483,1
1396,看我冷静辨是非,0.451892,0.548108,0.0378483,1
1397,高贵妃长得好像孙俪,0.550744,0.449256,0.00165237,2
1397,完了完了，这个丫头片子太厉害,0.49851,0.50149,0.970192,1
1397,我媳妇由我来守护,0.629714,0.370286,0.177141,2
1397,反方二辩过于优秀,0.476504,0.523496,0.530074,1
1397,我有主角光环,0.572229,0.427771,0.0493976,2
1397,好厉害好厉害,0.548975,0.451025,0.0205052,1
1398,主角把贵妃娘娘气到了，看起来好过瘾啊,0.686303,0.313697,0.302896,2
1398,媳妇儿好厉害,0.582848,0.417152,0.0729954,2
1398,你竟然敢怀疑本可爱,0.17961,0.82039,0.600866,0
1398,还用怀疑吗，就是啊高枪枪,0.132863,0.867137,0.704749,0
1398,你竟然敢怀疑本宫双标狗,0.0636247,0.936375,0.858612,0
1399,你都敢污蔑皇后,0.498835,0.501165,0.976708,1
1399,虽然逻辑严密，但没有说服力啊，皇后娘娘很难洗白诶,0.315957,0.684043,0.297873,0
1399,妆画得好浓啊,0.768684,0.231316,0.485964,2
1399,又来惹本宫,0.671806,0.328194,0.270679,2
1399,好厉害的逻辑,0.586349,0.413651,0.0807756,2
1399,你怀疑本宫你怎么没被掌嘴呢？,0.0499089,0.950091,0.889091,0
1400,高贵妃智商不高能有今天的位置，估计是身材有料,0.537241,0.462759,0.255184,1
1400,这时候都是多好的人阿，尔晴还会护着樱珞,0.847413,0.152587,0.660917,2
1400,高贵妃你竟然敢怀疑皇后，欺下范上，给我拖下去领盒饭,0.0621861,0.937814,0.861809,0
1400,那就彻底得罪老女人好了,0.293108,0.706892,0.34865,0
1398,本来就是带的太监太多了，让人起疑啊,0.50614,0.49386,0.877195,1
1400,贵妃是燕我不是药神那个跳钢管舞，女儿得白血病的妈妈,0.440768,0.559232,0.0205153,0
1401,这一幕尔晴还挺美的呵呵,0.89711,0.10289,0.771355,2
1400,哈哈哈哈嘴是真的厲害太會說了,0.498019,0.501981,0.960384,1
1401,我原来是一个好人,0.437292,0.562708,0.0282405,0
1401,这时候的尔晴还是很酷的,0.85894,0.14106,0.686534,2
1401,朕的皇阿玛喜欢绿色,0.850036,0.149964,0.666746,2
1401,期待我变坏,0.608121,0.391879,0.129158,2
1401,说赵英落的你是魔鬼吗,0.421814,0.578186,0.062636,0
1402,看的好过瘾,0.882535,0.117465,0.738966,2
1402,彪悍的人生不需要解释,0.665931,0.334069,0.257624,2
1402,我力气真大,0.295288,0.704712,0.343805,0
1402,我去领盒饭了,0.35604,0.64396,0.2088,0
1402,我原来是一个好人,0.437292,0.562708,0.0282405,0
1388,问玉贵人不就完了吗？,0.191055,0.808945,0.575434,0
1403,这个贵妃长得像刘雪华,0.498671,0.501329,0.973417,1
1403,高贵妃我劝你善良,0.297414,0.702586,0.33908,0
1402,怪不得令妃对五阿哥那么好,0.647668,0.352332,0.21704,2
1403,都好的姑娘啊，怎么就黑化了呢,0.753964,0.246036,0.453253,2
1403,怀疑你怎么滴，就是要盘你,0.126241,0.873759,0.719465,0
1403,贵妃太得了她要是不来这事就怀疑不到她身上,0.0602057,0.939794,0.86621,0
1404,还没走过去，杨手就能打？手事有多长啊,0.496655,0.503345,0.933105,1
1403,这女人得罪老娘了。,0.327179,0.672821,0.272936,0
1404,这会的尔晴好可爱,0.779186,0.220814,0.509301,2
1404,完全不知道高贵妃为啥活这么久，皇上又不喜欢,0.098619,0.901381,0.780847,0
1404,怀疑皇后你没罪怀疑你就有罪了,0.0130626,0.986937,0.970972,0
1404,我希望我善良,0.471841,0.528159,0.436811,1
1404,你厉害得了我？,0.269194,0.730806,0.401792,0
1405,尔晴那一下好霸气，如果她不是坏人该多好。,0.449701,0.550299,0.000664658,0
1405,要是尔晴把它黑化后的那股劲儿用来对付高贵妃该多好,0.133086,0.866914,0.704253,0
1405,尔晴姐姐这一拦好霸气，有木有，好喜欢,0.914674,0.0853263,0.810386,2
1406,好担心她端来的那个盘子里有什么不干净的东西,0.578384,0.421616,0.0630747,2
1405,这个璎珞演的太聪明了，有点不合常理,0.402968,0.597032,0.104515,0
1406,高贵妃我劝你善良,0.297414,0.702586,0.33908,0
1405,怀疑皇后你没罪怀疑你就有罪了,0.0130626,0.986937,0.970972,0
1406,高可爱啊，咱好好的吧！要不你就领盒饭啦,0.86859,0.13141,0.707977,2
1406,真是好样的，不会是皇后身边的,0.278553,0.721447,0.380993,0
1405,完全不知道高贵妃为啥活这么久，皇上又不喜欢,0.098619,0.901381,0.780847,0
1406,贵妃长得像秦俊杰啊,0.561659,0.438341,0.0259089,2
1406,尔晴那一下好霸气，如果她不是坏人该多好。,0.449701,0.550299,0.000664658,0
1407,贵妃还是蒋欣演的好,0.681362,0.318638,0.291915,2
1407,我劝你们都善良,0.257905,0.742095,0.426877,0
1407,高贵妃的丫头太抢戏了,0.372032,0.627968,0.173262,0
1407,这个贵妃更像太后，好老相,0.653874,0.346126,0.23083,2
1407,我刚刚一直在想永和宫咋这么耳熟原来是永琪的宫殿,0.510966,0.489034,0.780684,1
1407,高贵妃我求求你快死吧,0.584376,0.415624,0.0763901,2
1408,主角嘴动的太厉害了吧，有点出戏,0.386651,0.613349,0.140775,0
1408,高贵妃怀疑皇后按她刚刚所说的道理不也是以下犯上吗？,0.0509269,0.949073,0.886829,0
1408,我这次有点善良,0.362859,0.637141,0.193646,0
1408,璎珞可真聪明,0.469057,0.530943,0.381145,1
1408,高贵妃的丫头太抢戏了,0.372032,0.627968,0.173262,0
1409,尔晴为什么黑化呀真是的多好的姑娘,0.542791,0.457209,0.144187,1
1408,难道高贵妃不是以下犯上吗,0.0616749,0.938325,0.862945,0
1409,现在的尔晴还是很可爱的,0.825331,0.174669,0.611848,2
1409,这逻辑思维能力爆表,0.51385,0.48615,0.723003,1
1409,皇后感觉没用了点主角光芒太强了,0.333295,0.666705,0.259344,0
1409,高贵妃的婢女长得真壮硕,0.455788,0.544212,0.115753,1
1410,尔晴好可爱啊,0.819858,0.180142,0.599685,2
1409,这个剧：我劝你善良！,0.272279,0.727721,0.394935,0
1410,这肯定是假牙吧，高贵人的丫鬟,0.536861,0.463139,0.262775,1
1410,谋害皇嗣这么大的事，为何不先来给朕说,0.567216,0.432784,0.0382576,2
1410,我劝你善良否则你一下子就该去领盒饭,0.104403,0.895597,0.767993,0
1410,尔晴我劝你一直这么善良,0.329795,0.670205,0.267123,0
1410,这逻辑思维能力爆表,0.51385,0.48615,0.723003,1
1411,其实你们不觉得主角总开大是因为坏人心里有鬼吗,0.207676,0.792324,0.538498,0
1411,两个尔晴，俩人长的好像啊,0.613583,0.386417,0.141296,2
1411,刘诗诗来演就好了,0.59817,0.40183,0.107044,2
1411,说明玉拦的好的你要不要再看一遍,0.547646,0.452354,0.0470734,1
1411,我不想领盒饭。,0.32746,0.67254,0.27231,0
1411,这个高贵飞是蒋欣来演就好了,0.485412,0.514588,0.708249,1
1412,即使聪明也不该显得自己很厉害似的说要说得缓点,0.220416,0.779584,0.510186,0
1412,我可真是一个小机灵鬼,0.430649,0.569351,0.0430012,0
1412,这个璎珞说话的表情真讨打,0.258418,0.741582,0.425738,0
1412,可气死我老高了,0.130043,0.869957,0.711015,0
1412,那个。。能不能先扶本宫起来。。。,0.57523,0.424771,0.0560656,2
1413,我劝你们都善良,0.257905,0.742095,0.426877,0
1413,这么滑稽，这片中的手段都是小儿科,0.252828,0.747172,0.43816,0
1412,声音演技的感觉都像颖宝,0.505812,0.494188,0.883765,1
1413,这嘴皮子真厉害,0.472147,0.527853,0.442937,1
1414,宫斗也得力气大啊,0.547587,0.452413,0.0482619,1
1413,我忍，我忍，啊！忍不住了，来人，掌嘴,0.551075,0.448925,0.00238803,2
1413,高贵妃我就是想给j自己加戏,0.576141,0.423859,0.0580913,2
1414,高贵妃还有三秒领盒饭，请进行加热,0.467913,0.532087,0.358264,1
1414,我不管，不管不管！,0.520332,0.479668,0.593365,1
1413,有几分张钧蜜的感觉,0.646924,0.353075,0.215388,2
1414,以下犯上？高贵妃你是个der啊,0.48671,0.51329,0.734208,1
1414,口才很重要,0.501323,0.498677,0.973541,1
1415,眉毛不对称,0.515043,0.484957,0.699134,1
