1,走之前一定要脱下那红配绿，换身朴素的衣服,0.650608,0.349392,0.223574,2
1,娴妃最厉害的是算准了高会走位，然后时间掐好。不简单,0.555466,0.444534,0.0121476,2
1,高贵妃就是个一身紫装缺没有技术含量的人物,0.463482,0.536518,0.269638,1
1,我们都能干啥了,0.561969,0.438031,0.026598,2
1,皇家要活得体面。高妃虽然让人憎恶，她这性子确实厉害,0.590082,0.409917,0.0890721,2
1,明明是魏璎珞怎么扯上我了,0.0870936,0.912906,0.806459,0
2,贵妃娘娘不成了,0.390907,0.609093,0.131319,0
2,曹若薇第一,0.61199,0.38801,0.137757,2
3,我天使也有些可爱啊,0.801201,0.198799,0.558224,2
4,皇上个大猪蹄子,0.574688,0.425312,0.0548612,2
3,这标题看得我肝疼,0.480352,0.519648,0.607045,1
4,高贵妃你该去领盒饭了拜拜了,0.198759,0.801241,0.558314,0
5,贤芬啥时候会死,0.449676,0.550324,0.000720554,0
5,嗨，告诉你们好消息周二到周日每天两集奥😁,0.55269,0.44731,0.00597821,2
6,高贵妃要领盒饭了人！！,0.417404,0.582596,0.072435,0
5,每天更新骗人的,0.181397,0.818603,0.596895,0
6,本宫来追剧了,0.513916,0.486084,0.721676,1
7,骄傲的活着,0.716418,0.283582,0.369818,2
8,看标题就知这集精彩,0.375894,0.624106,0.164681,0
9,耐心看开头~,0.694535,0.305465,0.32119,2
10,不是说把她两个妹妹杀了吗,0.0791361,0.920864,0.824142,0
8,就喜欢看这个标题,0.775983,0.224017,0.502184,2
7,呜呜呜皇后,0.549698,0.450302,0.00603556,1
10,这集要搞事情,0.413733,0.586267,0.0805936,0
13,这宫里每个人都有自己的故事,0.688247,0.311753,0.307215,2
15,正规学校毕业的记者是嫩头清就算再想表现也不敢大胆！,0.604555,0.395445,0.121234,2
15,居然加更。,0.372853,0.627147,0.171437,0
15,怎么没有更新,0.250897,0.749103,0.442452,0
15,这么早就更新啦？！,0.513033,0.486967,0.739349,1
16,大家一起来看剧,0.539524,0.460476,0.209522,1
11,一看标题就不简单,0.183264,0.816736,0.592746,0
16,怎么还不更新啊,0.198738,0.801262,0.55836,0
17,我吉祥又活了,0.504123,0.495877,0.917533,1
17,让我们嗨起来好嘛,0.604093,0.395907,0.120206,2
17,估计高贵妃要领盒饭。。。,0.334247,0.665753,0.257229,0
17,太好了，周二就可以更新了,0.917614,0.0823856,0.816921,2
17,什么时候更新？,0.547451,0.452549,0.0509751,1
18,喜欢高贵妃,0.869828,0.130172,0.710728,2
18,死了好开心,0.52609,0.47391,0.478203,1
18,今天加更，耶耶耶,0.544807,0.455193,0.10385,1
18,标题大快人心啊,0.561741,0.438259,0.0260909,2
19,袁春旺就是吴总管害我看了半天,0.599612,0.400388,0.110249,2
19,本宫马上就要领盒饭了,0.434377,0.565623,0.0347167,0
19,高贵妃和年贵妃好像啊,0.713596,0.286404,0.363546,2
20,小剧场我劝你善良,0.302973,0.697027,0.326726,0
19,标题使我激动,0.703349,0.296651,0.340775,2
20,贵妃别走！,0.595039,0.404961,0.100086,2
21,本小可爱就要领盒饭啦啊哈哈哈哈😄,0.733192,0.266808,0.407092,2
21,前奏有点好听,0.36213,0.63787,0.195267,0
21,最近的剧情很拖拉,0.77654,0.22346,0.503421,2
22,俞乐佳在看吗,0.364705,0.635295,0.189544,0
21,看标题就爽。,0.759574,0.240426,0.465721,2
23,上一集啥也没有……,0.549068,0.450932,0.0186324,1
24,为啥34又成预告了呀,0.438237,0.561763,0.0261402,0
24,有人要报复我？,0.515204,0.484796,0.695923,1
26,随便一截屏都是画啊,0.473196,0.526804,0.463923,1
26,来回忆高可爱,0.87297,0.12703,0.717711,2
26,怎么这么卡，晚上追剧这班待遇……,0.302226,0.697774,0.328386,0
26,周二就开始了,0.529842,0.470158,0.40316,1
26,本宫这集就下线了,0.507312,0.492688,0.853753,1
27,太棒了，加更了,0.717682,0.282318,0.372626,2
27,这周开始是每天更新两节嘛,0.522566,0.477434,0.548674,1
27,本高贵妃明明就是一个小可爱嘛,0.329059,0.670941,0.268758,0
26,我来看看高贵妃领盒饭了没有,0.386931,0.613069,0.140154,0
28,以后可以多看了,0.703086,0.296914,0.34019,2
28,魏璎珞把骨灰撒入井中是哪一集,0.521423,0.478577,0.571532,1
31,以后可以多看了,0.703086,0.296914,0.34019,2
31,剧情不拖拉呀,0.310079,0.689921,0.310935,0
31,标题谁写的给他满分,0.667121,0.332879,0.260269,2
27,2倍速看的很捧腹大笑小高,0.586643,0.413357,0.0814296,2
32,片头片尾都好美，音乐也好听,0.729224,0.270776,0.398276,2
32,又可以多看啦,0.806403,0.193597,0.569784,2
33,很喜欢片头,0.911774,0.0882261,0.803942,2
34,我媳妇儿就是可爱,0.77789,0.22211,0.506422,2
33,皇后啊你咋还没来,0.237513,0.762487,0.472193,0
34,我什么时候出来,0.516091,0.483909,0.678183,1
35,啊我咋还没出场,0.250605,0.749395,0.4431,0
35,高贵妃这集领盒饭吗？,0.35674,0.64326,0.207244,0
33,太好了，加更了，一直在等呢。,0.929617,0.0703833,0.843593,2
37,我好像快领盒饭了,0.526515,0.473485,0.469693,1
39,这部剧的色调真美啊,0.632189,0.367811,0.182641,2
38,片头依旧那么美,0.70279,0.29721,0.339532,2
37,感觉皇后在高处往下看的这张就预示着她要跳楼,0.533641,0.466359,0.327179,1
40,加更是每天都可以看了吗,0.599736,0.400264,0.110524,2
40,幸福来的措不及防,0.587105,0.412895,0.0824561,2
40,今天周二两集信息量hin大啊,0.634175,0.365825,0.187057,2
38,其实高贵妃很美，只是这个妆剧情需要声音也独特，哈哈,0.964494,0.0355056,0.921099,2
40,周二见了各位小可爱,0.356799,0.643201,0.207113,0
41,前奏有些好听哦,0.760984,0.239016,0.468852,2
41,尔晴怎么不去死,0.12312,0.87688,0.726401,0
41,周二到周日！,0.608989,0.391011,0.131087,2
42,我只喜欢看璎珞和富察皇后,0.761995,0.238005,0.4711,2
45,标题真是大快人心啊,0.429366,0.570634,0.0458532,0
46,更新改时间了。真好,0.695601,0.304399,0.323557,2
47,片头曲风格想那年花开,0.590892,0.409108,0.0908715,2
46,本宫是皇后,0.544153,0.455847,0.116948,1
47,快点更新吧,0.455946,0.544054,0.118921,1
45,今天开始每天更新两集是不是真的,0.496188,0.503812,0.923754,1
43,第一次看片头,0.554699,0.445301,0.0104431,2
48,樱落的长相好像那朝代的人，好有代入感,0.677919,0.322081,0.284264,2
42,是不是从这开始贤妃彻底黑化，,0.31544,0.68456,0.299022,0
48,片头曲不错！,0.88933,0.11067,0.754067,2
49,欧欧欧这段是真的好听,0.5911,0.4089,0.0913326,2
52,为什么高贵妃会找这么丑又这么扭捏做态的演员来演😓,0.226802,0.773198,0.495996,0
50,周一不更，是它最后的倔强,0.404344,0.595656,0.101458,0
49,第一次看片头,0.554699,0.445301,0.0104431,2
52,周一表示得罪谁了,0.332737,0.667263,0.260585,0
53,真好听，画面也大气磅礴，于妈这次逆袭了,0.680055,0.319945,0.28901,2
50,都三十多集了还没成令妃,0.587387,0.412613,0.0830823,2
54,哦~原来聂远是特别出演啊,0.721125,0.278875,0.380277,2
58,这标题看的都解气,0.567523,0.432477,0.0389397,2
56,希望每天都多更新两集，，，，，,0.684793,0.315207,0.29954,2
59,就想问下张嘉倪啥时出来,0.346498,0.653502,0.230004,0
60,片头太美了,0.436311,0.563689,0.0304189,0
58,有点像沙海的片头了,0.51921,0.48079,0.6158,1
61,周一做错了什么,0.451349,0.548651,0.02698,1
61,等不及了，，，希望多更新,0.600832,0.399168,0.112959,2
63,听说有加更，就来围观，结果发现是高贵妃的盒饭,0.243351,0.756649,0.45922,0
53,我可真是个小机灵鬼,0.399381,0.600619,0.112487,0
64,高贵妃其实很美,0.838149,0.161851,0.640332,2
66,我什么时候上场,0.526547,0.473453,0.469053,1
67,这唱歌的人感觉跟疯子一样。,0.401001,0.598999,0.108886,0
69,周一绝望了,0.503178,0.496822,0.936439,1
70,张嘉倪为什么还没出来？不是主演吗,0.0673102,0.93269,0.850422,0
68,为什么为什么为什么还不更新,0.0890934,0.910907,0.802015,0
70,贵妃要领盒饭了,0.443074,0.556926,0.0153916,0
70,这服装看起来很贵,0.506145,0.493855,0.877092,1
67,周一惹谁了？,0.42286,0.57714,0.0603117,0
72,今天更新嘛？？？,0.548836,0.451164,0.0232804,1
74,可怜傅璎女孩，他们注定有缘无分,0.204901,0.795099,0.544665,0
75,我为什么还不出来,0.173303,0.826697,0.614881,0
77,更新，好期待,0.780055,0.219945,0.511233,2
79,有人在听片头曲吗,0.387398,0.612602,0.139116,0
80,愉贵人下线了呀,0.539138,0.460862,0.217233,1
80,舍不得跳过片头,0.619304,0.380696,0.154009,2
72,是以后都这样播吗,0.242165,0.757835,0.461856,0
83,片头都这么美,0.720498,0.279502,0.378885,2
83,舍不得看所以搭着看片头,0.575595,0.424405,0.0568778,2
84,惊喜今天更新,0.752677,0.247323,0.450393,2
84,片头很好呀,0.92864,0.0713598,0.841423,2
85,片頭片尾都聽,0.498783,0.501217,0.975657,1
83,王俊凯开始你的格斗了，学的肿么样！,0.365843,0.634157,0.187016,0
86,没得看就来看片头,0.71516,0.28484,0.367022,2
86,我怎么想起了红楼梦呢,0.449485,0.550515,0.00114494,0
88,片头画面太美了,0.537579,0.462421,0.248427,1
88,于正翻身了！,0.494988,0.505012,0.899756,1
89,片头是真的美,0.675591,0.324409,0.279091,2
90,该叫老高吧,0.321276,0.678724,0.286053,0
88,诡异的片头,0.388375,0.611625,0.136945,0
88,不想看娴妃那虚伪的嘴脸,0.23327,0.76673,0.481623,0
90,这段腔戏有点诡异…,0.250234,0.749766,0.443925,0
91,高贵妃唱的吧？,0.530386,0.469614,0.39228,1
91,片头曲很美的,0.876469,0.123531,0.725487,2
91,高贵妃妆容演技都很好很喜欢很可爱的,0.989484,0.010516,0.976631,2
91,我怎么觉得这是高贵妃唱的呢,0.464275,0.535725,0.285494,1
92,高贵妃从头到尾给我感觉像在演京剧,0.483989,0.516011,0.679788,1
94,其实啊我最善良,0.58201,0.41799,0.0711328,2
92,有，这次剧真用心了,0.660514,0.339486,0.245587,2
93,片头曲真的很有个性，有很符合本剧，我开始爱上京剧了,0.925561,0.0744392,0.834579,2
97,海上课开始看,0.556084,0.443916,0.0135193,2
97,周二开始播啦,0.588364,0.411636,0.0852537,2
100,相爱的人总是走不了婚姻的殿堂,0.303208,0.696792,0.326205,0
101,杰哥在看吗,0.397447,0.602553,0.116785,0
100,小高要被烫了小高要被烫了,0.272827,0.727173,0.393718,0
102,贵妃跟皇上妈似的,0.414255,0.585745,0.0794343,0
102,看到这个标题我就放心了,0.751586,0.248414,0.44797,2
100,知道是报复高贵妃我就放心了,0.832841,0.167159,0.628535,2
102,大猪蹄子🐷,0.620561,0.379439,0.156801,2
102,今晚你就要挂了,0.327181,0.672819,0.27293,0
102,这集。。。。是不是高贵妃要玩了,0.503544,0.496456,0.929121,1
102,都舍不得看了,0.677842,0.322158,0.284094,2
103,看標題哇好啊,0.716607,0.283393,0.370238,2
103,盒饭热了又热，热了又热,0.415683,0.584317,0.07626,0
103,高贵妃的段位都没其他几位深啊，让人恨不起来,0.375675,0.624325,0.165168,0
103,这唱戏声好悲,0.443446,0.556554,0.0145645,0
103,大家看我表演,0.54598,0.45402,0.0804031,1
104,高贵妃刚刚说的话好可爱，尾调喽,0.686802,0.313198,0.304005,2
104,本宫不出意外盒饭也该热好惹😆😆😆,0.507076,0.492924,0.858472,1
104,高贵妃你个大猪蹄子快下线吧你,0.497638,0.502362,0.952763,1
103,脖子洗干净,0.41114,0.58886,0.0863552,0
104,哎呀！妈也！魏樱诺好大的胆子！早就被砍头了吧！,0.484833,0.515167,0.696667,1
104,本宫临死都没穿上新衣服,0.585217,0.414783,0.0782594,2
104,高贵飞你不太会说话呀,0.185472,0.814528,0.58784,0
105,本宫不出意外这集要领盒饭了,0.434567,0.565433,0.0342962,0
105,想到要领盒饭还有点激动呢,0.670765,0.329235,0.268367,2
105,高贵妃领盒饭，锦绣领盒饭,0.385694,0.614306,0.142902,0
106,贵妃单纯的让人心疼了,0.478238,0.521762,0.564752,1
106,想看一下特效是否厉害,0.279918,0.720082,0.37796,0
105,陈宇倩你个大猪蹄子,0.457876,0.542124,0.157522,1
106,艾玛这标题我好激动,0.740032,0.259968,0.422293,2
105,看到这个标题，本宫甚是开心！,0.513152,0.486848,0.736961,1
106,看到标题很是开心,0.742186,0.257814,0.427079,2
106,大猪蹄子是什么意思,0.414785,0.585215,0.0782561,0
106,看标题就去觉得痛快呢,0.592279,0.407721,0.0939543,2
107,高贵妃你乖哦！快去领盒饭啦,0.734038,0.265962,0.408972,2
107,这标题让人看得舒服,0.700763,0.299237,0.33503,2
107,标题令人兴奋,0.598154,0.401846,0.10701,2
107,贵妃长点心眼吧，都快领盒饭了,0.32058,0.67942,0.2876,0
108,开头背景音乐一定要这么响么大晚上吓一跳,0.353076,0.646924,0.215387,0
105,远盛是个大猪蹄子,0.527373,0.472627,0.452536,1
107,说她可爱的怕是对这个词有什么误解,0.688847,0.311153,0.308549,2
107,高贵妃，本宫也要送你一份大礼,0.658419,0.341581,0.240932,2
108,高贵妃，本宫为你热好了盒饭，快来吃吧,0.753338,0.246662,0.451861,2
108,高贵妃的盒饭热好了,0.590357,0.409643,0.0896818,2
108,宝贝们多看看我几眼吧，待会儿我就要领盒饭咯,0.513079,0.486921,0.738414,1
108,标题好标题好,0.822311,0.177689,0.605136,2
108,这标题看着！心里甭提🈶多高兴了,0.522935,0.477065,0.541298,1
109,高可爱要领盒饭了！开森,0.725504,0.274496,0.390009,2
109,人家是不是很可爱,0.646321,0.35368,0.214046,2
109,一看这个标题就开心呢嘻嘻嘻,0.653798,0.346202,0.230663,2
109,今天就能领盒饭了🍱！真开心,0.562603,0.437397,0.028006,2
110,高贵妃好可爱，抱走我高贵妃,0.704164,0.295836,0.342588,2
110,一看这标题就知道本宫要开大了,0.314136,0.685864,0.30192,0
109,高贵妃是专业的旦角吧，说台词像说戏词,0.746658,0.253342,0.437018,2
109,盒饭挺好吃的,0.846532,0.153468,0.658959,2
110,标题看的好激动,0.806669,0.193331,0.570375,2
110,看标题朕觉得这集不简单,0.215714,0.784286,0.520635,0
110,朕相信，你的盒饭一定会吃到饱的,0.782559,0.217441,0.516797,2
110,这标题写的好,0.654157,0.345843,0.231459,2
111,高可爱领盒饭吧,0.651937,0.348063,0.226526,2
111,本宫这么可爱竟然要领盒饭喽嘤嘤,0.420747,0.579253,0.0650073,0
111,看标题好开心,0.652858,0.347143,0.228572,2
111,有点舍不得高贵妃那么可爱单纯,0.672953,0.327047,0.273228,2
111,哎妈这标题真叫人兴奋,0.157991,0.842009,0.648909,0
111,富恒其实你还是很帅的,0.808319,0.191681,0.574042,2
112,听说本可爱盒饭已经热好了,0.790787,0.209213,0.535083,2
112,其实高贵妃只是太任性。心机不深有点肆宠而娇不懂脸色,0.502255,0.497745,0.954904,1
112,总感觉这高可爱要领盒饭好不舍得😟,0.749911,0.250089,0.444246,2
112,高贵妃的盒饭该热了,0.337315,0.662685,0.25041,0
112,高贵妃你的盒饭热好了,0.492768,0.507232,0.855365,1
112,为什么都叫我大猪蹄子,0.442663,0.557337,0.0163037,0
113,看到这个标题，盒饭怕是热好了,0.432928,0.567072,0.0379368,0
113,高高长点心吧😂你道行没我高,0.29571,0.70429,0.342867,0
113,看标题好高兴啊,0.53458,0.46542,0.308409,1
113,标题让人兴奋真好,0.830799,0.169201,0.623998,2
113,这标题，让人好兴奋,0.686472,0.313528,0.303271,2
114,说高贵妃可爱的怕都是抖音看多了,0.508756,0.491244,0.824871,1
113,本宫是最单纯的竟然要领盒饭了,0.234294,0.765706,0.479346,0
114,原来本宫这么单纯，你们心眼都太多了,0.144207,0.855792,0.679539,0
114,大猪蹄子，皇后都没醒你还有心情看表演,0.693866,0.306134,0.319703,2
114,看标题好高兴啊,0.53458,0.46542,0.308409,1
114,盒饭给本宫热一热,0.469811,0.530189,0.396217,1
114,高高长点心吧😂你道行没我高,0.29571,0.70429,0.342867,0
115,好激动好激动高贵妃要烫伤了,0.949693,0.0503073,0.888206,2
115,好长时候不见我了，不开心，哼(ノ=Д=)ノ┻━┻,0.653722,0.346278,0.230494,2
115,好了好了，不要再问了，马上就吃盒饭去了,0.806246,0.193754,0.569436,2
115,看我多可爱,0.474253,0.525747,0.485055,1
115,盒饭给本宫热一热,0.469811,0.530189,0.396217,1
116,本宫的饭盒热好了没,0.493872,0.506128,0.87743,1
116,我觉得高贵非是直接害人，而娴妃心机太重了，不喜欢,0.137114,0.862886,0.695302,0
116,贵妃娘娘，您的盒饭已热好,0.605546,0.394454,0.123436,2
116,贵妃你的盒饭热好了，趁热吃,0.662111,0.337889,0.249136,2
116,高贵妃就两件衣服一个红的一个绿的这俩衣服绝配！,0.574603,0.425397,0.0546743,2
116,看到标题我很是开心,0.738878,0.261122,0.41973,2
115,一会儿高可爱的背就熟了,0.76442,0.23558,0.476489,2
117,问大猪蹄子的自己去补课，给你们解释了好几遍还问!,0.383215,0.616785,0.148412,0
117,这个时候高贵妃说的话才是正常的声音,0.383673,0.616327,0.147394,0
117,我这么可爱，不想领盒饭！,0.222064,0.777936,0.506524,0
117,你可长点心吧,0.388888,0.611112,0.135805,0
118,看本贵妃多天真阔耐,0.637884,0.362116,0.195297,2
117,老高你可长点心吧,0.394285,0.605715,0.123811,0
117,璎珞说的那么小声，锦绣都听到了,0.494308,0.505692,0.886154,1
118,高之前耽误了给她弟弟治病的时间也算间接的凶手,0.504857,0.495143,0.902855,1
118,高贵妃好可爱啊哈哈哈,0.855771,0.144229,0.679492,2
118,男人都是大猪蹄子的意思就是男人没一个好东西😂️,0.550509,0.449491,0.00113103,2
118,觉得高高变美了,0.691563,0.308437,0.314584,2
119,这个剧报复来的没有那么的快，挺耐看的,0.807469,0.192531,0.572153,2
119,大猪蹄子就是我,0.699521,0.300479,0.332269,2
120,盒饭快热好了，高贵妃请稍等,0.613747,0.386253,0.141661,2
118,你可长点心吧,0.388888,0.611112,0.135805,0
119,贵妃挂了从哪找这么可爱没心机的反派,0.431635,0.568365,0.0408108,0
120,为什么说皇上是个大猪蹄子,0.370481,0.629519,0.176708,0
119,我准备去热盒饭了,0.36733,0.632671,0.183712,0
119,贵妃太得意了小心人头落地,0.184121,0.815879,0.590842,0
119,我先打两集酱油，你们尽管斗，甭客气。,0.468274,0.531726,0.365473,1
120,我还不想高可爱走呀,0.55494,0.44506,0.0109777,2
120,感觉不妙，但是还是要可爱,0.41471,0.58529,0.0784228,0
121,娴妃放现在就是最合适的工作伙伴了,0.679985,0.320015,0.288855,2
120,该找谁报仇找谁报仇害我皇后娘娘干什么,0.171006,0.828994,0.619987,0
121,我不管宝宝最单纯最可爱！！,0.795053,0.204947,0.544562,2
121,贵妃，你还能再单纯可爱点吗,0.419974,0.580026,0.0667241,0
121,魏璎珞这一盘棋可下的太好了,0.793017,0.206983,0.540038,2
120,我准备去热盒饭了,0.36733,0.632671,0.183712,0
121,我快走了，盒饭热好了没,0.403337,0.596663,0.103695,0
121,唉，本宝宝最单纯居然就要领盒饭去了,0.0752724,0.924728,0.832728,0
122,我去给高高和贤妃端盒饭去了，你们等着,0.458325,0.541675,0.166505,1
122,贵妃别急你的盒饭快好了,0.554505,0.445495,0.0100117,2
122,盒饭给你热好了,0.478221,0.521779,0.564414,1
122,还有一个多月高贵妃就奥特了,0.561383,0.438617,0.0252949,2
122,哭唧唧本宫不想领盒饭还想见樱宁呢,0.269835,0.730165,0.400367,0
123,来人！把本宫的盒饭热一热,0.453291,0.546709,0.0658119,1
122,我这是要什么时候才等得到傅恒来看我咯,0.470401,0.529599,0.408025,1
123,高贵妃知道自己盒饭快好了，笑得可甜喽,0.797845,0.202155,0.550768,2
123,本宫的盒饭热好了,0.561214,0.438786,0.0249194,2
123,高贵妃刚才的样子好甜好少女啊！！！,0.738957,0.261043,0.419904,2
123,妈呀连着看了三十多集完全停不下来,0.453883,0.546117,0.0776607,1
123,本宫的盒饭你们这么快热好了？？,0.442675,0.557325,0.0162772,0
124,快把本宫的盒饭热好,0.697162,0.302838,0.327026,2
124,本宫的盒饭热好了嘛?,0.425174,0.574826,0.0551683,0
124,都是大猪蹄子,0.594916,0.405084,0.0998141,2
124,吴亦凡你个大猪蹄子，你变了,0.541752,0.458248,0.164964,1
124,剧组的盒饭就是好吃,0.728859,0.271141,0.397465,2
125,妾身要开大了,0.498008,0.501992,0.960154,1
125,高高这集开始叫外卖了,0.537786,0.462214,0.244285,1
124,盒饭热好了，准备去领吧,0.502361,0.497639,0.952776,1
125,高贵妃好单纯,0.690458,0.309542,0.31213,2
125,突然舍不得高贵妃领盒饭，挺可爱呀,0.49909,0.50091,0.981806,1
125,水已煮好，就等下锅了,0.459205,0.540795,0.184103,1
126,哈哈哈高贵妃其实挺可爱，直言直语，总是无意间被利用,0.591466,0.408534,0.0921457,2
126,总有大猪蹄子要害本宫，本宫最单纯,0.686214,0.313786,0.302697,2
126,你这个语气要不要转变的这么明显，皇上还在呢,0.236473,0.763527,0.474504,0
126,说大猪蹄子的给本宫说说到底是什么梗,0.564182,0.435818,0.0315156,2
125,这态度转变得太可爱了,0.656889,0.343111,0.23753,2
126,我高高这么可爱为什么要我领盒饭,0.375016,0.624984,0.16663,0
127,高贵妃不喜欢谁就明显的不喜欢,0.0910599,0.90894,0.797645,0
127,倍数放正常多了,0.414741,0.585259,0.078353,0
126,现在发现躺着生病可以多活几集,0.657722,0.342278,0.239382,2
127,高贵妃给你准备的盒饭已好，请查收,0.488723,0.511277,0.774452,1
127,高贵妃我劝你善良,0.297414,0.702586,0.33908,0
127,啥是是大猪蹄子,0.524938,0.475062,0.501231,1
127,饭盒准备好了,0.510063,0.489938,0.798749,1
128,皇上．臣妾的盒饭热好了要吃吗？,0.364488,0.635512,0.190027,0
128,为啥贵妃就两件衣服不是绿的就是红的,0.301187,0.698813,0.330695,0
128,哈哈态度转变好快,0.954347,0.0456532,0.898548,2
128,贵妃不单纯？一点心机没有还傲娇,0.25959,0.74041,0.423133,0
128,来人呐把高贵妃的盒饭热一热咯,0.445216,0.554784,0.0106306,0
129,大猪蹄子：来人啊，给高贵妃热一热盒饭,0.740651,0.259349,0.423669,2
128,高贵妃我劝你善良,0.297414,0.702586,0.33908,0
129,不愧是戏子，这脸变的这叫一个快,0.814902,0.185098,0.588672,2
129,这变脸比翻书快多了,0.611317,0.388683,0.136259,2
129,满宫上下就本宫的发型别致啊,0.74271,0.25729,0.428245,2
129,想高可爱了回来看看,0.738982,0.261018,0.41996,2
129,高贵妃这种反派让人觉得莫名可爱啊😥,0.636271,0.363729,0.191714,2
130,我好可爱，我好可爱，我好可爱,0.860643,0.139357,0.690318,2
130,看标题不错不错,0.834377,0.165623,0.63195,2
130,贵妃看到皇上眼睛都亮了起来,0.603031,0.396969,0.117847,2
130,本宫要走了你们小心娴妃,0.203333,0.796667,0.548148,0
130,这个表情好可爱啊哈哈,0.897311,0.102689,0.771802,2
130,看本宫多会变脸,0.541434,0.458565,0.171311,1
131,我最单纯最可爱,0.738853,0.261147,0.419673,2
131,贵妃比那些表面温柔善良实则暗藏祸心的伪善之人好多了,0.67151,0.32849,0.270023,2
131,看我多聪明,0.573037,0.426963,0.0511924,2
131,马上就有好戏看喽，好贵妃还在那乐个啥劲,0.720643,0.279357,0.379208,2
131,哈哈哈，贵妃这脸变的好可爱,0.704109,0.295891,0.342465,2
132,贵妃才是最节俭的妃子，只有一套衣服,0.559236,0.440764,0.0205249,2
131,高贵妃好可爱,0.688729,0.311271,0.308286,2
132,高贵妃秒变脸。厉害厉害。,0.597224,0.402775,0.104943,2
132,最怕坏人装善良,0.603654,0.396346,0.119232,2
133,本宫就是这么可爱又迷人的反派角色哟,0.853267,0.146733,0.673927,2
132,希望自己长点心,0.494959,0.505041,0.899186,1
132,锦绣其实是被我算计了，被当枪使了,0.269854,0.730146,0.400324,0
133,这个标题看着就舒服,0.703732,0.296268,0.341626,2
133,阿佘的表演好自然不是第一眼好人也不是第一眼坏人,0.681732,0.318268,0.292737,2
132,盒饭帮你热好啦高贵妃快来吃,0.744062,0.255938,0.431249,2
133,因为我姓闲啊,0.528954,0.471046,0.420921,1
133,我变脸快吗,0.442386,0.557614,0.01692,0
134,顺嫔莫急好饭不怕晚太早出来也是送人头,0.724675,0.275325,0.388166,2
133,这集看的好开心哈哈哈哈,0.874787,0.125213,0.72175,2
134,态度变好快,0.687194,0.312806,0.304875,2
134,贵妃不善良但心机真的不深,0.189193,0.810807,0.579571,0
134,贵妃的盒饭，臣妾已经替您热好了，就在边上,0.594964,0.405036,0.0999194,2
134,说高贵妃可爱的，祝你娶到这种可爱的女人♡,0.732994,0.267006,0.406654,2
134,高可爱要领饭盒了,0.766766,0.233234,0.481703,2
135,突然翻回来看高可爱觉得她还算好了,0.705253,0.294747,0.345007,2
135,大猪蹄子不来看本宫看表演，本宫要被你气醒了,0.413494,0.586506,0.081124,0
135,可爱吗处心积虑害死别人还能叫可爱啊。,0.883523,0.116477,0.741162,2
135,本可爱要领盒饭了,0.700351,0.299649,0.334114,2
135,我就是戏精,0.596104,0.403896,0.102452,2
135,周二开始更新了，太好了，又可以多看两集了,0.929654,0.0703458,0.843676,2
136,本宫已经提前给你热好盒饭了,0.541276,0.458724,0.174485,1
136,高贵妃全是皇后之后最单纯的人了，她争宠至少坦荡,0.587543,0.412457,0.0834292,2
136,高贵妃我舍不得你，有你这么单纯的反派不多了,0.302921,0.697079,0.326843,0
136,高贵妃说话好可爱,0.669475,0.330525,0.2655,2
136,朕脑阔疼，你们还有完没有,0.447359,0.552641,0.00586894,0
137,贵妃耿直比闲妃这么有心机强多了,0.77617,0.22383,0.502601,2
136,贵妃是不是要死了，好桑心,0.270379,0.729621,0.399158,0
137,姓高的好戏马上上演,0.482739,0.51726,0.65479,1
137,小高，你这大眼珠子朕就是喜欢😍,0.619579,0.380421,0.15462,2
137,来来来队形来一波领盒饭领盒饭领盒饭！！！,0.334025,0.665975,0.257721,0
137,本宫准备吃盒饭啦好开熏啊,0.6351,0.3649,0.189111,2
137,哈哈，脸变的好快，好明显,0.813453,0.186547,0.585451,2
138,女人变脸好快呀哈哈哈哈,0.86389,0.13611,0.697534,2
138,那她也在害人好吗怎么能说可爱,0.625123,0.374877,0.166939,2
138,我怎么说话那么可爱直来直往,0.603672,0.396328,0.11927,2
138,改为周二开始更新了不错不错。,0.79235,0.20765,0.538555,2
