1408,佘诗曼演的帅呆了,0.604517,0.395483,0.121149,2
1411,过去就是没有录音笔，不然事情好办多了,0.447723,0.552277,0.00505964,0
1411,你们都是坏人，只有我最单纯,0.403567,0.596433,0.103185,0
1411,三十多集不容易了,0.65548,0.34452,0.234401,2
1410,佘诗曼黑化了让人好开心怎么回事,0.607669,0.392331,0.128153,2
1411,好可爱的丸子头啊,0.771675,0.228325,0.492611,2
1411,本宫是第二个皇后，必须有两把刷子,0.640583,0.359417,0.201295,2
1412,不错不错，这出戏演的真好,0.96406,0.0359397,0.920134,2
1411,都怪这个时代没有监控录音设备,0.280037,0.719963,0.377695,0
1412,贤妃娘娘太厉害了，演技也好棒,0.891377,0.108623,0.758615,2
1412,贤妃好厉害啊，这都想到了,0.664681,0.335319,0.254846,2
1412,本宫不想领盒饭，本宫还没玩够,0.296857,0.703143,0.340317,0
1412,你这么聪明咋就对付不了小燕子呢,0.0933958,0.906604,0.792454,0
1413,闲妃娘娘头上有两把梳子。,0.500622,0.499378,0.987556,1
1412,这个娴妃看的实在是让人厌恶,0.370943,0.629057,0.175682,0
1413,老娘长得不错，戏也唱得很好，就是心眼儿坏了点,0.822985,0.177015,0.606634,2
1413,过去要是有录音机，监控就好了,0.466309,0.533691,0.326174,1
1413,打的一手好牌,0.698918,0.301082,0.330928,2
1413,娴妃我劝你善良,0.306924,0.693076,0.317948,0
1413,本宫最单纯了,0.468448,0.531552,0.368963,1
1414,我咋没看出佘诗曼演技好，这部剧比她演的好的多了去了,0.22344,0.77656,0.503467,0
1414,鱼香肉丝热好了吗本宫还有五分钟杀青了,0.552274,0.447726,0.00505288,2
1414,就贤妃衣服最多了,0.578499,0.421501,0.0633321,2
1415,闲妃头上带两个梳子，是有两把刷子的意思吗😂,0.240518,0.759482,0.465515,0
1414,高贵妃，我劝你善良，不信吧，盒饭都热好了,0.168393,0.831607,0.625793,0
1414,老娘是头上有两把刷子的人。,0.471815,0.528185,0.436307,1
1414,佘诗曼多厉害,0.44371,0.55629,0.0139785,0
1415,高可爱我舍不得你,0.784678,0.215322,0.521507,2
1415,高可爱就是我,0.836009,0.163991,0.635576,2
1415,三好你不是要存好心，做好事，说好话吗？怎么变成这样,0.0487493,0.951251,0.891668,0
1416,刘海掉下来真的好美高贵妃演技真的好,0.796459,0.20354,0.547688,2
1416,我高贵妃那双大馒头比你大，看皇上嫌弃谁,0.486122,0.513878,0.722437,1
1415,哈哈哈哈哈，打不过我吧，没有办法，我就是这么强大,0.851562,0.148438,0.670138,2
1415,老娘是头上有两把刷子的人。,0.471815,0.528185,0.436307,1
1416,我可是宫中老人了，玩心机？哼，你还嫩点儿！,0.488671,0.511329,0.77342,1
1416,本宫演技好棒,0.643513,0.356487,0.207806,2
1416,闲妃头上带两个梳子，是有两把刷子的意思吗😂,0.240518,0.759482,0.465515,0
1416,所以说人还是要善良点！等别人努力翻身后就是你的死期,0.368442,0.631558,0.181241,0
1417,阿佘看起来好可爱,0.644221,0.355779,0.209381,2
1417,那是以前我不认真，不代表我不厉害,0.0631663,0.936834,0.85963,0
1417,不想高可爱下线,0.480321,0.519679,0.606421,1
1417,我怎么没这么厉害,0.132434,0.867566,0.705703,0
1417,好想穿越过去贩卖录音笔呀，在宫中肯定会大卖,0.851469,0.148531,0.669931,2
1418,是你太菜了，整个后宫最菜的高贵妃，你根本斗不过他们,0.119424,0.880576,0.734613,0
1417,演的真好哈哈看的好开心,0.976558,0.0234423,0.947906,2
1418,领盒饭喽领盒饭喽,0.52334,0.47666,0.533208,1
1418,本宫要禀告皇上该给各宫安个监控了看谁还敢兴风作浪,0.327835,0.672165,0.271478,0
1418,难道就我一个人觉得高贵妃现在要比平时美吗？,0.463559,0.53644,0.27119,1
1418,本宫是充钱了,0.327765,0.672234,0.271632,0
1419,一对比真的佘诗曼又美演技又好,0.759967,0.240033,0.466594,2
1418,那是以前我不认真，不代表我不厉害,0.0631663,0.936834,0.85963,0
1419,高贵妃你的盒饭热好了,0.492768,0.507232,0.855365,1
1419,本宫掉段好快，才一集就从星耀到青铜了,0.704069,0.295931,0.342377,2
1419,演的确实不错,0.850414,0.149586,0.667587,2
1419,这一波操作厉害了,0.352161,0.647839,0.217419,0
1420,贤妃本来很善良，也是被逼才变坏的，支持😁,0.617247,0.382753,0.149438,2
1420,锦绣的听力这么好的么,0.622013,0.377987,0.160029,2
1419,爱玛～本宫的演技真的炸裂了，眼睛里全是戏,0.494879,0.505121,0.89757,1
1420,娴妃眼里满满的都是戏阿！,0.681457,0.318543,0.292126,2
1420,录音笔真是个好东西,0.484376,0.515624,0.68752,1
1420,娴妃演技太好了,0.823957,0.176043,0.608793,2
1421,导演能把佘诗曼请来真的很不错，很有看头,0.887193,0.112807,0.749319,2
1421,去领盒饭啦开心开心,0.812243,0.187757,0.582763,2
1420,高贵妃就是没戴罩,0.433691,0.566309,0.0362428,0
1421,大胆，竟敢用明黄服饰，高贵妃，你竟如此胆大包天,0.348698,0.651302,0.225115,0
1421,真过瘾，好一句你还有时间吗,0.667807,0.332193,0.261793,2
1422,让开让开我都劝你们善良,0.300385,0.699615,0.332478,0
1421,娴妃，我劝你善良,0.306924,0.693076,0.317948,0
1422,佘诗曼真的太厉害了，演技太好了,0.624896,0.375104,0.166435,2
1422,本宫害别人从来没有成功过，为何别人总是能成功谋害我,0.532634,0.467366,0.347329,1
1421,还有人说她被利用，她难道没那个心？娴妃黑化还不是怪她，皇后娘娘流产昏迷还不是怪她，自己作的,0.0403639,0.959636,0.910303,0
1422,导演能把佘诗曼请来真的很不错，很有看头,0.887193,0.112807,0.749319,2
1422,我黑化之后好厉害啊,0.558446,0.441554,0.0187691,2
1423,就不能让我再活多几集嘛,0.294431,0.705569,0.345708,0
1423,饭盒热好了,0.663108,0.336892,0.25135,2
1423,突然觉得高贵妃这样看着挺美的,0.650548,0.349452,0.223439,2
1422,大胆，竟敢用明黄服饰，高贵妃，你竟如此胆大包天,0.348698,0.651302,0.225115,0
1423,又一个高级玩家进厂,0.690212,0.309788,0.311582,2
1423,不厉害怎么当皇后,0.125544,0.874456,0.721013,0
1424,再厉害也木有璎珞厉害,0.172479,0.827521,0.616713,0
1424,何止宫里本宫打王者都会想着螳螂捕蝉黄雀在后,0.659186,0.340814,0.242635,2
1424,你才知道我厉害啊晚了,0.349111,0.650889,0.224197,0
1424,敢问高贵妃自己的头发好吃吗,0.578799,0.421201,0.0639988,2
1424,知道厉害了，早干嘛去了、,0.213188,0.786812,0.526248,0
1424,本宫就是这么厉害,0.366874,0.633126,0.184724,0
1423,这古代最大的坏处就是没有录音器,0.541812,0.458188,0.163763,1
1425,高贵飞无愧也就是充了钱的黄金段位的,0.651068,0.348932,0.224595,2
1425,本宫佩服啊，闲飞哈哈哈哈我先去领盒饭,0.716799,0.283201,0.370665,2
1425,贵妃做了那么多坏事没有一件是成功的,0.649547,0.350453,0.221215,2
1425,本宫睡个觉高可爱都快吃盒饭了,0.794569,0.205431,0.543486,2
1425,佘诗曼演技太耀眼，所以你们只能攻击年龄了是吗😡,0.0750297,0.92497,0.833268,0
1426,算了算了，本宝宝也活了三十多集，不说了领盒饭去,0.515793,0.484207,0.684148,1
1426,佘诗曼这演技不错，好人跟坏人这两者都演的很透彻,0.886204,0.113796,0.747121,2
1425,我心真善良都要领盒饭了也不忘夸夸娴妃,0.553237,0.446763,0.00719282,2
1426,高可爱要吃盒饭了,0.722038,0.277962,0.382307,2
1426,本可爱这就要走了嘛。战士最终还是没拼过法师。脑壳疼,0.703796,0.296204,0.341769,2
1426,最菜的玩儿完坐看好戏,0.523317,0.476683,0.533664,1
1426,盒饭热起来。快好了,0.732385,0.267615,0.405299,2
1427,高贵飞你的盒饭打好了来领哇,0.545074,0.454926,0.0985241,1
1427,厉害了这演技，最棒我啊佘,0.793292,0.206708,0.54065,2
1427,高贵贵妃，我劝你善良,0.370959,0.629041,0.175646,0
1427,贵妃就是靠山大，其实就是个棒槌，害人也是被利用,0.473142,0.526858,0.462842,1
1427,佘诗曼演的太棒了，不用化妆靠演技就能把黑化演的这棒,0.94203,0.0579696,0.871179,2
1428,我来帮你把盒饭热好了,0.582793,0.417207,0.0728733,2
1427,段位好高啊,0.721277,0.278723,0.380616,2
1428,越是外表柔弱的让人就会放松警惕其实是个狠角色,0.755273,0.244727,0.456161,2
1428,本以为高贵妃是王者，结果却是高级装备的青铜,0.427418,0.572582,0.0501829,0
1428,怕的就是铂金钻石以为自己玩的厉害高贵妃自以为是,0.710583,0.289417,0.356851,2
1428,黑化之后本宫心情舒畅多了,0.642473,0.357527,0.205495,2
1428,最棒我最强我,0.904958,0.0950424,0.788795,2
1429,不知道是闲妃厉害还是纯妃厉害哈？,0.352043,0.647957,0.217681,0
1429,我能活到三十多集挺不错了,0.80434,0.19566,0.5652,2
1429,高贵妃急火攻心，舌头大了？,0.492171,0.507829,0.843418,1
1429,我来帮你把盒饭热好了,0.582793,0.417207,0.0728733,2
1429,本宫盒饭吃饱了该我上场了吧,0.399743,0.600257,0.111683,0
1430,高可爱领完盒饭估计妹妹就要登场了,0.635223,0.364777,0.189384,2
1430,加了金汁不是还有那么厚的衣服吗，都渗进去了？,0.248676,0.751324,0.447387,0
1429,跟本宫作对的人都好厉害啊,0.616133,0.383867,0.146963,2
1430,看过一遍居然还在看哎这一段太精彩,0.212964,0.787036,0.526746,0
1430,录音笔是个好东西，可惜你们没有,0.503925,0.496075,0.921504,1
1430,温容善良的女人要是狠起来比谁都厉害,0.312919,0.687081,0.304624,0
1430,一般一般世界第三,0.202724,0.797276,0.549501,0
1431,高实在是高啊比我还高,0.566604,0.433396,0.0368969,2
1431,不想看娴妃，还我高可爱,0.560524,0.439476,0.0233869,2
1431,祝高贵妃杀青成功，领盒饭喽,0.706113,0.293887,0.346917,2
1431,本宫那么可爱那么厉害居然要我去领盒饭。。。,0.489579,0.510421,0.791587,1
1431,一般一般世界第三,0.202724,0.797276,0.549501,0
1432,天啊，阿佘凑下来的时候好乖啊,0.768757,0.231243,0.486127,2
1432,导演！高贵妃的盒饭热好了现在端上来吗？,0.323383,0.676617,0.281372,0
1432,本宫的盒饭热好了没,0.415642,0.584358,0.0763517,0
1432,我老高活了三十多集还不是赚了,0.151864,0.848136,0.662525,0
1432,越单纯的人，黑化后就越厉害,0.324791,0.675209,0.278242,0
1432,高贵妃真的是后宫最真实的人，不像纯妃娴妃,0.637636,0.362364,0.194747,2
1433,这部剧演技派真多，看着好给力,0.708878,0.291122,0.353062,2
1431,盒饭热好了，快来领吧,0.641129,0.358871,0.20251,2
1433,盒饭热好了吗,0.419118,0.580882,0.0686269,0
1433,人家看的是后位当然厉害了,0.314,0.686,0.302222,0
1433,这样子的落魄的发型觉得高贵妃超美的呢。真话,0.761604,0.238396,0.470231,2
1433,锦绣厉害啊，告密间接害了高贵妃,0.297202,0.702798,0.339551,0
1434,这名字一个个的真好听就是记不住哈哈哈哈,0.702162,0.297838,0.338138,2
1434,高手都低调！,0.785743,0.214257,0.523873,2
1434,是傅园慧给哀家配的音吗,0.369201,0.630799,0.179553,0
1434,厉害是厉害还不是输给了令妃最后,0.201314,0.798686,0.552636,0
1434,这个故事告诉我们：平时默默无闻与世无争的人你不能惹,0.351166,0.648834,0.219631,0
1434,娴妃演的好,0.78169,0.21831,0.514866,2
1435,几天没上分了，他们咋这么快呐,0.268044,0.731956,0.404347,0
1435,不想让高可爱下线,0.49455,0.50545,0.891003,1
1435,高贵妃成功过好么，她把娴妃一家都害死了,0.701125,0.298875,0.335832,2
1435,最可爱的高高要领盒饭了,0.790433,0.209568,0.534294,2
1435,不容易啊，活到32集了,0.695654,0.304346,0.323676,2
1436,问娴妃没事的是傻子吧她就烫了一点点又没有高贵妃的多,0.41526,0.58474,0.077201,0
1435,娴妃演的好,0.78169,0.21831,0.514866,2
1436,只有我跟吉娃娃活到最后一集你说厉害不厉害,0.153239,0.846761,0.659469,0
1436,哼一开始我就是大坏蛋，但是从来没有成功过,0.651026,0.348974,0.224503,2
1436,所以说我多厉害,0.402506,0.597494,0.105541,0
1436,玲珑耳朵咋这么好,0.730873,0.269127,0.401941,2
1437,最后娴妃身边要不是有个袁春旺和璎珞和平相处也挺好,0.738082,0.261918,0.41796,2
1437,我可比姚金玲厉害多了,0.451655,0.548345,0.033108,1
1437,高贵妃这样看着还挺美的可能是变弱势了,0.449392,0.550608,0.00135197,0
1436,佘诗曼让人又爱又恨演技太好了,0.818045,0.181955,0.595655,2
1437,这段看的本宫很是过瘾啊,0.862104,0.137896,0.693564,2
1437,会咬人的狗不叫，高贵妃难道你不知道吗。哼哼,0.152317,0.847683,0.661518,0
1438,本宫还想多活两集，叶太医不要走,0.606865,0.393135,0.126367,2
1437,高贵妃说话的语气真是无语了看到现在说话都是那个鸟性,0.0840436,0.915956,0.813236,0
1438,不错不错演技都很好,0.989288,0.0107124,0.976195,2
1438,打不过我吧没有办法我就是这么强大，啦啦啦啦啦啦,0.663028,0.336972,0.251174,2
1438,娴妃心机好深啊,0.801709,0.198291,0.559352,2
1438,高贵妃好像灰太狼，三十多级了，一只羊都没抓住,0.49749,0.50251,0.949805,1
1438,同学们本宫完了你们开心吗,0.460181,0.539819,0.203626,1
1439,演了这么多集不错了该领盒饭了,0.737997,0.262003,0.41777,2
1439,把盒饭给本宫热上，马上去领,0.362572,0.637428,0.194284,0
1439,盒饭热好了吗？本宫要吃,0.504883,0.495117,0.902333,1
1439,盒饭好了来领吧,0.575852,0.424148,0.0574481,2
1439,娴妃我劝你善良高贵妃就是你未来的下场,0.295096,0.704904,0.344231,0
1439,本宫还想多活两集，叶太医不要走,0.606865,0.393135,0.126367,2
1440,不得不说，高贵妃真的是整剧最单纯的,0.572966,0.427034,0.0510348,2
1440,快！热热本宫的盒饭！本宫要来吃啦！,0.707073,0.292927,0.349051,2
1440,刷佘诗曼演技好的你们够了啊！,0.634539,0.365461,0.187864,2
1440,没有办法我就是这么强大,0.526292,0.473708,0.474163,1
1440,这部剧能请来佘诗曼，真的不错,0.836454,0.163546,0.636565,2
1440,啦啦啦啦啦，打不过我吧我就是这么强大,0.610648,0.389352,0.134774,2
1441,知道了，是锦绣或者袁春望告的密,0.556762,0.443238,0.0150274,2
1441,白白了奥，要去领盒饭了,0.293426,0.706574,0.347943,0
1441,佘诗曼的演技看得好过瘾,0.858951,0.141049,0.686558,2
1441,毕竟本宫是高段位玩家，充了钱的,0.566727,0.433273,0.0371716,2
1441,会咬人的旺看来真的是不会叫,0.166078,0.833922,0.630938,0
1441,快，快来人啊，快把本宫的盒饭热热,0.589574,0.410426,0.0879412,2
1442,看不到刘三好的影子才是厉害现在只要看孙俪就是嬛嬛,0.255983,0.744017,0.43115,0
1442,本宫演的棒不棒,0.889958,0.110042,0.755462,2
1442,本宫此时可真美,0.621526,0.378474,0.158947,2
1442,哎，高可爱要领盒饭了,0.41443,0.58557,0.079044,0
1442,本宫为本宫骄傲,0.653439,0.346561,0.229865,2
1443,花是零落成泥长开不败,0.500427,0.499573,0.991467,1
1443,好厉害啊，打了人还不能哭那种,0.554142,0.445858,0.00920335,2
1443,高贵妃：盒饭热好了请慢用,0.663955,0.336045,0.253233,2
1443,现在才知道比你厉害的多了去了吧,0.391486,0.608514,0.130032,0
1442,袁春望确定是她的人了密函还有粪水,0.472179,0.527821,0.443571,1
1443,香港演员佘诗曼太让人惊艳了。,0.47258,0.52742,0.451594,1
1444,高贵妃的盒饭🍱一定要比任何人好！快去热,0.742684,0.257316,0.428187,2
1443,果然整饿个后宫就我最单纯了,0.601017,0.398983,0.113371,2
1444,这个姿势，本宫也是很美的,0.852321,0.147679,0.671825,2
1444,贵妃天然去雕饰，清水出芙蓉啊,0.615406,0.384594,0.145347,2
1444,知道本宫的厉害了吧,0.365517,0.634483,0.187739,0
1444,其实高贵妃是妃子里最不会耍心机的人就是喜欢害人,0.546528,0.453472,0.0694382,1
1444,高宁馨。。超前时尚的名字,0.780114,0.219886,0.511364,2
1445,我们家高可爱就这样领盒饭啦,0.679411,0.320589,0.287581,2
1445,芝兰本宫的盒饭热好了没？,0.411545,0.588455,0.085456,0
1445,哈哈哈，报仇了好开心,0.798001,0.201999,0.551113,2
1445,善良的人如果变坏，你连跪下的机会都没有,0.372488,0.627512,0.172249,0
1445,真的好精彩名场面啊,0.808361,0.191639,0.574135,2
1446,所以说我劝你善良不是不报时候未到,0.0689808,0.931019,0.846709,0
1445,本宫心情大好,0.581978,0.418022,0.0710618,2
1446,来人，快把本宫的盒饭热好,0.69668,0.30332,0.325955,2
1446,佘诗曼黑化了好过瘾,0.858051,0.141949,0.684558,2
1446,阿曼最后一句台词都说中文辛苦了,0.72061,0.27939,0.379134,2
1446,老娘这叫一击致命，你那些小打小闹太稚嫩了,0.199509,0.800491,0.556647,0
1446,本宫心情大好,0.581978,0.418022,0.0710618,2
1447,高贵妃换张馨予来演，估计看头过瘾,0.655933,0.344067,0.235406,2
1447,你们居然让本宫吃盒饭！大胆！,0.231229,0.768771,0.486157,0
1447,高贵非能活这么久,0.441059,0.558941,0.0198682,0
1447,一天就叫叫叫声音最大就是她了,0.284679,0.715321,0.36738,0
1447,本宫才是厉害的,0.519211,0.480789,0.615771,1
1447,你们每个人都比我聪明呜呜呜呜,0.674664,0.325336,0.277031,2
1448,看来害人知心不可有啊，不是不报时候未到！,0.106152,0.893848,0.764107,0
1448,就欺负我单纯可爱,0.529495,0.470505,0.410106,1
1448,嘻嘻嘻基本操作,0.581208,0.418792,0.0693519,2
1448,高贵妃这样显得好年轻啊,0.604272,0.395728,0.120605,2
1448,本宫的饭盒还没热好,0.509587,0.490413,0.808255,1
1449,高贵妃害人没一次成功还树了那么多敌,0.585403,0.414597,0.0786727,2
1448,后宫本就高手对决，输了就是死呢,0.699169,0.300831,0.331487,2
1449,姓高的叫你欺负本宝宝，哼,0.17521,0.82479,0.610645,0
1449,娴妃黑化多少集了说快的没看剧吧,0.611849,0.388151,0.137442,2
1449,佘诗曼真的演技很好,0.846292,0.153708,0.658426,2
1449,高贵妃那不叫单纯，叫蠢好吧？别什么人都用单纯来形容,0.197326,0.802674,0.561498,0
1450,死的好，真是不知为啥叫高可爱,0.450803,0.549197,0.0160688,1
1449,心情好的一批,0.642321,0.357679,0.205159,2
1450,当然要开心了，之前的耻辱如今还回去为何不高兴,0.573974,0.426026,0.0532752,2
1450,这剧除了富察皇后都是坏人，不过是看谁最聪明罢了,0.265353,0.734646,0.410326,0
1450,黑化的好黑化的妙,0.679765,0.320235,0.288367,2
1450,佘诗曼真的演技很好,0.846292,0.153708,0.658426,2
1450,一般一般世界第三,0.202724,0.797276,0.549501,0
1451,看的出的厉害真不算厉害，娴妃这种才真厉害,0.135463,0.864537,0.69897,0
1451,本宫一次也没有成功过,0.600439,0.399561,0.112087,2
1451,据说后面的剧情，尔晴绿了富恒怀的孩子不是富恒的。,0.522856,0.477144,0.542874,1
1451,娴妃的盒饭也快好了,0.784223,0.215777,0.520495,2
1451,本宫心情大好,0.581978,0.418022,0.0710618,2
1452,佘诗曼演技好，宫心计她就反派，是让人恨不起来的反派,0.477751,0.522249,0.555015,1
1452,这一段看得过瘾，这演技绝对的,0.853092,0.146908,0.673538,2
1452,想吃盒饭盒饭好吃,0.652872,0.347128,0.228604,2
1452,本宫对她不错了，好歹没在她背上踩上几脚,0.485748,0.514252,0.714963,1
1452,真心演的好，本宫黑化不需要装,0.592515,0.407485,0.0944779,2
1452,哈哈，本宝宝好开心啦,0.950271,0.0497287,0.889492,2
1451,可爱如我高贵妃,0.786735,0.213265,0.526078,2
1453,好了皇后也病着整个后宫她最大了厉害呀厉害,0.550158,0.449842,0.000351138,2
1453,佘诗曼的演技是真厉害这一段看的很过瘾,0.807372,0.192628,0.571938,2
1453,这么聪明的人之前竟然能隐忍这么久，本宫有些怕,0.332683,0.667317,0.260705,0
1453,佘诗曼演技好，宫心计她就反派，是让人恨不起来的反派,0.477751,0.522249,0.555015,1
1454,抬轿子的人好辛苦啊,0.609421,0.390579,0.132048,2
1454,这么多人黑化之后感觉还是我最可爱了,0.249904,0.750096,0.444658,0
1453,盒饭热好了,0.585823,0.414177,0.0796058,2
1453,会是以后最强大的对手吧￼,0.726239,0.273761,0.391643,2
1454,本宫段位可比你高多了,0.552473,0.447527,0.00549595,2
1454,高贵妃的盒饭热好了吗？赶紧送过去😂,0.448544,0.551456,0.00323494,0
1454,段位竟然比我高了那么多，失策失策,0.373489,0.626511,0.170025,0
1455,有录音机多好,0.586727,0.413273,0.0816145,2
1454,说佘诗曼不适合古装的看一下金枝欲孽好吧,0.241883,0.758117,0.462483,0
1455,本宫坐这么高，会不会掉下来？,0.386121,0.613879,0.141954,0
1455,大可爱要下线啦,0.869789,0.130211,0.710641,2
1455,佘诗曼的普听话是怎么样的呢,0.583018,0.416982,0.0733723,2
1455,本宫段位可比你高多了,0.552473,0.447527,0.00549595,2
1456,这段看得爽娴皇后威武霸气哈哈,0.966621,0.0333786,0.925825,2
1456,零落成泥捻作尘，只有香如故,0.521374,0.478627,0.57253,1
1456,做人呢最重要的就是开心呐,0.782951,0.217049,0.51767,2
1456,抬轿子的都不扶着，这功夫练的不错,0.763615,0.236385,0.474701,2
1456,这后宫中除了皇后最没心机的就是可爱的本宫啦哈哈,0.948715,0.0512851,0.886033,2
1457,喜欢娴妃黑化，演技太好了一点都不像刘三好,0.868568,0.131432,0.707928,2
1457,本宫的盒饭热好了吗？,0.400425,0.599575,0.110166,0
1456,这粪水加的好，本宫等候多时了。,0.435055,0.564945,0.0332108,0
1457,青铜蹦哒了这么久,0.499626,0.500374,0.992518,1
1457,难道就我一个人觉得佘诗曼长得奇怪吗,0.165838,0.834162,0.631472,0
1457,阵仗太大了，皇后一倒你最厉害了,0.116646,0.883354,0.740787,0
1458,皇后和高贵妃领盒饭后，就都是高段位了,0.61795,0.38205,0.151,2
1458,这叫还没成功过那皇后的孩子是风吹走了吗,0.4372,0.5628,0.0284445,0
1457,我就是厉害,0.419506,0.580494,0.067764,0
1458,闲妃是要做皇后的人,0.482424,0.517576,0.648474,1
1458,请给本宫一支录音笔好吗,0.512263,0.487737,0.754735,1
1458,抱抱单纯的高贵妃,0.521045,0.478955,0.579095,1
1458,本宫心情不错,0.521448,0.478552,0.571037,1
1459,觉得高贵妃可爱的那个品味独特，眼光独到啊！佩服佩服,0.907437,0.0925634,0.794304,2
1459,闲妃一点都不闲。纯妃一点都不纯，高贵妃一点都不高,0.148857,0.851143,0.669206,0
1459,高贵妃怎么活这么久的一点智谋也没有全都是别人出注意,0.235398,0.764602,0.476893,0
1459,演技不是一般的好,0.176555,0.823445,0.607655,0
1459,还是本宫最善良,0.42427,0.575729,0.0571766,0
1459,得意的表情能不能收一收，不怕被人看到啊,0.253489,0.746511,0.436691,0
1460,周建你个大猪蹄子，你看你家娴妃好坏,0.527281,0.472719,0.454384,1
1460,国色天香艳压群芳是认真的吗,0.576305,0.423695,0.0584564,2
1460,看了花絮我觉得贵妃很可爱,0.729479,0.270521,0.398842,2
1460,录音笔和监控真是好东西啊,0.541042,0.458958,0.179169,1
1460,还是本宫最善良,0.42427,0.575729,0.0571766,0
1461,贤妃打野发育成熟来抓人了,0.394643,0.605357,0.123016,0
1461,把高贵妃羞辱一顿，好开心啊，好开心。,0.801911,0.198089,0.559802,2
1460,娴妃也没个好下场的,0.544824,0.455176,0.103513,1
1461,本宫甚是高兴啊，哈哈哈哈,0.755938,0.244062,0.457641,2
1461,这嘴角的这个笑演的太好了,0.789995,0.210005,0.533322,2
1461,本宫咋这么善良,0.509302,0.490698,0.813957,1
1462,我就算饿死也不会吃你们一点盒饭啊！盒饭真香真好吃,0.118056,0.881944,0.737653,0
1462,贵妃啊别人都是集集升段位你倒好是集集掉段位,0.776602,0.223398,0.50356,2
1462,呵呵哈哈哈活该，谁叫你把我踢下去,0.464873,0.535127,0.297462,1
1462,娴妃在宫里走路的方式都变了。。。,0.638752,0.361248,0.197226,2
1462,皇后任性一回然后躺了，贵妃也要任性了,0.602108,0.397892,0.115795,2
1461,密函是玲珑给的啊,0.614888,0.385112,0.144195,2
1462,我不愧是一姐,0.744838,0.255162,0.432973,2
1463,芝兰好低调啊,0.833235,0.166765,0.629412,2
1463,往后看就知道为什么说高贵妃可爱了,0.666425,0.333575,0.258721,2
1463,用肩膀抬轿子厉害了群演们,0.430275,0.569725,0.0438335,0
1463,不听劝就是这个下场,0.248033,0.751967,0.448816,0
1463,能做到妃都不一般,0.170984,0.829016,0.620035,0
1464,平板支撑演的好,0.721017,0.278983,0.380038,2
1463,皇后任性一回然后躺了，贵妃也要任性了,0.602108,0.397892,0.115795,2
1464,本宫可是未来太厚，你们这些小喽啰，要注意了,0.146834,0.853166,0.673703,0
1464,长得像女版郑嘉颖,0.381626,0.618374,0.151942,0
1464,贵妃死了我可以出来没有,0.303853,0.696147,0.324771,0
1464,其实高贵妃挺单纯的,0.72124,0.27876,0.380534,2
1433,请叫我宁馨儿好吗？,0.432116,0.567884,0.0397432,0
1464,我和贵妃谁先吃盒饭,0.440638,0.559362,0.0208036,0
1465,每次这么多人捧一堆东西是干嘛的,0.380492,0.619508,0.154463,0
1465,本宫开心到一摇一摆的呢,0.781217,0.218783,0.513815,2
1465,做人最紧要开心啊嘛,0.737007,0.262993,0.41557,2
1465,整部剧就我最单纯,0.527117,0.472883,0.457654,1
1466,演坏人最过瘾，演好人最考验演技,0.895429,0.104571,0.76762,2
1465,高贵妃，可以去领盒饭了,0.57303,0.42697,0.0511776,2
1465,高贵妃戏腔范，演的很好啊,0.91423,0.0857697,0.809401,2
1466,好想看高贵妃变好然后逆袭,0.798389,0.201611,0.551976,2
1466,现在头脑简单和单纯一个意思了？？,0.333271,0.666729,0.259398,0
1466,盒饭热好了再加做一份,0.545076,0.454924,0.0984847,1
1466,宫女不是什么好东西,0.157533,0.842467,0.649927,0
1466,唯一的倔强青铜已下线,0.415091,0.584908,0.0775744,0
1467,做人最重要的呢就是要开心,0.827704,0.172296,0.617121,2
1467,大猪蹄子快来救我，我感觉下一个就是我了,0.831532,0.168468,0.625626,2
