1908,令妃的姐姐不是尔康的娘吗,0.305571,0.694429,0.320954,0
1908,二哈认真的吗,0.695646,0.304354,0.323657,2
1908,我觉得这是见过最不怕死的宫女,0.404897,0.595103,0.100228,0
1908,尔晴我劝你善良,0.324823,0.675177,0.278172,0
1909,陈道明年轻时候才叫帅，帅不帅要看气质。,0.627092,0.372908,0.171316,2
1909,感觉璎珞长得有点像梅艳芳,0.476482,0.523518,0.529649,1
1909,这是我弟媳,0.47628,0.523719,0.52561,1
1908,你胆大又不是第一天,0.165756,0.834244,0.631654,0
1909,我咋成贵人了,0.215542,0.784458,0.521019,0
1909,我就好奇为啥他们不在一起,0.355029,0.644971,0.211046,0
1909,还珠里不是说令妃是尔康的姨妈吗,0.215511,0.784489,0.521086,0
1910,是说的曹阿满吗,0.407045,0.592955,0.0954558,0
1910,他姐姐感觉很厉害,0.650473,0.349527,0.223274,2
1910,喜欢本宫么？,0.78785,0.21215,0.528557,2
1910,不是还是情人呢吗和她姐姐,0.218136,0.781864,0.515254,0
1910,皇后进宫这么久了，嘴上功夫居然一点都没练出来,0.29043,0.70957,0.354599,0
1911,曹操是啊瞒好吗？欺上瞒下他叔叔给起的,0.784895,0.215105,0.521989,2
1910,先是佩服有加，再是怜爱之心泛起，一段爱情故事开始了,0.533079,0.466921,0.338416,1
1911,一直说谁像谁谁的，尊重一下演员好么.,0.310404,0.689596,0.310214,0
1911,30几集变坏了,0.549687,0.450313,0.00625729,1
1911,这剧剧情紧凑,0.507187,0.492813,0.856255,1
1911,是说的曹阿满吗,0.407045,0.592955,0.0954558,0
1911,边上那个这次怎么嘴巴不多了,0.219454,0.780546,0.512325,0
1912,尔康他爹是福伦你才要去看看历史,0.29786,0.702141,0.33809,0
1912,要不是要帮姐姐找仇人我一定要和傅恒在一起！！,0.586161,0.413839,0.0803577,2
1912,可不可以不要再说还珠了。还珠本来就是小说，不是历史,0.120486,0.879514,0.732253,0
1912,编剧是别人，于正就是个制片，别掩盖别人的成果,0.448082,0.551918,0.00426279,0
1912,你胆大又不是第一回😂😂,0.1591,0.8409,0.646445,0
1912,我还能抢救一下。,0.597933,0.402067,0.106518,2
1913,璎珞：我胆子大也不是一回两回了好不,0.295573,0.704427,0.34317,0
1913,我劝你们安生,0.210898,0.789102,0.531338,0
1913,历史上宫女真的这么出众可能是死很快,0.672326,0.327674,0.271835,2
1913,想知道他有什么反应阿,0.424692,0.575308,0.0562394,0
1913,尔康他爹是福伦你才要去看看历史,0.29786,0.702141,0.33809,0
1914,我感觉这个编剧不一般啊,0.123708,0.876292,0.725093,0
1914,姐姐怕是无意撞见了不得了的事情,0.711478,0.288522,0.35884,2
1914,为啥开始都是要背对着,0.468744,0.531256,0.37488,1
1913,好温柔的凉凉啊,0.712963,0.287037,0.36214,2
1914,谁说我像二哈给我出来,0.504638,0.495363,0.907249,1
1914,曹阿蛮好么😢,0.612189,0.387811,0.138198,2
1914,这个皇后真好,0.795426,0.204574,0.54539,2
1915,能不能别把傅恒和尔康扯一起？俩人没法比好吗还父子！,0.129094,0.870906,0.713124,0
1915,走过最长的路便是魏璎珞的套路,0.659678,0.340322,0.243728,2
1915,有些像，但比叶祖新长得精致一点,0.621546,0.378454,0.158991,2
1915,本宫很喜欢这个丫头,0.829399,0.170601,0.620887,2
1916,要是明玉那个蠢货本宫就被害惨了,0.27243,0.72757,0.394599,0
1916,皇后娘娘说话的声音好温柔,0.637045,0.362955,0.193433,2
1915,啦啦啦，主子就是好😜,0.800108,0.199891,0.555797,2
1915,皇后声音好听,0.499561,0.500439,0.99121,1
1916,皇后说不出来的话，你替皇后说了，皇后感激你还来不及,0.654293,0.345707,0.231762,2
1916,矮油好温柔啊,0.533899,0.466101,0.322014,1
1916,走过最长的路便是魏璎珞的套路,0.659678,0.340322,0.243728,2
1916,连本宫你都敢顶撞，你还有什么不敢的？,0.303698,0.696302,0.325116,0
1917,还珠的皇后是继室这部剧黑化后的娴妃,0.548219,0.451781,0.0356209,1
1917,还没换上干净的衣服,0.567195,0.432805,0.0382102,2
1917,穿着带血的衣服去见皇后，不是大不敬吗,0.133296,0.866704,0.703786,0
1917,明明最帅的是紫萱,0.576927,0.423073,0.0598371,2
1917,辛亏是你去，不然等明玉去五阿哥就没命了,0.226991,0.773009,0.495574,0
1918,她是来复仇的，撒了很大的网,0.650453,0.349547,0.223229,2
1918,五阿哥长那么大，真不容易啊，怎么就被小燕子给嚯嚯了,0.472442,0.527558,0.448846,1
1917,乾隆怎么找了那么久，都没找到璎珞,0.476683,0.523317,0.53365,1
1918,为啥不换衣服,0.170726,0.829274,0.620609,0
1918,挺接近历史的!,0.782623,0.217377,0.516939,2
1918,皇后真的是仁慈,0.473398,0.526602,0.467954,1
1919,杜比剧院的环绕音效，被成为世界上音响设备之最。,0.716858,0.283142,0.370795,2
1918,脖子太细了不协调,0.102576,0.897424,0.772052,0
1919,杜比是一个剧院的名字，是奥斯卡颁奖典礼举行的地方。,0.534351,0.465649,0.312974,1
1919,还是你最可爱,0.594968,0.405032,0.0999298,2
1919,我认识啊满,0.668024,0.331976,0.262276,2
1919,不拖拉是因为导演好,0.477296,0.522704,0.54592,1
1919,我多少集领盒饭,0.545998,0.454002,0.0800383,1
1920,就我一个人觉得皇后说话好听吗,0.509066,0.490935,0.818689,1
1920,躺的可真舒服,0.674016,0.325984,0.27559,2
1920,你不仅胆大，力气也大,0.481157,0.518843,0.623143,1
1920,头发突然就整齐了，还真神奇,0.635958,0.364042,0.191017,2
1920,妈朵。一天天事情真多。,0.345409,0.654591,0.232425,0
1920,我和皇上抢女人,0.547598,0.452402,0.0480485,1
1921,今天若不是因为有你，本宫这个锅算是背定了,0.274901,0.725099,0.389109,0
1921,真乃神药，一擦就好,0.477388,0.522612,0.547752,1
1921,少爷真贴心,0.770082,0.229918,0.489072,2
1921,无论魏璎珞做什么都是淡定，大气！,0.782323,0.217677,0.516273,2
1921,我和皇上抢女人,0.547598,0.452402,0.0480485,1
1921,璎珞的性格才是正确的打开方式好吗,0.775673,0.224327,0.501495,2
1922,琼瑶的剧情，你们也敢信,0.434442,0.565558,0.0345741,0
1922,本宫好像重复最多的台词就是:起来吧,0.542932,0.457068,0.14136,1
1922,好过瘾的剧,0.919279,0.080721,0.82062,2
1922,是曹阿蛮吗？,0.389454,0.610546,0.134547,0
1922,琼瑶怎么害人了？还珠格格带给多少人欢乐！,0.470402,0.529598,0.408036,1
1923,令妃是善良不是温柔富察皇后是温柔贤惠,0.453849,0.546151,0.0769824,1
1922,给我小心点,0.476371,0.523629,0.527414,1
1923,不换带血衣服就来见皇后，大不敬,0.136326,0.863674,0.697054,0
1923,本宫很可爱,0.750543,0.249457,0.445651,2
1923,每个人声音都好独特,0.880585,0.119415,0.734634,2
1924,历史令妃不是很温柔贤惠吗？有这么厉害吗,0.242134,0.757866,0.461924,0
1923,怎么还不去换衣服,0.140465,0.859535,0.687856,0
1924,皇后娘娘人超好啊喜欢喜欢(♥ω♥),0.91993,0.0800703,0.822066,2
1924,本宫要是背了这么大的黑锅，以后就见不了纯妃了,0.263139,0.736861,0.415247,0
1923,还不去换衣服，这样一件血衣晃来晃去，不是不吉利吗,0.0339838,0.966016,0.924481,0
1924,尔康是我弟,0.553982,0.446018,0.0088497,2
1924,呦头发梳好了,0.814605,0.185395,0.588011,2
1924,本宫要提拔你,0.462209,0.537791,0.244178,1
1925,没说令妃是尔康的亲姨啊,0.456767,0.543233,0.135335,1
1925,阿满听过好出戏像是曹阿蛮,0.618485,0.381515,0.152189,2
1925,很多剧都是真实历史加以改编，还珠格格也是这部也是,0.684746,0.315254,0.299435,2
1925,丑人多作怪,0.364167,0.635833,0.19074,0
1926,我喜欢这个剧情！太直接了！也不墨迹！,0.411835,0.588165,0.0848117,0
1925,有时间梳头发，为什么不把带血的衣服换换,0.41278,0.58722,0.0827109,0
1925,没看出来，尔晴坏啊,0.292092,0.707908,0.350906,0
1926,我怎么成尔康他爹了，他爹是福伦好吗！,0.0779417,0.922058,0.826796,0
1926,只有我觉得魏璎珞长得像姚晨吗,0.306267,0.693733,0.319407,0
1926,主角光环就是厉害,0.453306,0.546694,0.066117,1
1926,皇后就是秦岚的声音吧,0.46007,0.53993,0.201396,1
1926,台词有点太直白,0.173324,0.826676,0.614837,0
1927,秦岚姐姐好美,0.698247,0.301753,0.329438,2
1927,我不喜欢阿满，只喜欢你,0.253427,0.746573,0.43683,0
1927,那不是没有令妃的话历史上就不会有五阿哥了,0.115588,0.884412,0.743138,0
1927,就要大家一起作，反正主角光环在我头上,0.399939,0.600061,0.111246,0
1927,令妃是她儿子十五阿哥继位之后追封的,0.715162,0.284838,0.367027,2
1928,就觉得阿满那么耳熟原来是曹操啊,0.483183,0.516817,0.663662,1
1927,我喜欢这个剧情！太直接了！也不墨迹！,0.411835,0.588165,0.0848117,0
1928,我觉得演技都不错,0.881865,0.118135,0.737478,2
1928,知我者谓我心忧,1,0,1,1
1928,吉祥领饭盒太快了。,0.428145,0.571855,0.0485663,0
1928,尔康是虚构人物好吗,0.573495,0.426505,0.0522101,2
1928,秦岚姐姐好美,0.698247,0.301753,0.329438,2
1929,小姑娘，真可爱,0.556189,0.443811,0.0137541,2
1929,皇后是真的美啊由内到外的美,0.916249,0.0837509,0.813887,2
1929,这部电视的演员台词都比较直接,0.516227,0.483773,0.675469,1
1929,我觉得演技都不错,0.881865,0.118135,0.737478,2
1929,这集乾隆就一分多钟的戏噗哈哈哈哈,0.769424,0.230576,0.487609,2
1929,就觉得阿满那么耳熟原来是曹操啊,0.483183,0.516817,0.663662,1
1930,被个太监随便说几句就洗不清了,0.114367,0.885633,0.745851,0
1930,好厉害啊！徐徐图之,0.510165,0.489835,0.796706,1
1930,我就是那么认性,0.628648,0.371352,0.174774,2
1930,我还不想黑化,0.263269,0.736731,0.414959,0
1930,皇后最有心计你又是怎么看出来的,0.586092,0.413908,0.0802051,2
1930,和珅和纪晓岚刘墉是不是还没科举呢,0.449919,0.550081,0.000179079,0
1931,好好听的声音,0.452704,0.547296,0.0540894,1
1931,我对你很满意,0.85846,0.14154,0.685467,2
1931,看到两个人同框就好甜呀,0.659729,0.34027,0.243843,2
1931,配乐不合适,0.425592,0.574408,0.0542394,0
1932,令妃出生不高的靠自己实力,0.407257,0.592743,0.0949833,0
1931,怪不得一群人病殃殃的，坐个板凳都要人扶着…无语,0.102967,0.897033,0.771184,0
1932,曹阿瞒怎么是你姐姐啊,0.436115,0.563885,0.0308559,0
1931,说福尔康是傅恒儿子的，怕是没读过书吧。琼瑶剧看多了,0.334757,0.665243,0.256095,0
1932,宫心计是找姐姐，这里是给姐姐报仇，麻烦看剧情,0.790337,0.209663,0.534083,2
1932,还珠格格历史上是乾隆的一个格格不过给改编了,0.705359,0.294641,0.345242,2
1932,刷还珠的还不知道里面人物的名字,0.429277,0.570723,0.0460508,0
1932,能得皇上恩宠的，没心机怎么立足,0.273851,0.726149,0.391443,0
1933,少爷太帅了,0.571627,0.428373,0.0480598,2
1933,皇后当的什么呀上下尊卑很严格的怎么可能这样,0.462367,0.537633,0.247347,1
1933,本宫背了这个黑锅就真没法对付高贵妃了,0.182435,0.817565,0.594588,0
1933,后宫发生那么大的事，皇上不知道吗,0.439678,0.560322,0.0229384,0
1933,宫心计2比这个拍的晚，这个压了没播,0.478907,0.521093,0.578133,1
1934,秦岚好美好想娶她,0.791384,0.208616,0.536408,2
1934,换了衣服，你们要说换的这么快，不换你们又要说,0.204381,0.795619,0.54582,0
1933,不能换件干净衣服吗,0.208105,0.791895,0.537544,0
1934,皇后是六宫之首，后宫的事归皇后管，皇上是不会过问的,0.236537,0.763463,0.474362,0
1934,感觉姐姐是纯妃杀得耶,0.735933,0.264066,0.413186,2
1935,朕后宫佳丽3000大臣们排好队一人赏一个,0.800129,0.19987,0.555843,2
1934,血迹变了第三次，衣服是真的多啊,0.545375,0.454625,0.0924933,1
1934,少爷太帅了,0.571627,0.428373,0.0480598,2
1935,人五阿哥是注定要与小燕子缠缠绵绵的,0.665027,0.334973,0.255616,2
1935,头发都梳好了为何媳妇不换,0.384538,0.615462,0.14547,0
1935,衣服上的血也是神奇,0.578867,0.421133,0.0641482,2
1935,尔晴我劝你善良,0.324823,0.675177,0.278172,0
1935,这血演技真好啊,0.756429,0.243571,0.458732,2
1936,主角真厉害，看得好过瘾,0.868088,0.131912,0.706862,2
1936,脖颈上的伤好的真快啊！,0.672448,0.327552,0.272106,2
1936,这衣服上的血痕形状变得好快。。。,0.702326,0.297674,0.338503,2
1936,皇后还没有一个丫鬟厉害,0.281202,0.718798,0.375107,0
1936,为啥能在外面坐会去看皇后，不就去换个衣服，都还带血,0.425936,0.574064,0.0534746,0
1937,有人剧情进展快不适应慢了又讲墨迹你让它怎么办怎么办,0.242688,0.757312,0.460693,0
1937,娘娘好温柔善良,0.719277,0.280723,0.376171,2
1936,明玉看她的眼神不一样了,0.52248,0.47752,0.550402,1
1937,说台词直白的你难道想看文言文？看得懂吗？,0.130928,0.869072,0.709049,0
1937,突然说让他好好审核同意通过v得分让身体伤害他人生活,0.587925,0.412075,0.0842771,2
1937,这丫头不错，可以考虑一下,0.852655,0.147345,0.672567,2
1938,少爷，你怎么能这么帅的,0.63061,0.36939,0.179134,2
1937,三个场景，三件血衣！,0.569077,0.430923,0.0423941,2
1938,谁说姐姐就要大很多，大三四岁也可以照顾妹妹的，,0.833966,0.166034,0.631037,2
1938,脖子好的挺快啊,0.869811,0.130189,0.71069,2
1938,这皇后太温婉了吧！,0.244908,0.755092,0.455759,0
1938,尔晴，我劝你善良,0.324823,0.675177,0.278172,0
1939,我说看少爷怎么这么眼熟就是愤怒的小鸟啊哈哈,0.570598,0.429402,0.0457736,2
1939,都给朕退下，真要翻牌,0.517645,0.482355,0.647108,1
1939,胸前衣服上的红色像是红笔画的,0.590143,0.409857,0.0892071,2
1939,还不去换衣服啊这样带血见皇后受惊了,0.204054,0.795946,0.546547,0
1939,胸前的血迹又变样了,0.481005,0.518995,0.620108,1
1938,哼，那又怎么样,0.449688,0.550312,0.000693931,0
1939,谁欺负我未婚妻？,0.224796,0.775204,0.500453,0
1940,皇后声音真好听,0.466944,0.533056,0.338885,1
1940,还珠虽然是小说可是很多都是和历史相符的好吧,0.76949,0.23051,0.487755,2
1940,一口气连着看好像播放量不怎么高,0.376557,0.623443,0.163206,0
1940,蔡少芬演的皇后最有分寸,0.65117,0.34883,0.224822,2
1940,受不了尔康他爹的原型就是傅恒好吧不信自己去查,0.0520022,0.947998,0.88444,0
1941,委屈你了媳妇儿,0.383339,0.616661,0.148136,0
1941,琼瑶奶奶自己都说了还珠格格是虚构感情剧,0.663965,0.336035,0.253256,2
1941,皇后是🐷吗,0.402941,0.597059,0.104576,0
1940,现在的衣服跟刚刚衣服上的血渍又不同了,0.492608,0.507392,0.852152,1
1941,璎珞她姐姐的名字和高贵妃有重名，犯忌讳，所以改名字,0.624464,0.375536,0.165475,2
1942,衣服上的血迹真是戏精，头发也是,0.465792,0.534208,0.315846,1
1941,这血是认真的吗,0.463692,0.536308,0.273848,1
1942,是高贵妃要杀我,0.590886,0.409113,0.0908588,2
1942,闹了这么大动静。皇上都没耳闻吗,0.200965,0.799035,0.553411,0
1941,身上的血迹变少了,0.361448,0.638552,0.196782,0
1942,都是这部剧设计的，本宫可没那么坏,0.290788,0.709212,0.353805,0
1942,哪个导演她妈导的皇后管不了贵妃史盲吗,0.123606,0.876394,0.72532,0
1942,都是郑的媳妇,0.639944,0.360056,0.199876,2
1943,头发梳好了,0.723315,0.276684,0.385145,2
1943,本宫是皇后,0.544153,0.455847,0.116948,1
1943,扶了显得高贵啊,0.699659,0.300341,0.332576,2
1943,这团血渍一会儿是个✌️型，一会儿是个⭕️型，厉害哦,0.556258,0.443742,0.0139066,2
1943,敢说我们小高老妖婆你这是找diss,0.355651,0.644349,0.209663,0
1943,我什么时候出来啊,0.552497,0.447503,0.00554787,2
1944,高贵菲不是突然拜访吗没带东西也挺正常,0.152075,0.847925,0.662056,0
1944,皇后娘娘有一种魔仙女王的既视感,0.652472,0.347528,0.227715,2
1944,我觉得也是,0.491613,0.508387,0.832252,1
1944,天呀衣服上的血迹和刚刚不一样了！！刚刚不是这个样子,0.235622,0.764378,0.476396,0
1944,嘤嘤嘤好可怕,0.542732,0.457268,0.14537,1
1945,是皇后主使的，然后让你去看看然后把事情闹大,0.317461,0.682539,0.29453,0
1944,就是啊傅恒不是令妃的亲戚吗怎么成皇后的弟弟了,0.317154,0.682846,0.295213,0
1945,膏药不错，一下子脖子上的掐痕就没有了呢,0.83143,0.16857,0.6254,2
1945,午好啦啦啦,0.811434,0.188566,0.580964,2
1945,我可以当律师了,0.40212,0.59788,0.106401,0
1946,皇后很端庄，很善良的一个女子，璎珞很尊敬他,0.828077,0.171923,0.61795,2
1945,还不去换衣服,0.247352,0.752648,0.450329,0
1946,从来没有想过于正认真起来可以拍那么好,0.82126,0.17874,0.602799,2
1946,能不能有皇后的样子，头饰太朴素了,0.361551,0.638449,0.196554,0
1945,你说得很对，把证据叫出来☞,0.370106,0.629894,0.177543,0
1946,朕的戏份呢,0.707742,0.292258,0.350538,2
1947,这个怀了龙胎的后妃,出了这么大的事！皇上都不管？,0.508518,0.491482,0.829631,1
1946,这家伙厉害了,0.342464,0.657536,0.23897,0
1947,贵妃娘娘不讲理,0.555762,0.444238,0.0128051,2
1946,魏樱珞是朕的。,0.625737,0.374263,0.168305,2
1947,皇后要是没有皇后身份也活不长,0.171146,0.828854,0.619675,0
1947,皇后的声音听起来像是秦岚自己的声音,0.408538,0.591462,0.0921377,0
1948,哎，衣服不带血又要说怎么没血了，怎么那么难伺候,0.0360328,0.963967,0.919927,0
1947,皇后很端庄，很善良的一个女子，璎珞很尊敬他,0.828077,0.171923,0.61795,2
1947,我就是换了三次衣服不要再问啦！,0.596091,0.403909,0.102423,2
1948,伏地魔的名字你也敢讲，要说那个人,0.384241,0.615759,0.146131,0
1948,你说是就是呗,0.461938,0.538062,0.238757,1
1948,主角光环太过了,0.323374,0.676626,0.281391,0
1949,衣服的血变三次了走点心好吗,0.362664,0.637336,0.194079,0
1948,朕的两个儿媳真是聪明,0.475567,0.524433,0.511332,1
1948,我这血迹一会儿一个样呢？,0.486608,0.513392,0.732161,1
1949,这部剧衣服好美,0.578518,0.421482,0.0633743,2
1949,出现三次正面，三次血迹都不是一样的,0.207789,0.792211,0.538246,0
1949,以后你们就懂啦，我其实很善良,0.567387,0.432613,0.0386371,2
1949,皇后真窝能,0.475059,0.524941,0.501177,1
1950,他不会喜欢璎珞姐姐吧然后她姐夫知道了就把她姐姐强了,0.787442,0.212558,0.52765,2
1950,我怎么这么聪明呢,0.436285,0.563716,0.0304789,0
1949,皇上还没正眼看过她，这都多少集了[撇嘴],0.572299,0.427701,0.0495527,2
1950,这么大事情皇上太后都不管？,0.518835,0.481165,0.623309,1
1950,感觉是纯妃,0.586036,0.413964,0.0800804,2
1950,为什么绿了,0.333003,0.666997,0.259994,0
1950,皇后太好脾气了,0.326127,0.673873,0.275274,0
1951,那些说纯妃爱少爷的，不觉得纯妃像长辈吗,0.643015,0.356985,0.206701,2
1951,一点五倍是个好东西,0.312547,0.687453,0.30545,0
1951,这集真的槽点满满啊😂,0.60318,0.39682,0.118179,2
1951,就是这么美！,0.727511,0.272489,0.394468,2
1951,哟，好清秀的大闺女,0.8455,0.1545,0.656667,2
1951,是什么神药，脖子这么好了,0.382559,0.617441,0.149869,0
1952,所以魏璎珞的姐姐有可能也是这样死的吧？,0.339116,0.660884,0.246409,0
1952,为什么不去换一件衣服再来皇后这里呢,0.25017,0.749829,0.444065,0
1952,有血的衣服在皇后的殿内，这样好么,0.461939,0.538061,0.23877,1
1952,主角的戏，只看过烽火佳人唉，反派演的淋漓尽致,0.374093,0.625907,0.168683,0
1952,脖子上的瘀痕没有了,0.436168,0.563832,0.030738,0
1952,见皇后不换件衣服吗,0.184259,0.815741,0.590536,0
1953,剧组没衣服换了吧,0.253827,0.746173,0.435941,0
1953,主角光环加持中,0.607089,0.392912,0.126863,2
1953,皇后娘娘好好,0.674402,0.325598,0.276449,2
1953,皇后好温柔。。。。。,0.800786,0.199214,0.557303,2
1953,她是欺负小燕子的皇后娘娘吗？😁,0.201689,0.798311,0.551803,0
1953,见皇后不换件衣服吗,0.184259,0.815741,0.590536,0
1954,好清秀的姑娘……,0.740417,0.259583,0.423148,2
1954,。衣服上的血真是戏多,0.446529,0.553471,0.00771417,0
1954,太美好的皇后,0.412729,0.587271,0.082824,0
1954,璎珞说话的时候嘴巴有点像金星,0.514005,0.485995,0.719893,1
1954,我就不讲理,0.500116,0.499884,0.997673,1
1955,皇上哪有那么多闲心管后宫的事。,0.294677,0.705323,0.345163,0
1954,乾隆有两个皇后，一个是魏鹦咯，一个是富查皇后,0.518459,0.481541,0.630826,1
1955,尔晴我劝你善良,0.324823,0.675177,0.278172,0
1955,我觉得没这么简单,0.343254,0.656746,0.237212,0
1955,[得意][得意][得意],0.742565,0.257435,0.427922,2
1955,我就不讲理,0.500116,0.499884,0.997673,1
1956,伏地魔的名字你也敢讲，要叫那个人,0.292491,0.707509,0.350021,0
1956,说皇后没有宫女厉害的，把嘴闭上，璎珞最后也是皇后,0.230839,0.769161,0.487025,0
1956,我就是这么美,0.670613,0.329387,0.268028,2
1956,这件带血的衣服还准备穿到什么时候,就这样来见皇后?,0.216522,0.783478,0.51884,0
1956,爱咋咋滴俺小高就是做,0.342261,0.657739,0.239419,0
1955,脖子上的伤拿里去了,0.359831,0.640169,0.200375,0
1957,还行吧，至少比那些所谓的鲜花鲜肉演技好,0.49619,0.50381,0.923794,1
1956,喜欢富察皇后说高贵妃,0.879416,0.120584,0.732035,2
1957,你们都是魔鬼,0.409167,0.590833,0.0907396,0
1957,明月赶紧领盒饭吧没用的家伙,0.256684,0.743316,0.429591,0
1957,背景音乐实在太多了,0.311902,0.688098,0.306884,0
1957,看剧就好了,0.481211,0.518789,0.624224,1
1957,衣服上的血好像是口红,0.445303,0.554696,0.0104365,0
1958,桌子演得好,0.698236,0.301764,0.329413,2
1958,皇上呢，皇上是摆设吗，竟然没出面,0.217674,0.782326,0.51628,0
1958,皇后声音好好听,0.45197,0.54803,0.0393933,1
1958,原来你还是柯南,0.304663,0.695337,0.322972,0
1959,不喜欢还看了这么久，辛苦你们了,0.239525,0.760475,0.467722,0
1958,今天你们这些都去吃盒饭🍱……,0.38252,0.61748,0.149956,0
1959,这个死法，和璎珞姐姐一样吧，她姐姐是不是贵妃杀的,0.596625,0.403375,0.103611,2
1959,人在宫中坐，锅从天上来,0.66324,0.33676,0.251644,2
1959,不现代化怕你们听不懂,0.288026,0.711974,0.359943,0
1959,魏璎珞的姐姐是不是也是这么死的？,0.442226,0.557774,0.0172755,0
1959,喜欢这霸气的性格,0.918197,0.0818025,0.818217,2
1958,小朋友们，你们是不是喜欢傻白甜丫,0.305142,0.694858,0.321907,0
1960,说的是这啥毛吴什么言的，几个大牌带她还不用心，,0.413871,0.586129,0.0802868,0
1960,衣服上的血到底是怎么一回事,0.234139,0.765861,0.47969,0
1960,说不定她姐姐就是那个贵妃杀的,0.656878,0.343122,0.237506,2
1960,尔康他爹是乾隆,0.28907,0.71093,0.357622,0
1960,这么大的事情皇上都不来看一眼,0.333819,0.666181,0.258181,0
1961,尔晴我劝你善良,0.324823,0.675177,0.278172,0
1961,我怎么那么稀罕皇后娘娘呢主要是性格好诺,0.664806,0.335194,0.255124,2
1960,皇后我劝你霸气,0.409175,0.590825,0.0907229,0
1961,璎珞的左肩原是两根手指的样子，结果后来变成了一片,0.233604,0.766396,0.480879,0
1961,中了这剧的毒,0.591376,0.408624,0.0919469,2
1961,为啥还不换衣服啊带着血到处走,0.246395,0.753605,0.452457,0
1961,这么大的事情皇上都不来看一眼,0.333819,0.666181,0.258181,0
1962,这不叫主角光环好吧，主角光环是傻白甜大家还都帮着他,0.203728,0.796272,0.54727,0
1962,我就是不善良,0.264761,0.735239,0.411643,0
1962,头发梳好了换个衣服不行吗,0.238826,0.761174,0.469275,0
1962,多亏了珞樱啊,0.580738,0.419262,0.0683064,2
1962,中了这剧的毒,0.591376,0.408624,0.0919469,2
1963,这片拍的真是好多，有违常理的地方经不起推敲,0.535865,0.464135,0.282699,1
1962,这么久了不换件干净衣服吗？,0.271301,0.728699,0.397109,0
1963,人家好可怜,0.502558,0.497442,0.948843,1
1963,为什么红了,0.411649,0.588351,0.0852252,0
1963,似乎看懂了什么，璎珞的姐姐也是这样的吧,0.417515,0.582485,0.0721893,0
1964,主角完全就是自己挺聪明的，要报复别人也是一步步设局,0.55733,0.44267,0.0162897,2
1964,本宫叱咤后宫多年，没想到输给了主角光环,0.728961,0.271039,0.397691,2
1963,这不叫主角光环好吧，主角光环是傻白甜大家还都帮着他,0.203728,0.796272,0.54727,0
1964,历史上没有尔康这个人，琼瑶中所说的尔康是福康安,0.518379,0.481621,0.632412,1
1964,我媳妇就是厉害,0.442389,0.557611,0.0169125,0
1964,我觉得怡嫔也是高贵妃杀的,0.762597,0.237403,0.472437,2
1963,带入还珠格格太出戏了,0.288209,0.711791,0.359535,0
1965,陈道明年轻时候才叫帅，帅不帅要看气质。,0.627092,0.372908,0.171316,2
1964,这出血啊的位置是不是变了？,0.415246,0.584754,0.0772311,0
1965,剧情还蛮紧凑的，一口气看了这么多集,0.791589,0.208411,0.536864,2
1965,讲道理是不可能的,0.386949,0.613051,0.140112,0
1965,我好厉害呀,0.554215,0.445785,0.0093672,2
1965,可见她在宫中，是有多么的闲,0.561201,0.438799,0.024892,2
1966,丫鬟的表情好轻松，若无其事的样子,0.484641,0.515359,0.692822,1
1965,该管管了，太猖狂,0.163461,0.836539,0.636753,0
1966,我不是心机是聪明,0.210562,0.789438,0.532084,0
1966,弄一下高贵妃,0.522259,0.477741,0.554827,1
1966,皇后这个角色演的挺好,0.805515,0.194485,0.567812,2
1966,那么这个皇后是不是有个儿子是十二阿哥,0.421213,0.578787,0.0639709,0
1967,秦岚颜值好高啊,0.88885,0.11115,0.753,2
1966,可见她在宫中，是有多么的闲,0.561201,0.438799,0.024892,2
1967,皇后好温柔,0.800786,0.199214,0.557303,2
1967,妖帝最帅，你们谁也帅不过妖帝,0.86798,0.13202,0.706623,2
1967,丫鬟的表情好轻松，若无其事的样子,0.484641,0.515359,0.692822,1
