1332,这段戏也是多余的吧这个人城府这么深,0.58652,0.41348,0.0811545,2
1332,爱是一道光，绿到你发煌,0.693306,0.306694,0.318458,2
1331,靠那么近干嘛！快离开我媳妇,0.355364,0.644636,0.210301,0
1331,爱是一道光，绿到人发慌。,0.764589,0.235411,0.476864,2
1331,虽然是坏人但这一脸宠溺，莫名好甜哦,0.789867,0.210133,0.533038,2
1332,感觉穿太监衣服更帅啊有木有,0.699718,0.300282,0.332708,2
1331,人在家中坐，绿从天上来,0.627001,0.372999,0.171113,2
1332,我觉得王爷还是没我帅,0.514749,0.485251,0.705029,1
1333,说不帅的是不懂得欣赏,0.313618,0.686382,0.30307,0
1332,我都没亲过我媳妇小手,0.49031,0.50969,0.806201,1
1333,套路深似海,0.491005,0.508995,0.820097,1
1333,看本少爷的新染的头发咋样，,0.477366,0.522634,0.547315,1
1332,怎么觉得王爷这样好可爱,0.399255,0.600745,0.112766,0
1333,确实帅啊不能拿剧情说事吧,0.632661,0.367339,0.183692,2
1333,和亲王有点帅怎么回事,0.539269,0.460731,0.214624,1
1333,富恒要是跟璎珞在一起就好了,0.417809,0.582191,0.071536,0
1334,演弘昼的人看着好眼熟,0.697437,0.302563,0.327638,2
1334,盒饭快热好了，你再等会,0.62122,0.37878,0.158266,2
1334,璎珞好厉害啊哈哈哈哈,0.763417,0.236583,0.47426,2
1335,怎么办我好绿,0.663325,0.336675,0.251832,2
1334,一次给两个人带了帽子，璎珞你可真行,0.524916,0.475084,0.501675,1
1335,除了这副牙演技还是很好的人也帅,0.747101,0.252899,0.438002,2
1334,我媳妇勾人水平越发厉害呀,0.364654,0.635346,0.189658,0
1335,爱是一道光，绿的心发慌,0.785059,0.214941,0.522354,2
1334,人在家中坐，绿从天上来头顶一片青青草原,0.6002,0.3998,0.111555,2
1335,今天属实有点绿,0.272011,0.727989,0.395532,0
1335,演弘昼的人看着好眼熟,0.697437,0.302563,0.327638,2
1335,璎珞好厉害啊哈哈哈哈,0.763417,0.236583,0.47426,2
1336,二月绿前来求帽二月绿前来求帽,0.376951,0.623049,0.162332,0
1336,说可爱的是什么样的审美观真是佩服佩服,0.539426,0.460574,0.211471,1
1336,兄弟们，和亲王的饭盒热好了吗？,0.521889,0.478111,0.562212,1
1336,愛是一道光，祿到你發光,0.71632,0.28368,0.369601,2
1336,我好像又绿了,0.499774,0.500226,0.995482,1
1336,爱是一道光，绿到你发光。,0.749841,0.250159,0.444091,2
1337,这太监服穿得真顺眼，像就是他的衣服一样合适,0.608371,0.391629,0.129713,2
1337,要想谈恋爱头上总得带点绿,0.352882,0.647118,0.215818,0
1337,比抚痕强太多了,0.689877,0.310123,0.310839,2
1337,撩男人就是这么简单,0.571885,0.428115,0.0486341,2
1337,说美牙仪的别走聊聊,0.732673,0.267327,0.405939,2
1338,王爷好单纯哈哈哈哈,0.811387,0.188613,0.580859,2
1337,盒饭备好了吃吧,0.486241,0.513759,0.724815,1
1338,道具组:给王爷热盒饭咯,0.56384,0.43616,0.0307556,2
1338,戴着帽子好可爱,0.696517,0.303483,0.325592,2
1338,盒饭已经给你热好了,0.492948,0.507052,0.858967,1
1338,璎珞撩汉无人能敌,0.56183,0.43817,0.0262894,2
1339,牙齿怎么看都不顺眼，能不能找个好点的牙医！,0.650928,0.349072,0.224285,2
1339,盒饭热好了趁热吃吧,0.662388,0.337612,0.249752,2
1338,这太监服穿得真顺眼，像就是他的衣服一样合适,0.608371,0.391629,0.129713,2
1339,整的大龅牙真白,0.439448,0.560552,0.0234483,0
1339,您是不知道我多皮,0.411731,0.588269,0.0850413,0
1339,皇上我们绿了,0.516841,0.483159,0.663178,1
1339,一看天气就很热演员头上都是汗,0.524898,0.475102,0.502033,1
1340,好甜好甜好罪过,0.899905,0.100095,0.777566,2
1340,王爷的大鼻孔小门牙还挺可爱哈哈哈哈,0.766935,0.233065,0.482077,2
1340,好大的胆子,0.770826,0.229174,0.490725,2
1340,莫名觉得王爷挺好玩，他俩有产品cp感,0.663505,0.336495,0.252234,2
1341,这个王爷和海兰察长的有点像看预告还以为是海兰察呢,0.581183,0.418817,0.0692962,2
1341,我被太多人绿了,0.271988,0.728012,0.395581,0
1340,这烤瓷牙做的，满屏的大白牙,0.518578,0.481422,0.628449,1
1341,和亲王走过最深的路就是璎珞的套路,0.821878,0.178122,0.604173,2
1340,为啥我觉得弘昼好可爱,0.595601,0.404399,0.101336,2
1341,还是穿太监衣服更顺眼,0.441754,0.558246,0.0183255,0
1341,快给五爷盒饭热一热,0.509464,0.490536,0.810729,1
1341,为啥我觉得弘昼好可爱,0.595601,0.404399,0.101336,2
1342,大夏天，拍过戏辛苦啊，大猪蹄子都出汗了,0.907593,0.0924066,0.794652,2
1342,诶妈耶，我总感觉头上有东西,0.464921,0.535079,0.298417,1
1342,举头三尺有神淋。蔡依林不会让你为非作歹的。,0.375626,0.624374,0.165276,0
1342,我被太多人绿了,0.271988,0.728012,0.395581,0
1343,五爷，你演太监比演王爷帅多了,0.689937,0.310063,0.310971,2
1342,王爷的盒饭还有三分钟热好,0.713217,0.286783,0.362705,2
1342,王爷长的还不错就是有点混,0.594768,0.405232,0.0994835,2
1343,饭盒热好了快去吃吧,0.714456,0.285544,0.365458,2
1343,王爷您的大板牙太抢戏了,0.354449,0.645551,0.212337,0
1343,要想生活过得去头上必须带点绿,0.491613,0.508387,0.832268,1
1343,我这不是得给你热盒饭吗,0.0829694,0.917031,0.815623,0
1344,这牙齿假牙好明显,0.630217,0.369783,0.178261,2
1343,看这货的大龅牙！,0.336733,0.663267,0.251705,0
1344,大猪蹄子撒开你的手！要不然给你剁了！,0.557112,0.442888,0.0158034,2
1344,我好厉害呀,0.554215,0.445785,0.0093672,2
1344,动我媳妇儿，不想活了,0.275991,0.724009,0.386686,0
1344,怕是对帅有什么误解,0.728453,0.271547,0.396563,2
1345,大猪蹄子我劝你善良,0.405996,0.594004,0.0977873,0
1344,王爷长得还不错,0.747549,0.252451,0.438997,2
1345,绿的人发慌啊,0.577836,0.422164,0.0618581,2
1345,内个瘦不拉几的小太监衣服弘昼能穿？,0.462976,0.537025,0.25951,1
1345,大猪蹄子撒开你的手！要不然给你剁了！,0.557112,0.442888,0.0158034,2
1345,皇弟，你好大的胆子,0.751023,0.248977,0.446718,2
1346,璎珞勾引人真的一勾一个准,0.574846,0.425154,0.0552127,2
1345,我好厉害呀,0.554215,0.445785,0.0093672,2
1346,说实话，王爷长的真不错！,0.793148,0.206852,0.540328,2
1346,我今天特别绿,0.594591,0.405409,0.0990907,2
1346,看到王爷的牙就会出戏,0.619347,0.380653,0.154104,2
1346,头上的汗是真的热啊,0.357468,0.642532,0.205626,0
1346,拉出去杖毙了,0.494434,0.505566,0.888685,1
1347,王爷的烤瓷牙太抢戏了🤦‍♀️就不能做个全瓷牙么,0.205005,0.794995,0.544434,0
1347,天热不热？一脑袋汗珠子呢,0.474781,0.525219,0.495613,1
1347,这句台词好耳熟,0.487739,0.512261,0.754783,1
1347,弘昼演技有点点嫩啊，这样就感觉绷不住了，哈哈,0.769701,0.230299,0.488224,2
1347,璎珞勾引人真的一勾一个准,0.574846,0.425154,0.0552127,2
1348,璎珞前后差距太大了，明眼人一看就是装的,0.0822493,0.917751,0.817224,0
1347,头上的汗是真的热啊,0.357468,0.642532,0.205626,0
1348,王爷这滴汗演得好！,0.650656,0.349344,0.22368,2
1348,大夏天瞧把他热的，满头的汗,0.569718,0.430282,0.0438182,2
1348,突然感觉有点绿,0.3585,0.6415,0.203334,0
1348,你们牙冠做的不错😂又白又齐,0.666442,0.333558,0.25876,2
1349,大猪蹄子，你可让我好等啊,0.75816,0.24184,0.462578,2
1348,我劝你们善良,0.203694,0.796306,0.547348,0
1349,真的帅，如果演个好人会很可爱的,0.943489,0.0565108,0.874421,2
1349,爱是一道光，绿到你发慌,0.745364,0.254636,0.434143,2
1349,璎珞前后差距太大了，明眼人一看就是装的,0.0822493,0.917751,0.817224,0
1349,王爷你是有多热？汗珠几颗几颗的滴,0.579129,0.420871,0.06473,2
1349,突然感觉有点绿,0.3585,0.6415,0.203334,0
1350,我媳妇套路深啊！好绿,0.748605,0.251395,0.441346,2
1350,不施点小记，本姑娘就浑身不舒服,0.160023,0.839977,0.644394,0
1350,王爷的盒饭热好了,0.603443,0.396557,0.118763,2
1350,俩个戏精啊,0.583642,0.416358,0.07476,2
1350,璎珞用美色勾引和亲王。想和我斗你还是嫩那点。,0.435533,0.564467,0.0321478,0
1351,和亲王，厉害厉害哦！抢我媳妇儿啊！来来来，走一波,0.708899,0.291101,0.353109,2
1350,王爷流汗了多热啊哈哈哈哈,0.785034,0.214966,0.522299,2
1351,这个王爷可爱，不演坏人就好了,0.662356,0.337644,0.249681,2
1351,说实话王爷长得不错,0.725488,0.274512,0.389973,2
1351,看王爷这流氓样，王爷演的好,0.422164,0.577836,0.0618588,0
1351,俩个戏精啊,0.583642,0.416358,0.07476,2
1352,对非常完美男嘉宾叫啥来着王爷眼熟,0.611554,0.388446,0.136787,2
1352,我头上好像有点什么东西好重,0.278533,0.721467,0.381037,0
1352,说不帅的是不懂得欣赏,0.313618,0.686382,0.30307,0
1352,头上的汗是认真的吗,0.432652,0.567348,0.0385504,0
1351,一嘴牙好耀眼,0.687073,0.312926,0.304608,2
1353,觉得大瓷牙挺可爱的,0.650525,0.349475,0.223389,2
1353,你是饿了呢还是吃饱了撑的,0.810699,0.189301,0.579331,2
1353,爱是一道光，，绿到你发慌,0.745364,0.254636,0.434143,2
1352,看王爷这流氓样，王爷演的好,0.422164,0.577836,0.0618588,0
1353,勾引得好明显,0.552,0.448,0.00444531,2
1353,傅恒绿了绿了,0.420435,0.579565,0.0657007,0
1352,你看这脸上的汗，天得多热啊,0.352607,0.647393,0.216429,0
1354,王爷有点帅，😚😚😚希望他下次演个好角色,0.860665,0.139335,0.690366,2
1353,我头上好像有点什么东西好重,0.278533,0.721467,0.381037,0
1354,大媳妇，真好,0.845704,0.154296,0.657121,2
1354,爱像一道光，绿到你发慌，和亲王，我劝你善良,0.488081,0.511919,0.76162,1
1354,为啥我觉得王爷帅了咋整,0.702187,0.297813,0.338193,2
1354,世上最长的路，就是璎珞的套路,0.633053,0.366946,0.184563,2
1355,大不大呀软不软啊王爷,0.322555,0.677445,0.283211,0
1354,傅恒绿了绿了,0.420435,0.579565,0.0657007,0
1355,跟本宫玩套路？你还是太嫩了,0.424197,0.575803,0.0573407,0
1355,王爷到底是多热啊哈哈哈哈,0.738641,0.261359,0.419202,2
1355,世上最长的路，就是璎珞的套路,0.633053,0.366946,0.184563,2
1355,大胆！朕的媳妇你都敢动,0.575864,0.424136,0.0574762,2
1355,爱像一道光，绿到你发慌，和亲王，我劝你善良,0.488081,0.511919,0.76162,1
1356,和亲王你的盒饭热好了，现在要用吗,0.330628,0.669372,0.26527,0
1356,王爷你可长点儿心吧,0.449654,0.550346,0.000768238,0
1356,妈耶，和亲王你个大猪蹄子。,0.472278,0.527722,0.445557,1
1356,走过最长的路，就是樱络的套路,0.703553,0.296447,0.341229,2
1356,王爷到底是多热啊哈哈哈哈,0.738641,0.261359,0.419202,2
1356,璎珞说谎话的时候嘴巴会上扬你们注意到没,0.369712,0.630288,0.178417,0
1357,会勾引人不错不错,0.890725,0.109275,0.757166,2
1357,这眼睛眨的勾引成功。王爷你把璎珞想的太简单好欺负了,0.281955,0.718045,0.373433,0
1358,五爷挺可爱的啊！看那宠溺的眼神,0.422018,0.577982,0.0621819,0
1357,王爷好热啊都流汗了,0.732145,0.267855,0.404766,2
1357,感觉好热，他都流汗了,0.628561,0.371439,0.17458,2
1358,绿了绿了傅恒绿了,0.391412,0.608588,0.130196,0
1358,这笑天真无邪,0.492481,0.507519,0.849613,1
1357,好绿好绿呜呜呜,0.752956,0.247044,0.451014,2
1357,璎珞好会勾引人，套路深,0.754025,0.245975,0.453389,2
1358,王爷好热啊都流汗了,0.732145,0.267855,0.404766,2
1358,我媳妇儿一笑准没好事,0.481845,0.518155,0.636893,1
1359,王爷你怕是不知道魏姐姐的套有多深,0.63521,0.36479,0.189355,2
1359,好大的胆子，敢勾引朕的女人,0.738456,0.261544,0.418792,2
1359,妈呀这拍戏的时候是有多热，这汗流的,0.621607,0.378393,0.159127,2
1358,好绿好绿呜呜呜,0.752956,0.247044,0.451014,2
1359,新帽子好开心,0.777204,0.222796,0.504898,2
1359,盒饭快热好了,0.712469,0.287531,0.361041,2
1359,绿了绿了傅恒绿了,0.391412,0.608588,0.130196,0
1360,两个戏精.璎珞没有一点真诚感，感觉一直是个套路王,0.548221,0.451779,0.0355899,1
1360,说话的时候嘴好大,0.601191,0.39881,0.113757,2
1360,要想生活过得去，头上就得带点绿,0.42612,0.57388,0.0530665,0
1360,新帽子好开心,0.777204,0.222796,0.504898,2
1360,和亲王你饿了吧我媳妇已经把盒饭给你热好了,0.412733,0.587267,0.0828163,0
1360,弘昼长得多可爱,0.505913,0.494087,0.881741,1
1361,我就说这牙好面熟邓伦在欢乐颂里面也是这样的牙,0.451996,0.548004,0.0399119,1
1361,好甜哈哈哈完了我背叛了傅璎,0.76672,0.23328,0.481599,2
1361,不得体！！是套路也不得体啊！！！放开你的大猪蹄！,0.288743,0.711257,0.358349,0
1361,头上好热，是多了帽子么？咦？眼前怎么绿了？？？？,0.447707,0.552293,0.00509646,0
1361,女人都是大猪蹄子,0.55932,0.44068,0.0207114,2
1362,感觉吴谨言演那种妖艳的坏女人也会很出彩,0.732109,0.267891,0.404686,2
1361,一个嘴大，一个牙齿大，好登对,0.668339,0.331661,0.262976,2
1362,我觉得我头上好绿,0.574311,0.425689,0.0540241,2
1362,如果他不帅色样大家觉得好倒胃口，帅还好点,0.396888,0.603112,0.118028,0
1362,爱是一道光绿的心发慌！,0.785059,0.214941,0.522354,2
1362,哇弘昼笑的好甜,0.838039,0.161961,0.640088,2
1362,一个嘴大，一个牙齿大，好登对,0.668339,0.331661,0.262976,2
1363,樱落长得像男演员叫什么了,0.390176,0.609824,0.132942,0
1363,爱是一道光，绿到发慌，绿色走一波,0.762804,0.237196,0.472897,2
1363,盒饭马上就热好了,0.609747,0.390253,0.132771,2
1363,干嘛干嘛手手手,0.170698,0.829302,0.620671,0
1363,我觉得我头上好绿,0.574311,0.425689,0.0540241,2
1363,哇弘昼笑的好甜,0.838039,0.161961,0.640088,2
1364,莫名甜是怎么回事,0.349257,0.650743,0.223873,0
1364,绿了绿了新帽子还有点绿,0.470543,0.529457,0.410854,1
1364,爱是一道光，绿道我发慌,0.796199,0.203801,0.547109,2
1364,这个牙又白又大,0.465218,0.534782,0.304367,1
1364,真的长得很像章子怡耶,0.496062,0.503938,0.921249,1
1365,好绿好绿，绿的发光,0.812385,0.187614,0.583079,2
1364,你的盒饭已经热好了,0.478619,0.521381,0.572384,1
1365,哟又在幽会呢可真行啊,0.741335,0.258665,0.425189,2
1365,我变绿了耶，好神奇啊😄😄😄,0.801683,0.198317,0.559295,2
1365,一口大白牙还齐,0.513616,0.486384,0.727681,1
1365,莫名甜是怎么回事,0.349257,0.650743,0.223873,0
1366,有的角度像楚乔传的男二还蛮帅的,0.861299,0.138701,0.691775,2
1366,不得体不得体啊啊,0.326,0.674,0.275555,0
1366,天呐绿了绿了,0.428075,0.571925,0.0487223,0
1366,爱像一道光绿到发亮,0.768748,0.231252,0.486106,2
1366,牙好白出戏,0.64634,0.35366,0.214089,2
1366,要想生活过得去，身上总得带点绿！😁,0.460514,0.539486,0.21028,1
1365,这王爷别说还有点帅是怎么回事,0.469903,0.530097,0.398064,1
1367,牙齿好出戏。牙好出戏呀好出戏,0.877205,0.122795,0.727122,2
1367,弘昼，我已经帮你把盒饭热好了,0.523625,0.476375,0.527499,1
1367,深，好深的套路,0.825665,0.174335,0.61259,2
1367,绿了芭蕉红了樱桃,1,0,1,1
1367,好一片绿呀,0.651531,0.348469,0.225625,2
1367,混账朕的女人你也敢占便宜,0.421514,0.578486,0.0633025,0
1368,说帅的那个莎普爱思都救不了你的眼,0.585185,0.414815,0.0781883,2
1368,好吃不过饺子，好玩不过姨子,0.91328,0.0867196,0.80729,2
1368,王爷，我给你热一碗盒饭吧，吃完就可以歇息了,0.452887,0.547113,0.0577479,1
1368,要想生活过得去，必须头上带点绿，安排,0.49922,0.50078,0.984409,1
1368,这两口大白牙好抢镜头啊,0.606406,0.393594,0.125346,2
1369,长得这样的是不是都是大画心,0.224491,0.775509,0.50113,0
1369,我头上好绿,0.611554,0.388446,0.136786,2
1369,脑袋上的帽子怕不是绿的,0.285176,0.714824,0.366276,0
1369,好甜，罪过罪过,0.748472,0.251528,0.441048,2
1368,绿了芭蕉红了樱桃,1,0,1,1
1370,完了完了，绿了绿了，导演快让我出去,0.668288,0.331712,0.262861,2
1369,说帅的那个莎普爱思都救不了你的眼,0.585185,0.414815,0.0781883,2
1369,他之前不是说和傅恒感情深厚不会动她吗,0.131988,0.868012,0.706694,0
1370,怎么办我感觉我浑身绿,0.508949,0.491051,0.821013,1
1370,王爷好可爱耳朵都红了,0.775992,0.224008,0.502205,2
1370,我感觉多了个什么东西,0.384818,0.615182,0.144848,0
1371,王爷大半夜的，是来找魏姐热盒饭的吗,0.434896,0.565104,0.033564,0
1370,王爷挺帅啊，怎么觉得好甜,0.88558,0.114419,0.745734,2
1370,我头上好绿,0.611554,0.388446,0.136786,2
1371,好绿好绿啊,0.793352,0.206648,0.540783,2
1371,人渣，就帅点你们就忘记他是个人渣了？他就该被教训,0.214898,0.785102,0.522448,0
1371,好啊你备着我和别人勾肩搭背,0.648408,0.351592,0.218685,2
1371,牙齿好白啊,0.785263,0.214737,0.522807,2
1371,王爷好可爱耳朵都红了,0.775992,0.224008,0.502205,2
1372,王爷牙齿长得还不错,0.810925,0.189075,0.579834,2
1372,好大一片绿啊,0.643311,0.356689,0.207358,2
1372,朕的女人你都敢动。不想活了是吧,0.199313,0.800687,0.557083,0
1372,好绿好绿啊,0.793352,0.206648,0.540783,2
1372,王爷大半夜的，是来找魏姐热盒饭的吗,0.434896,0.565104,0.033564,0
1372,突然觉得本宫好善良嘤嘤嘤,0.55736,0.44264,0.0163563,2
1373,好大的胆子,0.770826,0.229174,0.490725,2
1373,主角太厉害了什么人都玩弄想整谁就整谁,0.223779,0.776221,0.502713,0
1373,爱是一道光，绿的你发慌,0.732568,0.267432,0.405708,2
1373,你这个大猪蹄子放开我媳妇,0.51173,0.48827,0.76539,1
1374,缨络嘴太多戏了。看着真不舒服,0.144053,0.855947,0.679883,0
1373,你们两个这样不得体不得体,0.142376,0.857624,0.683608,0
1374,盒饭热好了，来吃吧,0.569385,0.430615,0.0430779,2
1373,王爷您的烤瓷牙可太出众了,0.4521,0.5479,0.0420064,1
1374,好可爱哈哈哈哈哈不想他盒饭,0.787207,0.212793,0.527126,2
1374,王爷这是假牙吧这么齐,0.436514,0.563486,0.0299687,0
1374,蜡烛演得好，一根醋，一根细,0.644239,0.355761,0.209419,2
1374,可是我觉得好甜啊,0.74198,0.25802,0.426622,2
1375,绿了绿了，富恒还有三秒到达战场,0.624816,0.375184,0.166259,2
1375,快亲亲抱抱举高高，打一针,0.671086,0.328914,0.269081,2
1375,王爷牙齿好白,0.769363,0.230638,0.487472,2
1375,快去吃盒饭吧，都给你热好了,0.631587,0.368413,0.181305,2
1375,大家都叫我小狐狸精吧,0.381818,0.618182,0.151516,0
1376,王爷的牙好白啊，又大又白，贼带感，很想认识他的牙医,0.778548,0.221452,0.507884,2
1375,头上的花是什么？多肉吗？哈哈哈,0.348721,0.651279,0.225064,0
1376,感觉好甜喔是怎么回事,0.63001,0.36999,0.1778,2
1376,绿了绿了，绿得发亮,0.453125,0.546875,0.0625038,1
1376,盒饭给你热好了,0.478221,0.521779,0.564414,1
1376,你的盒饭已热好,0.509476,0.490524,0.810482,1
1376,脑壳疼脑壳疼,0.506789,0.493211,0.864214,1
1377,媳妇儿不得体啊，我都绿啦,0.647572,0.352428,0.216826,2
1377,王爷大白牙演技不错,0.860708,0.139292,0.690461,2
1377,要想生活过得去，头上总得带点绿,0.41049,0.58951,0.087799,0
1377,王爷的牙是认真的吗,0.6216,0.3784,0.159111,2
1377,其实我感觉长得还不错,0.69559,0.30441,0.323532,2
1378,爱是一道光，照在傅恒头上绿的如此美丽,0.773273,0.226727,0.496162,2
1378,不得体啊不得体啊脑壳疼,0.336823,0.663177,0.251504,0
1378,大猪蹄子大猪蹄子,0.678312,0.321688,0.285138,2
1378,满屏绿完了完了绿,0.484775,0.515225,0.695496,1
1378,这货牙齿为什么又白又齐的,0.521134,0.478866,0.577311,1
1377,感觉好甜喔是怎么回事,0.63001,0.36999,0.1778,2
1379,爱是一道光，如此美妙，绿到你发慌…,0.799795,0.200205,0.555101,2
1378,头上都绿成大草原了都,0.526975,0.473025,0.460491,1
1379,来人啊，帮朕的弟弟看看他的盒饭热好了没,0.640139,0.359861,0.200309,2
1379,為什麼感覺好甜,0.574966,0.425034,0.0554791,2
1379,怎么感觉好绿,0.56398,0.43602,0.031067,2
1379,满屏绿完了完了绿,0.484775,0.515225,0.695496,1
1380,五王爷牙好白，用的是黑人牙膏吧,0.555048,0.444952,0.0112181,2
1379,一般这个时候反派会听墙角,0.388058,0.611942,0.137648,0
1380,牙齿好出戏。牙好出戏呀好出戏,0.877205,0.122795,0.727122,2
1380,怎么办心里小鹿扑通扑通的觉得好甜,0.721015,0.278985,0.380034,2
1380,王爷的嘴一看就是玉米吃多了,0.463498,0.536502,0.269967,1
1380,好绿好绿阿,0.763595,0.236405,0.474655,2
1381,绿了绿了富察少爷绿了,0.403462,0.596538,0.103417,0
1381,王爷耳朵红的让人出戏,0.588414,0.411586,0.0853647,2
1381,五王爺的牙齒好白,0.647724,0.352276,0.217165,2
1381,唉我这媳妇媳让我脑阔疼,0.299193,0.700807,0.335126,0
1381,长的挺好就是牙大，,0.762665,0.237335,0.472588,2
1381,勾引人，一勾一个准，准备老娘要对付你了,0.355668,0.644332,0.209627,0
1382,还有人觉得甜，天呐，是单身太久了吗，哈哈哈哈哈哈哈,0.955339,0.0446614,0.900753,2
1382,饭盒热好了自己来领下,0.673046,0.326954,0.273436,2
1382,要想生活过得去，头上就得带点绿,0.42612,0.57388,0.0530665,0
1380,怎么感觉好绿,0.56398,0.43602,0.031067,2
1382,绿了绿了使不得使不得,0.471867,0.528133,0.437347,1
1382,对的，感觉王爷的牙好大呀,0.689814,0.310186,0.310698,2
1382,绿了绿了富察少爷绿了,0.403462,0.596538,0.103417,0
1383,快快快绿色来一波,0.644878,0.355122,0.21084,2
1383,呃，刚有那么一瞬间觉得这个大猪蹄子声音还很好听……,0.435725,0.564275,0.031722,0
1383,离得那么近发现弘昼的牙怎么那么白,0.364178,0.635822,0.190715,0
1383,要想生活过得去.头上必须带点绿.,0.491613,0.508387,0.832268,1
1383,王爷的牙是贴片美白！这么明显的、都看不出来？！,0.308666,0.691334,0.314076,0
1383,绿绿绿更健康,0.556852,0.443148,0.015227,2
1384,要想生活过得去身上总得带点绿,0.460514,0.539486,0.21028,1
1384,我怎么觉得王爷穿了太监服更顺眼呢,0.473604,0.526396,0.472083,1
1384,感觉自己好绿,0.662295,0.337705,0.249544,2
1384,我头上有一片大草原,0.474997,0.525003,0.499947,1
1384,头上带了大大滴绿,0.650742,0.349258,0.223872,2
1385,绿背景下的大绿色,0.559775,0.440225,0.0217224,2
1385,这王爷要是好角色的话肯定超甜超帅超会撒娇,0.934829,0.0651708,0.855176,2
1384,我就喜欢这种男人，老实男人就是木头,0.572339,0.427661,0.0496423,2
1385,绿了绿了，到底是皇上绿了还是傅恒绿了,0.297127,0.702873,0.339717,0
1385,我怎么觉得王爷穿了太监服更顺眼呢,0.473604,0.526396,0.472083,1
1386,婴珞啊，都照你这样真的好么？还是人在你那位置都这样,0.428641,0.571359,0.0474633,0
1385,绿起来为新的力量喝彩,0.700569,0.299431,0.334597,2
1385,我头上有一片大草原,0.474997,0.525003,0.499947,1
1386,恒远，你变了，快去领盒饭吧，我媳妇儿热好了,0.653441,0.346559,0.229868,2
1386,爱是一道绿光如此美妙,0.828205,0.171795,0.618234,2
1386,到底是皇上绿了，还是我绿了，说清楚,0.383693,0.616307,0.147349,0
1386,爱是一道光，绿的人发慌,0.757883,0.242117,0.461963,2
1386,好大一个绿字在头上,0.606465,0.393535,0.125477,2
1387,给本宫把绿刷起来！皇后娘娘你看看你的弟妹！！,0.429304,0.570696,0.0459912,0
1387,大猪蹄子你的盒饭热好了,0.574026,0.425974,0.0533917,2
1387,好深的套路,0.770766,0.229234,0.490591,2
1387,傅恒啊，你看你要是早觉得得体，早把人家娶回家了！,0.591491,0.408509,0.0922023,2
1387,到底是皇上绿了，还是我绿了，说清楚,0.383693,0.616307,0.147349,0
1388,你们看王爷的牙，是又大又白,0.344502,0.655498,0.23444,0
1387,樱洛演得太卖力了，就有点过了,0.435398,0.564602,0.0324493,0
1388,好绿好绿的呢,0.831617,0.168383,0.625816,2
1388,排好队一个一个开始绿,0.675509,0.324491,0.278909,2
1388,绿了绿了绿了哈哈哈哈,0.610502,0.389498,0.134448,2
1388,给本宫把绿刷起来！皇后娘娘你看看你的弟妹！！,0.429304,0.570696,0.0459912,0
1389,爱是一道光，绿到我发慌，我头上好绿好绿,0.826086,0.173914,0.613525,2
1389,把话讲清楚，被皇上绿就算了，王爷算怎么回事儿！,0.196018,0.803982,0.564404,0
1389,帮我看看我头上是不是绿了,0.290524,0.709476,0.354391,0
1389,好绿啊你们太皮了,0.353024,0.646976,0.215503,0
1388,樱洛演得太卖力了，就有点过了,0.435398,0.564602,0.0324493,0
1389,乾隆和傅恒都表示好绿,0.723333,0.276667,0.385185,2
1390,头上的帽子好绿啊绿的发光.,0.619494,0.380506,0.154431,2
1390,大猪蹄子大猪蹄子,0.678312,0.321688,0.285138,2
1389,满屏绿是认真的吗哈哈哈哈,0.736336,0.263664,0.414079,2
1390,乾隆：你敢绿我女人拉出去砍了,0.25158,0.74842,0.440933,0
1390,牙哥你的盒饭热好了,0.515065,0.484935,0.698707,1
1390,妈耶绿了绿了,0.393818,0.606182,0.124848,0
1391,要想生活过得如意，头上总得带点绿。,0.528601,0.471399,0.427978,1
1391,绿也是装绿,0.471738,0.528262,0.434751,1
1391,爱是一道光，绿到你花荒,0.716517,0.283483,0.370038,2
1391,这牙不是全瓷牙吗,0.109805,0.890195,0.755988,0
1391,完了，我居然觉得好甜,0.622478,0.377522,0.161062,2
1390,大板牙演的好,0.803368,0.196632,0.56304,2
1392,王爷的烤瓷牙好整齐啊,0.838285,0.161715,0.640633,2
1391,大猪蹄长得还可以,0.744189,0.255811,0.431531,2
1392,要想生活过得去，头上总得戴点绿,0.410171,0.589829,0.0885092,0
1392,绿了绿了，媳妇儿，你是在玩火,0.423024,0.576976,0.0599468,0
1392,妈呀哈哈哈哈哈看得我好羞涩,0.878362,0.121639,0.729692,2
1392,绿一绿更健康,0.517296,0.482704,0.654076,1
