2012,真的求求皇后多活一会太喜欢她了,0.659101,0.340899,0.242447,2
2013,主角从头到尾都没有被罚过，主角光环是不是有点太大,0.213188,0.786812,0.52625,0
2012,我为啥要这么棒,0.750077,0.249923,0.444615,2
2013,皇后也太好了太好了,0.965573,0.0344272,0.923495,2
2013,我怎么这么爱作呢？皇后，你别管我了，让我长长记性吧,0.592263,0.407737,0.0939172,2
2013,令后大旗我来扛,0.551692,0.448308,0.00376039,2
2013,你的高可爱突然出现,0.614348,0.385652,0.142996,2
2013,真的求求皇后多活一会太喜欢她了,0.659101,0.340899,0.242447,2
2014,我好善良好温柔,0.851641,0.148359,0.670314,2
2014,大爱皇后。从没见过这么好的皇后。感动到哭,0.981771,0.0182289,0.959491,2
2014,魏璎珞是积了八辈子的德，皇后对她这么好,0.673678,0.326322,0.27484,2
2014,拜托你们能看看简介再来看剧好吗,0.151139,0.848861,0.664136,0
2014,令后大旗我来扛,0.551692,0.448308,0.00376039,2
2014,皇后都知道啊，她多了解璎珞啊，但是还是要护着她,0.781041,0.218959,0.513424,2
2015,朕吃醋了要皇后亲亲抱抱举高高,0.603005,0.396995,0.11779,2
2015,桌上那么多章好抢镜,0.462321,0.537679,0.246428,1
2015,皇后像个大姐姐,0.608749,0.391251,0.130553,2
2015,这么多件事都能成功几率太小了吧，不成功一件都要gg,0.658277,0.341723,0.240615,2
2015,大爱皇后。从没见过这么好的皇后。感动到哭,0.981771,0.0182289,0.959491,2
2016,好歹罚一罚魏吧，主角光环太重,0.228874,0.771126,0.491391,0
2016,皇后真的太好了太好了,0.932603,0.0673969,0.850229,2
2015,大爱无疆的富察皇后，好喜欢你！有同感的赞起来👍,0.895753,0.104247,0.76834,2
2016,皇后娘娘眉毛没画好,0.640765,0.359235,0.2017,2
2016,必须护住弟妹啊，额娘盼了这么久了！,0.521669,0.478331,0.56662,1
2016,不开心总是被利用,0.337839,0.662161,0.249246,0
2017,好喜欢皇后凉凉温柔的声音,0.826958,0.173042,0.615463,2
2016,朕这么多的印章啊,0.600665,0.399335,0.11259,2
2017,这么多心眼心机重的宫女居然还有人信,0.203264,0.796736,0.548303,0
2017,感觉皇后没出来时皇桑都要信了，皇后一出就开始嫉妒,0.516555,0.483445,0.668893,1
2017,要媳妇还是要兄弟呢,0.518304,0.481696,0.633912,1
2017,不开心总是被利用,0.337839,0.662161,0.249246,0
2018,好人有好报的,0.790427,0.209573,0.534283,2
2018,聂远演得真好,皇上好威严霸气,0.926227,0.0737727,0.836061,2
2018,皇上璎珞有主角光环您杀了他您也得去领盒饭呀皇上,0.522533,0.477467,0.549333,1
2017,璎珞皇后才是爱，皇上只是个意外,0.877735,0.122265,0.7283,2
2018,桌上的印章真的多,0.535753,0.464247,0.284939,1
2018,秦岚声音好好听人也美,0.709054,0.290946,0.353454,2
2018,好喜欢皇后凉凉温柔的声音,0.826958,0.173042,0.615463,2
2019,秦岚真的是把富察皇后演活了,0.520596,0.479404,0.588083,1
2019,璎珞是没想利用皇后，但结果每次都是利用了呀，哎,0.160294,0.839706,0.643792,0
2019,跟亲姐姐一样的皇后。,0.617192,0.382808,0.149315,2
2019,娘娘人真好,0.807706,0.192294,0.572681,2
2019,桌上的印章真的多,0.535753,0.464247,0.284939,1
2019,我怎么绿了,0.271723,0.728277,0.396172,0
2020,皇后对她太好了，她才会用一生来完成皇后对她的嘱托,0.931152,0.0688476,0.847005,2
2020,有人保护媳妇儿，我好开心,0.782763,0.217237,0.517251,2
2020,主角光环太强，开始到现在都没有受过什么罪,0.242787,0.757213,0.460474,0
2020,可以不要让皇后那么早死嘛，一直活着,0.652478,0.347522,0.227729,2
2020,一个普通宫女实在是太厉害了,0.10371,0.89629,0.769533,0
2020,皇后娘娘呀，您可真善良。,0.482603,0.517397,0.652057,1
2021,编剧好厉害，这样皇上都不杀她全家,0.51509,0.48491,0.698198,1
2021,我容易吗，这么护着你就是想让你嫁给傅恒,0.304041,0.695959,0.324354,0
2021,多好的皇后啊,0.630961,0.36904,0.179912,2
2021,朕的皇后好善良,0.742717,0.257283,0.42826,2
2021,皇后对她太好了，她才会用一生来完成皇后对她的嘱托,0.931152,0.0688476,0.847005,2
2021,好美好美的感情哦,0.927987,0.0720135,0.83997,2
2022,现在皇后有多护着她、以后她就多恨害皇后的人、,0.512756,0.487244,0.744872,1
2022,每一个商标的吐槽都是认真的嘛,0.573096,0.426904,0.0513248,2
2022,别说那个年代了好吗，大家都没去过好吗,0.306204,0.693796,0.319548,0
2022,皇后娘娘也太好了吧,0.841288,0.158712,0.647306,2
2022,多好的皇后啊,0.630961,0.36904,0.179912,2
2023,好了是爱情了你两结婚吧皇后璎珞,0.724795,0.275205,0.388433,2
2023,这个皇后真的是全天下最好的皇后。,0.808016,0.191984,0.573369,2
2023,我媳妇眼睛好大，就是瘦了点,0.654156,0.345844,0.231458,2
2022,好美好美的感情哦,0.927987,0.0720135,0.83997,2
2023,帽子带好了昂，别摔下来,0.533332,0.466668,0.333356,1
2023,皇后娘娘好美！昀昀你看到了嘛,0.551838,0.448162,0.00408544,2
2024,只因为这是臣妾亲弟弟要拼命保护的人,0.413529,0.586471,0.0810478,0
2023,现在皇后有多护着她、以后她就多恨害皇后的人、,0.512756,0.487244,0.744872,1
2024,皇后当璎珞的姐姐算了，好暖,0.760706,0.239294,0.468236,2
2024,为皇后报仇的那几集才是最精彩的,0.82133,0.17867,0.602956,2
2024,这下好了，可以名正言顺的放了朕的令妃了,0.813841,0.186159,0.586313,2
2024,主角光环大得让人无语,0.144387,0.855613,0.67914,0
2024,皇后真的太好了嘤嘤嘤,0.827414,0.172586,0.616475,2
2025,高举令后大旗，令后大旗永不倒！,0.361317,0.638683,0.197073,0
2025,好暖啊，皇后也太好了,0.952111,0.047889,0.89358,2
2025,这下好了，可以名正言顺的放了朕的令妃了,0.813841,0.186159,0.586313,2
2025,皇后当璎珞的姐姐算了，好暖,0.760706,0.239294,0.468236,2
2025,多好的皇后可惜红颜薄命,0.672992,0.327008,0.273315,2
2026,呜呜呜呜呜呜皇后娘娘好温柔善良啊哭哭,0.647498,0.352502,0.216662,2
2026,遇见好主子了,0.678528,0.321472,0.285617,2
2026,纯元皇后是雍正的媳妇好吧,0.725619,0.274381,0.390263,2
2026,高举令后大旗，令后大旗永不倒！,0.361317,0.638683,0.197073,0
2026,我姐姐太好了吧,0.817374,0.182625,0.594165,2
2026,璎珞和皇后大旗举起来,0.597828,0.402172,0.106284,2
2027,皇后真的待她像亲姐姐一样好,0.644112,0.355888,0.209138,2
2027,好感动啊皇后真好温柔善良正直,0.881704,0.118296,0.73712,2
2027,皇后太善良正直了真感人,0.236887,0.763113,0.473584,0
2027,遇见好主子了,0.678528,0.321472,0.285617,2
2027,来晚了来晚了,0.803383,0.196617,0.563074,2
2027,呜呜呜呜呜呜皇后娘娘好温柔善良啊哭哭,0.647498,0.352502,0.216662,2
2028,皇后比她弟弟有种多了好吗，外表柔弱内心强大,0.868895,0.131105,0.708656,2
2025,主角光环大得让人无语,0.144387,0.855613,0.67914,0
2028,我好善良啊,0.69548,0.30452,0.323288,2
2028,来晚了来晚了,0.803383,0.196617,0.563074,2
2028,嘤嘤嘤，皇后这句话好感人，令后大旗扛起来,0.536954,0.463046,0.260911,1
2028,我不管！我不管！我就是高可爱！,0.720901,0.279099,0.37978,2
2028,皇后说的这么直接对璎珞算绝好了吧,0.705559,0.294441,0.345687,2
2029,被意图不轨还如此冷静的叙述事情经过，反而有问题,0.0532764,0.946724,0.881608,0
2029,皇后一句用性命担保把我都看哭了，她太好了,0.698848,0.301152,0.330774,2
2029,脑壳疼脑壳疼脑壳疼,0.502532,0.497468,0.949352,1
2029,皇后比她弟弟有种多了好吗，外表柔弱内心强大,0.868895,0.131105,0.708656,2
2029,好了好了，你们俩才是一对,0.824345,0.175655,0.609657,2
2029,皇后娘娘身上背负太多，只有璎珞懂她,0.386455,0.613546,0.141212,0
2030,哇，皇后娘娘好暖心，感动死了，皇后最美丽,0.97157,0.0284299,0.936822,2
2030,皇后好温柔,0.800786,0.199214,0.557303,2
2030,每次看到皇后那么善良想到她不得善终就觉得好心疼,0.825388,0.174612,0.611973,2
2030,朕的后宫套路太深,0.419004,0.580996,0.0688803,0
2030,好感动啊，要是每个人都像皇后这样该多好,0.612822,0.387178,0.139604,2
2030,被意图不轨还如此冷静的叙述事情经过，反而有问题,0.0532764,0.946724,0.881608,0
2031,想到那个时候的知画多清纯，现在的皇后多温柔,0.71936,0.28064,0.376355,2
2031,朕就是个大猪蹄子,0.609868,0.390132,0.133041,2
2031,主角光环太重，一个小小宫女扮演的这么厉害,0.185208,0.814792,0.588426,0
2031,皇后都护着我，我就是这么强大,0.697109,0.302891,0.32691,2
2031,哇，皇后娘娘好暖心，感动死了，皇后最美丽,0.97157,0.0284299,0.936822,2
2032,皇后太好了演的秦岚演的皇后太好了就是演知画的时候不,0.895794,0.104206,0.768431,2
2032,魏璎珞和皇后一比，我还是喜欢皇后端庄优雅高贵大气,0.957849,0.0421513,0.90633,2
2032,璎珞只想报仇也不想想会不会拖累皇后净惹事不想想后果,0.401033,0.598967,0.108815,0
2031,桌子上摆了那么多印章，不愧是爱新觉罗·牛皮癣,0.782756,0.217244,0.517236,2
2032,这个奴才多事儿已经不是一天两天了,0.228448,0.771552,0.492337,0
2032,朕就是个大猪蹄子,0.609868,0.390132,0.133041,2
2032,在现代她就是傻子，监控这么多屁话还多,0.583142,0.416858,0.0736494,2
2033,朕的脑阔好疼,0.725539,0.274461,0.390088,2
2033,璎珞可别作妖了吧，皇后对你这么好,0.600427,0.399573,0.11206,2
2033,抓不到我吧！哈哈哈哈，没有办法我就是这么强大,0.670655,0.329344,0.268123,2
2033,排好队发绿帽,0.677101,0.322899,0.282447,2
2034,要想生活过得去，就得头上带点绿,0.430126,0.569874,0.0441636,0
2034,看到皇后用性命担保，感动得哭了…皇后真的是太好了,0.939544,0.0604559,0.865654,2
2034,忽然觉得朕变成了多余的那个,0.377683,0.622317,0.160705,0
2033,中国好皇后,0.744222,0.255778,0.431605,2
2034,皇后娘娘心善良,0.544395,0.455605,0.112109,1
2034,主角话不多，难道配角话多吗,0.319248,0.680752,0.29056,0
2033,又美又善良的皇后啊,0.815076,0.184924,0.589059,2
2034,又美又善良的皇后啊,0.815076,0.184924,0.589059,2
2035,你们看我多好哇！我都感动了。,0.814532,0.185468,0.587848,2
2035,主角光环太强大，不讨喜,0.285519,0.714481,0.365514,0
2035,本宫就是这么任性,0.488048,0.511952,0.760954,1
2035,怎么会有这么好的皇后呢,0.568815,0.431185,0.0418119,2
2035,自从你入了宫朕就没消停过！什么事都有你,0.472388,0.527612,0.447762,1
2035,一天也不让皇上省心啊,0.545028,0.454972,0.0994468,1
2036,这么坚定的话可以说得那么温柔,0.529286,0.470714,0.414272,1
2036,魏璎珞这女人心机真的太重了主角光环太重了,0.137047,0.862953,0.695452,0
2036,皇后好温柔,0.800786,0.199214,0.557303,2
2036,令后大旗摇起来,0.528908,0.471092,0.421832,1
1983,主角光环太强来人给盒饭,0.431246,0.568754,0.0416749,0
2036,皇后长得有点像太妃,0.406041,0.593959,0.0976862,0
2036,本宫就是这么任性,0.488048,0.511952,0.760954,1
2037,明明那么温柔，说得话感觉那么强硬，这是最厉害的,0.185095,0.814905,0.588678,0
2037,喜欢皇后，温柔善良大方美丽,0.966729,0.0332707,0.926065,2
2037,皇后，你为什么对我这么好啊！,0.708156,0.291844,0.351457,2
2037,令后大旗摇起来,0.528908,0.471092,0.421832,1
2038,主角光环太大，臣妾不得不帮啊皇上,0.457007,0.542993,0.140145,1
2038,皇后姐弟俩太好了她只想报仇,0.816028,0.183972,0.591172,2
2038,我大清是真闲啊,0.399489,0.600511,0.112247,0
2038,乾隆为什么是大猪蹄子,0.448155,0.551845,0.00409921,0
2037,看了这么多集，印象最深还是大嘴跟主角光环,0.592874,0.407126,0.0952749,2
2038,说着温柔话,0.728709,0.271291,0.397131,2
2038,喜欢皇后，温柔善良大方美丽,0.966729,0.0332707,0.926065,2
2037,魏璎珞这女人心机真的太重了主角光环太重了,0.137047,0.862953,0.695452,0
2039,好温柔又好有能量的感觉,0.912493,0.0875069,0.80554,2
2039,演技不错啊可以领盒饭了,0.867062,0.132938,0.704583,2
2039,皇后就像亲姐姐一样好,0.687932,0.312068,0.306515,2
2039,太温柔善良了朕的皇后!,0.303084,0.696916,0.326479,0
2039,皇后娘娘好温柔,0.774351,0.225649,0.498557,2
2039,我和璎珞才是真爱，皇上只是个意外！！！哈哈哈,0.871916,0.128084,0.715368,2
2040,皇后娘娘好美好喜欢,0.933767,0.0662334,0.852815,2
2040,璎珞别怕有本宫在我看谁敢伤害你,0.371374,0.628626,0.174723,0
2040,璎珞呀你可省省心吧,0.685139,0.314861,0.300308,2
2040,皇后娘娘真好,0.799455,0.200545,0.554345,2
2041,小说精彩多了,0.660305,0.339695,0.245122,2
2040,太温柔善良了朕的皇后!,0.303084,0.696916,0.326479,0
2040,皇后就像亲姐姐一样好,0.687932,0.312068,0.306515,2
2041,扛起令后大旗,0.502881,0.497119,0.942384,1
2041,皇后好温柔,0.800786,0.199214,0.557303,2
2041,我好温柔呀,0.778009,0.221991,0.506687,2
2041,人情冷暖，什么时候身边也要有这样的人就好了,0.555833,0.444167,0.012962,2
2041,保护好我媳妇,0.578783,0.421217,0.0639624,2
2042,令后大旗我来扛！令后最甜,0.624247,0.375753,0.164993,2
2042,本宫眉毛没画好,0.62553,0.37447,0.167844,2
2042,皇后好温柔阿,0.793053,0.206947,0.540118,2
2042,皇上，就成全我们吧。,0.52675,0.47325,0.464998,1
2042,扛起令后大旗,0.502881,0.497119,0.942384,1
2043,皇后又美又善良,0.784549,0.215451,0.521219,2
2043,看的想哭，皇后娘娘人太好了,0.690925,0.309075,0.313166,2
2042,皇后娘娘怎么这么好,0.505494,0.494506,0.890128,1
2043,哇啊，天啦，皇后真的好善良,0.859557,0.140443,0.687904,2
2043,令后大旗摇起来,0.528908,0.471092,0.421832,1
2043,本宫眉毛没画好,0.62553,0.37447,0.167844,2
2043,令后大旗不倒,0.455476,0.544524,0.109524,1
2044,报复心真强，主角光环闪得睁不开眼,0.331539,0.668461,0.263247,0
2044,大猪蹄子我劝你善良,0.405996,0.594004,0.0977873,0
2044,皇后人太好了，不愧是母仪天下,0.92058,0.0794199,0.823511,2
2044,当然知道璎珞骗人不可饶恕的事情实是代璎宁讨公道了,0.121708,0.878292,0.729537,0
2044,令后大旗摇起来,0.528908,0.471092,0.421832,1
2045,太完美太让人想哭了看的,0.352725,0.647275,0.216167,0
2045,现在有多甜以后就有多虐,0.646155,0.353845,0.213678,2
2045,所以后面令妃没有当皇后，是因为念着皇后的好不愿意做,0.388448,0.611552,0.136781,0
2045,容音小天使是全宇宙最好的皇后,0.704504,0.295496,0.343342,2
2045,璎珞你可长点心吧,0.388888,0.611112,0.135805,0
2044,大猪蹄子什么梗,0.539179,0.460821,0.216423,1
2045,当然知道璎珞骗人不可饶恕的事情实是代璎宁讨公道了,0.121708,0.878292,0.729537,0
2046,皇后好善良,0.731396,0.268604,0.403103,2
2046,皇后是除了姐姐外对璎珞影响最大的人了,0.523142,0.476858,0.537165,1
2046,我家娘娘对我太好了呜呜呜,0.828683,0.171317,0.619296,2
2046,行了行了，你们才是真爱,0.533633,0.466368,0.32735,1
2046,现在有多甜以后就有多虐,0.646155,0.353845,0.213678,2
2047,此时的皇后让以后的令妃保留了一丝仁慈之心,0.790967,0.209033,0.535482,2
2047,求求皇上成全皇后和璎珞在一起吧，让她们幸福！！！,0.771119,0.228881,0.491374,2
2047,令后大旗摇起来,0.528908,0.471092,0.421832,1
2047,皇后对我这么好,0.69957,0.300431,0.332377,2
2047,皇后是除了姐姐外对璎珞影响最大的人了,0.523142,0.476858,0.537165,1
2048,令后大旗我来抗太甜了嘤嘤嘤,0.540823,0.459177,0.183532,1
2047,皇后太好了，聪明心善,0.883455,0.116545,0.741012,2
2048,你们女人都是大猪蹄子，媳妇你都不想想我,0.212046,0.787954,0.528787,0
2048,帝后的对手戏看的太爽了！实力派眼神里全是戏！厉害！,0.574911,0.425089,0.0553578,2
2048,哇皇后也太好了吧,0.895452,0.104548,0.76767,2
2048,此时的皇后让以后的令妃保留了一丝仁慈之心,0.790967,0.209033,0.535482,2
2048,皇后好勇敢,0.719575,0.280425,0.376832,2
2049,这世间怎会有如此善良一人,0.398375,0.601625,0.114721,0
2049,皇后聪慧和善良集于一身,0.672817,0.327183,0.272927,2
2049,，这婢女也绿我脑壳疼,0.528335,0.471665,0.433297,1
2049,乾隆：皇后你和谁都是真爱。我就是个意外。我走我走。,0.583241,0.416759,0.073869,2
2049,哇皇后也太好了吧,0.895452,0.104548,0.76767,2
2050,皇后和璎珞才是真爱，皇上是意外,0.77226,0.22774,0.49391,2
2050,突然觉得皇后把璎珞当孩子一样宠，护得好严实,0.479768,0.520232,0.595359,1
2049,皇后这样就不算包庇？而且不会回原处查看那个香吗,0.189754,0.810246,0.578324,0
2050,爱是一道光绿到你发慌,0.745364,0.254636,0.434143,2
2050,我就是要护她一世周全,0.640195,0.359805,0.200434,2
2050,皇后聪慧和善良集于一身,0.672817,0.327183,0.272927,2
2050,这世间怎会有如此善良一人,0.398375,0.601625,0.114721,0
2051,我为了我弟我容易吗。还不是想让我弟赶紧娶媳妇。,0.302215,0.697785,0.328411,0
2051,什么光环多去看看历史,0.59479,0.40521,0.0995338,2
2051,媳妇儿你看你大姑子对你多好,0.55005,0.44995,0.0001106,2
2051,行了行了朕为你和璎珞赐婚可以了吧,0.70004,0.29996,0.333421,2
2052,皇后太好了，温柔贤惠，璎珞真得要誓死追随的,0.888972,0.111028,0.753271,2
2051,皇后和璎珞才是真爱，皇上是意外,0.77226,0.22774,0.49391,2
2052,皇后你的眉毛没画好,0.594232,0.405768,0.0982931,2
2052,行了行了朕为你和璎珞赐婚可以了吧,0.70004,0.29996,0.333421,2
2052,好人不长命啊，皇后你怎么就嫌命长呢,0.591605,0.408395,0.0924562,2
2052,媳妇儿你看你大姑子对你多好,0.55005,0.44995,0.0001106,2
2052,哼嗯哼，大猪蹄子你没办法了吧,0.257899,0.742101,0.426892,0
2053,皇后太好了嘤嘤嘤感动哭唧唧,0.955961,0.0440393,0.902135,2
2053,大猪蹄子什么梗必须给我解释清楚🤨,0.567768,0.432232,0.0394834,2
2053,皇后真的好温柔,0.790562,0.209438,0.534582,2
2053,皇后太好了，太完美了，,0.889835,0.110164,0.75519,2
2053,秦岚好温柔啊,0.682581,0.317419,0.294625,2
2053,皇后太好了，温柔贤惠，璎珞真得要誓死追随的,0.888972,0.111028,0.753271,2
2054,没你说话的余地客气了。。没你说话的份,0.346925,0.653075,0.229056,0
2054,我只能保你半事周全了。,0.202071,0.797929,0.550954,0
2054,皇后啊好感动,0.670702,0.329298,0.268227,2
2054,呵呵我就是这么善良,0.606854,0.393146,0.126341,2
2055,这就是女人在为难男人，兄弟重要还是我重要,0.657624,0.342376,0.239165,2
2054,我姐姐就是好,0.793835,0.206165,0.541855,2
2054,这部剧的皇后太讨喜了，人设太好,0.451261,0.548739,0.0252271,1
2055,好喜欢皇后啊温柔善良,0.895828,0.104172,0.768507,2
2055,秦岚的眼睛好水灵,0.714344,0.285656,0.365209,2
2055,本宫想回去给他两边打打薄,0.313569,0.686431,0.30318,0
2056,皇后你说你是爱朕多点还是爱她多点,0.646519,0.353481,0.214487,2
2055,幸好有皇后护着我，令后大旗永不倒,0.391,0.609,0.131112,0
2055,我只能保你半事周全了。,0.202071,0.797929,0.550954,0
2056,好桑心你是不是不爱朕了,0.412581,0.587419,0.0831531,0
2056,魏璎珞这个角色让人心生厌烦太不真实了,0.288846,0.711154,0.358119,0
2056,幸好有皇后护着我，令后大旗永不倒,0.391,0.609,0.131112,0
2057,感动到哭，好一句臣妾必须毫发无伤把人带走,0.913221,0.0867795,0.807157,2
2056,皇后娘娘真好,0.799455,0.200545,0.554345,2
2057,要想生活过得去，头上必须带点绿,0.491613,0.508387,0.832268,1
2056,这就是女人在为难男人，兄弟重要还是我重要,0.657624,0.342376,0.239165,2
2057,看了那么多宫廷剧这个皇后真的好得一塌糊涂,0.417754,0.582246,0.0716579,0
2057,你要为了一个宫女伤了我们夫妻和气吗,0.280551,0.719449,0.376554,0
2057,皇后好温柔善良，我都快弯了,0.833894,0.166106,0.630876,2
2057,皇后你说你是爱朕多点还是爱她多点,0.646519,0.353481,0.214487,2
2058,这是看过所有宫戏里从未有过的好皇后，配得上母仪天下,0.640669,0.359331,0.201487,2
2058,要这些大猪蹄子干什么？皇后多好啊,0.470486,0.529514,0.40971,1
2058,护你一世周全皇后娘娘好善良,0.59211,0.40789,0.0935766,2
2046,脑阔疼脑阔疼听的朕的脑阔疼,0.692606,0.307394,0.316901,2
2058,主角光环不是一般的强大,0.226928,0.773071,0.495714,0
2058,看了那么多宫廷剧这个皇后真的好得一塌糊涂,0.417754,0.582246,0.0716579,0
2058,感动到哭，好一句臣妾必须毫发无伤把人带走,0.913221,0.0867795,0.807157,2
2059,这蹄子，本宫都没化好妆就来求情了，后期得为本宫报仇,0.529988,0.470012,0.400242,1
2059,看来皇后也是一个胆子大的人不怕事的人,0.541862,0.458138,0.16275,1
2059,这么好的皇后，为什么不多活几年,0.56458,0.43542,0.0323996,2
2059,我好像多余了，你俩才是真爱,0.59757,0.40243,0.105711,2
2059,真的是头一回见到这么好的皇后。宫斗剧里面,0.552935,0.447065,0.00652221,2
2051,我就是要护她一世周全,0.640195,0.359805,0.200434,2
2059,如果这个皇后能活下去小燕子紫薇就不会这样了,0.0828198,0.91718,0.815956,0
2060,大晚上还让不让人睡觉了,0.403234,0.596766,0.103924,0
2060,皇后真的很温柔，人美心美,0.727683,0.272317,0.39485,2
2060,我全靠皇后活这么多集,0.530829,0.469171,0.383425,1
2060,哪裡來的這麼大面子？就算是對親妹妹也不過如此吧,0.146643,0.853357,0.674128,0
2060,这么好的皇后，为什么不多活几年,0.56458,0.43542,0.0323996,2
2060,我好像多余了，你俩才是真爱,0.59757,0.40243,0.105711,2
2061,所以我后来对皇后这么忠诚，是有原因滴,0.493604,0.506396,0.872071,1
2061,特别喜欢秦岚演的这个皇后，端庄优雅大方得体，,0.936884,0.063116,0.859742,2
2061,每次这个节点就好感动，秦岚演技真好,0.890529,0.109471,0.75673,2
2061,两个都是朕爱的女人，朕脑壳疼,0.668952,0.331048,0.264337,2
2061,皇后真的很温柔，人美心美,0.727683,0.272317,0.39485,2
2061,隔壁的皇后好坏的，这间的皇后好仁慈啊,0.589396,0.410604,0.0875476,2
2062,我不高兴了，皇后快哄我,0.458626,0.541374,0.172523,1
2062,皇后太好了，能得这样的人庇佑，死了也甘心,0.827862,0.172138,0.617472,2
2062,特别喜欢秦岚演的这个皇后，端庄优雅大方得体，,0.936884,0.063116,0.859742,2
2062,哈哈哈打不过我吧，没有办法我就是这么强大哼,0.591078,0.408922,0.0912841,2
2062,看我表现多好,0.609738,0.390262,0.13275,2
2062,呵呵我好善良啊,0.803821,0.196179,0.564048,2
2063,护你一世周全皇后好善良,0.625198,0.374802,0.167106,2
2063,皇后就是亲姐姐啊,0.728366,0.271634,0.396369,2
2063,不要大猪蹄子的袍子,0.421373,0.578627,0.0636158,0
2063,本来皇上想留她过夜的，皇后算准了,0.323474,0.676526,0.281168,0
2064,太扯了皇上的亲弟弟不知道璎珞哪来的勇气和筹码,0.154153,0.845847,0.657439,0
2064,皇上对皇后的情可见多深,0.761659,0.238341,0.470353,2
2063,朕最爱的皇后都开口了，准,0.951792,0.0482075,0.892872,2
2063,好感动好感动好想哭,0.659945,0.340055,0.244323,2
2064,呜呜娘娘美丽又温柔，好舍不得,0.921026,0.078974,0.824502,2
2064,皇后好善良啊,0.74924,0.25076,0.442755,2
2064,皇后就是亲姐姐啊,0.728366,0.271634,0.396369,2
2064,本来皇上想留她过夜的，皇后算准了,0.323474,0.676526,0.281168,0
2065,皇后娘娘好暖,0.759807,0.240193,0.466239,2
2065,爱是一道光，绿的你发慌,0.732568,0.267432,0.405708,2
2065,哈哈没有办法我就是这么强大,0.835519,0.164481,0.634487,2
2065,令后这门亲事我准了,0.388277,0.611723,0.137163,0
2065,皇后嘤嘤嘤怎么会有这么好的皇后,0.565845,0.434155,0.0352105,2
2065,呜呜娘娘美丽又温柔，好舍不得,0.921026,0.078974,0.824502,2
2066,皇后的仁慈庄孝，蕙质兰心，温婉善良可真不是装出来的,0.428256,0.571744,0.0483207,0
2066,后璎大旗高高挂起,0.424317,0.575683,0.0570741,0
2066,脑壳疼脑壳疼,0.506789,0.493211,0.864214,1
2066,朕要去绿草原看风景,0.5215,0.4785,0.570003,1
2066,主角光环不是一般大,0.0818685,0.918132,0.81807,0
2067,看这戏，不能较真，更不能推敲。娱乐娱乐蛮好了,0.324923,0.675078,0.27795,0
2067,为我美丽善良端庄贤淑大方得体的皇后娘娘疯狂打电话！,0.77154,0.22846,0.49231,2
2067,皇上好爱皇后难得啊,0.920817,0.0791833,0.824037,2
2067,皇后的仁慈庄孝，蕙质兰心，温婉善良可真不是装出来的,0.428256,0.571744,0.0483207,0
2067,现在皇后有多护着她，她以后就有多恨害皇后的人,0.526513,0.473487,0.469745,1
2068,皇后现在对璎珞有多好，她后期就有多恨害死她的人,0.516552,0.483448,0.668969,1
2067,朕要去绿草原看风景,0.5215,0.4785,0.570003,1
2068,本宫就是这样善良可爱,0.644631,0.355369,0.210291,2
2068,这就是天美贵族八和没有贵族的王者之间的对战,0.676774,0.323226,0.28172,2
2068,大爱富察姐弟一个比一个暖都是小天使,0.958683,0.0413173,0.908184,2
2068,哼还是我面子大,0.331914,0.668086,0.262414,0
2068,皇上好爱皇后难得啊,0.920817,0.0791833,0.824037,2
2069,对小燕子和紫薇怎么没这么好脾气,0.308159,0.691841,0.315202,0
2069,没错我就是大猪蹄子,0.628895,0.371105,0.175322,2
2069,要不是有皇后，估计没得活了,0.346443,0.653556,0.230125,0
2066,现在皇后有多护着她，她以后就有多恨害皇后的人,0.526513,0.473487,0.469745,1
2069,主角光环就是厉害,0.453306,0.546694,0.066117,1
2069,哼还是我面子大,0.331914,0.668086,0.262414,0
