1975,阿你个大猪蹄子，伤了这么多女人,0.429972,0.570028,0.0445076,0
1975,哭了，哭了，高可爱别走,0.691342,0.308657,0.314094,2
1976,别说她单纯了，单纯的人还能推孕妇？,0.401909,0.598091,0.106868,0
1975,满满都是大猪蹄,0.688527,0.311473,0.307837,2
1976,看哭了，其实高贵妃深爱着皇上也最是单纯,0.626942,0.373058,0.170983,2
1976,唉，高高也是个可怜人,0.0966483,0.903352,0.785226,0
1976,某贵妃要领盒饭了，好开心,0.583987,0.416013,0.075527,2
1976,大猪蹄本宫还没醒呢别被迷惑了,0.341628,0.658372,0.240826,0
1976,哭了，哭了，高可爱别走,0.691342,0.308657,0.314094,2
1977,看得我背好疼,0.644628,0.355372,0.210285,2
1977,其实高贵妃都是被那些心机重的女人给利用的,0.413937,0.586063,0.0801406,0
1977,害皇后是要付出代价的,0.443205,0.556795,0.0151004,0
1977,看哭了，其实高贵妃深爱着皇上也最是单纯,0.626942,0.373058,0.170983,2
1977,害皇后没好下场，皇后那么善良,0.324393,0.675607,0.279127,0
1977,唉，高高也是个可怜人,0.0966483,0.903352,0.785226,0
1978,皇上不能宠爱她，不能让她的家族势力太大,0.0797003,0.9203,0.822888,0
1978,你的盒饭备好了，赶紧去叭,0.412829,0.587171,0.0826013,0
1978,导演：高贵妃啊快来领盒饭了,0.612786,0.387214,0.139525,2
1978,馨儿是美的,0.798464,0.201536,0.552142,2
1978,高贵妃才是真正全力斗宫之人呐把一生都献给了皇上,0.682105,0.317895,0.293567,2
1979,本宫对自己的唇妆甚是满意,0.688165,0.311835,0.307032,2
1978,就要吃盒饭了，有点开心,0.459482,0.540518,0.189649,1
1979,典型的，女人不要太聪明,0.259332,0.740668,0.423707,0
1979,看了那么久，第一次眼眶湿润,0.495324,0.504676,0.906482,1
1979,你喜欢绿色我绿过你,0.727532,0.272468,0.394515,2
1979,大猪蹄子被套路了,0.462282,0.537718,0.245638,1
1979,馨儿是美的,0.798464,0.201536,0.552142,2
1980,高可爱试我误会你了,0.804464,0.195536,0.565476,2
1980,大猪蹄子你该当何罪,0.590663,0.409336,0.0903633,2
1980,其实高贵妃活的才最真实,0.582794,0.417206,0.072875,2
1980,宫里过得久的，都是明白人,0.485537,0.514463,0.710742,1
1980,典型的，女人不要太聪明,0.259332,0.740668,0.423707,0
1981,除我白月光皇后以外算不算最单纯的人不接受批评,0.360809,0.639191,0.198201,0
1980,这么久还没领盒饭,0.276732,0.723268,0.385041,0
1981,看了这么久，居然被高贵妃对皇家的痴情给感动哭了😭,0.732536,0.267464,0.405635,2
1981,你要心地善良，皇上能不喜欢你吗,0.135981,0.864019,0.69782,0
1981,好疼呀呜呜呜,0.70468,0.29532,0.343734,2
1981,高贵妃跳舞那刻真心美，突然不想高贵妃领盒饭了😂,0.459577,0.540423,0.191534,1
1981,感觉好幸福啊！！,0.634947,0.365053,0.188772,2
1982,大猪蹄子活得真幸福，这些女人居然都真爱他,0.778735,0.221265,0.5083,2
1982,也没觉得多聪明啊使计最后都是自己背锅,0.553855,0.446145,0.00856691,2
1982,此时的高女士好美,0.666692,0.333308,0.259316,2
1982,能不能不走啊高可爱,0.650266,0.349734,0.222813,2
1982,高贵妃牙齿好整齐好白啊,0.898598,0.101402,0.774663,2
1982,你那么可爱朕是爱的你，要封你慧贤连富察皇后都羡慕,0.750412,0.249588,0.44536,2
1983,这里要加上满脸的汗就更入戏了，看着就让人疼,0.344059,0.655941,0.235424,0
1983,台词怎么那么多呢，本宫都饿了,0.434002,0.565998,0.0355501,0
1983,原来高贵妃才是最大的戏精,0.59402,0.40598,0.0978212,2
1983,大猪蹄子弘小四！,0.638005,0.361995,0.195566,2
1983,哭得最多的一次到现在,0.551291,0.448709,0.00286804,2
1983,此时的高女士好美,0.666692,0.333308,0.259316,2
1984,一入皇宫深似海！不容易啊,0.651896,0.348104,0.226435,2
1984,皇上高贵妃我劝你们两个善良饭盒热好了，皇上挨搞定了,0.25138,0.74862,0.441378,0
1984,皇上这两集又是淑慎，又是宁馨，大猪蹄子,0.394524,0.605476,0.123279,0
1984,大猪蹄子阿莫西林都舍不得给我买,0.813659,0.186341,0.585909,2
1984,高女士现在太美了吧，就这么领盒饭了吧以后谁来背锅,0.313264,0.686736,0.303858,0
1985,最单纯的先挂了哎后面都是高段位,0.221767,0.778234,0.507186,0
1985,最单纯最真实的女子,0.545741,0.454259,0.0851881,1
1984,谁还不是个戏精宝宝呢,0.29769,0.70231,0.338467,0
1985,闲妃才是真正的厉害呀，一出场杀无赦了,0.460881,0.539119,0.217625,1
1985,本宮活了三十集足已,0.740079,0.259921,0.422398,2
1985,为什么恨不起来高天真反而有点泪奔,0.276735,0.723265,0.385034,0
1985,30多集没吃饭了，本宫要去吃饭了,0.389727,0.610273,0.133939,0
1986,以为是倔强青铜，结果还是最强王者，厉害了,0.163889,0.836111,0.635802,0
1986,本宫已经活了30多集了，是时候该走了,0.651979,0.348021,0.226621,2
1986,我看到这里居然看哭了，看她跳最后一支舞居然这么伤感,0.17261,0.82739,0.616422,0
1986,本宫就要领盒饭了，热好了没,0.388827,0.611174,0.135941,0
1986,最单纯最真实的女子,0.545741,0.454259,0.0851881,1
1986,她是真爱皇上。至少在爱情里她是善良的,0.650249,0.349751,0.222776,2
1987,大猪蹄子，大猪蹄子，大猪蹄子,0.730325,0.269675,0.400722,2
1987,朕是四处留情的大猪蹄子,0.597455,0.402545,0.105457,2
1987,娘娘好白的牙,0.689446,0.310554,0.309881,2
1987,好了，好了，放开大猪蹄子，人家要吃盒饭了,0.860199,0.139801,0.68933,2
1987,领盒饭才有新衣服穿不容易啊,0.550762,0.449238,0.00169396,2
1988,可以对那么多女人说，皇上是滥情还是博爱啊,0.641482,0.358518,0.203294,2
1987,一直以为高贵妃是个青铜没想到竟然是个王者,0.452691,0.547309,0.0538182,1
1988,大猪蹄子清宫最红的姑娘,0.74939,0.25061,0.443089,2
1988,妹妹，盒饭热好了，快去吃吧,0.621334,0.378666,0.158521,2
1988,皇上怎么那么三心二意那么多女人真的是雨露均沾啊,0.338466,0.661534,0.247853,0
1988,朕是四处留情的大猪蹄子,0.597455,0.402545,0.105457,2
1989,皇后只是不单纯但是人是善良的，没害过人，高害人害己,0.338634,0.661366,0.24748,0
1989,行吧我承认自己是个大猪蹄子,0.412137,0.587863,0.0841408,0
1989,大猪蹄子大猪蹄子大猪蹄子,0.730325,0.269675,0.400722,2
1989,你个大猪蹄子，一定要记得替我报仇哦,0.85977,0.14023,0.688377,2
1989,导演盒饭给我们好可爱加个鸡腿,0.644845,0.355155,0.210766,2
1990,盒饭热好了,0.585823,0.414177,0.0796058,2
1990,真的是个不可多求的好演员,0.356973,0.643027,0.206727,0
1988,皇上要跟这么多女人谈情说爱，也是怪不容易的,0.525241,0.474759,0.495188,1
1990,为了拍这部戏头发几个月没洗了头上的油都能炒菜,0.245945,0.754055,0.453455,0
1990,大猪蹄子真是大猪蹄子。,0.601429,0.398571,0.114286,2
1990,皇上的宽容心真大对弘昼对高贵妃,0.595371,0.404628,0.100825,2
1990,哼你个大猪蹄子,0.364986,0.635014,0.188919,0
1991,说她单纯，是因为她说啥做啥，不做作，又不是心地好,0.105951,0.894049,0.764553,0
1991,到目前为止哭的最厉害的一回,0.603733,0.396267,0.119407,2
1989,大猪蹄子！老娘还怀着你的孩子昏迷不醒呢！,0.635172,0.364828,0.18927,2
1991,本宫的盒饭热好了吗,0.400425,0.599575,0.110166,0
1991,领盒饭吧行了行了,0.299832,0.700168,0.333706,0
1991,卫英络心机好重,0.575767,0.424233,0.0572595,2
1992,好了好了别说了快吃饭去吧求你了,0.751964,0.248036,0.448808,2
1991,本宫就是说话慢，不然早领盒饭了,0.206324,0.793676,0.541503,0
1992,本宫没有这么好的演技就不会来演好贵妃了！,0.267823,0.732177,0.404837,0
1992,好可爱的一群女人。男人都是大猪蹄子,0.724151,0.275849,0.387002,2
1992,快点，本宫盒饭咋还没好，本宫马上就要领盒饭了。,0.11577,0.88423,0.742733,0
1992,最重要的是保住父亲和高家吧。。。,0.619787,0.380213,0.155081,2
1992,要领饭盒了，才给一身看着舒服一点儿的衣服😔,0.726981,0.273019,0.393291,2
1993,觉着乾隆是个大猪蹄子,0.598063,0.401937,0.106806,2
1993,高可爱完美谢幕,0.776682,0.223318,0.503739,2
1993,仇人要走了，本宫好高兴,0.470829,0.529171,0.416573,1
1993,能在后宫待久的没有一个蠢人,0.461661,0.538339,0.233216,1
1994,三十二集了朋友们别再问这个唇妆好吗到现在还弄不清啊,0.340432,0.659568,0.243485,0
1994,人长得不错就是被化妆师坑啦,0.642578,0.357422,0.205728,2
1993,好可爱的一群女人。男人都是大猪蹄子,0.724151,0.275849,0.387002,2
1994,家世如此注定没有办法得到真爱皇上爱他是有顾忌的,0.642735,0.357265,0.206078,2
1994,干嘛一直说盒饭的，人家要杀青了不能吃点好的吗？,0.168867,0.831133,0.624741,0
1993,高贵妇演得好,0.709524,0.290476,0.354498,2
1994,一入宫门深似海啊,0.59545,0.40455,0.101,2
1994,盒饭准备好了没？我马上就来领了,0.244458,0.755542,0.456759,0
1995,令人有点感动高贵人是真爱啊还一直称皇上您,0.890982,0.109018,0.757737,2
1995,这段看哭贵妃演技赞让人恨的彻底也爱的真挚,0.874748,0.125252,0.721662,2
1995,大哥你这么抱我我背疼,0.383814,0.616186,0.147079,0
1995,头发上的发夹好眼熟,0.712019,0.287981,0.360042,2
1995,我都要走了，大家就别计较那么多了哈,0.514407,0.485593,0.711856,1
1996,如果高贵妃不进宫该多好,0.246347,0.753653,0.452562,0
1996,历史上贵妃病重的时候封了皇贵妃，然后就死了,0.542679,0.457321,0.146424,1
1996,其实我聪明,0.553005,0.446995,0.00667837,2
1996,大猪蹄子什么意思啊各位大神们能解释一下吗,0.226788,0.773212,0.496028,0
1996,这个时候该直接叫馨儿呀皇上！,0.435359,0.564641,0.0325345,0
1996,为什么反派对皇上都是真爱？,0.457619,0.542381,0.152388,1
1997,劳资斗这么久从来没有赢过，算了让你们斗。,0.347416,0.652584,0.227965,0
1997,贵妃实际很美，也很好。就是太爱皇上,0.945558,0.0544418,0.879018,2
1997,牙齿戏份太足了，谭卓如果鼻子再回回炉就好了,0.781728,0.218272,0.514951,2
1997,行了行了，盒饭里面给你加个鸡腿行没？？？？,0.310908,0.689092,0.309093,0
1997,高贵妃皮肤棒棒哒,0.721172,0.278828,0.380382,2
1998,本宫要领盒饭了，以后绿袍子全是皇上的,0.457121,0.542879,0.142425,1
1997,这个时候该直接叫馨儿呀皇上！,0.435359,0.564641,0.0325345,0
1998,高贵妃你的盒饭已经热好了嘞，快去吃吧,0.516719,0.483281,0.665614,1
1998,死得好唯美,0.568745,0.431255,0.0416562,2
1998,高活不成了,0.32144,0.67856,0.285689,0
1998,这才是深爱一个人的模样，不论她做了什么，爱没有错,0.40096,0.59904,0.108977,0
1999,高说到她母亲每一次很感人,0.555753,0.444247,0.0127855,2
1998,高贵妃也不容易啊,0.761419,0.238581,0.469819,2
1999,好了。再加个大猪蹄子,0.626941,0.373059,0.170979,2
1999,大猪蹄子，本宫还没醒呢,0.585333,0.414667,0.0785169,2
1999,突然心疼是怎么肥事,0.284655,0.715345,0.367433,0
1999,看了三十几成功地哭了,0.565441,0.434559,0.0343136,2
2000,你们没有做过皇上就不要说皇上是大猪蹄子,0.188109,0.811891,0.58198,0
2000,绿到最后自然红啊,0.696469,0.303531,0.325486,2
2000,疼得声音都颤了，作为烧伤科的人，声音绝对给满分,0.694688,0.305312,0.321529,2
2000,贵妃的牙好白,0.739728,0.260272,0.421618,2
2000,突然心疼是怎么肥事,0.284655,0.715345,0.367433,0
2000,买药的你是认真的嘛,0.594786,0.405214,0.099524,2
2001,本宫活了三十多集，够了，，领盒饭前让皇后她儿子一起,0.799826,0.200174,0.555169,2
2001,本宫要走了，你们后宫那些嫔妃现在称心如意了吧,0.383177,0.616823,0.148495,0
2001,罢了后宫妃子早死早超生,0.338407,0.661593,0.247984,0
2001,韩旭我劝你善良,0.254637,0.745363,0.43414,0
2001,突然有点舍不得贵妃领盒饭了,0.332264,0.667736,0.261636,0
2002,盒饭已热好。高贵妃您可以去吃了,0.51559,0.48441,0.68819,1
2001,大猪蹄子是什么意思？什么梗？,0.332734,0.667266,0.26059,0
2002,大猪蹄子你轻点啊，手别使那么大劲,0.653545,0.346455,0.230101,2
2002,心疼高贵妃三秒钟，隔着屏幕都觉得疼,0.632389,0.367611,0.183086,2
2002,来人呐本宫这都饿了20多集了这盒饭到底还让不让吃了,0.417399,0.582601,0.0724465,0
2002,皇后才是真爱，生病那次高贵妃躲的远远的,0.702783,0.297217,0.339517,2
2002,看一次哭一次贵妃是真坏人跟娴妃是不一样的,0.408587,0.591413,0.0920284,0
2003,那么多集第一次哭可爱的宁馨儿要走了,0.775661,0.224339,0.50147,2
2003,大猪蹄子们天天让我哭一天哭几时回,0.5597,0.4403,0.0215564,2
2003,早说出来有多好啊哎,0.402972,0.597028,0.104507,0
2003,你的盒饭热好了说完快去领了吧,0.418274,0.581726,0.0705032,0
2003,心疼高贵妃三秒钟，隔着屏幕都觉得疼,0.632389,0.367611,0.183086,2
2004,她真的演的好认真,0.766705,0.233295,0.481566,2
2003,被高可爱感动哭了,0.907902,0.0920985,0.795337,2
2004,一入皇门深似海,0.534098,0.465902,0.318031,1
2004,说贵妃可爱的忘了她做了些什么吗,0.544847,0.455153,0.103064,1
2004,大猪蹄子，趁我没醒到处浪,0.589594,0.410406,0.0879856,2
2004,我很喜欢她，死了都好可惜，为她哭了，虽然任性但可爱,0.970421,0.0295795,0.934268,2
2004,看这么多集既然看高贵妃流泪了,0.295802,0.704198,0.342661,0
2005,看哭了高贵妃不过只是痴情而已心思很单纯,0.364529,0.635471,0.189936,0
2005,大猪蹄子！,0.620561,0.379439,0.156801,2
2005,感觉小高一直变来变去的模样,0.539256,0.460744,0.214888,1
2005,再让我捏着嗓子说一会儿,0.517445,0.482555,0.651095,1
2006,退了那个烟熏眼妆，美多了,0.505609,0.494391,0.887825,1
2005,好了好了高贵妃吃大餐去了,0.869815,0.130185,0.710701,2
2006,说高贵妃嗓子的，别忘了高贵妃可是唱戏的,0.502819,0.497181,0.94362,1
2006,一直喜欢高贵妃，坚强的让人心疼,0.86714,0.13286,0.704755,2
2006,哭了哭了。鼻子好酸,0.494562,0.505438,0.891238,1
2005,高贵妃和导演是亲戚，这是艳压群芳吗，有点年纪大了,0.251107,0.748893,0.441984,0
2006,好了好了高贵妃吃大餐去了,0.869815,0.130185,0.710701,2
2007,这样说话感觉有好大的口气冒出来,0.392184,0.607816,0.128479,0
2006,大猪蹄子！,0.620561,0.379439,0.156801,2
2007,贵妃是个大明白啊,0.59761,0.40239,0.1058,2
2007,早点聊开多好啊,0.684333,0.315667,0.298517,2
2007,皇上再不搞高巫婆她准备死了，你们两个害人害己👋,0.224573,0.775427,0.500949,0
2007,本宫活得不容易,0.585851,0.414149,0.079668,2
2007,退了那个烟熏眼妆，美多了,0.505609,0.494391,0.887825,1
2008,心疼，最爱皇上的往往都是没好下场不爱的都是身居高位,0.929408,0.0705915,0.84313,2
2008,这个样子好美比平时美多了,0.86904,0.13096,0.708978,2
2008,别了，大猪蹄子,0.490761,0.509239,0.815229,1
2008,演技很好演员都没有大哭。。观众哭的稀里哗啦,0.863504,0.136496,0.696675,2
2008,这坏人我居然会有点想哭，果然演的好,0.671638,0.328362,0.270307,2
2008,皇上我好疼,0.703852,0.296148,0.341892,2
2009,马鸭！刚敷了面膜给我看哭了……演技太好了🌝,0.797517,0.202483,0.550038,2
2009,长的美都被化妆师耽误了,0.295535,0.704465,0.343256,0
2009,其实她想多了，他老爸对他还蛮好,0.806777,0.193223,0.570616,2
2009,她要是不在她那个家族，可能命运会好一点,0.201716,0.798284,0.551742,0
2009,让你任性一次,0.547301,0.452699,0.0539768,1
2009,别抱那么紧可疼死我了,0.24532,0.75468,0.454844,0
2010,看得透透儿的,0.494332,0.505668,0.886644,1
2010,哼大猪蹄子本宫要去领盒饭了,0.337193,0.662807,0.250682,0
2010,唉搞这么多，其实高贵妃也是为了能立足，但却害了自己,0.064517,0.935483,0.856629,0
2010,舍不得她死怎么回事。明明蛮可爱的反派角色,0.505611,0.494389,0.887781,1
2010,牙齿白的不正常,0.273019,0.726981,0.39329,0
2011,吃个盒饭怎么要等这么久,0.254394,0.745606,0.434679,0
2011,看了这么多集，高贵妃演的真好，倔强的高贵妃让人心疼,0.87523,0.12477,0.722733,2
2010,谁给朕解释一下什么是大猪蹄子,0.27051,0.72949,0.398866,0
2011,本宫要一直美下去,0.758723,0.241277,0.463828,2
2011,她那么聪明，次次害人，次次不成功，是不敢成功啊,0.540745,0.459255,0.185101,1
2011,感觉芝兰对贵妃的感情很深阿,0.79605,0.20395,0.546778,2
2011,她本来可以很好的,0.906202,0.0937977,0.791561,2
2012,说出了跟皇后一样的话。宫墙内无自由,0.601229,0.398771,0.113842,2
2012,大猪蹄子，还抱我背，疼死本宫了,0.563259,0.43674,0.0294655,2
2012,你个大猪蹄子，为何不来看看本宫，气人,0.155783,0.844217,0.653816,0
2012,第一次看哭竟然是因为高贵妃~不得不说演得真的好,0.495972,0.504028,0.919431,1
2012,她说的跟皇后一样，时间久了都不是真正的自己了,0.154369,0.845631,0.656959,0
2012,盒饭快好了？本宫马上就来！😂😂,0.723475,0.276525,0.3855,2
2013,贵妃皮肤好，不化浓妆，可以说是清新脱俗了,0.68447,0.31553,0.298823,2
2013,为高可爱泪流了,0.90264,0.0973596,0.783645,2
2013,本宫就是脸大脸长,0.464329,0.535671,0.286586,1
2013,皇上待遇可真好,抱那么多女人,0.762884,0.237116,0.473076,2
2013,说出了跟皇后一样的话。宫墙内无自由,0.601229,0.398771,0.113842,2
2014,皇上的爱情好丰富啊，满世界都是真爱都是情,0.912374,0.087626,0.805275,2
2013,其实高贵妃演的才让人触动感情，璎珞主角光环太重,0.41651,0.58349,0.0744216,0
2014,本宫说话全用气声，听不舒服就忍着！本宫就是这么装！,0.0784415,0.921558,0.825686,0
2014,贵妃的声音好飘渺,0.647282,0.352718,0.216182,2
2014,皇上把你的大猪蹄子拿开！疼！,0.505352,0.494648,0.892967,1
2014,看了快30集了第一次发现高贵妃原来这么美,0.742768,0.257232,0.428373,2
2015,好了，你洗白成功了赶紧去领盒饭吧,0.458292,0.541708,0.165842,1
2015,高贵妃盒饭热好了快来吃了吧，热乎着呢,0.830409,0.169591,0.62313,2
2015,你怎么能忘了我呢？我还没醒呢，大猪蹄子。,0.300486,0.699514,0.332253,0
2015,最爱皇上的其实是闲妃，她不救弟弟也是为皇上着想,0.957061,0.0429389,0.90458,2
2015,坚强的让人心疼，高高不要走,0.608143,0.391857,0.129208,2
2016,我还想多活两集混个领衔主演,0.585569,0.414431,0.0790413,2
2014,贵妃皮肤好，不化浓妆，可以说是清新脱俗了,0.68447,0.31553,0.298823,2
2016,好可爱的一群女人男人就是大猪蹄子,0.7507,0.2493,0.446001,2
2015,贵妃的声音好飘渺,0.647282,0.352718,0.216182,2
2016,这么久第一次哭，高贵妃是真心爱皇上，这么早领盒饭了,0.531375,0.468625,0.372504,1
2016,长得那么老非要叫的这么嫩,0.446062,0.553938,0.00875049,0
2016,贵妃演的绝了，这疼的说话声音都颤抖了,0.688487,0.311513,0.307748,2
2016,突然觉得贵妇美炸了,0.556377,0.443623,0.0141719,2
2017,一夫一妻制多好，皇上女人太多，争宠,0.459288,0.540712,0.185765,1
2017,都是妃子多了惹的祸,0.583372,0.416627,0.074161,2
2017,盒饭热好了吗,0.419118,0.580882,0.0686269,0
2017,怎么这部剧那么多地方都不符合逻辑,0.191067,0.808933,0.575407,0
2017,别说了赶紧走你死了我就活了,0.214355,0.785645,0.523656,0
2018,大猪蹄子是什么梗呢？一集没落依旧不明白,0.510764,0.489236,0.78472,1
2018,快去吧别说了，朕脑阔疼,0.646023,0.353977,0.213385,2
2018,皇上脑袋旁边的是青筋还是假发没有贴好啊,0.3634,0.6366,0.192444,0
2017,老匹夫要作妖把三妹四妹送进宫吗！,0.217017,0.782983,0.51774,0
2018,突然看了想哭好感动,0.412519,0.587481,0.0832901,0
2018,她做了这么多坏事活该死，别煽情一下就忘了皇后坠楼,0.547019,0.452981,0.0596285,1
2019,高大姐你是大天蝎嘛说话太直接白了,0.242152,0.757848,0.461885,0
2019,可爱又迷人的反派角色就是本宫了,0.933157,0.0668426,0.851461,2
2019,可你害人之心常有活着所有的意义就是害人,0.299165,0.700835,0.335189,0
2019,大猪蹄子害的本宫临走之前都要哭一场,0.669373,0.330627,0.265272,2
2019,可爱？把皇后推下去的时候你怎么不说可爱,0.751703,0.248297,0.448229,2
2019,突然看了想哭好感动,0.412519,0.587481,0.0832901,0
2018,好了，本宫要去补睫毛了,0.722401,0.277599,0.383113,2
2020,可爱又迷人的反派角色,0.912202,0.0877981,0.804893,2
2020,好心疼最单纯的就是高贵妃了还保护阿满哭了,0.707638,0.292362,0.350306,2
2020,朕头上好大条蚯蚓！,0.597749,0.402251,0.106108,2
2020,看了一半了头一次哭竟然是为了高可爱,0.387546,0.612454,0.138787,0
2020,大猪蹄子女人真多,0.606627,0.393373,0.125838,2
2020,可爱又迷人的反派角色就是本宫了,0.933157,0.0668426,0.851461,2
2021,高贵妃害了皇后害了那么多工匠，说她单纯是什么人啊！,0.258154,0.741846,0.426325,0
2021,我一个大男人竟然看高可爱看哭了,0.548022,0.451978,0.0395548,1
2021,看了一半了头一次哭竟然是为了高可爱,0.387546,0.612454,0.138787,0
2021,高贵妃是唯一一个死能让本宫落泪的反派角色,0.371928,0.628072,0.173493,0
2021,好心疼最单纯的就是高贵妃了还保护阿满哭了,0.707638,0.292362,0.350306,2
2022,皇上真的诠释了男人可以同时爱多个女人,0.666066,0.333934,0.257923,2
2021,朕头上好大条蚯蚓！,0.597749,0.402251,0.106108,2
2022,大猪蹄子，大猪蹄子，大猪蹄子。,0.730325,0.269675,0.400722,2
2022,大猪蹄子你背着我都干什么了,0.437451,0.562549,0.0278866,0
2022,高可爱要领盒饭了,0.713894,0.286106,0.36421,2
了,0.949293,0.0507065,0.887319,2
2022,将死才会醒悟、活着继续作,0.588285,0.411715,0.0850773,2
2023,哎呀妈跳饿了本宫的盒饭热好了吗,0.339609,0.660391,0.245314,0
2023,好了大猪蹄，本宫要去吃盒饭啦,0.827482,0.172518,0.616627,2
2023,甚至忘记是她推了你的皇后，到现在都没醒吗大猪蹄子,0.362502,0.637498,0.19444,0
2023,皇上真的诠释了男人可以同时爱多个女人,0.666066,0.333934,0.257923,2
2023,大猪蹄子你背着我都干什么了,0.437451,0.562549,0.0278866,0
2023,盒饭热好，我马上来,0.642017,0.357983,0.204482,2
2024,看这剧第一次哭居然是为了高贵妇演技太好了吧,0.568385,0.431615,0.0408559,2
2024,别抱这么紧老娘背疼,0.331806,0.668194,0.262654,0
2024,可别，养好病后又该祸祸别人了,0.345162,0.654838,0.232973,0
2024,大猪蹄子，你还记得大明湖畔的夏雨荷吗？,0.635378,0.364622,0.189729,2
2024,原来高贵妃一直这么聪明后宫之道她比谁都清楚,0.590102,0.409898,0.0891152,2
2024,盒饭怎么这么慢啊，找人催催啊,0.0592301,0.94077,0.868378,0
2025,看了这么久，为高贵妃看哭了，心疼高贵妃😔,0.547466,0.452534,0.0506782,1
2025,其实贵妃对皇上的爱是单纯执着的,0.772738,0.227263,0.494972,2
2025,大猪蹄子你忘了还在昏迷中的本宫了吗,0.539606,0.460394,0.207878,1
2025,朕盒饭已经给你热好了,0.47456,0.52544,0.491201,1
2025,她是幸福的能死在皇上怀里,0.743454,0.256546,0.429898,2
2026,她现在都没有喊疼，这本是多么娇弱的身体,0.511573,0.488427,0.768544,1
2026,大猪蹄子大猪蹄子,0.678312,0.321688,0.285138,2
2026,其实贵妃对皇上的爱是单纯执着的,0.772738,0.227263,0.494972,2
2026,朕盒饭已经给你热好了,0.47456,0.52544,0.491201,1
2025,别抱这么紧老娘背疼,0.331806,0.668194,0.262654,0
2026,她是幸福的能死在皇上怀里,0.743454,0.256546,0.429898,2
2026,盒饭快给我热好本宫马上到,0.715739,0.284261,0.368308,2
2027,其实宁馨儿自己没主动动过害人的心思只怪身边小人太多,0.29833,0.70167,0.337044,0
2027,说高贵妃好的人是什么心态,0.544367,0.455633,0.112653,1
2027,来不及啦我盒饭都热好了,0.745898,0.254102,0.435328,2
2027,别死啊还想看可爱的高贵妃,0.616582,0.383418,0.14796,2
2027,大猪蹄子我还没醒呢,0.583272,0.416728,0.0739369,2
2028,好白好整齐的牙齿,0.849228,0.150772,0.66495,2
2027,她现在都没有喊疼，这本是多么娇弱的身体,0.511573,0.488427,0.768544,1
2028,高贵妃你的盒饭已热好,0.526015,0.473985,0.479702,1
2028,看了这么久被一句你那么可就是不爱我看哭了,0.297768,0.702232,0.338293,0
2028,皇宫里每个女人都活的不容易,0.733774,0.266226,0.408387,2
2029,嘤嘤嘤大猪蹄子再见了本可爱先去领盒饭了,0.792073,0.207926,0.537941,2
2028,盒饭好了没，本宫要杀青领盒饭了,0.343836,0.656164,0.235919,0
2029,高贵妃推皇后也是舒贵人的注意，高贵妃是挺单纯的,0.775428,0.224572,0.500952,2
2029,大猪蹄子给我憋回去别为了这娘们哭,0.520871,0.479129,0.58259,1
2029,你个大猪蹄子把我都忘到脑后了哼不开心☹️,0.379067,0.620933,0.15763,0
2029,真的很喜欢好贵妃最单纯,0.8811,0.1189,0.735778,2
2029,大猪蹄子你忘记谁杀了你的皇后和孩子吗,0.463951,0.536049,0.279011,1
2030,说高可爱是最单纯的你怕是忘了谁把皇后推下去的,0.730767,0.269233,0.401704,2
2030,一直没哭，给高可爱弄哭了可还行,0.729328,0.270672,0.398508,2
2030,本宫盒饭热好没还有多少台词啊,0.490953,0.509047,0.819052,1
2030,皇上大猪蹄子，为什么不去看皇后,0.369881,0.630119,0.178042,0
2030,本宫爱的最痴情,0.765657,0.234342,0.479239,2
2030,她只爱他，争宠只是想让他在乎、注意，高贵妃！呜呜,0.508012,0.491988,0.839752,1
2031,高贵妃倔强的可爱，让人心疼！,0.804961,0.195039,0.566581,2
