1,高贵妃这不是红衣服就是绿衣服啊还特爱这件绿衣服,0.510516,0.489484,0.789689,1
1,杨雨盟。你看到这里没有,0.284318,0.715682,0.368182,0
1,有识别度的美才叫美佘诗曼的长相识别度很高,0.851476,0.148524,0.669947,2
1,为什么一个个都争着先走一步,0.429413,0.570587,0.0457487,0
1,说纯妃是纯元的是文盲吧，历史上纯元没有这个人,0.631236,0.368764,0.180525,2
2,璎珞长得真有气质。高贵脸,0.427556,0.572444,0.0498749,0
1,哈哈哈哈该我出场了,0.6575,0.3425,0.238888,2
2,我一晚上看了九集,0.439404,0.560596,0.0235462,0
3,高贵妃那个演了呢？,0.582061,0.417939,0.0712468,2
3,额娘，不是我不救弟弟，是弟弟自作孽不可活,0.356264,0.643736,0.208301,0
2,每次都不想错过片头,0.685023,0.314977,0.300052,2
5,喜欢吴谨言,0.887169,0.11283,0.749265,2
9,片尾曲为啥不能看,0.29822,0.70178,0.337289,0
4,贵妃的声音就和动画片配音一样,0.471516,0.528484,0.430313,1
9,皇后娘娘驾到,0.538024,0.461976,0.239525,1
9,我喜欢皇后,0.831847,0.168153,0.626326,2
10,好一个白发人送黑发,0.568178,0.431822,0.0403954,2
13,2倍速了解一下,0.527277,0.472723,0.454467,1
13,有为珍珠而来的吗,0.370203,0.629797,0.177326,0
10,总有一种在看还珠格格前传的感觉,0.708985,0.291015,0.353301,2
14,喜欢大猪蹄子,0.878198,0.121802,0.72933,2
16,白天晚上看要疯了,0.512232,0.487768,0.755356,1
19,为帝后这对cp而来,0.539027,0.460973,0.219462,1
16,一起看大剧,0.576522,0.423478,0.0589383,2
21,幸亏没活在后宫，不然我可能刚出场就被毙了,0.255842,0.744158,0.431463,0
22,演的还是没有本宫好,0.507101,0.492899,0.857974,1
24,这部剧衣服首饰比较符合历史原貌,0.801975,0.198025,0.559944,2
24,一口气追9集了,0.768333,0.231667,0.485185,2
25,片头好爱啊,0.870477,0.129523,0.712171,2
27,佘诗曼真的老了，哎,0.206318,0.793682,0.541516,0
30,我通宵看了十集,0.513251,0.48675,0.734989,1
28,高贵妃，我劝你善良,0.297414,0.702586,0.33908,0
24,唯一一部不想跳过片头的剧,0.262916,0.737084,0.415741,0
34,实话，这剧的服装头饰都很贴切历史啊,0.692592,0.307408,0.316872,2
36,快快更新啊,0.564012,0.435988,0.0311373,2
37,喜欢片头曲,0.871073,0.128927,0.713496,2
34,这一世皇后救了五阿哥，下一世嫁给他为他生孩子😉,0.623015,0.376985,0.162256,2
34,为啥只能看片段啊,0.322844,0.677156,0.282569,0
38,片头于妈真用心了,0.508486,0.491514,0.830287,1
32,有喜欢玛瑙的吗,0.790098,0.209902,0.53355,2
39,从打酱油到迷剧,0.718304,0.281696,0.374008,2
39,怎么调倍速啊？,0.37768,0.62232,0.160711,0
42,皇后最美美美,0.785379,0.214621,0.523064,2
40,这部剧的着装造型，还有拍摄场地真的很考究，,0.851362,0.148638,0.669694,2
41,睡到早上七点了饿了,0.381804,0.618196,0.151548,0
41,为什么要跳过片头呢,0.47115,0.52885,0.422998,1
42,皇后娘娘啊,0.584872,0.415128,0.0774939,2
43,歌是真的好听,0.486782,0.513218,0.735647,1
43,装扮很贴切历史,0.775724,0.224276,0.501609,2
44,很美的画面,0.87102,0.12898,0.713377,2
43,熬夜看了，现在又继续,0.646198,0.353802,0.213774,2
45,片头厉害了,0.342258,0.657742,0.239427,0
43,本宫又来追剧了,0.513816,0.486184,0.723686,1
46,第一次追于正的剧这么积极,0.617738,0.382262,0.150529,2
47,于正这剧拍得不错，演员也选的好,0.90895,0.0910502,0.797666,2
47,我真在看，我妈看一眼吓一跳，说，这不跟清朝鬼一样吗,0.10497,0.89503,0.766734,0
48,这部剧很精致啊,0.856111,0.14389,0.680246,2
48,这剧的服装和宫锁沉香是一样的,0.524965,0.475036,0.500709,1
46,感觉我好厉害，又来看一次,0.580385,0.419615,0.0675225,2
49,背景音乐很好听,0.655309,0.344691,0.23402,2
49,从扶摇来的,0.704653,0.295347,0.343673,2
51,这剧挺不错的,0.846322,0.153678,0.658493,2
51,大概都略过开头片尾曲了吧,0.47136,0.52864,0.427208,1
50,皇后太温柔,0.355522,0.644478,0.20995,0
54,我看起来是要凉凉领盒饭了，,0.19643,0.80357,0.563488,0
55,我知道大男人连续追剧10集了,0.590015,0.409985,0.0889227,2
48,皇后人美又温柔,0.702551,0.297449,0.339002,2
49,唯一一部不想跳过片头的剧,0.262916,0.737084,0.415741,0
55,都是直接跳过吧,0.410945,0.589055,0.0867895,0
56,片头是真美！,0.565787,0.434213,0.0350822,2
56,都是直接跳过片头片尾头一次看片头,0.450043,0.549957,0.000857711,1
57,挺喜欢这个音乐🎵,0.869397,0.130603,0.709771,2
58,皇后看起来病殃殃的,0.618283,0.381717,0.151741,2
57,二次追剧中,0.535937,0.464063,0.281252,1
58,富贵那个是搞笑的嘛23333,0.401493,0.598507,0.107794,0
59,服饰化妆都很贴切历史,0.835459,0.164541,0.634354,2
59,永远不跳过片头,0.222374,0.777626,0.505836,0
52,诗曼前10集都没半个小时的戏份,0.453091,0.546909,0.0618261,1
60,珍珠还不至于让我们专程来看这个剧,0.364217,0.635783,0.19063,0
61,秦岚是真的美呀~,0.697226,0.302774,0.327169,2
61,领衔主演后只能跟一个演员的名字，这一长串是个啥意思,0.105656,0.894344,0.76521,0
61,这部剧真的算良心国产了,0.352923,0.647077,0.215726,0
61,我什么时候出场,0.532365,0.467635,0.352691,1
64,为啥没嫁给富恒！,0.343441,0.656559,0.236797,0
65,感觉这是于正最好的一部戏,0.73722,0.26278,0.416044,2
65,朕又来追剧了,0.634751,0.365249,0.188335,2
65,容嬷嬷，快扶着本宫,0.750032,0.249968,0.444516,2
66,尤其是傅恒蠢的,0.630952,0.369048,0.179893,2
69,看到远山眉就觉得不错,0.834327,0.165673,0.631838,2
69,为佘诗曼来，童年女神,0.675427,0.324573,0.278726,2
70,为了这个我花了六块,0.409122,0.590878,0.0908395,0
72,觉得片头曲超美啊,0.829417,0.170583,0.620927,2
73,刚进宫的于妈已经死了，现在是钮钴禄于妈,0.33175,0.66825,0.262778,0
74,是不是根据阿锁的小说改的,0.502907,0.497093,0.94187,1
74,刚进宫的于妈已经死了，现在是钮钴禄于妈,0.33175,0.66825,0.262778,0
74,太喜欢这段了,0.477528,0.522472,0.550566,1
75,跳过可惜了,0.599738,0.400262,0.110529,2
75,服饰用心了,0.68007,0.31993,0.289043,2
71,每个画面截图都是一副优美的宫廷古典画,0.814128,0.185872,0.586951,2
70,啥？于正的剧？不看了~,0.43102,0.56898,0.0421777,0
76,我准备傅恒结过婚就不看了,0.415951,0.58405,0.0756657,0
79,一口气，真的挺不错的，蛮有意思的,0.964681,0.0353191,0.921513,2
79,喜欢佘诗曼,0.870501,0.129499,0.712223,2
79,你咋不说生了福满多？,0.106774,0.893226,0.762725,0
79,好凄凉的感觉,0.734564,0.265436,0.410143,2
80,天呐，这片头我给满分，美呆!,0.899856,0.100144,0.777457,2
78,这段戏曲不会是高贵妃谭卓唱的吧,0.329628,0.670372,0.267494,0
81,突然觉得有点虐，觉得付恒和璎珞很配，确不能在一起,0.291347,0.708653,0.352562,0
81,这是昆调啊,0.480682,0.519318,0.613636,1
82,这调调还挺好听的,0.71471,0.28529,0.366022,2
83,为了这个剧用了6块钱,0.429225,0.570775,0.0461663,0
83,可怜的富恒和璎珞,0.228641,0.771359,0.491909,0
85,片头曲好听,0.590813,0.409187,0.0906951,2
84,和傅恒在一起多好，怎么当贵妃了呢,0.393214,0.606786,0.126192,0
85,我花了十五块,0.404533,0.595467,0.101038,0
86,长的好像陈晓,0.574061,0.425939,0.0534696,2
86,片头很美啊，有味道,0.875495,0.124505,0.723322,2
86,只有我看了这么久还没记住人吗😂😂,0.217149,0.782851,0.517447,0
87,，你们家里都有矿,0.604488,0.395512,0.121083,2
87,我花了15块,0.417308,0.582692,0.0726495,0
89,这剧不是于正的。。,0.214317,0.785683,0.52374,0
89,于妈这个剧是力作啊,0.498631,0.501369,0.972617,1
91,和皇上怎么勾搭上的,0.470055,0.529945,0.401105,1
85,还是那么美、,0.388094,0.611906,0.137568,0
92,这个有点吓人,0.189741,0.810259,0.578353,0
92,是生了福尔康😂️,0.523157,0.476843,0.536868,1
94,真的，都不太敢相信这是于正的剧,0.195906,0.804094,0.564654,0
96,和富贵在一起多好,0.565328,0.434672,0.0340618,2
96,片头曲感觉要看鬼片啦,0.602477,0.397523,0.116615,2
96,为了这剧，我花了一块钱……😍😍😍,0.38104,0.61896,0.153245,0
96,大晚上听这个歌有点吓人,0.355839,0.644162,0.209248,0
96,片头很用心,0.797764,0.202236,0.550587,2
99,为啥一听片头就起鸡皮疙瘩,0.428856,0.571144,0.0469863,0
96,想不通这有什么吓人的？不就是戏曲吗？戏曲很吓人吗？,0.0513777,0.948622,0.885827,0
99,这什么时候更新啊？？？,0.523325,0.476675,0.533495,1
99,这片头曲怎么感觉瘆的慌,0.383936,0.616064,0.14681,0
100,就为佘诗曼来的,0.677569,0.322431,0.283486,2
100,不看的不看呢,0.550855,0.449145,0.00189967,2
100,为了看这部剧，我花了6元,0.435288,0.564712,0.0326926,0
101,这部剧的服装有水准,0.479864,0.520136,0.597288,1
101,片头有木有是高贵妃的万紫千红,0.530918,0.469082,0.381639,1
101,就不能好好唱吗,0.313786,0.686214,0.302697,0
102,害怕的都看过山村老尸吧,0.598138,0.401862,0.106974,2
102,其实说实话，上次怪她的不是她娘嘛,0.116649,0.883351,0.74078,0
102,我现在都没分清楚这个妃那个妃的,0.526141,0.473859,0.477176,1
102,你头发白了吗😊,0.244827,0.755173,0.45594,0
102,我花了6元,0.4802,0.5198,0.603998,1
103,后v更好的快感吧,0.533286,0.466714,0.334289,1
103,太帅了没办法,0.539701,0.460299,0.205979,1
103,老牌皇后什么角色都可以驾驭,0.802991,0.197009,0.562202,2
104,慈母多败儿,0.609399,0.390601,0.131999,2
104,你根本没白发,0.147639,0.852361,0.671914,0
103,说白了还是心疼儿子,0.363702,0.636298,0.191773,0
103,我怎么这么懦弱，拿不起皇后的角色🎭,0.297271,0.702729,0.339397,0
103,爸比你会唱小星星吗,0.503469,0.496531,0.930629,1
104,我怎么这么没精神啊,0.262957,0.737043,0.415651,0
104,还好意思让女儿求晴不要又害了女儿,0.127057,0.872943,0.717652,0
104,重男轻女😏领盒饭🍱去吧,0.355418,0.644582,0.210182,0
104,大娘，你头还没白呢,0.289958,0.710042,0.355649,0
105,慈母多败儿,0.609399,0.390601,0.131999,2
105,女儿就不重要？看不起这种父母,0.444441,0.555559,0.0123542,0
105,耳朵好疼😭,0.690099,0.309901,0.31133,2
105,皓镧传马上出来啦开心,0.693485,0.306515,0.318855,2
105,娴妃果然长的跟她妈一样,0.550479,0.449521,0.00106414,2
105,主角光环咋滴咧,0.466981,0.533019,0.339623,1
106,头发没有白,0.381826,0.618174,0.151497,0
106,港普特别好听,0.649654,0.350346,0.221454,2
106,一看到佘诗曼的画面就觉得当时剧面质量好，感觉是好剧,0.507599,0.492402,0.84803,1
106,总有几个拖后腿的,0.656107,0.343893,0.235793,2
107,片头多好听啊,0.672052,0.327948,0.271227,2
106,纯妃是好的吗,0.651338,0.348662,0.225195,2
106,你头发一点都不白,0.454066,0.545934,0.081324,1
107,没满门抄家就不错了,0.720381,0.279619,0.378625,2
107,容嬷嬷也有年轻的时候啊,0.651956,0.348044,0.226568,2
107,一看到佘诗曼的画面就觉得当时剧面质量好，感觉是好剧,0.507599,0.492402,0.84803,1
108,我说娴妃那么眼熟，原来她是三好啊,0.465097,0.534903,0.301942,1
107,额，你还是黑头发！！！没事，你还有女儿我！,0.441096,0.558904,0.0197873,0
107,演技都很不错耶,0.921096,0.0789041,0.824657,2
108,黑发演的好,0.777659,0.222341,0.50591,2
108,本来抱着打发时间的想法没想到根本停不下来,0.301973,0.698027,0.328949,0
108,有木有想我啊,0.525093,0.474907,0.498148,1
108,头发还没白呢,0.476114,0.523886,0.522277,1
108,该我上场表演了,0.491751,0.508249,0.835011,1
109,我什么时候领盒饭,0.440381,0.559619,0.0213763,0
109,呵呵我少年白都比你白勞資白发送你盒饭可要？,0.542338,0.457662,0.153241,1
109,刚开始看呃呃呃,0.332249,0.667751,0.261669,0
109,加油，小伙伴,0.592194,0.407806,0.0937638,2
110,下班回来看剧，好激动😁😁😁,0.801791,0.198209,0.559535,2
109,你头发不是还没白吗,0.0595456,0.940454,0.867676,0
110,那个时候就是儿子金贵呀,0.70004,0.29996,0.333423,2
109,女儿如果有了儿子以后说不定呢，现在拿女儿就儿子儿子又不一定回得来,0.54795,0.45205,0.0409913,1
110,我太机灵了,0.227519,0.772481,0.494402,0
111,这剧随意的地方太多了不要思考看个乐子吧,0.426616,0.573384,0.0519653,0
110,这外戚怎么可以这么随意出入宫？你难到不为你女儿想想？！我去。。。慈母多败儿,0.295407,0.704593,0.34354,0
110,剧情和服装不错，其他的就别鼓吹了,0.685278,0.314722,0.300618,2
111,她头发哪里白了,0.376047,0.623953,0.164341,0
111,佘诗曼法令纹好深,0.75404,0.24596,0.453423,2
111,我只爱皇上,0.646349,0.353651,0.214109,2
110,看到额娘，真想去看一遍还珠格格,0.42793,0.57207,0.0490455,0
112,说头发没白的你是魔鬼吗,0.229124,0.770877,0.490837,0
111,我怎么还不动手呐,0.264354,0.735646,0.412547,0
112,娴妃娘演的很好,0.883522,0.116478,0.74116,2
112,你们这些历史学得好的还怎么看剧啊😂,0.444362,0.555638,0.0125286,0
112,额娘啊你可是乾隆下一任皇后啊！,0.570013,0.429987,0.0444741,2
111,慈母多败儿，严师出高徒。,0.58218,0.41782,0.0715107,2
112,额娘，你头发没白呀！,0.323646,0.676354,0.280786,0
112,怎么说呢，只能说是，长大之后，我就成了你,0.188133,0.811867,0.581926,0
113,没用的，这次逃了还有下次，还是便当了好,0.635134,0.364866,0.189186,2
113,额娘，您发还没白呢，什么叫白发人送黑发人啊,0.337301,0.662699,0.250442,0
113,把牙刷了再来演戏好吧，这额娘牙也太黄了,0.26399,0.73601,0.413357,0
113,我就是钢铁大直男,0.558398,0.441602,0.0186612,2
114,呵呵呵，原来儿子比丈夫更重要呢？,0.725066,0.274934,0.389035,2
114,每一个单纯的人黑化都变成大佬,0.510146,0.489854,0.79707,1
113,就一个儿子？你有几个女儿呢？儿子是人女儿不是人？,0.458922,0.541078,0.178446,1
114,你才是真正的皇后啊，比另妃还牛呢，还有容嚒嚒呢,0.792766,0.207234,0.53948,2
113,他弟弟在历史上是好的，有战功,0.820602,0.179398,0.601339,2
114,你头发没白,0.283582,0.716418,0.369817,0
114,就是延禧攻略这个名字才有兴趣看,0.707314,0.292686,0.349588,2
115,一起去吧多说无益,0.66979,0.33021,0.2662,2
115,胡说，这明明是黑发人送黑发人,0.256697,0.743303,0.429561,0
115,佘诗曼演技真好,0.789318,0.210682,0.531817,2
115,你们女人都是大猪蹄子,0.413005,0.586994,0.0822099,0
115,不是不能让黑发人送白发人么，说反了,0.0927176,0.907282,0.793961,0
114,我劝你们善良,0.203694,0.796306,0.547348,0
116,这要是我妈，我妈会说做人要有担当，不会让我帮弟弟,0.201527,0.798473,0.552163,0
116,满人的齐头怎么这么简单…,0.431802,0.568198,0.0404398,0
115,今天没我戏,0.404027,0.595973,0.102162,0
116,不能为难娴妃现在就把那些人全斩了,0.21702,0.78298,0.517733,0
116,佘诗曼皮肤太好了！,0.855055,0.144945,0.6779,2
116,耳环把耳朵都夹红了,0.523888,0.476113,0.52225,1
116,杜比和普通有什么区别，我怎么听不出来,0.134252,0.865748,0.701663,0
117,这额娘真不让人省心，重男轻女,0.376634,0.623366,0.163036,0
117,纯飞不简单啊看第九集标题,0.392884,0.607116,0.126925,0
117,好了，闲妃快了,0.774447,0.225553,0.498772,2
117,这个妈是还珠格格里面的皇后吧,0.396499,0.603501,0.118891,0
117,道德绑架啊大姐,0.49163,0.50837,0.832609,1
117,不明白看就看吧，说这个怎样那个怎样、自己是有多好？,0.0549413,0.945059,0.877908,0
118,谨言慎行就是忘了生了个不争气的儿子,0.714059,0.285941,0.364575,2
118,呵呵，原来你这么看中儿子比丈夫都重要,0.652614,0.347386,0.228031,2
118,一看标题就觉得不简单,0.187083,0.812917,0.58426,0
118,佘诗曼演的不错,0.886356,0.113644,0.747457,2
118,生活中也有很多坑姐姐的弟弟借钱不还,0.712868,0.287132,0.36193,2
119,容嬷嬷，让她们知道点厉害,0.342148,0.657852,0.23967,0
118,你头发还没白,0.289581,0.710419,0.356488,0
119,我怎么这么帅,0.521169,0.478831,0.576618,1
119,皇后娘娘能不能留点眼泪,0.35205,0.64795,0.217666,0
119,我妈头发白吗？,0.241894,0.758106,0.462457,0
120,典型港剧背景音乐,0.48931,0.51069,0.786207,1
120,朕是公正无私的,0.60081,0.39919,0.11291,2
120,下任皇后就是本宫！当然要小心啦,0.675995,0.324005,0.279988,2
120,后宫的妃子不得参朕，把本王的话都不放在眼里吗,0.188279,0.811721,0.581603,0
121,这种亲弟弟救了也是白救,0.422821,0.577179,0.0603982,0
120,佘诗曼比你们好，键盘侠,0.60864,0.39136,0.130312,2
120,就儿子重要女儿就不重要么,0.609379,0.390621,0.131953,2
121,皇后娘娘吉祥,0.548913,0.451087,0.0217366,1
121,大蕉蕉我来惹，对你爱爱爱不完👋,0.822321,0.177679,0.605157,2
121,不听不听王八念经,0.470377,0.529622,0.40755,1
121,还是老人演的好,0.622362,0.377638,0.160804,2
121,就儿子重要女儿就不重要么,0.609379,0.390621,0.131953,2
122,以为儿子比女儿重要，如果你的弟弟要死，你i救不救,0.497871,0.502129,0.957413,1
119,本宫何时出场,0.517583,0.482417,0.648334,1
122,你是白发人吗？一头的黑头发，还白发人送黑发人,0.355847,0.644153,0.209228,0
122,分不清这些痱子叫啥咋办啊？,0.345667,0.654333,0.231852,0
122,这宫廷剧好随意啊哈哈,0.931253,0.0687467,0.84723,2
122,吕文凯你个大猪蹄子,0.457876,0.542124,0.157522,1
122,你好像还是黑发吧！,0.311992,0.688008,0.306684,0
123,头发还没白呢,0.476114,0.523886,0.522277,1
123,慈母多败儿,0.609399,0.390601,0.131999,2
123,我啥时候领盒饭,0.379788,0.620212,0.156027,0
123,都有酒窝不错,0.916625,0.0833754,0.814721,2
124,这个娴妃也是够了自己亲弟弟为了丈夫为难就不管,0.756982,0.243017,0.459961,2
123,朕的皇后。今晚的牌纸就你了,0.559993,0.440007,0.0222062,2
124,许凯你个大猪蹄子,0.457876,0.542124,0.157522,1
123,这么多女人，还是佘诗曼有范，演技派啊,0.544578,0.455422,0.108436,1
124,皇后娘娘，使不得使不得，我这就去找小燕子和紫薇帮忙,0.637202,0.362798,0.193783,2
124,我劝你善良,0.221201,0.778799,0.508442,0
125,人老是正常有什么奇怪的啊,0.327847,0.672153,0.271451,0
125,自做孽不可活,0.403686,0.596314,0.10292,0
125,你说去就去那我不就很没面子啰,0.208517,0.791483,0.53663,0
125,本宫当上皇后以后跟额娘长得可是一模一样,0.409918,0.590082,0.0890709,0
124,这让我很为难,0.67694,0.32306,0.282088,2
125,哪里有白发嗯……头皮是挺白的,0.612416,0.387584,0.138702,2
125,我觉得不能救,0.322874,0.677126,0.282501,0
126,看了这么多清宫剧，第一次知道一耳三钳,0.566134,0.433866,0.0358537,2
126,我怎么了亲,0.525991,0.474009,0.480189,1
124,这个名字很好啊，难道你对宫锁乾隆更敢兴趣,0.769807,0.230193,0.488459,2
126,最烦这种出事来找女儿，没事在家宠儿子的人，神烦,0.317774,0.682226,0.293835,0
126,娴妃太清高了害了自己的家人,0.563226,0.436774,0.0293914,2
126,来来来，我再派个盒饭，谁领？,0.22262,0.77738,0.505289,0
126,今晚翻在座各位小姐姐的牌子,0.407417,0.592583,0.0946281,0
127,这可是亲弟的性命，还不肯就太伪善了,0.153353,0.846646,0.659214,0
127,杜比是什么,0.4167,0.5833,0.0739992,0
127,这不是还珠格格里面的那个老妖婆吗好像是皇后吧,0.132317,0.867683,0.705963,0
127,Hello迷谁dj这节奏不要停,0.36301,0.63699,0.193312,0
127,每次到佘诗曼这里都有金枝玉孽的感觉,0.847684,0.152316,0.66152,2
127,我只爱皇上,0.646349,0.353651,0.214109,2
128,那儿白了你就告诉我那儿白了,0.255323,0.744677,0.432616,0
128,居然没有小剧场，这点特别好,0.619328,0.380672,0.154062,2
128,一看就不是亲的,0.179444,0.820556,0.601235,0
128,话别这么多,0.497273,0.502727,0.94546,1
128,连皇上都敢顶撞，你是不是不想活了?,0.0637028,0.936297,0.858438,0
128,这标题不错,0.838933,0.161067,0.642074,2
129,我以为旁边是宫女感觉都长一样分不清了都,0.284611,0.715389,0.367531,0
129,慈母多败儿我不能这么做,0.347648,0.652352,0.227448,0
129,容麼麽你居然敢怂恿朕的妃嫔来为你儿子求情你可知罪！,0.194271,0.805729,0.568287,0
129,这才是真正的皇后娘娘，却来演个娴妃的母亲,0.583787,0.416213,0.0750822,2
129,港真，这部剧火，还真不是主角多牛。是这些配角都很牛,0.414781,0.585219,0.0782646,0
129,额娘一出来我就串戏了哈哈,0.811272,0.188728,0.580604,2
130,感觉旁边的宫女好紧张,0.648436,0.351565,0.218746,2
130,闲妃和妈妈其实是姐妹吧,0.496665,0.503335,0.933292,1
130,这剧里面娘娘还没丫头厉害,0.278599,0.721402,0.380892,0
131,看这题目，一直好奇纯妃是个什么样的人设,0.458189,0.541811,0.163776,1
130,璎珞这丫头深得我心,0.606217,0.393783,0.124927,2
130,佘诗曼演的是乾隆的第二个皇后能不能有个明白人,0.480947,0.519053,0.618942,1
131,醒醒吧樊胜美她妈也是这么说的,0.486683,0.513317,0.733663,1
130,本宫本来就有些失宠现在又要去恳求皇上还能活着吗,0.361849,0.638151,0.195892,0
131,皇后娘娘吉祥,0.548913,0.451087,0.0217366,1
131,别想了跪下求朕。朕也绝不轻饶,0.387912,0.612088,0.137973,0
131,杜比声音大,0.342255,0.657745,0.239433,0
132,历史上的愉妃活了七十多岁,0.718448,0.281552,0.374328,2
132,母亲的耳朵眼好红啊刚打的吧,0.684904,0.315096,0.299787,2
131,都睡觉去吧，身体重要,0.680069,0.319931,0.289042,2
132,准了，去求情吧，好人都变坏了,0.704044,0.295956,0.342321,2
132,本宫甚是欣慰,0.427481,0.572519,0.0500429,0
133,佘诗曼法令纹好重啊,0.576572,0.423428,0.0590478,2
132,这基因强大的，还珠的皇后啊,0.759132,0.240868,0.464738,2
133,一个成功男人的背后都有一个不争气的小舅子,0.743562,0.256438,0.430139,2
132,醒醒吧樊胜美她妈也是这么说的,0.486683,0.513317,0.733663,1
133,皇后娘娘耳朵都扎红了,0.514031,0.485969,0.719375,1
133,配音好耳熟,0.709132,0.290868,0.353627,2
133,额娘！做人嘛，最重要的就是开心咯,0.755274,0.244726,0.456165,2
133,我才发现高贵妃在片尾曲真的唱了出戏啊哈哈哈,0.576609,0.423391,0.0591306,2
134,四十几岁的颜这样很好了，和以前差不多，有的人酸什么,0.71512,0.28488,0.366933,2
134,只有我觉得高贵妃可爱么,0.665631,0.334369,0.256958,2
134,哈哈我还想多活几集,0.878284,0.121716,0.72952,2
134,大猪蹄子你先起来,0.666146,0.333854,0.258103,2
134,明明是黑发，还没白，骗人,0.0435987,0.956401,0.903114,0
135,没白没白还年轻,0.230923,0.769077,0.486837,0
134,余诗曼人中太长。法令纹太深,0.186534,0.813466,0.58548,0
135,头发哪里白了,0.368438,0.631562,0.181248,0
135,杜比的声大，隔壁都能听见,0.353027,0.646973,0.215495,0
135,怪不得眼熟原来丫鬟月月演的,0.408261,0.591739,0.0927522,0
136,佘，长得确实一般，但是辨识度很高，保养的很好,0.828281,0.171718,0.618403,2
135,为何让我去给弟弟求情，你为何不去？,0.149292,0.850709,0.668241,0
135,妈你头发还不白，不能说白发人送黑发人。,0.29401,0.70599,0.346645,0
136,这妃子看的比皇上大好多,0.577473,0.422527,0.0610513,2
136,你头发又没有白,0.327052,0.672948,0.273217,0
136,这母亲好眼熟啊,0.673287,0.326713,0.273971,2
136,求朕也没有用没准还会打入冷宫,0.7037,0.2963,0.341556,2
137,额娘你头发是白的么？是本宫色盲了？,0.278612,0.721388,0.380863,0
137,而且自己的亲弟弟出事了，肯定要想办法救啊,0.540234,0.459766,0.195321,1
137,佘诗曼的配音一直就是这个吗好耳熟,0.620489,0.379511,0.156642,2
137,多跟本宫学学,0.492019,0.50798,0.84039,1
137,慈母多败儿，这真的是千古不变的道理啊,0.614469,0.385531,0.143264,2
137,我真是个小机灵鬼,0.361475,0.638525,0.196723,0
138,那你是想送了女儿的命吗以后你家还想活吗,0.166744,0.833256,0.629457,0
138,说佘诗曼法令纹深的怎么想的？你40你能保养成这样？,0.200894,0.799106,0.553569,0
138,脸变的真快刚刚还跪着,0.466275,0.533725,0.325507,1
138,这么多年过去了，当年的皇后还是那么年轻,0.679829,0.320171,0.28851,2
138,你先白了发再说,0.325179,0.674821,0.277381,0
138,我看自己越看越顺眼,0.567187,0.432813,0.0381924,2
139,佘诗曼鼻子再秀气点就好了,0.302587,0.697413,0.327585,0
139,可闲妃的母亲也是黑发呀,0.559225,0.440775,0.0205,2
139,戴春容就是不演皇后也得演个太后啊，她演的有范~,0.726207,0.273793,0.391572,2
139,典型的为了儿子不顾自己的女儿,0.364811,0.635189,0.189308,0
139,很宽容大度了,0.647523,0.352477,0.216717,2
140,法令纹好深,0.763798,0.236202,0.475107,2
139,果然朕有这么多媳妇也不是什么好事,0.391154,0.608846,0.130769,0
140,这头发也没白好吧,0.360401,0.639599,0.19911,0
140,还珠的皇后戴春容的演技不错,0.88654,0.11346,0.747867,2
140,你头发也没白啊,0.345138,0.654862,0.233026,0
141,我说这个夫人咋这么眼熟原来是皇后,0.424969,0.575031,0.0556254,0
140,所以为什么要特意提没有沾女儿的光？进宫真的是好事？,0.312517,0.687484,0.305519,0
140,娘，你头发还是白的,0.356579,0.643421,0.207603,0
141,喜欢年轻时候的佘诗曼,0.861309,0.138691,0.691797,2
141,你头发没白好吧?,0.183862,0.816138,0.591418,0
141,我最帅我超开心,0.794101,0.205899,0.542446,2
141,你们都想多了,0.458321,0.541679,0.166414,1
141,比胜美的妈妈好很多好吧，，人家是下跪,0.762917,0.237083,0.473149,2
142,额娘你头发没白啊,0.306567,0.693433,0.318741,0
