1,好大的地位啊，居然可以去御药房取药治病,0.773452,0.226548,0.496559,2
1,从她拿鞭子那刻起我就觉得她不简单,0.392703,0.607297,0.127327,0
1,为你痴为你狂为你框框撞大墙我爱皇后嘤嘤嘤,0.945465,0.0545353,0.87881,2
1,哈哈哈尔晴脸都绿了,0.611654,0.388346,0.137009,2
1,香蜜是現在最火的一部電視劇，來一起看,0.799337,0.200663,0.554081,2
1,皇后真是太好啦,0.340321,0.659679,0.24373,0
2,这么多大咖不发话,0.179133,0.820867,0.601926,0
2,那个和亲王真想呼死他,0.267703,0.732297,0.405105,0
2,这帽子真当语,0.306433,0.693566,0.319037,0
3,哈哈哈哈，打不过我吧，没有办法我就是那么强大,0.757654,0.242346,0.461454,2
4,傅恒和璎珞不是一类人，再相爱都有不同的思想,0.319202,0.680798,0.290662,0
3,现在人还没古代好呢,0.737162,0.262838,0.415915,2
4,朕宣布本集开始,0.579836,0.420164,0.0663016,2
4,天啊，最后是娴妃当了皇后,0.534433,0.465567,0.311332,1
9,看到这个标题我就放心了,0.751586,0.248414,0.44797,2
7,片头反复看了好几遍,0.453517,0.546483,0.0703341,1
10,报复来的这么快,0.653727,0.346273,0.230505,2
10,强烈要求每天更新,0.460483,0.539517,0.209667,1
9,今天好久更新,0.627704,0.372296,0.172675,2
10,什么时候更新啊,0.589445,0.410555,0.0876557,2
11,什么破玩意怎么不更了,0.0158497,0.98415,0.964779,0
13,还有说和亲王好的。。。这是有多奴性？,0.685976,0.314024,0.302169,2
13,什么时候能更新好啊,0.730658,0.269342,0.401463,2
15,看片尾看哭了,0.295196,0.704804,0.344009,0
14,天天掐点等更新😂,0.516739,0.483262,0.665229,1
15,为啥还不更新,0.216481,0.783519,0.518932,0
16,还不更新25,0.2857,0.7143,0.365111,0
16,标题很过瘾阿,0.775265,0.224735,0.500589,2
17,片尾好虐。。伤心,0.371974,0.628026,0.173392,0
17,这片头曲特优美,0.660899,0.339101,0.246441,2
20,明天没有更新心疼到不能自已,0.525,0.475,0.499995,1
22,片头曲真不错,0.884436,0.115564,0.74319,2
22,好早啊嘿嘿,0.93894,0.0610604,0.86431,2
18,片尾了解一下解锁新的剧情,0.552425,0.447575,0.00538799,2
22,这个标题可以,0.662586,0.337414,0.250191,2
22,我第三有木有,0.478953,0.521047,0.579059,1
22,一个大男人每天等更新,0.58748,0.41252,0.0832884,2
21,为什么不更,0.148414,0.851586,0.670192,0
23,蹲个点看个剧,0.491145,0.508855,0.822903,1
22,那个能忍的小太监呢？,0.467031,0.532969,0.340627,1
23,我就想问问和亲王最后死了没,0.247527,0.752473,0.449939,0
23,来人，给本宫打他,0.537013,0.462987,0.259743,1
25,这啥没法关,0.197961,0.802039,0.560087,0
26,片头太震撼,0.42722,0.57278,0.0506226,0
26,果然还是有点玛丽苏,0.35561,0.64439,0.209755,0
26,20亿播放量,0.525156,0.474844,0.496875,1
23,啊啊明天晚上就看不了了,0.378136,0.621864,0.159698,0
28,这王爷也不算太坏呀,0.624305,0.375695,0.165121,2
29,希望明天继续更新,0.629884,0.370116,0.177521,2
29,又一個黃子歇,0.553667,0.446332,0.00814994,2
30,看了上一集的片尾才知道，怎么会尔晴嫁给小富了呢,0.428563,0.571437,0.0476372,0
30,一直等更新完了在接着看，可是等不了了,0.198059,0.801941,0.55987,0
31,说实话不喜欢璎珞,0.148232,0.851768,0.670595,0
30,咋不更新呢,0.16729,0.83271,0.628243,0
32,已经过了12點了都不算七夕了,0.404151,0.595849,0.101888,0
33,这片头音乐有点抑郁啊好伤感,0.500993,0.499007,0.980145,1
34,太喜欢这片头了,0.453884,0.546116,0.0776756,1
34,怎么不更新啊,0.176073,0.823927,0.608726,0
34,为什么不更新了啊？,0.160582,0.839418,0.643151,0
37,今晚就要更新了,0.52758,0.472419,0.44839,1
38,上传太慢了,0.0724583,0.927542,0.838982,0
38,大男人是哪个不会是杨貔貅吧哈哈哈哈哈,0.848925,0.151075,0.664279,2
36,新片尾曝光太多亲近的黑化，太虐了，太虐了...,0.146527,0.853473,0.674384,0
38,这个王爷真的丑龅牙,0.27218,0.72782,0.395155,0
38,不算太坏？,0.538358,0.461642,0.232835,1
39,好玛丽苏啊,0.734707,0.265293,0.410459,2
40,总感觉这事没这么简单,0.31144,0.68856,0.307911,0
40,这个小子说得好,0.531833,0.468167,0.363343,1
39,怕是没见过更玛丽苏的,0.354235,0.645765,0.212811,0
40,特别喜欢片头曲,0.901087,0.0989125,0.780194,2
39,卫龙女孩走起,0.568161,0.431839,0.0403574,2
41,片尾那一瞬间看哭,0.418409,0.581591,0.0702017,0
43,都好几天没有更新了,0.383248,0.616752,0.148338,0
39,本来就更得慢，今天还不更了，气,0.0227547,0.977245,0.949434,0
43,难怪这部剧🔥了，真是用心了,0.343192,0.656808,0.237351,0
43,老看到佘诗曼的粉，不知道有多少是真的。。。。烦,0.268884,0.731116,0.40248,0
45,画面感太强了,0.460674,0.539326,0.213484,1
44,这事没到你身上，真会说,0.374195,0.625805,0.168455,0
45,这音乐好好听哦,0.774291,0.225709,0.498425,2
46,璎珞太牛怼不过，溜了溜了。,0.259551,0.740449,0.423219,0
48,片头真的是超棒啊！,0.909168,0.090832,0.798151,2
51,不是一般的慢啊,0.0367375,0.963262,0.918361,0
52,这次主题是什么？,0.594697,0.405303,0.0993261,2
44,这个就是以后容嬷嬷吧,0.467767,0.532233,0.355331,1
53,说可以了的真是没痛在你身上,0.350834,0.649166,0.220369,0
53,主题曲好听,0.597702,0.402298,0.106004,2
54,片头做的好唯美,0.727183,0.272817,0.393741,2
56,片头画面好美啊😄,0.707728,0.292272,0.350507,2
56,几天才更新一集，够了吧,0.605034,0.394966,0.122298,2
55,看到24集就没往下看了，想等更新完再看,0.517362,0.482638,0.652752,1
52,吃辣条等更新,0.591493,0.408507,0.0922061,2
58,多久更新啊,0.385551,0.614449,0.143219,0
32,1
57,每一帧都可以做壁纸，很美,0.922263,0.077737,0.827251,2
61,这标题看着就解气,0.4334,0.5666,0.0368884,0
62,为什么不更新了？？,0.121575,0.878425,0.729833,0
65,王爷做这些完全是施舍,0.335547,0.664453,0.25434,0
63,太喜欢富察皇后了,0.574509,0.425491,0.0544638,2
66,你挺爱钱，为了钱说谎陷害我！,0.511251,0.488749,0.774976,1
67,啥时候更新啊,0.503572,0.496428,0.928555,1
69,魏璎珞长的让人一眼就记住,0.519446,0.480554,0.611075,1
72,切肤之痛怎么可能就这么算了,0.320303,0.679697,0.288216,0
73,为什么两天都还没有更新,0.320412,0.679588,0.287973,0
74,片头感觉有点像鬼片,0.542424,0.457576,0.15151,1
74,张嘉妮什么时候出来啊,0.590805,0.409195,0.0906781,2
69,就是喜欢佘诗曼,0.882239,0.117761,0.73831,2
75,怎么几天都不更新,0.180182,0.819818,0.599597,0
77,这次于妈令我刮目相看,0.671888,0.328112,0.270861,2
80,片头实在太美,0.361532,0.638468,0.196596,0
80,导演温德光！不是于正啊……,0.188629,0.811371,0.580824,0
86,不得不说片头片尾做的好唯美歌也好听,0.601515,0.398485,0.114478,2
85,这一段昆剧好美,0.588095,0.411905,0.0846556,2
80,璎珞太瘦了,0.482804,0.517197,0.656071,1
82,哈哈哈这人好,0.788475,0.211525,0.529944,2
77,怎么不更新啊,0.176073,0.823927,0.608726,0
86,她爹就认钱,0.252865,0.747135,0.438077,0
87,感觉纯妃喜欢和亲王是纯妃杀的姐姐,0.880441,0.119559,0.734313,2
87,开头有点像鬼片呢！,0.64266,0.35734,0.205911,2
89,导演：温德光,0.541897,0.458103,0.162067,1
91,还以为在看红楼梦呢,0.572887,0.427113,0.0508601,2
90,片头曲子叫啥名儿啊,0.517612,0.482388,0.647753,1
90,两倍速有点想笑,0.563525,0.436475,0.0300545,2
92,大猪蹄子是什么东西,0.482309,0.517691,0.646178,1
92,璎珞和皇上在一起了,0.511026,0.488974,0.779476,1
92,明天就更啦,0.697191,0.302809,0.327091,2
95,吗的还不更新,0.201514,0.798486,0.552192,0
99,于妈要翻身了啊～,0.542786,0.457214,0.14429,1
96,片头真的唯美，看了好几遍,0.442524,0.557476,0.0166123,0
101,很红很喜庆,0.848954,0.151046,0.664341,2
102,美牙仪了解下,0.784798,0.215202,0.521773,2
102,一看标题就知道事情没那么简单哈哈,0.683108,0.316892,0.295797,2
102,剧开头的戏就是高贵妃唱的吧,0.636332,0.363668,0.191849,2
102,我什么时候黑化,0.519541,0.480459,0.609175,1
98,这标题令我害怕,0.51141,0.48859,0.771801,1
103,弘昼要是领盒饭就好了,0.316066,0.683933,0.29763,0
103,听这标题好兴奋,0.710066,0.289934,0.355701,2
103,我媳妇为了两家和好，给你热爱心便当去了,0.630067,0.369933,0.177926,2
102,这集不能告诉你陈晶晶继续下一集,0.739003,0.260997,0.420008,2
103,有些话想想就好不要说出来好吗？,0.265675,0.734325,0.409611,0
102,我其实想问一句这次于正水平变这么高了？,0.206003,0.793997,0.542214,0
103,一个亲王能这样已经很不错了,0.825028,0.174972,0.611174,2
103,好了好了这集弘昼可以领盒饭了吧,0.812701,0.187299,0.58378,2
104,真服了这觉得好的人的思路了,0.315075,0.684925,0.299833,0
104,说和亲王好的真不知道什么人,0.327654,0.672346,0.27188,0
104,他爹来宫里只会拖殷洛后腿,0.258973,0.741027,0.424504,0
104,标题看起来很开心,0.798665,0.201335,0.552588,2
104,这主角光环真大,0.336882,0.663118,0.251373,0
104,不是不报时候未到,0.104123,0.895877,0.768616,0
105,兄弟你可长点心，盒饭都冷冻了，等会又拿出来打热了,0.193916,0.806084,0.569074,0
105,我觉得这五王爷能做到这样也是不错了,0.68738,0.31262,0.305289,2
105,一个王爷能这样很不错了，知足吧,0.785855,0.214145,0.524122,2
105,导演把盒饭给我热好,0.566075,0.433925,0.0357213,2
105,可想看两个人撕逼了,0.40991,0.59009,0.0890889,0
106,已经很不错了人家堂堂亲王也肯为你一平民亲自致歉,0.97641,0.0235902,0.947577,2
106,比起那些做事不认账的和亲王算很好了好吧,0.84874,0.151259,0.663868,2
105,这个标题是要领饭盒的节奏啊,0.52544,0.47456,0.491207,1
106,没想到吧报复来的这么快,0.630078,0.369922,0.177952,2
106,兄弟你可长点心，盒饭都冷冻了，等会又拿出来打热了,0.193916,0.806084,0.569074,0
106,导演把盒饭给我热好,0.566075,0.433925,0.0357213,2
106,兄弟，你想的太简单了,0.202996,0.797004,0.548897,0
107,你放心，我媳妇做盒饭很好吃,0.92572,0.0742796,0.834934,2
107,这个标题就很好,0.874036,0.125964,0.720079,2
107,看到标题我就知道璎珞是不会被银子收买的人,0.246623,0.753377,0.451948,0
107,比起那些做事不认账的和亲王算很好了好吧,0.84874,0.151259,0.663868,2
107,和亲王不是好人，但他对大清看的最透，呵呵,0.705511,0.294489,0.345581,2
107,兄弟，你想的太简单了,0.202996,0.797004,0.548897,0
108,程碧蓉多吃点儿一定不能瘦下来加油！,0.578033,0.421967,0.0622952,2
108,看到这标题就好开心,0.597153,0.402847,0.104784,2
108,这个开头是认真的吗每次开始都会被吓一跳,0.783882,0.216118,0.519738,2
108,和亲王不是好人，但他对大清看的最透，呵呵,0.705511,0.294489,0.345581,2
108,大猪蹄子，准备领盒饭,0.589138,0.410862,0.0869736,2
108,这个标题就很好,0.874036,0.125964,0.720079,2
109,标题好激动,0.813804,0.186196,0.586231,2
109,竟然那么多人觉得王爷态度好?他这是为了自己求个心安,0.177341,0.822659,0.605909,0
109,导演该热饭盒了,0.375382,0.624618,0.165818,0
109,原谅他是上帝的事！用尽一切手段送她去见上帝才是正事,0.386688,0.613312,0.140693,0
109,弘昼很疼媳妇好吧，改编都没边了,0.626819,0.373181,0.17071,2
109,大猪蹄子，准备领盒饭,0.589138,0.410862,0.0869736,2
110,弘昼演技很好，我觉得挺可爱，王爷很懂得分寸了已经,0.928931,0.0710688,0.842069,2
110,惊不惊喜，意不意外，报复来的这么快,0.638024,0.361976,0.195609,2
110,你们真是和平生活久了当这是天经地义的了是吧？,0.374909,0.625091,0.166869,0
110,在这种客观条件下这难道不是好的解决办法？,0.0392698,0.96073,0.912734,0
111,璎珞的报复心真不是一般地强啊,0.3235,0.6765,0.281111,0
111,标题令我激动激动。,0.829745,0.170255,0.621656,2
110,竟然那么多人觉得王爷态度好?他这是为了自己求个心安,0.177341,0.822659,0.605909,0
111,恒哥.你胆子挺肥的哈.你一会去领饭盒吧老娘要弄你了,0.465612,0.534388,0.312244,1
110,大猪蹄子，你给我等着这事儿没完,0.575807,0.424193,0.0573483,2
111,标题太好了满足朕的少女心,0.948788,0.0512123,0.886195,2
111,盒饭马上就到，王爷别急,0.420721,0.579279,0.065064,0
111,人家又不是普通丫鬟，是皇后娘娘最喜欢的丫鬟,0.512941,0.487059,0.741179,1
112,好了，弘昼的盒饭热好了,0.751043,0.248957,0.446761,2
112,好单纯好不做作,0.596249,0.403751,0.102775,2
112,多说不宜必自毙,0.773884,0.226116,0.49752,2
112,标题太好了满足朕的少女心,0.948788,0.0512123,0.886195,2
112,感觉这样很好的，可以试试自己的亲女儿姐妹遭遇一下,0.813176,0.186824,0.584835,2
112,亲王的盒饭怎么能随便领，要多几道菜才成,0.215111,0.784889,0.521975,0
113,来人啊弘昼的盒饭热一热啊,0.557329,0.442671,0.0162857,2
113,我会放过你吗？天真，盒饭备好了，等着吃吧,0.494572,0.505428,0.891441,1
113,生活中每个人观点不同，没必要争来争去，过后你们自己,0.3837,0.6163,0.147334,0
113,觉得好的人怕是没自尊,0.490572,0.509428,0.811441,1
113,你们接着说我看戏就好,0.446861,0.55314,0.00697666,0
114,其实和亲王算得上不错的王爷了不争帝位活得更潇洒,0.796445,0.203555,0.547655,2
114,把盒饭给他放微波炉热一热,0.281956,0.718045,0.373432,0
113,惊不惊喜刺不刺激,0.499278,0.500722,0.985554,1
114,说多错多早点领盒饭,0.58153,0.41847,0.0700671,2
114,王爷您的盒饭热好了,0.552672,0.447328,0.00593742,2
114,饭盒热好了该吃了,0.557474,0.442526,0.016609,2
115,这个演樱洛的人面部都没有表情，眼睛无神嘴大,0.268343,0.731657,0.403682,0
114,可是也没别的办法了呀，说了皇上对他不是一般的好,0.206074,0.793926,0.542058,0
115,哎哟标题让朕脑阔疼,0.48587,0.51413,0.717396,1
115,看到标题好开森深得我心,0.696203,0.303797,0.324895,2
115,要我说找个人强了弘昼，让他自己体会一次才是正解,0.802658,0.197342,0.561461,2
115,觉得和亲王好的人适合到古代去，她们的奴性还没消失,0.664423,0.335577,0.254274,2
115,王爷您的盒饭热好了,0.552672,0.447328,0.00593742,2
116,就因为你们觉得很好古代女人白一点地位没有，他是用钱,0.71802,0.28198,0.373377,2
116,璎珞从小没妈唯一一个亲姐姐因为他死了，当然恨特别恨,0.58982,0.41018,0.0884889,2
116,让你多活了一集，这集可以领盒饭啦弘昼,0.675361,0.324639,0.27858,2
116,这标题我很兴奋啊少爷等解决他在跟你算账,0.410511,0.589489,0.0877531,0
116,一个宫女想报复谁报复谁，感觉大清朝是她家的,0.28436,0.71564,0.36809,0
116,看到标题好开森深得我心,0.696203,0.303797,0.324895,2
117,好了好了，我相信你弘昼，你可以去领盒饭了,0.788058,0.211942,0.529017,2
117,我媳妇可厉害了你不要太单纯了,0.118114,0.881886,0.737525,0
117,看这标题我就知道事情不简单了,0.14832,0.85168,0.6704,0
117,大猪蹄子你可长点心吧,0.54528,0.45472,0.0944066,1
117,我觉得在当时像她这样没地位没背景的情况下已经很好了,0.586006,0.413994,0.0800124,2
117,等着你个大猪蹄子呢,0.666332,0.333668,0.258516,2
118,复仇心太重了，王爷完全可以找几个杀手灭他全家,0.287837,0.712163,0.360362,0
118,璎珞的主角光环太强大了，不过看着很过瘾,0.79049,0.20951,0.534423,2
118,能不能把自己代入到古时候去这又不是现代戏古代这个王爷的做法已经很好了好嘛,0.600608,0.399392,0.112461,2
118,兄弟别高兴太早我媳妇套路深,0.746869,0.253131,0.437487,2
118,标题已经给你热好盒饭了和亲王,0.467165,0.532835,0.343295,1
119,这标题让人兴奋，人设太强大，不报仇决不罢休！,0.409661,0.590339,0.0896415,0
118,看这标题我就知道事情不简单了,0.14832,0.85168,0.6704,0
119,老娘要开始打野了，后期要你狗命,0.192375,0.807625,0.572501,0
119,你还是下去跟我姐姐诚恳致歉吧，看她原不原谅你,0.358706,0.641294,0.202876,0
119,璎珞很能忍的，她要下一盘很大的棋了，和亲王跑不了,0.255339,0.744661,0.43258,0
119,弘昼别高兴太早,0.62476,0.37524,0.166132,2
119,兄弟别高兴太早我媳妇套路深,0.746869,0.253131,0.437487,2
120,死于话多，伤人了啊大兄弟，本璎珞生气起来让你领饭盒,0.313456,0.686544,0.30343,0
120,大猪蹄子，你的盒饭热好了,0.574026,0.425974,0.0533917,2
120,那些说知足的人，如果你们是丫鬟被这样了是不是很开心,0.43422,0.56578,0.0350674,0
120,但是嘴上说下本这王爷感觉人还好,0.52457,0.47543,0.508603,1
120,弘昼惊不惊喜意不意外？,0.436797,0.563203,0.0293405,0
121,不要用现代人的人人平等来想这个问题古代皇权至上,0.382352,0.617648,0.15033,0
120,兄弟，你是不是嫌你活的太久了?.,0.139141,0.860859,0.690798,0
121,我媳妇儿要开大了,0.467864,0.532136,0.357276,1
121,已经为你热好盒饭了，等着吧！,0.669945,0.330055,0.266544,2
121,敢问您们的清白在那时候这样草草了事该不会还很庆幸吧,0.117067,0.882933,0.739852,0
121,看了历史弘昼活得挺好的,0.845559,0.154441,0.656799,2
121,兄弟完了你最多活不过两集,0.571429,0.428571,0.0476197,2
122,你别高兴太早。这娘们套路深着呢,0.665327,0.334673,0.256283,2
122,在那个时代能这样已经很不错了，主角光环太强大,0.869252,0.130748,0.709448,2
122,我媳妇儿要开大了,0.467864,0.532136,0.357276,1
123,姐夫你的盒饭热好了,0.454683,0.545317,0.0936526,1
122,真的可以了，人这么大权利分分钟灭族也是一样的,0.586714,0.413286,0.0815867,2
123,好了弘昼领盒饭吧，已经热好了,0.65849,0.34151,0.241088,2
122,多说多错啊孩子,0.701303,0.298697,0.336228,2
122,已经为你热好盒饭了，等着吧！,0.669945,0.330055,0.266544,2
123,傅恒快和璎珞在一起多好,0.70326,0.29674,0.340577,2
123,这么大的王还会向一个宫女道歉有点不合情理,0.652216,0.347784,0.227147,2
123,和亲王的盒饭热一热,0.483706,0.516294,0.674118,1
124,兄弟我看这事儿不可能这么简单你还是悠着点,0.231064,0.768936,0.486524,0
123,您的便当已热好,0.696148,0.303852,0.324774,2
124,王爷的盒饭还没热好么？怎么办事的！,0.249237,0.750763,0.446141,0
124,生命之大，在他们看来，金钱，权利，都可以妥协,0.488037,0.511963,0.760741,1
124,王爷你太单纯了，璎珞是有仇必报滴,0.266258,0.733742,0.408316,0
124,其实他一个王爷能为一个小小宫女做到这一步也难得了,0.712313,0.287687,0.360695,2
125,导演这个大猪蹄子的盒饭热好了吗,0.447708,0.552292,0.00509381,0
124,男人都是大猪蹄子的意思是男人没一个好东西,0.508727,0.491273,0.825459,1
125,让你得意，过会儿让你想哭都哭不得哼,0.23064,0.76936,0.487466,0
125,盒饭已经热好了，快来吃吧,0.672479,0.327521,0.272175,2
125,呵呵，看璎珞王者告诉你们什么叫后退只是为了更好前进,0.435522,0.564478,0.0321734,0
126,太不合实际了，一个宫女拿什么资本跟一个亲王斗,0.0509793,0.949021,0.886713,0
126,弘昼，朕怕是保不了你了，自领盒饭吧，吃好,0.186656,0.813344,0.585209,0
126,强了人道个歉你们就觉得不错了？,0.819675,0.180325,0.599278,2
126,盒饭给你热好了，一会赶紧吃了,0.403959,0.596041,0.102313,0
126,这么轻松就跟仇人面对面了，好意外,0.902926,0.0970743,0.784279,2
125,算了吧对于和亲王来说一个侍妾的名头算不上什么的好,0.198857,0.801143,0.558095,0
126,你成功上本宫为你准备了盒饭,0.607785,0.392215,0.128411,2
125,看我先打个红爸爸再找你算账,0.456749,0.543251,0.134975,1
127,历史上的弘昼也是任性妄为，仗着乾隆惯着他跟历史贴切,0.676964,0.323036,0.282143,2
127,傅恒你看我开心了吗，你个大猪蹄子,0.438226,0.561774,0.0261652,0
127,没办法，古代本就是这样，王爷要个宫女多大点事,0.303448,0.696552,0.32567,0
127,盒饭热好了，我看你还能嘚瑟几分钟,0.591556,0.408444,0.0923476,2
127,太不合实际了，一个宫女拿什么资本跟一个亲王斗,0.0509793,0.949021,0.886713,0
127,张宇曦你要多吃点饭，千万别瘦下来,0.188326,0.811674,0.581497,0
128,突然觉得傅恒和王爷的CP感好足,0.751642,0.248358,0.448093,2
128,玛德居然有点喜欢这个大板牙哥哥了,0.506298,0.493702,0.874035,1
128,我居然觉得这个王爷挺实在，快打醒我,0.413088,0.586912,0.0820261,0
128,一个宫女让那么多高位领盒饭也就主角了,0.306694,0.693306,0.318458,0
128,历史上的弘昼也是任性妄为，仗着乾隆惯着他跟历史贴切,0.676964,0.323036,0.282143,2
129,和亲王你个大猪蹄子,0.473648,0.526352,0.472966,1
129,这集本宫脑阔疼,0.615963,0.384037,0.146585,2
129,古时尊卑观念重以和亲王身份其实这样很不错了,0.703748,0.296252,0.341661,2
129,呵男人，让你见识见识得罪小心眼女人的下场吧,0.150922,0.849078,0.664617,0
129,盒饭热着呢，一会就给你端出来,0.395008,0.604991,0.122203,0
129,麻烦去学学历史吧一个亲王能做到这样不错了,0.765983,0.234017,0.479962,2
128,傅恒如果不管，璎珞会闯出更大的祸,0.495045,0.504955,0.900905,1
130,盒饭给你热好了,0.478221,0.521779,0.564414,1
130,这结果其实已经算不错了，一个亲王愿意这样和解,0.492307,0.507693,0.846139,1
130,这爹跟亲王真都不是个东西！！大猪蹄子,0.0951091,0.904891,0.788646,0
130,可是主角报复心强啊……你得意也…,0.704406,0.295594,0.343124,2
130,和亲王你个大猪蹄子,0.473648,0.526352,0.472966,1
130,弘大牙你等着，这就给你热盒饭,0.311875,0.688125,0.306945,0
131,和亲王，你可知璎珞有多厉害，我劝你善良。,0.20768,0.79232,0.538489,0
131,傅恒你个大猪蹄子璎珞咱们不哭不理他了,0.207662,0.792338,0.538529,0
131,咱们认清现实，清朝的宫女得到这样的补偿不错了好吗,0.684367,0.315633,0.298594,2
131,和亲王你的盒饭热好了!,0.475051,0.524949,0.501029,1
131,别高兴太久,0.341371,0.658629,0.241398,0
132,人已经死了，和亲王给的条件已经够好了,0.596657,0.403343,0.103683,2
132,老爹演技很好啊，眼眶都红了,0.914429,0.0855708,0.809843,2
131,宫女都找这么快，元玥是公主，到最后也只找到个背锅的,0.802942,0.197058,0.562094,2
132,和亲王，你可知璎珞有多厉害，我劝你善良。,0.20768,0.79232,0.538489,0
132,别高兴太久,0.341371,0.658629,0.241398,0
132,宫女能这样已经不错了，在那个年代,0.679437,0.320563,0.287637,2
132,这个标题让朕脑壳疼,0.47456,0.52544,0.491203,1
133,看到这集的标题突然好开心,0.652827,0.347173,0.228504,2
133,这个导火索会活到最后但善恶终有一报劝你善良,0.291976,0.708024,0.351164,0
133,其实结果放在那个时候，已经是很好的结果了，太执着了,0.449919,0.550081,0.000179344,0
133,你怕是想吃盒饭了,0.324467,0.675533,0.278962,0
133,答应你后，你就可以去领盒饭了,0.339859,0.660141,0.244758,0
133,总要为活着的人考虑吧，过刚易折,0.548139,0.451861,0.0372279,1
5,陪读妈妈第十八集,0.619213,0.380787,0.153807,2
134,说王爷做得还不错的这就是你们和主角的区别了,0.481991,0.518009,0.639822,1
134,这标题可真让朕为难,0.440319,0.559681,0.021513,0
134,都是大猪蹄子,0.594916,0.405084,0.0998141,2
134,还是高姿态用钱解决问题,0.257295,0.742705,0.428233,0
134,要是弘昼态度好点就好了,0.315559,0.684441,0.298758,0
135,王爷做的也够给他们面子了正常皇上知道也不会惩罚他,0.32165,0.67835,0.285222,0
135,王爷请抬头看标题,0.515487,0.484513,0.690255,1
135,这个王爷活得真真实现实,0.401894,0.598106,0.106902,0
135,还是高姿态用钱解决问题,0.257295,0.742705,0.428233,0
135,看了标题就知道事情不简单,0.211565,0.788435,0.529855,0
136,呵呵他姐姐如果还活着这亲王能娶她吗,0.508547,0.491453,0.829065,1
136,你回家洗好脖子等着吧,0.479778,0.520222,0.595568,1
135,王爷你抬头，看看标题写的啥,0.413417,0.586583,0.081295,0
136,你呀好聪明,0.70403,0.29597,0.342289,2
136,你要相信导演表妹是最厉害的,0.375443,0.624557,0.165683,0
134,你怕是想吃盒饭了,0.324467,0.675533,0.278962,0
136,放心好了，弘昼造反都没能让他领盒饭。,0.874493,0.125507,0.721096,2
137,你个牙精给我等着，非得叫你牙飘着走不可,0.18029,0.81971,0.599355,0
137,哎呀呀，盒饭热得透透的，王爷开饭啦……,0.438726,0.561274,0.0250532,0
136,王爷请抬头看标题,0.515487,0.484513,0.690255,1
137,要是古代一个仆人的命那么值钱，就不会有仆人了,0.196112,0.803888,0.564197,0
137,这王爷也就算不错不错的了，放到现在都不一定有这样,0.773255,0.226746,0.496121,2
137,于正这剧只是个拉投资的好吗？吹什么呢,0.417973,0.582027,0.071171,0
138,人都死了也没办法啊这么小心眼不会开心的,0.320239,0.67976,0.288357,0
137,呵呵他姐姐如果还活着这亲王能娶她吗,0.508547,0.491453,0.829065,1
138,大猪蹄子，盒饭差不多好了,0.682303,0.317697,0.294006,2
138,王爷真是单纯的认为璎珞会放过他,0.561454,0.438546,0.0254528,2
138,哇好兴奋的标题,0.855894,0.144106,0.679764,2
138,看你还能得意多久,0.347159,0.652841,0.228536,0
139,嘿嘿，魏璎珞的老爹也是个大猪蹄子，还是馊的大猪蹄子,0.793093,0.206907,0.540206,2
139,弘昼你别高兴的太早,0.591672,0.408328,0.092604,2
138,好了弘昼的盒饭可以做了,0.703234,0.296766,0.34052,2
139,任性的恋其他王爷都让三分的王爷能做到这样可以了,0.572368,0.427632,0.0497056,2
